,kind,etag,id.kind,id.videoId,snippet.publishedAt,snippet.channelId,snippet.title,snippet.description,snippet.thumbnails.default.url,snippet.thumbnails.default.width,snippet.thumbnails.default.height,snippet.thumbnails.medium.url,snippet.thumbnails.medium.width,snippet.thumbnails.medium.height,snippet.thumbnails.high.url,snippet.thumbnails.high.width,snippet.thumbnails.high.height,snippet.channelTitle,snippet.liveBroadcastContent,snippet.publishTime
2,youtube#searchResult,xh7heon1VFuN57cVDDnCSjqibuY,youtube#video,m-GOZSi2R_Q,2025-10-03T05:49:18Z,UCX7Y2qWriXpqocG97SFW2OQ,What is Solveit? Showing some recent use cases,"To get access to our next course, which includes access to the Solveit platform, go to: https://solve.it.com/",https://i.ytimg.com/vi/m-GOZSi2R_Q/default.jpg,120,90,https://i.ytimg.com/vi/m-GOZSi2R_Q/mqdefault.jpg,320,180,https://i.ytimg.com/vi/m-GOZSi2R_Q/hqdefault.jpg,480,360,Jeremy Howard,none,2025-10-03T05:49:18Z
3,youtube#searchResult,84g3oOJvf4pu757cn_PFICuGNow,youtube#video,LDklFaxssFE,2025-03-18T19:08:36Z,UCX7Y2qWriXpqocG97SFW2OQ,"Sarah Pan, teenage AI wizard",Sarah has also written a blog post here: https://www.answer.ai/posts/2025-03-17-gpu-programming-scratch.html.,https://i.ytimg.com/vi/LDklFaxssFE/default.jpg,120,90,https://i.ytimg.com/vi/LDklFaxssFE/mqdefault.jpg,320,180,https://i.ytimg.com/vi/LDklFaxssFE/hqdefault.jpg,480,360,Jeremy Howard,none,2025-03-18T19:08:36Z
4,youtube#searchResult,19DpyouQSFf-u2WuDVm6VHVVgfc,youtube#video,EtZ4pEzPMcc,2025-02-11T20:13:34Z,UCX7Y2qWriXpqocG97SFW2OQ,MonsterUI: Beautiful Python Web Apps in Minutes,MonsterUI ( https://monsterui.answer.ai/ ) is a Python/fasthtml library that simplifies web development by combining the best of ...,https://i.ytimg.com/vi/EtZ4pEzPMcc/default.jpg,120,90,https://i.ytimg.com/vi/EtZ4pEzPMcc/mqdefault.jpg,320,180,https://i.ytimg.com/vi/EtZ4pEzPMcc/hqdefault.jpg,480,360,Jeremy Howard,none,2025-02-11T20:13:34Z
0,youtube#searchResult,1ETXfjH3vP1znOH_JQMSxLe4S0Q,youtube#video,8uoMrqB2Nd4,2025-03-17T13:52:12Z,UC7kFLyCRK3gQmiSBaFRzgnA,"Innovation Takes a Village / Isabelle Moret, Canton of Vaud",Experience the pinnacle of AI and machine learning expertise at the Applied Machine Learning Days (AMLD) hosted at EPFL in ...,https://i.ytimg.com/vi/8uoMrqB2Nd4/default.jpg,120,90,https://i.ytimg.com/vi/8uoMrqB2Nd4/mqdefault.jpg,320,180,https://i.ytimg.com/vi/8uoMrqB2Nd4/hqdefault.jpg,480,360,Applied Machine Learning Days,none,2025-03-17T13:52:12Z
1,youtube#searchResult,a-xtoyTuoASEvq-iH_o3BafrzkI,youtube#video,_tvh06KAcuc,2025-03-17T13:52:09Z,UC7kFLyCRK3gQmiSBaFRzgnA,"The Dawn of Industrial AI / Sepp Hochreiter, NXAI",Experience the pinnacle of AI and machine learning expertise at the Applied Machine Learning Days (AMLD) hosted at EPFL in ...,https://i.ytimg.com/vi/_tvh06KAcuc/default.jpg,120,90,https://i.ytimg.com/vi/_tvh06KAcuc/mqdefault.jpg,320,180,https://i.ytimg.com/vi/_tvh06KAcuc/hqdefault.jpg,480,360,Applied Machine Learning Days,none,2025-03-17T13:52:09Z
2,youtube#searchResult,UYsISgYmpgIXXMUEvj6qEMCkokA,youtube#video,uoPTIfzNFX0,2025-03-17T13:52:01Z,UC7kFLyCRK3gQmiSBaFRzgnA,"Investing in Tomorrow&#39;s AI Giants/Nal Kalchbrenner, Angel Investor &amp; Florian Schweitzer, b2ventureAG",Experience the pinnacle of AI and machine learning expertise at the Applied Machine Learning Days (AMLD) hosted at EPFL in ...,https://i.ytimg.com/vi/uoPTIfzNFX0/default.jpg,120,90,https://i.ytimg.com/vi/uoPTIfzNFX0/mqdefault.jpg,320,180,https://i.ytimg.com/vi/uoPTIfzNFX0/hqdefault.jpg,480,360,Applied Machine Learning Days,none,2025-03-17T13:52:01Z
3,youtube#searchResult,eSzqeGbzGhpzndZqVtkh3YRBqOk,youtube#video,aM6qGXe5K9U,2025-03-17T13:52:06Z,UC7kFLyCRK3gQmiSBaFRzgnA,"The Al Startup Wave: How Founders are Disrupting Industries / Nicolas Dessaigne, Y Combinator",Experience the pinnacle of AI and machine learning expertise at the Applied Machine Learning Days (AMLD) hosted at EPFL in ...,https://i.ytimg.com/vi/aM6qGXe5K9U/default.jpg,120,90,https://i.ytimg.com/vi/aM6qGXe5K9U/mqdefault.jpg,320,180,https://i.ytimg.com/vi/aM6qGXe5K9U/hqdefault.jpg,480,360,Applied Machine Learning Days,none,2025-03-17T13:52:06Z
4,youtube#searchResult,n6wVyD9ftDDWGtiCkn6G-GAmhMs,youtube#video,1n4e_IRqDhI,2025-03-17T12:35:11Z,UC7kFLyCRK3gQmiSBaFRzgnA,AFTERMOVIE - AMLD EPFL 2025,"Relive the 4 days of AMLD 2025, the leading annual conference in Europe on AI and machine learning, held at EPFL. Thank you ...",https://i.ytimg.com/vi/1n4e_IRqDhI/default.jpg,120,90,https://i.ytimg.com/vi/1n4e_IRqDhI/mqdefault.jpg,320,180,https://i.ytimg.com/vi/1n4e_IRqDhI/hqdefault.jpg,480,360,Applied Machine Learning Days,none,2025-03-17T12:35:11Z
5,youtube#searchResult,rKCGOTPuZV2-1YqL3Rm8nalAjOw,youtube#video,I9x5JDmA3CI,2025-01-23T10:25:38Z,UC7kFLyCRK3gQmiSBaFRzgnA,AMLD EPFL 2025,The Applied Machine Learning Days channel features talks and performances from the Applied Machine Learning Days. AMLD is ...,https://i.ytimg.com/vi/I9x5JDmA3CI/default.jpg,120,90,https://i.ytimg.com/vi/I9x5JDmA3CI/mqdefault.jpg,320,180,https://i.ytimg.com/vi/I9x5JDmA3CI/hqdefault.jpg,480,360,Applied Machine Learning Days,none,2025-01-23T10:25:38Z
6,youtube#searchResult,iTAWF2DOt1KR53eHOrTOJdU07Yc,youtube#video,_F43A7xgWoQ,2024-06-18T12:51:06Z,UC7kFLyCRK3gQmiSBaFRzgnA,Licensing in open source AI: selected legal topics | Open-Source AI Models | Michel Jaccard,Experience the pinnacle of AI and machine learning expertise at the Applied Machine Learning Days (AMLD) hosted at EPFL in ...,https://i.ytimg.com/vi/_F43A7xgWoQ/default.jpg,120,90,https://i.ytimg.com/vi/_F43A7xgWoQ/mqdefault.jpg,320,180,https://i.ytimg.com/vi/_F43A7xgWoQ/hqdefault.jpg,480,360,Applied Machine Learning Days,none,2024-06-18T12:51:06Z
7,youtube#searchResult,JA8GIfYfOB38K908DyUJAqptZa8,youtube#video,B-pqcx8S4FU,2024-06-18T12:18:26Z,UC7kFLyCRK3gQmiSBaFRzgnA,Machine learning at the service of the weary warrior | Clinical AI | Sylvain Meylan,Experience the pinnacle of AI and machine learning expertise at the Applied Machine Learning Days (AMLD) hosted at EPFL in ...,https://i.ytimg.com/vi/B-pqcx8S4FU/default.jpg,120,90,https://i.ytimg.com/vi/B-pqcx8S4FU/mqdefault.jpg,320,180,https://i.ytimg.com/vi/B-pqcx8S4FU/hqdefault.jpg,480,360,Applied Machine Learning Days,none,2024-06-18T12:18:26Z
8,youtube#searchResult,xQhrtCjC4NB3Fo0bodj6nGpMo3s,youtube#video,-ty5_w3n7FM,2024-06-18T12:05:05Z,UC7kFLyCRK3gQmiSBaFRzgnA,Carbon footprint in practice @ EPFL | Environmentally Sustainable AI | Manuel Cubero-Castan,Experience the pinnacle of AI and machine learning expertise at the Applied Machine Learning Days (AMLD) hosted at EPFL in ...,https://i.ytimg.com/vi/-ty5_w3n7FM/default.jpg,120,90,https://i.ytimg.com/vi/-ty5_w3n7FM/mqdefault.jpg,320,180,https://i.ytimg.com/vi/-ty5_w3n7FM/hqdefault.jpg,480,360,Applied Machine Learning Days,none,2024-06-18T12:05:05Z
9,youtube#searchResult,dgbl_NWSSri_42ePi4cSumBQwss,youtube#video,_XbWxeD6Z7M,2024-06-18T11:52:01Z,UC7kFLyCRK3gQmiSBaFRzgnA,Shaping your innovation in the context of Generative AI | AI-Powered Projects | Robert van Kommer,Experience the pinnacle of AI and machine learning expertise at the Applied Machine Learning Days (AMLD) hosted at EPFL in ...,https://i.ytimg.com/vi/_XbWxeD6Z7M/default.jpg,120,90,https://i.ytimg.com/vi/_XbWxeD6Z7M/mqdefault.jpg,320,180,https://i.ytimg.com/vi/_XbWxeD6Z7M/hqdefault.jpg,480,360,Applied Machine Learning Days,none,2024-06-18T11:52:01Z
10,youtube#searchResult,VoXMTc9XVWAmf9BekUkxF6_TiBc,youtube#video,s_gQUFIzprE,2024-06-18T11:16:39Z,UC7kFLyCRK3gQmiSBaFRzgnA,"Creating Collective Insight on AI Literacy | AI Literacy, Skills and Readiness | Johannes Schleiss",Experience the pinnacle of AI and machine learning expertise at the Applied Machine Learning Days (AMLD) hosted at EPFL in ...,https://i.ytimg.com/vi/s_gQUFIzprE/default.jpg,120,90,https://i.ytimg.com/vi/s_gQUFIzprE/mqdefault.jpg,320,180,https://i.ytimg.com/vi/s_gQUFIzprE/hqdefault.jpg,480,360,Applied Machine Learning Days,none,2024-06-18T11:16:39Z
11,youtube#searchResult,F0uJIo52GDsmXIcBZ_V2qmsC9JM,youtube#video,i3e0b4Vl0J4,2024-06-17T13:16:19Z,UC7kFLyCRK3gQmiSBaFRzgnA,AI in the aviation Industry:A new prediction approach for airlines 2 | AI in Aviation | Danica Babić,Experience the pinnacle of AI and machine learning expertise at the Applied Machine Learning Days (AMLD) hosted at EPFL in ...,https://i.ytimg.com/vi/i3e0b4Vl0J4/default.jpg,120,90,https://i.ytimg.com/vi/i3e0b4Vl0J4/mqdefault.jpg,320,180,https://i.ytimg.com/vi/i3e0b4Vl0J4/hqdefault.jpg,480,360,Applied Machine Learning Days,none,2024-06-17T13:16:19Z
12,youtube#searchResult,nJFJygnvgfPRyaP4xAO-NolewMI,youtube#video,-eNfRtGqU4o,2024-06-17T11:38:41Z,UC7kFLyCRK3gQmiSBaFRzgnA,Detecting Greenwashing Signals | Advances of ML Approaches | Susie Xi Rao,Experience the pinnacle of AI and machine learning expertise at the Applied Machine Learning Days (AMLD) hosted at EPFL in ...,https://i.ytimg.com/vi/-eNfRtGqU4o/default.jpg,120,90,https://i.ytimg.com/vi/-eNfRtGqU4o/mqdefault.jpg,320,180,https://i.ytimg.com/vi/-eNfRtGqU4o/hqdefault.jpg,480,360,Applied Machine Learning Days,none,2024-06-17T11:38:41Z
13,youtube#searchResult,GyjndLqtRhA5_HeS1HUWkdPkB5Q,youtube#video,UwNP17Hc_xQ,2024-06-17T11:38:28Z,UC7kFLyCRK3gQmiSBaFRzgnA,Violating Privacy Via Inference with Large Language | Advances of ML Approaches | Mislav Balunović,Experience the pinnacle of AI and machine learning expertise at the Applied Machine Learning Days (AMLD) hosted at EPFL in ...,https://i.ytimg.com/vi/UwNP17Hc_xQ/default.jpg,120,90,https://i.ytimg.com/vi/UwNP17Hc_xQ/mqdefault.jpg,320,180,https://i.ytimg.com/vi/UwNP17Hc_xQ/hqdefault.jpg,480,360,Applied Machine Learning Days,none,2024-06-17T11:38:28Z
14,youtube#searchResult,D4lRqowsEnhn0n572KuVTc63hsg,youtube#video,eFcHQ_6-qoI,2024-06-17T10:56:03Z,UC7kFLyCRK3gQmiSBaFRzgnA,SMEs and fast-prototyping AI services | Accelerating the Adoption of AI | Sébastien Rumley,Experience the pinnacle of AI and machine learning expertise at the Applied Machine Learning Days (AMLD) hosted at EPFL in ...,https://i.ytimg.com/vi/eFcHQ_6-qoI/default.jpg,120,90,https://i.ytimg.com/vi/eFcHQ_6-qoI/mqdefault.jpg,320,180,https://i.ytimg.com/vi/eFcHQ_6-qoI/hqdefault.jpg,480,360,Applied Machine Learning Days,none,2024-06-17T10:56:03Z
15,youtube#searchResult,PGKTh8kixrpu9Nm-svMHmrbJur8,youtube#video,OVf_QMK7_UY,2024-06-17T08:54:33Z,UC7kFLyCRK3gQmiSBaFRzgnA,3 interactive case studies on climate risk | Accelerating Climate Change Action | Harrison Pim,Experience the pinnacle of AI and machine learning expertise at the Applied Machine Learning Days (AMLD) hosted at EPFL in ...,https://i.ytimg.com/vi/OVf_QMK7_UY/default.jpg,120,90,https://i.ytimg.com/vi/OVf_QMK7_UY/mqdefault.jpg,320,180,https://i.ytimg.com/vi/OVf_QMK7_UY/hqdefault.jpg,480,360,Applied Machine Learning Days,none,2024-06-17T08:54:33Z
16,youtube#searchResult,qYKZvMeH1UIpcZaFzK-AgyC7Hjo,youtube#video,EGNcNQapk2w,2024-06-17T08:54:22Z,UC7kFLyCRK3gQmiSBaFRzgnA,Global Flood Prediction | Accelerating Climate Change Action | Cynthia Zeng,Experience the pinnacle of AI and machine learning expertise at the Applied Machine Learning Days (AMLD) hosted at EPFL in ...,https://i.ytimg.com/vi/EGNcNQapk2w/default.jpg,120,90,https://i.ytimg.com/vi/EGNcNQapk2w/mqdefault.jpg,320,180,https://i.ytimg.com/vi/EGNcNQapk2w/hqdefault.jpg,480,360,Applied Machine Learning Days,none,2024-06-17T08:54:22Z
17,youtube#searchResult,adjJP28fo3-8YFCKybKXwc_VJ6o,youtube#video,6n49IEEcoYU,2024-06-11T07:41:07Z,UC7kFLyCRK3gQmiSBaFRzgnA,The Power of Data | AI and Connectivity | Francesco Pellegrini &amp; Ivan Vallejo Vall,Experience the pinnacle of AI and machine learning expertise at the Applied Machine Learning Days (AMLD) hosted at EPFL in ...,https://i.ytimg.com/vi/6n49IEEcoYU/default.jpg,120,90,https://i.ytimg.com/vi/6n49IEEcoYU/mqdefault.jpg,320,180,https://i.ytimg.com/vi/6n49IEEcoYU/hqdefault.jpg,480,360,Applied Machine Learning Days,none,2024-06-11T07:41:07Z
18,youtube#searchResult,3Zs6OiF_uG-OnaWm9heeEecMAR8,youtube#video,n0ZX_ZfWPGg,2024-06-03T13:31:45Z,UC7kFLyCRK3gQmiSBaFRzgnA,Graph Neural Networks | Scientific Machine Learning for Science and Engineering | Vinay Sharma,Experience the pinnacle of AI and machine learning expertise at the Applied Machine Learning Days (AMLD) hosted at EPFL in ...,https://i.ytimg.com/vi/n0ZX_ZfWPGg/default.jpg,120,90,https://i.ytimg.com/vi/n0ZX_ZfWPGg/mqdefault.jpg,320,180,https://i.ytimg.com/vi/n0ZX_ZfWPGg/hqdefault.jpg,480,360,Applied Machine Learning Days,none,2024-06-03T13:31:45Z
19,youtube#searchResult,VehHKhqIwehuxdWFLJtk8Tm6eqg,youtube#video,lhFVOu7qUXw,2024-05-24T08:19:27Z,UC7kFLyCRK3gQmiSBaFRzgnA,Accelerating Numerical Simulations by Model Reduction | AI &amp; Physics | Gianluigi Rozza,Experience the pinnacle of AI and machine learning expertise at the Applied Machine Learning Days (AMLD) hosted at EPFL in ...,https://i.ytimg.com/vi/lhFVOu7qUXw/default.jpg,120,90,https://i.ytimg.com/vi/lhFVOu7qUXw/mqdefault.jpg,320,180,https://i.ytimg.com/vi/lhFVOu7qUXw/hqdefault.jpg,480,360,Applied Machine Learning Days,none,2024-05-24T08:19:27Z
20,youtube#searchResult,aCinlDi57MtdLM-3HYwLTZYMUzY,youtube#video,aPu02vqcvbw,2024-05-24T08:10:39Z,UC7kFLyCRK3gQmiSBaFRzgnA,Accelerating Numerical Simulations by Model Reduction | AI &amp; Physics | Federica Gerace,Experience the pinnacle of AI and machine learning expertise at the Applied Machine Learning Days (AMLD) hosted at EPFL in ...,https://i.ytimg.com/vi/aPu02vqcvbw/default.jpg,120,90,https://i.ytimg.com/vi/aPu02vqcvbw/mqdefault.jpg,320,180,https://i.ytimg.com/vi/aPu02vqcvbw/hqdefault.jpg,480,360,Applied Machine Learning Days,none,2024-05-24T08:10:39Z
21,youtube#searchResult,wKyeawRe0izuNS3adBPSws1Ues4,youtube#video,E0SmtZ-JBzQ,2024-05-24T08:04:37Z,UC7kFLyCRK3gQmiSBaFRzgnA,Accelerating Numerical Simulations by Model Reduction | AI &amp; Physics | Florent Krzakala,Experience the pinnacle of AI and machine learning expertise at the Applied Machine Learning Days (AMLD) hosted at EPFL in ...,https://i.ytimg.com/vi/E0SmtZ-JBzQ/default.jpg,120,90,https://i.ytimg.com/vi/E0SmtZ-JBzQ/mqdefault.jpg,320,180,https://i.ytimg.com/vi/E0SmtZ-JBzQ/hqdefault.jpg,480,360,Applied Machine Learning Days,none,2024-05-24T08:04:37Z
22,youtube#searchResult,57IPWpVPCJJ4xkWeSQ4m9tDj_gs,youtube#video,t7Brws6vLhc,2024-05-16T12:44:26Z,UC7kFLyCRK3gQmiSBaFRzgnA,A look at Tetra Pak&#39;s AI Program | From Strategy to Execution | Alberto Barroso,Experience the pinnacle of AI and machine learning expertise at the Applied Machine Learning Days (AMLD) hosted at EPFL in ...,https://i.ytimg.com/vi/t7Brws6vLhc/default.jpg,120,90,https://i.ytimg.com/vi/t7Brws6vLhc/mqdefault.jpg,320,180,https://i.ytimg.com/vi/t7Brws6vLhc/hqdefault.jpg,480,360,Applied Machine Learning Days,none,2024-05-16T12:44:26Z
23,youtube#searchResult,A_SEIV8clXUmbd1_qg1tKlBk4dM,youtube#video,Ym16ISv84LI,2024-05-16T12:21:33Z,UC7kFLyCRK3gQmiSBaFRzgnA,Dotphoton AG | Startup Pitches | Bruno Sanguinetti,Experience the pinnacle of AI and machine learning expertise at the Applied Machine Learning Days (AMLD) hosted at EPFL in ...,https://i.ytimg.com/vi/Ym16ISv84LI/default.jpg,120,90,https://i.ytimg.com/vi/Ym16ISv84LI/mqdefault.jpg,320,180,https://i.ytimg.com/vi/Ym16ISv84LI/hqdefault.jpg,480,360,Applied Machine Learning Days,none,2024-05-16T12:21:33Z
24,youtube#searchResult,Wwul8lFRvxq1pHkTu3py5oHu6x8,youtube#video,x4DvU3clhJg,2024-05-16T12:21:08Z,UC7kFLyCRK3gQmiSBaFRzgnA,Artifact SA | Startup Pitches | Michael Wegmüller,Experience the pinnacle of AI and machine learning expertise at the Applied Machine Learning Days (AMLD) hosted at EPFL in ...,https://i.ytimg.com/vi/x4DvU3clhJg/default.jpg,120,90,https://i.ytimg.com/vi/x4DvU3clhJg/mqdefault.jpg,320,180,https://i.ytimg.com/vi/x4DvU3clhJg/hqdefault.jpg,480,360,Applied Machine Learning Days,none,2024-05-16T12:21:08Z
0,youtube#searchResult,I7Isz4EeVCuUwAGVX76sCT0oZMM,youtube#video,KkUXHylOqmQ,2023-11-04T14:59:36Z,UCspapbPlDQn1Tc7Pym2KMTw,NLP With Friends — Wenting Zhao,What We Learned from 570K ChatGPT Interaction Logs in The Wild.,https://i.ytimg.com/vi/KkUXHylOqmQ/default.jpg,120,90,https://i.ytimg.com/vi/KkUXHylOqmQ/mqdefault.jpg,320,180,https://i.ytimg.com/vi/KkUXHylOqmQ/hqdefault.jpg,480,360,NLP with Friends,none,2023-11-04T14:59:36Z
1,youtube#searchResult,hmLNUFeufglwToidTrErmS5NOf0,youtube#video,6gLUeMpmw28,2023-10-14T18:38:31Z,UCspapbPlDQn1Tc7Pym2KMTw,"NLP With Friends, Featured Friend: Mukund Srinath",Mukund is a PhD student in the Human Language Technologies lab at Pennsylvania State University. His primary research ...,https://i.ytimg.com/vi/6gLUeMpmw28/default.jpg,120,90,https://i.ytimg.com/vi/6gLUeMpmw28/mqdefault.jpg,320,180,https://i.ytimg.com/vi/6gLUeMpmw28/hqdefault.jpg,480,360,NLP with Friends,none,2023-10-14T18:38:31Z
2,youtube#searchResult,JWtxqS-wXjxQViBYT3OfiRsu0gM,youtube#video,TktbBnAWNB8,2023-09-08T18:14:57Z,UCspapbPlDQn1Tc7Pym2KMTw,"NLP With Friends, Featured Friend: Kalpesh Krishna","Kalpesh Krishna is a Research Scientist at Google, working in the Bard team. He recently received his PhD from UMass Amherst, ...",https://i.ytimg.com/vi/TktbBnAWNB8/default.jpg,120,90,https://i.ytimg.com/vi/TktbBnAWNB8/mqdefault.jpg,320,180,https://i.ytimg.com/vi/TktbBnAWNB8/hqdefault.jpg,480,360,NLP with Friends,none,2023-09-08T18:14:57Z
3,youtube#searchResult,5En5tYkb-0zU0oEAaLmKWOD607M,youtube#video,0WLGNTf9Yt4,2023-08-09T18:15:47Z,UCspapbPlDQn1Tc7Pym2KMTw,"NLP With Friends, Featured Friend: Prince Osei Aboagye","Prince Osei Aboagye is a final year Ph.D. student at the University of Utah, advised by Dr. Jeff M. Phillips. His research aims at ...",https://i.ytimg.com/vi/0WLGNTf9Yt4/default.jpg,120,90,https://i.ytimg.com/vi/0WLGNTf9Yt4/mqdefault.jpg,320,180,https://i.ytimg.com/vi/0WLGNTf9Yt4/hqdefault.jpg,480,360,NLP with Friends,none,2023-08-09T18:15:47Z
4,youtube#searchResult,Ohf6MsLrQ67U74WxQ84WG4uZaKw,youtube#video,6584JiBX_Z8,2021-12-02T06:13:46Z,UCspapbPlDQn1Tc7Pym2KMTw,"NLP with Friends, Featured Friend: Tuhin Chakrabarty",The Curious Case of Figurative Language.,https://i.ytimg.com/vi/6584JiBX_Z8/default.jpg,120,90,https://i.ytimg.com/vi/6584JiBX_Z8/mqdefault.jpg,320,180,https://i.ytimg.com/vi/6584JiBX_Z8/hqdefault.jpg,480,360,NLP with Friends,none,2021-12-02T06:13:46Z
0,youtube#searchResult,3_yLXyQajQ78I5t-4Ghg8BG0AOQ,youtube#video,Awmq5BK0lgM,2022-06-20T13:57:58Z,UCVlPeQjsKct9bXoC1Qlp1qA,TVBEHub In Conversation With... Faithful+Gould,"Listen in as we chat about skills for jobs, future employment opportunities in the Built Environment sector, and how one company ...",https://i.ytimg.com/vi/Awmq5BK0lgM/default.jpg,120,90,https://i.ytimg.com/vi/Awmq5BK0lgM/mqdefault.jpg,320,180,https://i.ytimg.com/vi/Awmq5BK0lgM/hqdefault.jpg,480,360,TVAI Hub,none,2022-06-20T13:57:58Z
1,youtube#searchResult,Z_8JZt-cNgQEz5IggHV15vq3lxk,youtube#video,gG78VWREcSU,2022-03-31T15:26:27Z,UCVlPeQjsKct9bXoC1Qlp1qA,TVBEHub In Conversation With... GradSpire,"Listen in as we chat about skills for jobs and regional support for skills development with Gradspire Project Coordinator, Ella ...",https://i.ytimg.com/vi/gG78VWREcSU/default.jpg,120,90,https://i.ytimg.com/vi/gG78VWREcSU/mqdefault.jpg,320,180,https://i.ytimg.com/vi/gG78VWREcSU/hqdefault.jpg,480,360,TVAI Hub,none,2022-03-31T15:26:27Z
2,youtube#searchResult,IDfRrO6_6GyUJZKS0YFYu28CFaE,youtube#video,3U4-7Y-epFw,2022-03-21T16:28:56Z,UCVlPeQjsKct9bXoC1Qlp1qA,AI at the University of Reading,Index: 0:00:15 Introductions 0:02:22 Dr Varun Ojha - Anything Repeatable is Replaceable by Artificial Intelligence: Opportunities ...,https://i.ytimg.com/vi/3U4-7Y-epFw/default.jpg,120,90,https://i.ytimg.com/vi/3U4-7Y-epFw/mqdefault.jpg,320,180,https://i.ytimg.com/vi/3U4-7Y-epFw/hqdefault.jpg,480,360,TVAI Hub,none,2022-03-21T16:28:56Z
3,youtube#searchResult,-5gk6Xp65JbKcAMgNJY1W6kIz40,youtube#video,fECQRR8aYPA,2022-03-08T16:47:27Z,UCVlPeQjsKct9bXoC1Qlp1qA,"Developing data driven solutions in Healthcare, what are the realities?",This recording includes details of how to engage with a hospital and successfully deliver a collaborative project. Speakers ...,https://i.ytimg.com/vi/fECQRR8aYPA/default.jpg,120,90,https://i.ytimg.com/vi/fECQRR8aYPA/mqdefault.jpg,320,180,https://i.ytimg.com/vi/fECQRR8aYPA/hqdefault.jpg,480,360,TVAI Hub,none,2022-03-08T16:47:27Z
4,youtube#searchResult,UqFYrV6itUNVhT0oiPYsovUjHfc,youtube#video,cPF-hCawHII,2021-12-02T18:34:55Z,UCVlPeQjsKct9bXoC1Qlp1qA,Getting data right for AI,"Be amongst the first to hear about new events, current funding opportunities and information on local business support services by ...",https://i.ytimg.com/vi/cPF-hCawHII/default.jpg,120,90,https://i.ytimg.com/vi/cPF-hCawHII/mqdefault.jpg,320,180,https://i.ytimg.com/vi/cPF-hCawHII/hqdefault.jpg,480,360,TVAI Hub,none,2021-12-02T18:34:55Z
0,youtube#searchResult,GG9OmN8dqV_tnffxxAJB1XCqaIY,youtube#video,tN5P1TmTFx4,2025-10-13T14:01:32Z,UCUcpVoi5KkJmnE3bvEhHR0Q,Pokemon&#39;s Missing Fire Type According to Simple Math,The Fire type mon that needs to be added in Gen 10! Missing Grass Type for Generation 10 Video ...,https://i.ytimg.com/vi/tN5P1TmTFx4/default.jpg,120,90,https://i.ytimg.com/vi/tN5P1TmTFx4/mqdefault.jpg,320,180,https://i.ytimg.com/vi/tN5P1TmTFx4/hqdefault.jpg,480,360,ritvikmath,none,2025-10-13T14:01:32Z
1,youtube#searchResult,4zulGJBgGHByMNBQToY6Bo0C76A,youtube#video,8Ald9O9JIAk,2025-09-04T19:30:01Z,UCUcpVoi5KkJmnE3bvEhHR0Q,Pokemon&#39;s New Mega Evolutions (According to Simple Math),The Math : https://www.youtube.com/watch?v=ZX3IjK4pfps Visuals Created with Excalidraw : https://excalidraw.com/,https://i.ytimg.com/vi/8Ald9O9JIAk/default.jpg,120,90,https://i.ytimg.com/vi/8Ald9O9JIAk/mqdefault.jpg,320,180,https://i.ytimg.com/vi/8Ald9O9JIAk/hqdefault.jpg,480,360,ritvikmath,none,2025-09-04T19:30:01Z
2,youtube#searchResult,uhPjQix5JJbW1_1rZzB45_pnZqk,youtube#video,uo1TLHaUmgY,2025-08-31T15:01:39Z,UCUcpVoi5KkJmnE3bvEhHR0Q,Fixing Pokemon&#39;s Type Chart with One Change,Visuals created with Excalidraw : https://excalidraw.com/,https://i.ytimg.com/vi/uo1TLHaUmgY/default.jpg,120,90,https://i.ytimg.com/vi/uo1TLHaUmgY/mqdefault.jpg,320,180,https://i.ytimg.com/vi/uo1TLHaUmgY/hqdefault.jpg,480,360,ritvikmath,none,2025-08-31T15:01:39Z
3,youtube#searchResult,umbvY77I6Das56L81OZkuZ1o7yc,youtube#video,NvADlWGawP8,2025-08-24T14:00:29Z,UCUcpVoi5KkJmnE3bvEhHR0Q,What if Pokemon Had Primary and Secondary Types?,Visuals Created with Excalidraw : https://excalidraw.com/,https://i.ytimg.com/vi/NvADlWGawP8/default.jpg,120,90,https://i.ytimg.com/vi/NvADlWGawP8/mqdefault.jpg,320,180,https://i.ytimg.com/vi/NvADlWGawP8/hqdefault.jpg,480,360,ritvikmath,none,2025-08-24T14:00:29Z
4,youtube#searchResult,GAB3B0wxQDiZ7v_mX8KY3MAWsvE,youtube#video,ZX3IjK4pfps,2025-08-18T14:00:55Z,UCUcpVoi5KkJmnE3bvEhHR0Q,Pokemon&#39;s Missing Grass Type According to Simple Math,The Grass type mon that needs to be added in Gen 10! Visuals Created with Excalidraw : https://excalidraw.com/,https://i.ytimg.com/vi/ZX3IjK4pfps/default.jpg,120,90,https://i.ytimg.com/vi/ZX3IjK4pfps/mqdefault.jpg,320,180,https://i.ytimg.com/vi/ZX3IjK4pfps/hqdefault.jpg,480,360,ritvikmath,none,2025-08-18T14:00:55Z
0,youtube#searchResult,zGGAByhRCeqZq7hT558CKAXQaxk,youtube#video,Rzi5p_1Mg1E,2024-04-09T16:26:25Z,UCjRjkk9nmIqSYwZ1zdxFw_g,Maximiza el Potencial de los Modelos de IA Generativa con Afinamiento y Optimización,Este webinar explorará en profundidad las estrategias y técnicas clave para la afinación (fine-tuning) de Modelos Grandes del ...,https://i.ytimg.com/vi/Rzi5p_1Mg1E/default.jpg,120,90,https://i.ytimg.com/vi/Rzi5p_1Mg1E/mqdefault.jpg,320,180,https://i.ytimg.com/vi/Rzi5p_1Mg1E/hqdefault.jpg,480,360,Databricks America Latina,none,2024-04-09T16:26:25Z
1,youtube#searchResult,YxsvhGeN4nM6UMfD8m5q1UyvozE,youtube#video,uDrnt_sd_2A,2024-03-05T19:21:35Z,UCjRjkk9nmIqSYwZ1zdxFw_g,WEBINAR: Revolucionando el Lakehouse con GenAI: Data Intelligence Platform,"El impacto de la IA en las plataformas de datos no será incremental, sino fundamental: democratizar masivamente el acceso a los ...",https://i.ytimg.com/vi/uDrnt_sd_2A/default.jpg,120,90,https://i.ytimg.com/vi/uDrnt_sd_2A/mqdefault.jpg,320,180,https://i.ytimg.com/vi/uDrnt_sd_2A/hqdefault.jpg,480,360,Databricks America Latina,none,2024-03-05T19:21:35Z
2,youtube#searchResult,JSuwQJuykEfjNlCXV8SckA55Va8,youtube#video,j1Mk41NXNIQ,2023-07-19T17:26:58Z,UCjRjkk9nmIqSYwZ1zdxFw_g,Webinar en Español  Escala y democratiza la analítica avanzada con Databricks y DataIku,"En esta sesión te compartiremos como nuestros clientes pueden aprovechar las ventajas de Databricks y Dataiku juntos, al tener ...",https://i.ytimg.com/vi/j1Mk41NXNIQ/default.jpg,120,90,https://i.ytimg.com/vi/j1Mk41NXNIQ/mqdefault.jpg,320,180,https://i.ytimg.com/vi/j1Mk41NXNIQ/hqdefault.jpg,480,360,Databricks America Latina,none,2023-07-19T17:26:58Z
3,youtube#searchResult,bOpK544ITAznyl9T-ste5Q2QFbw,youtube#video,2Wzj9Iu9Ey4,2021-03-03T19:30:18Z,UCjRjkk9nmIqSYwZ1zdxFw_g,Databricks Data Platform: Hadoop Modernización,Porque migrar de Hadoop hacia Databricks? Te comentamos durante este webinar y Demo.,https://i.ytimg.com/vi/2Wzj9Iu9Ey4/default.jpg,120,90,https://i.ytimg.com/vi/2Wzj9Iu9Ey4/mqdefault.jpg,320,180,https://i.ytimg.com/vi/2Wzj9Iu9Ey4/hqdefault.jpg,480,360,Databricks America Latina,none,2021-03-03T19:30:18Z
4,youtube#searchResult,Anv0gsiZ1edyOEPpxx2eGIsaKn4,youtube#video,ewdP1_coRyo,2021-02-09T19:42:42Z,UCjRjkk9nmIqSYwZ1zdxFw_g,Capsula 2 - Lakehouse,Aprende más sobre el nuevo paradigma: Lakehouse.,https://i.ytimg.com/vi/ewdP1_coRyo/default.jpg,120,90,https://i.ytimg.com/vi/ewdP1_coRyo/mqdefault.jpg,320,180,https://i.ytimg.com/vi/ewdP1_coRyo/hqdefault.jpg,480,360,Databricks America Latina,none,2021-02-09T19:42:42Z
