,kind,etag,id.kind,id.videoId,snippet.publishedAt,snippet.channelId,snippet.title,snippet.description,snippet.thumbnails.default.url,snippet.thumbnails.default.width,snippet.thumbnails.default.height,snippet.thumbnails.medium.url,snippet.thumbnails.medium.width,snippet.thumbnails.medium.height,snippet.thumbnails.high.url,snippet.thumbnails.high.width,snippet.thumbnails.high.height,snippet.channelTitle,snippet.liveBroadcastContent,snippet.publishTime
1,youtube#searchResult,sb1XC5VCm2xLcxDNcvTk47Zzs7Y,youtube#video,XcprcNreEzE,2023-01-11T20:16:23Z,UCHGAwygtFWAonSYfjeUv0iA,Data Science in Healthcare,,https://i.ytimg.com/vi/XcprcNreEzE/default.jpg,120,90,https://i.ytimg.com/vi/XcprcNreEzE/mqdefault.jpg,320,180,https://i.ytimg.com/vi/XcprcNreEzE/hqdefault.jpg,480,360,Data Science Talks,none,2023-01-11T20:16:23Z
2,youtube#searchResult,uvVWNUDh6uhmoQLMvzVgkusAZ8Q,youtube#video,WrgH4CKfY7M,2022-06-25T17:20:34Z,UCHGAwygtFWAonSYfjeUv0iA,Data science as a career choice for women in all stages | WiDS Regional &#39;22,"Speaker: Saradha Kameswaran, Google. She has spent 15+ years across many teams since the inception of Google India.",https://i.ytimg.com/vi/WrgH4CKfY7M/default.jpg,120,90,https://i.ytimg.com/vi/WrgH4CKfY7M/mqdefault.jpg,320,180,https://i.ytimg.com/vi/WrgH4CKfY7M/hqdefault.jpg,480,360,Data Science Talks,none,2022-06-25T17:20:34Z
3,youtube#searchResult,3PMmqF5Fcg8lmG5wLqpKQzTYtlw,youtube#video,sKO3dY-R9q0,2022-06-18T17:40:54Z,UCHGAwygtFWAonSYfjeUv0iA,Identifying fake reviews on a Business using ML and Data | WiDS 2022,,https://i.ytimg.com/vi/sKO3dY-R9q0/default.jpg,120,90,https://i.ytimg.com/vi/sKO3dY-R9q0/mqdefault.jpg,320,180,https://i.ytimg.com/vi/sKO3dY-R9q0/hqdefault.jpg,480,360,Data Science Talks,none,2022-06-18T17:40:54Z
4,youtube#searchResult,Eqflit7WBhAUNfKovBwMjTkOj5c,youtube#video,VEoSYvmC-PE,2022-04-16T17:46:00Z,UCHGAwygtFWAonSYfjeUv0iA,ML applications in Customer Interactions,"Sravanthi Dhanekula, Engineering Lead at Google. This talk is organized in association with VIT Bhopal University. Special ...",https://i.ytimg.com/vi/VEoSYvmC-PE/default.jpg,120,90,https://i.ytimg.com/vi/VEoSYvmC-PE/mqdefault.jpg,320,180,https://i.ytimg.com/vi/VEoSYvmC-PE/hqdefault.jpg,480,360,Data Science Talks,none,2022-04-16T17:46:00Z
0,youtube#searchResult,phWXRZ5YNstHv9gHnHGrHLYbkHk,youtube#video,3MYAkMMlDU0,2020-05-04T08:00:02Z,UCJ70w0WzWjWerpk3utRcAKA,Object-oriented programming in Python - Part 6 - Polymorphism,"Welcome to a new series of videos on the Python programming language. This time I want to tackle OOP, Object-oriented ...",https://i.ytimg.com/vi/3MYAkMMlDU0/default.jpg,120,90,https://i.ytimg.com/vi/3MYAkMMlDU0/mqdefault.jpg,320,180,https://i.ytimg.com/vi/3MYAkMMlDU0/hqdefault.jpg,480,360,The Digital Cat,none,2020-05-04T08:00:02Z
1,youtube#searchResult,ZRtssu7_Oix8lsnN9dfs2YuhI5w,youtube#video,FLwxJrwYHbo,2020-04-13T08:46:56Z,UCJ70w0WzWjWerpk3utRcAKA,Object-oriented programming in Python - Part 5 - Delegation: inheritance and composition,"Welcome to a new series of videos on the Python programming language. This time I want to tackle OOP, Object-oriented ...",https://i.ytimg.com/vi/FLwxJrwYHbo/default.jpg,120,90,https://i.ytimg.com/vi/FLwxJrwYHbo/mqdefault.jpg,320,180,https://i.ytimg.com/vi/FLwxJrwYHbo/hqdefault.jpg,480,360,The Digital Cat,none,2020-04-13T08:46:56Z
2,youtube#searchResult,H_R_eSv63N2TnYGlc4ZWDmy24vc,youtube#video,6ZPXR0Gj0GU,2019-12-09T19:00:00Z,UCJ70w0WzWjWerpk3utRcAKA,Object-oriented programming in Python - Part 4 - Classes and instances,"Welcome to a new series of videos on the Python programming language. This time I want to tackle OOP, Object-oriented ...",https://i.ytimg.com/vi/6ZPXR0Gj0GU/default.jpg,120,90,https://i.ytimg.com/vi/6ZPXR0Gj0GU/mqdefault.jpg,320,180,https://i.ytimg.com/vi/6ZPXR0Gj0GU/hqdefault.jpg,480,360,The Digital Cat,none,2019-12-09T19:00:00Z
3,youtube#searchResult,Q4r5J6v6ZDHtEq0PmKk4d_I3lig,youtube#video,_b18YfmEvTg,2019-12-02T19:00:06Z,UCJ70w0WzWjWerpk3utRcAKA,Object-oriented programming in Python - Part 3 - How to create a class,"Welcome to a new series of videos on the Python programming language. This time I want to tackle OOP, Object-oriented ...",https://i.ytimg.com/vi/_b18YfmEvTg/default.jpg,120,90,https://i.ytimg.com/vi/_b18YfmEvTg/mqdefault.jpg,320,180,https://i.ytimg.com/vi/_b18YfmEvTg/hqdefault.jpg,480,360,The Digital Cat,none,2019-12-02T19:00:06Z
4,youtube#searchResult,l3YsKjjxIP5St-7uuEhH9GF41Ao,youtube#video,-O7OHmrQMfc,2019-11-25T19:00:01Z,UCJ70w0WzWjWerpk3utRcAKA,Object-oriented programming in Python - Part 2 - Types and classes in Python,"Welcome to a new series of videos on the Python programming language. This time I want to tackle OOP, Object-oriented ...",https://i.ytimg.com/vi/-O7OHmrQMfc/default.jpg,120,90,https://i.ytimg.com/vi/-O7OHmrQMfc/mqdefault.jpg,320,180,https://i.ytimg.com/vi/-O7OHmrQMfc/hqdefault.jpg,480,360,The Digital Cat,none,2019-11-25T19:00:01Z
0,youtube#searchResult,eUCnDhm2EspoJ1SBS5JTPB7LfRs,youtube#video,g5QWmWn3KGY,2021-04-26T02:43:57Z,UCGYPQz_qySbPESTK8k2ky5g,Announcing the 8 Week SQL Challenge - Start Your Data Science Journey,I'm super excited to announce the official launch of the #8WeekSQLChallenge - join me for a 1 hour SQL focused Q&A session to ...,https://i.ytimg.com/vi/g5QWmWn3KGY/default.jpg,120,90,https://i.ytimg.com/vi/g5QWmWn3KGY/mqdefault.jpg,320,180,https://i.ytimg.com/vi/g5QWmWn3KGY/hqdefault.jpg,480,360,Danny Ma,none,2021-04-26T02:43:57Z
1,youtube#searchResult,o6z-Stsmy5b8n4ZQTkvMAglbKm4,youtube#video,OO4W4SnIHhM,2021-03-30T13:48:54Z,UCGYPQz_qySbPESTK8k2ky5g,Machine Learning From Beginning To Advanced,A quick breakdown of different machine learning skills required for data science from beginner to advanced. This video is a ...,https://i.ytimg.com/vi/OO4W4SnIHhM/default.jpg,120,90,https://i.ytimg.com/vi/OO4W4SnIHhM/mqdefault.jpg,320,180,https://i.ytimg.com/vi/OO4W4SnIHhM/hqdefault.jpg,480,360,Danny Ma,none,2021-03-30T13:48:54Z
2,youtube#searchResult,kBA6orNHVzCKx3NpVOhi577-o5g,youtube#video,GnkIX10cLao,2021-03-23T13:11:30Z,UCGYPQz_qySbPESTK8k2ky5g,The 3 Types of Data Scientists,"A is for Analyst, B is for Builder and C is for Consultant - a Unicorn Data Scientist is someone who can do all 3 at an extreme level ...",https://i.ytimg.com/vi/GnkIX10cLao/default.jpg,120,90,https://i.ytimg.com/vi/GnkIX10cLao/mqdefault.jpg,320,180,https://i.ytimg.com/vi/GnkIX10cLao/hqdefault.jpg,480,360,Danny Ma,none,2021-03-23T13:11:30Z
3,youtube#searchResult,5tgzXs0ZVs9E9ewB0t3elvKzlcU,youtube#video,ksciAXvvck0,2021-03-18T09:45:11Z,UCGYPQz_qySbPESTK8k2ky5g,How to Break Into Data Science in 2021,Are you interested in breaking into Data Science but don't know where to start? Don't worry that flying brain in the thumbnail has ...,https://i.ytimg.com/vi/ksciAXvvck0/default.jpg,120,90,https://i.ytimg.com/vi/ksciAXvvck0/mqdefault.jpg,320,180,https://i.ytimg.com/vi/ksciAXvvck0/hqdefault.jpg,480,360,Danny Ma,none,2021-03-18T09:45:11Z
4,youtube#searchResult,yfHM_xPGYKaWH5fAjtCwfaqJqFw,youtube#video,sdrY7pA-f2I,2021-03-12T16:07:02Z,UCGYPQz_qySbPESTK8k2ky5g,Ask Danny - Live Data Science Q&amp;A,"Join me at 2PM AEDT Friday 12th March for Q&A about data science, machine learning, career advice or anything else you'd like ...",https://i.ytimg.com/vi/sdrY7pA-f2I/default.jpg,120,90,https://i.ytimg.com/vi/sdrY7pA-f2I/mqdefault.jpg,320,180,https://i.ytimg.com/vi/sdrY7pA-f2I/hqdefault.jpg,480,360,Danny Ma,none,2021-03-12T16:07:02Z
0,youtube#searchResult,bacHoGkuHxHbZ2fj1YUhjGIvFmk,youtube#video,UlNt1rInC3I,2020-07-03T12:17:07Z,UCmWRF1AxelqS9hlbgI-SRWw,alb datastream1003 1080p 24fps,,https://i.ytimg.com/vi/UlNt1rInC3I/default.jpg,120,90,https://i.ytimg.com/vi/UlNt1rInC3I/mqdefault.jpg,320,180,https://i.ytimg.com/vi/UlNt1rInC3I/hqdefault.jpg,480,360,Brandon Rohrer,none,2020-07-03T12:17:07Z
0,youtube#searchResult,nqZmbs4V7z_au9oTFgjRfUb8Trs,youtube#video,jkrNMKz9pWU,2023-09-24T07:09:20Z,UCX7Y2qWriXpqocG97SFW2OQ,A Hackers&#39; Guide to Language Models,"In this deeply informative video, Jeremy Howard, co-founder of fast.ai and creator of the ULMFiT approach on which all modern ...",https://i.ytimg.com/vi/jkrNMKz9pWU/default.jpg,120,90,https://i.ytimg.com/vi/jkrNMKz9pWU/mqdefault.jpg,320,180,https://i.ytimg.com/vi/jkrNMKz9pWU/hqdefault.jpg,480,360,Jeremy Howard,none,2023-09-24T07:09:20Z
1,youtube#searchResult,H_m1e7QM_eYmOd5mVCiJdGQl6Eo,youtube#video,AbBZEULuCwc,2023-07-22T23:31:47Z,UCX7Y2qWriXpqocG97SFW2OQ,Jeremy Howard on ABC Weekend Breakfast,Jeremy discusses the latest agreement between the US White House and US AI companies.,https://i.ytimg.com/vi/AbBZEULuCwc/default.jpg,120,90,https://i.ytimg.com/vi/AbBZEULuCwc/mqdefault.jpg,320,180,https://i.ytimg.com/vi/AbBZEULuCwc/hqdefault.jpg,480,360,Jeremy Howard,none,2023-07-22T23:31:47Z
2,youtube#searchResult,_46qy7J_nXhUwRtJBeEF7kQhUmQ,youtube#video,GxcLDDJVBBg,2023-05-26T22:13:53Z,UCX7Y2qWriXpqocG97SFW2OQ,Jeremy Howard and Joshua Browder discuss AI &amp; Jobs with Piers Morgan,Full show link: https://www.youtube.com/live/gyhnHG5N2wE.,https://i.ytimg.com/vi/GxcLDDJVBBg/default.jpg,120,90,https://i.ytimg.com/vi/GxcLDDJVBBg/mqdefault.jpg,320,180,https://i.ytimg.com/vi/GxcLDDJVBBg/hqdefault.jpg,480,360,Jeremy Howard,none,2023-05-26T22:13:53Z
3,youtube#searchResult,0KQYL-6HyVwhtaY-2zdmKJ6rTtU,youtube#video,6GvB5lZJqcE,2023-05-03T06:32:09Z,UCX7Y2qWriXpqocG97SFW2OQ,Jeremy Howard demo for Mojo launch,"This is a section from the Modular launch video. The full video, docs, and details are here: https://www.modular.com/",https://i.ytimg.com/vi/6GvB5lZJqcE/default.jpg,120,90,https://i.ytimg.com/vi/6GvB5lZJqcE/mqdefault.jpg,320,180,https://i.ytimg.com/vi/6GvB5lZJqcE/hqdefault.jpg,480,360,Jeremy Howard,none,2023-05-03T06:32:09Z
4,youtube#searchResult,Kjs6pphP7PBWmMJ9ZGBhZacrgAA,youtube#video,vGdB4eI4KBs,2023-04-04T22:36:57Z,UCX7Y2qWriXpqocG97SFW2OQ,Lesson 13: Deep Learning Foundations to Stable Diffusion,"All lesson resources are available at http://course.fast.ai.) In this lesson, we dive into backpropagation and the creation of a simple ...",https://i.ytimg.com/vi/vGdB4eI4KBs/default.jpg,120,90,https://i.ytimg.com/vi/vGdB4eI4KBs/mqdefault.jpg,320,180,https://i.ytimg.com/vi/vGdB4eI4KBs/hqdefault.jpg,480,360,Jeremy Howard,none,2023-04-04T22:36:57Z
0,youtube#searchResult,bDh90zhFE9R9FB2O51IlYbuVhzQ,youtube#video,jVOzMoz5ikI,2022-05-12T11:48:57Z,UC7kFLyCRK3gQmiSBaFRzgnA,Computer Vision for Mixed Reality | Microsoft Swiss Joint Research Center | Marc Pollefeys,"Microsoft Swiss Joint Research Center – Day 2 – Computer vision and Mixed Reality ""Computer Vision for Mixed Reality"" Marc ...",https://i.ytimg.com/vi/jVOzMoz5ikI/default.jpg,120,90,https://i.ytimg.com/vi/jVOzMoz5ikI/mqdefault.jpg,320,180,https://i.ytimg.com/vi/jVOzMoz5ikI/hqdefault.jpg,480,360,Applied Machine Learning Days,none,2022-05-12T11:48:57Z
1,youtube#searchResult,Wtmx4xFEdh-_A4P4QGrJpNHrmOI,youtube#video,JLfjG_BnM_s,2022-05-11T10:30:00Z,UC7kFLyCRK3gQmiSBaFRzgnA,Robust and Interpretable Learning for Healthcare | AI &amp; Healthcare | Dorina Thanou,"AI & Healthcare ""Robust and Interpretable Learning for Healthcare"" Dorina Thanou The Applied Machine Learning Days channel ...",https://i.ytimg.com/vi/JLfjG_BnM_s/default.jpg,120,90,https://i.ytimg.com/vi/JLfjG_BnM_s/mqdefault.jpg,320,180,https://i.ytimg.com/vi/JLfjG_BnM_s/hqdefault.jpg,480,360,Applied Machine Learning Days,none,2022-05-11T10:30:00Z
2,youtube#searchResult,Eb-3E76Eo3rWUFd-zedY7WZSphk,youtube#video,mooseyAkvl8,2022-05-06T12:16:30Z,UC7kFLyCRK3gQmiSBaFRzgnA,Securing Cloud Deployments for the International Committee of the Red Cross | Ivan Puddu,"Microsoft Swiss Joint Research Center – Day 1 – AI, Confidential Computing, Health, Cloud and Systems ""Securing Cloud ...",https://i.ytimg.com/vi/mooseyAkvl8/default.jpg,120,90,https://i.ytimg.com/vi/mooseyAkvl8/mqdefault.jpg,320,180,https://i.ytimg.com/vi/mooseyAkvl8/hqdefault.jpg,480,360,Applied Machine Learning Days,none,2022-05-06T12:16:30Z
3,youtube#searchResult,XVv5-0IsEfXEHwMlsQfdixaLA-g,youtube#video,R3K7h_v6wZY,2022-05-06T07:41:16Z,UC7kFLyCRK3gQmiSBaFRzgnA,Monitoring the Missing Migrants | Andrea Garcia Borja &amp; Jenny Paola Yela Bello,"Using AI to track missing migrants worldwide ""Monitoring the Missing Migrants"" Andrea Garcia Borja & Jenny Paola Yela Bello ...",https://i.ytimg.com/vi/R3K7h_v6wZY/default.jpg,120,90,https://i.ytimg.com/vi/R3K7h_v6wZY/mqdefault.jpg,320,180,https://i.ytimg.com/vi/R3K7h_v6wZY/hqdefault.jpg,480,360,Applied Machine Learning Days,none,2022-05-06T07:41:16Z
4,youtube#searchResult,GdbSOeZUqVPxbHOGeRRvbEcYWUE,youtube#video,g8jwE7ZHfrY,2022-05-04T14:30:21Z,UC7kFLyCRK3gQmiSBaFRzgnA,LaserSKI: Object Detection for Defect Detection in Semiconductors | William Clemens,"AI & Manufacturing ""LaserSKI: Object Detection for Defect Detection in Semiconductors"" William Clemens The Applied Machine ...",https://i.ytimg.com/vi/g8jwE7ZHfrY/default.jpg,120,90,https://i.ytimg.com/vi/g8jwE7ZHfrY/mqdefault.jpg,320,180,https://i.ytimg.com/vi/g8jwE7ZHfrY/hqdefault.jpg,480,360,Applied Machine Learning Days,none,2022-05-04T14:30:21Z
0,youtube#searchResult,8Bd75y2I-B0_jZ-LkGhpHFySY1c,youtube#video,KkUXHylOqmQ,2023-11-04T14:59:36Z,UCspapbPlDQn1Tc7Pym2KMTw,NLP With Friends — Wenting Zhao,What We Learned from 570K ChatGPT Interaction Logs in The Wild.,https://i.ytimg.com/vi/KkUXHylOqmQ/default.jpg,120,90,https://i.ytimg.com/vi/KkUXHylOqmQ/mqdefault.jpg,320,180,https://i.ytimg.com/vi/KkUXHylOqmQ/hqdefault.jpg,480,360,NLP with Friends,none,2023-11-04T14:59:36Z
1,youtube#searchResult,lYgswsCX08nABFp4V0uVINYQjvA,youtube#video,6gLUeMpmw28,2023-10-14T18:38:31Z,UCspapbPlDQn1Tc7Pym2KMTw,"NLP With Friends, Featured Friend: Mukund Srinath",Mukund is a PhD student in the Human Language Technologies lab at Pennsylvania State University. His primary research ...,https://i.ytimg.com/vi/6gLUeMpmw28/default.jpg,120,90,https://i.ytimg.com/vi/6gLUeMpmw28/mqdefault.jpg,320,180,https://i.ytimg.com/vi/6gLUeMpmw28/hqdefault.jpg,480,360,NLP with Friends,none,2023-10-14T18:38:31Z
2,youtube#searchResult,EvCsWqPJo_OJcUq61AFhrAB9fL8,youtube#video,TktbBnAWNB8,2023-09-08T18:14:57Z,UCspapbPlDQn1Tc7Pym2KMTw,"NLP With Friends, Featured Friend: Kalpesh Krishna","Kalpesh Krishna is a Research Scientist at Google, working in the Bard team. He recently received his PhD from UMass Amherst, ...",https://i.ytimg.com/vi/TktbBnAWNB8/default.jpg,120,90,https://i.ytimg.com/vi/TktbBnAWNB8/mqdefault.jpg,320,180,https://i.ytimg.com/vi/TktbBnAWNB8/hqdefault.jpg,480,360,NLP with Friends,none,2023-09-08T18:14:57Z
3,youtube#searchResult,CrxJiedLHVMMJK4gD66PIHPeQF0,youtube#video,0WLGNTf9Yt4,2023-08-09T18:15:47Z,UCspapbPlDQn1Tc7Pym2KMTw,"NLP With Friends, Featured Friend: Prince Osei Aboagye","Prince Osei Aboagye is a final year Ph.D. student at the University of Utah, advised by Dr. Jeff M. Phillips. His research aims at ...",https://i.ytimg.com/vi/0WLGNTf9Yt4/default.jpg,120,90,https://i.ytimg.com/vi/0WLGNTf9Yt4/mqdefault.jpg,320,180,https://i.ytimg.com/vi/0WLGNTf9Yt4/hqdefault.jpg,480,360,NLP with Friends,none,2023-08-09T18:15:47Z
4,youtube#searchResult,E3atPO-VWPQy4wp_vO72X3UWIFM,youtube#video,6584JiBX_Z8,2021-12-02T06:13:46Z,UCspapbPlDQn1Tc7Pym2KMTw,"NLP with Friends, Featured Friend: Tuhin Chakrabarty",The Curious Case of Figurative Language.,https://i.ytimg.com/vi/6584JiBX_Z8/default.jpg,120,90,https://i.ytimg.com/vi/6584JiBX_Z8/mqdefault.jpg,320,180,https://i.ytimg.com/vi/6584JiBX_Z8/hqdefault.jpg,480,360,NLP with Friends,none,2021-12-02T06:13:46Z
0,youtube#searchResult,UrryqDXb4CUA_yXHWPYa9iKM_RY,youtube#video,Awmq5BK0lgM,2022-06-20T13:57:58Z,UCVlPeQjsKct9bXoC1Qlp1qA,TVBEHub In Conversation With... Faithful+Gould,"Listen in as we chat about skills for jobs, future employment opportunities in the Built Environment sector, and how one company ...",https://i.ytimg.com/vi/Awmq5BK0lgM/default.jpg,120,90,https://i.ytimg.com/vi/Awmq5BK0lgM/mqdefault.jpg,320,180,https://i.ytimg.com/vi/Awmq5BK0lgM/hqdefault.jpg,480,360,TVAI Hub,none,2022-06-20T13:57:58Z
1,youtube#searchResult,bw0IwxDbj1Ax6-_ErHObNBo5EuI,youtube#video,gG78VWREcSU,2022-03-31T15:26:27Z,UCVlPeQjsKct9bXoC1Qlp1qA,TVBEHub In Conversation With... GradSpire,"Listen in as we chat about skills for jobs and regional support for skills development with Gradspire Project Coordinator, Ella ...",https://i.ytimg.com/vi/gG78VWREcSU/default.jpg,120,90,https://i.ytimg.com/vi/gG78VWREcSU/mqdefault.jpg,320,180,https://i.ytimg.com/vi/gG78VWREcSU/hqdefault.jpg,480,360,TVAI Hub,none,2022-03-31T15:26:27Z
2,youtube#searchResult,i9cYUkfOq0CLyEqYZ1k8_1-axDI,youtube#video,3U4-7Y-epFw,2022-03-21T16:28:56Z,UCVlPeQjsKct9bXoC1Qlp1qA,AI at the University of Reading,Index: 0:00:15 Introductions 0:02:22 Dr Varun Ojha - Anything Repeatable is Replaceable by Artificial Intelligence: Opportunities ...,https://i.ytimg.com/vi/3U4-7Y-epFw/default.jpg,120,90,https://i.ytimg.com/vi/3U4-7Y-epFw/mqdefault.jpg,320,180,https://i.ytimg.com/vi/3U4-7Y-epFw/hqdefault.jpg,480,360,TVAI Hub,none,2022-03-21T16:28:56Z
3,youtube#searchResult,NrzsYrFEV5WZ0nSD1GScEpcnwf8,youtube#video,fECQRR8aYPA,2022-03-08T16:47:27Z,UCVlPeQjsKct9bXoC1Qlp1qA,"Developing data driven solutions in Healthcare, what are the realities?",This recording includes details of how to engage with a hospital and successfully deliver a collaborative project. Speakers ...,https://i.ytimg.com/vi/fECQRR8aYPA/default.jpg,120,90,https://i.ytimg.com/vi/fECQRR8aYPA/mqdefault.jpg,320,180,https://i.ytimg.com/vi/fECQRR8aYPA/hqdefault.jpg,480,360,TVAI Hub,none,2022-03-08T16:47:27Z
4,youtube#searchResult,uRCdAfcSytjxPwWn1m_O9KC_gIw,youtube#video,cPF-hCawHII,2021-12-02T18:34:55Z,UCVlPeQjsKct9bXoC1Qlp1qA,Getting data right for AI,"Be amongst the first to hear about new events, current funding opportunities and information on local business support services by ...",https://i.ytimg.com/vi/cPF-hCawHII/default.jpg,120,90,https://i.ytimg.com/vi/cPF-hCawHII/mqdefault.jpg,320,180,https://i.ytimg.com/vi/cPF-hCawHII/hqdefault.jpg,480,360,TVAI Hub,none,2021-12-02T18:34:55Z
0,youtube#searchResult,yVxjXQvX-WuBp1694wOvgQvx5tM,youtube#video,D1iSS_og7dM,2024-03-25T14:00:09Z,UCUcpVoi5KkJmnE3bvEhHR0Q,Call Options : The Intuition and Math You Need,All the intuition and math you need to know about call options! 0:00 Intro to Call Options 3:10 Visual Profit Analysis 9:16 Call ...,https://i.ytimg.com/vi/D1iSS_og7dM/default.jpg,120,90,https://i.ytimg.com/vi/D1iSS_og7dM/mqdefault.jpg,320,180,https://i.ytimg.com/vi/D1iSS_og7dM/hqdefault.jpg,480,360,ritvikmath,none,2024-03-25T14:00:09Z
1,youtube#searchResult,QlYNTkAhyateBeGh0ceySHYfsf0,youtube#video,gbjDEYFhdr4,2023-12-18T15:00:35Z,UCUcpVoi5KkJmnE3bvEhHR0Q,The Planet Fitness Problem : Improved Markov Chains,0:00 Intro 3:47 Markov Chain Framework 13:32 Improving the Framework Icon References: ...,https://i.ytimg.com/vi/gbjDEYFhdr4/default.jpg,120,90,https://i.ytimg.com/vi/gbjDEYFhdr4/mqdefault.jpg,320,180,https://i.ytimg.com/vi/gbjDEYFhdr4/hqdefault.jpg,480,360,ritvikmath,none,2023-12-18T15:00:35Z
2,youtube#searchResult,qB1KF52Eq7MDWiagrykjNrYFYlI,youtube#video,3LlMjjqJYYQ,2023-07-05T15:00:02Z,UCUcpVoi5KkJmnE3bvEhHR0Q,The 5 Most Important Matrices for Data Scientists,My Patreon : https://www.patreon.com/user?u=49277905 The 5 most important matrices that I use all the time as a data scientist.,https://i.ytimg.com/vi/3LlMjjqJYYQ/default.jpg,120,90,https://i.ytimg.com/vi/3LlMjjqJYYQ/mqdefault.jpg,320,180,https://i.ytimg.com/vi/3LlMjjqJYYQ/hqdefault.jpg,480,360,ritvikmath,none,2023-07-05T15:00:02Z
3,youtube#searchResult,0QFJSck_hS2j4rCNilVOdy422V8,youtube#video,1GqYpmLjTRQ,2023-06-26T15:00:01Z,UCUcpVoi5KkJmnE3bvEhHR0Q,Why do we use &quot;e&quot; in the Sigmoid?,"Why do we use the mathematical constant ""e"" in the sigmoid function? My Patreon : https://www.patreon.com/user?u=49277905 ...",https://i.ytimg.com/vi/1GqYpmLjTRQ/default.jpg,120,90,https://i.ytimg.com/vi/1GqYpmLjTRQ/mqdefault.jpg,320,180,https://i.ytimg.com/vi/1GqYpmLjTRQ/hqdefault.jpg,480,360,ritvikmath,none,2023-06-26T15:00:01Z
4,youtube#searchResult,FG58huq-uqPGscKiclsuNofnEpo,youtube#video,UHdbHkjhaeY,2023-06-19T14:30:18Z,UCUcpVoi5KkJmnE3bvEhHR0Q,I Made Two AIs Debate Student Loan Forgiveness,My Patreon https://www.patreon.com/user?u=49277905 Visuals created by ExcaliDraw https://excalidraw.com/ Text to Voice by ...,https://i.ytimg.com/vi/UHdbHkjhaeY/default.jpg,120,90,https://i.ytimg.com/vi/UHdbHkjhaeY/mqdefault.jpg,320,180,https://i.ytimg.com/vi/UHdbHkjhaeY/hqdefault.jpg,480,360,ritvikmath,none,2023-06-19T14:30:18Z
0,youtube#searchResult,SfkwcQG136A69qa48RpE_btukuE,youtube#video,uDrnt_sd_2A,2024-03-05T19:21:35Z,UCjRjkk9nmIqSYwZ1zdxFw_g,WEBINAR: Revolucionando el Lakehouse con GenAI: Data Intelligence Platform,"El impacto de la IA en las plataformas de datos no será incremental, sino fundamental: democratizar masivamente el acceso a los ...",https://i.ytimg.com/vi/uDrnt_sd_2A/default.jpg,120,90,https://i.ytimg.com/vi/uDrnt_sd_2A/mqdefault.jpg,320,180,https://i.ytimg.com/vi/uDrnt_sd_2A/hqdefault.jpg,480,360,Databricks America Latina,none,2024-03-05T19:21:35Z
1,youtube#searchResult,T4oCcrjWuAVX3HipvUhHO-lbI68,youtube#video,j1Mk41NXNIQ,2023-07-19T17:26:58Z,UCjRjkk9nmIqSYwZ1zdxFw_g,Webinar en Español  Escala y democratiza la analítica avanzada con Databricks y DataIku,"En esta sesión te compartiremos como nuestros clientes pueden aprovechar las ventajas de Databricks y Dataiku juntos, al tener ...",https://i.ytimg.com/vi/j1Mk41NXNIQ/default.jpg,120,90,https://i.ytimg.com/vi/j1Mk41NXNIQ/mqdefault.jpg,320,180,https://i.ytimg.com/vi/j1Mk41NXNIQ/hqdefault.jpg,480,360,Databricks America Latina,none,2023-07-19T17:26:58Z
2,youtube#searchResult,lDeCk3tMJu5p_yDvdyk0Lz8XBpo,youtube#video,2Wzj9Iu9Ey4,2021-03-03T19:30:18Z,UCjRjkk9nmIqSYwZ1zdxFw_g,Databricks Data Platform: Hadoop Modernización,Porque migrar de Hadoop hacia Databricks? Te comentamos durante este webinar y Demo.,https://i.ytimg.com/vi/2Wzj9Iu9Ey4/default.jpg,120,90,https://i.ytimg.com/vi/2Wzj9Iu9Ey4/mqdefault.jpg,320,180,https://i.ytimg.com/vi/2Wzj9Iu9Ey4/hqdefault.jpg,480,360,Databricks America Latina,none,2021-03-03T19:30:18Z
3,youtube#searchResult,URmZI5RWbdUVF-AaacmxUTCd3O8,youtube#video,ewdP1_coRyo,2021-02-09T19:42:42Z,UCjRjkk9nmIqSYwZ1zdxFw_g,Capsula 2 - Lakehouse,Aprende más sobre el nuevo paradigma: Lakehouse.,https://i.ytimg.com/vi/ewdP1_coRyo/default.jpg,120,90,https://i.ytimg.com/vi/ewdP1_coRyo/mqdefault.jpg,320,180,https://i.ytimg.com/vi/ewdP1_coRyo/hqdefault.jpg,480,360,Databricks America Latina,none,2021-02-09T19:42:42Z
4,youtube#searchResult,M7Qgzd_FeuTncut8ZF3bYRqCcYg,youtube#video,t7f18haq_1Y,2020-12-17T17:27:59Z,UCjRjkk9nmIqSYwZ1zdxFw_g,Capsula 1 - Databricks Unified Data Analytics Platform,Aprende más sobre nuestro concepto UDAP.,https://i.ytimg.com/vi/t7f18haq_1Y/default.jpg,120,90,https://i.ytimg.com/vi/t7f18haq_1Y/mqdefault.jpg,320,180,https://i.ytimg.com/vi/t7f18haq_1Y/hqdefault.jpg,480,360,Databricks America Latina,none,2020-12-17T17:27:59Z
0,youtube#searchResult,H3ZSDRDPl-XNbYYW0KUZ4vJunbI,youtube#video,4lTpfhgmwgs,2024-03-25T16:55:23Z,UC3NDbeN0Jq_InNAhiJtvHcQ,Від СТО до СЕО - Дмитро Гринь [Fwdays CTO],"Відео з CTO fwdays'23 конференції, яка пройшла 19 листопада 2023 року https://fwdays.com/event/cto-fwdays-2023 Доповідь: ...",https://i.ytimg.com/vi/4lTpfhgmwgs/default.jpg,120,90,https://i.ytimg.com/vi/4lTpfhgmwgs/mqdefault.jpg,320,180,https://i.ytimg.com/vi/4lTpfhgmwgs/hqdefault.jpg,480,360,fwdays,none,2024-03-25T16:55:23Z
1,youtube#searchResult,nY7vxZMtCDUUR3iF3YJKekGM7uw,youtube#video,5MRSJ7QZB3M,2024-03-25T16:11:27Z,UC3NDbeN0Jq_InNAhiJtvHcQ,Про архітектуру Cargofy,Другий випуск Fwdays Tech Talks: A&B Show де говоримо про архітектуру з ведучим Єгором Герасимчуком. Гість випуску ...,https://i.ytimg.com/vi/5MRSJ7QZB3M/default.jpg,120,90,https://i.ytimg.com/vi/5MRSJ7QZB3M/mqdefault.jpg,320,180,https://i.ytimg.com/vi/5MRSJ7QZB3M/hqdefault.jpg,480,360,fwdays,none,2024-03-25T16:11:27Z
2,youtube#searchResult,uZm9ZWZzIqqi6Z-OGBQ1oCumx1g,youtube#video,ls-Ai3VI7LY,2024-03-22T16:00:25Z,UC3NDbeN0Jq_InNAhiJtvHcQ,«Мені у Laravel не вистачає генерації міграції» Олександр Ковальчук,Другий випуск Fwdays Tech Talks: A&B Show де говоримо про архітектуру з ведучим Єгором Герасимчуком. Гість випуску ...,https://i.ytimg.com/vi/ls-Ai3VI7LY/default.jpg,120,90,https://i.ytimg.com/vi/ls-Ai3VI7LY/mqdefault.jpg,320,180,https://i.ytimg.com/vi/ls-Ai3VI7LY/hqdefault.jpg,480,360,fwdays,none,2024-03-22T16:00:25Z
3,youtube#searchResult,o-Q2kAqNgQ2l1i4Ni-N3RQfJUYA,youtube#video,d_7s95NQAhU,2024-03-20T16:00:27Z,UC3NDbeN0Jq_InNAhiJtvHcQ,«Мені заплатили за перший сайт 500 грн» Олександр Ковальчук,Другий випуск Fwdays Tech Talks: A&B Show де говоримо про архітектуру з ведучим Єгором Герасимчуком. Гість випуску ...,https://i.ytimg.com/vi/d_7s95NQAhU/default.jpg,120,90,https://i.ytimg.com/vi/d_7s95NQAhU/mqdefault.jpg,320,180,https://i.ytimg.com/vi/d_7s95NQAhU/hqdefault.jpg,480,360,fwdays,none,2024-03-20T16:00:27Z
4,youtube#searchResult,B1Pvv1HsQXdavtvReoRNhPAg3iU,youtube#video,B45GxkvaYro,2024-03-18T16:00:01Z,UC3NDbeN0Jq_InNAhiJtvHcQ,«Я був єдиний на біржі в Україні з Laravel» Олександр Ковальчук,Другий випуск Fwdays Tech Talks: A&B Show де говоримо про архітектуру з ведучим Єгором Герасимчуком. Гість випуску ...,https://i.ytimg.com/vi/B45GxkvaYro/default.jpg,120,90,https://i.ytimg.com/vi/B45GxkvaYro/mqdefault.jpg,320,180,https://i.ytimg.com/vi/B45GxkvaYro/hqdefault.jpg,480,360,fwdays,none,2024-03-18T16:00:01Z
