,kind,etag,id.kind,id.videoId,snippet.publishedAt,snippet.channelId,snippet.title,snippet.description,snippet.thumbnails.default.url,snippet.thumbnails.default.width,snippet.thumbnails.default.height,snippet.thumbnails.medium.url,snippet.thumbnails.medium.width,snippet.thumbnails.medium.height,snippet.thumbnails.high.url,snippet.thumbnails.high.width,snippet.thumbnails.high.height,snippet.channelTitle,snippet.liveBroadcastContent,snippet.publishTime
0,youtube#searchResult,53CiD6u5yz9xCt-MxJ4_2-B5Fq8,youtube#video,aLEkXKI_R_s,2023-03-21T22:14:49Z,UCOjD18EJYcsBog4IozkF_7w,Thomas Wiecki: The State of the Art for Probabilistic Programming | PyData Global 2022,"Probabilistic Programming as a field is moving at breakneck speed, with innovations being driven on all levels: language, ...",https://i.ytimg.com/vi/aLEkXKI_R_s/default.jpg,120,90,https://i.ytimg.com/vi/aLEkXKI_R_s/mqdefault.jpg,320,180,https://i.ytimg.com/vi/aLEkXKI_R_s/hqdefault.jpg,480,360,PyData,none,2023-03-21T22:14:49Z
1,youtube#searchResult,WVTHDThhxZ_deXuCrxBoJi41kN0,youtube#video,fsdbneHgi58,2023-03-20T17:37:56Z,UCOjD18EJYcsBog4IozkF_7w,Allen Downey: Bayesian Decision Analysis [Tutorial] | PyData Global 2022,"This tutorial is a hands-on introduction to Bayesian Decision Analysis (BDA), which is a framework for using probability to guide ...",https://i.ytimg.com/vi/fsdbneHgi58/default.jpg,120,90,https://i.ytimg.com/vi/fsdbneHgi58/mqdefault.jpg,320,180,https://i.ytimg.com/vi/fsdbneHgi58/hqdefault.jpg,480,360,PyData,none,2023-03-20T17:37:56Z
2,youtube#searchResult,8FNMWlKvs0AnHQBxTroYgjP7k98,youtube#video,7XpZjt8cvgs,2023-01-11T08:08:21Z,UCOjD18EJYcsBog4IozkF_7w,Dimitry Venger - Extreme Value Analysis | PyData Tel Aviv 2022,How do you use data from 15 years of observations to predict the magnitude of a “once in 50 years” storm? How can we build a ...,https://i.ytimg.com/vi/7XpZjt8cvgs/default.jpg,120,90,https://i.ytimg.com/vi/7XpZjt8cvgs/mqdefault.jpg,320,180,https://i.ytimg.com/vi/7XpZjt8cvgs/hqdefault.jpg,480,360,PyData,none,2023-01-11T08:08:21Z
3,youtube#searchResult,4od9wpapGbzkW6uMi-XQKULCz5E,youtube#video,wiGkV37Kbxk,2023-01-11T08:06:11Z,UCOjD18EJYcsBog4IozkF_7w,Raymond Hettinger: Numerical Marvels Inside Python - Keynote | PyData Tel Aviv 2022,"Bio: Raymond has been a prolific contributor to the CPython project for over a decade, having implemented and maintained many ...",https://i.ytimg.com/vi/wiGkV37Kbxk/default.jpg,120,90,https://i.ytimg.com/vi/wiGkV37Kbxk/mqdefault.jpg,320,180,https://i.ytimg.com/vi/wiGkV37Kbxk/hqdefault.jpg,480,360,PyData,none,2023-01-11T08:06:11Z
4,youtube#searchResult,J8MWVryO0UmS90TjUMxXzJu5l60,youtube#video,SLsaCdRAV0U,2023-01-06T18:24:04Z,UCOjD18EJYcsBog4IozkF_7w,Jeroen Overschie - How to create a Devcontainer for your Python project 🐳,"Devcontainers are an open-source specification, which allow you to connect your IDE to a running Docker container and develop ...",https://i.ytimg.com/vi/SLsaCdRAV0U/default.jpg,120,90,https://i.ytimg.com/vi/SLsaCdRAV0U/mqdefault.jpg,320,180,https://i.ytimg.com/vi/SLsaCdRAV0U/hqdefault.jpg,480,360,PyData,none,2023-01-06T18:24:04Z
0,youtube#searchResult,OmwZ9H1Prp7Dn659LXhIz0SI_lU,youtube#video,sVtkDhz5liI,2024-04-22T21:34:26Z,UCtWI06j1EADmEOGj2iJhSyA,PyCascades 2024: Day 1,PyCascades Day 1 View the full schedule here: https://2024.pycascades.com/program/schedule/,https://i.ytimg.com/vi/sVtkDhz5liI/default.jpg,120,90,https://i.ytimg.com/vi/sVtkDhz5liI/mqdefault.jpg,320,180,https://i.ytimg.com/vi/sVtkDhz5liI/hqdefault.jpg,480,360,PyCascades,none,2024-04-22T21:34:26Z
1,youtube#searchResult,Q9GCFXyafbcHRlaOQidAcfbiyTM,youtube#video,nEBwL1FN4uk,2024-04-22T21:34:26Z,UCtWI06j1EADmEOGj2iJhSyA,PyCascades 2024: Day 2,PyCascades Day 2 View the full schedule here: https://2024.pycascades.com/program/schedule/,https://i.ytimg.com/vi/nEBwL1FN4uk/default.jpg,120,90,https://i.ytimg.com/vi/nEBwL1FN4uk/mqdefault.jpg,320,180,https://i.ytimg.com/vi/nEBwL1FN4uk/hqdefault.jpg,480,360,PyCascades,none,2024-04-22T21:34:26Z
2,youtube#searchResult,_qsULawtMgaaLMvpoiT8oSWP6cI,youtube#video,i-EHx0WSsBM,2023-04-12T05:04:35Z,UCtWI06j1EADmEOGj2iJhSyA,Lightning Talks (PyCascades 2023),"Speaker: Jim De la Hunt Lightning Talk: Global domain names and email addresses, or, email me at जिम@डाटामेल.",https://i.ytimg.com/vi/i-EHx0WSsBM/default.jpg,120,90,https://i.ytimg.com/vi/i-EHx0WSsBM/mqdefault.jpg,320,180,https://i.ytimg.com/vi/i-EHx0WSsBM/hqdefault.jpg,480,360,PyCascades,none,2023-04-12T05:04:35Z
3,youtube#searchResult,HRC4mjYpK00Es0X70YTJkHT0Ab4,youtube#video,f7dS4b7xOn4,2023-04-12T04:51:16Z,UCtWI06j1EADmEOGj2iJhSyA,Vulnerability Scanning For Free (as in Puppies) - Terri Oda (PyCascades 2023),"Secure software supply chains with 0 vulnerabilities sounds like a great idea, but once you start looking through entire ...",https://i.ytimg.com/vi/f7dS4b7xOn4/default.jpg,120,90,https://i.ytimg.com/vi/f7dS4b7xOn4/mqdefault.jpg,320,180,https://i.ytimg.com/vi/f7dS4b7xOn4/hqdefault.jpg,480,360,PyCascades,none,2023-04-12T04:51:16Z
4,youtube#searchResult,avM1Hsusj8B9WDyyjrzN4clROyc,youtube#video,Rfz5Bm-AG1M,2023-04-12T04:53:07Z,UCtWI06j1EADmEOGj2iJhSyA,Untangle Python Spaghettis - Deep Dive Into Environments [...] - Cheuk Ting Ho (PyCascades 2023),"After learning doing in Python, we started multiple Python or Data Science projects. Dependency management becomes a skill ...",https://i.ytimg.com/vi/Rfz5Bm-AG1M/default.jpg,120,90,https://i.ytimg.com/vi/Rfz5Bm-AG1M/mqdefault.jpg,320,180,https://i.ytimg.com/vi/Rfz5Bm-AG1M/hqdefault.jpg,480,360,PyCascades,none,2023-04-12T04:53:07Z
0,youtube#searchResult,OLDqtAIIg42ocbXqnHDAJnXId8A,youtube#video,rkw0jZkZA_U,2022-07-05T09:15:29Z,UCTCV2vonJgaQVb8AdMgdvCA,PyDataMCR - July Talks,Talk Details to be announced SPONSORS Thank you to NUMFocus for sponsoring Meetup and further support.,https://i.ytimg.com/vi/rkw0jZkZA_U/default_live.jpg,120,90,https://i.ytimg.com/vi/rkw0jZkZA_U/mqdefault_live.jpg,320,180,https://i.ytimg.com/vi/rkw0jZkZA_U/hqdefault_live.jpg,480,360,PyDataMCR,upcoming,2022-07-05T09:15:29Z
1,youtube#searchResult,ohVnCgApmpQHPaf6gO-OdSq0-WM,youtube#video,w_GQgSqLbxc,2022-06-30T06:48:38Z,UCTCV2vonJgaQVb8AdMgdvCA,PyDataMCR - is back!,"Topics, Classification and Reviews - Shaun Hide - @ShaunHide1 With increasing noise around fake reviews and review skews ...",https://i.ytimg.com/vi/w_GQgSqLbxc/default.jpg,120,90,https://i.ytimg.com/vi/w_GQgSqLbxc/mqdefault.jpg,320,180,https://i.ytimg.com/vi/w_GQgSqLbxc/hqdefault.jpg,480,360,PyDataMCR,none,2022-06-30T06:48:38Z
2,youtube#searchResult,jGcXJIlFTNHVNonZYg37GCec5Ic,youtube#video,cik-dqUUiaU,2021-10-27T07:07:06Z,UCTCV2vonJgaQVb8AdMgdvCA,Data Horror Stories with Open Data Manchester &amp; Her+DataMcr 2021,"Do you have a tale of bad stats, strange correlations, malicious intent or plain stupidity? Join us and share your Data Horror ...",https://i.ytimg.com/vi/cik-dqUUiaU/default.jpg,120,90,https://i.ytimg.com/vi/cik-dqUUiaU/mqdefault.jpg,320,180,https://i.ytimg.com/vi/cik-dqUUiaU/hqdefault.jpg,480,360,PyDataMCR,none,2021-10-27T07:07:06Z
3,youtube#searchResult,fnU77nmAYPjBJAfH4_D5NIaf1u4,youtube#video,G7Sm2vzZjZg,2021-08-18T06:21:37Z,UCTCV2vonJgaQVb8AdMgdvCA,Live-Coding - Rain Risk,"""The ship's navigation computer seems to be malfunctioning; rather than giving a route directly to safety, it produced extremely ...",https://i.ytimg.com/vi/G7Sm2vzZjZg/default.jpg,120,90,https://i.ytimg.com/vi/G7Sm2vzZjZg/mqdefault.jpg,320,180,https://i.ytimg.com/vi/G7Sm2vzZjZg/hqdefault.jpg,480,360,PyDataMCR,none,2021-08-18T06:21:37Z
4,youtube#searchResult,BzGtxuGRivmeRazqqFc44Ko4kcg,youtube#video,SvNGA5-wIPs,2021-04-28T06:13:46Z,UCTCV2vonJgaQVb8AdMgdvCA,Data FAQs with the UKDS,Data FAQs Some questions come up again and again in relation to data industries. Questions like: * Should I learn R or Python?,https://i.ytimg.com/vi/SvNGA5-wIPs/default.jpg,120,90,https://i.ytimg.com/vi/SvNGA5-wIPs/mqdefault.jpg,320,180,https://i.ytimg.com/vi/SvNGA5-wIPs/hqdefault.jpg,480,360,PyDataMCR,none,2021-04-28T06:13:46Z
0,youtube#searchResult,OLDqtAIIg42ocbXqnHDAJnXId8A,youtube#video,rkw0jZkZA_U,2022-07-05T09:15:29Z,UCTCV2vonJgaQVb8AdMgdvCA,PyDataMCR - July Talks,Talk Details to be announced SPONSORS Thank you to NUMFocus for sponsoring Meetup and further support.,https://i.ytimg.com/vi/rkw0jZkZA_U/default_live.jpg,120,90,https://i.ytimg.com/vi/rkw0jZkZA_U/mqdefault_live.jpg,320,180,https://i.ytimg.com/vi/rkw0jZkZA_U/hqdefault_live.jpg,480,360,PyDataMCR,upcoming,2022-07-05T09:15:29Z
1,youtube#searchResult,ohVnCgApmpQHPaf6gO-OdSq0-WM,youtube#video,w_GQgSqLbxc,2022-06-30T06:48:38Z,UCTCV2vonJgaQVb8AdMgdvCA,PyDataMCR - is back!,"Topics, Classification and Reviews - Shaun Hide - @ShaunHide1 With increasing noise around fake reviews and review skews ...",https://i.ytimg.com/vi/w_GQgSqLbxc/default.jpg,120,90,https://i.ytimg.com/vi/w_GQgSqLbxc/mqdefault.jpg,320,180,https://i.ytimg.com/vi/w_GQgSqLbxc/hqdefault.jpg,480,360,PyDataMCR,none,2022-06-30T06:48:38Z
2,youtube#searchResult,jGcXJIlFTNHVNonZYg37GCec5Ic,youtube#video,cik-dqUUiaU,2021-10-27T07:07:06Z,UCTCV2vonJgaQVb8AdMgdvCA,Data Horror Stories with Open Data Manchester &amp; Her+DataMcr 2021,"Do you have a tale of bad stats, strange correlations, malicious intent or plain stupidity? Join us and share your Data Horror ...",https://i.ytimg.com/vi/cik-dqUUiaU/default.jpg,120,90,https://i.ytimg.com/vi/cik-dqUUiaU/mqdefault.jpg,320,180,https://i.ytimg.com/vi/cik-dqUUiaU/hqdefault.jpg,480,360,PyDataMCR,none,2021-10-27T07:07:06Z
3,youtube#searchResult,fnU77nmAYPjBJAfH4_D5NIaf1u4,youtube#video,G7Sm2vzZjZg,2021-08-18T06:21:37Z,UCTCV2vonJgaQVb8AdMgdvCA,Live-Coding - Rain Risk,"""The ship's navigation computer seems to be malfunctioning; rather than giving a route directly to safety, it produced extremely ...",https://i.ytimg.com/vi/G7Sm2vzZjZg/default.jpg,120,90,https://i.ytimg.com/vi/G7Sm2vzZjZg/mqdefault.jpg,320,180,https://i.ytimg.com/vi/G7Sm2vzZjZg/hqdefault.jpg,480,360,PyDataMCR,none,2021-08-18T06:21:37Z
4,youtube#searchResult,BzGtxuGRivmeRazqqFc44Ko4kcg,youtube#video,SvNGA5-wIPs,2021-04-28T06:13:46Z,UCTCV2vonJgaQVb8AdMgdvCA,Data FAQs with the UKDS,Data FAQs Some questions come up again and again in relation to data industries. Questions like: * Should I learn R or Python?,https://i.ytimg.com/vi/SvNGA5-wIPs/default.jpg,120,90,https://i.ytimg.com/vi/SvNGA5-wIPs/mqdefault.jpg,320,180,https://i.ytimg.com/vi/SvNGA5-wIPs/hqdefault.jpg,480,360,PyDataMCR,none,2021-04-28T06:13:46Z
0,youtube#searchResult,_A7CnRXKbbkkr7XvIpswlLHJFdU,youtube#video,Nm71G0-wnFU,2024-02-20T02:00:42Z,UC2d_azMgPLw_8JzgbpNb2oQ,PyData Montreal Meetup #24,There is a raw replay of PyData Montreal Meetup #24 with two talks 00:02:15 - 00:49:46 - How we used Python to see how many ...,https://i.ytimg.com/vi/Nm71G0-wnFU/default.jpg,120,90,https://i.ytimg.com/vi/Nm71G0-wnFU/mqdefault.jpg,320,180,https://i.ytimg.com/vi/Nm71G0-wnFU/hqdefault.jpg,480,360,PyData Montreal,none,2024-02-20T02:00:42Z
1,youtube#searchResult,8y-YvHBEXhCThckR1VJg0WG1c8Q,youtube#video,-FFKxz4V9_o,2021-06-29T23:48:14Z,UC2d_azMgPLw_8JzgbpNb2oQ,PyData Montreal #20 with Itamar Turner-Trauring,"Our guest this time is Itamar Turner-Trauring who will present two talks: - ""Small Big Data: using NumPy and Pandas when your ...",https://i.ytimg.com/vi/-FFKxz4V9_o/default.jpg,120,90,https://i.ytimg.com/vi/-FFKxz4V9_o/mqdefault.jpg,320,180,https://i.ytimg.com/vi/-FFKxz4V9_o/hqdefault.jpg,480,360,PyData Montreal,none,2021-06-29T23:48:14Z
2,youtube#searchResult,VQN7PBZRQVdYF7MjgKuTnIuFrps,youtube#video,jNZw_azRlDU,2021-04-22T23:53:51Z,UC2d_azMgPLw_8JzgbpNb2oQ,PyData Montreal #19 with Frederick Reiss and Luciano Resende,"Our speakers this time are: - Frederick Reiss, with a talk ""Text Extensions for Pandas"", and - Luciano Resende with ""Introducing ...",https://i.ytimg.com/vi/jNZw_azRlDU/default.jpg,120,90,https://i.ytimg.com/vi/jNZw_azRlDU/mqdefault.jpg,320,180,https://i.ytimg.com/vi/jNZw_azRlDU/hqdefault.jpg,480,360,PyData Montreal,none,2021-04-22T23:53:51Z
3,youtube#searchResult,5aKbKHEP9kKdPaOwVyKgNdQQui0,youtube#video,NrdJOfYisKI,2021-03-20T00:01:15Z,UC2d_azMgPLw_8JzgbpNb2oQ,PyData Montreal #18: Data Engineering and Data Management,"Our speakers this time are: - Ben Rogojan, with a talk ""The Python ETL: Airflow Vs. Luigi"", and - Sergey Karayev, presenting on ...",https://i.ytimg.com/vi/NrdJOfYisKI/default.jpg,120,90,https://i.ytimg.com/vi/NrdJOfYisKI/mqdefault.jpg,320,180,https://i.ytimg.com/vi/NrdJOfYisKI/hqdefault.jpg,480,360,PyData Montreal,none,2021-03-20T00:01:15Z
4,youtube#searchResult,VbYyMYvOpUrcNMEDE2q31cSUkXA,youtube#video,RG-yV5zgqjQ,2021-02-26T01:22:19Z,UC2d_azMgPLw_8JzgbpNb2oQ,PyData Montreal #17: Online meetup on NLP,"Our guests this time are: - Sylvain Gugger, a Research Engineer at Hugging Face and one of the core maintainers of the ...",https://i.ytimg.com/vi/RG-yV5zgqjQ/default.jpg,120,90,https://i.ytimg.com/vi/RG-yV5zgqjQ/mqdefault.jpg,320,180,https://i.ytimg.com/vi/RG-yV5zgqjQ/hqdefault.jpg,480,360,PyData Montreal,none,2021-02-26T01:22:19Z
0,youtube#searchResult,ipQJVns_rZ-F-05iJCiSEqJMKmc,youtube#video,hLTqQQ71TVw,2024-05-16T00:33:11Z,UCP7jMXSY2xbc3KCAE0MHQ-A,Project Astra demo | Explaining physics drawings,Watch as Project Astra identifies famous scientists and their accomplishments after seeing only a few sketches. Shot in a single ...,https://i.ytimg.com/vi/hLTqQQ71TVw/default.jpg,120,90,https://i.ytimg.com/vi/hLTqQQ71TVw/mqdefault.jpg,320,180,https://i.ytimg.com/vi/hLTqQQ71TVw/hqdefault.jpg,480,360,Google DeepMind,none,2024-05-16T00:33:11Z
1,youtube#searchResult,6sbvSImV4TcRKhjGeg9-sPzw68s,youtube#video,tyyg9pLVhN8,2024-05-16T00:33:11Z,UCP7jMXSY2xbc3KCAE0MHQ-A,Project Astra demo | Memorizing a sequence of objects,"Watch Project Astra memorize and recall a group of random objects, even identifying a “spiky gold ball”. Shot in single take in real ...",https://i.ytimg.com/vi/tyyg9pLVhN8/default.jpg,120,90,https://i.ytimg.com/vi/tyyg9pLVhN8/mqdefault.jpg,320,180,https://i.ytimg.com/vi/tyyg9pLVhN8/hqdefault.jpg,480,360,Google DeepMind,none,2024-05-16T00:33:11Z
2,youtube#searchResult,C6FevnZqgobj-660KG8SgoRh2Yg,youtube#video,smLNb1OoyFc,2024-05-16T00:33:11Z,UCP7jMXSY2xbc3KCAE0MHQ-A,Project Astra demo | Interpreting drawings from literature,Watch as Project Astra guesses famous books and thought experiments from simple sketches on a whiteboard. Shot in a single ...,https://i.ytimg.com/vi/smLNb1OoyFc/default.jpg,120,90,https://i.ytimg.com/vi/smLNb1OoyFc/mqdefault.jpg,320,180,https://i.ytimg.com/vi/smLNb1OoyFc/hqdefault.jpg,480,360,Google DeepMind,none,2024-05-16T00:33:11Z
3,youtube#searchResult,qz6N6W1hgudzJ18ZMz2ZiWDDlTc,youtube#video,4SrujTACZwA,2024-05-16T00:32:43Z,UCP7jMXSY2xbc3KCAE0MHQ-A,Project Astra demo | Explaining parts of a race car,"Watch as Project Astra identifies parts of a race car and helpful information, shot in a single take in real time. Project Astra is a ...",https://i.ytimg.com/vi/4SrujTACZwA/default.jpg,120,90,https://i.ytimg.com/vi/4SrujTACZwA/mqdefault.jpg,320,180,https://i.ytimg.com/vi/4SrujTACZwA/hqdefault.jpg,480,360,Google DeepMind,none,2024-05-16T00:32:43Z
4,youtube#searchResult,nci8OCduZosimaxcB0pwB3amOLc,youtube#video,9btDaOcfIMY,2024-05-14T17:58:00Z,UCP7jMXSY2xbc3KCAE0MHQ-A,SynthID: A tool for watermarking and identifying AI-generated content,"SynthID is a tool for watermarking and identifying AI-generated content created by Google DeepMind. With SynthID, users can ...",https://i.ytimg.com/vi/9btDaOcfIMY/default.jpg,120,90,https://i.ytimg.com/vi/9btDaOcfIMY/mqdefault.jpg,320,180,https://i.ytimg.com/vi/9btDaOcfIMY/hqdefault.jpg,480,360,Google DeepMind,none,2024-05-14T17:58:00Z
0,youtube#searchResult,r4XYdTqj8SEyZCU7-7l7eaovS0A,youtube#video,5lktwy6gSUg,2024-04-13T17:59:48Z,UCj09XsAWj-RF9kY4UvBJh_A,AI Meetup (4/10/2024) - Berlin,Tech Talk: Building an LLM agent to chat with the Berlin Parliament Speaker: Stephen Batifol (Zilliz) Tech Talk: Improving the ...,https://i.ytimg.com/vi/5lktwy6gSUg/default.jpg,120,90,https://i.ytimg.com/vi/5lktwy6gSUg/mqdefault.jpg,320,180,https://i.ytimg.com/vi/5lktwy6gSUg/hqdefault.jpg,480,360,AICamp,none,2024-04-13T17:59:48Z
1,youtube#searchResult,y_SqUBb_yCpcWPoGUcj0Vhvp26c,youtube#video,1xlABlYnxSQ,2024-03-07T18:45:22Z,UCj09XsAWj-RF9kY4UvBJh_A,AI meetup (3/6/2024) - San Francisco,Tech Talk: Open-source LLM optimized for building purpose-trained models Speaker: Lucy Park (Upstage) Tech Talk: Building an ...,https://i.ytimg.com/vi/1xlABlYnxSQ/default.jpg,120,90,https://i.ytimg.com/vi/1xlABlYnxSQ/mqdefault.jpg,320,180,https://i.ytimg.com/vi/1xlABlYnxSQ/hqdefault.jpg,480,360,AICamp,none,2024-03-07T18:45:22Z
2,youtube#searchResult,iqdFzv3tmb2RQwOFg9QzwwS3jN4,youtube#video,8JvwVomQtqE,2024-02-21T23:25:47Z,UCj09XsAWj-RF9kY4UvBJh_A,AI meetup (2/20/2024) - San Francisco,Tech Talk: The challenges of making vector search billion-scale Speaker: Kacper Łukawski (Qdrant) Tech Talk: Improving the ...,https://i.ytimg.com/vi/8JvwVomQtqE/default.jpg,120,90,https://i.ytimg.com/vi/8JvwVomQtqE/mqdefault.jpg,320,180,https://i.ytimg.com/vi/8JvwVomQtqE/hqdefault.jpg,480,360,AICamp,none,2024-02-21T23:25:47Z
3,youtube#searchResult,NGchJFzGHTWqQEdDqMNcdWW9_6g,youtube#video,Md6262yIW3I,2023-12-20T03:31:12Z,UCj09XsAWj-RF9kY4UvBJh_A,AI EOY Meetup 2023 - Dallas,Tech Talk 1: AI-Powered Data Exploration: Beyond SQL Expertise Speaker: Abdullah Al Hamoud @PMG Tech Talk 2: The Future ...,https://i.ytimg.com/vi/Md6262yIW3I/default.jpg,120,90,https://i.ytimg.com/vi/Md6262yIW3I/mqdefault.jpg,320,180,https://i.ytimg.com/vi/Md6262yIW3I/hqdefault.jpg,480,360,AICamp,none,2023-12-20T03:31:12Z
4,youtube#searchResult,mnEZFiidRRy0b_X6ZaxoOjnTJzc,youtube#video,NbEVPUlIKOA,2023-09-25T20:01:07Z,UCj09XsAWj-RF9kY4UvBJh_A,AI-driven Language Processing with Vector Search,Tech Talk: AI-driven language processing with Vector Search and Apache Cassandra Speaker: Erick Ramirez @Datastax ...,https://i.ytimg.com/vi/NbEVPUlIKOA/default.jpg,120,90,https://i.ytimg.com/vi/NbEVPUlIKOA/mqdefault.jpg,320,180,https://i.ytimg.com/vi/NbEVPUlIKOA/hqdefault.jpg,480,360,AICamp,none,2023-09-25T20:01:07Z
0,youtube#searchResult,O5VODOPQue4Fe1f_xzqTVMV1e5k,youtube#video,_KNKXnRwy78,2023-10-27T20:17:39Z,UCuGC1JusVvbOGa__qMtH3QA,"Translating Electronic Documents: A Low-Resource Story, with John Ortega","Translating Electronic Documents: A Low-Resource Story, presented by John Ortega to an online meetup audience, October 25, ...",https://i.ytimg.com/vi/_KNKXnRwy78/default.jpg,120,90,https://i.ytimg.com/vi/_KNKXnRwy78/mqdefault.jpg,320,180,https://i.ytimg.com/vi/_KNKXnRwy78/hqdefault.jpg,480,360,Natural Language Processing presentations,none,2023-10-27T20:17:39Z
1,youtube#searchResult,4_mu3-M7-oHVxuFw6RlCUWfKTe8,youtube#video,veFYp_WPcxU,2023-04-20T00:20:13Z,UCuGC1JusVvbOGa__qMtH3QA,NLP Technology for Enterprise Legal ApplicationsUntitled,"Emad Elwany from Lexion.ai presents NLP Technology for Enterprise Legal Applications in an online meetup program, April 19, ...",https://i.ytimg.com/vi/veFYp_WPcxU/default.jpg,120,90,https://i.ytimg.com/vi/veFYp_WPcxU/mqdefault.jpg,320,180,https://i.ytimg.com/vi/veFYp_WPcxU/hqdefault.jpg,480,360,Natural Language Processing presentations,none,2023-04-20T00:20:13Z
2,youtube#searchResult,nn_9KKyDWxcz67ZEHgqdP9Tw7Xw,youtube#video,ocNgZ6eDG3A,2023-03-28T21:43:44Z,UCuGC1JusVvbOGa__qMtH3QA,Training New Multilingual Foundation Models for Search &amp; Classification,"Nils Reimers, who is director of machine learning at cohere.ai, presents online on March 28, 2023 on Training New Multilingual ...",https://i.ytimg.com/vi/ocNgZ6eDG3A/default.jpg,120,90,https://i.ytimg.com/vi/ocNgZ6eDG3A/mqdefault.jpg,320,180,https://i.ytimg.com/vi/ocNgZ6eDG3A/hqdefault.jpg,480,360,Natural Language Processing presentations,none,2023-03-28T21:43:44Z
3,youtube#searchResult,OCzVpDoJlmx60I-X3weykwsYb-E,youtube#video,hscJK-4kA_A,2023-03-15T20:35:05Z,UCuGC1JusVvbOGa__qMtH3QA,Automated Speech Recognition with Spark NLP,David Cecchini from John Snow Labs presents Automated Speech Recognition with Spark NLP to an online natural language ...,https://i.ytimg.com/vi/hscJK-4kA_A/default.jpg,120,90,https://i.ytimg.com/vi/hscJK-4kA_A/mqdefault.jpg,320,180,https://i.ytimg.com/vi/hscJK-4kA_A/hqdefault.jpg,480,360,Natural Language Processing presentations,none,2023-03-15T20:35:05Z
4,youtube#searchResult,vNKzJQgwSt7-QCTNdC22LBS2iEU,youtube#video,9JNXgF7K2x0,2023-02-23T20:31:31Z,UCuGC1JusVvbOGa__qMtH3QA,"Why and How to Build a Distributed Search Engine, with Stan Srednyak",Stan Srednyak presents Why and How to Build a Distributed Search Engine to an online natural language processing (NLP) ...,https://i.ytimg.com/vi/9JNXgF7K2x0/default.jpg,120,90,https://i.ytimg.com/vi/9JNXgF7K2x0/mqdefault.jpg,320,180,https://i.ytimg.com/vi/9JNXgF7K2x0/hqdefault.jpg,480,360,Natural Language Processing presentations,none,2023-02-23T20:31:31Z
0,youtube#searchResult,gjvQuQrQsvGxyrAv2YtgOWd2884,youtube#video,vEQL9Xy7h6Q,2024-05-29T16:00:53Z,UCBp3w4DCEC64FZr4k9ROxig,Insights into Building a High-Performance Computing Cloud Platform,All of the Fully Connected San Francisco 2024 videos are available at http://wandb.me/fcsf24yt* *About Rahul Talari and Harsh ...,https://i.ytimg.com/vi/vEQL9Xy7h6Q/default.jpg,120,90,https://i.ytimg.com/vi/vEQL9Xy7h6Q/mqdefault.jpg,320,180,https://i.ytimg.com/vi/vEQL9Xy7h6Q/hqdefault.jpg,480,360,Weights & Biases,none,2024-05-29T16:00:53Z
1,youtube#searchResult,zF5BxsoRrznMgK4ZdJbYH7LVXzQ,youtube#video,eLmvmCHRGzs,2024-05-28T18:00:16Z,UCBp3w4DCEC64FZr4k9ROxig,Building Future Proof AI Assistants with Codeium CEO Varun Mohan,"In this episode of Gradient Dissent, Varun Mohan, Co-Founder & CEO of Codeium, joins host Lukas Biewald to explore the ...",https://i.ytimg.com/vi/eLmvmCHRGzs/default.jpg,120,90,https://i.ytimg.com/vi/eLmvmCHRGzs/mqdefault.jpg,320,180,https://i.ytimg.com/vi/eLmvmCHRGzs/hqdefault.jpg,480,360,Weights & Biases,none,2024-05-28T18:00:16Z
2,youtube#searchResult,N8LHmHZxyrsif1VnGNDfW10Q8mc,youtube#video,2ZPn9Pt4omk,2024-05-24T17:00:03Z,UCBp3w4DCEC64FZr4k9ROxig,The Importance of Latency In Gen-AI Apps,"In this episode of Gradient Dissent, Varun Mohan, Co-Founder & CEO of Codeium, joins host Lukas Biewald to discuss the ...",https://i.ytimg.com/vi/2ZPn9Pt4omk/default.jpg,120,90,https://i.ytimg.com/vi/2ZPn9Pt4omk/mqdefault.jpg,320,180,https://i.ytimg.com/vi/2ZPn9Pt4omk/hqdefault.jpg,480,360,Weights & Biases,none,2024-05-24T17:00:03Z
3,youtube#searchResult,NOm_oncbvb2JsHqvLLjuAq-ZGuo,youtube#video,Kzh70JK6oBc,2024-05-14T17:00:12Z,UCBp3w4DCEC64FZr4k9ROxig,The Importance of Modularity When Developing Gen-AI Apps,"shorts In this episode of Gradient Dissent, Percy Liang, co-founder of Together AI and Stanford associate professor, shares ...",https://i.ytimg.com/vi/Kzh70JK6oBc/default.jpg,120,90,https://i.ytimg.com/vi/Kzh70JK6oBc/mqdefault.jpg,320,180,https://i.ytimg.com/vi/Kzh70JK6oBc/hqdefault.jpg,480,360,Weights & Biases,none,2024-05-14T17:00:12Z
4,youtube#searchResult,5bZHgWrJzwLG8TCMzaEY4jxlCWA,youtube#video,eD0o5QH2Y5g,2024-05-10T16:00:37Z,UCBp3w4DCEC64FZr4k9ROxig,The Challenge of Evaluating LLM’s,"In this thought-provoking episode of Gradient Dissent, Percy Liang, co-founder of Together AI and Stanford University associate ...",https://i.ytimg.com/vi/eD0o5QH2Y5g/default.jpg,120,90,https://i.ytimg.com/vi/eD0o5QH2Y5g/mqdefault.jpg,320,180,https://i.ytimg.com/vi/eD0o5QH2Y5g/hqdefault.jpg,480,360,Weights & Biases,none,2024-05-10T16:00:37Z
0,youtube#searchResult,-Pz2PHMuzZldildKhDl_uTlV4vs,youtube#video,jmLCephF89U,2024-04-16T09:03:09Z,UCpwC9QC0lWaEJ85MoMRFvrA,Meng Fang | Large Language Models Are Neurosymbolic Reasoners,Organised by Evolution AI - AI extraction from financial documents - https://www.evolution.ai/ Sponsored by Man Group ...,https://i.ytimg.com/vi/jmLCephF89U/default.jpg,120,90,https://i.ytimg.com/vi/jmLCephF89U/mqdefault.jpg,320,180,https://i.ytimg.com/vi/jmLCephF89U/hqdefault.jpg,480,360,London Machine Learning Meetup,none,2024-04-16T09:03:09Z
1,youtube#searchResult,JRAaldjDsesjHu1rq57Al51h7_4,youtube#video,9c9KdJ-5JG4,2024-02-08T09:58:37Z,UCpwC9QC0lWaEJ85MoMRFvrA,Yuxiong Wang | Bridging Generative &amp; Discriminative Learning in the Open World,Sponsored by Evolution AI: https://www.evolution.ai Abstract: Generative AI has emerged as the new wave following ...,https://i.ytimg.com/vi/9c9KdJ-5JG4/default.jpg,120,90,https://i.ytimg.com/vi/9c9KdJ-5JG4/mqdefault.jpg,320,180,https://i.ytimg.com/vi/9c9KdJ-5JG4/hqdefault.jpg,480,360,London Machine Learning Meetup,none,2024-02-08T09:58:37Z
2,youtube#searchResult,o6Yfsd46OgihssBwIpmRcoePVGw,youtube#video,THYrjDuJ7GI,2024-01-11T15:42:13Z,UCpwC9QC0lWaEJ85MoMRFvrA,Brenden M. Lake | Addressing Two Classic Debates in Cognitive Science with Deep Learning,Sponsored by Evolution AI: https://www.evolution.ai Abstract: How can advances in machine learning best advance our ...,https://i.ytimg.com/vi/THYrjDuJ7GI/default.jpg,120,90,https://i.ytimg.com/vi/THYrjDuJ7GI/mqdefault.jpg,320,180,https://i.ytimg.com/vi/THYrjDuJ7GI/hqdefault.jpg,480,360,London Machine Learning Meetup,none,2024-01-11T15:42:13Z
3,youtube#searchResult,nFPI_OzOMq6y89sJSftM8CWK-IA,youtube#video,eXPhvQgAT_I,2023-12-08T10:12:18Z,UCpwC9QC0lWaEJ85MoMRFvrA,Yuandong Tian | Efficient Inference of LLMs with Long Context Support,Sponsored by Evolution AI: https://www.evolution.ai Abstract: While Large Language Models (LLMs) demonstrate impressive ...,https://i.ytimg.com/vi/eXPhvQgAT_I/default.jpg,120,90,https://i.ytimg.com/vi/eXPhvQgAT_I/mqdefault.jpg,320,180,https://i.ytimg.com/vi/eXPhvQgAT_I/hqdefault.jpg,480,360,London Machine Learning Meetup,none,2023-12-08T10:12:18Z
