,kind,etag,id.kind,id.videoId,snippet.publishedAt,snippet.channelId,snippet.title,snippet.description,snippet.thumbnails.default.url,snippet.thumbnails.default.width,snippet.thumbnails.default.height,snippet.thumbnails.medium.url,snippet.thumbnails.medium.width,snippet.thumbnails.medium.height,snippet.thumbnails.high.url,snippet.thumbnails.high.width,snippet.thumbnails.high.height,snippet.channelTitle,snippet.liveBroadcastContent,snippet.publishTime
4,youtube#searchResult,VaFudv2LdiLS-AzeOR6QHrvYCCM,youtube#video,ZvxAKvGTlnk,2025-10-16T00:31:18Z,UCipPccqvcfychKNOaYUokyQ,[理研AIP 成果報告イベント] 計算論的学習理論チーム-20250908,主催：理化学研究所 AIP 数理科学チーム 日時：2025年9月8日 (月) ＊下記(左)の時間(時・分・秒)をクリックするとそれぞれの ...,https://i.ytimg.com/vi/ZvxAKvGTlnk/default.jpg,120,90,https://i.ytimg.com/vi/ZvxAKvGTlnk/mqdefault.jpg,320,180,https://i.ytimg.com/vi/ZvxAKvGTlnk/hqdefault.jpg,480,360,RIKEN AIP,none,2025-10-16T00:31:18Z
0,youtube#searchResult,w3m4C7WK4vv2EHPO-f4qJbwUk6g,youtube#video,ssPSCs5GVlA,2022-09-13T15:20:32Z,UCY15whY8GyA3DgjZFPdHfAQ,AI Expo 2022 | Panel: Productivity and Performance Boosters for Data Scientists and Developers,"ValleyML AI Expo 2022 Panel Discussion, In-Person Event, Day 1 Topic: Productivity and Performance Boosters for Data ...",https://i.ytimg.com/vi/ssPSCs5GVlA/default.jpg,120,90,https://i.ytimg.com/vi/ssPSCs5GVlA/mqdefault.jpg,320,180,https://i.ytimg.com/vi/ssPSCs5GVlA/hqdefault.jpg,480,360,ValleyML,none,2022-09-13T15:20:32Z
1,youtube#searchResult,WIAvwECd0HzVasLwgoY9EReGUms,youtube#video,xCMgLDx1O9M,2022-09-13T14:02:53Z,UCY15whY8GyA3DgjZFPdHfAQ,AI Expo 2022 | Chris Eliasmith - An Optimal Time Series Processor,"ValleyML AI Expo 2022 Sponsored Session, AI Hardware, Virtual Event Speaker: Chris Eliasmith, Co-CEO, Applied Brain ...",https://i.ytimg.com/vi/xCMgLDx1O9M/default.jpg,120,90,https://i.ytimg.com/vi/xCMgLDx1O9M/mqdefault.jpg,320,180,https://i.ytimg.com/vi/xCMgLDx1O9M/hqdefault.jpg,480,360,ValleyML,none,2022-09-13T14:02:53Z
2,youtube#searchResult,t4dEfTAxHtXSE_IUewggetizfbg,youtube#video,8kYM_Ac78ik,2022-09-13T14:02:58Z,UCY15whY8GyA3DgjZFPdHfAQ,AI Expo 2022 | Mark Oliver - Introduction to the Efinix TinyML Platform,"ValleyML AI Expo 2022 Sponsored Session, AI Hardware, Virtual Event Speaker: Mark Oliver, VP Marketing, Efinix, Inc. Title: ...",https://i.ytimg.com/vi/8kYM_Ac78ik/default.jpg,120,90,https://i.ytimg.com/vi/8kYM_Ac78ik/mqdefault.jpg,320,180,https://i.ytimg.com/vi/8kYM_Ac78ik/hqdefault.jpg,480,360,ValleyML,none,2022-09-13T14:02:58Z
3,youtube#searchResult,KAK6aAoZmZIf0GIb8WCsGwrYhZs,youtube#video,MvR-_fJ0NMQ,2022-09-13T14:03:03Z,UCY15whY8GyA3DgjZFPdHfAQ,AI Expo 2022 | Manasi Vartak - A Reference Architecture for Operational AI,"ValleyML AI Expo 2022 Sponsored Session, AI Operations, Virtual Event Speaker: Manasi Vartak, CEO, Verta Inc Title: A ...",https://i.ytimg.com/vi/MvR-_fJ0NMQ/default.jpg,120,90,https://i.ytimg.com/vi/MvR-_fJ0NMQ/mqdefault.jpg,320,180,https://i.ytimg.com/vi/MvR-_fJ0NMQ/hqdefault.jpg,480,360,ValleyML,none,2022-09-13T14:03:03Z
4,youtube#searchResult,0BHwu5PvolR6TYLZFMTx_qctCJA,youtube#video,6Xmeo99eHVw,2022-09-13T14:03:09Z,UCY15whY8GyA3DgjZFPdHfAQ,AI Expo 2022 | Jan Jongboom - Building confidence in your ML models,"ValleyML AI Expo 2022 Virtual Keynote Speaker: Jan Jongboom, CTO, Edge Impulse Title: Building confidence in your ML ...",https://i.ytimg.com/vi/6Xmeo99eHVw/default.jpg,120,90,https://i.ytimg.com/vi/6Xmeo99eHVw/mqdefault.jpg,320,180,https://i.ytimg.com/vi/6Xmeo99eHVw/hqdefault.jpg,480,360,ValleyML,none,2022-09-13T14:03:09Z
0,youtube#searchResult,nmnTgpQpbQER-o3Ieyw4JYJCe64,youtube#video,5D2Vdt0QMN0,2021-08-12T21:37:24Z,UCMxUmQFr0_dyW8JTLDiOeNQ,"Proof, Provers, and the Lean Theorem Prover - Summer Special!","In this summer special we'll take a break from messy data, and - just for fun - take refuge in the reassuring consistency and ...",https://i.ytimg.com/vi/5D2Vdt0QMN0/default.jpg,120,90,https://i.ytimg.com/vi/5D2Vdt0QMN0/mqdefault.jpg,320,180,https://i.ytimg.com/vi/5D2Vdt0QMN0/hqdefault.jpg,480,360,Data Science Cornwall,none,2021-08-12T21:37:24Z
1,youtube#searchResult,2s_VAaYkQptXUcwnpFa_qMN1hH0,youtube#video,Qv4FVsXnf-M,2021-07-29T22:35:10Z,UCMxUmQFr0_dyW8JTLDiOeNQ,Data Challenge Cornwall - Cluster Analysis to Create Personas without Bias,Link to slides: tinyurl.com/SmartlineClusterDataChallenge Slides include links to data and sample code. --- The Smartline Project ...,https://i.ytimg.com/vi/Qv4FVsXnf-M/default.jpg,120,90,https://i.ytimg.com/vi/Qv4FVsXnf-M/mqdefault.jpg,320,180,https://i.ytimg.com/vi/Qv4FVsXnf-M/hqdefault.jpg,480,360,Data Science Cornwall,none,2021-07-29T22:35:10Z
2,youtube#searchResult,RAILYTHSFPpkSJHKNJ6A8H2ZlZY,youtube#video,6U3h6DBTZes,2021-07-29T22:35:24Z,UCMxUmQFr0_dyW8JTLDiOeNQ,Data Challenge Cornwall - Predicting Housing Faults &amp; Resident Support Needs,Slides: https://drive.google.com/file/d/1lnjUb0tRI_wuHY1psFCArnDj8F116Osg/view?usp=sharing --- Coastline Housing is an ...,https://i.ytimg.com/vi/6U3h6DBTZes/default.jpg,120,90,https://i.ytimg.com/vi/6U3h6DBTZes/mqdefault.jpg,320,180,https://i.ytimg.com/vi/6U3h6DBTZes/hqdefault.jpg,480,360,Data Science Cornwall,none,2021-07-29T22:35:24Z
3,youtube#searchResult,fkpxtgyg8eSClkSUH-N0xV32brY,youtube#video,1Sy0B-4ZRg8,2021-07-29T22:20:51Z,UCMxUmQFr0_dyW8JTLDiOeNQ,Data Challenge Cornwall - OCR of Historical Mining Records,Link to scanned images: https://cornishlithium.egnyte.com/fl/dTYUvzsHR3 Slides: ...,https://i.ytimg.com/vi/1Sy0B-4ZRg8/default.jpg,120,90,https://i.ytimg.com/vi/1Sy0B-4ZRg8/mqdefault.jpg,320,180,https://i.ytimg.com/vi/1Sy0B-4ZRg8/hqdefault.jpg,480,360,Data Science Cornwall,none,2021-07-29T22:20:51Z
4,youtube#searchResult,ZCBiLzAaIgRyNzez7-YPsepR4EE,youtube#video,CuSX2jFMAFc,2021-07-22T23:49:04Z,UCMxUmQFr0_dyW8JTLDiOeNQ,Data Challenge Cornwall - Visualising GP Surgery Data,"The NHS collects and publishes a broad range of data, including on GP surgery information. Join the session to find hear about ...",https://i.ytimg.com/vi/CuSX2jFMAFc/default.jpg,120,90,https://i.ytimg.com/vi/CuSX2jFMAFc/mqdefault.jpg,320,180,https://i.ytimg.com/vi/CuSX2jFMAFc/hqdefault.jpg,480,360,Data Science Cornwall,none,2021-07-22T23:49:04Z
0,youtube#searchResult,Uj5fTr5FFlmhGLEsWcpdj-wSdqc,youtube#video,M_dc73EAxxA,2025-03-01T17:40:30Z,UCoTuN2KVQHpnAOO9nM9354Q,2025 03 01 OMLDS LLM Assisted EDA,Join us as guest speaker William Guesdon gives an enlightening presentation on how LLMs are being used to assist with ...,https://i.ytimg.com/vi/M_dc73EAxxA/default.jpg,120,90,https://i.ytimg.com/vi/M_dc73EAxxA/mqdefault.jpg,320,180,https://i.ytimg.com/vi/M_dc73EAxxA/hqdefault.jpg,480,360,OMLDS,none,2025-03-01T17:40:30Z
1,youtube#searchResult,Oo3HGuI3-SPTV-w3ffAmwJAN_6k,youtube#video,LRfFBhxpoO8,2024-04-20T18:00:23Z,UCoTuN2KVQHpnAOO9nM9354Q,OMLDS: Lakehouse Solutions to Data Problems,"In today's data-driven world, organizations grapple with vast volumes of data coming from diverse sources. Managing, processing ...",https://i.ytimg.com/vi/LRfFBhxpoO8/default.jpg,120,90,https://i.ytimg.com/vi/LRfFBhxpoO8/mqdefault.jpg,320,180,https://i.ytimg.com/vi/LRfFBhxpoO8/hqdefault.jpg,480,360,OMLDS,none,2024-04-20T18:00:23Z
2,youtube#searchResult,RCYciw85a4MIhRdN0rChGAzaqZY,youtube#video,PnTRj3ghRhI,2024-01-12T20:28:35Z,UCoTuN2KVQHpnAOO9nM9354Q,Part 7 End to End Machine Learning Series,"In this installment of the End to End ML Series, we discuss model selection using the PyCaret open source tool to evaluate ...",https://i.ytimg.com/vi/PnTRj3ghRhI/default.jpg,120,90,https://i.ytimg.com/vi/PnTRj3ghRhI/mqdefault.jpg,320,180,https://i.ytimg.com/vi/PnTRj3ghRhI/hqdefault.jpg,480,360,OMLDS,none,2024-01-12T20:28:35Z
3,youtube#searchResult,LINpF3IOYg_e_o6ri8wRb99-if8,youtube#video,vQLXgiqoG9o,2023-11-16T18:32:17Z,UCoTuN2KVQHpnAOO9nM9354Q,Part 6 End to End Machine Learning Series,In this phase we build our first model using SciKit Learn and evaluate the results of a Logistic Regression model using the ...,https://i.ytimg.com/vi/vQLXgiqoG9o/default.jpg,120,90,https://i.ytimg.com/vi/vQLXgiqoG9o/mqdefault.jpg,320,180,https://i.ytimg.com/vi/vQLXgiqoG9o/hqdefault.jpg,480,360,OMLDS,none,2023-11-16T18:32:17Z
4,youtube#searchResult,qf4QADofIei7NtkDRIx0DUwpAck,youtube#video,m0gWOGrvn14,2023-10-24T20:42:47Z,UCoTuN2KVQHpnAOO9nM9354Q,Part5 End to End Machine Learning Series,,https://i.ytimg.com/vi/m0gWOGrvn14/default.jpg,120,90,https://i.ytimg.com/vi/m0gWOGrvn14/mqdefault.jpg,320,180,https://i.ytimg.com/vi/m0gWOGrvn14/hqdefault.jpg,480,360,OMLDS,none,2023-10-24T20:42:47Z
5,youtube#searchResult,VDeH02P6IZvxGhbobljX0x7SsLQ,youtube#video,izd1aRnKW3Q,2023-10-24T20:30:42Z,UCoTuN2KVQHpnAOO9nM9354Q,Part4 End to End Machine Learning Series,,https://i.ytimg.com/vi/izd1aRnKW3Q/default.jpg,120,90,https://i.ytimg.com/vi/izd1aRnKW3Q/mqdefault.jpg,320,180,https://i.ytimg.com/vi/izd1aRnKW3Q/hqdefault.jpg,480,360,OMLDS,none,2023-10-24T20:30:42Z
6,youtube#searchResult,TZd4DU4vcKrvqq61fFvzflP0rbE,youtube#video,8V9G8SrHRpY,2023-07-23T17:54:52Z,UCoTuN2KVQHpnAOO9nM9354Q,Part 3: End to End Machine Learning Series,OMLDS (Orlando Machine Learning and Data Scientists) End to End Machine Learning Project 2023 This is the third video in a ...,https://i.ytimg.com/vi/8V9G8SrHRpY/default.jpg,120,90,https://i.ytimg.com/vi/8V9G8SrHRpY/mqdefault.jpg,320,180,https://i.ytimg.com/vi/8V9G8SrHRpY/hqdefault.jpg,480,360,OMLDS,none,2023-07-23T17:54:52Z
7,youtube#searchResult,ZJGEm8QjxaNd7MHZ1zgFQnaDtEI,youtube#video,FAwoQO0jFD4,2023-07-22T19:51:33Z,UCoTuN2KVQHpnAOO9nM9354Q,OMLDS 2023 06 24 Vizzu Presentation,"Guest speaker Peter Vidos, CEO of Vizzu, presents how to create animated visualizations in Jupyter notebooks.",https://i.ytimg.com/vi/FAwoQO0jFD4/default.jpg,120,90,https://i.ytimg.com/vi/FAwoQO0jFD4/mqdefault.jpg,320,180,https://i.ytimg.com/vi/FAwoQO0jFD4/hqdefault.jpg,480,360,OMLDS,none,2023-07-22T19:51:33Z
8,youtube#searchResult,y0-hb-FgQBSL04p4ikzY3Mwx7BA,youtube#video,uSDzJUWIHWc,2023-05-31T20:15:47Z,UCoTuN2KVQHpnAOO9nM9354Q,Part 2:  End to End Machine Learning Series,OMLDS (Orlando Machine Learning and Data Scientists) End to End Machine Learning Project 2023 This is the second video in a ...,https://i.ytimg.com/vi/uSDzJUWIHWc/default.jpg,120,90,https://i.ytimg.com/vi/uSDzJUWIHWc/mqdefault.jpg,320,180,https://i.ytimg.com/vi/uSDzJUWIHWc/hqdefault.jpg,480,360,OMLDS,none,2023-05-31T20:15:47Z
9,youtube#searchResult,jhkcPf3hNWfzJQYeACQtFh8Zupc,youtube#video,K-feJXtEavE,2023-05-22T17:13:38Z,UCoTuN2KVQHpnAOO9nM9354Q,Part 1:  End to End Machine Learning Series,OMLDS (Orlando Machine Learning and Data Scientists) End to End Machine Learning Project 2023 This is the first video in a ...,https://i.ytimg.com/vi/K-feJXtEavE/default.jpg,120,90,https://i.ytimg.com/vi/K-feJXtEavE/mqdefault.jpg,320,180,https://i.ytimg.com/vi/K-feJXtEavE/hqdefault.jpg,480,360,OMLDS,none,2023-05-22T17:13:38Z
10,youtube#searchResult,OtAtIMFTUwJ_SQh71nxL0r9EFIE,youtube#video,BXv0iVOiCrw,2022-08-18T17:24:30Z,UCoTuN2KVQHpnAOO9nM9354Q,An Intro to Metaprogramming in R,Description: Metaprogramming is a generally useful tool to solve certain kinds of programming and data analysis problems.,https://i.ytimg.com/vi/BXv0iVOiCrw/default.jpg,120,90,https://i.ytimg.com/vi/BXv0iVOiCrw/mqdefault.jpg,320,180,https://i.ytimg.com/vi/BXv0iVOiCrw/hqdefault.jpg,480,360,OMLDS,none,2022-08-18T17:24:30Z
11,youtube#searchResult,-UMJbUtQjjHcUySmyQt4Pily1lE,youtube#video,2Qb795RA0z4,2022-05-30T18:55:56Z,UCoTuN2KVQHpnAOO9nM9354Q,OMLDS - Lunch and Learn (5/25/2022) - Missing Data,Orlando Machine Learning and Data Science Meetup May 2022 Lunch and Learn Orlando Machine Learning and Data Science ...,https://i.ytimg.com/vi/2Qb795RA0z4/default.jpg,120,90,https://i.ytimg.com/vi/2Qb795RA0z4/mqdefault.jpg,320,180,https://i.ytimg.com/vi/2Qb795RA0z4/hqdefault.jpg,480,360,OMLDS,none,2022-05-30T18:55:56Z
12,youtube#searchResult,jBuDmLmcyEs6Sd4wJH5u67DfI7o,youtube#video,AoWNOdkXlpE,2021-11-09T19:45:14Z,UCoTuN2KVQHpnAOO9nM9354Q,Introduction to Distributed Compute with Dask,"Orlando Machine Learning and Data Science Meetup November 2021 Event About the Talk: As data volume continues to grow, ...",https://i.ytimg.com/vi/AoWNOdkXlpE/default.jpg,120,90,https://i.ytimg.com/vi/AoWNOdkXlpE/mqdefault.jpg,320,180,https://i.ytimg.com/vi/AoWNOdkXlpE/hqdefault.jpg,480,360,OMLDS,none,2021-11-09T19:45:14Z
13,youtube#searchResult,xh6Ns0HPWz6pCdKIq6B7SiV8j7Y,youtube#video,6qO1-NEbjxs,2021-08-28T17:09:26Z,UCoTuN2KVQHpnAOO9nM9354Q,Sarcasm Detection in Social Media,Orlando Machine Learning and Data Science Meetup July 2021 Event About the Talk: Ramya Akula is a PhD candidate and a ...,https://i.ytimg.com/vi/6qO1-NEbjxs/default.jpg,120,90,https://i.ytimg.com/vi/6qO1-NEbjxs/mqdefault.jpg,320,180,https://i.ytimg.com/vi/6qO1-NEbjxs/hqdefault.jpg,480,360,OMLDS,none,2021-08-28T17:09:26Z
14,youtube#searchResult,MU9XLsga2d7308TyQwfKEcwpsvk,youtube#video,8B4_mkU_XW0,2021-07-04T07:11:04Z,UCoTuN2KVQHpnAOO9nM9354Q,Multi-language Data Wrangling and Acquisition Conversational Agents,Orlando Machine Learning and Data Science Meetup June 2021 Event About the Talk: Anton Antonov is an applied ...,https://i.ytimg.com/vi/8B4_mkU_XW0/default.jpg,120,90,https://i.ytimg.com/vi/8B4_mkU_XW0/mqdefault.jpg,320,180,https://i.ytimg.com/vi/8B4_mkU_XW0/hqdefault.jpg,480,360,OMLDS,none,2021-07-04T07:11:04Z
15,youtube#searchResult,qilPCzZThznPmvbQ5ngvnKTPLdo,youtube#video,tnKkm0cBM-k,2021-04-19T18:42:10Z,UCoTuN2KVQHpnAOO9nM9354Q,Building a Tableau Dashboard from Scratch,Orlando Machine Learning and Data Science Meetup April 2021 Event About the talk: Maggy will be giving us a step-by-step ...,https://i.ytimg.com/vi/tnKkm0cBM-k/default.jpg,120,90,https://i.ytimg.com/vi/tnKkm0cBM-k/mqdefault.jpg,320,180,https://i.ytimg.com/vi/tnKkm0cBM-k/hqdefault.jpg,480,360,OMLDS,none,2021-04-19T18:42:10Z
16,youtube#searchResult,BMXkQWE_7QqXaeBZKGAlekxb3Mw,youtube#video,evpQkdQL0m8,2021-03-21T23:10:27Z,UCoTuN2KVQHpnAOO9nM9354Q,Modeling Content and Context with Deep Relational Learning,"Orlando Machine Learning and Data Science Meetup March 2021 Event About the talk: For this presentation, Maria gave us an ...",https://i.ytimg.com/vi/evpQkdQL0m8/default.jpg,120,90,https://i.ytimg.com/vi/evpQkdQL0m8/mqdefault.jpg,320,180,https://i.ytimg.com/vi/evpQkdQL0m8/hqdefault.jpg,480,360,OMLDS,none,2021-03-21T23:10:27Z
17,youtube#searchResult,eFzIzceCTMtuUXmFrR1PAllxN1A,youtube#video,4h0T6GLLlUo,2021-02-20T21:50:31Z,UCoTuN2KVQHpnAOO9nM9354Q,Scaling Machine Learning With Python and Dask,Orlando Machine Learning and Data Science Meetup Febraury 2021 Event About the talk: James Lamb presented an introduction ...,https://i.ytimg.com/vi/4h0T6GLLlUo/default.jpg,120,90,https://i.ytimg.com/vi/4h0T6GLLlUo/mqdefault.jpg,320,180,https://i.ytimg.com/vi/4h0T6GLLlUo/hqdefault.jpg,480,360,OMLDS,none,2021-02-20T21:50:31Z
18,youtube#searchResult,cp43uLKZXMBdJ8BxV_JPv9yJR2s,youtube#video,3WfC4Mjl65Q,2021-01-24T01:19:58Z,UCoTuN2KVQHpnAOO9nM9354Q,An Overview of Clustering: K-means and Gaussian Mixtures,Orlando Machine Learning and Data Science Meetup January 2021 Event About the Talk: This talk will cover two classic ...,https://i.ytimg.com/vi/3WfC4Mjl65Q/default.jpg,120,90,https://i.ytimg.com/vi/3WfC4Mjl65Q/mqdefault.jpg,320,180,https://i.ytimg.com/vi/3WfC4Mjl65Q/hqdefault.jpg,480,360,OMLDS,none,2021-01-24T01:19:58Z
19,youtube#searchResult,VAxXBIKkdOD0_gKqz1X6Qwfb9ck,youtube#video,756-rCoLi2E,2020-12-19T21:56:52Z,UCoTuN2KVQHpnAOO9nM9354Q,"Fugue: An Abstraction Layer for Compute Frameworks (Pandas, Spark, and Dask)",Orlando Machine Learning and Data Science Meetup December 2020 Event There is a Kaggle Notebook that accompanies this ...,https://i.ytimg.com/vi/756-rCoLi2E/default.jpg,120,90,https://i.ytimg.com/vi/756-rCoLi2E/mqdefault.jpg,320,180,https://i.ytimg.com/vi/756-rCoLi2E/hqdefault.jpg,480,360,OMLDS,none,2020-12-19T21:56:52Z
20,youtube#searchResult,NOaG1OvsKNTxFzBiCL7ctFGbWHE,youtube#video,odcoi9stYuY,2020-03-28T22:03:08Z,UCoTuN2KVQHpnAOO9nM9354Q,Coronavirus propagation modeling (OMLDS March 2020 session),In this virtual session Dr Antonov will: - Discuss the modeling and evolution of different scenarios of the coronavirus propagation ...,https://i.ytimg.com/vi/odcoi9stYuY/default.jpg,120,90,https://i.ytimg.com/vi/odcoi9stYuY/mqdefault.jpg,320,180,https://i.ytimg.com/vi/odcoi9stYuY/hqdefault.jpg,480,360,OMLDS,none,2020-03-28T22:03:08Z
21,youtube#searchResult,9p9o0eRG5tKkSUFCunz6s3Njd34,youtube#video,AUbQ6UOTt8M,2020-02-05T01:23:56Z,UCoTuN2KVQHpnAOO9nM9354Q,Trash Detection using Panoptic Segmentation ( Detectron 2 ),Garbage or trash management is a challenging task in modern cities around the globe. If automated this problem can be solved to ...,https://i.ytimg.com/vi/AUbQ6UOTt8M/default.jpg,120,90,https://i.ytimg.com/vi/AUbQ6UOTt8M/mqdefault.jpg,320,180,https://i.ytimg.com/vi/AUbQ6UOTt8M/hqdefault.jpg,480,360,OMLDS,none,2020-02-05T01:23:56Z
22,youtube#searchResult,NCbf3b8gvlUu-KFU-KDeZdO8hTw,youtube#video,JcbQ0Kz5UW4,2019-09-30T00:53:19Z,UCoTuN2KVQHpnAOO9nM9354Q,Helping Orlando Through Data Science: Embrace Families and Foster Care (OMLDS),The Orlando Machine Learning and Data Science Meetup (OMLDS) has been working on a volunteer project for Embrace ...,https://i.ytimg.com/vi/JcbQ0Kz5UW4/default.jpg,120,90,https://i.ytimg.com/vi/JcbQ0Kz5UW4/mqdefault.jpg,320,180,https://i.ytimg.com/vi/JcbQ0Kz5UW4/hqdefault.jpg,480,360,OMLDS,none,2019-09-30T00:53:19Z
23,youtube#searchResult,zLlL2UxzoVB7yTNKsc6raUZHPng,youtube#video,-ZqrbpEIi34,2019-09-09T02:46:32Z,UCoTuN2KVQHpnAOO9nM9354Q,Regression Kriging Model for Improved Environmental Data Science Interpolation (OMLDS),"Dan Schmutz is the Chief Environmental Scientist for Greenman-Pedersen, Inc., 1500-person corporation earning the rank of #56 ...",https://i.ytimg.com/vi/-ZqrbpEIi34/default.jpg,120,90,https://i.ytimg.com/vi/-ZqrbpEIi34/mqdefault.jpg,320,180,https://i.ytimg.com/vi/-ZqrbpEIi34/hqdefault.jpg,480,360,OMLDS,none,2019-09-09T02:46:32Z
24,youtube#searchResult,Ip97Vyc9-xuqiYhLhmxFzBiLAQo,youtube#video,g70e6evn5uc,2019-08-22T16:44:20Z,UCoTuN2KVQHpnAOO9nM9354Q,Machine Learning Model Interpretability (OMLDS),"Kevin Kho is a data scientist at Itron, where he works on applications in the electric utility space. In this talk, he'll go over ...",https://i.ytimg.com/vi/g70e6evn5uc/default.jpg,120,90,https://i.ytimg.com/vi/g70e6evn5uc/mqdefault.jpg,320,180,https://i.ytimg.com/vi/g70e6evn5uc/hqdefault.jpg,480,360,OMLDS,none,2019-08-22T16:44:20Z
0,youtube#searchResult,aBsrpOHeTTroegYIWDciVPub_Pc,youtube#video,PwoTb-SxoC0,2024-02-21T18:14:01Z,UC8hI87gt0dmTAIEupEcsckA,Deep Reinforcement Learning for Trading,Join the Hudson and Thames Reading Group: https://hudsonthames.org/reading-group/ This Friday for our weekly reading group ...,https://i.ytimg.com/vi/PwoTb-SxoC0/default.jpg,120,90,https://i.ytimg.com/vi/PwoTb-SxoC0/mqdefault.jpg,320,180,https://i.ytimg.com/vi/PwoTb-SxoC0/hqdefault.jpg,480,360,Hudson & Thames,none,2024-02-21T18:14:01Z
1,youtube#searchResult,L00v_6JhGRxOiEVI90dNss5G_rQ,youtube#video,vyjgR5Ln57s,2024-02-21T18:14:16Z,UC8hI87gt0dmTAIEupEcsckA,Conditional Portfolio Optimization,Join the Hudson and Thames Reading Group: https://hudsonthames.org/reading-group/ In this session we are discussing a paper ...,https://i.ytimg.com/vi/vyjgR5Ln57s/default.jpg,120,90,https://i.ytimg.com/vi/vyjgR5Ln57s/mqdefault.jpg,320,180,https://i.ytimg.com/vi/vyjgR5Ln57s/hqdefault.jpg,480,360,Hudson & Thames,none,2024-02-21T18:14:16Z
2,youtube#searchResult,LUmfh1KZR-N6I97UEpc1qxU2-Go,youtube#video,knPPeV58gHM,2024-02-21T18:12:28Z,UC8hI87gt0dmTAIEupEcsckA,Scientific Discovery in Quantitative Finance,"This lecture we review the first 4 chapters of Marcos Lopez de Prado's latest paper from ADIA Labs, which lays out the foundation ...",https://i.ytimg.com/vi/knPPeV58gHM/default.jpg,120,90,https://i.ytimg.com/vi/knPPeV58gHM/mqdefault.jpg,320,180,https://i.ytimg.com/vi/knPPeV58gHM/hqdefault.jpg,480,360,Hudson & Thames,none,2024-02-21T18:12:28Z
3,youtube#searchResult,OOQhUX7x1vkzL7jwLhw7J0uZH8M,youtube#video,kX_7ocfTS8g,2023-08-21T12:35:00Z,UC8hI87gt0dmTAIEupEcsckA,FinGPT: Open-Source Financial Large Language Models,Join the Hudson and Thames Reading Group: https://hudsonthames.org/reading-group/ We explored the paper and open-source ...,https://i.ytimg.com/vi/kX_7ocfTS8g/default.jpg,120,90,https://i.ytimg.com/vi/kX_7ocfTS8g/mqdefault.jpg,320,180,https://i.ytimg.com/vi/kX_7ocfTS8g/hqdefault.jpg,480,360,Hudson & Thames,none,2023-08-21T12:35:00Z
4,youtube#searchResult,aPfSXKmQABk3IZpgVXL3sW-pH6M,youtube#video,6SfotqCQtag,2023-05-17T13:46:13Z,UC8hI87gt0dmTAIEupEcsckA,"Git, Branching, and Pull Requests","Welcome to our video on Git fundamentals presented by Michael Struwig, the CEO of Hudson & Thames. If you have some basic ...",https://i.ytimg.com/vi/6SfotqCQtag/default.jpg,120,90,https://i.ytimg.com/vi/6SfotqCQtag/mqdefault.jpg,320,180,https://i.ytimg.com/vi/6SfotqCQtag/hqdefault.jpg,480,360,Hudson & Thames,none,2023-05-17T13:46:13Z
0,youtube#searchResult,H867d6xIsovZWGOey6AhsKVinaA,youtube#video,Bti-usPrZt4,2025-11-07T10:30:09Z,UC8kXgHG13XdgsigIPRmrIyA,Advanced Order Types &amp; Comprehensive Risk Management: Algo Trading with Zerodha (Part 5/5),Welcome to the 5th and final part of a 5-video summary series based on the full 11-hour Quantra course: “Algorithmic Trading with ...,https://i.ytimg.com/vi/Bti-usPrZt4/default.jpg,120,90,https://i.ytimg.com/vi/Bti-usPrZt4/mqdefault.jpg,320,180,https://i.ytimg.com/vi/Bti-usPrZt4/hqdefault.jpg,480,360,QuantInsti Quantitative Learning,none,2025-11-07T10:30:09Z
1,youtube#searchResult,uSHDZ9NNunysJZjkLW5c6plILo8,youtube#video,ZCMOaIr3lkY,2025-11-03T11:30:37Z,UC8kXgHG13XdgsigIPRmrIyA,Create Automated Trading Bot: Algorithmic Trading with Zerodha (Part 4/5),Welcome to the Part 4 of a 5-video summary series based on the full 11-hour Quantra course: “Algorithmic Trading with Zerodha ...,https://i.ytimg.com/vi/ZCMOaIr3lkY/default.jpg,120,90,https://i.ytimg.com/vi/ZCMOaIr3lkY/mqdefault.jpg,320,180,https://i.ytimg.com/vi/ZCMOaIr3lkY/hqdefault.jpg,480,360,QuantInsti Quantitative Learning,none,2025-11-03T11:30:37Z
2,youtube#searchResult,TStUoeq2KWVzc2Cq7ZkkU5I215s,youtube#video,k2Z_brTn0_w,2025-10-31T10:30:29Z,UC8kXgHG13XdgsigIPRmrIyA,"Kite Connect Core Trading Operations: Polling vs. WebSocket Ticker, Orders, Positions &amp; Rate Limits",Welcome to the Part 3 of a 5-video summary series based on the full 11-hour Quantra course: “Algorithmic Trading with Zerodha ...,https://i.ytimg.com/vi/k2Z_brTn0_w/default.jpg,120,90,https://i.ytimg.com/vi/k2Z_brTn0_w/mqdefault.jpg,320,180,https://i.ytimg.com/vi/k2Z_brTn0_w/hqdefault.jpg,480,360,QuantInsti Quantitative Learning,none,2025-10-31T10:30:29Z
3,youtube#searchResult,1u-0dvpLESmsP2mwYgCR2r32Bzc,youtube#video,obXpjB-e82I,2025-10-30T10:30:43Z,UC8kXgHG13XdgsigIPRmrIyA,"Future of Data, Trading &amp; The Quant Industry with Decentralized AI",Learn to apply AI and ML in trading in a practical hands-on manner EPAT syllabus on Machine learning & AI: https://bit.ly/3WYekfj ...,https://i.ytimg.com/vi/obXpjB-e82I/default.jpg,120,90,https://i.ytimg.com/vi/obXpjB-e82I/mqdefault.jpg,320,180,https://i.ytimg.com/vi/obXpjB-e82I/hqdefault.jpg,480,360,QuantInsti Quantitative Learning,none,2025-10-30T10:30:43Z
4,youtube#searchResult,7E8EneyEi_uUAomlc1XWHkvx510,youtube#video,-sgDDdQlEmo,2025-10-29T14:30:00Z,UC8kXgHG13XdgsigIPRmrIyA,Where AI Provides the BIGGEST Leverage for Starting a Trading Desk,Discover how AI is transforming modern trading - from research to real alpha generation. From automating grunt work to ...,https://i.ytimg.com/vi/-sgDDdQlEmo/default.jpg,120,90,https://i.ytimg.com/vi/-sgDDdQlEmo/mqdefault.jpg,320,180,https://i.ytimg.com/vi/-sgDDdQlEmo/hqdefault.jpg,480,360,QuantInsti Quantitative Learning,none,2025-10-29T14:30:00Z
0,youtube#searchResult,YdGDCg4ZrrYSAOHPGT0I_8Piayc,youtube#video,3s1YWgG4iP8,2024-03-15T09:21:11Z,UCywHr2wSEj3Fl0u81OIzEoQ,Correlation - Basic intro  #correlationmatrix #datascience #statisticalanalysis,Learn about correlations.,https://i.ytimg.com/vi/3s1YWgG4iP8/default.jpg,120,90,https://i.ytimg.com/vi/3s1YWgG4iP8/mqdefault.jpg,320,180,https://i.ytimg.com/vi/3s1YWgG4iP8/hqdefault.jpg,480,360,HKML,none,2024-03-15T09:21:11Z
1,youtube#searchResult,CVWo5jk8NNVn-kkLYs4hHt6nAug,youtube#video,cFfj-mlwPrU,2024-03-15T03:45:22Z,UCywHr2wSEj3Fl0u81OIzEoQ,Uniform at Heart: Generating Correlation Matrices with the Onion Method,"Dive into the core of statistical simulations with our concise and informative YouTube short, where we explain generating random ...",https://i.ytimg.com/vi/cFfj-mlwPrU/default.jpg,120,90,https://i.ytimg.com/vi/cFfj-mlwPrU/mqdefault.jpg,320,180,https://i.ytimg.com/vi/cFfj-mlwPrU/hqdefault.jpg,480,360,HKML,none,2024-03-15T03:45:22Z
2,youtube#searchResult,rnlz5pZ7-6Xwd_w-hBH1_JYFz00,youtube#video,Ds1kU-rPRL8,2024-01-01T15:35:55Z,UCywHr2wSEj3Fl0u81OIzEoQ,Unlock Trading Success: Master Portfolio Turnover Analysis! #financialeducation #financialmarkets,Dive into our latest YouTube Short to uncover the secrets of effective trading strategies! This video is a must-watch for anyone ...,https://i.ytimg.com/vi/Ds1kU-rPRL8/default.jpg,120,90,https://i.ytimg.com/vi/Ds1kU-rPRL8/mqdefault.jpg,320,180,https://i.ytimg.com/vi/Ds1kU-rPRL8/hqdefault.jpg,480,360,HKML,none,2024-01-01T15:35:55Z
3,youtube#searchResult,qYzncodp3tCyXO5u9R9kgGvA620,youtube#video,VMFN-1zPnsk,2023-12-29T06:30:12Z,UCywHr2wSEj3Fl0u81OIzEoQ,Mastering Portfolio Optimization: The $100 Million Strategy Unveiled!,"Dive into the world of professional portfolio management with our latest YouTube Short. In this insightful video, we unveil the ...",https://i.ytimg.com/vi/VMFN-1zPnsk/default.jpg,120,90,https://i.ytimg.com/vi/VMFN-1zPnsk/mqdefault.jpg,320,180,https://i.ytimg.com/vi/VMFN-1zPnsk/hqdefault.jpg,480,360,HKML,none,2023-12-29T06:30:12Z
