,kind,etag,id.kind,id.videoId,snippet.publishedAt,snippet.channelId,snippet.title,snippet.description,snippet.thumbnails.default.url,snippet.thumbnails.default.width,snippet.thumbnails.default.height,snippet.thumbnails.medium.url,snippet.thumbnails.medium.width,snippet.thumbnails.medium.height,snippet.thumbnails.high.url,snippet.thumbnails.high.width,snippet.thumbnails.high.height,snippet.channelTitle,snippet.liveBroadcastContent,snippet.publishTime
0,youtube#searchResult,L_OY5wHh9S7sQxL-2mqchIE7TQs,youtube#video,k2r7SKTWk1Y,2026-06-24T20:38:24Z,UCOjD18EJYcsBog4IozkF_7w,Turning Messy Tax Data into Structured Insights with NLP,"Levon Chukhajyan speaking at the PyData Yerevan 2025 Monthly Meetup about using NLP to transform messy, multilingual tax ...",https://i.ytimg.com/vi/k2r7SKTWk1Y/default.jpg,120,90,https://i.ytimg.com/vi/k2r7SKTWk1Y/mqdefault.jpg,320,180,https://i.ytimg.com/vi/k2r7SKTWk1Y/hqdefault.jpg,480,360,PyData,none,2026-06-24T20:38:24Z
1,youtube#searchResult,hvATT1PTHqnHxyU7y2oftSsftTY,youtube#video,fRIJ2PazHKQ,2026-06-24T20:35:55Z,UCOjD18EJYcsBog4IozkF_7w,Challenges in Building Production-Ready Machine Translation Systems,"Adam Bittlingmayer, ex-Google, CEO of ModelFront, speaking at the PyData Yerevan 2025 Monthly Meetup about machine ...",https://i.ytimg.com/vi/fRIJ2PazHKQ/default.jpg,120,90,https://i.ytimg.com/vi/fRIJ2PazHKQ/mqdefault.jpg,320,180,https://i.ytimg.com/vi/fRIJ2PazHKQ/hqdefault.jpg,480,360,PyData,none,2026-06-24T20:35:55Z
2,youtube#searchResult,TwZ5Elu7WvHh8Mvu9V6aFjg3dfs,youtube#video,bXiKVFMHagw,2026-06-23T16:20:55Z,UCOjD18EJYcsBog4IozkF_7w,PyData Bradford&#39;s co-founder has one ask for NumFOCUS — and it could help every chapter worldwide,Elizabeth Osanyinro is building PyData Bradford between Leeds and Manchester — and she's got one clear ask for NumFOCUS: ...,https://i.ytimg.com/vi/bXiKVFMHagw/default.jpg,120,90,https://i.ytimg.com/vi/bXiKVFMHagw/mqdefault.jpg,320,180,https://i.ytimg.com/vi/bXiKVFMHagw/hqdefault.jpg,480,360,PyData,none,2026-06-23T16:20:55Z
3,youtube#searchResult,JOCrNf__9qOXggtR-R3k-xden-g,youtube#video,QYDI7r2bed8,2026-06-23T15:57:10Z,UCOjD18EJYcsBog4IozkF_7w,From Archaeology to AI: How Elizabeth Osanyinro Co-Founded PyData Bradford | Give Me 5 S2,"In this episode of Give Me 5, host MK sits down with Elizabeth Osanyinro — co-founder of PyData Bradford and AI & Data Science ...",https://i.ytimg.com/vi/QYDI7r2bed8/default.jpg,120,90,https://i.ytimg.com/vi/QYDI7r2bed8/mqdefault.jpg,320,180,https://i.ytimg.com/vi/QYDI7r2bed8/hqdefault.jpg,480,360,PyData,none,2026-06-23T15:57:10Z
4,youtube#searchResult,gkmr3TFjZgRk8_uAFqrN9X7OmEE,youtube#video,TlNX-wIbt2o,2026-06-22T17:42:48Z,UCOjD18EJYcsBog4IozkF_7w,A shy person who founded a data community. Her advice? Talk to people. GM5 S2E7: Elizabeth Osanyinro,"Elizabeth Osanyinro describes herself as ""an extremely shy person."" She also co-founded PyData Bradford and has been building ...",https://i.ytimg.com/vi/TlNX-wIbt2o/default.jpg,120,90,https://i.ytimg.com/vi/TlNX-wIbt2o/mqdefault.jpg,320,180,https://i.ytimg.com/vi/TlNX-wIbt2o/hqdefault.jpg,480,360,PyData,none,2026-06-22T17:42:48Z
0,youtube#searchResult,Dq0dQ5aR6sh7HDgS4NK0DzBWy0k,youtube#video,cKMEaudFcww,2026-05-24T18:48:27Z,UCtWI06j1EADmEOGj2iJhSyA,Variables and objects in Python: it&#39;s pointers all the way down - Trey Hunner - PyCascades 2026,"In Python, assignment statements don't copy objects, and data structures don't actually contain objects. These two surprising facts ...",https://i.ytimg.com/vi/cKMEaudFcww/default.jpg,120,90,https://i.ytimg.com/vi/cKMEaudFcww/mqdefault.jpg,320,180,https://i.ytimg.com/vi/cKMEaudFcww/hqdefault.jpg,480,360,PyCascades,none,2026-05-24T18:48:27Z
1,youtube#searchResult,mlJFK9cFSpFlNRwr6af6KQAKOAw,youtube#video,TLnfnW_h8Ok,2026-05-23T20:01:52Z,UCtWI06j1EADmEOGj2iJhSyA,When the Baby App Crashed: Coding for Chaos (and Parenthood) - Laura Meng - PyCascades 2026,"As a first-time parent and a developer, I relied on an app to log sleep and feedings. If I was going to lose sleep, at least I'd have ...",https://i.ytimg.com/vi/TLnfnW_h8Ok/default.jpg,120,90,https://i.ytimg.com/vi/TLnfnW_h8Ok/mqdefault.jpg,320,180,https://i.ytimg.com/vi/TLnfnW_h8Ok/hqdefault.jpg,480,360,PyCascades,none,2026-05-23T20:01:52Z
2,youtube#searchResult,nLUi1RvHl6l-AkM6IYjPxSLQvkA,youtube#video,v2XlE4IQfCA,2026-05-23T20:01:52Z,UCtWI06j1EADmEOGj2iJhSyA,"Climbing Out of Fixture Hell, Indirectly - Sammie Jiang - PyCascades 2026","Once you've moved past the basics of assert and test_ functions, developers often run into a new set of challenges when projects ...",https://i.ytimg.com/vi/v2XlE4IQfCA/default.jpg,120,90,https://i.ytimg.com/vi/v2XlE4IQfCA/mqdefault.jpg,320,180,https://i.ytimg.com/vi/v2XlE4IQfCA/hqdefault.jpg,480,360,PyCascades,none,2026-05-23T20:01:52Z
3,youtube#searchResult,iOhDkui4GbgD6PmgoKGy2MVUy20,youtube#video,MZ4Xq2qzWJo,2026-05-23T20:01:52Z,UCtWI06j1EADmEOGj2iJhSyA,Introducing t-strings: f-strings with superpowers - Dave Peck - PyCascades 2026,Python 3.14 introduces t-strings: template string literals that look like f-strings but evaluate to a `Template` instance instead of a ...,https://i.ytimg.com/vi/MZ4Xq2qzWJo/default.jpg,120,90,https://i.ytimg.com/vi/MZ4Xq2qzWJo/mqdefault.jpg,320,180,https://i.ytimg.com/vi/MZ4Xq2qzWJo/hqdefault.jpg,480,360,PyCascades,none,2026-05-23T20:01:52Z
4,youtube#searchResult,sYtoOK7lLktCtqobQ6mMfvGyRKg,youtube#video,Gx6q9L-VPoo,2026-05-23T20:01:50Z,UCtWI06j1EADmEOGj2iJhSyA,There and back again... but by I-5 or the ferry? - Justin Castilla - PyCascades 2026,"Living on Washington State's peninsula offers endless beauty, nature, and commuting challenges. In this talk, I'll share how I built ...",https://i.ytimg.com/vi/Gx6q9L-VPoo/default.jpg,120,90,https://i.ytimg.com/vi/Gx6q9L-VPoo/mqdefault.jpg,320,180,https://i.ytimg.com/vi/Gx6q9L-VPoo/hqdefault.jpg,480,360,PyCascades,none,2026-05-23T20:01:50Z
0,youtube#searchResult,3wObjN0PumTiGv3KblUNqCz3SHs,youtube#video,rkw0jZkZA_U,2022-07-05T09:15:29Z,UCTCV2vonJgaQVb8AdMgdvCA,PyDataMCR - July Talks,Talk Details to be announced SPONSORS Thank you to NUMFocus for sponsoring Meetup and further support.,https://i.ytimg.com/vi/rkw0jZkZA_U/default_live.jpg,120,90,https://i.ytimg.com/vi/rkw0jZkZA_U/mqdefault_live.jpg,320,180,https://i.ytimg.com/vi/rkw0jZkZA_U/hqdefault_live.jpg,480,360,PyDataMCR,upcoming,2022-07-05T09:15:29Z
1,youtube#searchResult,51gYU95neT6e2w_ppFgBOQkCUw8,youtube#video,w_GQgSqLbxc,2022-06-30T06:48:38Z,UCTCV2vonJgaQVb8AdMgdvCA,PyDataMCR - is back!,"Topics, Classification and Reviews - Shaun Hide - @ShaunHide1 With increasing noise around fake reviews and review skews ...",https://i.ytimg.com/vi/w_GQgSqLbxc/default.jpg,120,90,https://i.ytimg.com/vi/w_GQgSqLbxc/mqdefault.jpg,320,180,https://i.ytimg.com/vi/w_GQgSqLbxc/hqdefault.jpg,480,360,PyDataMCR,none,2022-06-30T06:48:38Z
2,youtube#searchResult,ITE-j3kAaFdSumGBNZJUbflKwqA,youtube#video,cik-dqUUiaU,2021-10-27T07:07:06Z,UCTCV2vonJgaQVb8AdMgdvCA,Data Horror Stories with Open Data Manchester &amp; Her+DataMcr 2021,"Do you have a tale of bad stats, strange correlations, malicious intent or plain stupidity? Join us and share your Data Horror ...",https://i.ytimg.com/vi/cik-dqUUiaU/default.jpg,120,90,https://i.ytimg.com/vi/cik-dqUUiaU/mqdefault.jpg,320,180,https://i.ytimg.com/vi/cik-dqUUiaU/hqdefault.jpg,480,360,PyDataMCR,none,2021-10-27T07:07:06Z
3,youtube#searchResult,xrlDvMrjtqNA_HdVBwuUjKfZtos,youtube#video,G7Sm2vzZjZg,2021-08-18T06:21:37Z,UCTCV2vonJgaQVb8AdMgdvCA,Live-Coding - Rain Risk,"""The ship's navigation computer seems to be malfunctioning; rather than giving a route directly to safety, it produced extremely ...",https://i.ytimg.com/vi/G7Sm2vzZjZg/default.jpg,120,90,https://i.ytimg.com/vi/G7Sm2vzZjZg/mqdefault.jpg,320,180,https://i.ytimg.com/vi/G7Sm2vzZjZg/hqdefault.jpg,480,360,PyDataMCR,none,2021-08-18T06:21:37Z
4,youtube#searchResult,OYV5bt919WCC-kjnV6op0tWuiEk,youtube#video,SvNGA5-wIPs,2021-04-28T06:13:46Z,UCTCV2vonJgaQVb8AdMgdvCA,Data FAQs with the UKDS,Data FAQs Some questions come up again and again in relation to data industries. Questions like: * Should I learn R or Python?,https://i.ytimg.com/vi/SvNGA5-wIPs/default.jpg,120,90,https://i.ytimg.com/vi/SvNGA5-wIPs/mqdefault.jpg,320,180,https://i.ytimg.com/vi/SvNGA5-wIPs/hqdefault.jpg,480,360,PyDataMCR,none,2021-04-28T06:13:46Z
0,youtube#searchResult,3wObjN0PumTiGv3KblUNqCz3SHs,youtube#video,rkw0jZkZA_U,2022-07-05T09:15:29Z,UCTCV2vonJgaQVb8AdMgdvCA,PyDataMCR - July Talks,Talk Details to be announced SPONSORS Thank you to NUMFocus for sponsoring Meetup and further support.,https://i.ytimg.com/vi/rkw0jZkZA_U/default_live.jpg,120,90,https://i.ytimg.com/vi/rkw0jZkZA_U/mqdefault_live.jpg,320,180,https://i.ytimg.com/vi/rkw0jZkZA_U/hqdefault_live.jpg,480,360,PyDataMCR,upcoming,2022-07-05T09:15:29Z
1,youtube#searchResult,51gYU95neT6e2w_ppFgBOQkCUw8,youtube#video,w_GQgSqLbxc,2022-06-30T06:48:38Z,UCTCV2vonJgaQVb8AdMgdvCA,PyDataMCR - is back!,"Topics, Classification and Reviews - Shaun Hide - @ShaunHide1 With increasing noise around fake reviews and review skews ...",https://i.ytimg.com/vi/w_GQgSqLbxc/default.jpg,120,90,https://i.ytimg.com/vi/w_GQgSqLbxc/mqdefault.jpg,320,180,https://i.ytimg.com/vi/w_GQgSqLbxc/hqdefault.jpg,480,360,PyDataMCR,none,2022-06-30T06:48:38Z
2,youtube#searchResult,ITE-j3kAaFdSumGBNZJUbflKwqA,youtube#video,cik-dqUUiaU,2021-10-27T07:07:06Z,UCTCV2vonJgaQVb8AdMgdvCA,Data Horror Stories with Open Data Manchester &amp; Her+DataMcr 2021,"Do you have a tale of bad stats, strange correlations, malicious intent or plain stupidity? Join us and share your Data Horror ...",https://i.ytimg.com/vi/cik-dqUUiaU/default.jpg,120,90,https://i.ytimg.com/vi/cik-dqUUiaU/mqdefault.jpg,320,180,https://i.ytimg.com/vi/cik-dqUUiaU/hqdefault.jpg,480,360,PyDataMCR,none,2021-10-27T07:07:06Z
3,youtube#searchResult,xrlDvMrjtqNA_HdVBwuUjKfZtos,youtube#video,G7Sm2vzZjZg,2021-08-18T06:21:37Z,UCTCV2vonJgaQVb8AdMgdvCA,Live-Coding - Rain Risk,"""The ship's navigation computer seems to be malfunctioning; rather than giving a route directly to safety, it produced extremely ...",https://i.ytimg.com/vi/G7Sm2vzZjZg/default.jpg,120,90,https://i.ytimg.com/vi/G7Sm2vzZjZg/mqdefault.jpg,320,180,https://i.ytimg.com/vi/G7Sm2vzZjZg/hqdefault.jpg,480,360,PyDataMCR,none,2021-08-18T06:21:37Z
4,youtube#searchResult,OYV5bt919WCC-kjnV6op0tWuiEk,youtube#video,SvNGA5-wIPs,2021-04-28T06:13:46Z,UCTCV2vonJgaQVb8AdMgdvCA,Data FAQs with the UKDS,Data FAQs Some questions come up again and again in relation to data industries. Questions like: * Should I learn R or Python?,https://i.ytimg.com/vi/SvNGA5-wIPs/default.jpg,120,90,https://i.ytimg.com/vi/SvNGA5-wIPs/mqdefault.jpg,320,180,https://i.ytimg.com/vi/SvNGA5-wIPs/hqdefault.jpg,480,360,PyDataMCR,none,2021-04-28T06:13:46Z
0,youtube#searchResult,HndqQSa58gFY3OcS908SIv9GDns,youtube#video,Nm71G0-wnFU,2024-02-20T02:00:42Z,UC2d_azMgPLw_8JzgbpNb2oQ,PyData Montreal Meetup #24,There is a raw replay of PyData Montreal Meetup #24 with two talks 00:02:15 - 00:49:46 - How we used Python to see how many ...,https://i.ytimg.com/vi/Nm71G0-wnFU/default.jpg,120,90,https://i.ytimg.com/vi/Nm71G0-wnFU/mqdefault.jpg,320,180,https://i.ytimg.com/vi/Nm71G0-wnFU/hqdefault.jpg,480,360,PyData Montreal,none,2024-02-20T02:00:42Z
1,youtube#searchResult,LSWz4fu820BsXsbbsaFzqUSUa2Q,youtube#video,-FFKxz4V9_o,2021-06-29T23:48:14Z,UC2d_azMgPLw_8JzgbpNb2oQ,PyData Montreal #20 with Itamar Turner-Trauring,"Our guest this time is Itamar Turner-Trauring who will present two talks: - ""Small Big Data: using NumPy and Pandas when your ...",https://i.ytimg.com/vi/-FFKxz4V9_o/default.jpg,120,90,https://i.ytimg.com/vi/-FFKxz4V9_o/mqdefault.jpg,320,180,https://i.ytimg.com/vi/-FFKxz4V9_o/hqdefault.jpg,480,360,PyData Montreal,none,2021-06-29T23:48:14Z
2,youtube#searchResult,Iz1ZrNxFmTQzVe2iTtCtuMtFlZo,youtube#video,jNZw_azRlDU,2021-04-22T23:53:51Z,UC2d_azMgPLw_8JzgbpNb2oQ,PyData Montreal #19 with Frederick Reiss and Luciano Resende,"Our speakers this time are: - Frederick Reiss, with a talk ""Text Extensions for Pandas"", and - Luciano Resende with ""Introducing ...",https://i.ytimg.com/vi/jNZw_azRlDU/default.jpg,120,90,https://i.ytimg.com/vi/jNZw_azRlDU/mqdefault.jpg,320,180,https://i.ytimg.com/vi/jNZw_azRlDU/hqdefault.jpg,480,360,PyData Montreal,none,2021-04-22T23:53:51Z
3,youtube#searchResult,HvUDBcYzm_5yL-73nBJ0y024lzs,youtube#video,NrdJOfYisKI,2021-03-20T00:01:15Z,UC2d_azMgPLw_8JzgbpNb2oQ,PyData Montreal #18: Data Engineering and Data Management,"Our speakers this time are: - Ben Rogojan, with a talk ""The Python ETL: Airflow Vs. Luigi"", and - Sergey Karayev, presenting on ...",https://i.ytimg.com/vi/NrdJOfYisKI/default.jpg,120,90,https://i.ytimg.com/vi/NrdJOfYisKI/mqdefault.jpg,320,180,https://i.ytimg.com/vi/NrdJOfYisKI/hqdefault.jpg,480,360,PyData Montreal,none,2021-03-20T00:01:15Z
4,youtube#searchResult,PKoqNuONEhTFxIMcb-qPMLgY0cg,youtube#video,RG-yV5zgqjQ,2021-02-26T01:22:19Z,UC2d_azMgPLw_8JzgbpNb2oQ,PyData Montreal #17: Online meetup on NLP,"Our guests this time are: - Sylvain Gugger, a Research Engineer at Hugging Face and one of the core maintainers of the ...",https://i.ytimg.com/vi/RG-yV5zgqjQ/default.jpg,120,90,https://i.ytimg.com/vi/RG-yV5zgqjQ/mqdefault.jpg,320,180,https://i.ytimg.com/vi/RG-yV5zgqjQ/hqdefault.jpg,480,360,PyData Montreal,none,2021-02-26T01:22:19Z
0,youtube#searchResult,2eQwMt_Y0NiZbJacgAn1p5PDDLA,youtube#video,V04bm-3d6EQ,2026-06-23T15:48:06Z,UCP7jMXSY2xbc3KCAE0MHQ-A,When millions of AI agents meet,The conversation of the moment is focused on one topic: AI agents. Unlike traditional language models that simply respond to a ...,https://i.ytimg.com/vi/V04bm-3d6EQ/default.jpg,120,90,https://i.ytimg.com/vi/V04bm-3d6EQ/mqdefault.jpg,320,180,https://i.ytimg.com/vi/V04bm-3d6EQ/hqdefault.jpg,480,360,Google DeepMind,none,2026-06-23T15:48:06Z
1,youtube#searchResult,p5ufYXpd8z4NL4cfNnkR2oa5gOU,youtube#video,pm5PBbo6l2k,2026-05-26T16:17:10Z,UCP7jMXSY2xbc3KCAE0MHQ-A,Gemini for Science is here. 🧬,,https://i.ytimg.com/vi/pm5PBbo6l2k/default.jpg,120,90,https://i.ytimg.com/vi/pm5PBbo6l2k/mqdefault.jpg,320,180,https://i.ytimg.com/vi/pm5PBbo6l2k/hqdefault.jpg,480,360,Google DeepMind,none,2026-05-26T16:17:10Z
2,youtube#searchResult,vB7gD6_Nf_9sHs4tEtniMTkMYWY,youtube#video,EF1BFaNZN9U,2026-05-22T16:09:49Z,UCP7jMXSY2xbc3KCAE0MHQ-A,"SynthID, our imperceptible watermark for AI-generated content, is expanding to more partners.",,https://i.ytimg.com/vi/EF1BFaNZN9U/default.jpg,120,90,https://i.ytimg.com/vi/EF1BFaNZN9U/mqdefault.jpg,320,180,https://i.ytimg.com/vi/EF1BFaNZN9U/hqdefault.jpg,480,360,Google DeepMind,none,2026-05-22T16:09:49Z
3,youtube#searchResult,z3RjrmMK2XQZWGRiIGrV4R5JdxM,youtube#video,R6mM0m3IZWY,2026-05-20T20:10:43Z,UCP7jMXSY2xbc3KCAE0MHQ-A,Gemini 3.5 Flash has landed.,,https://i.ytimg.com/vi/R6mM0m3IZWY/default.jpg,120,90,https://i.ytimg.com/vi/R6mM0m3IZWY/mqdefault.jpg,320,180,https://i.ytimg.com/vi/R6mM0m3IZWY/hqdefault.jpg,480,360,Google DeepMind,none,2026-05-20T20:10:43Z
4,youtube#searchResult,fn1EEZVo6DC6yw--cAN7cfVjrHE,youtube#video,u3T_0HmNbHM,2026-05-20T00:21:16Z,UCP7jMXSY2xbc3KCAE0MHQ-A,Build your next story with Gemini Omni.,,https://i.ytimg.com/vi/u3T_0HmNbHM/default.jpg,120,90,https://i.ytimg.com/vi/u3T_0HmNbHM/mqdefault.jpg,320,180,https://i.ytimg.com/vi/u3T_0HmNbHM/hqdefault.jpg,480,360,Google DeepMind,none,2026-05-20T00:21:16Z
0,youtube#searchResult,CgKp7iQ2rtmPrDibUqURwV2Wm1o,youtube#video,8ZeL3LWsOUw,2026-05-10T20:20:48Z,UCj09XsAWj-RF9kY4UvBJh_A,AICamp London April Meetup 2026,Two talks from community Spec-Driven Development Methodology The OpenSpec framework utilizes structured proposal and ...,https://i.ytimg.com/vi/8ZeL3LWsOUw/default.jpg,120,90,https://i.ytimg.com/vi/8ZeL3LWsOUw/mqdefault.jpg,320,180,https://i.ytimg.com/vi/8ZeL3LWsOUw/hqdefault.jpg,480,360,AICamp,none,2026-05-10T20:20:48Z
1,youtube#searchResult,8SjnvHrV_ZRk7Ue4x2_Dwyim7EM,youtube#video,T4snlVkfPcU,2026-04-24T01:57:43Z,UCj09XsAWj-RF9kY4UvBJh_A,AI Webinar - Enterprise Scale with AI-Driven Insights,Tech Talk: Stop Paying for Analytics. Just Use Postgres. Enterprise Scale with AI-Driven Insights Speaker: Marko Bocevski (Aiven) ...,https://i.ytimg.com/vi/T4snlVkfPcU/default.jpg,120,90,https://i.ytimg.com/vi/T4snlVkfPcU/mqdefault.jpg,320,180,https://i.ytimg.com/vi/T4snlVkfPcU/hqdefault.jpg,480,360,AICamp,none,2026-04-24T01:57:43Z
2,youtube#searchResult,MYFFsXxETmznC98-B79o3midqXw,youtube#video,ga-hAbQGIqI,2026-04-16T16:56:32Z,UCj09XsAWj-RF9kY4UvBJh_A,AI Deep Dive (Virtual) - AI-Ready Data Framework with Agent Skills,Tech Talk: How to Make Your Data AI-Ready Speaker: Jacob Prall (Snowflake) Abstract: Most AI initiatives fail because they're ...,https://i.ytimg.com/vi/ga-hAbQGIqI/default.jpg,120,90,https://i.ytimg.com/vi/ga-hAbQGIqI/mqdefault.jpg,320,180,https://i.ytimg.com/vi/ga-hAbQGIqI/hqdefault.jpg,480,360,AICamp,none,2026-04-16T16:56:32Z
3,youtube#searchResult,qnF24FeIu2CT5j_9pR9R33IqQas,youtube#video,jAXlXsZ-kU0,2026-04-03T06:12:47Z,UCj09XsAWj-RF9kY4UvBJh_A,AI meetup (San Diego) - A2A Protocol,"Tech talk: Leveraging the A2A Protocol: The What, When, and Why Speaker: Tommy Wagner (Google)",https://i.ytimg.com/vi/jAXlXsZ-kU0/default.jpg,120,90,https://i.ytimg.com/vi/jAXlXsZ-kU0/mqdefault.jpg,320,180,https://i.ytimg.com/vi/jAXlXsZ-kU0/hqdefault.jpg,480,360,AICamp,none,2026-04-03T06:12:47Z
4,youtube#searchResult,CV50ElRhqUKJYdPyaoAW0oZHnVY,youtube#video,gZOFwcAH45A,2026-03-26T21:26:18Z,UCj09XsAWj-RF9kY4UvBJh_A,AI Webinar   Building an AI Ready Data Backbone,"Welcome to the weekly AI Deep Dive Webinar Series (Virtual) with Aiven and Google Cloud. Join us for deep dive tech talks on AI, ...",https://i.ytimg.com/vi/gZOFwcAH45A/default.jpg,120,90,https://i.ytimg.com/vi/gZOFwcAH45A/mqdefault.jpg,320,180,https://i.ytimg.com/vi/gZOFwcAH45A/hqdefault.jpg,480,360,AICamp,none,2026-03-26T21:26:18Z
0,youtube#searchResult,9ySgnAfZjRv7RoJe4QTGIflgR78,youtube#video,Pw4polTZx90,2025-11-21T18:12:41Z,UCuGC1JusVvbOGa__qMtH3QA,"smart content conference oct 19 2010 welcome, Seth Grimes, Laurel Earhart","Smart Content Conference, October 19, 2010 in New York.",https://i.ytimg.com/vi/Pw4polTZx90/default.jpg,120,90,https://i.ytimg.com/vi/Pw4polTZx90/mqdefault.jpg,320,180,https://i.ytimg.com/vi/Pw4polTZx90/hqdefault.jpg,480,360,Natural Language Processing presentations,none,2025-11-21T18:12:41Z
1,youtube#searchResult,QCWFfU4_Ebcx4dRPpM6Zix_jb2Q,youtube#video,Hyp6ByQlCXI,2025-11-21T18:11:17Z,UCuGC1JusVvbOGa__qMtH3QA,"temis lightning talk, Guillaume Mazières","Smart Content Conference, October 19, 2010 in New York.",https://i.ytimg.com/vi/Hyp6ByQlCXI/default.jpg,120,90,https://i.ytimg.com/vi/Hyp6ByQlCXI/mqdefault.jpg,320,180,https://i.ytimg.com/vi/Hyp6ByQlCXI/hqdefault.jpg,480,360,Natural Language Processing presentations,none,2025-11-21T18:11:17Z
2,youtube#searchResult,9qE9_qswOZ73VxWSr-jgS140epw,youtube#video,7_Es1r6panQ,2025-11-21T18:11:32Z,UCuGC1JusVvbOGa__qMtH3QA,"delivering richer, smarter, targeted content, michael o lavitt","Smart Content Conference, October 19, 2010 in New York.",https://i.ytimg.com/vi/7_Es1r6panQ/default.jpg,120,90,https://i.ytimg.com/vi/7_Es1r6panQ/mqdefault.jpg,320,180,https://i.ytimg.com/vi/7_Es1r6panQ/hqdefault.jpg,480,360,Natural Language Processing presentations,none,2025-11-21T18:11:32Z
3,youtube#searchResult,tzeGbkYo599K6am8N_nJAzxLxRQ,youtube#video,TufdWzrHt9k,2025-11-21T18:11:45Z,UCuGC1JusVvbOGa__qMtH3QA,"analyst tools, competitive analysis, and market intelligence, fred wergeles","Smart Content Conference, October 19, 2010 in New York.",https://i.ytimg.com/vi/TufdWzrHt9k/default.jpg,120,90,https://i.ytimg.com/vi/TufdWzrHt9k/mqdefault.jpg,320,180,https://i.ytimg.com/vi/TufdWzrHt9k/hqdefault.jpg,480,360,Natural Language Processing presentations,none,2025-11-21T18:11:45Z
4,youtube#searchResult,XI8Q9JWvoOrubQTfVZaOA3oRVT8,youtube#video,aomKq3iqEUI,2025-11-21T18:12:03Z,UCuGC1JusVvbOGa__qMtH3QA,"linguamatics lightning talk, smart content, david milward","Smart Content Conference, October 19, 2010 in New York.",https://i.ytimg.com/vi/aomKq3iqEUI/default.jpg,120,90,https://i.ytimg.com/vi/aomKq3iqEUI/mqdefault.jpg,320,180,https://i.ytimg.com/vi/aomKq3iqEUI/hqdefault.jpg,480,360,Natural Language Processing presentations,none,2025-11-21T18:12:03Z
0,youtube#searchResult,pqlAh5TGNgX_MUxbE_0Cl_UEA1o,youtube#video,5V68N0wOlCQ,2026-06-24T16:00:39Z,UCBp3w4DCEC64FZr4k9ROxig,AI Gets Rewarded For Lying To You,It's really interesting how Dan Klein thinks about hallucinations. His argument: every output from an LLM is technically a ...,https://i.ytimg.com/vi/5V68N0wOlCQ/default.jpg,120,90,https://i.ytimg.com/vi/5V68N0wOlCQ/mqdefault.jpg,320,180,https://i.ytimg.com/vi/5V68N0wOlCQ/hqdefault.jpg,480,360,Weights & Biases,none,2026-06-24T16:00:39Z
1,youtube#searchResult,0Jr3SJEuN1cCDCEecexvg9VXJ9c,youtube#video,qCX031uijlg,2026-06-22T16:00:02Z,UCBp3w4DCEC64FZr4k9ROxig,The FDA is slowing American companies?,Why are American biotech companies running their clinical trials in China and Australia? Because the FDA makes it nearly ...,https://i.ytimg.com/vi/qCX031uijlg/default.jpg,120,90,https://i.ytimg.com/vi/qCX031uijlg/mqdefault.jpg,320,180,https://i.ytimg.com/vi/qCX031uijlg/hqdefault.jpg,480,360,Weights & Biases,none,2026-06-22T16:00:02Z
2,youtube#searchResult,5FY0gRoU2nrFroNjwcAvIRYxShU,youtube#video,jm8b8WWtAMA,2026-06-19T16:00:15Z,UCBp3w4DCEC64FZr4k9ROxig,Every AI output is a hallucination,"""My mission is to build technologies that can't lie."" That's Dan Klein on this week's Gradient Dissent. Dan is a Berkeley computer ...",https://i.ytimg.com/vi/jm8b8WWtAMA/default.jpg,120,90,https://i.ytimg.com/vi/jm8b8WWtAMA/mqdefault.jpg,320,180,https://i.ytimg.com/vi/jm8b8WWtAMA/hqdefault.jpg,480,360,Weights & Biases,none,2026-06-19T16:00:15Z
3,youtube#searchResult,VDIfo1-lOBhc_seSutE1VoEmqnc,youtube#video,JzETCk92Izw,2026-06-16T16:00:27Z,UCBp3w4DCEC64FZr4k9ROxig,"He&#39;s Building an AI That Can&#39;t Lie | Dan Klein, Scaled Cognition","""We are going to switch from the problem in AI being that nothing works to the problem being that everything works."" Dan Klein ...",https://i.ytimg.com/vi/JzETCk92Izw/default.jpg,120,90,https://i.ytimg.com/vi/JzETCk92Izw/mqdefault.jpg,320,180,https://i.ytimg.com/vi/JzETCk92Izw/hqdefault.jpg,480,360,Weights & Biases,none,2026-06-16T16:00:27Z
4,youtube#searchResult,cqHIObeAG1ZPqREAcczis9kxeCc,youtube#video,1_Qa_158VU0,2026-06-08T15:01:44Z,UCBp3w4DCEC64FZr4k9ROxig,Physics is Solved,"""There are no unsolved problems left in physics."" Devoid of things to solve, Samuel Rodriques moved to the one field nobody has ...",https://i.ytimg.com/vi/1_Qa_158VU0/default.jpg,120,90,https://i.ytimg.com/vi/1_Qa_158VU0/mqdefault.jpg,320,180,https://i.ytimg.com/vi/1_Qa_158VU0/hqdefault.jpg,480,360,Weights & Biases,none,2026-06-08T15:01:44Z
0,youtube#searchResult,e2QFjBpI331_-66_FBYpqE_mFIM,youtube#video,xPfyonOwNGQ,2025-03-27T09:56:07Z,UCpwC9QC0lWaEJ85MoMRFvrA,Ali Behrouz | Titans: Learning to Memorize at Test Time,Organised by Evolution AI - AI data extraction from financial documents - https://www.evolution.ai/ Abstract: Over more than a ...,https://i.ytimg.com/vi/xPfyonOwNGQ/default.jpg,120,90,https://i.ytimg.com/vi/xPfyonOwNGQ/mqdefault.jpg,320,180,https://i.ytimg.com/vi/xPfyonOwNGQ/hqdefault.jpg,480,360,London Machine Learning Meetup,none,2025-03-27T09:56:07Z
1,youtube#searchResult,7W6es-Dur7zCcrOLcyZGcFwz4Lo,youtube#video,ZGEnbW5z8S4,2024-11-28T09:50:05Z,UCpwC9QC0lWaEJ85MoMRFvrA,Hugo Laurençon | What Matters When Building Vision-Language Models?,Organised by Evolution AI - AI data extraction from financial documents - https://www.evolution.ai/ Abstract: The growing interest in ...,https://i.ytimg.com/vi/ZGEnbW5z8S4/default.jpg,120,90,https://i.ytimg.com/vi/ZGEnbW5z8S4/mqdefault.jpg,320,180,https://i.ytimg.com/vi/ZGEnbW5z8S4/hqdefault.jpg,480,360,London Machine Learning Meetup,none,2024-11-28T09:50:05Z
2,youtube#searchResult,6fYb1SavWe2uFSuSlcARxL1ZRJE,youtube#video,BvjDugSSF3c,2024-10-15T14:14:18Z,UCpwC9QC0lWaEJ85MoMRFvrA,Harish Tayyar Madabushi | Emergent Abilities in Large Language Models,Organised by Evolution AI - AI-powered data extraction from financial documents: https://www.evolution.ai/ Sponsored by Man ...,https://i.ytimg.com/vi/BvjDugSSF3c/default.jpg,120,90,https://i.ytimg.com/vi/BvjDugSSF3c/mqdefault.jpg,320,180,https://i.ytimg.com/vi/BvjDugSSF3c/hqdefault.jpg,480,360,London Machine Learning Meetup,none,2024-10-15T14:14:18Z
3,youtube#searchResult,e-u_A4rJieGryA10aqJ_CV8d3Yw,youtube#video,9UaXOCHTI-Q,2024-09-20T09:44:00Z,UCpwC9QC0lWaEJ85MoMRFvrA,Yong Jae Lee | Next Steps in Generalist Multimodal Models,Organised by Evolution AI - AI data extraction from financial documents - https://www.evolution.ai/ Title: Next Steps in Generalist ...,https://i.ytimg.com/vi/9UaXOCHTI-Q/default.jpg,120,90,https://i.ytimg.com/vi/9UaXOCHTI-Q/mqdefault.jpg,320,180,https://i.ytimg.com/vi/9UaXOCHTI-Q/hqdefault.jpg,480,360,London Machine Learning Meetup,none,2024-09-20T09:44:00Z
4,youtube#searchResult,ec5aenyh7tdEMoT5EXEtsJmRPY0,youtube#video,kDVY2f4Y8l0,2024-08-16T09:19:34Z,UCpwC9QC0lWaEJ85MoMRFvrA,Brett Larsen | The Importance of High-Quality Data in Building Your LLMs: Lessons from DBRX,"NOTE* Due to a recording error, the first minute of the Meetup isn't available. Organised by Evolution AI - AI data extraction from ...",https://i.ytimg.com/vi/kDVY2f4Y8l0/default.jpg,120,90,https://i.ytimg.com/vi/kDVY2f4Y8l0/mqdefault.jpg,320,180,https://i.ytimg.com/vi/kDVY2f4Y8l0/hqdefault.jpg,480,360,London Machine Learning Meetup,none,2024-08-16T09:19:34Z
0,youtube#searchResult,l6YOFUZ4ytt5ykxdJYZGU5pf2Uo,youtube#video,Dr6jw-WAd9E,2025-12-29T03:44:20Z,UCZHmQk67mSJgfCCTn7xBfew,Traditional X-Mas Stream,Letsgooo.,https://i.ytimg.com/vi/Dr6jw-WAd9E/default.jpg,120,90,https://i.ytimg.com/vi/Dr6jw-WAd9E/mqdefault.jpg,320,180,https://i.ytimg.com/vi/Dr6jw-WAd9E/hqdefault.jpg,480,360,Yannic Kilcher,none,2025-12-29T03:44:20Z
