,kind,etag,id.kind,id.videoId,snippet.publishedAt,snippet.channelId,snippet.title,snippet.description,snippet.thumbnails.default.url,snippet.thumbnails.default.width,snippet.thumbnails.default.height,snippet.thumbnails.medium.url,snippet.thumbnails.medium.width,snippet.thumbnails.medium.height,snippet.thumbnails.high.url,snippet.thumbnails.high.width,snippet.thumbnails.high.height,snippet.channelTitle,snippet.liveBroadcastContent,snippet.publishTime
22,youtube#searchResult,FSb5Wmc0pvVy67juLUJea6iUkxU,youtube#video,qYhXCELk05E,2025-07-30T09:47:19Z,UCKPSmMfDsXTKrCZApukcJ7A,Agentic Al Programming with Python - Talk Python to Me Ep. 517,Agentic AI programming is what happens when coding assistants stop acting like autocomplete and start collaborating on real ...,https://i.ytimg.com/vi/qYhXCELk05E/default.jpg,120,90,https://i.ytimg.com/vi/qYhXCELk05E/mqdefault.jpg,320,180,https://i.ytimg.com/vi/qYhXCELk05E/hqdefault.jpg,480,360,Talk Python,none,2025-07-30T09:47:19Z
23,youtube#searchResult,emkh5PGPsUAcaMNbMGP4zo0tgdI,youtube#video,p8utoU77P5g,2025-07-13T15:01:27Z,UCKPSmMfDsXTKrCZApukcJ7A,Storytelling Tool or Scratch Pad?,Notebooks were designed for literate programming: telling a story with code. But most of us? We just scribble and explore.,https://i.ytimg.com/vi/p8utoU77P5g/default.jpg,120,90,https://i.ytimg.com/vi/p8utoU77P5g/mqdefault.jpg,320,180,https://i.ytimg.com/vi/p8utoU77P5g/hqdefault.jpg,480,360,Talk Python,none,2025-07-13T15:01:27Z
24,youtube#searchResult,Ie1gtDh2OCT724ry33Ul8knD_Bc,youtube#video,J8BkmEobd5s,2025-07-12T15:00:35Z,UCKPSmMfDsXTKrCZApukcJ7A,The Advice That Changed My Data Science Career,"If you write better code, you can do more data science faster.” One comment that flipped my approach — and led to writing a book ...",https://i.ytimg.com/vi/J8BkmEobd5s/default.jpg,120,90,https://i.ytimg.com/vi/J8BkmEobd5s/mqdefault.jpg,320,180,https://i.ytimg.com/vi/J8BkmEobd5s/hqdefault.jpg,480,360,Talk Python,none,2025-07-12T15:00:35Z
0,youtube#searchResult,IfixoTfW62xksgPP2UC9ZbJkdgg,youtube#video,oVLswjM0RRs,2025-08-31T08:03:54Z,UCH_2cuWzFMyCPvm75lJJ6wg,"Launching, failing &amp; growing AI business &amp; teams through challeges &amp; AI trends by Melina Katkic","Melina will share her journey as the leader of NordAxon, a pioneering AI studio at the forefront of delivering groundbreaking AI ...",https://i.ytimg.com/vi/oVLswjM0RRs/default.jpg,120,90,https://i.ytimg.com/vi/oVLswjM0RRs/mqdefault.jpg,320,180,https://i.ytimg.com/vi/oVLswjM0RRs/hqdefault.jpg,480,360,PyCon Sweden,none,2025-08-31T08:03:54Z
1,youtube#searchResult,cahI4AbiL1HlloDSn98mnj5WJ2g,youtube#video,JCrgQ1vpX24,2025-08-31T08:03:52Z,UCH_2cuWzFMyCPvm75lJJ6wg,I want to deploy my Flask app by Javier de la Puente | PyConSe | 2024,"After creating a great web app using Python such as with flask, the next hurdle to production is how to make it available to users ...",https://i.ytimg.com/vi/JCrgQ1vpX24/default.jpg,120,90,https://i.ytimg.com/vi/JCrgQ1vpX24/mqdefault.jpg,320,180,https://i.ytimg.com/vi/JCrgQ1vpX24/hqdefault.jpg,480,360,PyCon Sweden,none,2025-08-31T08:03:52Z
2,youtube#searchResult,lnzGFn-X2aPufFoVpjVtwdIC5xA,youtube#video,QuaomKzcH9A,2025-08-31T08:03:52Z,UCH_2cuWzFMyCPvm75lJJ6wg,Advanced parsing of structured data using Python&#39;s new match statement by Marc-André Lemburg,"The match statement was introduced in Python 3.10, but has not yet seen wide adoption. This talk will highlight practical use ...",https://i.ytimg.com/vi/QuaomKzcH9A/default.jpg,120,90,https://i.ytimg.com/vi/QuaomKzcH9A/mqdefault.jpg,320,180,https://i.ytimg.com/vi/QuaomKzcH9A/hqdefault.jpg,480,360,PyCon Sweden,none,2025-08-31T08:03:52Z
3,youtube#searchResult,inlt6RJF1WTbD6SZb5uOOvhBBFA,youtube#video,1tSBYwX867I,2025-08-31T08:03:52Z,UCH_2cuWzFMyCPvm75lJJ6wg,"Shopping Assistants with GenAI: Frameworks, Prompt Evaluation, LLMOps and more by Dominik Haitz",Developing LLM-based products in Python comes with a lot of questions: Should I use an existing LLM framework? How to ...,https://i.ytimg.com/vi/1tSBYwX867I/default.jpg,120,90,https://i.ytimg.com/vi/1tSBYwX867I/mqdefault.jpg,320,180,https://i.ytimg.com/vi/1tSBYwX867I/hqdefault.jpg,480,360,PyCon Sweden,none,2025-08-31T08:03:52Z
4,youtube#searchResult,8z_x2m-XjhrMuTtQiigHyDrEMLw,youtube#video,_HFMu6wJmOw,2025-08-31T08:03:54Z,UCH_2cuWzFMyCPvm75lJJ6wg,PyCon 2024 Opening Session by Dr. Aris Nivorlis | PyConSe | 2024,https://pretalx.com/pyconse-2024/talk/JFQDFJ/ #pyconse #pyconse2024.,https://i.ytimg.com/vi/_HFMu6wJmOw/default.jpg,120,90,https://i.ytimg.com/vi/_HFMu6wJmOw/mqdefault.jpg,320,180,https://i.ytimg.com/vi/_HFMu6wJmOw/hqdefault.jpg,480,360,PyCon Sweden,none,2025-08-31T08:03:54Z
5,youtube#searchResult,63_fhV0YA_USmrhrUXI6ItztxJU,youtube#video,um-ow3Ip_7s,2025-08-31T08:03:54Z,UCH_2cuWzFMyCPvm75lJJ6wg,Django Ninja for API Development: Lessons from Energy Market by Anastasia and Beatriz | PyConSe 2024,"Django Ninja for API Development: Lessons from Energy Market ""In this talk, we will dive into how Django Ninja has transformed ...",https://i.ytimg.com/vi/um-ow3Ip_7s/default.jpg,120,90,https://i.ytimg.com/vi/um-ow3Ip_7s/mqdefault.jpg,320,180,https://i.ytimg.com/vi/um-ow3Ip_7s/hqdefault.jpg,480,360,PyCon Sweden,none,2025-08-31T08:03:54Z
6,youtube#searchResult,jZ-C5l2gfJgE43IKtsPM6-ipDxg,youtube#video,l2ZXwdVIhp4,2025-08-31T08:03:54Z,UCH_2cuWzFMyCPvm75lJJ6wg,It&#39;s About Time by Petter Salminen | PyConSe | 2024,"""It's About Time is set out to be an overview of time programming, to enlighten about the particular pitfalls and general problem ...",https://i.ytimg.com/vi/l2ZXwdVIhp4/default.jpg,120,90,https://i.ytimg.com/vi/l2ZXwdVIhp4/mqdefault.jpg,320,180,https://i.ytimg.com/vi/l2ZXwdVIhp4/hqdefault.jpg,480,360,PyCon Sweden,none,2025-08-31T08:03:54Z
7,youtube#searchResult,X8c9i9bEjk8-WfEnrn2e1j9DT_w,youtube#video,dBwigzPjjQw,2025-08-31T08:03:54Z,UCH_2cuWzFMyCPvm75lJJ6wg,The Art of Breaking and Entering by Jesper Larsson | PyConSe | 2024,"A Year in the Life of a Penetration Tester In the world of penetration testing, success is as much about creativity and intuition as it ...",https://i.ytimg.com/vi/dBwigzPjjQw/default.jpg,120,90,https://i.ytimg.com/vi/dBwigzPjjQw/mqdefault.jpg,320,180,https://i.ytimg.com/vi/dBwigzPjjQw/hqdefault.jpg,480,360,PyCon Sweden,none,2025-08-31T08:03:54Z
8,youtube#searchResult,7I9YrIu7rOYgQ6FYKRFOCq5Rqv8,youtube#video,yrLH436pFYw,2025-08-31T08:03:55Z,UCH_2cuWzFMyCPvm75lJJ6wg,A challenge of converting a project&#39;s core to asyncio by Petr Savelyev | PyConSe | 2024,"Pyroute2 is a relatively large project with a history spanning about 10 years, primarily built around synchronous, ...",https://i.ytimg.com/vi/yrLH436pFYw/default.jpg,120,90,https://i.ytimg.com/vi/yrLH436pFYw/mqdefault.jpg,320,180,https://i.ytimg.com/vi/yrLH436pFYw/hqdefault.jpg,480,360,PyCon Sweden,none,2025-08-31T08:03:55Z
9,youtube#searchResult,AAWMlONRSeCb3cWPx1Eu_uvAheU,youtube#video,AyqVu9qDf78,2025-08-31T08:03:52Z,UCH_2cuWzFMyCPvm75lJJ6wg,Parallel Python: Embracing the Future with Sub-Interpreters and Free Threading by  Shekhar Koirala,Step into the future of Python with Parallel Python: Embracing the Future with Sub-Interpreters and Free Threading. This talk dives ...,https://i.ytimg.com/vi/AyqVu9qDf78/default.jpg,120,90,https://i.ytimg.com/vi/AyqVu9qDf78/mqdefault.jpg,320,180,https://i.ytimg.com/vi/AyqVu9qDf78/hqdefault.jpg,480,360,PyCon Sweden,none,2025-08-31T08:03:52Z
10,youtube#searchResult,-ixzBXQoHw5vaX5WFsQr_NwXMIE,youtube#video,BIiYTpFpM6Q,2025-08-31T08:03:52Z,UCH_2cuWzFMyCPvm75lJJ6wg,Boring Releases: How We Ship Every Week Without Drama by Kristoffer Nordstrom | PyConSe | 2024,"""In this talk I want to tell you the story of how my best friend pulled me into working with a customer because he, the architect, ...",https://i.ytimg.com/vi/BIiYTpFpM6Q/default.jpg,120,90,https://i.ytimg.com/vi/BIiYTpFpM6Q/mqdefault.jpg,320,180,https://i.ytimg.com/vi/BIiYTpFpM6Q/hqdefault.jpg,480,360,PyCon Sweden,none,2025-08-31T08:03:52Z
11,youtube#searchResult,lDhwrappN-VHQPmFD-R-pRnkK0s,youtube#video,PuXK7PjKA0c,2025-08-31T08:03:52Z,UCH_2cuWzFMyCPvm75lJJ6wg,Lighting Talks | PyConSe | 2024,pyconse #pyconse2024.,https://i.ytimg.com/vi/PuXK7PjKA0c/default.jpg,120,90,https://i.ytimg.com/vi/PuXK7PjKA0c/mqdefault.jpg,320,180,https://i.ytimg.com/vi/PuXK7PjKA0c/hqdefault.jpg,480,360,PyCon Sweden,none,2025-08-31T08:03:52Z
12,youtube#searchResult,yJg146XJfC7zn5i_i_RRw3J-cp8,youtube#video,JtWx3ZU-Oss,2025-08-31T08:03:52Z,UCH_2cuWzFMyCPvm75lJJ6wg,Building Python based AI Systems with LLMs by Aleksey Veresov | PyConSe | 2024,"LLMs are now capable of translating user queries into small Python programs. In this talk, we will look at how we create AI ...",https://i.ytimg.com/vi/JtWx3ZU-Oss/default.jpg,120,90,https://i.ytimg.com/vi/JtWx3ZU-Oss/mqdefault.jpg,320,180,https://i.ytimg.com/vi/JtWx3ZU-Oss/hqdefault.jpg,480,360,PyCon Sweden,none,2025-08-31T08:03:52Z
13,youtube#searchResult,gXyoXT0BPj5OO6cBWF2gxcvy1-o,youtube#video,mMkAOrtUp68,2025-08-31T08:03:54Z,UCH_2cuWzFMyCPvm75lJJ6wg,"Keynote: Beyond the &quot;Hello, world!&quot;: from the core to you! by Cristián Maureira-Fredes PyConSe 2024","""Depending on who you ask, the meaning of Python will vary significantly. For some people, it could refer to the standard ...",https://i.ytimg.com/vi/mMkAOrtUp68/default.jpg,120,90,https://i.ytimg.com/vi/mMkAOrtUp68/mqdefault.jpg,320,180,https://i.ytimg.com/vi/mMkAOrtUp68/hqdefault.jpg,480,360,PyCon Sweden,none,2025-08-31T08:03:54Z
14,youtube#searchResult,P3K58JNkTbrGRzXFQ7aYAlxaloc,youtube#video,ntaCFGkfZJs,2025-08-31T08:03:54Z,UCH_2cuWzFMyCPvm75lJJ6wg,Documenting Python Code by Christian Heitzmann | PyConSe | 2024,Unlock the power of well-documented code! Join me for a quick dive into Python documentation essentials—learn about ...,https://i.ytimg.com/vi/ntaCFGkfZJs/default.jpg,120,90,https://i.ytimg.com/vi/ntaCFGkfZJs/mqdefault.jpg,320,180,https://i.ytimg.com/vi/ntaCFGkfZJs/hqdefault.jpg,480,360,PyCon Sweden,none,2025-08-31T08:03:54Z
15,youtube#searchResult,B_d2_91dyIF3lSXfI6BZzrfZwg4,youtube#video,F9T1lpJITkM,2025-08-31T08:03:52Z,UCH_2cuWzFMyCPvm75lJJ6wg,Let&#39;s goto work by Marcus Näslund | PyConSe | 2024,"Languages evolve. But how? The infamous ""goto"" keyword, which for good reason is missing from Python, is a surprisingly ""easy"" ...",https://i.ytimg.com/vi/F9T1lpJITkM/default.jpg,120,90,https://i.ytimg.com/vi/F9T1lpJITkM/mqdefault.jpg,320,180,https://i.ytimg.com/vi/F9T1lpJITkM/hqdefault.jpg,480,360,PyCon Sweden,none,2025-08-31T08:03:52Z
16,youtube#searchResult,UiIpTAnArvXa8dq5GuDLLIPO090,youtube#video,tYdyVwxBWzA,2025-08-31T08:03:54Z,UCH_2cuWzFMyCPvm75lJJ6wg,Controlling lab and production equipment with Python by Ulrik Södergren | PyConSe | 2024,"""In this talk you will learn how to control and monitor physical hardware to automate repetitive work in electronics, X-ray or any ...",https://i.ytimg.com/vi/tYdyVwxBWzA/default.jpg,120,90,https://i.ytimg.com/vi/tYdyVwxBWzA/mqdefault.jpg,320,180,https://i.ytimg.com/vi/tYdyVwxBWzA/hqdefault.jpg,480,360,PyCon Sweden,none,2025-08-31T08:03:54Z
17,youtube#searchResult,3ixgwO-xYWxxQxnwr7GqT7DYu2U,youtube#video,EIxehIFNbrk,2025-08-31T08:03:52Z,UCH_2cuWzFMyCPvm75lJJ6wg,Through the ups and downs and beyond a down-to-earth guide to site reliability by Magdalena Stenius,"You're not Google, and neither are we!” is a common sentence we hear when someone mentions SRE, or site reliability ...",https://i.ytimg.com/vi/EIxehIFNbrk/default.jpg,120,90,https://i.ytimg.com/vi/EIxehIFNbrk/mqdefault.jpg,320,180,https://i.ytimg.com/vi/EIxehIFNbrk/hqdefault.jpg,480,360,PyCon Sweden,none,2025-08-31T08:03:52Z
18,youtube#searchResult,0plyDXs-KgavuXWy3NUJ4oonkW8,youtube#video,VWuKmerpMuU,2025-08-31T08:03:52Z,UCH_2cuWzFMyCPvm75lJJ6wg,"Get old, go slow, write code! by Tobias Modig | Pyconse | 2024","""Turning old as a developer is hard. It is hard to stay relevant, hard to keep up with the competition of newcomers and hard to ...",https://i.ytimg.com/vi/VWuKmerpMuU/default.jpg,120,90,https://i.ytimg.com/vi/VWuKmerpMuU/mqdefault.jpg,320,180,https://i.ytimg.com/vi/VWuKmerpMuU/hqdefault.jpg,480,360,PyCon Sweden,none,2025-08-31T08:03:52Z
19,youtube#searchResult,ngBFp_FYOqGrf3GUO4YF9vSBiSA,youtube#video,rn4CBaYdsAs,2025-08-31T08:03:54Z,UCH_2cuWzFMyCPvm75lJJ6wg,Tech as a Gateway: Unlocking Opportunities for Women and Immigrants in the Digital Age  by Saaya,"Tech as a Gateway: Unlocking Opportunities for Women and Immigrants in the Digital Age by Saaya Sorrells-Weatherford ""In an ...",https://i.ytimg.com/vi/rn4CBaYdsAs/default.jpg,120,90,https://i.ytimg.com/vi/rn4CBaYdsAs/mqdefault.jpg,320,180,https://i.ytimg.com/vi/rn4CBaYdsAs/hqdefault.jpg,480,360,PyCon Sweden,none,2025-08-31T08:03:54Z
20,youtube#searchResult,2wiYeG_QDhJ4Du1inv8w_3wPtcI,youtube#video,xxl4Yp51kpI,2025-08-31T08:03:56Z,UCH_2cuWzFMyCPvm75lJJ6wg,Query your structured data with a LangChain AI agent  by Christophe Bornet | PyConSe | 2024,"""In this talk, we will explore the capabilities of LangChain, a versatile framework tailored for the development of applications ...",https://i.ytimg.com/vi/xxl4Yp51kpI/default.jpg,120,90,https://i.ytimg.com/vi/xxl4Yp51kpI/mqdefault.jpg,320,180,https://i.ytimg.com/vi/xxl4Yp51kpI/hqdefault.jpg,480,360,PyCon Sweden,none,2025-08-31T08:03:56Z
21,youtube#searchResult,it0q3uqmjYgBAETBrRpAQUmOTsY,youtube#video,pjVni5fw3ME,2025-08-31T08:03:54Z,UCH_2cuWzFMyCPvm75lJJ6wg,Enhancing CI/CD Workflows with Design Patterns in Python  by Saad Hasan | PyConSe | 2024,This proposal outlines a strategy to improve our Continuous Integration (CI) and Continuous Deployment (CD) processes by ...,https://i.ytimg.com/vi/pjVni5fw3ME/default.jpg,120,90,https://i.ytimg.com/vi/pjVni5fw3ME/mqdefault.jpg,320,180,https://i.ytimg.com/vi/pjVni5fw3ME/hqdefault.jpg,480,360,PyCon Sweden,none,2025-08-31T08:03:54Z
22,youtube#searchResult,HgMnaBIvFPjal2o1GtXrCe1kKa8,youtube#video,vGSYj_5tGmY,2025-08-31T08:03:55Z,UCH_2cuWzFMyCPvm75lJJ6wg,Accidentally popular: Beautiful CLI interfaces with rich-click by Phil Ewels| PyConSe | 2024,"""In the past few years, Will McGugan's Rich for formatting terminal outputs has had a meteoric rise in the Python community.",https://i.ytimg.com/vi/vGSYj_5tGmY/default.jpg,120,90,https://i.ytimg.com/vi/vGSYj_5tGmY/mqdefault.jpg,320,180,https://i.ytimg.com/vi/vGSYj_5tGmY/hqdefault.jpg,480,360,PyCon Sweden,none,2025-08-31T08:03:55Z
23,youtube#searchResult,UyrBx7SmBCdXfT5XED0ngvcmTo0,youtube#video,ns0XVzzbdpg,2024-09-25T14:28:48Z,UCH_2cuWzFMyCPvm75lJJ6wg,Harry Potter and the Elastic Python Clients by Iulia Feroli,"Abstract: We will create a search application by indexing the Harry Potter books, and enrich it with vector search, embeddings and ...",https://i.ytimg.com/vi/ns0XVzzbdpg/default.jpg,120,90,https://i.ytimg.com/vi/ns0XVzzbdpg/mqdefault.jpg,320,180,https://i.ytimg.com/vi/ns0XVzzbdpg/hqdefault.jpg,480,360,PyCon Sweden,none,2024-09-25T14:28:48Z
24,youtube#searchResult,eIDxtxTm2h0_vpweAe8F25Ug54o,youtube#video,lF83soaMzLQ,2024-09-08T20:32:55Z,UCH_2cuWzFMyCPvm75lJJ6wg,What if your code could be as simple as your business logic? by Raphaël Beamonte,"Abstract: Systems are expected to be both resilient and scalable. However, maintaining such systems often necessitates the ...",https://i.ytimg.com/vi/lF83soaMzLQ/default.jpg,120,90,https://i.ytimg.com/vi/lF83soaMzLQ/mqdefault.jpg,320,180,https://i.ytimg.com/vi/lF83soaMzLQ/hqdefault.jpg,480,360,PyCon Sweden,none,2024-09-08T20:32:55Z
0,youtube#searchResult,o5ieUGRo1qRyfbsTIQu2Io_xuWg,youtube#video,_AuE-bMC-MA,2018-06-16T09:38:46Z,UCpuDoeCqewjQW-sSI0jtLYQ,The Art of Castlevania Lords of Shadow - Flickthrough Weekly,A flickthrough of The Art of Castlevania Lords of Shadow. 192 Pages. Our videos are intended to be a quick flickthrough of the ...,https://i.ytimg.com/vi/_AuE-bMC-MA/default.jpg,120,90,https://i.ytimg.com/vi/_AuE-bMC-MA/mqdefault.jpg,320,180,https://i.ytimg.com/vi/_AuE-bMC-MA/hqdefault.jpg,480,360,Flickthrough Weekly,none,2018-06-16T09:38:46Z
1,youtube#searchResult,YOfVEqpsVI1mX3V31DcZkNFOQsI,youtube#video,1CJSd3OoENs,2018-06-09T14:40:31Z,UCpuDoeCqewjQW-sSI0jtLYQ,Breath Of Fire Official Complete Works - Flickthrough Weekly,A flickthrough of the Breath Of Fire Official Complete Works. Published by Udon Entertainment. 192 Pages Japanese Edition.,https://i.ytimg.com/vi/1CJSd3OoENs/default.jpg,120,90,https://i.ytimg.com/vi/1CJSd3OoENs/mqdefault.jpg,320,180,https://i.ytimg.com/vi/1CJSd3OoENs/hqdefault.jpg,480,360,Flickthrough Weekly,none,2018-06-09T14:40:31Z
2,youtube#searchResult,zDGR3RRIM0zW8xMbQChTJUMovtc,youtube#video,p7W5t2cFEcI,2018-06-03T20:59:56Z,UCpuDoeCqewjQW-sSI0jtLYQ,The Art Of Asura Online - Flickthrough Weekly,A flickthrough of The Art of Asura Online. Our videos are intended to be a quick flickthrough of the interior so you are informed ...,https://i.ytimg.com/vi/p7W5t2cFEcI/default.jpg,120,90,https://i.ytimg.com/vi/p7W5t2cFEcI/mqdefault.jpg,320,180,https://i.ytimg.com/vi/p7W5t2cFEcI/hqdefault.jpg,480,360,Flickthrough Weekly,none,2018-06-03T20:59:56Z
3,youtube#searchResult,e9UaM-ggbPFfEh2ssZlbnsFqMvo,youtube#video,gt4YipX5HQY,2018-01-10T20:16:25Z,UCpuDoeCqewjQW-sSI0jtLYQ,U-1 Kumakura Works 1995-2001 - Flickthrough Weekly,A flickthrough of the U-1 Kumakura Works 1995-2001 Artbook. Our videos are intended to be a quick flickthrough of the interior so ...,https://i.ytimg.com/vi/gt4YipX5HQY/default.jpg,120,90,https://i.ytimg.com/vi/gt4YipX5HQY/mqdefault.jpg,320,180,https://i.ytimg.com/vi/gt4YipX5HQY/hqdefault.jpg,480,360,Flickthrough Weekly,none,2018-01-10T20:16:25Z
4,youtube#searchResult,WZKUCniHrZZcGKPVY1Cgnd2GtJc,youtube#video,tKKpItfgUAI,2017-12-31T19:42:56Z,UCpuDoeCqewjQW-sSI0jtLYQ,Tactics Ogre Art Works by Square Enix - Flickthrough Weekly,A flickthrough of the Tactics Ogre Art Works book by Square Enix. Our videos are intended to be a quick flickthrough of the interior ...,https://i.ytimg.com/vi/tKKpItfgUAI/default.jpg,120,90,https://i.ytimg.com/vi/tKKpItfgUAI/mqdefault.jpg,320,180,https://i.ytimg.com/vi/tKKpItfgUAI/hqdefault.jpg,480,360,Flickthrough Weekly,none,2017-12-31T19:42:56Z
0,youtube#searchResult,9-i21_yAXO8uh_enywWRtauXTgc,youtube#video,laSzm-raS5A,2026-01-15T10:30:38Z,UC98CzaYuFNAA_gOINFB0e4Q,EuroPython 2026 Location Announcement,Wondering where EuroPython 2026 will take place? Watch the announcement video to find out! Links EuroPython 2026: ...,https://i.ytimg.com/vi/laSzm-raS5A/default.jpg,120,90,https://i.ytimg.com/vi/laSzm-raS5A/mqdefault.jpg,320,180,https://i.ytimg.com/vi/laSzm-raS5A/hqdefault.jpg,480,360,EuroPython Conference,none,2026-01-15T10:30:38Z
1,youtube#searchResult,SyhakzWKlUHTvvwGwmZ4yYDiAs8,youtube#video,anMZeTS7DIE,2026-01-14T13:36:25Z,UC98CzaYuFNAA_gOINFB0e4Q,Favorite Command Line Utility — Jurgen Gmach,"While in Prague during the last conference, we asked Jürgen Gmach about a favorite command line utility 🛠️ Oh, isn't this a ...",https://i.ytimg.com/vi/anMZeTS7DIE/default.jpg,120,90,https://i.ytimg.com/vi/anMZeTS7DIE/mqdefault.jpg,320,180,https://i.ytimg.com/vi/anMZeTS7DIE/hqdefault.jpg,480,360,EuroPython Conference,none,2026-01-14T13:36:25Z
2,youtube#searchResult,IIb7fO9pCqIXGoEI-9akseul4Gc,youtube#video,WGXXxGLBVF4,2025-09-01T16:00:06Z,UC98CzaYuFNAA_gOINFB0e4Q,Keynote: You don’t have to be a compiler engineer to work on Python — Savannah Bailey,EuroPython 2025 — Keynote — Forum Hall ON 2025-07-16] *You don't have to be a compiler engineer to work on Python by ...,https://i.ytimg.com/vi/WGXXxGLBVF4/default.jpg,120,90,https://i.ytimg.com/vi/WGXXxGLBVF4/mqdefault.jpg,320,180,https://i.ytimg.com/vi/WGXXxGLBVF4/hqdefault.jpg,480,360,EuroPython Conference,none,2025-09-01T16:00:06Z
3,youtube#searchResult,Ag8nYm-3sySSIfQU4QGWXQIQ_K4,youtube#video,ZtG8UCoDAg0,2023-09-19T15:48:36Z,UC98CzaYuFNAA_gOINFB0e4Q,"Pygoat - Learn Django security the hard way — Adarsh Divakaran, Thameem Karakkoth",EuroPython 2023 — Terrace 2B on 2023-07-21] https://ep2023.europython.eu/session/pygoat-learn-django-security-the-hard-way ...,https://i.ytimg.com/vi/ZtG8UCoDAg0/default.jpg,120,90,https://i.ytimg.com/vi/ZtG8UCoDAg0/mqdefault.jpg,320,180,https://i.ytimg.com/vi/ZtG8UCoDAg0/hqdefault.jpg,480,360,EuroPython Conference,none,2023-09-19T15:48:36Z
4,youtube#searchResult,NUv_MvgNfzhHc75QmnvA_IP9eiM,youtube#video,1pndeS8FIS8,2016-08-05T17:54:26Z,UC98CzaYuFNAA_gOINFB0e4Q,Angelo Failla - FBTFTP: Facebook&#39;s open source python3 framework for dynamic TFTP servers.,Angelo Failla - FBTFTP: Facebook's open source python3 framework for dynamic TFTP servers. [EuroPython 2016] [18 July 2016] ...,https://i.ytimg.com/vi/1pndeS8FIS8/default.jpg,120,90,https://i.ytimg.com/vi/1pndeS8FIS8/mqdefault.jpg,320,180,https://i.ytimg.com/vi/1pndeS8FIS8/hqdefault.jpg,480,360,EuroPython Conference,none,2016-08-05T17:54:26Z
0,youtube#searchResult,rmtLWMIpHfwZoJ51xDq7AzSqK7M,youtube#video,bHnQ6W14qEE,2022-08-12T15:46:29Z,UCkhm72fuzkS9fYGlGpEmj7A,Q&amp;A and Panel Maintainers Track,,https://i.ytimg.com/vi/bHnQ6W14qEE/default.jpg,120,90,https://i.ytimg.com/vi/bHnQ6W14qEE/mqdefault.jpg,320,180,https://i.ytimg.com/vi/bHnQ6W14qEE/hqdefault.jpg,480,360,Enthought,none,2022-08-12T15:46:29Z
1,youtube#searchResult,LtDc1IDCvVmzNYLnO6sJje-wGaQ,youtube#video,XiW1y18eMso,2022-08-12T15:47:34Z,UCkhm72fuzkS9fYGlGpEmj7A,SciPy Tools Plenary Session - Day 2 | SciPy 2022,,https://i.ytimg.com/vi/XiW1y18eMso/default.jpg,120,90,https://i.ytimg.com/vi/XiW1y18eMso/mqdefault.jpg,320,180,https://i.ytimg.com/vi/XiW1y18eMso/hqdefault.jpg,480,360,Enthought,none,2022-08-12T15:47:34Z
2,youtube#searchResult,TfZ7wl40Hgp0v6i4UQzNGMcGxX0,youtube#video,TirPmOyHrmA,2022-08-12T15:48:02Z,UCkhm72fuzkS9fYGlGpEmj7A,SciPy Tools Plenary Session - Day 3 | SciPy 2022,,https://i.ytimg.com/vi/TirPmOyHrmA/default.jpg,120,90,https://i.ytimg.com/vi/TirPmOyHrmA/mqdefault.jpg,320,180,https://i.ytimg.com/vi/TirPmOyHrmA/hqdefault.jpg,480,360,Enthought,none,2022-08-12T15:48:02Z
3,youtube#searchResult,3xbTmdxi5oQGiT120kVceqMxqqc,youtube#video,vj5Tsy_qM5g,2022-08-01T19:38:59Z,UCkhm72fuzkS9fYGlGpEmj7A,An Introduction to Distributed Hybrid Hyperparameter Optimization- Jun Liu | SciPy 2022,"Hyperparameter optimization in machine learning is commonly done on single search spaces, where the same search method is ...",https://i.ytimg.com/vi/vj5Tsy_qM5g/default.jpg,120,90,https://i.ytimg.com/vi/vj5Tsy_qM5g/mqdefault.jpg,320,180,https://i.ytimg.com/vi/vj5Tsy_qM5g/hqdefault.jpg,480,360,Enthought,none,2022-08-01T19:38:59Z
4,youtube#searchResult,VcpMrhaxlE-MGBr2Fg0hHPGms3w,youtube#video,EykWaiHHDNg,2022-08-01T19:38:59Z,UCkhm72fuzkS9fYGlGpEmj7A,Machine Learning for Production Workloads with Flyte- Niels Bantilan | SciPy 2022,MLOps encapsulates the discipline of – and infrastructure that supports – building and maintaining machine learning models in ...,https://i.ytimg.com/vi/EykWaiHHDNg/default.jpg,120,90,https://i.ytimg.com/vi/EykWaiHHDNg/mqdefault.jpg,320,180,https://i.ytimg.com/vi/EykWaiHHDNg/hqdefault.jpg,480,360,Enthought,none,2022-08-01T19:38:59Z
0,youtube#searchResult,JzZwZNGep8g3swX78bqeVon_QUc,youtube#video,iyV1NUaSt0k,2019-05-07T06:52:34Z,UCxs2IIVXaEHHA4BtTiWZ2mQ,Ernest W. Durbin III - Welcome and Housekeeping - PyCon 2019,"""Speaker: Ernest W. Durbin III Welcome to PyCon.",https://i.ytimg.com/vi/iyV1NUaSt0k/default.jpg,120,90,https://i.ytimg.com/vi/iyV1NUaSt0k/mqdefault.jpg,320,180,https://i.ytimg.com/vi/iyV1NUaSt0k/hqdefault.jpg,480,360,PyCon 2019,none,2019-05-07T06:52:34Z
1,youtube#searchResult,QzVNugyaVCOlJx6VMUA1R5EvIDU,youtube#video,P4IfFLAX9hY,2019-05-07T06:50:29Z,UCxs2IIVXaEHHA4BtTiWZ2mQ,Python Software Foundation Community Report and Community Service Awards - PyCon 2019,,https://i.ytimg.com/vi/P4IfFLAX9hY/default.jpg,120,90,https://i.ytimg.com/vi/P4IfFLAX9hY/mqdefault.jpg,320,180,https://i.ytimg.com/vi/P4IfFLAX9hY/hqdefault.jpg,480,360,PyCon 2019,none,2019-05-07T06:50:29Z
2,youtube#searchResult,xy0lNSdeFIDcvDBv8EmHFF6Ix4Q,youtube#video,ofuEhdzCqug,2019-05-07T06:50:29Z,UCxs2IIVXaEHHA4BtTiWZ2mQ,Briceida Mariscal - Por qué comencé mi carrera con Python y por qué tu también deberías hacerlo,Speaker: Briceida Mariscal.,https://i.ytimg.com/vi/ofuEhdzCqug/default.jpg,120,90,https://i.ytimg.com/vi/ofuEhdzCqug/mqdefault.jpg,320,180,https://i.ytimg.com/vi/ofuEhdzCqug/hqdefault.jpg,480,360,PyCon 2019,none,2019-05-07T06:50:29Z
3,youtube#searchResult,R6ZHtwRXjgwYBXqG7UTJd9rhU9Q,youtube#video,bnxxoTx9Sko,2019-05-06T03:20:46Z,UCxs2IIVXaEHHA4BtTiWZ2mQ,Sunday Lightning Talks - PyCon 2019,,https://i.ytimg.com/vi/bnxxoTx9Sko/default.jpg,120,90,https://i.ytimg.com/vi/bnxxoTx9Sko/mqdefault.jpg,320,180,https://i.ytimg.com/vi/bnxxoTx9Sko/hqdefault.jpg,480,360,PyCon 2019,none,2019-05-06T03:20:46Z
4,youtube#searchResult,MTKd_ddn8JWgJLHAZ3JyQlq8zhE,youtube#video,8dDp-UHBJ_A,2019-05-06T03:05:12Z,UCxs2IIVXaEHHA4BtTiWZ2mQ,Python Steering Council - Keynote - PyCon 2019,"""Speaker: Python Steering Council Keynote Slides can be found at: https://speakerdeck.com/pycon2019 and ...",https://i.ytimg.com/vi/8dDp-UHBJ_A/default.jpg,120,90,https://i.ytimg.com/vi/8dDp-UHBJ_A/mqdefault.jpg,320,180,https://i.ytimg.com/vi/8dDp-UHBJ_A/hqdefault.jpg,480,360,PyCon 2019,none,2019-05-06T03:05:12Z
0,youtube#searchResult,dbJevOMBZKJe2YNFXIu83WvYasQ,youtube#video,LB0Pj41nMwI,2025-09-21T15:10:47Z,UCYqdrfvhGxNW3vXebypqXoQ,&quot;Write Apps for Your TV with Kodi and Python&quot; - Andrew Kubera,Pyohio_2025 Andrew Kubera https://www.pyohio.org/2025/program/talks/write-apps-for-your-tv-with-kodi-and-python The ...,https://i.ytimg.com/vi/LB0Pj41nMwI/default.jpg,120,90,https://i.ytimg.com/vi/LB0Pj41nMwI/mqdefault.jpg,320,180,https://i.ytimg.com/vi/LB0Pj41nMwI/hqdefault.jpg,480,360,PyOhio,none,2025-09-21T15:10:47Z
