,kind,etag,id.kind,id.videoId,snippet.publishedAt,snippet.channelId,snippet.title,snippet.description,snippet.thumbnails.default.url,snippet.thumbnails.default.width,snippet.thumbnails.default.height,snippet.thumbnails.medium.url,snippet.thumbnails.medium.width,snippet.thumbnails.medium.height,snippet.thumbnails.high.url,snippet.thumbnails.high.width,snippet.thumbnails.high.height,snippet.channelTitle,snippet.liveBroadcastContent,snippet.publishTime
3,youtube#searchResult,Rd3NEUApnF59AGvZbim2PU-ipwE,youtube#video,NL3JgtaJIxQ,2025-02-27T13:13:04Z,UCDVL0bPrZHwCeJrlyy-wxaQ,Bootcamp Global de IA 2025 - Conferencia Principal,"Adoptando Nuevas Habilidades y Responsabilidades En la conferencia principal de este año, Roelant, Sammy y Henk del ...",https://i.ytimg.com/vi/NL3JgtaJIxQ/default.jpg,120,90,https://i.ytimg.com/vi/NL3JgtaJIxQ/mqdefault.jpg,320,180,https://i.ytimg.com/vi/NL3JgtaJIxQ/hqdefault.jpg,480,360,Global AI Community,none,2025-02-27T13:13:04Z
4,youtube#searchResult,ZJ4Xi_1MrHzxhSo4_xN3B9vQa3U,youtube#video,jUxyfz5FxjU,2024-04-11T08:12:49Z,UCDVL0bPrZHwCeJrlyy-wxaQ,Unveiling the Power of AI  Understanding the Future of Information Retrieval #ai #globalaicommunity,Full episode on: https://youtu.be/4Lv1xth5Inw More videos on:@GlobalAICommunity #SiliconMinds #HumanHearts #ChatGPT ...,https://i.ytimg.com/vi/jUxyfz5FxjU/default.jpg,120,90,https://i.ytimg.com/vi/jUxyfz5FxjU/mqdefault.jpg,320,180,https://i.ytimg.com/vi/jUxyfz5FxjU/hqdefault.jpg,480,360,Global AI Community,none,2024-04-11T08:12:49Z
0,youtube#searchResult,rPfPeaeseWAWGXARX7HJByravJk,youtube#video,NdPMaDzpqW8,2023-09-09T17:37:09Z,UCxArXLI-gxlTmWGGgec5D7w,Functions in Julia -Learn Julia 15/n-,"What are functions and what do they do ? In this video I present functions in Julia, what are they, how do they work, and how we ...",https://i.ytimg.com/vi/NdPMaDzpqW8/default.jpg,120,90,https://i.ytimg.com/vi/NdPMaDzpqW8/mqdefault.jpg,320,180,https://i.ytimg.com/vi/NdPMaDzpqW8/hqdefault.jpg,480,360,Rémi Vezy,none,2023-09-09T17:37:09Z
1,youtube#searchResult,J6dy3wsOINK5a2cLW2BqXU7aj3I,youtube#video,wTiVtP5tYPY,2023-08-21T14:58:42Z,UCxArXLI-gxlTmWGGgec5D7w,"For loops in Julia (eachindex, enumerate...) -Learn Julia 14/n-","How can we repeatedly execute code in Julia ? In this video I present for loops in Julia, what are they and how they work, and I ...",https://i.ytimg.com/vi/wTiVtP5tYPY/default.jpg,120,90,https://i.ytimg.com/vi/wTiVtP5tYPY/mqdefault.jpg,320,180,https://i.ytimg.com/vi/wTiVtP5tYPY/hqdefault.jpg,480,360,Rémi Vezy,none,2023-08-21T14:58:42Z
2,youtube#searchResult,A_RiDPy3ZyYRnyvRGf1jsSQtroU,youtube#video,qNK9C3ewoGE,2022-08-20T13:16:04Z,UCxArXLI-gxlTmWGGgec5D7w,Conditionals in Julia (if...else...) -Learn Julia 13/n-,"If you appreciate this video, you can buy me a coffee on Tipeee: https://fr.tipeee.com/remi-vezy What are conditional statements ?",https://i.ytimg.com/vi/qNK9C3ewoGE/default.jpg,120,90,https://i.ytimg.com/vi/qNK9C3ewoGE/mqdefault.jpg,320,180,https://i.ytimg.com/vi/qNK9C3ewoGE/hqdefault.jpg,480,360,Rémi Vezy,none,2022-08-20T13:16:04Z
3,youtube#searchResult,S8J3j6jSDiVMHXbqn7MeafdTh8U,youtube#video,zCvYmbP1esc,2022-05-22T19:07:40Z,UCxArXLI-gxlTmWGGgec5D7w,`begin` and `let` in Julia -Learn Julia 12/n-,You can buy me a coffee on Tipeee: https://fr.tipeee.com/remi-vezy What are `begin...end` statements ? What is the difference with ...,https://i.ytimg.com/vi/zCvYmbP1esc/default.jpg,120,90,https://i.ytimg.com/vi/zCvYmbP1esc/mqdefault.jpg,320,180,https://i.ytimg.com/vi/zCvYmbP1esc/hqdefault.jpg,480,360,Rémi Vezy,none,2022-05-22T19:07:40Z
4,youtube#searchResult,QJ2slbBUOJ_Qu_CTw0wgiJhEoxQ,youtube#video,yZwHgdAEx5Q,2022-04-24T19:46:02Z,UCxArXLI-gxlTmWGGgec5D7w,String operators in Julia -Learn Julia 11/n-,You can buy me a coffee on Tipeee: https://fr.tipeee.com/remi-vezy What is a string? What is the difference with characters?,https://i.ytimg.com/vi/yZwHgdAEx5Q/default.jpg,120,90,https://i.ytimg.com/vi/yZwHgdAEx5Q/mqdefault.jpg,320,180,https://i.ytimg.com/vi/yZwHgdAEx5Q/hqdefault.jpg,480,360,Rémi Vezy,none,2022-04-24T19:46:02Z
0,youtube#searchResult,YOVs6YIVg8aIuEumAEdqvsX_v1g,youtube#video,saskQ-EjCLQ,2025-04-09T18:05:39Z,UCupQLyNchb9-2Z5lmUOIijw,Lecture 20 – Learning the feature vector 𝒇(𝒙),"Lecture sample from my undergraduate course at NYU, «Introduction to Deep Learning», Spring 2025 Notebook: ...",https://i.ytimg.com/vi/saskQ-EjCLQ/default.jpg,120,90,https://i.ytimg.com/vi/saskQ-EjCLQ/mqdefault.jpg,320,180,https://i.ytimg.com/vi/saskQ-EjCLQ/hqdefault.jpg,480,360,Alfredo Canziani (冷在),none,2025-04-09T18:05:39Z
1,youtube#searchResult,NuO2Yveg3VeoVv1siwAFGq6Dkng,youtube#video,IKjd34ZsFVw,2025-01-23T21:18:39Z,UCupQLyNchb9-2Z5lmUOIijw,Cosine (extract from undergrad DLSP25),I think the new undergrad course is going well. At least we're having fun!,https://i.ytimg.com/vi/IKjd34ZsFVw/default.jpg,120,90,https://i.ytimg.com/vi/IKjd34ZsFVw/mqdefault.jpg,320,180,https://i.ytimg.com/vi/IKjd34ZsFVw/hqdefault.jpg,480,360,Alfredo Canziani (冷在),none,2025-01-23T21:18:39Z
2,youtube#searchResult,XwInghl9ONzyA-80o3xUHC0LJJg,youtube#video,g4sSU6B99Ek,2024-06-26T17:53:47Z,UCupQLyNchb9-2Z5lmUOIijw,"Chapter 2, video 4–6",Summary of the next 3 video lectures.,https://i.ytimg.com/vi/g4sSU6B99Ek/default.jpg,120,90,https://i.ytimg.com/vi/g4sSU6B99Ek/mqdefault.jpg,320,180,https://i.ytimg.com/vi/g4sSU6B99Ek/hqdefault.jpg,480,360,Alfredo Canziani (冷在),none,2024-06-26T17:53:47Z
3,youtube#searchResult,Vd7r_-Pa8gmhw3rsVK-ucehL7IM,youtube#video,WYnYCKXVfhg,2024-06-25T21:21:13Z,UCupQLyNchb9-2Z5lmUOIijw,06 – Optimisation and gradient ascent,Course website: https://atcold.github.io/NYU-AISP24/,https://i.ytimg.com/vi/WYnYCKXVfhg/default.jpg,120,90,https://i.ytimg.com/vi/WYnYCKXVfhg/mqdefault.jpg,320,180,https://i.ytimg.com/vi/WYnYCKXVfhg/hqdefault.jpg,480,360,Alfredo Canziani (冷在),none,2024-06-25T21:21:13Z
4,youtube#searchResult,5fkcx1FlOfXcBAXVyjTyNia2lXU,youtube#video,i31lQ18Gcbc,2024-06-18T15:01:24Z,UCupQLyNchb9-2Z5lmUOIijw,"05 – Multi-class perceptron, binary and multi-class logistic regression",Course website: https://atcold.github.io/NYU-AISP24/,https://i.ytimg.com/vi/i31lQ18Gcbc/default.jpg,120,90,https://i.ytimg.com/vi/i31lQ18Gcbc/mqdefault.jpg,320,180,https://i.ytimg.com/vi/i31lQ18Gcbc/hqdefault.jpg,480,360,Alfredo Canziani (冷在),none,2024-06-18T15:01:24Z
0,youtube#searchResult,n4BsStwDx1A7GDA7we99Fwavu4k,youtube#video,vCqMCIdIHGo,2019-10-01T12:29:58Z,UCBEShbs7rtE_ZjTmb6Jt5WA,PROGRAM TO FIND FACTORIAL OF GIVEN NUMBER,DURecorder This is my video recorded with DU Recorder. It's easy to record your screen and livestream. Download link: Android: ...,https://i.ytimg.com/vi/vCqMCIdIHGo/default.jpg,120,90,https://i.ytimg.com/vi/vCqMCIdIHGo/mqdefault.jpg,320,180,https://i.ytimg.com/vi/vCqMCIdIHGo/hqdefault.jpg,480,360,Real Python,none,2019-10-01T12:29:58Z
1,youtube#searchResult,QMdZN8zhI0EZ1xVys7c1WyHIwHg,youtube#video,TUlTY9GnKXE,2019-10-01T12:16:53Z,UCBEShbs7rtE_ZjTmb6Jt5WA,PYTHON PROGRAM TO PRINT REVERSE OF A NUMBER,,https://i.ytimg.com/vi/TUlTY9GnKXE/default.jpg,120,90,https://i.ytimg.com/vi/TUlTY9GnKXE/mqdefault.jpg,320,180,https://i.ytimg.com/vi/TUlTY9GnKXE/hqdefault.jpg,480,360,Real Python,none,2019-10-01T12:16:53Z
0,youtube#searchResult,92Iy5C-gMumF-6Ky9QaCM93vYeY,youtube#video,PecEL44pido,2025-11-17T20:52:19Z,UC9IuUwwE2xdjQUT_LMLONoA,Simulation of light-driven hot carrier dynamics &amp; transport | Snowden | JuliaCon Global 2025,Simulation of light-driven hot carrier dynamics & transport by Henry Snowden PreTalx: ...,https://i.ytimg.com/vi/PecEL44pido/default.jpg,120,90,https://i.ytimg.com/vi/PecEL44pido/mqdefault.jpg,320,180,https://i.ytimg.com/vi/PecEL44pido/hqdefault.jpg,480,360,The Julia Programming Language,none,2025-11-17T20:52:19Z
1,youtube#searchResult,YsM-RQNXrN-vy-GgfaFM3RTehjo,youtube#video,PgqrHm-wL1w,2025-11-17T16:56:58Z,UC9IuUwwE2xdjQUT_LMLONoA,Space Invaders: a new REPL mode. | Hafner | JuliaCon Global 2025,Space Invaders: a new REPL mode. by Lilith Hafner PreTalx: https://pretalx.com/juliacon-2025/talk/BVWXJC/ SpaceInvaders.jl ...,https://i.ytimg.com/vi/PgqrHm-wL1w/default.jpg,120,90,https://i.ytimg.com/vi/PgqrHm-wL1w/mqdefault.jpg,320,180,https://i.ytimg.com/vi/PgqrHm-wL1w/hqdefault.jpg,480,360,The Julia Programming Language,none,2025-11-17T16:56:58Z
2,youtube#searchResult,DYRn1Os3raLfBMgG_oHZ6fSi3Xo,youtube#video,bb0zUNe32KU,2025-11-17T12:07:54Z,UC9IuUwwE2xdjQUT_LMLONoA,"OhMyThreads.jl: User-friendly, flexible multithreading in Julia | Protter | JuliaCon Global 2025","OhMyThreads.jl: User-friendly, flexible multithreading in Julia by Mason Protter PreTalx: ...",https://i.ytimg.com/vi/bb0zUNe32KU/default.jpg,120,90,https://i.ytimg.com/vi/bb0zUNe32KU/mqdefault.jpg,320,180,https://i.ytimg.com/vi/bb0zUNe32KU/hqdefault.jpg,480,360,The Julia Programming Language,none,2025-11-17T12:07:54Z
3,youtube#searchResult,zoVHFKoO0CwzJ6TbMqkI6RBqAAo,youtube#video,GcpJ-KNXUYI,2025-11-17T01:27:49Z,UC9IuUwwE2xdjQUT_LMLONoA,ORTools.jl: access Google&#39;s solvers through JuMP | Warren | JuliaCon Global 2025,ORTools.jl: access Google's solvers through JuMP by Ochibobo Warren PreTalx: https://pretalx.com/juliacon-2025/talk/XQKQSW/ ...,https://i.ytimg.com/vi/GcpJ-KNXUYI/default.jpg,120,90,https://i.ytimg.com/vi/GcpJ-KNXUYI/mqdefault.jpg,320,180,https://i.ytimg.com/vi/GcpJ-KNXUYI/hqdefault.jpg,480,360,The Julia Programming Language,none,2025-11-17T01:27:49Z
0,youtube#searchResult,twKKneVCmqJQ4-mmqj5B4NKVRJE,youtube#video,cUEdNmnKJVQ,2025-10-17T22:20:14Z,UC12LqyqTQYbXatYS9AA7Nuw,Responsible AI - Lesson 2: Foundations of Responsible AI,"This video will cover a review of the previous lesson on evaluating large language models (LLMs), followed by an introduction to ...",https://i.ytimg.com/vi/cUEdNmnKJVQ/default.jpg,120,90,https://i.ytimg.com/vi/cUEdNmnKJVQ/mqdefault.jpg,320,180,https://i.ytimg.com/vi/cUEdNmnKJVQ/hqdefault.jpg,480,360,Machine Learning University,none,2025-10-17T22:20:14Z
1,youtube#searchResult,Zm19VuQphXtEQ3XIg1aQV7ijohc,youtube#video,KGbplvULNwg,2025-10-17T22:20:14Z,UC12LqyqTQYbXatYS9AA7Nuw,Building Apps with Foundation Models - Lesson 4: Agents,"This lesson will begin by reviewing Lesson 4. Then, we will discuss tools and agents. We will cover some specifics of LangChain ...",https://i.ytimg.com/vi/KGbplvULNwg/default.jpg,120,90,https://i.ytimg.com/vi/KGbplvULNwg/mqdefault.jpg,320,180,https://i.ytimg.com/vi/KGbplvULNwg/hqdefault.jpg,480,360,Machine Learning University,none,2025-10-17T22:20:14Z
2,youtube#searchResult,sIfVVLCFOVpkrtJawHGpuk0pI0k,youtube#video,0dLiVlWQhYU,2025-10-17T22:20:14Z,UC12LqyqTQYbXatYS9AA7Nuw,Building Apps with Foundation Models - Lesson 1: LangChain Modules and Integration,"This video includes a review of Module 2 (Responsible Generative AI) and an introduction to LangChain, its various modules, and ...",https://i.ytimg.com/vi/0dLiVlWQhYU/default.jpg,120,90,https://i.ytimg.com/vi/0dLiVlWQhYU/mqdefault.jpg,320,180,https://i.ytimg.com/vi/0dLiVlWQhYU/hqdefault.jpg,480,360,Machine Learning University,none,2025-10-17T22:20:14Z
3,youtube#searchResult,jLKhMwkcgEXVlAjnAXh5XDq8nME,youtube#video,8togqsH1xRU,2025-10-17T22:20:14Z,UC12LqyqTQYbXatYS9AA7Nuw,Responsible AI - Lesson 1: Evaluating Large Language Models,"This video will begin with a review of Generative AI Module 1 (Fundamentals of Generative AI), covering the key concepts and ...",https://i.ytimg.com/vi/8togqsH1xRU/default.jpg,120,90,https://i.ytimg.com/vi/8togqsH1xRU/mqdefault.jpg,320,180,https://i.ytimg.com/vi/8togqsH1xRU/hqdefault.jpg,480,360,Machine Learning University,none,2025-10-17T22:20:14Z
4,youtube#searchResult,rGNoAwkfLDGKkC4n4iR8o_Lnklk,youtube#video,5H77KxUbQnA,2025-10-17T22:20:14Z,UC12LqyqTQYbXatYS9AA7Nuw,Building Apps with Foundation Models - Lesson 3: Retrieval Augmented Generation (RAG),"This video begins with a review of Lesson 2 . Then we'll explore the concept of grounding a model. Next, we'll dive deeper into ...",https://i.ytimg.com/vi/5H77KxUbQnA/default.jpg,120,90,https://i.ytimg.com/vi/5H77KxUbQnA/mqdefault.jpg,320,180,https://i.ytimg.com/vi/5H77KxUbQnA/hqdefault.jpg,480,360,Machine Learning University,none,2025-10-17T22:20:14Z
0,youtube#searchResult,R8hhv0oEg3W_Tnzy-_p-KBYkpvI,youtube#video,7IaHRXC_U_U,2025-11-17T19:45:06Z,UCX6b17PVsYBQ0ip5gyeme-Q,Crash Course Writing Workshop,Editorial Director Meghan Modafferi and Script Editor Annie Fillenwarth take you behind the scenes into the life cycle of a Crash ...,https://i.ytimg.com/vi/7IaHRXC_U_U/default.jpg,120,90,https://i.ytimg.com/vi/7IaHRXC_U_U/mqdefault.jpg,320,180,https://i.ytimg.com/vi/7IaHRXC_U_U/hqdefault.jpg,480,360,CrashCourse,none,2025-11-17T19:45:06Z
1,youtube#searchResult,ogu_qFEwYA5Z55jEuK8h2MvoZSE,youtube#video,3V78r1y2EHs,2025-11-13T17:00:10Z,UCX6b17PVsYBQ0ip5gyeme-Q,Nature in Latin American Literature: Crash Course Latin American Literature #3,"Who is Mother Nature REALLY? In this episode of Crash Course Latin American Literature, we'll uncover how representations of ...",https://i.ytimg.com/vi/3V78r1y2EHs/default.jpg,120,90,https://i.ytimg.com/vi/3V78r1y2EHs/mqdefault.jpg,320,180,https://i.ytimg.com/vi/3V78r1y2EHs/hqdefault.jpg,480,360,CrashCourse,none,2025-11-13T17:00:10Z
2,youtube#searchResult,C4utoLMqbOUXZ7yuGO5YsrZoJXM,youtube#video,7L2cSifRrLk,2025-11-11T17:00:20Z,UCX6b17PVsYBQ0ip5gyeme-Q,The Land Back Movement Explained: Ep 22 of Crash Course Native American History,The Land Back movement is exactly what it sounds like: Native Americans want their land … back. But it's also a whole lot more ...,https://i.ytimg.com/vi/7L2cSifRrLk/default.jpg,120,90,https://i.ytimg.com/vi/7L2cSifRrLk/mqdefault.jpg,320,180,https://i.ytimg.com/vi/7L2cSifRrLk/hqdefault.jpg,480,360,CrashCourse,none,2025-11-11T17:00:20Z
3,youtube#searchResult,rzOAd5LPYzkBum_r8He0Dfp8OuU,youtube#video,-a739VjqdSI,2016-11-21T23:02:30Z,UCX6b17PVsYBQ0ip5gyeme-Q,Utilitarianism: Crash Course Philosophy #36,"Our next stop in our tour of the ethical lay of the land is utilitarianism. With a little help from Batman, Hank explains the principle of ...",https://i.ytimg.com/vi/-a739VjqdSI/default.jpg,120,90,https://i.ytimg.com/vi/-a739VjqdSI/mqdefault.jpg,320,180,https://i.ytimg.com/vi/-a739VjqdSI/hqdefault.jpg,480,360,CrashCourse,none,2016-11-21T23:02:30Z
4,youtube#searchResult,aqG00fXdXIfy99TictHQ98qEmsY,youtube#video,17WiQ_tNld4,2016-07-11T20:43:48Z,UCX6b17PVsYBQ0ip5gyeme-Q,Arguments Against Personal Identity: Crash Course Philosophy #20,How can Daenerys Targaryen help us understand personal identity? Find out as Hank continues our exploration of personal ...,https://i.ytimg.com/vi/17WiQ_tNld4/default.jpg,120,90,https://i.ytimg.com/vi/17WiQ_tNld4/mqdefault.jpg,320,180,https://i.ytimg.com/vi/17WiQ_tNld4/hqdefault.jpg,480,360,CrashCourse,none,2016-07-11T20:43:48Z
0,youtube#searchResult,eebySaGwoSH95GfuJ9rSzSLHHrc,youtube#video,m_CFCyc2Shs,2025-11-17T18:27:43Z,UCSHZKyawb77ixDdsGog4iWA,"David Kirtley: Nuclear Fusion, Plasma Physics, and the Future of Energy | Lex Fridman Podcast #485","David Kirtley is a nuclear fusion engineer and CEO of Helion Energy, a company working on building the world's first commercial ...",https://i.ytimg.com/vi/m_CFCyc2Shs/default.jpg,120,90,https://i.ytimg.com/vi/m_CFCyc2Shs/mqdefault.jpg,320,180,https://i.ytimg.com/vi/m_CFCyc2Shs/hqdefault.jpg,480,360,Lex Fridman,none,2025-11-17T18:27:43Z
1,youtube#searchResult,y6eqLLllIfXzvls_1o-jnXM2N-w,youtube#video,7OLVwZeMCfY,2025-10-14T17:21:10Z,UCSHZKyawb77ixDdsGog4iWA,"Julia Shaw: Criminal Psychology of Murder, Serial Killers, Memory &amp; Sex | Lex Fridman Podcast #483","Julia Shaw is a criminal psychologist and author who in her books explores human nature, including psychopathy, violent crime, ...",https://i.ytimg.com/vi/7OLVwZeMCfY/default.jpg,120,90,https://i.ytimg.com/vi/7OLVwZeMCfY/mqdefault.jpg,320,180,https://i.ytimg.com/vi/7OLVwZeMCfY/hqdefault.jpg,480,360,Lex Fridman,none,2025-10-14T17:21:10Z
2,youtube#searchResult,Q_Gy7ydqjks5WrmhJKjatrz4IkQ,youtube#video,SvKv7D4pBjE,2025-09-19T18:17:48Z,UCSHZKyawb77ixDdsGog4iWA,"Norman Ohler: Hitler, Nazis, Drugs, WW2, Blitzkrieg, LSD, MKUltra &amp; CIA | Lex Fridman Podcast #481","Norman Ohler is a historian and author of ""Blitzed: Drugs in the Third Reich,"" a book that investigates the role of psychoactive ...",https://i.ytimg.com/vi/SvKv7D4pBjE/default.jpg,120,90,https://i.ytimg.com/vi/SvKv7D4pBjE/mqdefault.jpg,320,180,https://i.ytimg.com/vi/SvKv7D4pBjE/hqdefault.jpg,480,360,Lex Fridman,none,2025-09-19T18:17:48Z
3,youtube#searchResult,nfVzg6gZ0cofiHWorFe7ZPvLr7U,youtube#video,-Qm1_On71Oo,2025-09-04T19:56:59Z,UCSHZKyawb77ixDdsGog4iWA,"Dave Hone: T-Rex, Dinosaurs, Extinction, Evolution, and Jurassic Park | Lex Fridman Podcast #480","Dave Hone is a paleontologist, expert on dinosaurs, co-host of the Terrible Lizards podcast, and author of numerous scientific ...",https://i.ytimg.com/vi/-Qm1_On71Oo/default.jpg,120,90,https://i.ytimg.com/vi/-Qm1_On71Oo/mqdefault.jpg,320,180,https://i.ytimg.com/vi/-Qm1_On71Oo/hqdefault.jpg,480,360,Lex Fridman,none,2025-09-04T19:56:59Z
4,youtube#searchResult,ZGHSezzp2I6JoTFAu1OCv2y0GjE,youtube#video,HsLgZzgpz9Y,2025-08-29T23:52:25Z,UCSHZKyawb77ixDdsGog4iWA,"Dave Plummer: Programming, Autism, and Old-School Microsoft Stories | Lex Fridman Podcast #479","Dave Plummer is a programmer, former Microsoft software engineer (Windows 95, NT, XP), creator of Task Manager, author of two ...",https://i.ytimg.com/vi/HsLgZzgpz9Y/default.jpg,120,90,https://i.ytimg.com/vi/HsLgZzgpz9Y/mqdefault.jpg,320,180,https://i.ytimg.com/vi/HsLgZzgpz9Y/hqdefault.jpg,480,360,Lex Fridman,none,2025-08-29T23:52:25Z
0,youtube#searchResult,e7MZ5hwrJ_aO67aYndDrJpPAlx0,youtube#video,QHrGjpB2NY0,2025-11-03T13:01:01Z,UCRbKmV_XYB7C12SPBokLVHQ,KNIME AI Extension: New LLM Connectors,More LLMs. More data work done. See what new LLM Connectors we've added to our KNIME AI Extension.,https://i.ytimg.com/vi/QHrGjpB2NY0/default.jpg,120,90,https://i.ytimg.com/vi/QHrGjpB2NY0/mqdefault.jpg,320,180,https://i.ytimg.com/vi/QHrGjpB2NY0/hqdefault.jpg,480,360,KNIMETV,none,2025-11-03T13:01:01Z
1,youtube#searchResult,LGp661TjVQutly-ssifUaK6w0A0,youtube#video,GQ03Au90LY4,2025-09-30T15:42:27Z,UCRbKmV_XYB7C12SPBokLVHQ,KNIME for Audit: How to Escape Legacy Tools for Smarter Audits,"Auditors today are constrained by spreadsheets and legacy tools like ACL, which limit scalability, collaboration, and flexibility.",https://i.ytimg.com/vi/GQ03Au90LY4/default.jpg,120,90,https://i.ytimg.com/vi/GQ03Au90LY4/mqdefault.jpg,320,180,https://i.ytimg.com/vi/GQ03Au90LY4/hqdefault.jpg,480,360,KNIMETV,none,2025-09-30T15:42:27Z
2,youtube#searchResult,3aJm7AiREuRKxiWnE416Tg4scOU,youtube#video,9sE5ITQLT-Q,2025-09-11T09:30:08Z,UCRbKmV_XYB7C12SPBokLVHQ,KNIME101: 10 Underrated Nodes That Will Make Your Life Easier,The focus of this 101 webinar is data manipulation. It's the task that usually takes the most time and headaches to reach results ...,https://i.ytimg.com/vi/9sE5ITQLT-Q/default.jpg,120,90,https://i.ytimg.com/vi/9sE5ITQLT-Q/mqdefault.jpg,320,180,https://i.ytimg.com/vi/9sE5ITQLT-Q/hqdefault.jpg,480,360,KNIMETV,none,2025-09-11T09:30:08Z
3,youtube#searchResult,4XBfhZ06aixjJAF8HF4RnissDiE,youtube#video,tVskQ7JH9Wk,2025-08-14T12:14:19Z,UCRbKmV_XYB7C12SPBokLVHQ,KNIME101: Building Workflows with K-AI,"Not sure how to get started with KNIME, or find yourself stuck? Don't get yourself down – let K-AI help! Scott Fincher will demo K-AI ...",https://i.ytimg.com/vi/tVskQ7JH9Wk/default.jpg,120,90,https://i.ytimg.com/vi/tVskQ7JH9Wk/mqdefault.jpg,320,180,https://i.ytimg.com/vi/tVskQ7JH9Wk/hqdefault.jpg,480,360,KNIMETV,none,2025-08-14T12:14:19Z
4,youtube#searchResult,AxUm7MAQiwAAQ1oztkBUxyu7f3c,youtube#video,Q0c8sRz_RYE,2025-07-30T09:22:04Z,UCRbKmV_XYB7C12SPBokLVHQ,New in KNIME: How to Build Reliable AI Agents and Deploy Them in a Few Simple Steps,"Learn how to build your first AI agent with KNIME in as little as 5 nodes, or turn your existing KNIME workflows into tools for AI ...",https://i.ytimg.com/vi/Q0c8sRz_RYE/default.jpg,120,90,https://i.ytimg.com/vi/Q0c8sRz_RYE/mqdefault.jpg,320,180,https://i.ytimg.com/vi/Q0c8sRz_RYE/hqdefault.jpg,480,360,KNIMETV,none,2025-07-30T09:22:04Z
0,youtube#searchResult,zLHmm779F2tvP9vCcMsxy08uJcc,youtube#video,HZXgrXQnfjk,2023-11-01T14:30:10Z,UCmKaoNn0OvxVAe7f_8sXYNQ,Jovian&#39;s Batch of November 2023 Graduation Day!,"Join us for Jovian's Data Science Bootcamp Graduation Day Over the past eight months, participants of the program have spent ...",https://i.ytimg.com/vi/HZXgrXQnfjk/default.jpg,120,90,https://i.ytimg.com/vi/HZXgrXQnfjk/mqdefault.jpg,320,180,https://i.ytimg.com/vi/HZXgrXQnfjk/hqdefault.jpg,480,360,Jovian,none,2023-11-01T14:30:10Z
1,youtube#searchResult,_tQHrrD__t3AzXVRYmLVN6vnG8k,youtube#video,3RFdcWf9kN4,2023-09-11T14:30:10Z,UCmKaoNn0OvxVAe7f_8sXYNQ,Jovian&#39;s Batch of September 2023 Graduation Day!,"Join us for Jovian's Data Science Bootcamp Graduation Day Over the past eight months, participants of the program have spent ...",https://i.ytimg.com/vi/3RFdcWf9kN4/default.jpg,120,90,https://i.ytimg.com/vi/3RFdcWf9kN4/mqdefault.jpg,320,180,https://i.ytimg.com/vi/3RFdcWf9kN4/hqdefault.jpg,480,360,Jovian,none,2023-09-11T14:30:10Z
2,youtube#searchResult,OzwM9kscLxPgTKO4Jcnoh8ou3qI,youtube#video,kFUKx4Rh5CI,2023-06-30T14:30:08Z,UCmKaoNn0OvxVAe7f_8sXYNQ,"Difference between Pass by Value, Pass by Reference | #python #pythonprogramming #pythonlanguage",Did you know the way you pass arguments to a function can make a huge difference in your code? Let's explore. Pass by value ...,https://i.ytimg.com/vi/kFUKx4Rh5CI/default.jpg,120,90,https://i.ytimg.com/vi/kFUKx4Rh5CI/mqdefault.jpg,320,180,https://i.ytimg.com/vi/kFUKx4Rh5CI/hqdefault.jpg,480,360,Jovian,none,2023-06-30T14:30:08Z
3,youtube#searchResult,Yhpa09Y2-dsLHyWy4rHBcDmdxNY,youtube#video,oRhD7j_HtaU,2023-06-29T15:30:08Z,UCmKaoNn0OvxVAe7f_8sXYNQ,"From #chemicalengineering to #datascience | Watch Aakash interview Rishabh, Data Scientist, Uber","The speaker, who majored in chemical engineering, became interested in data science because they wanted to use their ...",https://i.ytimg.com/vi/oRhD7j_HtaU/default.jpg,120,90,https://i.ytimg.com/vi/oRhD7j_HtaU/mqdefault.jpg,320,180,https://i.ytimg.com/vi/oRhD7j_HtaU/hqdefault.jpg,480,360,Jovian,none,2023-06-29T15:30:08Z
4,youtube#searchResult,e8F1Q1hQoPZuoLr_lbYOknpoLJY,youtube#video,M6bnZfFnXZs,2023-06-27T15:30:10Z,UCmKaoNn0OvxVAe7f_8sXYNQ,#generativeai is a $100m market | How can you apply GenAI?,Did you know that the global market for Generative AI is expected to reach a hundred billion dollars by 2025? Here are some of ...,https://i.ytimg.com/vi/M6bnZfFnXZs/default.jpg,120,90,https://i.ytimg.com/vi/M6bnZfFnXZs/mqdefault.jpg,320,180,https://i.ytimg.com/vi/M6bnZfFnXZs/hqdefault.jpg,480,360,Jovian,none,2023-06-27T15:30:10Z
5,youtube#searchResult,ePacpXQAvhXvGBh5hfwMKf0Yttw,youtube#video,KEqvAMZQ_PI,2023-06-26T15:30:07Z,UCmKaoNn0OvxVAe7f_8sXYNQ,Exploring Relational vs Non Relational Databases | #sql #datascience #machinelearning,"A database is a piece of software that stores all the data for an application, and it can be relational or non-relational, with relational ...",https://i.ytimg.com/vi/KEqvAMZQ_PI/default.jpg,120,90,https://i.ytimg.com/vi/KEqvAMZQ_PI/mqdefault.jpg,320,180,https://i.ytimg.com/vi/KEqvAMZQ_PI/hqdefault.jpg,480,360,Jovian,none,2023-06-26T15:30:07Z
6,youtube#searchResult,iGUMgeIGIx69Vp6A54_ZbV0psGQ,youtube#video,RV_MihEQ4BA,2023-06-26T04:02:19Z,UCmKaoNn0OvxVAe7f_8sXYNQ,Building Generative AI Apps with Python &amp; Streamlit,,https://i.ytimg.com/vi/RV_MihEQ4BA/default.jpg,120,90,https://i.ytimg.com/vi/RV_MihEQ4BA/mqdefault.jpg,320,180,https://i.ytimg.com/vi/RV_MihEQ4BA/hqdefault.jpg,480,360,Jovian,none,2023-06-26T04:02:19Z
7,youtube#searchResult,aDgJtigGjZjoNb1hArXdu0bc6kQ,youtube#video,ZXXcb4ELVd0,2023-06-24T14:30:09Z,UCmKaoNn0OvxVAe7f_8sXYNQ,Understanding Foreign Keys: Connecting Tables in #sql #database #datascience,"Foreign keys are used to represent relationships between different tables, such as an orders table having a primary key for order ...",https://i.ytimg.com/vi/ZXXcb4ELVd0/default.jpg,120,90,https://i.ytimg.com/vi/ZXXcb4ELVd0/mqdefault.jpg,320,180,https://i.ytimg.com/vi/ZXXcb4ELVd0/hqdefault.jpg,480,360,Jovian,none,2023-06-24T14:30:09Z
8,youtube#searchResult,BgFFD1C7f6XbgFW_3HKFQeQ631w,youtube#video,3dZ9m6bJonM,2023-06-24T13:08:42Z,UCmKaoNn0OvxVAe7f_8sXYNQ,Workshop Building Generative AI Apps with React and useLLM - June 24 2023,Directions and steps: ...,https://i.ytimg.com/vi/3dZ9m6bJonM/default.jpg,120,90,https://i.ytimg.com/vi/3dZ9m6bJonM/mqdefault.jpg,320,180,https://i.ytimg.com/vi/3dZ9m6bJonM/hqdefault.jpg,480,360,Jovian,none,2023-06-24T13:08:42Z
9,youtube#searchResult,8KkBgAPh4QUXTDhvaAXG7Rtve6U,youtube#video,s13epHhJeEM,2023-06-22T15:30:11Z,UCmKaoNn0OvxVAe7f_8sXYNQ,#opensource Large Language Models you should use to build!,"Want to build an NLP project and don't know where to begin from. You need to try out these language models, which are ...",https://i.ytimg.com/vi/s13epHhJeEM/default.jpg,120,90,https://i.ytimg.com/vi/s13epHhJeEM/mqdefault.jpg,320,180,https://i.ytimg.com/vi/s13epHhJeEM/hqdefault.jpg,480,360,Jovian,none,2023-06-22T15:30:11Z
10,youtube#searchResult,ZGmPA5iXXy7uhv8G9btwgAQhY6g,youtube#video,F72r0Jtb4M0,2023-06-21T15:30:11Z,UCmKaoNn0OvxVAe7f_8sXYNQ,Mastering #sql : Essential for #data #management #ai #frontenddeveloper,"SQL is important for setting up data models and retrieving data, making it an essential skill to have. Full Podcast here: ...",https://i.ytimg.com/vi/F72r0Jtb4M0/default.jpg,120,90,https://i.ytimg.com/vi/F72r0Jtb4M0/mqdefault.jpg,320,180,https://i.ytimg.com/vi/F72r0Jtb4M0/hqdefault.jpg,480,360,Jovian,none,2023-06-21T15:30:11Z
