,kind,etag,id.kind,id.videoId,snippet.publishedAt,snippet.channelId,snippet.title,snippet.description,snippet.thumbnails.default.url,snippet.thumbnails.default.width,snippet.thumbnails.default.height,snippet.thumbnails.medium.url,snippet.thumbnails.medium.width,snippet.thumbnails.medium.height,snippet.thumbnails.high.url,snippet.thumbnails.high.width,snippet.thumbnails.high.height,snippet.channelTitle,snippet.liveBroadcastContent,snippet.publishTime
1,youtube#searchResult,mVUDrFm9YHqUJqfveT6PYn7KwiQ,youtube#video,sKO3dY-R9q0,2022-05-30T07:44:01Z,UCHGAwygtFWAonSYfjeUv0iA,Identifying fake reviews on a Business using ML and Data | WiDS 2022,,https://i.ytimg.com/vi/sKO3dY-R9q0/default_live.jpg,120,90,https://i.ytimg.com/vi/sKO3dY-R9q0/mqdefault_live.jpg,320,180,https://i.ytimg.com/vi/sKO3dY-R9q0/hqdefault_live.jpg,480,360,Women in Data Science Regional,upcoming,2022-05-30T07:44:01Z
2,youtube#searchResult,wsFi9gFyXVuWTeTu_fjNyFN8RBs,youtube#video,VEoSYvmC-PE,2022-04-16T17:46:00Z,UCHGAwygtFWAonSYfjeUv0iA,ML applications in Customer Interactions,"Sravanthi Dhanekula, Engineering Lead at Google. This talk is organized in association with VIT Bhopal University. Special ...",https://i.ytimg.com/vi/VEoSYvmC-PE/default.jpg,120,90,https://i.ytimg.com/vi/VEoSYvmC-PE/mqdefault.jpg,320,180,https://i.ytimg.com/vi/VEoSYvmC-PE/hqdefault.jpg,480,360,Women in Data Science Regional,none,2022-04-16T17:46:00Z
3,youtube#searchResult,l7BgdR2kArn3N_xgyY72K0WzkG4,youtube#video,dxkg9NtHegQ,2022-03-23T04:18:55Z,UCHGAwygtFWAonSYfjeUv0iA,[Live] Akankshha Aggarwal | Machine Learning in the Payments World,Akankshha Aggrawal is a Data Analyst working in Google Cloud and Workspace in the Trust and Safety vertical. Her expertise lies ...,https://i.ytimg.com/vi/dxkg9NtHegQ/default.jpg,120,90,https://i.ytimg.com/vi/dxkg9NtHegQ/mqdefault.jpg,320,180,https://i.ytimg.com/vi/dxkg9NtHegQ/hqdefault.jpg,480,360,Women in Data Science Regional,none,2022-03-23T04:18:55Z
4,youtube#searchResult,1EhiAAGVuSNTAh2DMNPEKc8x_bQ,youtube#video,oPuAKEEUado,2022-03-09T03:58:40Z,UCHGAwygtFWAonSYfjeUv0iA,Live : Bushra Amiwala | WiDS Mumbai and Kerala 2022,We are delighted to share that Bushra Amiwala would be our first speaker for 2022 organized by WiDS Mumbai and Kerala on ...,https://i.ytimg.com/vi/oPuAKEEUado/default.jpg,120,90,https://i.ytimg.com/vi/oPuAKEEUado/mqdefault.jpg,320,180,https://i.ytimg.com/vi/oPuAKEEUado/hqdefault.jpg,480,360,Women in Data Science Regional,none,2022-03-09T03:58:40Z
0,youtube#searchResult,pzfSNQyN2IN3SFP2bh9MybGEQnw,youtube#video,7qn9dHaLFjI,2020-06-01T11:00:06Z,UCJ70w0WzWjWerpk3utRcAKA,The Linux terminal - 3 - Show the content of a file,Hello! This is a video on the Linux terminal and the bash shell. The goal is to introduce beginners to the command line and to the ...,https://i.ytimg.com/vi/7qn9dHaLFjI/default.jpg,120,90,https://i.ytimg.com/vi/7qn9dHaLFjI/mqdefault.jpg,320,180,https://i.ytimg.com/vi/7qn9dHaLFjI/hqdefault.jpg,480,360,The Digital Cat,none,2020-06-01T11:00:06Z
1,youtube#searchResult,92R9CY19ADJlsTkIhVZnvD2QdLo,youtube#video,6PpU-bEOPkQ,2020-05-25T11:00:04Z,UCJ70w0WzWjWerpk3utRcAKA,The Linux terminal - 2 - Print strings,Hello! This is a video on the Linux terminal and the bash shell. The goal is to introduce beginners to the command line and to the ...,https://i.ytimg.com/vi/6PpU-bEOPkQ/default.jpg,120,90,https://i.ytimg.com/vi/6PpU-bEOPkQ/mqdefault.jpg,320,180,https://i.ytimg.com/vi/6PpU-bEOPkQ/hqdefault.jpg,480,360,The Digital Cat,none,2020-05-25T11:00:04Z
2,youtube#searchResult,6P1NlvejvNSqOxO8uqOcvvTTdiM,youtube#video,35RKTf8ZrFs,2020-05-18T11:00:02Z,UCJ70w0WzWjWerpk3utRcAKA,The Linux terminal - 1 - How to get help,Hello! This is a video on the Linux terminal and the bash shell. The goal is to introduce beginners to the command line and to the ...,https://i.ytimg.com/vi/35RKTf8ZrFs/default.jpg,120,90,https://i.ytimg.com/vi/35RKTf8ZrFs/mqdefault.jpg,320,180,https://i.ytimg.com/vi/35RKTf8ZrFs/hqdefault.jpg,480,360,The Digital Cat,none,2020-05-18T11:00:02Z
3,youtube#searchResult,Xw1jk0C-jd74cR4rLt-2Ncxfvi0,youtube#video,3MYAkMMlDU0,2020-05-04T08:00:02Z,UCJ70w0WzWjWerpk3utRcAKA,Object-oriented programming in Python - Part 6 - Polymorphism,"Welcome to a new series of videos on the Python programming language. This time I want to tackle OOP, Object-oriented ...",https://i.ytimg.com/vi/3MYAkMMlDU0/default.jpg,120,90,https://i.ytimg.com/vi/3MYAkMMlDU0/mqdefault.jpg,320,180,https://i.ytimg.com/vi/3MYAkMMlDU0/hqdefault.jpg,480,360,The Digital Cat,none,2020-05-04T08:00:02Z
4,youtube#searchResult,XXT5Fg1tCE_r3yORtxL9dI-MNrY,youtube#video,FLwxJrwYHbo,2020-04-13T08:46:56Z,UCJ70w0WzWjWerpk3utRcAKA,Object-oriented programming in Python - Part 5 - Delegation: inheritance and composition,"Welcome to a new series of videos on the Python programming language. This time I want to tackle OOP, Object-oriented ...",https://i.ytimg.com/vi/FLwxJrwYHbo/default.jpg,120,90,https://i.ytimg.com/vi/FLwxJrwYHbo/mqdefault.jpg,320,180,https://i.ytimg.com/vi/FLwxJrwYHbo/hqdefault.jpg,480,360,The Digital Cat,none,2020-04-13T08:46:56Z
0,youtube#searchResult,RX4kt82Arzg1UTgU5KJQ-Ku5wFk,youtube#video,g5QWmWn3KGY,2021-04-26T02:43:57Z,UCGYPQz_qySbPESTK8k2ky5g,Announcing the 8 Week SQL Challenge - Start Your Data Science Journey,I'm super excited to announce the official launch of the #8WeekSQLChallenge - join me for a 1 hour SQL focused Q&A session to ...,https://i.ytimg.com/vi/g5QWmWn3KGY/default.jpg,120,90,https://i.ytimg.com/vi/g5QWmWn3KGY/mqdefault.jpg,320,180,https://i.ytimg.com/vi/g5QWmWn3KGY/hqdefault.jpg,480,360,Danny Ma,none,2021-04-26T02:43:57Z
1,youtube#searchResult,P5V6iK7IWrmqqK1d32SzcMrOrlQ,youtube#video,OO4W4SnIHhM,2021-03-30T13:48:54Z,UCGYPQz_qySbPESTK8k2ky5g,Machine Learning From Beginning To Advanced,A quick breakdown of different machine learning skills required for data science from beginner to advanced. This video is a ...,https://i.ytimg.com/vi/OO4W4SnIHhM/default.jpg,120,90,https://i.ytimg.com/vi/OO4W4SnIHhM/mqdefault.jpg,320,180,https://i.ytimg.com/vi/OO4W4SnIHhM/hqdefault.jpg,480,360,Danny Ma,none,2021-03-30T13:48:54Z
2,youtube#searchResult,BAJIKYCnU6Bigxps0y1oj2OCAUk,youtube#video,GnkIX10cLao,2021-03-23T13:11:30Z,UCGYPQz_qySbPESTK8k2ky5g,The 3 Types of Data Scientists,"A is for Analyst, B is for Builder and C is for Consultant - a Unicorn Data Scientist is someone who can do all 3 at an extreme level ...",https://i.ytimg.com/vi/GnkIX10cLao/default.jpg,120,90,https://i.ytimg.com/vi/GnkIX10cLao/mqdefault.jpg,320,180,https://i.ytimg.com/vi/GnkIX10cLao/hqdefault.jpg,480,360,Danny Ma,none,2021-03-23T13:11:30Z
3,youtube#searchResult,we5slTkxhiQMkUXIEzybmKKVZwM,youtube#video,ksciAXvvck0,2021-03-18T09:45:11Z,UCGYPQz_qySbPESTK8k2ky5g,How to Break Into Data Science in 2021,Are you interested in breaking into Data Science but don't know where to start? Don't worry that flying brain in the thumbnail has ...,https://i.ytimg.com/vi/ksciAXvvck0/default.jpg,120,90,https://i.ytimg.com/vi/ksciAXvvck0/mqdefault.jpg,320,180,https://i.ytimg.com/vi/ksciAXvvck0/hqdefault.jpg,480,360,Danny Ma,none,2021-03-18T09:45:11Z
4,youtube#searchResult,Q2COq11xt52Mwoyss3hm_Cq90AY,youtube#video,sdrY7pA-f2I,2021-03-12T16:07:02Z,UCGYPQz_qySbPESTK8k2ky5g,Ask Danny - Live Data Science Q&amp;A,"Join me at 2PM AEDT Friday 12th March for Q&A about data science, machine learning, career advice or anything else you'd like ...",https://i.ytimg.com/vi/sdrY7pA-f2I/default.jpg,120,90,https://i.ytimg.com/vi/sdrY7pA-f2I/mqdefault.jpg,320,180,https://i.ytimg.com/vi/sdrY7pA-f2I/hqdefault.jpg,480,360,Danny Ma,none,2021-03-12T16:07:02Z
0,youtube#searchResult,bGF8UZyBeS6jTICsFLzGiE__uZg,youtube#video,UlNt1rInC3I,2020-07-03T12:17:07Z,UCmWRF1AxelqS9hlbgI-SRWw,alb datastream1003 1080p 24fps,,https://i.ytimg.com/vi/UlNt1rInC3I/default.jpg,120,90,https://i.ytimg.com/vi/UlNt1rInC3I/mqdefault.jpg,320,180,https://i.ytimg.com/vi/UlNt1rInC3I/hqdefault.jpg,480,360,Brandon Rohrer,none,2020-07-03T12:17:07Z
0,youtube#searchResult,UFsH04gxe7epHUKDJUmGt9rMKoQ,youtube#video,g_6nQBsE4pU,2022-03-22T19:06:13Z,UCX7Y2qWriXpqocG97SFW2OQ,Jeremy Howard Interviews Kaggle Grandmaster Sanyam Bhutani,"Chai Time Data Science (CTDS) becomes ""Coffee Time Data Science"" for a one-time special episode! The genesis for this ...",https://i.ytimg.com/vi/g_6nQBsE4pU/default.jpg,120,90,https://i.ytimg.com/vi/g_6nQBsE4pU/mqdefault.jpg,320,180,https://i.ytimg.com/vi/g_6nQBsE4pU/hqdefault.jpg,480,360,Jeremy Howard,none,2022-03-22T19:06:13Z
1,youtube#searchResult,oHXx0Mzk1QWa0GTjdV9hMHvPq2Q,youtube#video,6hoqZp0aJDY,2022-01-13T03:47:56Z,UCX7Y2qWriXpqocG97SFW2OQ,Jeremy Howard on Studio 10 - Why we must all now upgrade our masks,"For context : this interview was for Australian TV. In Australia omicron is causing the economy, logistics chains, and healthcare to ...",https://i.ytimg.com/vi/6hoqZp0aJDY/default.jpg,120,90,https://i.ytimg.com/vi/6hoqZp0aJDY/mqdefault.jpg,320,180,https://i.ytimg.com/vi/6hoqZp0aJDY/hqdefault.jpg,480,360,Jeremy Howard,none,2022-01-13T03:47:56Z
2,youtube#searchResult,z6JlO_gSnjwbG1DqJDwiKd8Zr8E,youtube#video,0rEOjih_hps,2021-10-22T07:07:18Z,UCX7Y2qWriXpqocG97SFW2OQ,The GPGPU developer experience has a long way to go,An invited talk at the 2021 Victorian GPGPU Research Symposium - https://www.gpgpu.net.au/,https://i.ytimg.com/vi/0rEOjih_hps/default.jpg,120,90,https://i.ytimg.com/vi/0rEOjih_hps/mqdefault.jpg,320,180,https://i.ytimg.com/vi/0rEOjih_hps/hqdefault.jpg,480,360,Jeremy Howard,none,2021-10-22T07:07:18Z
3,youtube#searchResult,TJduHntQO2Vo2lyepLORlIT6EMA,youtube#video,dkojsBJ-S-g,2021-09-20T23:46:50Z,UCX7Y2qWriXpqocG97SFW2OQ,A short introduction to LaTeX and Overleaf,"LaTeX and Overleaf can seem quite complicated when you first start out, but actually once you know the basics it's a much easier ...",https://i.ytimg.com/vi/dkojsBJ-S-g/default.jpg,120,90,https://i.ytimg.com/vi/dkojsBJ-S-g/mqdefault.jpg,320,180,https://i.ytimg.com/vi/dkojsBJ-S-g/hqdefault.jpg,480,360,Jeremy Howard,none,2021-09-20T23:46:50Z
4,youtube#searchResult,PC5ffq3YUybXW3iOc0FojX1o4Dg,youtube#video,0MI0Te7EgtA,2021-07-14T00:59:38Z,UCX7Y2qWriXpqocG97SFW2OQ,My Journey to Deep Learning,For 20 years I used a wide variety of machine learning and optimization algorithms to tackle predictive modeling challenges in ...,https://i.ytimg.com/vi/0MI0Te7EgtA/default.jpg,120,90,https://i.ytimg.com/vi/0MI0Te7EgtA/mqdefault.jpg,320,180,https://i.ytimg.com/vi/0MI0Te7EgtA/hqdefault.jpg,480,360,Jeremy Howard,none,2021-07-14T00:59:38Z
0,youtube#searchResult,ExxcJCDR_N004jUL-ssg11uJtXE,youtube#video,f3zbKGf_GVw,2022-05-30T14:06:08Z,UC7kFLyCRK3gQmiSBaFRzgnA,Enabling Property Risk Intelligence with Earth Observation AI | AI &amp; Industry | Ciprian Tomoiagă,"AI & Industry ""Enabling Property Risk Intelligence with Earth Observation AI"" Ciprian Tomoiagă The Applied Machine Learning ...",https://i.ytimg.com/vi/f3zbKGf_GVw/default.jpg,120,90,https://i.ytimg.com/vi/f3zbKGf_GVw/mqdefault.jpg,320,180,https://i.ytimg.com/vi/f3zbKGf_GVw/hqdefault.jpg,480,360,Applied Machine Learning Days,none,2022-05-30T14:06:08Z
1,youtube#searchResult,dQiD9dxUziN9-0fEXhVK0CHA-yk,youtube#video,Dpc7Iz8oBKE,2022-05-30T08:07:43Z,UC7kFLyCRK3gQmiSBaFRzgnA,Human-in-the-loop Low cost manufacturing data labeling | AI &amp; Manufacturing | Walid Daboubi,"AI & Manufacturing ""Human-in-the-loop Low cost manufacturing data labeling"" Walid Daboubi The Applied Machine Learning ...",https://i.ytimg.com/vi/Dpc7Iz8oBKE/default.jpg,120,90,https://i.ytimg.com/vi/Dpc7Iz8oBKE/mqdefault.jpg,320,180,https://i.ytimg.com/vi/Dpc7Iz8oBKE/hqdefault.jpg,480,360,Applied Machine Learning Days,none,2022-05-30T08:07:43Z
2,youtube#searchResult,6-CWYhBVWWJ9eIoOz4l2XHICfSg,youtube#video,jVOzMoz5ikI,2022-05-12T11:48:57Z,UC7kFLyCRK3gQmiSBaFRzgnA,Computer Vision for Mixed Reality | Microsoft Swiss Joint Research Center | Marc Pollefeys,"Microsoft Swiss Joint Research Center – Day 2 – Computer vision and Mixed Reality ""Computer Vision for Mixed Reality"" Marc ...",https://i.ytimg.com/vi/jVOzMoz5ikI/default.jpg,120,90,https://i.ytimg.com/vi/jVOzMoz5ikI/mqdefault.jpg,320,180,https://i.ytimg.com/vi/jVOzMoz5ikI/hqdefault.jpg,480,360,Applied Machine Learning Days,none,2022-05-12T11:48:57Z
3,youtube#searchResult,iHBUOB3nehgzt-brhuu7V7LSlNo,youtube#video,JLfjG_BnM_s,2022-05-11T10:30:00Z,UC7kFLyCRK3gQmiSBaFRzgnA,Robust and Interpretable Learning for Healthcare | AI &amp; Healthcare | Dorina Thanou,"AI & Healthcare ""Robust and Interpretable Learning for Healthcare"" Dorina Thanou The Applied Machine Learning Days channel ...",https://i.ytimg.com/vi/JLfjG_BnM_s/default.jpg,120,90,https://i.ytimg.com/vi/JLfjG_BnM_s/mqdefault.jpg,320,180,https://i.ytimg.com/vi/JLfjG_BnM_s/hqdefault.jpg,480,360,Applied Machine Learning Days,none,2022-05-11T10:30:00Z
4,youtube#searchResult,9KUomdM40ydTkO8wtDs-fh9VH98,youtube#video,mooseyAkvl8,2022-05-06T12:16:30Z,UC7kFLyCRK3gQmiSBaFRzgnA,Securing Cloud Deployments for the International Committee of the Red Cross | Ivan Puddu,"Microsoft Swiss Joint Research Center – Day 1 – AI, Confidential Computing, Health, Cloud and Systems ""Securing Cloud ...",https://i.ytimg.com/vi/mooseyAkvl8/default.jpg,120,90,https://i.ytimg.com/vi/mooseyAkvl8/mqdefault.jpg,320,180,https://i.ytimg.com/vi/mooseyAkvl8/hqdefault.jpg,480,360,Applied Machine Learning Days,none,2022-05-06T12:16:30Z
0,youtube#searchResult,kp92DnZVMuVYL6dh92RURZn8Wlg,youtube#video,9paQh7EcWsM,2021-12-16T06:08:30Z,UCspapbPlDQn1Tc7Pym2KMTw,"NLP with Friends, Featured Friend: Boaz Shmueli",New methods for automated collection of sarcasm and affective data.,https://i.ytimg.com/vi/9paQh7EcWsM/default.jpg,120,90,https://i.ytimg.com/vi/9paQh7EcWsM/mqdefault.jpg,320,180,https://i.ytimg.com/vi/9paQh7EcWsM/hqdefault.jpg,480,360,NLP with Friends,none,2021-12-16T06:08:30Z
1,youtube#searchResult,q0LQOrc4yCGyY7oahE0Ccj4Ba58,youtube#video,6584JiBX_Z8,2021-12-02T06:13:46Z,UCspapbPlDQn1Tc7Pym2KMTw,"NLP with Friends, Featured Friend: Tuhin Chakrabarty",The Curious Case of Figurative Language.,https://i.ytimg.com/vi/6584JiBX_Z8/default.jpg,120,90,https://i.ytimg.com/vi/6584JiBX_Z8/mqdefault.jpg,320,180,https://i.ytimg.com/vi/6584JiBX_Z8/hqdefault.jpg,480,360,NLP with Friends,none,2021-12-02T06:13:46Z
2,youtube#searchResult,CHQ0U3rlceTZjVmqm0hlSJMVZa4,youtube#video,1_h-pmq6298,2021-11-18T03:07:00Z,UCspapbPlDQn1Tc7Pym2KMTw,"NLP with Friends, Featured Friend: Alane Suhr",Learning and Using Natural Language in Interaction.,https://i.ytimg.com/vi/1_h-pmq6298/default.jpg,120,90,https://i.ytimg.com/vi/1_h-pmq6298/mqdefault.jpg,320,180,https://i.ytimg.com/vi/1_h-pmq6298/hqdefault.jpg,480,360,NLP with Friends,none,2021-11-18T03:07:00Z
3,youtube#searchResult,wm3ELGehjsAyzFSv540Y1mwOZlQ,youtube#video,fSEyOeTpv5c,2021-11-04T03:06:09Z,UCspapbPlDQn1Tc7Pym2KMTw,"NLP with Friends, Featured Friend: Maria Ryskina",Romanization with Friends: Deciphering Informally Romanized Text.,https://i.ytimg.com/vi/fSEyOeTpv5c/default.jpg,120,90,https://i.ytimg.com/vi/fSEyOeTpv5c/mqdefault.jpg,320,180,https://i.ytimg.com/vi/fSEyOeTpv5c/hqdefault.jpg,480,360,NLP with Friends,none,2021-11-04T03:06:09Z
4,youtube#searchResult,KzE_WsZnK4EQJ5oysMx50KYozzs,youtube#video,RNCmuidht5Q,2021-10-21T03:03:17Z,UCspapbPlDQn1Tc7Pym2KMTw,"NLP with Friends, Featured Friend: Eleftheria Briakou",How do cross-lingual semantic divergences impact neural machine translation?,https://i.ytimg.com/vi/RNCmuidht5Q/default.jpg,120,90,https://i.ytimg.com/vi/RNCmuidht5Q/mqdefault.jpg,320,180,https://i.ytimg.com/vi/RNCmuidht5Q/hqdefault.jpg,480,360,NLP with Friends,none,2021-10-21T03:03:17Z
0,youtube#searchResult,UIi_IT2BaP9almEOzPrTkbOeUdg,youtube#video,gG78VWREcSU,2022-03-31T15:26:27Z,UCVlPeQjsKct9bXoC1Qlp1qA,TVBEHub In Conversation With... GradSpire,"Listen in as we chat about skills for jobs and regional support for skills development with Gradspire Project Coordinator, Ella ...",https://i.ytimg.com/vi/gG78VWREcSU/default.jpg,120,90,https://i.ytimg.com/vi/gG78VWREcSU/mqdefault.jpg,320,180,https://i.ytimg.com/vi/gG78VWREcSU/hqdefault.jpg,480,360,TVAI Hub,none,2022-03-31T15:26:27Z
1,youtube#searchResult,hjwsD69tmy98GPHVtY2GbP0ibeY,youtube#video,3U4-7Y-epFw,2022-03-21T16:28:56Z,UCVlPeQjsKct9bXoC1Qlp1qA,AI at the University of Reading,Index: 0:00:15 Introductions 0:02:22 Dr Varun Ojha - Anything Repeatable is Replaceable by Artificial Intelligence: Opportunities ...,https://i.ytimg.com/vi/3U4-7Y-epFw/default.jpg,120,90,https://i.ytimg.com/vi/3U4-7Y-epFw/mqdefault.jpg,320,180,https://i.ytimg.com/vi/3U4-7Y-epFw/hqdefault.jpg,480,360,TVAI Hub,none,2022-03-21T16:28:56Z
2,youtube#searchResult,aWAgEZ0Yi47y9zDfBB3yk6_VEII,youtube#video,fECQRR8aYPA,2022-03-08T16:47:27Z,UCVlPeQjsKct9bXoC1Qlp1qA,"Developing data driven solutions in Healthcare, what are the realities?",This recording includes details of how to engage with a hospital and successfully deliver a collaborative project. Speakers ...,https://i.ytimg.com/vi/fECQRR8aYPA/default.jpg,120,90,https://i.ytimg.com/vi/fECQRR8aYPA/mqdefault.jpg,320,180,https://i.ytimg.com/vi/fECQRR8aYPA/hqdefault.jpg,480,360,TVAI Hub,none,2022-03-08T16:47:27Z
3,youtube#searchResult,xsgJ74KhCvM8ipJ6c0HyAcO8RiY,youtube#video,cPF-hCawHII,2021-12-02T18:34:55Z,UCVlPeQjsKct9bXoC1Qlp1qA,Getting data right for AI,"Be amongst the first to hear about new events, current funding opportunities and information on local business support services by ...",https://i.ytimg.com/vi/cPF-hCawHII/default.jpg,120,90,https://i.ytimg.com/vi/cPF-hCawHII/mqdefault.jpg,320,180,https://i.ytimg.com/vi/cPF-hCawHII/hqdefault.jpg,480,360,TVAI Hub,none,2021-12-02T18:34:55Z
4,youtube#searchResult,iqigzOcl65KAfhQhZhgSrV1UODo,youtube#video,GQY76ItGtuM,2021-02-13T21:24:18Z,UCVlPeQjsKct9bXoC1Qlp1qA,How to make data science more racially inclusive,"Taking place on Wednesday 10th February 2021, this virtual event highlights the issues and impact of racial biases in AI/ML ...",https://i.ytimg.com/vi/GQY76ItGtuM/default.jpg,120,90,https://i.ytimg.com/vi/GQY76ItGtuM/mqdefault.jpg,320,180,https://i.ytimg.com/vi/GQY76ItGtuM/hqdefault.jpg,480,360,TVAI Hub,none,2021-02-13T21:24:18Z
0,youtube#searchResult,YGqbceCHhLA6-tkHv8XC39Ygjjc,youtube#video,czlAAEyTyKs,2022-05-09T15:00:31Z,UCUcpVoi5KkJmnE3bvEhHR0Q,A simple bot to unsubscribe from all your annoying emails,My Patreon : https://www.patreon.com/user?u=49277905 Link to Code ...,https://i.ytimg.com/vi/czlAAEyTyKs/default.jpg,120,90,https://i.ytimg.com/vi/czlAAEyTyKs/mqdefault.jpg,320,180,https://i.ytimg.com/vi/czlAAEyTyKs/hqdefault.jpg,480,360,ritvikmath,none,2022-05-09T15:00:31Z
1,youtube#searchResult,i-e-c5mXSPR0shzwulgbmSFQd8o,youtube#video,7UeS-sr-KBA,2022-05-03T15:15:00Z,UCUcpVoi5KkJmnE3bvEhHR0Q,Supply and Demand Simply Explained!,My Patreon : https://www.patreon.com/user?u=49277905.,https://i.ytimg.com/vi/7UeS-sr-KBA/default.jpg,120,90,https://i.ytimg.com/vi/7UeS-sr-KBA/mqdefault.jpg,320,180,https://i.ytimg.com/vi/7UeS-sr-KBA/hqdefault.jpg,480,360,ritvikmath,none,2022-05-03T15:15:00Z
2,youtube#searchResult,7yP5VYyNWY3fQ42DFtYqdRJVT1g,youtube#video,eYO9RNKXBDk,2022-04-25T15:00:18Z,UCUcpVoi5KkJmnE3bvEhHR0Q,Why the heck are gas stations always right next to each other ?!,My Patreon : https://www.patreon.com/user?u=49277905 Icon References : https://www.flaticon.com/free-icons/sea-life ...,https://i.ytimg.com/vi/eYO9RNKXBDk/default.jpg,120,90,https://i.ytimg.com/vi/eYO9RNKXBDk/mqdefault.jpg,320,180,https://i.ytimg.com/vi/eYO9RNKXBDk/hqdefault.jpg,480,360,ritvikmath,none,2022-04-25T15:00:18Z
3,youtube#searchResult,CPT4aZvMn6oROJirvpw30fIP85A,youtube#video,xy96ArOpntA,2022-04-18T14:30:10Z,UCUcpVoi5KkJmnE3bvEhHR0Q,EM Algorithm : Data Science Concepts,I really struggled to learn this for a long time! All about the Expectation-Maximization Algorithm. My Patreon ...,https://i.ytimg.com/vi/xy96ArOpntA/default.jpg,120,90,https://i.ytimg.com/vi/xy96ArOpntA/mqdefault.jpg,320,180,https://i.ytimg.com/vi/xy96ArOpntA/hqdefault.jpg,480,360,ritvikmath,none,2022-04-18T14:30:10Z
4,youtube#searchResult,UYbtShZ2IWCENtv2lSpP3rI-1Ew,youtube#video,l_zvHLIJ53w,2022-03-21T14:00:30Z,UCUcpVoi5KkJmnE3bvEhHR0Q,Coding PCA from Scratch : Data Science Code,My Patreon : https://www.patreon.com/user?u=49277905 PCA : https://www.youtube.com/watch?v=pmG4K79DUoI PCA Math ...,https://i.ytimg.com/vi/l_zvHLIJ53w/default.jpg,120,90,https://i.ytimg.com/vi/l_zvHLIJ53w/mqdefault.jpg,320,180,https://i.ytimg.com/vi/l_zvHLIJ53w/hqdefault.jpg,480,360,ritvikmath,none,2022-03-21T14:00:30Z
0,youtube#searchResult,7p6ZNy5S9IFQh9VolIxcxaMDt2Q,youtube#video,2Wzj9Iu9Ey4,2021-03-03T19:30:18Z,UCjRjkk9nmIqSYwZ1zdxFw_g,Databricks Data Platform: Hadoop Modernización,Porque migrar de Hadoop hacia Databricks? Te comentamos durante este webinar y Demo.,https://i.ytimg.com/vi/2Wzj9Iu9Ey4/default.jpg,120,90,https://i.ytimg.com/vi/2Wzj9Iu9Ey4/mqdefault.jpg,320,180,https://i.ytimg.com/vi/2Wzj9Iu9Ey4/hqdefault.jpg,480,360,Databricks America Latina,none,2021-03-03T19:30:18Z
1,youtube#searchResult,P1X53lAwV_rFUh4Ef2nlFRC5sEg,youtube#video,ewdP1_coRyo,2021-02-09T19:42:42Z,UCjRjkk9nmIqSYwZ1zdxFw_g,Capsula 2 - Lakehouse,Aprende más sobre el nuevo paradigma: Lakehouse.,https://i.ytimg.com/vi/ewdP1_coRyo/default.jpg,120,90,https://i.ytimg.com/vi/ewdP1_coRyo/mqdefault.jpg,320,180,https://i.ytimg.com/vi/ewdP1_coRyo/hqdefault.jpg,480,360,Databricks America Latina,none,2021-02-09T19:42:42Z
2,youtube#searchResult,5_JkuF02uIP3TphZTdcZgTzO6OM,youtube#video,t7f18haq_1Y,2020-12-17T17:27:59Z,UCjRjkk9nmIqSYwZ1zdxFw_g,Capsula 1 - Databricks Unified Data Analytics Platform,Aprende más sobre nuestro concepto UDAP.,https://i.ytimg.com/vi/t7f18haq_1Y/default.jpg,120,90,https://i.ytimg.com/vi/t7f18haq_1Y/mqdefault.jpg,320,180,https://i.ytimg.com/vi/t7f18haq_1Y/hqdefault.jpg,480,360,Databricks America Latina,none,2020-12-17T17:27:59Z
3,youtube#searchResult,gJTeVdSUYPRtSm-p1kuYUHGiGZA,youtube#video,KFtnR53YlO8,2020-12-01T21:39:20Z,UCjRjkk9nmIqSYwZ1zdxFw_g,Databricks Webinar: Construye una plataforma para minimizar el riesgo,"Agenda: Introducción Plataforma Databricks Ecosistema Databricks: Delta Lake, Spark, ML Flow Demostracion.",https://i.ytimg.com/vi/KFtnR53YlO8/default.jpg,120,90,https://i.ytimg.com/vi/KFtnR53YlO8/mqdefault.jpg,320,180,https://i.ytimg.com/vi/KFtnR53YlO8/hqdefault.jpg,480,360,Databricks America Latina,none,2020-12-01T21:39:20Z
0,youtube#searchResult,zLQ7pTjNYi5lLscarALgV7U9Sso,youtube#video,c_-wixIS06Y,2022-05-31T10:45:03Z,UC3NDbeN0Jq_InNAhiJtvHcQ,10 років в .NET,"Програміст і блогер АйТиБорода розповів про його досвід в .NET. А повне відео з 4-го випуску подкасту ""Right Tool For The ...",https://i.ytimg.com/vi/c_-wixIS06Y/default.jpg,120,90,https://i.ytimg.com/vi/c_-wixIS06Y/mqdefault.jpg,320,180,https://i.ytimg.com/vi/c_-wixIS06Y/hqdefault.jpg,480,360,fwdays,none,2022-05-31T10:45:03Z
1,youtube#searchResult,ZOvYDAtZfguhPok1Ugo73Se7IQA,youtube#video,6cgitaV72A4,2022-05-31T10:35:13Z,UC3NDbeN0Jq_InNAhiJtvHcQ,Web Vitals monitoring &amp; optimizations [ru] / Эрик Гимиранов,"Видео с онлайн-конференции Fwdays: JS is back!, которая прошла с 23 ноября по 3 декабря 2021 года. Описание доклада: ...",https://i.ytimg.com/vi/6cgitaV72A4/default.jpg,120,90,https://i.ytimg.com/vi/6cgitaV72A4/mqdefault.jpg,320,180,https://i.ytimg.com/vi/6cgitaV72A4/hqdefault.jpg,480,360,fwdays,none,2022-05-31T10:35:13Z
2,youtube#searchResult,TO-pQz8JVkjhTP8ykk8iBFURiMA,youtube#video,da18mXDxJg4,2022-05-30T12:24:08Z,UC3NDbeN0Jq_InNAhiJtvHcQ,Усовершенствуем процесс аутентификации [ru] / Антон Немцев,"Видео с онлайн-конференции Fwdays: JS is back!, которая прошла с 23 ноября по 3 декабря 2021 года. Описание доклада: ...",https://i.ytimg.com/vi/da18mXDxJg4/default.jpg,120,90,https://i.ytimg.com/vi/da18mXDxJg4/mqdefault.jpg,320,180,https://i.ytimg.com/vi/da18mXDxJg4/hqdefault.jpg,480,360,fwdays,none,2022-05-30T12:24:08Z
3,youtube#searchResult,9F4yPBcou1tfv8EeR9J8zL51bi8,youtube#video,n6jdVROs2nY,2022-05-27T14:57:20Z,UC3NDbeN0Jq_InNAhiJtvHcQ,Как работает новая корзина Prom.ua в форме микрофронтенда [ru] / Данила Казимиров,"Видео с онлайн-конференции Fwdays: JS is back!, которая прошла с 23 ноября по 3 декабря 2021 года. Описание доклада: ...",https://i.ytimg.com/vi/n6jdVROs2nY/default.jpg,120,90,https://i.ytimg.com/vi/n6jdVROs2nY/mqdefault.jpg,320,180,https://i.ytimg.com/vi/n6jdVROs2nY/hqdefault.jpg,480,360,fwdays,none,2022-05-27T14:57:20Z
4,youtube#searchResult,uMijp0d1dWoep2sNNHBrmFXwA5w,youtube#video,1k_HYTPN4Ao,2022-05-26T18:26:45Z,UC3NDbeN0Jq_InNAhiJtvHcQ,Благодійний стрім з Артемом Захарченко. Збираємо 600 000 грн на потужний коптер для ЗСУ.,Благодійний стрім з Артемом Захарченко - організатором конференції KharkivJS та Solution Architect / Head JavaScript в ...,https://i.ytimg.com/vi/1k_HYTPN4Ao/default.jpg,120,90,https://i.ytimg.com/vi/1k_HYTPN4Ao/mqdefault.jpg,320,180,https://i.ytimg.com/vi/1k_HYTPN4Ao/hqdefault.jpg,480,360,fwdays,none,2022-05-26T18:26:45Z
0,youtube#searchResult,oNQQISkGOG0SBUpnRs6OAo5snpM,youtube#video,31k2AoqxWX0,2022-03-14T07:00:01Z,UCRF82wX0EPwqvKMBwvB4fQg,The future of EdgeDB (2022) — Yury Selivanov | EdgeDB Day,"Co-founder and CEO of EdgeDB talks about what's ahead: upcoming features, the v2.0 release timetable, and EdgeDB Cloud.",https://i.ytimg.com/vi/31k2AoqxWX0/default.jpg,120,90,https://i.ytimg.com/vi/31k2AoqxWX0/mqdefault.jpg,320,180,https://i.ytimg.com/vi/31k2AoqxWX0/hqdefault.jpg,480,360,EdgeDB,none,2022-03-14T07:00:01Z
