,kind,etag,id.kind,id.videoId,snippet.publishedAt,snippet.channelId,snippet.title,snippet.description,snippet.thumbnails.default.url,snippet.thumbnails.default.width,snippet.thumbnails.default.height,snippet.thumbnails.medium.url,snippet.thumbnails.medium.width,snippet.thumbnails.medium.height,snippet.thumbnails.high.url,snippet.thumbnails.high.width,snippet.thumbnails.high.height,snippet.channelTitle,snippet.liveBroadcastContent,snippet.publishTime
0,youtube#searchResult,q_pijPGU7FA86jzu0C2Tvr_xkBs,youtube#video,MvuIu6l7i4o,2023-12-17T22:38:03Z,UCYqdrfvhGxNW3vXebypqXoQ,Welcome! [PyOhio 2023],Plenary Session by Dave Forgac at PyOhio 2023: Welcome to PyOhio! Here is some important information before we get started: ...,https://i.ytimg.com/vi/MvuIu6l7i4o/default.jpg,120,90,https://i.ytimg.com/vi/MvuIu6l7i4o/mqdefault.jpg,320,180,https://i.ytimg.com/vi/MvuIu6l7i4o/hqdefault.jpg,480,360,PyOhio,none,2023-12-17T22:38:03Z
1,youtube#searchResult,tvI3nsQoxq0BaGA4COBNlBCsqrA,youtube#video,3PyvWkQsjeM,2023-12-17T22:38:03Z,UCYqdrfvhGxNW3vXebypqXoQ,How Many Times Can One Line Fail? ExceptionGroups &amp; Except*: What They Are and How to  [PyOhio 2023],"Talk by Andrew Kubera at PyOhio 2023: Async programming can make complex things easy, but at the same time be hard to get ...",https://i.ytimg.com/vi/3PyvWkQsjeM/default.jpg,120,90,https://i.ytimg.com/vi/3PyvWkQsjeM/mqdefault.jpg,320,180,https://i.ytimg.com/vi/3PyvWkQsjeM/hqdefault.jpg,480,360,PyOhio,none,2023-12-17T22:38:03Z
2,youtube#searchResult,PW5jBnyJj1yRKcuWUFfJcLHEjSg,youtube#video,eF2EQFaPEJg,2023-12-17T22:38:03Z,UCYqdrfvhGxNW3vXebypqXoQ,Build a Web Map with PyScript! [PyOhio 2023],"Talk by Christy Heaton at PyOhio 2023: PyScript allows you to run Python code in a browser, like JavaScript does. It also lets you ...",https://i.ytimg.com/vi/eF2EQFaPEJg/default.jpg,120,90,https://i.ytimg.com/vi/eF2EQFaPEJg/mqdefault.jpg,320,180,https://i.ytimg.com/vi/eF2EQFaPEJg/hqdefault.jpg,480,360,PyOhio,none,2023-12-17T22:38:03Z
3,youtube#searchResult,A_8N3W-9UwEvlYbfwU0gnSUlkH4,youtube#video,52b4Tg74Fu0,2023-12-17T22:38:04Z,UCYqdrfvhGxNW3vXebypqXoQ,Thank You &amp; Looking Ahead to PyOhio 2024 [PyOhio 2023],"Plenary Session by Dave Forgac & Kattni at PyOhio 2023: Thank you to everyone who helped make PyOhio happen this year, ...",https://i.ytimg.com/vi/52b4Tg74Fu0/default.jpg,120,90,https://i.ytimg.com/vi/52b4Tg74Fu0/mqdefault.jpg,320,180,https://i.ytimg.com/vi/52b4Tg74Fu0/hqdefault.jpg,480,360,PyOhio,none,2023-12-17T22:38:04Z
4,youtube#searchResult,CV-DYlTDfZ0og_ABIcKciB7UQsU,youtube#video,3tqLanasKUY,2023-12-17T22:37:35Z,UCYqdrfvhGxNW3vXebypqXoQ,"Exploring OpenSearch, Python, and Serverless: Crafting Efficient and Modern Search App [PyOhio 2023]","Talk by Laysa Uchoa & Yuliia Barabash at PyOhio 2023: OpenSearch, a community-driven, open-source project, offers a robust ...",https://i.ytimg.com/vi/3tqLanasKUY/default.jpg,120,90,https://i.ytimg.com/vi/3tqLanasKUY/mqdefault.jpg,320,180,https://i.ytimg.com/vi/3tqLanasKUY/hqdefault.jpg,480,360,PyOhio,none,2023-12-17T22:37:35Z
0,youtube#searchResult,nz3OGGAZQ7O3peYWcAeiL1G6cCo,youtube#video,s2ugvkipu2Y,2021-09-15T00:45:18Z,UCS9sdEyduD9K83K3GkvQlOA,&quot;Conference Close&quot; - Richard Jones (PyConline AU 2021),"(Richard Jones) Conference close, logistics, and Sunday event information https://pretalx.com/pycon-au-2021/talk/AYP8FC/ ...",https://i.ytimg.com/vi/s2ugvkipu2Y/default.jpg,120,90,https://i.ytimg.com/vi/s2ugvkipu2Y/mqdefault.jpg,320,180,https://i.ytimg.com/vi/s2ugvkipu2Y/hqdefault.jpg,480,360,PyCon AU,none,2021-09-15T00:45:18Z
1,youtube#searchResult,1ADpMjVM74PZWcnk8kRssapVgJ4,youtube#video,ZF4BARKBRjc,2021-09-15T00:12:08Z,UCS9sdEyduD9K83K3GkvQlOA,&quot;Python Versions and Dependencies Made Easy&quot; - Sebastian Witowski (PyConline AU 2021),"(Sebastian Witowski) Presentation on using pyenv, virtual environments, and pipx to build an easy-to-manage Python ...",https://i.ytimg.com/vi/ZF4BARKBRjc/default.jpg,120,90,https://i.ytimg.com/vi/ZF4BARKBRjc/mqdefault.jpg,320,180,https://i.ytimg.com/vi/ZF4BARKBRjc/hqdefault.jpg,480,360,PyCon AU,none,2021-09-15T00:12:08Z
2,youtube#searchResult,ZZSCYhhT2PjzwLAIHCu3PqivI-A,youtube#video,9_tS2N__8N0,2021-09-15T00:12:13Z,UCS9sdEyduD9K83K3GkvQlOA,"No, Maybe and Close Enough! Probabilistic Data Structures with Python and Redis",(Simon Prickett) Being right all the time isn't necessarily the best idea. This talk examines how to count distinct items from a ...,https://i.ytimg.com/vi/9_tS2N__8N0/default.jpg,120,90,https://i.ytimg.com/vi/9_tS2N__8N0/mqdefault.jpg,320,180,https://i.ytimg.com/vi/9_tS2N__8N0/hqdefault.jpg,480,360,PyCon AU,none,2021-09-15T00:12:13Z
3,youtube#searchResult,6FfNcYlv7wgbN1nXWM5ubc24OBA,youtube#video,GeyiWsy5oWQ,2021-09-15T00:12:05Z,UCS9sdEyduD9K83K3GkvQlOA,&quot;What was your Python up to at 3am?&quot; - Garth Kidd (PyConline AU 2021),"(Garth Kidd) If a customer was hopping mad overnight, but your monitoring dashboard shows its usual green line at 99.5% superb ...",https://i.ytimg.com/vi/GeyiWsy5oWQ/default.jpg,120,90,https://i.ytimg.com/vi/GeyiWsy5oWQ/mqdefault.jpg,320,180,https://i.ytimg.com/vi/GeyiWsy5oWQ/hqdefault.jpg,480,360,PyCon AU,none,2021-09-15T00:12:05Z
4,youtube#searchResult,X2KvkZol7SF-6wLOPHt7mdMLkAg,youtube#video,KQZym_PmwxY,2021-09-15T00:12:01Z,UCS9sdEyduD9K83K3GkvQlOA,"&quot;Snakes all the way down, building Worlds with Python code&quot; - Sam Bishop (PyConline AU 2021)",(Sam Bishop) This talk will introduce and demonstrate a selection of procedural content generation tools built with Python.,https://i.ytimg.com/vi/KQZym_PmwxY/default.jpg,120,90,https://i.ytimg.com/vi/KQZym_PmwxY/mqdefault.jpg,320,180,https://i.ytimg.com/vi/KQZym_PmwxY/hqdefault.jpg,480,360,PyCon AU,none,2021-09-15T00:12:01Z
0,youtube#searchResult,nM5vkSWt7o5sd2yYPiUd9r-Lm4Q,youtube#video,z4wSSuKuA04,2019-10-08T15:26:39Z,UCHh7vOesookNhYvupCCcJxA,Women in Tech Panel - PyLondinium 2019,The PyLondinium 2019 Women in Tech Panel has an in-depth discussion about promoting diversity and inclusion in the work ...,https://i.ytimg.com/vi/z4wSSuKuA04/default.jpg,120,90,https://i.ytimg.com/vi/z4wSSuKuA04/mqdefault.jpg,320,180,https://i.ytimg.com/vi/z4wSSuKuA04/hqdefault.jpg,480,360,PyLondinium,none,2019-10-08T15:26:39Z
1,youtube#searchResult,z0lGwGjSR4sGFBJOJGqJXLJdRSA,youtube#video,xNuz3WEk6AE,2019-10-08T13:55:09Z,UCHh7vOesookNhYvupCCcJxA,Keynote: The M Word - Anna Ossowski - PyLondinium19,"In a world where you can be anything, be kind. ** Copyright belongs to the speaker **",https://i.ytimg.com/vi/xNuz3WEk6AE/default.jpg,120,90,https://i.ytimg.com/vi/xNuz3WEk6AE/mqdefault.jpg,320,180,https://i.ytimg.com/vi/xNuz3WEk6AE/hqdefault.jpg,480,360,PyLondinium,none,2019-10-08T13:55:09Z
2,youtube#searchResult,hVVjJneZceg2PX9-t008aAT4raQ,youtube#video,OSnRl8yF9a4,2019-09-18T17:05:11Z,UCHh7vOesookNhYvupCCcJxA,How to best package your library? - Bernát Gábor - PyLondinium19,"One of the most fundamental principles of programming is ""don't repeat yourself."" Join me in finding out how you can achieve ...",https://i.ytimg.com/vi/OSnRl8yF9a4/default.jpg,120,90,https://i.ytimg.com/vi/OSnRl8yF9a4/mqdefault.jpg,320,180,https://i.ytimg.com/vi/OSnRl8yF9a4/hqdefault.jpg,480,360,PyLondinium,none,2019-09-18T17:05:11Z
3,youtube#searchResult,fG6Vd37aqc6qfXRQOjsBiorJxnI,youtube#video,avLK67SHeAs,2019-09-18T17:00:14Z,UCHh7vOesookNhYvupCCcJxA,The soul of the beast: Everything about Python’s grammar - Pablo Galindo Salgado - PyLondinium19,We will try to answer a straightforward question: What makes Python so easy to learn and read? Other languages also have a ...,https://i.ytimg.com/vi/avLK67SHeAs/default.jpg,120,90,https://i.ytimg.com/vi/avLK67SHeAs/mqdefault.jpg,320,180,https://i.ytimg.com/vi/avLK67SHeAs/hqdefault.jpg,480,360,PyLondinium,none,2019-09-18T17:00:14Z
4,youtube#searchResult,xZ4KPnSJm122Iq74YrCsQVbr81Y,youtube#video,WOlLYckxeLc,2019-09-18T16:42:10Z,UCHh7vOesookNhYvupCCcJxA,The Adventures of pip and pacman: A Tale of Package Managers - László Kiss Kollár - PyLondinium19,Overview Installing Python packages can be frustrating for new (and even not so new) users of Python. If we simply follow the ...,https://i.ytimg.com/vi/WOlLYckxeLc/default.jpg,120,90,https://i.ytimg.com/vi/WOlLYckxeLc/mqdefault.jpg,320,180,https://i.ytimg.com/vi/WOlLYckxeLc/hqdefault.jpg,480,360,PyLondinium,none,2019-09-18T16:42:10Z
0,youtube#searchResult,PsQk_IMLNaJsKjtw3GoBLwKnQ6o,youtube#video,uARIj9eAZcQ,2022-09-19T08:08:53Z,UChA9XP_feY1-1oSy2L7acog,Exception Groups and except: Irit Katriel,Python 3.11 introduces new features that make it possible to raise and handle multiple unrelated exceptions. This talk briefly ...,https://i.ytimg.com/vi/uARIj9eAZcQ/default.jpg,120,90,https://i.ytimg.com/vi/uARIj9eAZcQ/mqdefault.jpg,320,180,https://i.ytimg.com/vi/uARIj9eAZcQ/hqdefault.jpg,480,360,PyCon UK,none,2022-09-19T08:08:53Z
1,youtube#searchResult,cMyR2JYXIABzVP_5gEaOlNSv0Dg,youtube#video,NbkD0hNyetg,2022-09-18T21:42:37Z,UChA9XP_feY1-1oSy2L7acog,PYCON UK 2022: Sunday Lightning Talks and closing session,Hosted by Mark Smith Ian Thomas: Visualising large datasets Adam Johnson: My PyCon photos George Angelchev: How to keep ...,https://i.ytimg.com/vi/NbkD0hNyetg/default.jpg,120,90,https://i.ytimg.com/vi/NbkD0hNyetg/mqdefault.jpg,320,180,https://i.ytimg.com/vi/NbkD0hNyetg/hqdefault.jpg,480,360,PyCon UK,none,2022-09-18T21:42:37Z
2,youtube#searchResult,APTFZg4D0HsDal3fSSGu-3A3bHU,youtube#video,ITr3O3sqhVg,2022-09-18T21:28:19Z,UChA9XP_feY1-1oSy2L7acog,Pointers? In my Python? It&#39;s more likely than you think,"Learn about Python's memory handling, including: - what pointers are, and why it matters - what object IDs are, and what they ...",https://i.ytimg.com/vi/ITr3O3sqhVg/default.jpg,120,90,https://i.ytimg.com/vi/ITr3O3sqhVg/mqdefault.jpg,320,180,https://i.ytimg.com/vi/ITr3O3sqhVg/hqdefault.jpg,480,360,PyCon UK,none,2022-09-18T21:28:19Z
3,youtube#searchResult,D-VY-TQQZU7Eus8irlsOxZ3EDNo,youtube#video,rom7BzoxD8c,2022-09-18T21:18:20Z,UChA9XP_feY1-1oSy2L7acog,Connecting those thoughts: Personal knowledge management with Python: Mark Farragher,"Apps such as Obsidian.md have revolutionised note-taking for the digital age, through connected markdown files. I discuss how I ...",https://i.ytimg.com/vi/rom7BzoxD8c/default.jpg,120,90,https://i.ytimg.com/vi/rom7BzoxD8c/mqdefault.jpg,320,180,https://i.ytimg.com/vi/rom7BzoxD8c/hqdefault.jpg,480,360,PyCon UK,none,2022-09-18T21:18:20Z
4,youtube#searchResult,SOux2UR00mAfqmIwTasRAGB0fGE,youtube#video,L55mq5wi3Cc,2022-09-18T21:02:38Z,UChA9XP_feY1-1oSy2L7acog,OpenSAFELY: a python powered response to the COVID pandemic: Becky Smith &amp; Simon Davey,"OpenSAFELY is a secure, transparent, open-source platform, built in Python, in response to the COVID pandemic. It provides ...",https://i.ytimg.com/vi/L55mq5wi3Cc/default.jpg,120,90,https://i.ytimg.com/vi/L55mq5wi3Cc/mqdefault.jpg,320,180,https://i.ytimg.com/vi/L55mq5wi3Cc/hqdefault.jpg,480,360,PyCon UK,none,2022-09-18T21:02:38Z
0,youtube#searchResult,uXuoAtraBWaEV5BW7hhfwz7QPuw,youtube#video,IVgizc711OA,2023-10-24T02:56:59Z,UC51aOZF5nnderbuar5D5ifw,"Better Together: Unleashing the Synergy of Pandas, Polars, and Apache Arrow",Chris Brousseau https://pybay.com/speakers/#sz-speaker-438b7844-5b59-44f8-89f8-d8b3b8d270a0 Supercharge your data ...,https://i.ytimg.com/vi/IVgizc711OA/default.jpg,120,90,https://i.ytimg.com/vi/IVgizc711OA/mqdefault.jpg,320,180,https://i.ytimg.com/vi/IVgizc711OA/hqdefault.jpg,480,360,SF Python,none,2023-10-24T02:56:59Z
1,youtube#searchResult,bHEz-WxypxOAliWXe-Dfvm_fNlw,youtube#video,r6wabaVH7CE,2023-10-15T18:35:44Z,UC51aOZF5nnderbuar5D5ifw,&quot;Python in Hardware &amp; Embedded Systems: A Deep Dive&quot; - Sriram Vamsi Ilapakurthy (PyBay 2023),"Sriram Vamsi Ilapakurthy https://pybay.com/speakers/#sz-speaker-2ec02e2b-6827-4823-aa00-8e77605ff96c ""Python in ...",https://i.ytimg.com/vi/r6wabaVH7CE/default.jpg,120,90,https://i.ytimg.com/vi/r6wabaVH7CE/mqdefault.jpg,320,180,https://i.ytimg.com/vi/r6wabaVH7CE/hqdefault.jpg,480,360,SF Python,none,2023-10-15T18:35:44Z
2,youtube#searchResult,Bz3H6LFUg27IS22vwE2W_EnT0N0,youtube#video,z52SYR7-Rm4,2023-06-26T17:09:16Z,UC51aOZF5nnderbuar5D5ifw,Didier Lopes - Revolutionizing the financial industry through Python - SF Python @ GGU (2023-06-14),Didier talks about his journey from the pain points of doing investment research to starting his own investment research platform in ...,https://i.ytimg.com/vi/z52SYR7-Rm4/default.jpg,120,90,https://i.ytimg.com/vi/z52SYR7-Rm4/mqdefault.jpg,320,180,https://i.ytimg.com/vi/z52SYR7-Rm4/hqdefault.jpg,480,360,SF Python,none,2023-06-26T17:09:16Z
3,youtube#searchResult,kFLDP0oovLNrHEnwyBDXgsux-7U,youtube#video,AmNRN5LuVNo,2023-06-26T17:05:37Z,UC51aOZF5nnderbuar5D5ifw,Zac Hatfield-Dodds - Scaling Structured Concurrency - SF Python @ GGU (2023-06-14),"Zac discusses the advantages of using async Python for structured concurrency. He explores the benefits of error handling, ...",https://i.ytimg.com/vi/AmNRN5LuVNo/default.jpg,120,90,https://i.ytimg.com/vi/AmNRN5LuVNo/mqdefault.jpg,320,180,https://i.ytimg.com/vi/AmNRN5LuVNo/hqdefault.jpg,480,360,SF Python,none,2023-06-26T17:05:37Z
4,youtube#searchResult,pv2rlG9YPwMkvSGDxkSmPJbdgws,youtube#video,L9ELuU3GeNc,2023-06-13T16:50:52Z,UC51aOZF5nnderbuar5D5ifw,Ashot Vardanian - Fantastic Data Science Libraries - SF Python @ Sentry (2023-05-10),"Full Title: Fantastic Data Science Libraries and Where to Use Them) It is 2023, and we need to process a lot of data fast, but how?",https://i.ytimg.com/vi/L9ELuU3GeNc/default.jpg,120,90,https://i.ytimg.com/vi/L9ELuU3GeNc/mqdefault.jpg,320,180,https://i.ytimg.com/vi/L9ELuU3GeNc/hqdefault.jpg,480,360,SF Python,none,2023-06-13T16:50:52Z
0,youtube#searchResult,cT337lVBnr7X6yOrz1mmOg_wMr4,youtube#video,jUoJGYCWSC0,2022-06-26T21:05:25Z,UCEhI2CfdT5--TYq47K4en4A,PyMeetup 2022/06/15 Creating Python Data Pipelines with Yaetos by Arthur Prevot,Python Barcelona https://pybcn.org Who: Arthur Prevot (   @arprevot) Language: English Abstract: The talk will describe ...,https://i.ytimg.com/vi/jUoJGYCWSC0/default.jpg,120,90,https://i.ytimg.com/vi/jUoJGYCWSC0/mqdefault.jpg,320,180,https://i.ytimg.com/vi/jUoJGYCWSC0/hqdefault.jpg,480,360,Python Barcelona,none,2022-06-26T21:05:25Z
1,youtube#searchResult,29ppf03YRbpwOpPVxUONgPQT-ss,youtube#video,rF3pLmxr3v8,2022-06-15T08:04:03Z,UCEhI2CfdT5--TYq47K4en4A,PyMeetup 2022/05/19 Introduction to PyScript by David Arcos,Python Barcelona https://pybcn.org Who: David Arcos (   @DZPM) ⏱ Duration: ~30 minutes Language: English Abstract: ...,https://i.ytimg.com/vi/rF3pLmxr3v8/default.jpg,120,90,https://i.ytimg.com/vi/rF3pLmxr3v8/mqdefault.jpg,320,180,https://i.ytimg.com/vi/rF3pLmxr3v8/hqdefault.jpg,480,360,Python Barcelona,none,2022-06-15T08:04:03Z
2,youtube#searchResult,1nomew3UzUDJ5omY2qeoh5vdeeU,youtube#video,76jG59xQzVw,2022-06-13T20:06:35Z,UCEhI2CfdT5--TYq47K4en4A,PyMeetup 2022/05/19 Building a Django scalable system by Samuel Parra,Python Barcelona https://pybcn.org Who: Samuel Parra ⏱ Duration: ~30 minutes Language: English Abstract: Mundimoto ...,https://i.ytimg.com/vi/76jG59xQzVw/default.jpg,120,90,https://i.ytimg.com/vi/76jG59xQzVw/mqdefault.jpg,320,180,https://i.ytimg.com/vi/76jG59xQzVw/hqdefault.jpg,480,360,Python Barcelona,none,2022-06-13T20:06:35Z
3,youtube#searchResult,IuW2A9o-rilzWrzEnB8fUVGbo0o,youtube#video,a8smnNogLQU,2022-05-16T18:24:58Z,UCEhI2CfdT5--TYq47K4en4A,PyBCN Meetup 2022/03/04 Aprendizaje a través de grafos: Graph Neural Networks by @camilo_chacon_s,Python Barcelona https://pybcn.org ➡️ What: Aprendizaje a través de grafos: Graph Neural Networks Who: Camilo Chacón ...,https://i.ytimg.com/vi/a8smnNogLQU/default.jpg,120,90,https://i.ytimg.com/vi/a8smnNogLQU/mqdefault.jpg,320,180,https://i.ytimg.com/vi/a8smnNogLQU/hqdefault.jpg,480,360,Python Barcelona,none,2022-05-16T18:24:58Z
4,youtube#searchResult,OWfifIAnvoJSuK0wjUwoXng1L0A,youtube#video,j7pTZtDUeRc,2022-05-10T09:29:50Z,UCEhI2CfdT5--TYq47K4en4A,PyBCN Meetup 2022/04/21 Shorter feedback loop by running impacted tests only by Mathieu Kniewallner,"Python Barcelona https://pybcn.org At BackMarket, we have dozens of developers working on our Django monolith that holds ...",https://i.ytimg.com/vi/j7pTZtDUeRc/default.jpg,120,90,https://i.ytimg.com/vi/j7pTZtDUeRc/mqdefault.jpg,320,180,https://i.ytimg.com/vi/j7pTZtDUeRc/hqdefault.jpg,480,360,Python Barcelona,none,2022-05-10T09:29:50Z
0,youtube#searchResult,fVx_zv0WtGd6yYt6lVKbqcCyDYk,youtube#video,AzkUBhufgp8,2023-01-03T20:09:47Z,UC6HfeAa0vWeSWS6IcNAjZ2A,AI-animated visual short story: Never of the past or the future #aiart,An experiment in generating a visualization for a short story from suchwasnot.com (Never of the past or the future). The animation ...,https://i.ytimg.com/vi/AzkUBhufgp8/default.jpg,120,90,https://i.ytimg.com/vi/AzkUBhufgp8/mqdefault.jpg,320,180,https://i.ytimg.com/vi/AzkUBhufgp8/hqdefault.jpg,480,360,Sebastiaan Mathôt,none,2023-01-03T20:09:47Z
1,youtube#searchResult,Q27ytDl1lV8liwGS7YMAP9Cambc,youtube#video,mu7yct6hOSA,2022-03-21T19:44:04Z,UC6HfeAa0vWeSWS6IcNAjZ2A,Publishing a Python package on pip [PythonLiveLessons #6],"Episode 6 of #PythonLiveLessons, a weekly live stream about Python code and more, hosted by Sebastiaan Mathôt.",https://i.ytimg.com/vi/mu7yct6hOSA/default.jpg,120,90,https://i.ytimg.com/vi/mu7yct6hOSA/mqdefault.jpg,320,180,https://i.ytimg.com/vi/mu7yct6hOSA/hqdefault.jpg,480,360,Sebastiaan Mathôt,none,2022-03-21T19:44:04Z
2,youtube#searchResult,H6XbjNZN2Bub-GtrZMygYplgydg,youtube#video,ej3S30nC8Io,2022-03-16T20:21:46Z,UC6HfeAa0vWeSWS6IcNAjZ2A,Documenting Python code (docstrings) [PythonLiveLessons #5],"The sixth episode of #PythonLiveLessons, a weekly live stream about Python code and more, hosted by Sebastiaan Mathôt.",https://i.ytimg.com/vi/ej3S30nC8Io/default.jpg,120,90,https://i.ytimg.com/vi/ej3S30nC8Io/mqdefault.jpg,320,180,https://i.ytimg.com/vi/ej3S30nC8Io/hqdefault.jpg,480,360,Sebastiaan Mathôt,none,2022-03-16T20:21:46Z
3,youtube#searchResult,Dxf_YSf6Q5iyzz__96I7Ithqzbw,youtube#video,vX83-7G0Qm0,2022-03-16T05:33:29Z,UC6HfeAa0vWeSWS6IcNAjZ2A,PythonLiveLessons #6: Publishing a Python package on pip,"This is the seventh episode of #PythonLiveLessons, a weekly live stream about Python code and more, hosted by Sebastiaan ...",https://i.ytimg.com/vi/vX83-7G0Qm0/default.jpg,120,90,https://i.ytimg.com/vi/vX83-7G0Qm0/mqdefault.jpg,320,180,https://i.ytimg.com/vi/vX83-7G0Qm0/hqdefault.jpg,480,360,Sebastiaan Mathôt,none,2022-03-16T05:33:29Z
4,youtube#searchResult,U9Kn96ebE-KmfnMaAocHJ9gq3d8,youtube#video,f4ZQ-_Sft0I,2022-03-09T05:35:13Z,UC6HfeAa0vWeSWS6IcNAjZ2A,PythonLiveLessons #5: Documenting your Python project,"This is the sixth episode of #PythonLiveLessons, a weekly live stream about Python code and more, hosted by Sebastiaan Mathôt.",https://i.ytimg.com/vi/f4ZQ-_Sft0I/default.jpg,120,90,https://i.ytimg.com/vi/f4ZQ-_Sft0I/mqdefault.jpg,320,180,https://i.ytimg.com/vi/f4ZQ-_Sft0I/hqdefault.jpg,480,360,Sebastiaan Mathôt,none,2022-03-09T05:35:13Z
0,youtube#searchResult,oc5tgo02JDyvjucAHSx9zJ0-WEo,youtube#video,jUxyfz5FxjU,2024-04-11T08:12:49Z,UCDVL0bPrZHwCeJrlyy-wxaQ,Unveiling the Power of AI  Understanding the Future of Information Retrieval #ai #globalaicommunity,Full episode on: https://youtu.be/4Lv1xth5Inw More videos on:@GlobalAICommunity #SiliconMinds #HumanHearts #ChatGPT ...,https://i.ytimg.com/vi/jUxyfz5FxjU/default.jpg,120,90,https://i.ytimg.com/vi/jUxyfz5FxjU/mqdefault.jpg,320,180,https://i.ytimg.com/vi/jUxyfz5FxjU/hqdefault.jpg,480,360,Global AI Community,none,2024-04-11T08:12:49Z
1,youtube#searchResult,xq8lt7kzE4QWFywbEef70D5QJvE,youtube#video,Z4NJ6fLI2IU,2024-02-19T10:08:55Z,UCDVL0bPrZHwCeJrlyy-wxaQ,Global AI Bootcamp #artificialintelligence #ai #globalaicommunity,"Join the Global AI Bootcamp 2024 The Global AI Bootcamp is an annual event that occurs worldwide, where developers and AI ...",https://i.ytimg.com/vi/Z4NJ6fLI2IU/default.jpg,120,90,https://i.ytimg.com/vi/Z4NJ6fLI2IU/mqdefault.jpg,320,180,https://i.ytimg.com/vi/Z4NJ6fLI2IU/hqdefault.jpg,480,360,Global AI Community,none,2024-02-19T10:08:55Z
2,youtube#searchResult,YPBlFFxvLJ4-KFTfxrrxkFBU1ns,youtube#video,kQhSsubd7Ks,2024-01-29T09:34:23Z,UCDVL0bPrZHwCeJrlyy-wxaQ,Transform RAG and Search with Azure AI Document Intelligence,"Retrieval Augmented Generation (RAG) is a design pattern commonly used in Document Generative AI (e.g., chat with your ...",https://i.ytimg.com/vi/kQhSsubd7Ks/default.jpg,120,90,https://i.ytimg.com/vi/kQhSsubd7Ks/mqdefault.jpg,320,180,https://i.ytimg.com/vi/kQhSsubd7Ks/hqdefault.jpg,480,360,Global AI Community,none,2024-01-29T09:34:23Z
3,youtube#searchResult,MAneKc3Ad4C1uV8MIk3Xn1Hawdc,youtube#video,65mgprOCbDM,2023-12-18T09:23:33Z,UCDVL0bPrZHwCeJrlyy-wxaQ,Fine-tuning an Azure Open AI model: Lessons learned,"Open AI is the technology that has sparkled several waves of excitement, everyone is talking about it! One of its most powerful ...",https://i.ytimg.com/vi/65mgprOCbDM/default.jpg,120,90,https://i.ytimg.com/vi/65mgprOCbDM/mqdefault.jpg,320,180,https://i.ytimg.com/vi/65mgprOCbDM/hqdefault.jpg,480,360,Global AI Community,none,2023-12-18T09:23:33Z
4,youtube#searchResult,jR6CDZOHaMVexr2Y_3GupVm6ccQ,youtube#video,imVHjyHTtUE,2023-12-13T11:16:19Z,UCDVL0bPrZHwCeJrlyy-wxaQ,Generative AI Unleashed: crafting voices and music from text &amp; images,"While generative AI continues to evolve predominantly around text and imagery, the horizon is broadening with innovations in ...",https://i.ytimg.com/vi/imVHjyHTtUE/default.jpg,120,90,https://i.ytimg.com/vi/imVHjyHTtUE/mqdefault.jpg,320,180,https://i.ytimg.com/vi/imVHjyHTtUE/hqdefault.jpg,480,360,Global AI Community,none,2023-12-13T11:16:19Z
0,youtube#searchResult,kM5ZTrdWg4tgA3D-aeNbR1cIPio,youtube#video,NdPMaDzpqW8,2023-09-09T17:37:09Z,UCxArXLI-gxlTmWGGgec5D7w,Functions in Julia -Learn Julia 15/n-,"What are functions and what do they do ? In this video I present functions in Julia, what are they, how do they work, and how we ...",https://i.ytimg.com/vi/NdPMaDzpqW8/default.jpg,120,90,https://i.ytimg.com/vi/NdPMaDzpqW8/mqdefault.jpg,320,180,https://i.ytimg.com/vi/NdPMaDzpqW8/hqdefault.jpg,480,360,Rémi Vezy,none,2023-09-09T17:37:09Z
1,youtube#searchResult,RRaRMU43coGxdqYnku_005smBzw,youtube#video,wTiVtP5tYPY,2023-08-21T14:58:42Z,UCxArXLI-gxlTmWGGgec5D7w,"For loops in Julia (eachindex, enumerate...) -Learn Julia 14/n-","How can we repeatedly execute code in Julia ? In this video I present for loops in Julia, what are they and how they work, and I ...",https://i.ytimg.com/vi/wTiVtP5tYPY/default.jpg,120,90,https://i.ytimg.com/vi/wTiVtP5tYPY/mqdefault.jpg,320,180,https://i.ytimg.com/vi/wTiVtP5tYPY/hqdefault.jpg,480,360,Rémi Vezy,none,2023-08-21T14:58:42Z
2,youtube#searchResult,DnkVO588bA2_0Ix1ZQcOvu8_lu8,youtube#video,qNK9C3ewoGE,2022-08-20T13:16:04Z,UCxArXLI-gxlTmWGGgec5D7w,Conditionals in Julia (if...else...) -Learn Julia 13/n-,"If you appreciate this video, you can buy me a coffee on Tipeee: https://fr.tipeee.com/remi-vezy What are conditional statements ?",https://i.ytimg.com/vi/qNK9C3ewoGE/default.jpg,120,90,https://i.ytimg.com/vi/qNK9C3ewoGE/mqdefault.jpg,320,180,https://i.ytimg.com/vi/qNK9C3ewoGE/hqdefault.jpg,480,360,Rémi Vezy,none,2022-08-20T13:16:04Z
3,youtube#searchResult,YsO61eEpGGIg4wTJagCXszykBEM,youtube#video,zCvYmbP1esc,2022-05-22T19:07:40Z,UCxArXLI-gxlTmWGGgec5D7w,`begin` and `let` in Julia -Learn Julia 12/n-,You can buy me a coffee on Tipeee: https://fr.tipeee.com/remi-vezy What are `begin...end` statements ? What is the difference with ...,https://i.ytimg.com/vi/zCvYmbP1esc/default.jpg,120,90,https://i.ytimg.com/vi/zCvYmbP1esc/mqdefault.jpg,320,180,https://i.ytimg.com/vi/zCvYmbP1esc/hqdefault.jpg,480,360,Rémi Vezy,none,2022-05-22T19:07:40Z
4,youtube#searchResult,pWhsLE3WypOsEuyCG38DfK0hVkc,youtube#video,yZwHgdAEx5Q,2022-04-24T19:46:02Z,UCxArXLI-gxlTmWGGgec5D7w,String operators in Julia -Learn Julia 11/n-,You can buy me a coffee on Tipeee: https://fr.tipeee.com/remi-vezy What is a string? What is the difference with characters?,https://i.ytimg.com/vi/yZwHgdAEx5Q/default.jpg,120,90,https://i.ytimg.com/vi/yZwHgdAEx5Q/mqdefault.jpg,320,180,https://i.ytimg.com/vi/yZwHgdAEx5Q/hqdefault.jpg,480,360,Rémi Vezy,none,2022-04-24T19:46:02Z
0,youtube#searchResult,G9nKuUJqP5hhslz5KiJ1c1Lu7YI,youtube#video,ys-G9uEW3O0,2024-06-04T21:00:04Z,UCupQLyNchb9-2Z5lmUOIijw,"02 – Discrete probability recap, Naïve Bayes classification",Course website: https://atcold.github.io/NYU-AISP24/,https://i.ytimg.com/vi/ys-G9uEW3O0/default.jpg,120,90,https://i.ytimg.com/vi/ys-G9uEW3O0/mqdefault.jpg,320,180,https://i.ytimg.com/vi/ys-G9uEW3O0/hqdefault.jpg,480,360,Alfredo Canziani,none,2024-06-04T21:00:04Z
1,youtube#searchResult,R_5i4taf02tPCGHji3okazWuyIc,youtube#video,GyKlMcsl72w,2024-06-04T19:30:45Z,UCupQLyNchb9-2Z5lmUOIijw,00 – Course introduction,Course website: https://atcold.github.io/NYU-AISP24/,https://i.ytimg.com/vi/GyKlMcsl72w/default.jpg,120,90,https://i.ytimg.com/vi/GyKlMcsl72w/mqdefault.jpg,320,180,https://i.ytimg.com/vi/GyKlMcsl72w/hqdefault.jpg,480,360,Alfredo Canziani,none,2024-06-04T19:30:45Z
2,youtube#searchResult,KloqnJWphQvN5UXkRrOjt4vbmjM,youtube#video,jgmaQiVBBEE,2024-05-30T21:27:21Z,UCupQLyNchb9-2Z5lmUOIijw,"01 – Course first part recap, Naïve Bayes intro",Course website: https://atcold.github.io/NYU-AISP24/,https://i.ytimg.com/vi/jgmaQiVBBEE/default.jpg,120,90,https://i.ytimg.com/vi/jgmaQiVBBEE/mqdefault.jpg,320,180,https://i.ytimg.com/vi/jgmaQiVBBEE/hqdefault.jpg,480,360,Alfredo Canziani,none,2024-05-30T21:27:21Z
3,youtube#searchResult,PucmPOQ_B9pndS3_Krpm9Y9P2tM,youtube#video,FXqstjvTr4c,2023-12-13T17:09:43Z,UCupQLyNchb9-2Z5lmUOIijw,Thanks for your support!,,https://i.ytimg.com/vi/FXqstjvTr4c/default.jpg,120,90,https://i.ytimg.com/vi/FXqstjvTr4c/mqdefault.jpg,320,180,https://i.ytimg.com/vi/FXqstjvTr4c/hqdefault.jpg,480,360,Alfredo Canziani,none,2023-12-13T17:09:43Z
