,kind,etag,id.kind,id.videoId,snippet.publishedAt,snippet.channelId,snippet.title,snippet.description,snippet.thumbnails.default.url,snippet.thumbnails.default.width,snippet.thumbnails.default.height,snippet.thumbnails.medium.url,snippet.thumbnails.medium.width,snippet.thumbnails.medium.height,snippet.thumbnails.high.url,snippet.thumbnails.high.width,snippet.thumbnails.high.height,snippet.channelTitle,snippet.liveBroadcastContent,snippet.publishTime
8,youtube#searchResult,g8tVBTf3JbkOPEe74q9x9cQUZyo,youtube#video,4UH7EUyFUIA,2020-09-17T03:08:39Z,UCMxUmQFr0_dyW8JTLDiOeNQ,"Safe, Fair &amp; Ethical AI",This is the talk I gave at TechExeter 2020 - https://conference.techexeter.uk/ The last decade has seen huge leaps in Machine ...,https://i.ytimg.com/vi/4UH7EUyFUIA/default.jpg,120,90,https://i.ytimg.com/vi/4UH7EUyFUIA/mqdefault.jpg,320,180,https://i.ytimg.com/vi/4UH7EUyFUIA/hqdefault.jpg,480,360,Data Science Cornwall,none,2020-09-17T03:08:39Z
9,youtube#searchResult,w_ET9lNBlR4VdDUP1nsjfm0P-ek,youtube#video,SGYUv2v-b34,2020-07-19T00:28:33Z,UCMxUmQFr0_dyW8JTLDiOeNQ,"Typesetting Beautiful Mathematics with LaTeX, Lyx and MathJax","LaTEX is used extensively in mathematics, science and computing to typeset documents (papers, journal articles, books) and is ...",https://i.ytimg.com/vi/SGYUv2v-b34/default.jpg,120,90,https://i.ytimg.com/vi/SGYUv2v-b34/mqdefault.jpg,320,180,https://i.ytimg.com/vi/SGYUv2v-b34/hqdefault.jpg,480,360,Data Science Cornwall,none,2020-07-19T00:28:33Z
10,youtube#searchResult,Lenc0Bmbrq8jWUqyNVu-wxhgj7E,youtube#video,sTwHezFOs0Q,2020-05-19T03:11:41Z,UCMxUmQFr0_dyW8JTLDiOeNQ,Visualising And Optimising Classifier Performance With ROC Curves,"In this we learn about ROC analysis - a visual tool for understanding classifier performance, optimising classifiers and even ...",https://i.ytimg.com/vi/sTwHezFOs0Q/default.jpg,120,90,https://i.ytimg.com/vi/sTwHezFOs0Q/mqdefault.jpg,320,180,https://i.ytimg.com/vi/sTwHezFOs0Q/hqdefault.jpg,480,360,Data Science Cornwall,none,2020-05-19T03:11:41Z
11,youtube#searchResult,GJ9Oiilh7nABE_o4mDRKmXBfC-g,youtube#video,1Ss2BypcBAY,2020-04-14T00:38:25Z,UCMxUmQFr0_dyW8JTLDiOeNQ,Visualising High-Dimensional Data with t-SNE,"The more dimensions data has, the harder it is to visualise. The t-SNE method reduces the dimensionality of data, and in the ...",https://i.ytimg.com/vi/1Ss2BypcBAY/default.jpg,120,90,https://i.ytimg.com/vi/1Ss2BypcBAY/mqdefault.jpg,320,180,https://i.ytimg.com/vi/1Ss2BypcBAY/hqdefault.jpg,480,360,Data Science Cornwall,none,2020-04-14T00:38:25Z
12,youtube#searchResult,HumBH3tANeYr1iYq7s6yklMcYoU,youtube#video,P_9fFoc5pIc,2020-01-25T11:50:20Z,UCMxUmQFr0_dyW8JTLDiOeNQ,Functional Programming &amp; Data Science Applications,"An introduction to the concept of functional programming, benefits and disadvantages, and applications in data science.",https://i.ytimg.com/vi/P_9fFoc5pIc/default.jpg,120,90,https://i.ytimg.com/vi/P_9fFoc5pIc/mqdefault.jpg,320,180,https://i.ytimg.com/vi/P_9fFoc5pIc/hqdefault.jpg,480,360,Data Science Cornwall,none,2020-01-25T11:50:20Z
13,youtube#searchResult,Al0UqmY6nnj3zCzZZsCa4a2Imj4,youtube#video,jzTKK6iGOjU,2019-11-30T16:30:33Z,UCMxUmQFr0_dyW8JTLDiOeNQ,Big Data Challenges - Future Storage Technology,This talk is one of two from a special evening jointly organised with the Institute of Physics. - - - The Challenge of Storing Ever ...,https://i.ytimg.com/vi/jzTKK6iGOjU/default.jpg,120,90,https://i.ytimg.com/vi/jzTKK6iGOjU/mqdefault.jpg,320,180,https://i.ytimg.com/vi/jzTKK6iGOjU/hqdefault.jpg,480,360,Data Science Cornwall,none,2019-11-30T16:30:33Z
14,youtube#searchResult,xZu88KneNjzNU0VnQhYuZEM2338,youtube#video,FbBKsIe29HU,2019-11-30T03:38:28Z,UCMxUmQFr0_dyW8JTLDiOeNQ,Big Data Challenges - Particle Physics,This talk is one of two from a special evening jointly organised with the Institute of Physics. - - - Using Supercomputers to Search ...,https://i.ytimg.com/vi/FbBKsIe29HU/default.jpg,120,90,https://i.ytimg.com/vi/FbBKsIe29HU/mqdefault.jpg,320,180,https://i.ytimg.com/vi/FbBKsIe29HU/hqdefault.jpg,480,360,Data Science Cornwall,none,2019-11-30T03:38:28Z
15,youtube#searchResult,DSrTkeCFmokXt9zO7gfxOWFfN9s,youtube#video,5-yNu4cuPBU,2019-09-28T20:23:28Z,UCMxUmQFr0_dyW8JTLDiOeNQ,Practical Steps for Building Intelligent Systems,Aleksanda explains how we can't solve machine learning problems just by picking an algorithm and some data - we need to think ...,https://i.ytimg.com/vi/5-yNu4cuPBU/default.jpg,120,90,https://i.ytimg.com/vi/5-yNu4cuPBU/mqdefault.jpg,320,180,https://i.ytimg.com/vi/5-yNu4cuPBU/hqdefault.jpg,480,360,Data Science Cornwall,none,2019-09-28T20:23:28Z
16,youtube#searchResult,ULNidn7yX4kAnKYW6zj7v3fKVTE,youtube#video,ijyj-ogsuC8,2019-04-03T00:44:47Z,UCMxUmQFr0_dyW8JTLDiOeNQ,Machine Learning for Image Classification,A beginner-friendly tutorial walks us through training a neural network to classify the MNIST fashion dataset using Google's ...,https://i.ytimg.com/vi/ijyj-ogsuC8/default.jpg,120,90,https://i.ytimg.com/vi/ijyj-ogsuC8/mqdefault.jpg,320,180,https://i.ytimg.com/vi/ijyj-ogsuC8/hqdefault.jpg,480,360,Data Science Cornwall,none,2019-04-03T00:44:47Z
17,youtube#searchResult,vhquqpFfqvfRKE91L4N8eA00UVs,youtube#video,KkCSvD7FF5s,2018-12-19T16:47:32Z,UCMxUmQFr0_dyW8JTLDiOeNQ,Data Science Cornwall,blog - http://datasciencecornwall.blogspot.com meetup - https://www.meetup.com/datasciencecornwall/,https://i.ytimg.com/vi/KkCSvD7FF5s/default.jpg,120,90,https://i.ytimg.com/vi/KkCSvD7FF5s/mqdefault.jpg,320,180,https://i.ytimg.com/vi/KkCSvD7FF5s/hqdefault.jpg,480,360,Data Science Cornwall,none,2018-12-19T16:47:32Z
18,youtube#searchResult,jljiSg7LtnSiGQfF5nZXhlDkWJE,youtube#video,1YdpRiQvHzQ,2018-12-19T14:15:11Z,UCMxUmQFr0_dyW8JTLDiOeNQ,Designing for Big Data,The main talk (starts at 33:55) was on how to design your infrastructure and software to scale as your data storage and processing ...,https://i.ytimg.com/vi/1YdpRiQvHzQ/default.jpg,120,90,https://i.ytimg.com/vi/1YdpRiQvHzQ/mqdefault.jpg,320,180,https://i.ytimg.com/vi/1YdpRiQvHzQ/hqdefault.jpg,480,360,Data Science Cornwall,none,2018-12-19T14:15:11Z
0,youtube#searchResult,Uj5fTr5FFlmhGLEsWcpdj-wSdqc,youtube#video,M_dc73EAxxA,2025-03-01T17:40:30Z,UCoTuN2KVQHpnAOO9nM9354Q,2025 03 01 OMLDS LLM Assisted EDA,Join us as guest speaker William Guesdon gives an enlightening presentation on how LLMs are being used to assist with ...,https://i.ytimg.com/vi/M_dc73EAxxA/default.jpg,120,90,https://i.ytimg.com/vi/M_dc73EAxxA/mqdefault.jpg,320,180,https://i.ytimg.com/vi/M_dc73EAxxA/hqdefault.jpg,480,360,OMLDS,none,2025-03-01T17:40:30Z
1,youtube#searchResult,Oo3HGuI3-SPTV-w3ffAmwJAN_6k,youtube#video,LRfFBhxpoO8,2024-04-20T18:00:23Z,UCoTuN2KVQHpnAOO9nM9354Q,OMLDS: Lakehouse Solutions to Data Problems,"In today's data-driven world, organizations grapple with vast volumes of data coming from diverse sources. Managing, processing ...",https://i.ytimg.com/vi/LRfFBhxpoO8/default.jpg,120,90,https://i.ytimg.com/vi/LRfFBhxpoO8/mqdefault.jpg,320,180,https://i.ytimg.com/vi/LRfFBhxpoO8/hqdefault.jpg,480,360,OMLDS,none,2024-04-20T18:00:23Z
2,youtube#searchResult,RCYciw85a4MIhRdN0rChGAzaqZY,youtube#video,PnTRj3ghRhI,2024-01-12T20:28:35Z,UCoTuN2KVQHpnAOO9nM9354Q,Part 7 End to End Machine Learning Series,"In this installment of the End to End ML Series, we discuss model selection using the PyCaret open source tool to evaluate ...",https://i.ytimg.com/vi/PnTRj3ghRhI/default.jpg,120,90,https://i.ytimg.com/vi/PnTRj3ghRhI/mqdefault.jpg,320,180,https://i.ytimg.com/vi/PnTRj3ghRhI/hqdefault.jpg,480,360,OMLDS,none,2024-01-12T20:28:35Z
3,youtube#searchResult,LINpF3IOYg_e_o6ri8wRb99-if8,youtube#video,vQLXgiqoG9o,2023-11-16T18:32:17Z,UCoTuN2KVQHpnAOO9nM9354Q,Part 6 End to End Machine Learning Series,In this phase we build our first model using SciKit Learn and evaluate the results of a Logistic Regression model using the ...,https://i.ytimg.com/vi/vQLXgiqoG9o/default.jpg,120,90,https://i.ytimg.com/vi/vQLXgiqoG9o/mqdefault.jpg,320,180,https://i.ytimg.com/vi/vQLXgiqoG9o/hqdefault.jpg,480,360,OMLDS,none,2023-11-16T18:32:17Z
4,youtube#searchResult,qf4QADofIei7NtkDRIx0DUwpAck,youtube#video,m0gWOGrvn14,2023-10-24T20:42:47Z,UCoTuN2KVQHpnAOO9nM9354Q,Part5 End to End Machine Learning Series,,https://i.ytimg.com/vi/m0gWOGrvn14/default.jpg,120,90,https://i.ytimg.com/vi/m0gWOGrvn14/mqdefault.jpg,320,180,https://i.ytimg.com/vi/m0gWOGrvn14/hqdefault.jpg,480,360,OMLDS,none,2023-10-24T20:42:47Z
0,youtube#searchResult,aBsrpOHeTTroegYIWDciVPub_Pc,youtube#video,PwoTb-SxoC0,2024-02-21T18:14:01Z,UC8hI87gt0dmTAIEupEcsckA,Deep Reinforcement Learning for Trading,Join the Hudson and Thames Reading Group: https://hudsonthames.org/reading-group/ This Friday for our weekly reading group ...,https://i.ytimg.com/vi/PwoTb-SxoC0/default.jpg,120,90,https://i.ytimg.com/vi/PwoTb-SxoC0/mqdefault.jpg,320,180,https://i.ytimg.com/vi/PwoTb-SxoC0/hqdefault.jpg,480,360,Hudson & Thames,none,2024-02-21T18:14:01Z
1,youtube#searchResult,L00v_6JhGRxOiEVI90dNss5G_rQ,youtube#video,vyjgR5Ln57s,2024-02-21T18:14:16Z,UC8hI87gt0dmTAIEupEcsckA,Conditional Portfolio Optimization,Join the Hudson and Thames Reading Group: https://hudsonthames.org/reading-group/ In this session we are discussing a paper ...,https://i.ytimg.com/vi/vyjgR5Ln57s/default.jpg,120,90,https://i.ytimg.com/vi/vyjgR5Ln57s/mqdefault.jpg,320,180,https://i.ytimg.com/vi/vyjgR5Ln57s/hqdefault.jpg,480,360,Hudson & Thames,none,2024-02-21T18:14:16Z
2,youtube#searchResult,LUmfh1KZR-N6I97UEpc1qxU2-Go,youtube#video,knPPeV58gHM,2024-02-21T18:12:28Z,UC8hI87gt0dmTAIEupEcsckA,Scientific Discovery in Quantitative Finance,"This lecture we review the first 4 chapters of Marcos Lopez de Prado's latest paper from ADIA Labs, which lays out the foundation ...",https://i.ytimg.com/vi/knPPeV58gHM/default.jpg,120,90,https://i.ytimg.com/vi/knPPeV58gHM/mqdefault.jpg,320,180,https://i.ytimg.com/vi/knPPeV58gHM/hqdefault.jpg,480,360,Hudson & Thames,none,2024-02-21T18:12:28Z
3,youtube#searchResult,OOQhUX7x1vkzL7jwLhw7J0uZH8M,youtube#video,kX_7ocfTS8g,2023-08-21T12:35:00Z,UC8hI87gt0dmTAIEupEcsckA,FinGPT: Open-Source Financial Large Language Models,Join the Hudson and Thames Reading Group: https://hudsonthames.org/reading-group/ We explored the paper and open-source ...,https://i.ytimg.com/vi/kX_7ocfTS8g/default.jpg,120,90,https://i.ytimg.com/vi/kX_7ocfTS8g/mqdefault.jpg,320,180,https://i.ytimg.com/vi/kX_7ocfTS8g/hqdefault.jpg,480,360,Hudson & Thames,none,2023-08-21T12:35:00Z
4,youtube#searchResult,aPfSXKmQABk3IZpgVXL3sW-pH6M,youtube#video,6SfotqCQtag,2023-05-17T13:46:13Z,UC8hI87gt0dmTAIEupEcsckA,"Git, Branching, and Pull Requests","Welcome to our video on Git fundamentals presented by Michael Struwig, the CEO of Hudson & Thames. If you have some basic ...",https://i.ytimg.com/vi/6SfotqCQtag/default.jpg,120,90,https://i.ytimg.com/vi/6SfotqCQtag/mqdefault.jpg,320,180,https://i.ytimg.com/vi/6SfotqCQtag/hqdefault.jpg,480,360,Hudson & Thames,none,2023-05-17T13:46:13Z
5,youtube#searchResult,sA4eH0a0VH1RDPApa1ClUnUUnK8,youtube#video,BIBSv_gwBgs,2023-03-10T15:37:50Z,UC8hI87gt0dmTAIEupEcsckA,Meta-Labeling: Calibration and Position Sizing,Join our reading group! https://hudsonthames.org/reading-group/ We dive into the world of Meta-labeling and its impact on trading ...,https://i.ytimg.com/vi/BIBSv_gwBgs/default.jpg,120,90,https://i.ytimg.com/vi/BIBSv_gwBgs/mqdefault.jpg,320,180,https://i.ytimg.com/vi/BIBSv_gwBgs/hqdefault.jpg,480,360,Hudson & Thames,none,2023-03-10T15:37:50Z
6,youtube#searchResult,j-xV1xfb1Z5pUgFL3TPywk9PsEU,youtube#video,Gnpeiu0KxUE,2023-03-03T11:41:59Z,UC8hI87gt0dmTAIEupEcsckA,PortfolioLab Demo Video,PortfolioLab: Portfolio optimisation and allocation library A modern guide to portfolio optimisation: ...,https://i.ytimg.com/vi/Gnpeiu0KxUE/default.jpg,120,90,https://i.ytimg.com/vi/Gnpeiu0KxUE/mqdefault.jpg,320,180,https://i.ytimg.com/vi/Gnpeiu0KxUE/hqdefault.jpg,480,360,Hudson & Thames,none,2023-03-03T11:41:59Z
7,youtube#searchResult,kNp71I56r6U2zuG1BAoPKnJGhiI,youtube#video,tfIwxQu5nac,2023-03-03T11:37:08Z,UC8hI87gt0dmTAIEupEcsckA,"ArbitrageLab for Pairs Trading, Demo Video","An overview of ArbitrageLab, Hudson and Thames' flagship pairs trading python library. Statistical arbitrage pairs trading ...",https://i.ytimg.com/vi/tfIwxQu5nac/default.jpg,120,90,https://i.ytimg.com/vi/tfIwxQu5nac/mqdefault.jpg,320,180,https://i.ytimg.com/vi/tfIwxQu5nac/hqdefault.jpg,480,360,Hudson & Thames,none,2023-03-03T11:37:08Z
8,youtube#searchResult,7BtmxPoR1rl-kSk5Vhzcpi6Dots,youtube#video,oasG9DKE6Rk,2023-03-03T11:33:06Z,UC8hI87gt0dmTAIEupEcsckA,MlFinLab Demo Video,Learn more: https://hudsonthames.org/mlfinlab/ MlFinLab is a collection of production-ready algorithms (from the best journals and ...,https://i.ytimg.com/vi/oasG9DKE6Rk/default.jpg,120,90,https://i.ytimg.com/vi/oasG9DKE6Rk/mqdefault.jpg,320,180,https://i.ytimg.com/vi/oasG9DKE6Rk/hqdefault.jpg,480,360,Hudson & Thames,none,2023-03-03T11:33:06Z
9,youtube#searchResult,4fR1GOozim4fs7MY65e1lNjEaOQ,youtube#video,tpLCMVyMOaM,2023-01-09T14:00:01Z,UC8hI87gt0dmTAIEupEcsckA,Ensemble Meta-Labeling,Join the reading group! http://hudsonthames.org/reading-group/ This study systematically investigates different ensemble methods ...,https://i.ytimg.com/vi/tpLCMVyMOaM/default.jpg,120,90,https://i.ytimg.com/vi/tpLCMVyMOaM/mqdefault.jpg,320,180,https://i.ytimg.com/vi/tpLCMVyMOaM/hqdefault.jpg,480,360,Hudson & Thames,none,2023-01-09T14:00:01Z
10,youtube#searchResult,AX1ZanxRzN1ne7yOQ2kqkws5uJ8,youtube#video,1fYzABjsNFk,2022-11-07T11:44:59Z,UC8hI87gt0dmTAIEupEcsckA,Meta Labeling Architectures,Separating the side and size of a position allows for sophisticated strategy structures to be developed. Modeling the size ...,https://i.ytimg.com/vi/1fYzABjsNFk/default.jpg,120,90,https://i.ytimg.com/vi/1fYzABjsNFk/mqdefault.jpg,320,180,https://i.ytimg.com/vi/1fYzABjsNFk/hqdefault.jpg,480,360,Hudson & Thames,none,2022-11-07T11:44:59Z
11,youtube#searchResult,Kp04PQCEjq-aF9a4wo_nCVHL-ps,youtube#video,ZCFmZFBtqsQ,2022-10-19T10:59:04Z,UC8hI87gt0dmTAIEupEcsckA,Meta-Labeling: Theory and Framework,Join our reading group! https://hudsonthames.org/reading-group/ Meta-labeling is a machine learning (ML) layer that sits on top of ...,https://i.ytimg.com/vi/ZCFmZFBtqsQ/default.jpg,120,90,https://i.ytimg.com/vi/ZCFmZFBtqsQ/mqdefault.jpg,320,180,https://i.ytimg.com/vi/ZCFmZFBtqsQ/hqdefault.jpg,480,360,Hudson & Thames,none,2022-10-19T10:59:04Z
12,youtube#searchResult,J1AZuaNZKIatHAR13zdW0RAhO70,youtube#video,HGbWL2hhEUU,2022-07-12T19:30:46Z,UC8hI87gt0dmTAIEupEcsckA,OU Model Tear Sheet Example,Join our reading group! https://hudsonthames.org/reading-group/ OU Model Dashboard.,https://i.ytimg.com/vi/HGbWL2hhEUU/default.jpg,120,90,https://i.ytimg.com/vi/HGbWL2hhEUU/mqdefault.jpg,320,180,https://i.ytimg.com/vi/HGbWL2hhEUU/hqdefault.jpg,480,360,Hudson & Thames,none,2022-07-12T19:30:46Z
13,youtube#searchResult,SUjCwjujg-TMOrm4tKzU663YVVs,youtube#video,dO0toCkR9ro,2022-07-12T19:30:46Z,UC8hI87gt0dmTAIEupEcsckA,Cointegration Tear Sheet Example,Join our reading group! https://hudsonthames.org/reading-group/ Visualization of a cointegration dashboard.,https://i.ytimg.com/vi/dO0toCkR9ro/default.jpg,120,90,https://i.ytimg.com/vi/dO0toCkR9ro/mqdefault.jpg,320,180,https://i.ytimg.com/vi/dO0toCkR9ro/hqdefault.jpg,480,360,Hudson & Thames,none,2022-07-12T19:30:46Z
14,youtube#searchResult,WR8wJVdLvybE9fOdzlnGUzKrnVw,youtube#video,KqHrN6bJoNs,2022-07-12T19:28:41Z,UC8hI87gt0dmTAIEupEcsckA,Feature Importance Workshop,"Join our reading group! https://hudsonthames.org/reading-group/ In this workshop, we use feature importance techniques such as: ...",https://i.ytimg.com/vi/KqHrN6bJoNs/default.jpg,120,90,https://i.ytimg.com/vi/KqHrN6bJoNs/mqdefault.jpg,320,180,https://i.ytimg.com/vi/KqHrN6bJoNs/hqdefault.jpg,480,360,Hudson & Thames,none,2022-07-12T19:28:41Z
15,youtube#searchResult,EpXNU0TvHR0C0QiqdxHQH9l53Qg,youtube#video,lDTSGK4JMYk,2022-07-06T00:14:15Z,UC8hI87gt0dmTAIEupEcsckA,Modelling: Label Concurrency and Cross Validation,Join our reading group! https://hudsonthames.org/reading-group/ This lecture explores label concurrency and the pros and cons ...,https://i.ytimg.com/vi/lDTSGK4JMYk/default.jpg,120,90,https://i.ytimg.com/vi/lDTSGK4JMYk/mqdefault.jpg,320,180,https://i.ytimg.com/vi/lDTSGK4JMYk/hqdefault.jpg,480,360,Hudson & Thames,none,2022-07-06T00:14:15Z
16,youtube#searchResult,wnT4BBrsulWofg8_yumjk_3jnlQ,youtube#video,iVB_nSoQEB0,2022-07-06T00:13:58Z,UC8hI87gt0dmTAIEupEcsckA,Modelling: Sample Weights,Join our reading group! https://hudsonthames.org/reading-group/ MlFinLab supports two methods of applying sample weights.,https://i.ytimg.com/vi/iVB_nSoQEB0/default.jpg,120,90,https://i.ytimg.com/vi/iVB_nSoQEB0/mqdefault.jpg,320,180,https://i.ytimg.com/vi/iVB_nSoQEB0/hqdefault.jpg,480,360,Hudson & Thames,none,2022-07-06T00:13:58Z
17,youtube#searchResult,VIzi1kxQcX77WLBYuYSRVQjPm_I,youtube#video,RMskDStbwi0,2022-07-05T17:09:14Z,UC8hI87gt0dmTAIEupEcsckA,Bagging and Boosting in Financial Machine Learning,Join our reading group! https://hudsonthames.org/reading-group/ Learn how ensemble methods such as bagging and boosting ...,https://i.ytimg.com/vi/RMskDStbwi0/default.jpg,120,90,https://i.ytimg.com/vi/RMskDStbwi0/mqdefault.jpg,320,180,https://i.ytimg.com/vi/RMskDStbwi0/hqdefault.jpg,480,360,Hudson & Thames,none,2022-07-05T17:09:14Z
18,youtube#searchResult,-suMeEyVoKYMm0a15bFS0BfgcUI,youtube#video,NeG2nxk8ixc,2022-06-29T10:03:10Z,UC8hI87gt0dmTAIEupEcsckA,11 Stylized Facts of Financial Time Series,Join our reading group! https://hudsonthames.org/reading-group/ Do you know the stylized facts around time-series data for asset ...,https://i.ytimg.com/vi/NeG2nxk8ixc/default.jpg,120,90,https://i.ytimg.com/vi/NeG2nxk8ixc/mqdefault.jpg,320,180,https://i.ytimg.com/vi/NeG2nxk8ixc/hqdefault.jpg,480,360,Hudson & Thames,none,2022-06-29T10:03:10Z
19,youtube#searchResult,HQADDcZvM22sws3_SD8x4wUNpOw,youtube#video,i-tUY_QMYz8,2022-06-28T01:32:27Z,UC8hI87gt0dmTAIEupEcsckA,Tails of Time Series,Join our reading group! https://hudsonthames.org/reading-group/ Empirical evidence for asset return distributions shows some ...,https://i.ytimg.com/vi/i-tUY_QMYz8/default.jpg,120,90,https://i.ytimg.com/vi/i-tUY_QMYz8/mqdefault.jpg,320,180,https://i.ytimg.com/vi/i-tUY_QMYz8/hqdefault.jpg,480,360,Hudson & Thames,none,2022-06-28T01:32:27Z
20,youtube#searchResult,RbVp_joBu-PSy9YFJielbbGfTBQ,youtube#video,hraFWjK3Bes,2022-06-21T14:17:14Z,UC8hI87gt0dmTAIEupEcsckA,Labelling Techniques in Trading: Filters and Fixed Time,Join our reading group! https://hudsonthames.org/reading-group/ We explore 5 types of filters and introduce the idea of the classic ...,https://i.ytimg.com/vi/hraFWjK3Bes/default.jpg,120,90,https://i.ytimg.com/vi/hraFWjK3Bes/mqdefault.jpg,320,180,https://i.ytimg.com/vi/hraFWjK3Bes/hqdefault.jpg,480,360,Hudson & Thames,none,2022-06-21T14:17:14Z
21,youtube#searchResult,9ubZ8evq_XRWVE3egDiuULiukKo,youtube#video,cEFPuNR_J3M,2022-06-20T07:00:10Z,UC8hI87gt0dmTAIEupEcsckA,Matrix Flag Labeling,Join our reading group! https://hudsonthames.org/reading-group/ The matrix flag labeling method is meant to capture trends in ...,https://i.ytimg.com/vi/cEFPuNR_J3M/default.jpg,120,90,https://i.ytimg.com/vi/cEFPuNR_J3M/mqdefault.jpg,320,180,https://i.ytimg.com/vi/cEFPuNR_J3M/hqdefault.jpg,480,360,Hudson & Thames,none,2022-06-20T07:00:10Z
22,youtube#searchResult,YSZLuWR3YF6GptbD_g_udlVrVXU,youtube#video,zxGL2cLFFms,2022-06-15T05:00:30Z,UC8hI87gt0dmTAIEupEcsckA,Trend-Scanning Labels,Join our reading group! https://hudsonthames.org/reading-group/ Trend Scanning is both a classification and regression labeling ...,https://i.ytimg.com/vi/zxGL2cLFFms/default.jpg,120,90,https://i.ytimg.com/vi/zxGL2cLFFms/mqdefault.jpg,320,180,https://i.ytimg.com/vi/zxGL2cLFFms/hqdefault.jpg,480,360,Hudson & Thames,none,2022-06-15T05:00:30Z
23,youtube#searchResult,-Bq8cAAq2Rtat1Z_yS8RMbChiVY,youtube#video,mC53d7QhxEw,2022-06-13T23:08:03Z,UC8hI87gt0dmTAIEupEcsckA,Labelling Techniques in Trading: Triple-Barrier and  Meta-Labelling,Join our reading group! https://hudsonthames.org/reading-group/ The idea behind the triple-barrier method is that we have three ...,https://i.ytimg.com/vi/mC53d7QhxEw/default.jpg,120,90,https://i.ytimg.com/vi/mC53d7QhxEw/mqdefault.jpg,320,180,https://i.ytimg.com/vi/mC53d7QhxEw/hqdefault.jpg,480,360,Hudson & Thames,none,2022-06-13T23:08:03Z
24,youtube#searchResult,fxwwxxpMdGs9cEOKeBem2WKoZys,youtube#video,2oebNnhih-U,2022-06-09T14:14:57Z,UC8hI87gt0dmTAIEupEcsckA,Tail-Set Labels,Join our reading group! https://hudsonthames.org/reading-group/ Tail set labels are a classification labeling technique introduced ...,https://i.ytimg.com/vi/2oebNnhih-U/default.jpg,120,90,https://i.ytimg.com/vi/2oebNnhih-U/mqdefault.jpg,320,180,https://i.ytimg.com/vi/2oebNnhih-U/hqdefault.jpg,480,360,Hudson & Thames,none,2022-06-09T14:14:57Z
0,youtube#searchResult,_jZu3mmDI4xnf_tII4oG3TKjxBk,youtube#video,m8EMoOZsYSs,2026-01-28T10:05:43Z,UC8kXgHG13XdgsigIPRmrIyA,AI isn’t the problem. Blind trust is.,"Avoid these 3 AI sins before they drain your trading capital. Smart traders don't replace themselves with AI, they supervise it.",https://i.ytimg.com/vi/m8EMoOZsYSs/default.jpg,120,90,https://i.ytimg.com/vi/m8EMoOZsYSs/mqdefault.jpg,320,180,https://i.ytimg.com/vi/m8EMoOZsYSs/hqdefault.jpg,480,360,QuantInsti Quantitative Learning,none,2026-01-28T10:05:43Z
1,youtube#searchResult,jpdmBHtfaq5iDM5UY9Niz67d7Ug,youtube#video,taAXng9jIEk,2026-01-23T12:02:38Z,UC8kXgHG13XdgsigIPRmrIyA,From Raw Trading Idea to Backtest - Without Manual Coding,"Most traders fail not at ideas, but at execution. Manual coding, endless ChatGPT prompts, fragile scripts… that's not scalable.",https://i.ytimg.com/vi/taAXng9jIEk/default.jpg,120,90,https://i.ytimg.com/vi/taAXng9jIEk/mqdefault.jpg,320,180,https://i.ytimg.com/vi/taAXng9jIEk/hqdefault.jpg,480,360,QuantInsti Quantitative Learning,none,2026-01-23T12:02:38Z
2,youtube#searchResult,3AxJayE4liWh3fx7yetOKjjKJlE,youtube#video,ISVFhvECvzc,2026-01-21T11:00:36Z,UC8kXgHG13XdgsigIPRmrIyA,Intraday Implied Volatility: What Python + Options Data Reveal,Quantra Flash SALE is live: Min. 75% OFF on any course you like! Enrol now! https://quantra.quantinsti.com/courses _ _ _ New ...,https://i.ytimg.com/vi/ISVFhvECvzc/default.jpg,120,90,https://i.ytimg.com/vi/ISVFhvECvzc/mqdefault.jpg,320,180,https://i.ytimg.com/vi/ISVFhvECvzc/hqdefault.jpg,480,360,QuantInsti Quantitative Learning,none,2026-01-21T11:00:36Z
3,youtube#searchResult,HDsjPfQ3Q4u1mAcuJJwpfJHptpE,youtube#video,ok-pwdid71Y,2026-01-10T11:01:35Z,UC8kXgHG13XdgsigIPRmrIyA,Mid-Career Switch to Algorithmic Trading | Kanishka Tiwary | QuantInsti EPAT Review,Quantra Flash SALE is live: Min. 75% OFF on any course you like! Enrol now! https://quantra.quantinsti.com/courses _ _ _ New ...,https://i.ytimg.com/vi/ok-pwdid71Y/default.jpg,120,90,https://i.ytimg.com/vi/ok-pwdid71Y/mqdefault.jpg,320,180,https://i.ytimg.com/vi/ok-pwdid71Y/hqdefault.jpg,480,360,QuantInsti Quantitative Learning,none,2026-01-10T11:01:35Z
4,youtube#searchResult,dj6PlsB_GO_w2X0ZZmsQACISvdY,youtube#video,LzkkZgswjMY,2026-01-06T13:00:45Z,UC8kXgHG13XdgsigIPRmrIyA,From ER Doctor to Algo Trader: Dr. Roger Sen’s Journey | QuantInsti EPAT Review,Quantra Flash SALE is live: Min. 75% OFF on any course you like! Enrol now! https://quantra.quantinsti.com/courses _ _ _ New ...,https://i.ytimg.com/vi/LzkkZgswjMY/default.jpg,120,90,https://i.ytimg.com/vi/LzkkZgswjMY/mqdefault.jpg,320,180,https://i.ytimg.com/vi/LzkkZgswjMY/hqdefault.jpg,480,360,QuantInsti Quantitative Learning,none,2026-01-06T13:00:45Z
0,youtube#searchResult,YdGDCg4ZrrYSAOHPGT0I_8Piayc,youtube#video,3s1YWgG4iP8,2024-03-15T09:21:11Z,UCywHr2wSEj3Fl0u81OIzEoQ,Correlation - Basic intro  #correlationmatrix #datascience #statisticalanalysis,Learn about correlations.,https://i.ytimg.com/vi/3s1YWgG4iP8/default.jpg,120,90,https://i.ytimg.com/vi/3s1YWgG4iP8/mqdefault.jpg,320,180,https://i.ytimg.com/vi/3s1YWgG4iP8/hqdefault.jpg,480,360,HKML,none,2024-03-15T09:21:11Z
1,youtube#searchResult,CVWo5jk8NNVn-kkLYs4hHt6nAug,youtube#video,cFfj-mlwPrU,2024-03-15T03:45:22Z,UCywHr2wSEj3Fl0u81OIzEoQ,Uniform at Heart: Generating Correlation Matrices with the Onion Method,"Dive into the core of statistical simulations with our concise and informative YouTube short, where we explain generating random ...",https://i.ytimg.com/vi/cFfj-mlwPrU/default.jpg,120,90,https://i.ytimg.com/vi/cFfj-mlwPrU/mqdefault.jpg,320,180,https://i.ytimg.com/vi/cFfj-mlwPrU/hqdefault.jpg,480,360,HKML,none,2024-03-15T03:45:22Z
2,youtube#searchResult,rnlz5pZ7-6Xwd_w-hBH1_JYFz00,youtube#video,Ds1kU-rPRL8,2024-01-01T15:35:55Z,UCywHr2wSEj3Fl0u81OIzEoQ,Unlock Trading Success: Master Portfolio Turnover Analysis! #financialeducation #financialmarkets,Dive into our latest YouTube Short to uncover the secrets of effective trading strategies! This video is a must-watch for anyone ...,https://i.ytimg.com/vi/Ds1kU-rPRL8/default.jpg,120,90,https://i.ytimg.com/vi/Ds1kU-rPRL8/mqdefault.jpg,320,180,https://i.ytimg.com/vi/Ds1kU-rPRL8/hqdefault.jpg,480,360,HKML,none,2024-01-01T15:35:55Z
3,youtube#searchResult,qYzncodp3tCyXO5u9R9kgGvA620,youtube#video,VMFN-1zPnsk,2023-12-29T06:30:12Z,UCywHr2wSEj3Fl0u81OIzEoQ,Mastering Portfolio Optimization: The $100 Million Strategy Unveiled!,"Dive into the world of professional portfolio management with our latest YouTube Short. In this insightful video, we unveil the ...",https://i.ytimg.com/vi/VMFN-1zPnsk/default.jpg,120,90,https://i.ytimg.com/vi/VMFN-1zPnsk/mqdefault.jpg,320,180,https://i.ytimg.com/vi/VMFN-1zPnsk/hqdefault.jpg,480,360,HKML,none,2023-12-29T06:30:12Z
