,kind,etag,id.kind,id.videoId,snippet.publishedAt,snippet.channelId,snippet.title,snippet.description,snippet.thumbnails.default.url,snippet.thumbnails.default.width,snippet.thumbnails.default.height,snippet.thumbnails.medium.url,snippet.thumbnails.medium.width,snippet.thumbnails.medium.height,snippet.thumbnails.high.url,snippet.thumbnails.high.width,snippet.thumbnails.high.height,snippet.channelTitle,snippet.liveBroadcastContent,snippet.publishTime
4,youtube#searchResult,mYteQu_b31mYEMfmcmnZBRMTXOo,youtube#video,UDO_w55Xtcw,2025-09-19T16:36:14Z,UCYqdrfvhGxNW3vXebypqXoQ,&quot;Python for Hardware Folks&quot; - Alec Delaney,"Pyohio_2025 Alec Delaney https://www.pyohio.org/2025/program/talks/python-for-hardware-folks Python is a versatile language, ...",https://i.ytimg.com/vi/UDO_w55Xtcw/default.jpg,120,90,https://i.ytimg.com/vi/UDO_w55Xtcw/mqdefault.jpg,320,180,https://i.ytimg.com/vi/UDO_w55Xtcw/hqdefault.jpg,480,360,PyOhio,none,2025-09-19T16:36:14Z
0,youtube#searchResult,2WeNE9imqSxbRzlnOvUrBHlhVUg,youtube#video,qaGbwXJXf8E,2025-09-16T04:12:26Z,UCS9sdEyduD9K83K3GkvQlOA,&quot;Who_Dunnit.xlsx – Teaching Python through Data Investigation&quot; - Renee Noble (PyCon AU 2025),"(Renee Noble) Shock horror! Banana, the beloved science class Python has been released! But how? And more importantly...",https://i.ytimg.com/vi/qaGbwXJXf8E/default.jpg,120,90,https://i.ytimg.com/vi/qaGbwXJXf8E/mqdefault.jpg,320,180,https://i.ytimg.com/vi/qaGbwXJXf8E/hqdefault.jpg,480,360,PyCon AU,none,2025-09-16T04:12:26Z
1,youtube#searchResult,XVnPbC7jDWPfqbGnS9-66_C2vgs,youtube#video,qNt06GcQqCA,2025-09-15T03:30:45Z,UCS9sdEyduD9K83K3GkvQlOA,&quot;The Long Hello World&quot; - Noah Kantrowitz (Pycon AU 2025),"(Noah Kantrowitz) Hello World is often used as a stand-in for ""the simplest program"", great for teaching and getting people started ...",https://i.ytimg.com/vi/qNt06GcQqCA/default.jpg,120,90,https://i.ytimg.com/vi/qNt06GcQqCA/mqdefault.jpg,320,180,https://i.ytimg.com/vi/qNt06GcQqCA/hqdefault.jpg,480,360,PyCon AU,none,2025-09-15T03:30:45Z
2,youtube#searchResult,pBKqei1Ybc8ZNyErfVnzCMQLvaE,youtube#video,G0tlyC9Sr3w,2024-12-01T16:33:42Z,UCS9sdEyduD9K83K3GkvQlOA,ML ain’t your only hammer: adding mathematical optimisation to the data scientist’s toolbox,(Dr Jack Simpson) The purpose of this presentation is to introduce the audience to the field of mathematical optimisation - what it ...,https://i.ytimg.com/vi/G0tlyC9Sr3w/default.jpg,120,90,https://i.ytimg.com/vi/G0tlyC9Sr3w/mqdefault.jpg,320,180,https://i.ytimg.com/vi/G0tlyC9Sr3w/hqdefault.jpg,480,360,PyCon AU,none,2024-12-01T16:33:42Z
3,youtube#searchResult,Tb5Wkan6gYvtvrF8Xj8NxoD7h44,youtube#video,wCRlBdA0ED0,2024-12-01T01:41:03Z,UCS9sdEyduD9K83K3GkvQlOA,&quot;Conference Open (Saturday)&quot; - Peter Hall (Pycon AU 2024),(Peter Hall) This is the session where we'll tell you everything you need to know about the conference!,https://i.ytimg.com/vi/wCRlBdA0ED0/default.jpg,120,90,https://i.ytimg.com/vi/wCRlBdA0ED0/mqdefault.jpg,320,180,https://i.ytimg.com/vi/wCRlBdA0ED0/hqdefault.jpg,480,360,PyCon AU,none,2024-12-01T01:41:03Z
4,youtube#searchResult,dM6stw5S9jJAYCub7iHdr5ToxVM,youtube#video,X4XY1LLS8Z4,2023-08-24T08:45:49Z,UCS9sdEyduD9K83K3GkvQlOA,&quot;Maths Whimsy with Python&quot; - David Colls (PyCon AU 2023),"(David Colls) The more whimsy the better. First, it's about having fun solving interesting problems, and second it's about breaking ...",https://i.ytimg.com/vi/X4XY1LLS8Z4/default.jpg,120,90,https://i.ytimg.com/vi/X4XY1LLS8Z4/mqdefault.jpg,320,180,https://i.ytimg.com/vi/X4XY1LLS8Z4/hqdefault.jpg,480,360,PyCon AU,none,2023-08-24T08:45:49Z
0,youtube#searchResult,T6le-k3kAvBetJeFNlPT9uHbg3w,youtube#video,z4wSSuKuA04,2019-10-08T15:26:39Z,UCHh7vOesookNhYvupCCcJxA,Women in Tech Panel - PyLondinium 2019,The PyLondinium 2019 Women in Tech Panel has an in-depth discussion about promoting diversity and inclusion in the work ...,https://i.ytimg.com/vi/z4wSSuKuA04/default.jpg,120,90,https://i.ytimg.com/vi/z4wSSuKuA04/mqdefault.jpg,320,180,https://i.ytimg.com/vi/z4wSSuKuA04/hqdefault.jpg,480,360,PyLondinium,none,2019-10-08T15:26:39Z
1,youtube#searchResult,HggUE26FEmN1QpV1mAdmCRoS0TE,youtube#video,xNuz3WEk6AE,2019-10-08T13:55:09Z,UCHh7vOesookNhYvupCCcJxA,Keynote: The M Word - Anna Ossowski - PyLondinium19,"In a world where you can be anything, be kind. ** Copyright belongs to the speaker **",https://i.ytimg.com/vi/xNuz3WEk6AE/default.jpg,120,90,https://i.ytimg.com/vi/xNuz3WEk6AE/mqdefault.jpg,320,180,https://i.ytimg.com/vi/xNuz3WEk6AE/hqdefault.jpg,480,360,PyLondinium,none,2019-10-08T13:55:09Z
2,youtube#searchResult,61ZiOlVXiRtp9MhNdRd8S1LfSpM,youtube#video,OSnRl8yF9a4,2019-09-18T17:05:11Z,UCHh7vOesookNhYvupCCcJxA,How to best package your library? - Bernát Gábor - PyLondinium19,"One of the most fundamental principles of programming is ""don't repeat yourself."" Join me in finding out how you can achieve ...",https://i.ytimg.com/vi/OSnRl8yF9a4/default.jpg,120,90,https://i.ytimg.com/vi/OSnRl8yF9a4/mqdefault.jpg,320,180,https://i.ytimg.com/vi/OSnRl8yF9a4/hqdefault.jpg,480,360,PyLondinium,none,2019-09-18T17:05:11Z
3,youtube#searchResult,zWPTWwhWgXk7AP4LbcVVCQELzEQ,youtube#video,avLK67SHeAs,2019-09-18T17:00:14Z,UCHh7vOesookNhYvupCCcJxA,The soul of the beast: Everything about Python’s grammar - Pablo Galindo Salgado - PyLondinium19,We will try to answer a straightforward question: What makes Python so easy to learn and read? Other languages also have a ...,https://i.ytimg.com/vi/avLK67SHeAs/default.jpg,120,90,https://i.ytimg.com/vi/avLK67SHeAs/mqdefault.jpg,320,180,https://i.ytimg.com/vi/avLK67SHeAs/hqdefault.jpg,480,360,PyLondinium,none,2019-09-18T17:00:14Z
4,youtube#searchResult,YBkgm_zpLLFoP5BxTyCdAM5j8wI,youtube#video,WOlLYckxeLc,2019-09-18T16:42:10Z,UCHh7vOesookNhYvupCCcJxA,The Adventures of pip and pacman: A Tale of Package Managers - László Kiss Kollár - PyLondinium19,Overview Installing Python packages can be frustrating for new (and even not so new) users of Python. If we simply follow the ...,https://i.ytimg.com/vi/WOlLYckxeLc/default.jpg,120,90,https://i.ytimg.com/vi/WOlLYckxeLc/mqdefault.jpg,320,180,https://i.ytimg.com/vi/WOlLYckxeLc/hqdefault.jpg,480,360,PyLondinium,none,2019-09-18T16:42:10Z
0,youtube#searchResult,hMhxGv-XnZfKTApiuRXKx_83QxI,youtube#video,CtrsssksCNU,2025-09-27T20:20:37Z,UChA9XP_feY1-1oSy2L7acog,"PYCON UK 2025: Ada by Emily Holyoake, a rehearsed reading","This year at PyCon UK, you're warmly invited to a world premiere: Ada, a brand-new play inspired by Ada Lovelace, written by ...",https://i.ytimg.com/vi/CtrsssksCNU/default.jpg,120,90,https://i.ytimg.com/vi/CtrsssksCNU/mqdefault.jpg,320,180,https://i.ytimg.com/vi/CtrsssksCNU/hqdefault.jpg,480,360,PYCON UK,none,2025-09-27T20:20:37Z
1,youtube#searchResult,b3y3b8xYOQ3V5_UXryDvsIkzcoQ,youtube#video,8Pl3fvPfzDI,2025-09-27T13:24:06Z,UChA9XP_feY1-1oSy2L7acog,"PYCON UK 2025: Bringing Randomness to Life: A Python tool for stochastic processes, Dialid Santiago","How do you explain stochastic processes without equations? You show (plot) them! In this talk, I'll share my experience facing this ...",https://i.ytimg.com/vi/8Pl3fvPfzDI/default.jpg,120,90,https://i.ytimg.com/vi/8Pl3fvPfzDI/mqdefault.jpg,320,180,https://i.ytimg.com/vi/8Pl3fvPfzDI/hqdefault.jpg,480,360,PYCON UK,none,2025-09-27T13:24:06Z
2,youtube#searchResult,T4Gg9AAkwrgAzowuwvxZgFwFwqY,youtube#video,DkWHdLu97uk,2025-09-27T11:37:28Z,UChA9XP_feY1-1oSy2L7acog,"PYCON UK 2025: Halt and Catch Fire: Forcefully Stopping Python, Jake Howard",Writing code which runs is easy. Writing code which stops (cleanly) is hard. Writing code which cleanly stop someone else's code ...,https://i.ytimg.com/vi/DkWHdLu97uk/default.jpg,120,90,https://i.ytimg.com/vi/DkWHdLu97uk/mqdefault.jpg,320,180,https://i.ytimg.com/vi/DkWHdLu97uk/hqdefault.jpg,480,360,PYCON UK,none,2025-09-27T11:37:28Z
3,youtube#searchResult,INUFMLfJzrOEm5jKyKwZIn52KAY,youtube#video,llrv1P1xVO0,2025-09-27T11:15:30Z,UChA9XP_feY1-1oSy2L7acog,"PYCON UK 2025: Mapping Jane Austen’s Influence Across Space &amp; Time with ClickHouse, Nataly Merezhuk","What do zombies, Bollywood, and romantasy have in common? Jane Austen. This talk demonstrates how to embed, clean, and ...",https://i.ytimg.com/vi/llrv1P1xVO0/default.jpg,120,90,https://i.ytimg.com/vi/llrv1P1xVO0/mqdefault.jpg,320,180,https://i.ytimg.com/vi/llrv1P1xVO0/hqdefault.jpg,480,360,PYCON UK,none,2025-09-27T11:15:30Z
4,youtube#searchResult,X5N-cRQa1VOZOboBjhBQznM8zEY,youtube#video,f_d8fJQqlTQ,2025-09-27T10:43:57Z,UChA9XP_feY1-1oSy2L7acog,PYCON UK 2025: Lightning talks Saturday,Hosted by Mark Smith.,https://i.ytimg.com/vi/f_d8fJQqlTQ/default.jpg,120,90,https://i.ytimg.com/vi/f_d8fJQqlTQ/mqdefault.jpg,320,180,https://i.ytimg.com/vi/f_d8fJQqlTQ/hqdefault.jpg,480,360,PYCON UK,none,2025-09-27T10:43:57Z
0,youtube#searchResult,6VrxYlSCEpiN0WNryFyPCzqHK5k,youtube#video,ozhHbefdPWE,2025-11-08T17:01:19Z,UC51aOZF5nnderbuar5D5ifw,Talk to Your Chess Games with Python + LLMs — Indrajit Rajtilak (PyBay 2025),"What if you could chat with your chess games — about strategy, tactics, weaknesses, and more!In this talk, we'll build a ...",https://i.ytimg.com/vi/ozhHbefdPWE/default.jpg,120,90,https://i.ytimg.com/vi/ozhHbefdPWE/mqdefault.jpg,320,180,https://i.ytimg.com/vi/ozhHbefdPWE/hqdefault.jpg,480,360,SF Python,none,2025-11-08T17:01:19Z
1,youtube#searchResult,a78T352MpSmLYGfxDjdHqSSVxNM,youtube#video,vDc7SWqB2w4,2025-11-08T17:01:30Z,UC51aOZF5nnderbuar5D5ifw,"No, seriously, why don&#39;t we use better testing tools — Zac Hatfield Dodds (PyBay 2025)","Even powerful testing tools go unused. Drawing from years maintaining Python testing infrastructure, this talk explores why ...",https://i.ytimg.com/vi/vDc7SWqB2w4/default.jpg,120,90,https://i.ytimg.com/vi/vDc7SWqB2w4/mqdefault.jpg,320,180,https://i.ytimg.com/vi/vDc7SWqB2w4/hqdefault.jpg,480,360,SF Python,none,2025-11-08T17:01:30Z
2,youtube#searchResult,EZeGecQRvg5nPbPF58Vxs0ytrwQ,youtube#video,YPjILEc5Gj0,2025-11-08T17:01:02Z,UC51aOZF5nnderbuar5D5ifw,Welcome &amp; Opening Remarks — Chris Brousseau (PyBay 2025),Join us to kick off PyBay 2025 with Chris Brousseau the Conference Chair. Hear about the day and important messages from a ...,https://i.ytimg.com/vi/YPjILEc5Gj0/default.jpg,120,90,https://i.ytimg.com/vi/YPjILEc5Gj0/mqdefault.jpg,320,180,https://i.ytimg.com/vi/YPjILEc5Gj0/hqdefault.jpg,480,360,SF Python,none,2025-11-08T17:01:02Z
3,youtube#searchResult,lX85qH5XgV7nMd-a2Y2YQXuk0Bo,youtube#video,tZoVMbDmfhk,2025-11-08T17:01:26Z,UC51aOZF5nnderbuar5D5ifw,"Mentor Today, Lead Tomorrow  Why Interns Are Your Next Best Investment — Jo Hjersman (PyBay 2025)","In late May, the Federal Reserve Bank of New York announced CS majors ranked 7th in unemployment at 6.1%. With the scarcity ...",https://i.ytimg.com/vi/tZoVMbDmfhk/default.jpg,120,90,https://i.ytimg.com/vi/tZoVMbDmfhk/mqdefault.jpg,320,180,https://i.ytimg.com/vi/tZoVMbDmfhk/hqdefault.jpg,480,360,SF Python,none,2025-11-08T17:01:26Z
4,youtube#searchResult,8mm0gKxeoLcUxwPSl0bRokSWsy4,youtube#video,xAwf0Ss3R-4,2025-11-08T17:01:36Z,UC51aOZF5nnderbuar5D5ifw,"AI, IP, and Your Code What Developers Need to Know — Alla Barbalat (PyBay 2025)","In a world where AI-generated code is becoming more prevalent, who owns the output? Can AI companies freely use your ...",https://i.ytimg.com/vi/xAwf0Ss3R-4/default.jpg,120,90,https://i.ytimg.com/vi/xAwf0Ss3R-4/mqdefault.jpg,320,180,https://i.ytimg.com/vi/xAwf0Ss3R-4/hqdefault.jpg,480,360,SF Python,none,2025-11-08T17:01:36Z
0,youtube#searchResult,wdHRbKyDdOxD6aJJDgdygV-HlZI,youtube#video,9ASVfIPj_M8,2026-06-08T06:56:33Z,UCEhI2CfdT5--TYq47K4en4A,PyMeetup 2024/09 From text to actions: LLMs as the new software consumers by Pol Alvarez Vecino,"QA bots, copilots, workflow automation - LLMs are evolving to control our software through natural language. The endgame is ...",https://i.ytimg.com/vi/9ASVfIPj_M8/default.jpg,120,90,https://i.ytimg.com/vi/9ASVfIPj_M8/mqdefault.jpg,320,180,https://i.ytimg.com/vi/9ASVfIPj_M8/hqdefault.jpg,480,360,Python Barcelona,none,2026-06-08T06:56:33Z
1,youtube#searchResult,YK86vE9Gs1vDZ3eeaSSh2YXg9EU,youtube#video,h_LXliq1Wik,2026-05-31T19:45:00Z,UCEhI2CfdT5--TYq47K4en4A,PyMeetup 2024/09/26 Ragtime. An Approach to Retrieval-Augmented Generation by Javier Martinez,"In this session, we'll explore a pattern that has sparked significant interest in the world of natural language models (LLMs): ...",https://i.ytimg.com/vi/h_LXliq1Wik/default.jpg,120,90,https://i.ytimg.com/vi/h_LXliq1Wik/mqdefault.jpg,320,180,https://i.ytimg.com/vi/h_LXliq1Wik/hqdefault.jpg,480,360,Python Barcelona,none,2026-05-31T19:45:00Z
2,youtube#searchResult,0-C9EU1pPT8r6PLYl349vitiEig,youtube#video,2xqQwC2MwYY,2026-05-27T12:45:39Z,UCEhI2CfdT5--TYq47K4en4A,PyMeetup 2023/02/23 Python &amp; ChatGPT by Ismael Benito Altamirano,"Have you talked to the new kid in the building? I have, and a lot. Let me show you the capabilities of ChatGPT, and its limitations.",https://i.ytimg.com/vi/2xqQwC2MwYY/default.jpg,120,90,https://i.ytimg.com/vi/2xqQwC2MwYY/mqdefault.jpg,320,180,https://i.ytimg.com/vi/2xqQwC2MwYY/hqdefault.jpg,480,360,Python Barcelona,none,2026-05-27T12:45:39Z
3,youtube#searchResult,0sSkfjxhFTE1HYr2k1MJZE_T5ME,youtube#video,VE-JE4G53c8,2026-05-25T15:39:31Z,UCEhI2CfdT5--TYq47K4en4A,PyMeetup 2023/04/27 Python Packaging 101 by Ferran Jovell,Have you ever wondered how does the pip install? Would you like to know how to create your very own python package? This talk ...,https://i.ytimg.com/vi/VE-JE4G53c8/default.jpg,120,90,https://i.ytimg.com/vi/VE-JE4G53c8/mqdefault.jpg,320,180,https://i.ytimg.com/vi/VE-JE4G53c8/hqdefault.jpg,480,360,Python Barcelona,none,2026-05-25T15:39:31Z
4,youtube#searchResult,LeOiEF-F5KSz-2KRGYvz1nk2bXc,youtube#video,jUoJGYCWSC0,2022-06-26T21:05:25Z,UCEhI2CfdT5--TYq47K4en4A,PyMeetup 2022/06/15 Creating Python Data Pipelines with Yaetos by Arthur Prevot,Python Barcelona https://pybcn.org Who: Arthur Prevot (   @arprevot) Language: English Abstract: The talk will describe ...,https://i.ytimg.com/vi/jUoJGYCWSC0/default.jpg,120,90,https://i.ytimg.com/vi/jUoJGYCWSC0/mqdefault.jpg,320,180,https://i.ytimg.com/vi/jUoJGYCWSC0/hqdefault.jpg,480,360,Python Barcelona,none,2022-06-26T21:05:25Z
0,youtube#searchResult,ghU8P901PJkfuNNJ2apjufQh2zI,youtube#video,AzkUBhufgp8,2023-01-03T20:09:47Z,UC6HfeAa0vWeSWS6IcNAjZ2A,AI-animated visual short story: Never of the past or the future #aiart,An experiment in generating a visualization for a short story from suchwasnot.com (Never of the past or the future). The animation ...,https://i.ytimg.com/vi/AzkUBhufgp8/default.jpg,120,90,https://i.ytimg.com/vi/AzkUBhufgp8/mqdefault.jpg,320,180,https://i.ytimg.com/vi/AzkUBhufgp8/hqdefault.jpg,480,360,Sebastiaan Mathôt,none,2023-01-03T20:09:47Z
1,youtube#searchResult,rNqK97Y-osm_dnTzET3xY2UvT2w,youtube#video,mu7yct6hOSA,2022-03-21T19:44:04Z,UC6HfeAa0vWeSWS6IcNAjZ2A,Publishing a Python package on pip [PythonLiveLessons #6],"Episode 6 of #PythonLiveLessons, a weekly live stream about Python code and more, hosted by Sebastiaan Mathôt.",https://i.ytimg.com/vi/mu7yct6hOSA/default.jpg,120,90,https://i.ytimg.com/vi/mu7yct6hOSA/mqdefault.jpg,320,180,https://i.ytimg.com/vi/mu7yct6hOSA/hqdefault.jpg,480,360,Sebastiaan Mathôt,none,2022-03-21T19:44:04Z
2,youtube#searchResult,iNhicQ-F7ndvyGj8F5FsQaIXM9A,youtube#video,ej3S30nC8Io,2022-03-16T20:21:46Z,UC6HfeAa0vWeSWS6IcNAjZ2A,Documenting Python code (docstrings) [PythonLiveLessons #5],"The sixth episode of #PythonLiveLessons, a weekly live stream about Python code and more, hosted by Sebastiaan Mathôt.",https://i.ytimg.com/vi/ej3S30nC8Io/default.jpg,120,90,https://i.ytimg.com/vi/ej3S30nC8Io/mqdefault.jpg,320,180,https://i.ytimg.com/vi/ej3S30nC8Io/hqdefault.jpg,480,360,Sebastiaan Mathôt,none,2022-03-16T20:21:46Z
3,youtube#searchResult,E91N4s2wwCbh3c-GY3gDxYn8m-s,youtube#video,vX83-7G0Qm0,2022-03-16T05:33:29Z,UC6HfeAa0vWeSWS6IcNAjZ2A,PythonLiveLessons #6: Publishing a Python package on pip,"This is the seventh episode of #PythonLiveLessons, a weekly live stream about Python code and more, hosted by Sebastiaan ...",https://i.ytimg.com/vi/vX83-7G0Qm0/default.jpg,120,90,https://i.ytimg.com/vi/vX83-7G0Qm0/mqdefault.jpg,320,180,https://i.ytimg.com/vi/vX83-7G0Qm0/hqdefault.jpg,480,360,Sebastiaan Mathôt,none,2022-03-16T05:33:29Z
4,youtube#searchResult,fPcRMsjk2Rd31_43J-uqukE6JaA,youtube#video,f4ZQ-_Sft0I,2022-03-09T05:35:13Z,UC6HfeAa0vWeSWS6IcNAjZ2A,PythonLiveLessons #5: Documenting your Python project,"This is the sixth episode of #PythonLiveLessons, a weekly live stream about Python code and more, hosted by Sebastiaan Mathôt.",https://i.ytimg.com/vi/f4ZQ-_Sft0I/default.jpg,120,90,https://i.ytimg.com/vi/f4ZQ-_Sft0I/mqdefault.jpg,320,180,https://i.ytimg.com/vi/f4ZQ-_Sft0I/hqdefault.jpg,480,360,Sebastiaan Mathôt,none,2022-03-09T05:35:13Z
0,youtube#searchResult,ZXtzLYr2NsUq0rrTKTCC3fRy5ls,youtube#video,jXn4KHaoH-k,2026-06-21T20:52:03Z,UCDVL0bPrZHwCeJrlyy-wxaQ,Agents All the Way Down: How the VS Code Team Builds with What It Ships - Harald Kirschner,Commits doubled. Issues closed tripled. Releases went from monthly to weekly — same team size. The VS Code team wired ...,https://i.ytimg.com/vi/jXn4KHaoH-k/default.jpg,120,90,https://i.ytimg.com/vi/jXn4KHaoH-k/mqdefault.jpg,320,180,https://i.ytimg.com/vi/jXn4KHaoH-k/hqdefault.jpg,480,360,Global AI Community,none,2026-06-21T20:52:03Z
1,youtube#searchResult,YpwJtEmXSFJiIexYzp6joXecnfg,youtube#video,IFFkg0khNdk,2026-06-21T20:52:58Z,UCDVL0bPrZHwCeJrlyy-wxaQ,Lessons from a No-Code Library -  Drew Breunig,"The allure of Spec-Driven Development (SDD) is that you bring the specs and tests and the code comes for free. In reality, SDD ...",https://i.ytimg.com/vi/IFFkg0khNdk/default.jpg,120,90,https://i.ytimg.com/vi/IFFkg0khNdk/mqdefault.jpg,320,180,https://i.ytimg.com/vi/IFFkg0khNdk/hqdefault.jpg,480,360,Global AI Community,none,2026-06-21T20:52:58Z
2,youtube#searchResult,CAuXbjilZCUOfpBPyBaxIX6aCwY,youtube#video,Um9Lki5aPNA,2026-06-21T20:50:14Z,UCDVL0bPrZHwCeJrlyy-wxaQ,RAG is Dead. Long Live Agent Memory - Chris Latimer,"Chris Latimer is the co-founder and CEO of Vectorize, where he helps companies solve their hardest AI data challenges. As an AI ...",https://i.ytimg.com/vi/Um9Lki5aPNA/default.jpg,120,90,https://i.ytimg.com/vi/Um9Lki5aPNA/mqdefault.jpg,320,180,https://i.ytimg.com/vi/Um9Lki5aPNA/hqdefault.jpg,480,360,Global AI Community,none,2026-06-21T20:50:14Z
3,youtube#searchResult,NNIbv2JuIi6eHLqrF3oBaLoxVvc,youtube#video,RKPh7g0i-00,2026-06-21T20:48:36Z,UCDVL0bPrZHwCeJrlyy-wxaQ,"Securing Coding Agents: Sandboxes, Guardrails, and Real-World Attacks - Dan Ndombe","While most coding agents have ""sandboxes"" and ""permissions"", did you know that they are easily bypassed? And it's rare that a ...",https://i.ytimg.com/vi/RKPh7g0i-00/default.jpg,120,90,https://i.ytimg.com/vi/RKPh7g0i-00/mqdefault.jpg,320,180,https://i.ytimg.com/vi/RKPh7g0i-00/hqdefault.jpg,480,360,Global AI Community,none,2026-06-21T20:48:36Z
4,youtube#searchResult,Qyj-_-AFWt_OasgsckKIWvW4ndg,youtube#video,vDYht99Ttlc,2026-06-21T20:47:02Z,UCDVL0bPrZHwCeJrlyy-wxaQ,Client side Web AI Agents for the agentic internet of the future - Jason Mayes,"AI is everywhere, and Web AI usage in JavaScript on the front end is growing exponentially - but where is it going and how will ...",https://i.ytimg.com/vi/vDYht99Ttlc/default.jpg,120,90,https://i.ytimg.com/vi/vDYht99Ttlc/mqdefault.jpg,320,180,https://i.ytimg.com/vi/vDYht99Ttlc/hqdefault.jpg,480,360,Global AI Community,none,2026-06-21T20:47:02Z
0,youtube#searchResult,wnC_ILppweCIVlDI1eOIe8PZ9Io,youtube#video,NdPMaDzpqW8,2023-09-09T17:37:09Z,UCxArXLI-gxlTmWGGgec5D7w,Functions in Julia -Learn Julia 15/n-,"What are functions and what do they do ? In this video I present functions in Julia, what are they, how do they work, and how we ...",https://i.ytimg.com/vi/NdPMaDzpqW8/default.jpg,120,90,https://i.ytimg.com/vi/NdPMaDzpqW8/mqdefault.jpg,320,180,https://i.ytimg.com/vi/NdPMaDzpqW8/hqdefault.jpg,480,360,Rémi Vezy,none,2023-09-09T17:37:09Z
1,youtube#searchResult,rEWHiy_Oo_ajJqqUuKlqxf2zkKI,youtube#video,wTiVtP5tYPY,2023-08-21T14:58:42Z,UCxArXLI-gxlTmWGGgec5D7w,"For loops in Julia (eachindex, enumerate...) -Learn Julia 14/n-","How can we repeatedly execute code in Julia ? In this video I present for loops in Julia, what are they and how they work, and I ...",https://i.ytimg.com/vi/wTiVtP5tYPY/default.jpg,120,90,https://i.ytimg.com/vi/wTiVtP5tYPY/mqdefault.jpg,320,180,https://i.ytimg.com/vi/wTiVtP5tYPY/hqdefault.jpg,480,360,Rémi Vezy,none,2023-08-21T14:58:42Z
2,youtube#searchResult,7SvULtr0ZSf-aVXdJsG67xr__U0,youtube#video,qNK9C3ewoGE,2022-08-20T13:16:04Z,UCxArXLI-gxlTmWGGgec5D7w,Conditionals in Julia (if...else...) -Learn Julia 13/n-,"If you appreciate this video, you can buy me a coffee on Tipeee: https://fr.tipeee.com/remi-vezy What are conditional statements ?",https://i.ytimg.com/vi/qNK9C3ewoGE/default.jpg,120,90,https://i.ytimg.com/vi/qNK9C3ewoGE/mqdefault.jpg,320,180,https://i.ytimg.com/vi/qNK9C3ewoGE/hqdefault.jpg,480,360,Rémi Vezy,none,2022-08-20T13:16:04Z
3,youtube#searchResult,glKnpI8iBTADo8JSjRmdsdRCwI8,youtube#video,zCvYmbP1esc,2022-05-22T19:07:40Z,UCxArXLI-gxlTmWGGgec5D7w,`begin` and `let` in Julia -Learn Julia 12/n-,You can buy me a coffee on Tipeee: https://fr.tipeee.com/remi-vezy What are `begin...end` statements ? What is the difference with ...,https://i.ytimg.com/vi/zCvYmbP1esc/default.jpg,120,90,https://i.ytimg.com/vi/zCvYmbP1esc/mqdefault.jpg,320,180,https://i.ytimg.com/vi/zCvYmbP1esc/hqdefault.jpg,480,360,Rémi Vezy,none,2022-05-22T19:07:40Z
4,youtube#searchResult,w-zh3g_Eg5CJVN88mHIGa1LNl2w,youtube#video,yZwHgdAEx5Q,2022-04-24T19:46:02Z,UCxArXLI-gxlTmWGGgec5D7w,String operators in Julia -Learn Julia 11/n-,You can buy me a coffee on Tipeee: https://fr.tipeee.com/remi-vezy What is a string? What is the difference with characters?,https://i.ytimg.com/vi/yZwHgdAEx5Q/default.jpg,120,90,https://i.ytimg.com/vi/yZwHgdAEx5Q/mqdefault.jpg,320,180,https://i.ytimg.com/vi/yZwHgdAEx5Q/hqdefault.jpg,480,360,Rémi Vezy,none,2022-04-24T19:46:02Z
0,youtube#searchResult,reIVw_NhgHc9437ipUVWLhN92mQ,youtube#video,egMPgkuJonE,2026-05-15T23:31:00Z,UCupQLyNchb9-2Z5lmUOIijw,"Lesson 06: A softer perceptron, part II: likelihood and loss #education #science #deeplearning",,https://i.ytimg.com/vi/egMPgkuJonE/default.jpg,120,90,https://i.ytimg.com/vi/egMPgkuJonE/mqdefault.jpg,320,180,https://i.ytimg.com/vi/egMPgkuJonE/hqdefault.jpg,480,360,Alfredo Canziani (冷在),none,2026-05-15T23:31:00Z
1,youtube#searchResult,WYsPVbLxY8aBqS7w5Q3PqJw0qh8,youtube#video,6urnjbulYt0,2026-05-15T21:05:36Z,UCupQLyNchb9-2Z5lmUOIijw,"Lesson 06 – A softer perceptron, part II: likelihood and loss",Course website: https://atcold.github.io/NYU-DLFL25U/,https://i.ytimg.com/vi/6urnjbulYt0/default.jpg,120,90,https://i.ytimg.com/vi/6urnjbulYt0/mqdefault.jpg,320,180,https://i.ytimg.com/vi/6urnjbulYt0/hqdefault.jpg,480,360,Alfredo Canziani (冷在),none,2026-05-15T21:05:36Z
2,youtube#searchResult,Rx-weoKaE3qTaexl_onq04dJIJI,youtube#video,r41-Q6YTMfY,2026-03-13T16:11:49Z,UCupQLyNchb9-2Z5lmUOIijw,"Lesson 05: A softer perceptron, part I: probabilities #science #education #deeplearning",,https://i.ytimg.com/vi/r41-Q6YTMfY/default.jpg,120,90,https://i.ytimg.com/vi/r41-Q6YTMfY/mqdefault.jpg,320,180,https://i.ytimg.com/vi/r41-Q6YTMfY/hqdefault.jpg,480,360,Alfredo Canziani (冷在),none,2026-03-13T16:11:49Z
3,youtube#searchResult,7DM7kjI3AjdJqHRu_Ed6Wklqqz4,youtube#video,DYtEA4FTCgE,2026-03-11T20:56:38Z,UCupQLyNchb9-2Z5lmUOIijw,"Lesson 05 – A softer perceptron, part I: probabilities",Course website: https://atcold.github.io/NYU-DLFL25U/,https://i.ytimg.com/vi/DYtEA4FTCgE/default.jpg,120,90,https://i.ytimg.com/vi/DYtEA4FTCgE/mqdefault.jpg,320,180,https://i.ytimg.com/vi/DYtEA4FTCgE/hqdefault.jpg,480,360,Alfredo Canziani (冷在),none,2026-03-11T20:56:38Z
4,youtube#searchResult,UP1w3WeYvNQyLDXu0oXagWNRJLM,youtube#video,AJdgzGB80rg,2026-03-09T17:48:32Z,UCupQLyNchb9-2Z5lmUOIijw,"Lesson 04: Bias, perceptron properties, and multi-class classification 🧠",,https://i.ytimg.com/vi/AJdgzGB80rg/default.jpg,120,90,https://i.ytimg.com/vi/AJdgzGB80rg/mqdefault.jpg,320,180,https://i.ytimg.com/vi/AJdgzGB80rg/hqdefault.jpg,480,360,Alfredo Canziani (冷在),none,2026-03-09T17:48:32Z
0,youtube#searchResult,yum04ZSVvCGroZgNzOw_vAyox4A,youtube#video,vCqMCIdIHGo,2019-10-01T12:29:58Z,UCBEShbs7rtE_ZjTmb6Jt5WA,PROGRAM TO FIND FACTORIAL OF GIVEN NUMBER,DURecorder This is my video recorded with DU Recorder. It's easy to record your screen and livestream. Download link: Android: ...,https://i.ytimg.com/vi/vCqMCIdIHGo/default.jpg,120,90,https://i.ytimg.com/vi/vCqMCIdIHGo/mqdefault.jpg,320,180,https://i.ytimg.com/vi/vCqMCIdIHGo/hqdefault.jpg,480,360,Real Python,none,2019-10-01T12:29:58Z
1,youtube#searchResult,LodWtfcTIcw25BpuU6_EfwecbJA,youtube#video,TUlTY9GnKXE,2019-10-01T12:16:53Z,UCBEShbs7rtE_ZjTmb6Jt5WA,PYTHON PROGRAM TO PRINT REVERSE OF A NUMBER,,https://i.ytimg.com/vi/TUlTY9GnKXE/default.jpg,120,90,https://i.ytimg.com/vi/TUlTY9GnKXE/mqdefault.jpg,320,180,https://i.ytimg.com/vi/TUlTY9GnKXE/hqdefault.jpg,480,360,Real Python,none,2019-10-01T12:16:53Z
0,youtube#searchResult,gCTMToTossQPdZ8oD8GGTQMty7M,youtube#video,HnFFdVB94js,2026-06-25T08:00:26Z,UC9IuUwwE2xdjQUT_LMLONoA,DiffOpt: Now Nonlinear and Streamlined | Joaquim Dias Garcia,,https://i.ytimg.com/vi/HnFFdVB94js/default.jpg,120,90,https://i.ytimg.com/vi/HnFFdVB94js/mqdefault.jpg,320,180,https://i.ytimg.com/vi/HnFFdVB94js/hqdefault.jpg,480,360,The Julia Programming Language,none,2026-06-25T08:00:26Z
1,youtube#searchResult,j-B-n5zeRdNfO-k0AFFs259JFco,youtube#video,7eCB6-RGxWw,2026-06-24T08:00:26Z,UC9IuUwwE2xdjQUT_LMLONoA,JuMP&#39;s macros: why are they needed? | Oscar Dowson,,https://i.ytimg.com/vi/7eCB6-RGxWw/default.jpg,120,90,https://i.ytimg.com/vi/7eCB6-RGxWw/mqdefault.jpg,320,180,https://i.ytimg.com/vi/7eCB6-RGxWw/hqdefault.jpg,480,360,The Julia Programming Language,none,2026-06-24T08:00:26Z
