,kind,etag,id.kind,id.videoId,snippet.publishedAt,snippet.channelId,snippet.title,snippet.description,snippet.thumbnails.default.url,snippet.thumbnails.default.width,snippet.thumbnails.default.height,snippet.thumbnails.medium.url,snippet.thumbnails.medium.width,snippet.thumbnails.medium.height,snippet.thumbnails.high.url,snippet.thumbnails.high.width,snippet.thumbnails.high.height,snippet.channelTitle,snippet.liveBroadcastContent,snippet.publishTime
12,youtube#searchResult,1zQ-XUHdNqHXNX74bXl1LR-cTpQ,youtube#video,yAN2RuYN62U,2023-12-14T03:00:13Z,UCKPyg5gsnt6h0aA8EBw3i6A,How to Setup Your Python Environment (With VSCode &amp; Anaconda),Subscribe to RichardOnData here: https://www.youtube.com/channel/UCKPyg5gsnt6h0aA8EBw3i6A?sub_confirmation=1 In this ...,https://i.ytimg.com/vi/yAN2RuYN62U/default.jpg,120,90,https://i.ytimg.com/vi/yAN2RuYN62U/mqdefault.jpg,320,180,https://i.ytimg.com/vi/yAN2RuYN62U/hqdefault.jpg,480,360,RichardOnData,none,2023-12-14T03:00:13Z
13,youtube#searchResult,QDS9S-R0HTQR5ga57NmTo68WRjM,youtube#video,aG2034I8ZEw,2023-12-09T22:30:00Z,UCKPyg5gsnt6h0aA8EBw3i6A,How I Passed the Google Cloud Professional ML Engineer Exam,Subscribe to RichardOnData here: https://www.youtube.com/channel/UCKPyg5gsnt6h0aA8EBw3i6A?sub_confirmation=1 ...,https://i.ytimg.com/vi/aG2034I8ZEw/default.jpg,120,90,https://i.ytimg.com/vi/aG2034I8ZEw/mqdefault.jpg,320,180,https://i.ytimg.com/vi/aG2034I8ZEw/hqdefault.jpg,480,360,RichardOnData,none,2023-12-09T22:30:00Z
14,youtube#searchResult,O-5Y7gefTs0dWY-mbhSouTnk0o4,youtube#video,gpP_j1e65oo,2023-11-30T01:00:06Z,UCKPyg5gsnt6h0aA8EBw3i6A,Update | Where I’ve Been,Subscribe to RichardOnData here: https://www.youtube.com/channel/UCKPyg5gsnt6h0aA8EBw3i6A?sub_confirmation=1 Hi ...,https://i.ytimg.com/vi/gpP_j1e65oo/default.jpg,120,90,https://i.ytimg.com/vi/gpP_j1e65oo/mqdefault.jpg,320,180,https://i.ytimg.com/vi/gpP_j1e65oo/hqdefault.jpg,480,360,RichardOnData,none,2023-11-30T01:00:06Z
15,youtube#searchResult,UqVnggPIeQaGknqjiZR4xCyZL9Y,youtube#video,rf3jsWO3rg4,2022-06-20T21:46:50Z,UCKPyg5gsnt6h0aA8EBw3i6A,Tufte&#39;s Principles of Graphical Integrity,Subscribe to RichardOnData here: https://www.youtube.com/channel/UCKPyg5gsnt6h0aA8EBw3i6A?sub_confirmation=1 In this ...,https://i.ytimg.com/vi/rf3jsWO3rg4/default.jpg,120,90,https://i.ytimg.com/vi/rf3jsWO3rg4/mqdefault.jpg,320,180,https://i.ytimg.com/vi/rf3jsWO3rg4/hqdefault.jpg,480,360,RichardOnData,none,2022-06-20T21:46:50Z
16,youtube#searchResult,GOZQe42lMXC5BwGmsVAgHlxpAxA,youtube#video,5ri7G7zgOh8,2022-06-13T19:30:05Z,UCKPyg5gsnt6h0aA8EBw3i6A,Why Is It SO HARD to Get a Data Science Job?,Subscribe to RichardOnData here: https://www.youtube.com/channel/UCKPyg5gsnt6h0aA8EBw3i6A?sub_confirmation=1 In this ...,https://i.ytimg.com/vi/5ri7G7zgOh8/default.jpg,120,90,https://i.ytimg.com/vi/5ri7G7zgOh8/mqdefault.jpg,320,180,https://i.ytimg.com/vi/5ri7G7zgOh8/hqdefault.jpg,480,360,RichardOnData,none,2022-06-13T19:30:05Z
17,youtube#searchResult,FuTOh0GYEA59ZNBWAhcQV19RaPE,youtube#video,FmjPtdP0Pv0,2022-03-28T22:00:12Z,UCKPyg5gsnt6h0aA8EBw3i6A,I Quit My Data Science Job.   Here’s Why,Subscribe to RichardOnData here: https://www.youtube.com/channel/UCKPyg5gsnt6h0aA8EBw3i6A?sub_confirmation=1 In this ...,https://i.ytimg.com/vi/FmjPtdP0Pv0/default.jpg,120,90,https://i.ytimg.com/vi/FmjPtdP0Pv0/mqdefault.jpg,320,180,https://i.ytimg.com/vi/FmjPtdP0Pv0/hqdefault.jpg,480,360,RichardOnData,none,2022-03-28T22:00:12Z
18,youtube#searchResult,rwWWXX66E8ToQXdmBdnOlM_KcWE,youtube#video,V5srYcnDowA,2022-03-07T21:32:19Z,UCKPyg5gsnt6h0aA8EBw3i6A,10 Good Coding Practices for Data Science,Subscribe to RichardOnData here: https://www.youtube.com/channel/UCKPyg5gsnt6h0aA8EBw3i6A?sub_confirmation=1 In this ...,https://i.ytimg.com/vi/V5srYcnDowA/default.jpg,120,90,https://i.ytimg.com/vi/V5srYcnDowA/mqdefault.jpg,320,180,https://i.ytimg.com/vi/V5srYcnDowA/hqdefault.jpg,480,360,RichardOnData,none,2022-03-07T21:32:19Z
19,youtube#searchResult,hC9chYDNKOQmK_-DTtKF1Uaf3ts,youtube#video,imZ7bjBBHPg,2021-10-19T21:30:02Z,UCKPyg5gsnt6h0aA8EBw3i6A,Data Science Advice for College Students,"Subscribe to RichardOnData here: https://www.youtube.com/channel/UCKPyg5gsnt6h0aA8EBw3i6A?sub_confirmation=1 ""How ...",https://i.ytimg.com/vi/imZ7bjBBHPg/default.jpg,120,90,https://i.ytimg.com/vi/imZ7bjBBHPg/mqdefault.jpg,320,180,https://i.ytimg.com/vi/imZ7bjBBHPg/hqdefault.jpg,480,360,RichardOnData,none,2021-10-19T21:30:02Z
20,youtube#searchResult,-2fCs3AYmzKRCnHZFddKlFLTkR0,youtube#video,qnCRmzJHnIc,2021-10-05T15:30:05Z,UCKPyg5gsnt6h0aA8EBw3i6A,The TRUTH About Learning Data Science,Subscribe to RichardOnData here: https://www.youtube.com/channel/UCKPyg5gsnt6h0aA8EBw3i6A?sub_confirmation=1 In this ...,https://i.ytimg.com/vi/qnCRmzJHnIc/default.jpg,120,90,https://i.ytimg.com/vi/qnCRmzJHnIc/mqdefault.jpg,320,180,https://i.ytimg.com/vi/qnCRmzJHnIc/hqdefault.jpg,480,360,RichardOnData,none,2021-10-05T15:30:05Z
21,youtube#searchResult,Yrt-aCvfWei2LxCiWQvELOx_5oM,youtube#video,rL-1bqrISWE,2021-08-31T12:38:05Z,UCKPyg5gsnt6h0aA8EBw3i6A,Is the Future of Data Work Remote?,Subscribe to RichardOnData here: https://www.youtube.com/channel/UCKPyg5gsnt6h0aA8EBw3i6A?sub_confirmation=1 In this ...,https://i.ytimg.com/vi/rL-1bqrISWE/default.jpg,120,90,https://i.ytimg.com/vi/rL-1bqrISWE/mqdefault.jpg,320,180,https://i.ytimg.com/vi/rL-1bqrISWE/hqdefault.jpg,480,360,RichardOnData,none,2021-08-31T12:38:05Z
22,youtube#searchResult,oCiUAFVedj5o6-brx9QIbHBMM4Y,youtube#video,act-KMkNLqI,2021-08-11T11:30:26Z,UCKPyg5gsnt6h0aA8EBw3i6A,The State of Data Science in 2021 | Anaconda&#39;s Annual Report,Subscribe to RichardOnData here: https://www.youtube.com/channel/UCKPyg5gsnt6h0aA8EBw3i6A?sub_confirmation=1 2020 ...,https://i.ytimg.com/vi/act-KMkNLqI/default.jpg,120,90,https://i.ytimg.com/vi/act-KMkNLqI/mqdefault.jpg,320,180,https://i.ytimg.com/vi/act-KMkNLqI/hqdefault.jpg,480,360,RichardOnData,none,2021-08-11T11:30:26Z
23,youtube#searchResult,KZU1Z-nLFgyqnMu22VoOfdkHxPI,youtube#video,bhzn4FB-TW4,2021-04-27T20:30:01Z,UCKPyg5gsnt6h0aA8EBw3i6A,What Is Data Engineering?,Subscribe to RichardOnData here: https://www.youtube.com/channel/UCKPyg5gsnt6h0aA8EBw3i6A?sub_confirmation=1 In this ...,https://i.ytimg.com/vi/bhzn4FB-TW4/default.jpg,120,90,https://i.ytimg.com/vi/bhzn4FB-TW4/mqdefault.jpg,320,180,https://i.ytimg.com/vi/bhzn4FB-TW4/hqdefault.jpg,480,360,RichardOnData,none,2021-04-27T20:30:01Z
24,youtube#searchResult,gYnXozg-FFn-wfpuDFMZv4O6cBQ,youtube#video,9FH0CIMq8-Y,2021-04-11T23:00:03Z,UCKPyg5gsnt6h0aA8EBw3i6A,When Should You Use Regression Methods?,Subscribe to RichardOnData here: https://www.youtube.com/channel/UCKPyg5gsnt6h0aA8EBw3i6A?sub_confirmation=1 Topics: ...,https://i.ytimg.com/vi/9FH0CIMq8-Y/default.jpg,120,90,https://i.ytimg.com/vi/9FH0CIMq8-Y/mqdefault.jpg,320,180,https://i.ytimg.com/vi/9FH0CIMq8-Y/hqdefault.jpg,480,360,RichardOnData,none,2021-04-11T23:00:03Z
0,youtube#searchResult,WH1eToogjTMvoR_de9KV6ZHKaUI,youtube#video,MYKYksteNMM,2023-05-03T22:25:36Z,UCvwDejnW-Q49xEb667JqS-g,Mar 2023 - Supercharge your Python Dev Environment with VS Code &amp; XGBoost Wage Prediction Model,"Philly Python Users' Group + DataPhilly collaboration in-person event on Wharton's campus (Philadelphia, PA) on Mar 30, 2023.",https://i.ytimg.com/vi/MYKYksteNMM/default.jpg,120,90,https://i.ytimg.com/vi/MYKYksteNMM/mqdefault.jpg,320,180,https://i.ytimg.com/vi/MYKYksteNMM/hqdefault.jpg,480,360,DataPhilly,none,2023-05-03T22:25:36Z
1,youtube#searchResult,m1yYi_Z9H3HPEiEqfj5Sh3VSk6E,youtube#video,8y1p6uBHWVs,2022-10-17T00:51:38Z,UCvwDejnW-Q49xEb667JqS-g,Aug 2022  - Lighting Talks - Using Data Science in the Real World,This is a video of the second half of the event only. Lighting Talk #2 Abstract: The last two Canadian federal elections have ...,https://i.ytimg.com/vi/8y1p6uBHWVs/default.jpg,120,90,https://i.ytimg.com/vi/8y1p6uBHWVs/mqdefault.jpg,320,180,https://i.ytimg.com/vi/8y1p6uBHWVs/hqdefault.jpg,480,360,DataPhilly,none,2022-10-17T00:51:38Z
2,youtube#searchResult,8n_ev8-m0jdL-jQgKHHoHAICVp8,youtube#video,UixN0WmRaEg,2022-06-09T20:58:47Z,UCvwDejnW-Q49xEb667JqS-g,May 2022 - Linux Deep Dive for Data Science,"Speaker Session 1: In the world of data, there are a wide variety of tools for processing, managing, and analyzing data.",https://i.ytimg.com/vi/UixN0WmRaEg/default.jpg,120,90,https://i.ytimg.com/vi/UixN0WmRaEg/mqdefault.jpg,320,180,https://i.ytimg.com/vi/UixN0WmRaEg/hqdefault.jpg,480,360,DataPhilly,none,2022-06-09T20:58:47Z
3,youtube#searchResult,N_GEs4H2wVpse-zVuxUd3pniREM,youtube#video,dSslgMZEhas,2022-04-25T22:03:00Z,UCvwDejnW-Q49xEb667JqS-g,April 2022 - Live LinkedIn Profile Reviews &amp; Job Search Strategies,"DataPhilly Speaker Event - Apr 21, 2022 Topic: Live LinkedIn Profile Reviews & Job Search Strategies Speaker: Lynne Williams Is ...",https://i.ytimg.com/vi/dSslgMZEhas/default.jpg,120,90,https://i.ytimg.com/vi/dSslgMZEhas/mqdefault.jpg,320,180,https://i.ytimg.com/vi/dSslgMZEhas/hqdefault.jpg,480,360,DataPhilly,none,2022-04-25T22:03:00Z
4,youtube#searchResult,XGZXiI5_0l6SSyAZVhOHDZ8babg,youtube#video,D3vbH9klbTk,2022-01-03T02:59:02Z,UCvwDejnW-Q49xEb667JqS-g,Introducing Unstructured Data into your Models,"DataPhilly Speaker Event - Dec 16, 2021 Topic: Introducing Unstructured Data into your Models - Extracting predictive info/signals ...",https://i.ytimg.com/vi/D3vbH9klbTk/default.jpg,120,90,https://i.ytimg.com/vi/D3vbH9klbTk/mqdefault.jpg,320,180,https://i.ytimg.com/vi/D3vbH9klbTk/hqdefault.jpg,480,360,DataPhilly,none,2022-01-03T02:59:02Z
0,youtube#searchResult,N0UKqQjQwbZQw5-Lr7MCgpO_bhA,youtube#video,Tiw2mi-AGJ8,2026-02-16T04:20:42Z,UCipPccqvcfychKNOaYUokyQ,"AIVP, RIKEN-AIP &amp; A*STAR Joint Workshop Part 2 (Nov. 26, 2025)","AIVP, RIKEN-AIP & A*STAR Joint Workshop Part 2 (incl. 6 talks) (Nov. 26, 2025) ＊You can start each talk by clicking the time ...",https://i.ytimg.com/vi/Tiw2mi-AGJ8/default.jpg,120,90,https://i.ytimg.com/vi/Tiw2mi-AGJ8/mqdefault.jpg,320,180,https://i.ytimg.com/vi/Tiw2mi-AGJ8/hqdefault.jpg,480,360,RIKEN AIP,none,2026-02-16T04:20:42Z
1,youtube#searchResult,Z3fHUs707BfyuGb9TCg8DFbYVpA,youtube#video,fXdnBN6cFZ8,2026-02-16T04:17:23Z,UCipPccqvcfychKNOaYUokyQ,"AIVP, RIKEN-AIP &amp; A*STAR Joint Workshop Part 1 (Nov. 26, 2025)","AIVP, RIKEN-AIP & A*STAR Joint Workshop Part 1 (incl. 4 talks) (Nov. 26, 2025) ＊You can start each talk by clicking the time ...",https://i.ytimg.com/vi/fXdnBN6cFZ8/default.jpg,120,90,https://i.ytimg.com/vi/fXdnBN6cFZ8/mqdefault.jpg,320,180,https://i.ytimg.com/vi/fXdnBN6cFZ8/hqdefault.jpg,480,360,RIKEN AIP,none,2026-02-16T04:17:23Z
2,youtube#searchResult,mA4qkfmACp-9hS4a8H2peAumIdc,youtube#video,ty8kUJtp9ks,2026-02-05T00:15:46Z,UCipPccqvcfychKNOaYUokyQ,TrustML Young Scientist Seminar # 102 20251216 Talks by Prof. Javen Qinfeng Shi (Univ. of Adelaide),Event URL: https://c5dc59ed978213830355fc8978.doorkeeper.jp/events/192765 YouTubeチャンネルの登録をお願いします。,https://i.ytimg.com/vi/ty8kUJtp9ks/default.jpg,120,90,https://i.ytimg.com/vi/ty8kUJtp9ks/mqdefault.jpg,320,180,https://i.ytimg.com/vi/ty8kUJtp9ks/hqdefault.jpg,480,360,RIKEN AIP,none,2026-02-05T00:15:46Z
3,youtube#searchResult,c_mOw3CJDm3S7rOo9Om9w1JSimA,youtube#video,QdHjaaEfL24,2026-02-03T06:05:30Z,UCipPccqvcfychKNOaYUokyQ,科学技術と社会チーム活動総括ビデオ(ダイジェストバージョン：約15分)-202512,[理研 AIP 成果報告] 科学技術と社会チーム活動総括ビデオ (ダイジェストバージョン) 時間：約15分 内容： ・「AIと身体と表現」 ...,https://i.ytimg.com/vi/QdHjaaEfL24/default.jpg,120,90,https://i.ytimg.com/vi/QdHjaaEfL24/mqdefault.jpg,320,180,https://i.ytimg.com/vi/QdHjaaEfL24/hqdefault.jpg,480,360,RIKEN AIP,none,2026-02-03T06:05:30Z
4,youtube#searchResult,vsWYgLN-DL_8YI3dgR9gVLi7hPw,youtube#video,OQFEEHJAfI0,2026-02-03T06:03:33Z,UCipPccqvcfychKNOaYUokyQ,科学技術と社会チーム活動総括ビデオ(フルバージョン：約1時間)-202512,[理研 AIP 成果報告] 科学技術と社会チーム活動総括ビデオ (フルバージョン) 時間：約１時間 内容： ・「AIと身体と表現」 ...,https://i.ytimg.com/vi/OQFEEHJAfI0/default.jpg,120,90,https://i.ytimg.com/vi/OQFEEHJAfI0/mqdefault.jpg,320,180,https://i.ytimg.com/vi/OQFEEHJAfI0/hqdefault.jpg,480,360,RIKEN AIP,none,2026-02-03T06:03:33Z
0,youtube#searchResult,w3m4C7WK4vv2EHPO-f4qJbwUk6g,youtube#video,ssPSCs5GVlA,2022-09-13T15:20:32Z,UCY15whY8GyA3DgjZFPdHfAQ,AI Expo 2022 | Panel: Productivity and Performance Boosters for Data Scientists and Developers,"ValleyML AI Expo 2022 Panel Discussion, In-Person Event, Day 1 Topic: Productivity and Performance Boosters for Data ...",https://i.ytimg.com/vi/ssPSCs5GVlA/default.jpg,120,90,https://i.ytimg.com/vi/ssPSCs5GVlA/mqdefault.jpg,320,180,https://i.ytimg.com/vi/ssPSCs5GVlA/hqdefault.jpg,480,360,ValleyML,none,2022-09-13T15:20:32Z
1,youtube#searchResult,WIAvwECd0HzVasLwgoY9EReGUms,youtube#video,xCMgLDx1O9M,2022-09-13T14:02:53Z,UCY15whY8GyA3DgjZFPdHfAQ,AI Expo 2022 | Chris Eliasmith - An Optimal Time Series Processor,"ValleyML AI Expo 2022 Sponsored Session, AI Hardware, Virtual Event Speaker: Chris Eliasmith, Co-CEO, Applied Brain ...",https://i.ytimg.com/vi/xCMgLDx1O9M/default.jpg,120,90,https://i.ytimg.com/vi/xCMgLDx1O9M/mqdefault.jpg,320,180,https://i.ytimg.com/vi/xCMgLDx1O9M/hqdefault.jpg,480,360,ValleyML,none,2022-09-13T14:02:53Z
2,youtube#searchResult,t4dEfTAxHtXSE_IUewggetizfbg,youtube#video,8kYM_Ac78ik,2022-09-13T14:02:58Z,UCY15whY8GyA3DgjZFPdHfAQ,AI Expo 2022 | Mark Oliver - Introduction to the Efinix TinyML Platform,"ValleyML AI Expo 2022 Sponsored Session, AI Hardware, Virtual Event Speaker: Mark Oliver, VP Marketing, Efinix, Inc. Title: ...",https://i.ytimg.com/vi/8kYM_Ac78ik/default.jpg,120,90,https://i.ytimg.com/vi/8kYM_Ac78ik/mqdefault.jpg,320,180,https://i.ytimg.com/vi/8kYM_Ac78ik/hqdefault.jpg,480,360,ValleyML,none,2022-09-13T14:02:58Z
3,youtube#searchResult,KAK6aAoZmZIf0GIb8WCsGwrYhZs,youtube#video,MvR-_fJ0NMQ,2022-09-13T14:03:03Z,UCY15whY8GyA3DgjZFPdHfAQ,AI Expo 2022 | Manasi Vartak - A Reference Architecture for Operational AI,"ValleyML AI Expo 2022 Sponsored Session, AI Operations, Virtual Event Speaker: Manasi Vartak, CEO, Verta Inc Title: A ...",https://i.ytimg.com/vi/MvR-_fJ0NMQ/default.jpg,120,90,https://i.ytimg.com/vi/MvR-_fJ0NMQ/mqdefault.jpg,320,180,https://i.ytimg.com/vi/MvR-_fJ0NMQ/hqdefault.jpg,480,360,ValleyML,none,2022-09-13T14:03:03Z
4,youtube#searchResult,0BHwu5PvolR6TYLZFMTx_qctCJA,youtube#video,6Xmeo99eHVw,2022-09-13T14:03:09Z,UCY15whY8GyA3DgjZFPdHfAQ,AI Expo 2022 | Jan Jongboom - Building confidence in your ML models,"ValleyML AI Expo 2022 Virtual Keynote Speaker: Jan Jongboom, CTO, Edge Impulse Title: Building confidence in your ML ...",https://i.ytimg.com/vi/6Xmeo99eHVw/default.jpg,120,90,https://i.ytimg.com/vi/6Xmeo99eHVw/mqdefault.jpg,320,180,https://i.ytimg.com/vi/6Xmeo99eHVw/hqdefault.jpg,480,360,ValleyML,none,2022-09-13T14:03:09Z
5,youtube#searchResult,J8TY-jfMifwn4aQoOwbuuiSwcYY,youtube#video,bIX9A52Z5_s,2022-09-13T14:03:14Z,UCY15whY8GyA3DgjZFPdHfAQ,AI Expo 2022 | Chris Eliasmith - The Brain: A Lesson in Computing,"ValleyML AI Expo 2022 Virtual Keynote Speaker: Chris Eliasmith, Co-CEO, Applied Brain Research Title: The Brain: A Lesson in ...",https://i.ytimg.com/vi/bIX9A52Z5_s/default.jpg,120,90,https://i.ytimg.com/vi/bIX9A52Z5_s/mqdefault.jpg,320,180,https://i.ytimg.com/vi/bIX9A52Z5_s/hqdefault.jpg,480,360,ValleyML,none,2022-09-13T14:03:14Z
6,youtube#searchResult,n8epA1Qsfz4rv48UkS7h4CCdvmM,youtube#video,SpQBKGYYGcE,2022-09-13T14:02:50Z,UCY15whY8GyA3DgjZFPdHfAQ,"AI Expo 2022 | Eyal Cohen- Introducing CogniFiber Aurora: the Fastest, Most Efficient AI Accelerator","ValleyML AI Expo 2022 Sponsored Session, AI Hardware, Virtual Event Speaker: Eyal Cohen, CEO, CogniFiber Ltd. Title: ...",https://i.ytimg.com/vi/SpQBKGYYGcE/default.jpg,120,90,https://i.ytimg.com/vi/SpQBKGYYGcE/mqdefault.jpg,320,180,https://i.ytimg.com/vi/SpQBKGYYGcE/hqdefault.jpg,480,360,ValleyML,none,2022-09-13T14:02:50Z
7,youtube#searchResult,mutpJzeSYSAcRHxEcnmKgOjpS84,youtube#video,_VdWGWCshJA,2022-09-10T14:44:47Z,UCY15whY8GyA3DgjZFPdHfAQ,AI Expo 2022 | Eyal Cohen - Pure Photonics: Reaching 100 Million tasks per second with 300 Watt,"ValleyML AI Expo 2022 Keynote Talk, In-Person Event, Day 1 Speaker: Eyal Cohen, CEO, CogniFiber Title: Pure Photonics: ...",https://i.ytimg.com/vi/_VdWGWCshJA/default.jpg,120,90,https://i.ytimg.com/vi/_VdWGWCshJA/mqdefault.jpg,320,180,https://i.ytimg.com/vi/_VdWGWCshJA/hqdefault.jpg,480,360,ValleyML,none,2022-09-10T14:44:47Z
8,youtube#searchResult,D-CY1G1Z1iT2juKMQnoNnB-vYyU,youtube#video,62Efr1ymA7Q,2022-09-10T14:42:59Z,UCY15whY8GyA3DgjZFPdHfAQ,AI Expo 2022 | Sammy Cheung - Rapid Machine Learning Deployment with Efinix FPGAs,"ValleyML AI Expo 2022 Keynote Talk, In-Person Event, Day 1 Speaker: Sammy Cheung, CEO, Efinix Title: Rapid Machine ...",https://i.ytimg.com/vi/62Efr1ymA7Q/default.jpg,120,90,https://i.ytimg.com/vi/62Efr1ymA7Q/mqdefault.jpg,320,180,https://i.ytimg.com/vi/62Efr1ymA7Q/hqdefault.jpg,480,360,ValleyML,none,2022-09-10T14:42:59Z
9,youtube#searchResult,14Gb-8bzvzu8ZUYBtvHYTcAFIXI,youtube#video,d6Kg-BehGnY,2022-09-10T14:33:50Z,UCY15whY8GyA3DgjZFPdHfAQ,AI Expo 2022 | Sree Ganesan -  Making Deep Learning More Accessible to Developers,"ValleyML AI Expo 2022 Keynote Talk, In-Person Event, Day 1 Speaker: Sree Ganesan, Head of Software Products, Habana Labs ...",https://i.ytimg.com/vi/d6Kg-BehGnY/default.jpg,120,90,https://i.ytimg.com/vi/d6Kg-BehGnY/mqdefault.jpg,320,180,https://i.ytimg.com/vi/d6Kg-BehGnY/hqdefault.jpg,480,360,ValleyML,none,2022-09-10T14:33:50Z
10,youtube#searchResult,3RIxHrnW5vfJzzZLsCHXP-Jisak,youtube#video,xg2SD4nCy3A,2021-10-21T22:05:06Z,UCY15whY8GyA3DgjZFPdHfAQ,ValleyML AI Expo 2021 - CxO Insights Panel Discussion on Edge AI,"ValleyML AI Expo 2021 Panel, CxO Insights Track Panel Discussion on Edge AI Moderator: Arun Rajasekaran, Consultant, Edge ...",https://i.ytimg.com/vi/xg2SD4nCy3A/default.jpg,120,90,https://i.ytimg.com/vi/xg2SD4nCy3A/mqdefault.jpg,320,180,https://i.ytimg.com/vi/xg2SD4nCy3A/hqdefault.jpg,480,360,ValleyML,none,2021-10-21T22:05:06Z
11,youtube#searchResult,4IbE06anpn0FI3WdB9LhPh0kXg4,youtube#video,-Ygd_1IvpzU,2021-10-21T22:05:11Z,UCY15whY8GyA3DgjZFPdHfAQ,"ValleyML AI Expo 2021 - CxO Insights Presentation by Prasad Saripalli, MINDBODY, Inc.","ValleyML AI Expo 2021 Presentation, CxO Insights Track Title: Wellness is Healthcare Done Right: How AIML and Robotics ...",https://i.ytimg.com/vi/-Ygd_1IvpzU/default.jpg,120,90,https://i.ytimg.com/vi/-Ygd_1IvpzU/mqdefault.jpg,320,180,https://i.ytimg.com/vi/-Ygd_1IvpzU/hqdefault.jpg,480,360,ValleyML,none,2021-10-21T22:05:11Z
12,youtube#searchResult,zteP_FqbG8bgmtJhEwoxepMUKVo,youtube#video,tlJe_iiMwLg,2021-10-21T22:05:15Z,UCY15whY8GyA3DgjZFPdHfAQ,"ValleyML AI Expo 2021 - AI Hardware Presentation by Iakovos Stamoulis, Think Silicon S.A.","ValleyML AI Expo 2021 Presentation, AI Hardware Track Title: NEOX™, Graphics, Compute & AI extensions based on the RISC-V ...",https://i.ytimg.com/vi/tlJe_iiMwLg/default.jpg,120,90,https://i.ytimg.com/vi/tlJe_iiMwLg/mqdefault.jpg,320,180,https://i.ytimg.com/vi/tlJe_iiMwLg/hqdefault.jpg,480,360,ValleyML,none,2021-10-21T22:05:15Z
13,youtube#searchResult,c4ZnzYFEGm1fs4vYU1UlIxEOhwI,youtube#video,UcbMSefCL-U,2021-10-21T22:05:02Z,UCY15whY8GyA3DgjZFPdHfAQ,"ValleyML AI Expo 2021 - AI Optimization Keynote by Jan Jongboom, Edge Impulse","ValleyML AI Expo 2021 Keynote, AI Optimization Track Title: The future is now: ML on ubiquitous devices Speaker: Jan Jongboom ...",https://i.ytimg.com/vi/UcbMSefCL-U/default.jpg,120,90,https://i.ytimg.com/vi/UcbMSefCL-U/mqdefault.jpg,320,180,https://i.ytimg.com/vi/UcbMSefCL-U/hqdefault.jpg,480,360,ValleyML,none,2021-10-21T22:05:02Z
14,youtube#searchResult,9m2SPmKFIyxst-thyO1m15ltbOs,youtube#video,6o34YTyiTHE,2021-10-21T22:04:58Z,UCY15whY8GyA3DgjZFPdHfAQ,"ValleyML AI Expo 2021 - CxO Insights Keynote by Sree Ganesan, Habana Labs","ValleyML AI Expo 2021 Keynote, CxO Insights Track Title: Delivering Deep Learning Training Efficiency with Habana Gaudi® ...",https://i.ytimg.com/vi/6o34YTyiTHE/default.jpg,120,90,https://i.ytimg.com/vi/6o34YTyiTHE/mqdefault.jpg,320,180,https://i.ytimg.com/vi/6o34YTyiTHE/hqdefault.jpg,480,360,ValleyML,none,2021-10-21T22:04:58Z
15,youtube#searchResult,fCHLBDAbI1V3zRwT_p-ibmt3tPw,youtube#video,w1zsVOdRve8,2021-10-21T22:05:19Z,UCY15whY8GyA3DgjZFPdHfAQ,"ValleyML AI Expo 2021 - AI Hardware Presentation by Sammy Cheung and Mark Oliver, Efinix","ValleyML AI Expo 2021 Presentation, AI Hardware Track Title: Re-Defining The Edge With Efinix Quantum Technology Speakers: ...",https://i.ytimg.com/vi/w1zsVOdRve8/default.jpg,120,90,https://i.ytimg.com/vi/w1zsVOdRve8/mqdefault.jpg,320,180,https://i.ytimg.com/vi/w1zsVOdRve8/hqdefault.jpg,480,360,ValleyML,none,2021-10-21T22:05:19Z
16,youtube#searchResult,EM8TPIsKACdQJ6Vrri7SZYzSWTY,youtube#video,ubHB3z3pTck,2021-10-21T22:05:23Z,UCY15whY8GyA3DgjZFPdHfAQ,"ValleyML AI Expo 2021 - AI Hardware Presentation by Hussein Osman, Lattice Semiconductor","ValleyML AI Expo 2021 Presentation, AI Hardware Track Title: Lattice sensAI - A Flexible and Easy to Use Machine Learning ...",https://i.ytimg.com/vi/ubHB3z3pTck/default.jpg,120,90,https://i.ytimg.com/vi/ubHB3z3pTck/mqdefault.jpg,320,180,https://i.ytimg.com/vi/ubHB3z3pTck/hqdefault.jpg,480,360,ValleyML,none,2021-10-21T22:05:23Z
17,youtube#searchResult,-NWdmLl8q-o6qcEOw7WbbIyxD54,youtube#video,GFn2rKwMvQ0,2020-11-22T18:54:50Z,UCY15whY8GyA3DgjZFPdHfAQ,AI Expo 2020 week 9 - Nov 16th - Nov 19th,Highlights of ValleyML.ai's Week 9 of AI Expo 2020 from Nov 16th to Nov 19th. Visit https://www.valleyml.ai/agenda to see the ...,https://i.ytimg.com/vi/GFn2rKwMvQ0/default.jpg,120,90,https://i.ytimg.com/vi/GFn2rKwMvQ0/mqdefault.jpg,320,180,https://i.ytimg.com/vi/GFn2rKwMvQ0/hqdefault.jpg,480,360,ValleyML,none,2020-11-22T18:54:50Z
18,youtube#searchResult,mJMMBklTVTubimbCC5m8s8Xmi-c,youtube#video,yOjZD3EQTmM,2020-11-17T05:26:58Z,UCY15whY8GyA3DgjZFPdHfAQ,AI Expo 2020 week 8 - Nov 9th - Nov 12th,Highlights of ValleyML.ai's Week 8 of AI Expo 2020 from Nov 9th to Nov12th. Visit https://www.valleyml.ai/agenda to see the event ...,https://i.ytimg.com/vi/yOjZD3EQTmM/default.jpg,120,90,https://i.ytimg.com/vi/yOjZD3EQTmM/mqdefault.jpg,320,180,https://i.ytimg.com/vi/yOjZD3EQTmM/hqdefault.jpg,480,360,ValleyML,none,2020-11-17T05:26:58Z
19,youtube#searchResult,IPh8Qk69VMylkTbmw5E9d2hcMVg,youtube#video,k6pwnd-cH9I,2020-11-17T05:20:33Z,UCY15whY8GyA3DgjZFPdHfAQ,AI Expo 2020 week 7 - Nov 2nd - Nov 5th,Highlights of ValleyML.ai's Week 7 of AI Expo 2020 from Nov 2nd to Nov 5th. Visit https://www.valleyml.ai/agenda to see the event ...,https://i.ytimg.com/vi/k6pwnd-cH9I/default.jpg,120,90,https://i.ytimg.com/vi/k6pwnd-cH9I/mqdefault.jpg,320,180,https://i.ytimg.com/vi/k6pwnd-cH9I/hqdefault.jpg,480,360,ValleyML,none,2020-11-17T05:20:33Z
20,youtube#searchResult,JBY3Wiu47HRxGuFx6uN9D-WE1eo,youtube#video,W-AeQm3ADro,2020-11-17T05:16:09Z,UCY15whY8GyA3DgjZFPdHfAQ,AI Expo 2020 week 6 - Oct 26th - Oct 29th,Highlights of ValleyML.ai's Week 6 of AI Expo 2020 from Oct 26th to Oct 29th. Visit https://www.valleyml.ai/agenda to see the event ...,https://i.ytimg.com/vi/W-AeQm3ADro/default.jpg,120,90,https://i.ytimg.com/vi/W-AeQm3ADro/mqdefault.jpg,320,180,https://i.ytimg.com/vi/W-AeQm3ADro/hqdefault.jpg,480,360,ValleyML,none,2020-11-17T05:16:09Z
21,youtube#searchResult,fPNBISxv5ZUVBmmrMFtYUMipYpQ,youtube#video,wpEvfMpoJZs,2020-11-17T05:12:12Z,UCY15whY8GyA3DgjZFPdHfAQ,AI Expo 2020 week 5 - Oct 19th - Oct 22nd,Highlights of ValleyML.ai's Week 5 of AI Expo 2020 from Oct 19th to Oct 22nd. Visit https://www.valleyml.ai/agenda to see the ...,https://i.ytimg.com/vi/wpEvfMpoJZs/default.jpg,120,90,https://i.ytimg.com/vi/wpEvfMpoJZs/mqdefault.jpg,320,180,https://i.ytimg.com/vi/wpEvfMpoJZs/hqdefault.jpg,480,360,ValleyML,none,2020-11-17T05:12:12Z
22,youtube#searchResult,_NHrzVqSLG4EC2cQ4FAGihSy1E8,youtube#video,de_mwoCSMDA,2020-10-16T16:46:38Z,UCY15whY8GyA3DgjZFPdHfAQ,AI Expo 2020 week 4 - Oct 12th - Oct 15th,Highlights of ValleyML.ai's Week 4 of AI Expo 2020 from Oct 12th to Oct 15th. Visit https://www.valleyml.ai/agenda to see the event ...,https://i.ytimg.com/vi/de_mwoCSMDA/default.jpg,120,90,https://i.ytimg.com/vi/de_mwoCSMDA/mqdefault.jpg,320,180,https://i.ytimg.com/vi/de_mwoCSMDA/hqdefault.jpg,480,360,ValleyML,none,2020-10-16T16:46:38Z
23,youtube#searchResult,IkG19LV1lLuS212nBxu1NOLTZUw,youtube#video,6DvansX4SqM,2020-10-12T14:03:26Z,UCY15whY8GyA3DgjZFPdHfAQ,AI Expo 2020 Week 3 - Oct 5th - Oct 8th,Highlights of ValleyML.ai's Week 3 of AI Expo 2020 from Oct 5th to Oct 8th. Visit https://www.valleyml.ai/agenda to see the event ...,https://i.ytimg.com/vi/6DvansX4SqM/default.jpg,120,90,https://i.ytimg.com/vi/6DvansX4SqM/mqdefault.jpg,320,180,https://i.ytimg.com/vi/6DvansX4SqM/hqdefault.jpg,480,360,ValleyML,none,2020-10-12T14:03:26Z
24,youtube#searchResult,LmgfNOxJL0Pb25mMaZ0CXP0DYLc,youtube#video,QbRFh3lUrlo,2020-10-11T18:21:20Z,UCY15whY8GyA3DgjZFPdHfAQ,AI Expo 2020 Week 2 - Sep 28th - Oct 1st,Highlights of ValleyML.ai's Week 2 of AI Expo 2020 from Sep 28th to Oct 1st. Visit https://www.valleyml.ai/agenda to see the event ...,https://i.ytimg.com/vi/QbRFh3lUrlo/default.jpg,120,90,https://i.ytimg.com/vi/QbRFh3lUrlo/mqdefault.jpg,320,180,https://i.ytimg.com/vi/QbRFh3lUrlo/hqdefault.jpg,480,360,ValleyML,none,2020-10-11T18:21:20Z
0,youtube#searchResult,nmnTgpQpbQER-o3Ieyw4JYJCe64,youtube#video,5D2Vdt0QMN0,2021-08-12T21:37:24Z,UCMxUmQFr0_dyW8JTLDiOeNQ,"Proof, Provers, and the Lean Theorem Prover - Summer Special!","In this summer special we'll take a break from messy data, and - just for fun - take refuge in the reassuring consistency and ...",https://i.ytimg.com/vi/5D2Vdt0QMN0/default.jpg,120,90,https://i.ytimg.com/vi/5D2Vdt0QMN0/mqdefault.jpg,320,180,https://i.ytimg.com/vi/5D2Vdt0QMN0/hqdefault.jpg,480,360,Data Science Cornwall,none,2021-08-12T21:37:24Z
