,kind,etag,id.kind,id.videoId,snippet.publishedAt,snippet.channelId,snippet.title,snippet.description,snippet.thumbnails.default.url,snippet.thumbnails.default.width,snippet.thumbnails.default.height,snippet.thumbnails.medium.url,snippet.thumbnails.medium.width,snippet.thumbnails.medium.height,snippet.thumbnails.high.url,snippet.thumbnails.high.width,snippet.thumbnails.high.height,snippet.channelTitle,snippet.liveBroadcastContent,snippet.publishTime
2,youtube#searchResult,WjQ6i1vSVCiWTy0M3k4odE2kQsY,youtube#video,rUDH6ZF2mqU,2026-01-15T16:01:05Z,UCBHcMCGaiJhv-ESTcWGJPcw,Adding a Custom CLI Tool to a Bash Agent | Step-by-Step Tutorial,"Learn how to enable your AI agent to use a brand-new command-line interface (CLI) tool using synthetic data, reinforcement ...",https://i.ytimg.com/vi/rUDH6ZF2mqU/default.jpg,120,90,https://i.ytimg.com/vi/rUDH6ZF2mqU/mqdefault.jpg,320,180,https://i.ytimg.com/vi/rUDH6ZF2mqU/hqdefault.jpg,480,360,NVIDIA Developer,none,2026-01-15T16:01:05Z
3,youtube#searchResult,GrKMiN3hz0LLY92-yx2U-TpMe3w,youtube#video,QFwmF4ogaOQ,2026-01-15T16:01:00Z,UCBHcMCGaiJhv-ESTcWGJPcw,Adding a Custom CLI Tool to a Bash Agent,Ready to take your BASH agent from “handy” to “specialized”? Our newest blog will help you teach your BASH Agent a brand new ...,https://i.ytimg.com/vi/QFwmF4ogaOQ/default.jpg,120,90,https://i.ytimg.com/vi/QFwmF4ogaOQ/mqdefault.jpg,320,180,https://i.ytimg.com/vi/QFwmF4ogaOQ/hqdefault.jpg,480,360,NVIDIA Developer,none,2026-01-15T16:01:00Z
4,youtube#searchResult,-scC9Jh_qVe6mJQX26lF3TdD3sQ,youtube#video,7Rl71SPi4lw,2026-01-15T00:00:18Z,UCBHcMCGaiJhv-ESTcWGJPcw,NVIDIA DGX Spark Lights up CES 2026 Show Floor,"One year after the debut of Project Digits, DGX Spark has transformed from concept to reality and is now available from NVIDIA ...",https://i.ytimg.com/vi/7Rl71SPi4lw/default.jpg,120,90,https://i.ytimg.com/vi/7Rl71SPi4lw/mqdefault.jpg,320,180,https://i.ytimg.com/vi/7Rl71SPi4lw/hqdefault.jpg,480,360,NVIDIA Developer,none,2026-01-15T00:00:18Z
0,youtube#searchResult,j6wriOwjgoe2aIzgem8GBHD7OpA,youtube#video,Q4DQtngEHlA,2025-01-29T19:33:31Z,UCDYdA4hjckRLRVBrCoKenCQ,ClearML Introduction,Get a server: Get started by using our free tier servers: https://app.clear.ml OR by hosting you own: ...,https://i.ytimg.com/vi/Q4DQtngEHlA/default.jpg,120,90,https://i.ytimg.com/vi/Q4DQtngEHlA/mqdefault.jpg,320,180,https://i.ytimg.com/vi/Q4DQtngEHlA/hqdefault.jpg,480,360,ClearML,none,2025-01-29T19:33:31Z
1,youtube#searchResult,LJiUoEUWZqPzOBaL86-SEEoVeiQ,youtube#video,cd4u-UShOFk,2024-07-18T17:25:16Z,UCDYdA4hjckRLRVBrCoKenCQ,Contibuting to ClearML  How to Get Started with Open Source Contributions!,Get a server: Get started by using our free tier servers: https://app.clear.ml OR by hosting you own: ...,https://i.ytimg.com/vi/cd4u-UShOFk/default.jpg,120,90,https://i.ytimg.com/vi/cd4u-UShOFk/mqdefault.jpg,320,180,https://i.ytimg.com/vi/cd4u-UShOFk/hqdefault.jpg,480,360,ClearML,none,2024-07-18T17:25:16Z
2,youtube#searchResult,v5GGedj1dK60O_vQeX_0P5af9b8,youtube#video,U7n9qXIBxEg,2023-12-11T19:23:39Z,UCDYdA4hjckRLRVBrCoKenCQ,ClearML Introduction - Open and Continuous ML/LLMOps (now called our AI Development Center),Get a server: Get started by using our free tier servers: https://app.clear.ml OR by hosting you own: ...,https://i.ytimg.com/vi/U7n9qXIBxEg/default.jpg,120,90,https://i.ytimg.com/vi/U7n9qXIBxEg/mqdefault.jpg,320,180,https://i.ytimg.com/vi/U7n9qXIBxEg/hqdefault.jpg,480,360,ClearML,none,2023-12-11T19:23:39Z
3,youtube#searchResult,gYFnN_hv2qW-hwCdZiRaqA0JyNI,youtube#video,xLx7EXBEt6s,2023-11-01T14:53:45Z,UCDYdA4hjckRLRVBrCoKenCQ,[Webinar Recording] Boost Your AI Development With ClearML + NVIDIA TAO,ClearML + NVIDIA TAO tutorial: https://clear.ml/blog/nvidia-tao-clearml-tutorial NVIDIA TAO Toolkit documentation: ...,https://i.ytimg.com/vi/xLx7EXBEt6s/default.jpg,120,90,https://i.ytimg.com/vi/xLx7EXBEt6s/mqdefault.jpg,320,180,https://i.ytimg.com/vi/xLx7EXBEt6s/hqdefault.jpg,480,360,ClearML,none,2023-11-01T14:53:45Z
4,youtube#searchResult,9rWrfgn0dp3ITM6bFaaQoBfNdhY,youtube#video,7W_T7DhS2Kw,2023-08-29T17:27:28Z,UCDYdA4hjckRLRVBrCoKenCQ,[Webinar Recording] ClearML + Apache DolphinScheduler: A New Approach to MLOps Workflows,We are excited to present ClearML + Apache DolphinScheduler: two powerful tools for implementing an end-to-end MLOps ...,https://i.ytimg.com/vi/7W_T7DhS2Kw/default.jpg,120,90,https://i.ytimg.com/vi/7W_T7DhS2Kw/mqdefault.jpg,320,180,https://i.ytimg.com/vi/7W_T7DhS2Kw/hqdefault.jpg,480,360,ClearML,none,2023-08-29T17:27:28Z
0,youtube#searchResult,QE4mew-cTssv169FNv0owZSKnc4,youtube#video,QW4XsceFxv4,2025-10-17T11:31:36Z,UC4mrlyLbUN2q92W7P0u_Nzg,[115] Analyzing Geospatial Forest Data with Geopandas and Rasterio (Laya Zeinali Yadegari),"Join our Meetup group: https://www.meetup.com/data-umbrella ## About the Event In this session, we will explore how to model ...",https://i.ytimg.com/vi/QW4XsceFxv4/default.jpg,120,90,https://i.ytimg.com/vi/QW4XsceFxv4/mqdefault.jpg,320,180,https://i.ytimg.com/vi/QW4XsceFxv4/hqdefault.jpg,480,360,Data Umbrella,none,2025-10-17T11:31:36Z
1,youtube#searchResult,QpHrYnmeGf0HKiDiBhGlBpekFgQ,youtube#video,jrU0UBr2z3k,2025-08-12T19:37:11Z,UC4mrlyLbUN2q92W7P0u_Nzg,[114] Getting Started with PyMC (Chris Fonnesbeck),Join our Meetup group: https://www.meetup.com/data-umbrella About: This one-hour tutorial introduces new users to version 5 of ...,https://i.ytimg.com/vi/jrU0UBr2z3k/default.jpg,120,90,https://i.ytimg.com/vi/jrU0UBr2z3k/mqdefault.jpg,320,180,https://i.ytimg.com/vi/jrU0UBr2z3k/hqdefault.jpg,480,360,Data Umbrella,none,2025-08-12T19:37:11Z
2,youtube#searchResult,bxZc2MQPwuZoElFELhx1fU6Zw5k,youtube#video,wZmTzfhiu34,2025-07-15T21:14:06Z,UC4mrlyLbUN2q92W7P0u_Nzg,[113] Contributing to the NumPy Documentation (Mukulika Pahari),Join our Meetup group: https://www.meetup.com/data-umbrella Contributing to the NumPy Documentation (Mukulika Pahari) ...,https://i.ytimg.com/vi/wZmTzfhiu34/default.jpg,120,90,https://i.ytimg.com/vi/wZmTzfhiu34/mqdefault.jpg,320,180,https://i.ytimg.com/vi/wZmTzfhiu34/hqdefault.jpg,480,360,Data Umbrella,none,2025-07-15T21:14:06Z
3,youtube#searchResult,g7GAZRzisUpGdU90LgBvufz8_ug,youtube#video,DM7f4nz6uAs,2025-04-25T14:26:21Z,UC4mrlyLbUN2q92W7P0u_Nzg,[112] Exploring a Career in Evaluation &amp; Learning (Liz DiLuzio),Join our Meetup group: https://www.meetup.com/data-umbrella ## Resources - Intro to Evaluation workshop (paid): ...,https://i.ytimg.com/vi/DM7f4nz6uAs/default.jpg,120,90,https://i.ytimg.com/vi/DM7f4nz6uAs/mqdefault.jpg,320,180,https://i.ytimg.com/vi/DM7f4nz6uAs/hqdefault.jpg,480,360,Data Umbrella,none,2025-04-25T14:26:21Z
4,youtube#searchResult,m1KQt3z-PcWXdcs8PUbQi0BSLME,youtube#video,VJetLZdDu_8,2025-04-21T19:47:16Z,UC4mrlyLbUN2q92W7P0u_Nzg,[111] Git Graph Walk Through (Randal Schwartz),Join our Meetup group: https://www.meetup.com/data-umbrella # Intro to Git Graph (Randal Schwartz) ## Key Links - VSC Git ...,https://i.ytimg.com/vi/VJetLZdDu_8/default.jpg,120,90,https://i.ytimg.com/vi/VJetLZdDu_8/mqdefault.jpg,320,180,https://i.ytimg.com/vi/VJetLZdDu_8/hqdefault.jpg,480,360,Data Umbrella,none,2025-04-21T19:47:16Z
0,youtube#searchResult,cEx-SXF8ZrDZidPAB4xzB7Z49fw,youtube#video,2F_VQsmz9HQ,2026-01-13T14:00:00Z,UCTEgowmo98A-VI53vwmkmhg,Let&#39;s Talk Research Episode 5: A Year of Research with Alex Laterre,The latest episode of Let's Talk Research is now live! We're Kicking off 2026 by reflecting on our year of research and what's next ...,https://i.ytimg.com/vi/2F_VQsmz9HQ/default.jpg,120,90,https://i.ytimg.com/vi/2F_VQsmz9HQ/mqdefault.jpg,320,180,https://i.ytimg.com/vi/2F_VQsmz9HQ/hqdefault.jpg,480,360,InstaDeep,none,2026-01-13T14:00:00Z
1,youtube#searchResult,UrsdXDSplyujScdrXfAuae10nqU,youtube#video,WQfOWZ4NlLE,2025-12-11T13:48:55Z,UCTEgowmo98A-VI53vwmkmhg,Let&#39;s Talk Research Episode 4: Machine-learned Density Functional Theory (MLDFT),"In Episode 4 of Let's Talk Research, we take a closer look at some of InstaDeep's complex ongoing work in Machine-Learned ...",https://i.ytimg.com/vi/WQfOWZ4NlLE/default.jpg,120,90,https://i.ytimg.com/vi/WQfOWZ4NlLE/mqdefault.jpg,320,180,https://i.ytimg.com/vi/WQfOWZ4NlLE/hqdefault.jpg,480,360,InstaDeep,none,2025-12-11T13:48:55Z
2,youtube#searchResult,rzYKqa5mb-gCOv6eqcq7OKWPM9w,youtube#video,ZIH1FhvciXA,2025-11-25T14:14:12Z,UCTEgowmo98A-VI53vwmkmhg,"NeurIPS 2025: MEMENTO, Memory-Enhanced Neural Solvers for Routing Problems",We're proud to share that MEMENTO: Memory-Enhanced Neural Solvers for Routing Problems has been accepted as a Spotlight ...,https://i.ytimg.com/vi/ZIH1FhvciXA/default.jpg,120,90,https://i.ytimg.com/vi/ZIH1FhvciXA/mqdefault.jpg,320,180,https://i.ytimg.com/vi/ZIH1FhvciXA/hqdefault.jpg,480,360,InstaDeep,none,2025-11-25T14:14:12Z
3,youtube#searchResult,yCSUw68xm6j-EeUqoyFyTqq5wIE,youtube#video,-BlT85G38rc,2025-11-20T14:07:45Z,UCTEgowmo98A-VI53vwmkmhg,Inference strategies — Why does inference-time search have such a big impact on performance?,"In the lead-up to NeurIPS 2025, we're answering your top questions about our research. Hear from lead author Daniel ...",https://i.ytimg.com/vi/-BlT85G38rc/default.jpg,120,90,https://i.ytimg.com/vi/-BlT85G38rc/mqdefault.jpg,320,180,https://i.ytimg.com/vi/-BlT85G38rc/hqdefault.jpg,480,360,InstaDeep,none,2025-11-20T14:07:45Z
4,youtube#searchResult,R_zM5kLlFULCRiLD8tkLWNGjZkk,youtube#video,6dUZu_rSANA,2025-11-18T14:16:50Z,UCTEgowmo98A-VI53vwmkmhg,NeurIPS 2025: Breaking the performance ceiling in Reinforcement Learning,We're proud to share that our paper Breaking the Performance Ceiling in Reinforcement Learning requires Inference Strategies ...,https://i.ytimg.com/vi/6dUZu_rSANA/default.jpg,120,90,https://i.ytimg.com/vi/6dUZu_rSANA/mqdefault.jpg,320,180,https://i.ytimg.com/vi/6dUZu_rSANA/hqdefault.jpg,480,360,InstaDeep,none,2025-11-18T14:16:50Z
0,youtube#searchResult,pRchbjQSqH_W7m37nWDSvO71uvs,youtube#video,uo6a2wH94LU,2025-11-14T20:08:21Z,UCJ4D3tL-iEWyJJDXJAsd9Mw,R+AI Conference: Szilard Pafka: Gradient Boosting Machines (GBMs) in the Age of LLMs and ChatGPT,"Gradient Boosting Machines (GBMs) in the Age of LLMs and ChatGPT Szilard Pafka, PhD Chief Scientist, Epoch Gradient ...",https://i.ytimg.com/vi/uo6a2wH94LU/default.jpg,120,90,https://i.ytimg.com/vi/uo6a2wH94LU/mqdefault.jpg,320,180,https://i.ytimg.com/vi/uo6a2wH94LU/hqdefault.jpg,480,360,Real Data Science USA (formerly DataScience.LA),none,2025-11-14T20:08:21Z
1,youtube#searchResult,65zXKIFXlahaYRpII8cR8mO9DjY,youtube#video,igflZ8_9hdk,2022-05-26T20:16:29Z,UCJ4D3tL-iEWyJJDXJAsd9Mw,"Real Data Science USA Meetup, May 26, 2022 - Szilard Pafka: Best Algo for Tabular/Business Data?","Best Algorithm for Tabular/Business Data? Sorry, It's Not Deep Learning… Szilard Pafka, PhD Chief Scientist, Epoch With all the ...",https://i.ytimg.com/vi/igflZ8_9hdk/default.jpg,120,90,https://i.ytimg.com/vi/igflZ8_9hdk/mqdefault.jpg,320,180,https://i.ytimg.com/vi/igflZ8_9hdk/hqdefault.jpg,480,360,Real Data Science USA (formerly DataScience.LA),none,2022-05-26T20:16:29Z
2,youtube#searchResult,iS0P7dxLga8gboXYxkBEHmISjCo,youtube#video,8ze-zf_-viE,2021-11-12T15:52:55Z,UCJ4D3tL-iEWyJJDXJAsd9Mw,"Real Data Science USA - R Meetup, Nov 11, 2021 - Gergely Daroczi: A Decade of Using R in Production","A Decade of Using R in Production with Gergely Daroczi, Senior Director of Data Operations at System1 R is often not taken ...",https://i.ytimg.com/vi/8ze-zf_-viE/default.jpg,120,90,https://i.ytimg.com/vi/8ze-zf_-viE/mqdefault.jpg,320,180,https://i.ytimg.com/vi/8ze-zf_-viE/hqdefault.jpg,480,360,Real Data Science USA (formerly DataScience.LA),none,2021-11-12T15:52:55Z
3,youtube#searchResult,Lu02To2jF6KEwa2BFrnTDj4DKZo,youtube#video,sNTlt2SMwkU,2021-06-08T21:44:42Z,UCJ4D3tL-iEWyJJDXJAsd9Mw,"LA Data Science Meetup, June 8, 2021 - Michal Kurka: H2O&#39;s GBM",Overview of H2O GBM implementation by Michal Kurka H2O started its mission to let data scientists train their models on datasets ...,https://i.ytimg.com/vi/sNTlt2SMwkU/default.jpg,120,90,https://i.ytimg.com/vi/sNTlt2SMwkU/mqdefault.jpg,320,180,https://i.ytimg.com/vi/sNTlt2SMwkU/hqdefault.jpg,480,360,Real Data Science USA (formerly DataScience.LA),none,2021-06-08T21:44:42Z
4,youtube#searchResult,V3yHrZOBizpyhvyCsNyUc5rVkk4,youtube#video,2OfTEakSFXQ,2021-05-19T06:10:58Z,UCJ4D3tL-iEWyJJDXJAsd9Mw,"LA R Users - Max Kuhn - Creating model en mass with workflowsets - May 18, 2021",Creating model en mass with workflowsets*** The tidymodels packages allow users to create and optimize models and their ...,https://i.ytimg.com/vi/2OfTEakSFXQ/default.jpg,120,90,https://i.ytimg.com/vi/2OfTEakSFXQ/mqdefault.jpg,320,180,https://i.ytimg.com/vi/2OfTEakSFXQ/hqdefault.jpg,480,360,Real Data Science USA (formerly DataScience.LA),none,2021-05-19T06:10:58Z
0,youtube#searchResult,TLv6HO9V3VhQC15LNu9G_nLVEUg,youtube#video,LI2G4ztuIPs,2023-05-04T13:30:25Z,UCH99twkwBNwN-IBQjoHwdCQ,ChicagoML Building with Large Language Models,"The last six months have seen an explosion of interest in large language models spurred by the releases of ChatGPT, GPT-4, and ...",https://i.ytimg.com/vi/LI2G4ztuIPs/default.jpg,120,90,https://i.ytimg.com/vi/LI2G4ztuIPs/mqdefault.jpg,320,180,https://i.ytimg.com/vi/LI2G4ztuIPs/hqdefault.jpg,480,360,Chicago ML,none,2023-05-04T13:30:25Z
1,youtube#searchResult,uMpcHS5n6hJmQfEII4xQUgaihY0,youtube#video,R9sIRi-jwP8,2023-05-04T13:24:40Z,UCH99twkwBNwN-IBQjoHwdCQ,Chicago ML Lightning Talks,Chicaghost: Predicting Train Time Delays by Will Raphaelson - Leveraging LLM Hallucination with Marvin by Nate Nowack - Free ...,https://i.ytimg.com/vi/R9sIRi-jwP8/default.jpg,120,90,https://i.ytimg.com/vi/R9sIRi-jwP8/mqdefault.jpg,320,180,https://i.ytimg.com/vi/R9sIRi-jwP8/hqdefault.jpg,480,360,Chicago ML,none,2023-05-04T13:24:40Z
2,youtube#searchResult,RRie0Rvn4K1IAVKLXTR4wjYQsjA,youtube#video,7uOWoO5vVNs,2022-11-02T04:57:01Z,UCH99twkwBNwN-IBQjoHwdCQ,"Chicago ML - November 1, 2022 - The Transformation of ML with Transformers",,https://i.ytimg.com/vi/7uOWoO5vVNs/default.jpg,120,90,https://i.ytimg.com/vi/7uOWoO5vVNs/mqdefault.jpg,320,180,https://i.ytimg.com/vi/7uOWoO5vVNs/hqdefault.jpg,480,360,Chicago ML,none,2022-11-02T04:57:01Z
3,youtube#searchResult,kcDVAXw7soGP8A10YU6glUUdhek,youtube#video,90oNojNV75o,2022-11-02T04:51:16Z,UCH99twkwBNwN-IBQjoHwdCQ,"Chicago ML - November 1, 2022 - The Path to End to End Spoken Language Redaction",,https://i.ytimg.com/vi/90oNojNV75o/default.jpg,120,90,https://i.ytimg.com/vi/90oNojNV75o/mqdefault.jpg,320,180,https://i.ytimg.com/vi/90oNojNV75o/hqdefault.jpg,480,360,Chicago ML,none,2022-11-02T04:51:16Z
4,youtube#searchResult,46sAyW6CYSBGp69_CJChEc0H-50,youtube#video,6dpyTMhw-9s,2021-02-16T14:58:38Z,UCH99twkwBNwN-IBQjoHwdCQ,"Chicago ML - February 15, 2021 - Automated Exploration of Bioinformatic Models",,https://i.ytimg.com/vi/6dpyTMhw-9s/default.jpg,120,90,https://i.ytimg.com/vi/6dpyTMhw-9s/mqdefault.jpg,320,180,https://i.ytimg.com/vi/6dpyTMhw-9s/hqdefault.jpg,480,360,Chicago ML,none,2021-02-16T14:58:38Z
0,youtube#searchResult,dwHkc0gvUj60Ho5PBdk15xVM9Ts,youtube#video,l1sCtg4WYxo,2023-02-20T05:00:20Z,UCa3zFn8tzw6GaBKZUzifM9A,Lecture 5: Ethics and Transparency by Emily Denton (Day 5),"Emily Denton gives an overview of algorithmic harms, thoughtful dataset development, and discusses efforts in the AI community ...",https://i.ytimg.com/vi/l1sCtg4WYxo/default.jpg,120,90,https://i.ytimg.com/vi/l1sCtg4WYxo/mqdefault.jpg,320,180,https://i.ytimg.com/vi/l1sCtg4WYxo/hqdefault.jpg,480,360,NYU AI School,none,2023-02-20T05:00:20Z
1,youtube#searchResult,VnEJ0MMvty5VcgK-2fVRhFEqbWU,youtube#video,N5RAqvDTlao,2023-02-20T05:00:06Z,UCa3zFn8tzw6GaBKZUzifM9A,Panel: Bumpy Road to AI Research,A no-holds-barred panel discussion on challenges and realities of artificial intelligence research. Panelists: Sam Bowman ...,https://i.ytimg.com/vi/N5RAqvDTlao/default.jpg,120,90,https://i.ytimg.com/vi/N5RAqvDTlao/mqdefault.jpg,320,180,https://i.ytimg.com/vi/N5RAqvDTlao/hqdefault.jpg,480,360,NYU AI School,none,2023-02-20T05:00:06Z
2,youtube#searchResult,pyHFYrdCfWXpndDzSjTjUWpnNkM,youtube#video,Tlcfgl_kAkI,2023-02-20T05:00:19Z,UCa3zFn8tzw6GaBKZUzifM9A,Lecture 4: Deep Learning Part 2: Natural Language Processing by Sabrina Mielke (Day 4),Sabrina Mielke teaches us about deep neural networks as used in natural language applications. Lecture includes text ...,https://i.ytimg.com/vi/Tlcfgl_kAkI/default.jpg,120,90,https://i.ytimg.com/vi/Tlcfgl_kAkI/mqdefault.jpg,320,180,https://i.ytimg.com/vi/Tlcfgl_kAkI/hqdefault.jpg,480,360,NYU AI School,none,2023-02-20T05:00:19Z
3,youtube#searchResult,j9atRSwk37sj5bVjQb7dLLsZM_0,youtube#video,cptbXhIsdRQ,2023-02-20T05:00:17Z,UCa3zFn8tzw6GaBKZUzifM9A,Panel: Building a Career in AI,"Discussion on how to get into machine learning as a budding undergraduate, including non-STEM majors. Panelists: Tai-Danae ...",https://i.ytimg.com/vi/cptbXhIsdRQ/default.jpg,120,90,https://i.ytimg.com/vi/cptbXhIsdRQ/mqdefault.jpg,320,180,https://i.ytimg.com/vi/cptbXhIsdRQ/hqdefault.jpg,480,360,NYU AI School,none,2023-02-20T05:00:17Z
4,youtube#searchResult,sEiyPRj2i433b1on7JQObfmI6as,youtube#video,44LhKrwY7FQ,2023-02-20T05:00:01Z,UCa3zFn8tzw6GaBKZUzifM9A,Lecture 3: Deep Learning Part 1: Computer Vision by Elena Sizikova (Day 3),Elena Sizikova teaches us the basics of deep neural networks as used in computer vision applications. Lecture includes an ...,https://i.ytimg.com/vi/44LhKrwY7FQ/default.jpg,120,90,https://i.ytimg.com/vi/44LhKrwY7FQ/mqdefault.jpg,320,180,https://i.ytimg.com/vi/44LhKrwY7FQ/hqdefault.jpg,480,360,NYU AI School,none,2023-02-20T05:00:01Z
0,youtube#searchResult,WBpl_DAPDFx6WrrJkA4MV_kigi0,youtube#video,qEeqlLmZZ9U,2025-07-31T15:31:47Z,UCYuxbq0trkgoaoN72eJi8dA,Join us for the DATA festival online in October 2025!,wAIt no more! Sign up for free and save your spot now: https://barc.com/events/data-festival... DATA festival online is where theory ...,https://i.ytimg.com/vi/qEeqlLmZZ9U/default.jpg,120,90,https://i.ytimg.com/vi/qEeqlLmZZ9U/mqdefault.jpg,320,180,https://i.ytimg.com/vi/qEeqlLmZZ9U/hqdefault.jpg,480,360,DATA festival,none,2025-07-31T15:31:47Z
1,youtube#searchResult,t8HsstYXZ7DtIyipdaMjDUcLPC8,youtube#video,5Od4SeaiuHU,2025-07-24T13:28:36Z,UCYuxbq0trkgoaoN72eJi8dA,Centralized vs. Decentralized Data? Hybrid Wins. #datagovernance #shorts #datafestival #ai,Speaker: Thorsten Kranz | Head of AI Solutions at DHL Interested in what is happening at the forefront of AI? Join our DATA ...,https://i.ytimg.com/vi/5Od4SeaiuHU/default.jpg,120,90,https://i.ytimg.com/vi/5Od4SeaiuHU/mqdefault.jpg,320,180,https://i.ytimg.com/vi/5Od4SeaiuHU/hqdefault.jpg,480,360,DATA festival,none,2025-07-24T13:28:36Z
2,youtube#searchResult,wSZwXYM94ziV5MDPbV17uASCpss,youtube#video,hiunJBn2iNc,2025-07-24T13:24:13Z,UCYuxbq0trkgoaoN72eJi8dA,How AI Is Changing Data Job Roles! 💼🤖 #shorts #AI #DataFestival,Speaker: Barbara Engerer | Head of Data & AI - Senior Vice President Global Digital Services @ BSH Home Appliances Group ...,https://i.ytimg.com/vi/hiunJBn2iNc/default.jpg,120,90,https://i.ytimg.com/vi/hiunJBn2iNc/mqdefault.jpg,320,180,https://i.ytimg.com/vi/hiunJBn2iNc/hqdefault.jpg,480,360,DATA festival,none,2025-07-24T13:24:13Z
3,youtube#searchResult,uKZZzyNz16IU54VvWoChh2xY8UE,youtube#video,9BWxZ2z2PXQ,2025-07-24T13:16:28Z,UCYuxbq0trkgoaoN72eJi8dA,What Agentic AI Really Means 🤖 #shorts #AIAgents #DataFestival,"Speaker: Douglas Laney | Data, Analytics & AI Strategy Advisor | BARC Research & Advisory Fellow Interested in what is ...",https://i.ytimg.com/vi/9BWxZ2z2PXQ/default.jpg,120,90,https://i.ytimg.com/vi/9BWxZ2z2PXQ/mqdefault.jpg,320,180,https://i.ytimg.com/vi/9BWxZ2z2PXQ/hqdefault.jpg,480,360,DATA festival,none,2025-07-24T13:16:28Z
4,youtube#searchResult,EAr4MeMKZTkD4bHOPzne4w65tfA,youtube#video,-J3GfCCKkjY,2025-07-24T13:14:37Z,UCYuxbq0trkgoaoN72eJi8dA,AI Investment in 2025: Where Do Companies Stand? 🤖📈 #shorts #AI #DataFestival,"Speaker: Douglas Laney | Data, Analytics & AI Strategy Advisor | BARC Research & Advisory Fellow Interested in what is ...",https://i.ytimg.com/vi/-J3GfCCKkjY/default.jpg,120,90,https://i.ytimg.com/vi/-J3GfCCKkjY/mqdefault.jpg,320,180,https://i.ytimg.com/vi/-J3GfCCKkjY/hqdefault.jpg,480,360,DATA festival,none,2025-07-24T13:14:37Z
0,youtube#searchResult,eA_H0oSjx-BQ4MkTnDx7b8-8MKs,youtube#video,KdUrfY1yM0w,2024-06-05T21:00:19Z,UCKPyg5gsnt6h0aA8EBw3i6A,"Classification Metrics Explained | Sensitivity, Precision, AUROC, &amp; More",Subscribe to RichardOnData here: https://www.youtube.com/channel/UCKPyg5gsnt6h0aA8EBw3i6A?sub_confirmation=1 In this ...,https://i.ytimg.com/vi/KdUrfY1yM0w/default.jpg,120,90,https://i.ytimg.com/vi/KdUrfY1yM0w/mqdefault.jpg,320,180,https://i.ytimg.com/vi/KdUrfY1yM0w/hqdefault.jpg,480,360,RichardOnData,none,2024-06-05T21:00:19Z
1,youtube#searchResult,7mnLjBQDLydYJVL-QA10ARZB8nk,youtube#video,Vfnv1_bBqNg,2024-05-29T18:00:17Z,UCKPyg5gsnt6h0aA8EBw3i6A,SHAP Values: An Overview,Subscribe to RichardOnData here: https://www.youtube.com/channel/UCKPyg5gsnt6h0aA8EBw3i6A?sub_confirmation=1 In this ...,https://i.ytimg.com/vi/Vfnv1_bBqNg/default.jpg,120,90,https://i.ytimg.com/vi/Vfnv1_bBqNg/mqdefault.jpg,320,180,https://i.ytimg.com/vi/Vfnv1_bBqNg/hqdefault.jpg,480,360,RichardOnData,none,2024-05-29T18:00:17Z
2,youtube#searchResult,dnT0Yb6nuFFOg5oHvLtDp1jj2zw,youtube#video,nsHHcBoRTrI,2024-05-15T16:00:42Z,UCKPyg5gsnt6h0aA8EBw3i6A,Is ChatGPT-4 Worth It?,Subscribe to RichardOnData here: https://www.youtube.com/channel/UCKPyg5gsnt6h0aA8EBw3i6A?sub_confirmation=1 NOTE: ...,https://i.ytimg.com/vi/nsHHcBoRTrI/default.jpg,120,90,https://i.ytimg.com/vi/nsHHcBoRTrI/mqdefault.jpg,320,180,https://i.ytimg.com/vi/nsHHcBoRTrI/hqdefault.jpg,480,360,RichardOnData,none,2024-05-15T16:00:42Z
3,youtube#searchResult,hkYgHVLJ1_HMsvp24o_Ued1wcY8,youtube#video,Shl1XsvnbHg,2024-03-18T15:30:09Z,UCKPyg5gsnt6h0aA8EBw3i6A,Follow THESE 5 Tips to Get a Data Job,Subscribe to RichardOnData here: https://www.youtube.com/channel/UCKPyg5gsnt6h0aA8EBw3i6A?sub_confirmation=1 In this ...,https://i.ytimg.com/vi/Shl1XsvnbHg/default.jpg,120,90,https://i.ytimg.com/vi/Shl1XsvnbHg/mqdefault.jpg,320,180,https://i.ytimg.com/vi/Shl1XsvnbHg/hqdefault.jpg,480,360,RichardOnData,none,2024-03-18T15:30:09Z
4,youtube#searchResult,NrbbDLWz6o7oqFGUSr4URVRjvrM,youtube#video,EW3FkQMTdKM,2024-03-10T17:00:09Z,UCKPyg5gsnt6h0aA8EBw3i6A,Learn (and Do) Data Science FAST with ChatGPT,Subscribe to RichardOnData here: https://www.youtube.com/channel/UCKPyg5gsnt6h0aA8EBw3i6A?sub_confirmation=1 In this ...,https://i.ytimg.com/vi/EW3FkQMTdKM/default.jpg,120,90,https://i.ytimg.com/vi/EW3FkQMTdKM/mqdefault.jpg,320,180,https://i.ytimg.com/vi/EW3FkQMTdKM/hqdefault.jpg,480,360,RichardOnData,none,2024-03-10T17:00:09Z
0,youtube#searchResult,WH1eToogjTMvoR_de9KV6ZHKaUI,youtube#video,MYKYksteNMM,2023-05-03T22:25:36Z,UCvwDejnW-Q49xEb667JqS-g,Mar 2023 - Supercharge your Python Dev Environment with VS Code &amp; XGBoost Wage Prediction Model,"Philly Python Users' Group + DataPhilly collaboration in-person event on Wharton's campus (Philadelphia, PA) on Mar 30, 2023.",https://i.ytimg.com/vi/MYKYksteNMM/default.jpg,120,90,https://i.ytimg.com/vi/MYKYksteNMM/mqdefault.jpg,320,180,https://i.ytimg.com/vi/MYKYksteNMM/hqdefault.jpg,480,360,DataPhilly,none,2023-05-03T22:25:36Z
1,youtube#searchResult,m1yYi_Z9H3HPEiEqfj5Sh3VSk6E,youtube#video,8y1p6uBHWVs,2022-10-17T00:51:38Z,UCvwDejnW-Q49xEb667JqS-g,Aug 2022  - Lighting Talks - Using Data Science in the Real World,This is a video of the second half of the event only. Lighting Talk #2 Abstract: The last two Canadian federal elections have ...,https://i.ytimg.com/vi/8y1p6uBHWVs/default.jpg,120,90,https://i.ytimg.com/vi/8y1p6uBHWVs/mqdefault.jpg,320,180,https://i.ytimg.com/vi/8y1p6uBHWVs/hqdefault.jpg,480,360,DataPhilly,none,2022-10-17T00:51:38Z
2,youtube#searchResult,8n_ev8-m0jdL-jQgKHHoHAICVp8,youtube#video,UixN0WmRaEg,2022-06-09T20:58:47Z,UCvwDejnW-Q49xEb667JqS-g,May 2022 - Linux Deep Dive for Data Science,"Speaker Session 1: In the world of data, there are a wide variety of tools for processing, managing, and analyzing data.",https://i.ytimg.com/vi/UixN0WmRaEg/default.jpg,120,90,https://i.ytimg.com/vi/UixN0WmRaEg/mqdefault.jpg,320,180,https://i.ytimg.com/vi/UixN0WmRaEg/hqdefault.jpg,480,360,DataPhilly,none,2022-06-09T20:58:47Z
3,youtube#searchResult,N_GEs4H2wVpse-zVuxUd3pniREM,youtube#video,dSslgMZEhas,2022-04-25T22:03:00Z,UCvwDejnW-Q49xEb667JqS-g,April 2022 - Live LinkedIn Profile Reviews &amp; Job Search Strategies,"DataPhilly Speaker Event - Apr 21, 2022 Topic: Live LinkedIn Profile Reviews & Job Search Strategies Speaker: Lynne Williams Is ...",https://i.ytimg.com/vi/dSslgMZEhas/default.jpg,120,90,https://i.ytimg.com/vi/dSslgMZEhas/mqdefault.jpg,320,180,https://i.ytimg.com/vi/dSslgMZEhas/hqdefault.jpg,480,360,DataPhilly,none,2022-04-25T22:03:00Z
4,youtube#searchResult,XGZXiI5_0l6SSyAZVhOHDZ8babg,youtube#video,D3vbH9klbTk,2022-01-03T02:59:02Z,UCvwDejnW-Q49xEb667JqS-g,Introducing Unstructured Data into your Models,"DataPhilly Speaker Event - Dec 16, 2021 Topic: Introducing Unstructured Data into your Models - Extracting predictive info/signals ...",https://i.ytimg.com/vi/D3vbH9klbTk/default.jpg,120,90,https://i.ytimg.com/vi/D3vbH9klbTk/mqdefault.jpg,320,180,https://i.ytimg.com/vi/D3vbH9klbTk/hqdefault.jpg,480,360,DataPhilly,none,2022-01-03T02:59:02Z
0,youtube#searchResult,RvlECkGM7aF-fMGOcJ4UvwsgH6Q,youtube#video,2WQ5K_DyBgI,2026-01-07T06:56:21Z,UCipPccqvcfychKNOaYUokyQ,大学 学部生対象：『AI×未来×キャリア』研究者と語る対話型ワークショップ-20251119,『AI×未来×キャリア』研究者と語る対話型ワークショップ 日時：2025年11月19日 (水) ＊下記(左)の時間(時・分・秒)をクリック ...,https://i.ytimg.com/vi/2WQ5K_DyBgI/default.jpg,120,90,https://i.ytimg.com/vi/2WQ5K_DyBgI/mqdefault.jpg,320,180,https://i.ytimg.com/vi/2WQ5K_DyBgI/hqdefault.jpg,480,360,RIKEN AIP,none,2026-01-07T06:56:21Z
