,kind,etag,id.kind,id.videoId,snippet.publishedAt,snippet.channelId,snippet.title,snippet.description,snippet.thumbnails.default.url,snippet.thumbnails.default.width,snippet.thumbnails.default.height,snippet.thumbnails.medium.url,snippet.thumbnails.medium.width,snippet.thumbnails.medium.height,snippet.thumbnails.high.url,snippet.thumbnails.high.width,snippet.thumbnails.high.height,snippet.channelTitle,snippet.liveBroadcastContent,snippet.publishTime
4,youtube#searchResult,EWUommtLgSzCVpV_3fHRaZs828Y,youtube#video,VEoSYvmC-PE,2022-04-16T17:46:00Z,UCHGAwygtFWAonSYfjeUv0iA,ML applications in Customer Interactions,"Sravanthi Dhanekula, Engineering Lead at Google. This talk is organized in association with VIT Bhopal University. Special ...",https://i.ytimg.com/vi/VEoSYvmC-PE/default.jpg,120,90,https://i.ytimg.com/vi/VEoSYvmC-PE/mqdefault.jpg,320,180,https://i.ytimg.com/vi/VEoSYvmC-PE/hqdefault.jpg,480,360,Data Science Talks,none,2022-04-16T17:46:00Z
0,youtube#searchResult,vbb2Sw3XiB7X5APmEpgtM6rANZU,youtube#video,3MYAkMMlDU0,2020-05-04T08:00:02Z,UCJ70w0WzWjWerpk3utRcAKA,Object-oriented programming in Python - Part 6 - Polymorphism,"Welcome to a new series of videos on the Python programming language. This time I want to tackle OOP, Object-oriented ...",https://i.ytimg.com/vi/3MYAkMMlDU0/default.jpg,120,90,https://i.ytimg.com/vi/3MYAkMMlDU0/mqdefault.jpg,320,180,https://i.ytimg.com/vi/3MYAkMMlDU0/hqdefault.jpg,480,360,The Digital Cat,none,2020-05-04T08:00:02Z
1,youtube#searchResult,Ooy_Cy5Vvh5Dw0Gkg6-z76Ra9FM,youtube#video,FLwxJrwYHbo,2020-04-13T08:46:56Z,UCJ70w0WzWjWerpk3utRcAKA,Object-oriented programming in Python - Part 5 - Delegation: inheritance and composition,"Welcome to a new series of videos on the Python programming language. This time I want to tackle OOP, Object-oriented ...",https://i.ytimg.com/vi/FLwxJrwYHbo/default.jpg,120,90,https://i.ytimg.com/vi/FLwxJrwYHbo/mqdefault.jpg,320,180,https://i.ytimg.com/vi/FLwxJrwYHbo/hqdefault.jpg,480,360,The Digital Cat,none,2020-04-13T08:46:56Z
2,youtube#searchResult,LHYFQqHg0Oi9WodU1KYN5JFVRDI,youtube#video,6ZPXR0Gj0GU,2019-12-09T19:00:00Z,UCJ70w0WzWjWerpk3utRcAKA,Object-oriented programming in Python - Part 4 - Classes and instances,"Welcome to a new series of videos on the Python programming language. This time I want to tackle OOP, Object-oriented ...",https://i.ytimg.com/vi/6ZPXR0Gj0GU/default.jpg,120,90,https://i.ytimg.com/vi/6ZPXR0Gj0GU/mqdefault.jpg,320,180,https://i.ytimg.com/vi/6ZPXR0Gj0GU/hqdefault.jpg,480,360,The Digital Cat,none,2019-12-09T19:00:00Z
3,youtube#searchResult,R40_FlLFDczAwIEn7728tjEj2pQ,youtube#video,_b18YfmEvTg,2019-12-02T19:00:06Z,UCJ70w0WzWjWerpk3utRcAKA,Object-oriented programming in Python - Part 3 - How to create a class,"Welcome to a new series of videos on the Python programming language. This time I want to tackle OOP, Object-oriented ...",https://i.ytimg.com/vi/_b18YfmEvTg/default.jpg,120,90,https://i.ytimg.com/vi/_b18YfmEvTg/mqdefault.jpg,320,180,https://i.ytimg.com/vi/_b18YfmEvTg/hqdefault.jpg,480,360,The Digital Cat,none,2019-12-02T19:00:06Z
4,youtube#searchResult,LZIPQhLnHQdhImYFJsIr_JVFs2g,youtube#video,-O7OHmrQMfc,2019-11-25T19:00:01Z,UCJ70w0WzWjWerpk3utRcAKA,Object-oriented programming in Python - Part 2 - Types and classes in Python,"Welcome to a new series of videos on the Python programming language. This time I want to tackle OOP, Object-oriented ...",https://i.ytimg.com/vi/-O7OHmrQMfc/default.jpg,120,90,https://i.ytimg.com/vi/-O7OHmrQMfc/mqdefault.jpg,320,180,https://i.ytimg.com/vi/-O7OHmrQMfc/hqdefault.jpg,480,360,The Digital Cat,none,2019-11-25T19:00:01Z
0,youtube#searchResult,atFMkc7aarN8cCqH5rskou9JGzo,youtube#video,g5QWmWn3KGY,2021-04-26T02:43:57Z,UCGYPQz_qySbPESTK8k2ky5g,Announcing the 8 Week SQL Challenge - Start Your Data Science Journey,I'm super excited to announce the official launch of the #8WeekSQLChallenge - join me for a 1 hour SQL focused Q&A session to ...,https://i.ytimg.com/vi/g5QWmWn3KGY/default.jpg,120,90,https://i.ytimg.com/vi/g5QWmWn3KGY/mqdefault.jpg,320,180,https://i.ytimg.com/vi/g5QWmWn3KGY/hqdefault.jpg,480,360,Danny Ma,none,2021-04-26T02:43:57Z
1,youtube#searchResult,A-cX-abY9DA9FwmG42KULrMlKyA,youtube#video,OO4W4SnIHhM,2021-03-30T13:48:54Z,UCGYPQz_qySbPESTK8k2ky5g,Machine Learning From Beginning To Advanced,A quick breakdown of different machine learning skills required for data science from beginner to advanced. This video is a ...,https://i.ytimg.com/vi/OO4W4SnIHhM/default.jpg,120,90,https://i.ytimg.com/vi/OO4W4SnIHhM/mqdefault.jpg,320,180,https://i.ytimg.com/vi/OO4W4SnIHhM/hqdefault.jpg,480,360,Danny Ma,none,2021-03-30T13:48:54Z
2,youtube#searchResult,AaKxtpqtMPUTcb_PhLWaBVaq7SM,youtube#video,GnkIX10cLao,2021-03-23T13:11:30Z,UCGYPQz_qySbPESTK8k2ky5g,The 3 Types of Data Scientists,"A is for Analyst, B is for Builder and C is for Consultant - a Unicorn Data Scientist is someone who can do all 3 at an extreme level ...",https://i.ytimg.com/vi/GnkIX10cLao/default.jpg,120,90,https://i.ytimg.com/vi/GnkIX10cLao/mqdefault.jpg,320,180,https://i.ytimg.com/vi/GnkIX10cLao/hqdefault.jpg,480,360,Danny Ma,none,2021-03-23T13:11:30Z
3,youtube#searchResult,JbEtTo11qVaFXuflcBYKYwtTnQk,youtube#video,ksciAXvvck0,2021-03-18T09:45:11Z,UCGYPQz_qySbPESTK8k2ky5g,How to Break Into Data Science in 2021,Are you interested in breaking into Data Science but don't know where to start? Don't worry that flying brain in the thumbnail has ...,https://i.ytimg.com/vi/ksciAXvvck0/default.jpg,120,90,https://i.ytimg.com/vi/ksciAXvvck0/mqdefault.jpg,320,180,https://i.ytimg.com/vi/ksciAXvvck0/hqdefault.jpg,480,360,Danny Ma,none,2021-03-18T09:45:11Z
4,youtube#searchResult,MNl1opTkILleVRKx4wNhS59bX4Q,youtube#video,sdrY7pA-f2I,2021-03-12T16:07:02Z,UCGYPQz_qySbPESTK8k2ky5g,Ask Danny - Live Data Science Q&amp;A,"Join me at 2PM AEDT Friday 12th March for Q&A about data science, machine learning, career advice or anything else you'd like ...",https://i.ytimg.com/vi/sdrY7pA-f2I/default.jpg,120,90,https://i.ytimg.com/vi/sdrY7pA-f2I/mqdefault.jpg,320,180,https://i.ytimg.com/vi/sdrY7pA-f2I/hqdefault.jpg,480,360,Danny Ma,none,2021-03-12T16:07:02Z
0,youtube#searchResult,0rQX4PHqIrCC5XJuOw15i1W7cq8,youtube#video,UlNt1rInC3I,2020-07-03T12:17:07Z,UCmWRF1AxelqS9hlbgI-SRWw,alb datastream1003 1080p 24fps,,https://i.ytimg.com/vi/UlNt1rInC3I/default.jpg,120,90,https://i.ytimg.com/vi/UlNt1rInC3I/mqdefault.jpg,320,180,https://i.ytimg.com/vi/UlNt1rInC3I/hqdefault.jpg,480,360,Brandon Rohrer,none,2020-07-03T12:17:07Z
0,youtube#searchResult,WnOsaFainlUP-ciCAoos5hvGWHY,youtube#video,jkrNMKz9pWU,2023-09-24T07:09:20Z,UCX7Y2qWriXpqocG97SFW2OQ,A Hackers&#39; Guide to Language Models,"In this deeply informative video, Jeremy Howard, co-founder of fast.ai and creator of the ULMFiT approach on which all modern ...",https://i.ytimg.com/vi/jkrNMKz9pWU/default.jpg,120,90,https://i.ytimg.com/vi/jkrNMKz9pWU/mqdefault.jpg,320,180,https://i.ytimg.com/vi/jkrNMKz9pWU/hqdefault.jpg,480,360,Jeremy Howard,none,2023-09-24T07:09:20Z
1,youtube#searchResult,6R9SY7wyzj1HM8ev6IZDRrdwTQE,youtube#video,AbBZEULuCwc,2023-07-22T23:31:47Z,UCX7Y2qWriXpqocG97SFW2OQ,Jeremy Howard on ABC Weekend Breakfast,Jeremy discusses the latest agreement between the US White House and US AI companies.,https://i.ytimg.com/vi/AbBZEULuCwc/default.jpg,120,90,https://i.ytimg.com/vi/AbBZEULuCwc/mqdefault.jpg,320,180,https://i.ytimg.com/vi/AbBZEULuCwc/hqdefault.jpg,480,360,Jeremy Howard,none,2023-07-22T23:31:47Z
2,youtube#searchResult,4dFJyp9JtzdGc7J1MPDPXn3czr0,youtube#video,GxcLDDJVBBg,2023-05-26T22:13:53Z,UCX7Y2qWriXpqocG97SFW2OQ,Jeremy Howard and Joshua Browder discuss AI &amp; Jobs with Piers Morgan,Full show link: https://www.youtube.com/live/gyhnHG5N2wE.,https://i.ytimg.com/vi/GxcLDDJVBBg/default.jpg,120,90,https://i.ytimg.com/vi/GxcLDDJVBBg/mqdefault.jpg,320,180,https://i.ytimg.com/vi/GxcLDDJVBBg/hqdefault.jpg,480,360,Jeremy Howard,none,2023-05-26T22:13:53Z
3,youtube#searchResult,fDPoXn5MzU8aZHQOlnneeVt3RaM,youtube#video,6GvB5lZJqcE,2023-05-03T06:32:09Z,UCX7Y2qWriXpqocG97SFW2OQ,Jeremy Howard demo for Mojo launch,"This is a section from the Modular launch video. The full video, docs, and details are here: https://www.modular.com/",https://i.ytimg.com/vi/6GvB5lZJqcE/default.jpg,120,90,https://i.ytimg.com/vi/6GvB5lZJqcE/mqdefault.jpg,320,180,https://i.ytimg.com/vi/6GvB5lZJqcE/hqdefault.jpg,480,360,Jeremy Howard,none,2023-05-03T06:32:09Z
4,youtube#searchResult,8Me8oE2vMjJTb4P7BWvAAp9pSIs,youtube#video,vGdB4eI4KBs,2023-04-04T22:36:57Z,UCX7Y2qWriXpqocG97SFW2OQ,Lesson 13: Deep Learning Foundations to Stable Diffusion,"All lesson resources are available at http://course.fast.ai.) In this lesson, we dive into backpropagation and the creation of a simple ...",https://i.ytimg.com/vi/vGdB4eI4KBs/default.jpg,120,90,https://i.ytimg.com/vi/vGdB4eI4KBs/mqdefault.jpg,320,180,https://i.ytimg.com/vi/vGdB4eI4KBs/hqdefault.jpg,480,360,Jeremy Howard,none,2023-04-04T22:36:57Z
0,youtube#searchResult,KSSW8Sa0vI8ndnFwNTO7z2CvolU,youtube#video,n0ZX_ZfWPGg,2024-06-03T13:31:45Z,UC7kFLyCRK3gQmiSBaFRzgnA,Graph Neural Networks | Scientific Machine Learning for Science and Engineering | Vinay Sharma,The Applied Machine Learning Days channel features talks and performances from the Applied Machine Learning Days. AMLD is ...,https://i.ytimg.com/vi/n0ZX_ZfWPGg/default.jpg,120,90,https://i.ytimg.com/vi/n0ZX_ZfWPGg/mqdefault.jpg,320,180,https://i.ytimg.com/vi/n0ZX_ZfWPGg/hqdefault.jpg,480,360,Applied Machine Learning Days,none,2024-06-03T13:31:45Z
1,youtube#searchResult,PEwSK3Jv0V0JHSMBP_iVs73ohmk,youtube#video,MKsyOvM5Ti0,2024-05-15T12:32:34Z,UC7kFLyCRK3gQmiSBaFRzgnA,Innovative Trial Designs to Speed Up Clinical Development | Rare Disease Applications | Li Wang,Experience the pinnacle of AI and machine learning expertise at the Applied Machine Learning Days (AMLD) hosted at EPFL in ...,https://i.ytimg.com/vi/MKsyOvM5Ti0/default.jpg,120,90,https://i.ytimg.com/vi/MKsyOvM5Ti0/mqdefault.jpg,320,180,https://i.ytimg.com/vi/MKsyOvM5Ti0/hqdefault.jpg,480,360,Applied Machine Learning Days,none,2024-05-15T12:32:34Z
2,youtube#searchResult,BMpp10xJgkFiYObw9VkHf1dqFfc,youtube#video,kenVUYNlrTA,2024-05-13T13:47:54Z,UC7kFLyCRK3gQmiSBaFRzgnA,Detection of illegal landfills through Earth Observation | AI from the Sky | Andrea Diecidue,Experience the pinnacle of AI and machine learning expertise at the Applied Machine Learning Days (AMLD) hosted at EPFL in ...,https://i.ytimg.com/vi/kenVUYNlrTA/default.jpg,120,90,https://i.ytimg.com/vi/kenVUYNlrTA/mqdefault.jpg,320,180,https://i.ytimg.com/vi/kenVUYNlrTA/hqdefault.jpg,480,360,Applied Machine Learning Days,none,2024-05-13T13:47:54Z
3,youtube#searchResult,qN-b2kU7hZuBdWTEeiVbal3sNn8,youtube#video,jVOzMoz5ikI,2022-05-12T11:48:57Z,UC7kFLyCRK3gQmiSBaFRzgnA,Computer Vision for Mixed Reality | Microsoft Swiss Joint Research Center | Marc Pollefeys,"Microsoft Swiss Joint Research Center – Day 2 – Computer vision and Mixed Reality ""Computer Vision for Mixed Reality"" Marc ...",https://i.ytimg.com/vi/jVOzMoz5ikI/default.jpg,120,90,https://i.ytimg.com/vi/jVOzMoz5ikI/mqdefault.jpg,320,180,https://i.ytimg.com/vi/jVOzMoz5ikI/hqdefault.jpg,480,360,Applied Machine Learning Days,none,2022-05-12T11:48:57Z
4,youtube#searchResult,E3a0I3ScIdmwZsfeP76_zW1rcWc,youtube#video,JLfjG_BnM_s,2022-05-11T10:30:00Z,UC7kFLyCRK3gQmiSBaFRzgnA,Robust and Interpretable Learning for Healthcare | AI &amp; Healthcare | Dorina Thanou,"AI & Healthcare ""Robust and Interpretable Learning for Healthcare"" Dorina Thanou The Applied Machine Learning Days channel ...",https://i.ytimg.com/vi/JLfjG_BnM_s/default.jpg,120,90,https://i.ytimg.com/vi/JLfjG_BnM_s/mqdefault.jpg,320,180,https://i.ytimg.com/vi/JLfjG_BnM_s/hqdefault.jpg,480,360,Applied Machine Learning Days,none,2022-05-11T10:30:00Z
0,youtube#searchResult,WiLOqf46gsarDSe7OaexcNLgH6M,youtube#video,KkUXHylOqmQ,2023-11-04T14:59:36Z,UCspapbPlDQn1Tc7Pym2KMTw,NLP With Friends — Wenting Zhao,What We Learned from 570K ChatGPT Interaction Logs in The Wild.,https://i.ytimg.com/vi/KkUXHylOqmQ/default.jpg,120,90,https://i.ytimg.com/vi/KkUXHylOqmQ/mqdefault.jpg,320,180,https://i.ytimg.com/vi/KkUXHylOqmQ/hqdefault.jpg,480,360,NLP with Friends,none,2023-11-04T14:59:36Z
1,youtube#searchResult,UanxWFkXUfQeO3i4hdxUMyXHxKE,youtube#video,6gLUeMpmw28,2023-10-14T18:38:31Z,UCspapbPlDQn1Tc7Pym2KMTw,"NLP With Friends, Featured Friend: Mukund Srinath",Mukund is a PhD student in the Human Language Technologies lab at Pennsylvania State University. His primary research ...,https://i.ytimg.com/vi/6gLUeMpmw28/default.jpg,120,90,https://i.ytimg.com/vi/6gLUeMpmw28/mqdefault.jpg,320,180,https://i.ytimg.com/vi/6gLUeMpmw28/hqdefault.jpg,480,360,NLP with Friends,none,2023-10-14T18:38:31Z
2,youtube#searchResult,cHL-eqOQhHdFNNZw76srs82lomQ,youtube#video,TktbBnAWNB8,2023-09-08T18:14:57Z,UCspapbPlDQn1Tc7Pym2KMTw,"NLP With Friends, Featured Friend: Kalpesh Krishna","Kalpesh Krishna is a Research Scientist at Google, working in the Bard team. He recently received his PhD from UMass Amherst, ...",https://i.ytimg.com/vi/TktbBnAWNB8/default.jpg,120,90,https://i.ytimg.com/vi/TktbBnAWNB8/mqdefault.jpg,320,180,https://i.ytimg.com/vi/TktbBnAWNB8/hqdefault.jpg,480,360,NLP with Friends,none,2023-09-08T18:14:57Z
3,youtube#searchResult,4Mwt41YrGxjFIt7NmS21hdNPg1c,youtube#video,0WLGNTf9Yt4,2023-08-09T18:15:47Z,UCspapbPlDQn1Tc7Pym2KMTw,"NLP With Friends, Featured Friend: Prince Osei Aboagye","Prince Osei Aboagye is a final year Ph.D. student at the University of Utah, advised by Dr. Jeff M. Phillips. His research aims at ...",https://i.ytimg.com/vi/0WLGNTf9Yt4/default.jpg,120,90,https://i.ytimg.com/vi/0WLGNTf9Yt4/mqdefault.jpg,320,180,https://i.ytimg.com/vi/0WLGNTf9Yt4/hqdefault.jpg,480,360,NLP with Friends,none,2023-08-09T18:15:47Z
4,youtube#searchResult,aiR26ElY4LwjRANGhW1Vt7H5WVk,youtube#video,6584JiBX_Z8,2021-12-02T06:13:46Z,UCspapbPlDQn1Tc7Pym2KMTw,"NLP with Friends, Featured Friend: Tuhin Chakrabarty",The Curious Case of Figurative Language.,https://i.ytimg.com/vi/6584JiBX_Z8/default.jpg,120,90,https://i.ytimg.com/vi/6584JiBX_Z8/mqdefault.jpg,320,180,https://i.ytimg.com/vi/6584JiBX_Z8/hqdefault.jpg,480,360,NLP with Friends,none,2021-12-02T06:13:46Z
0,youtube#searchResult,emEeOYmt-_FfR1DDvWOdYFdjY7I,youtube#video,Awmq5BK0lgM,2022-06-20T13:57:58Z,UCVlPeQjsKct9bXoC1Qlp1qA,TVBEHub In Conversation With... Faithful+Gould,"Listen in as we chat about skills for jobs, future employment opportunities in the Built Environment sector, and how one company ...",https://i.ytimg.com/vi/Awmq5BK0lgM/default.jpg,120,90,https://i.ytimg.com/vi/Awmq5BK0lgM/mqdefault.jpg,320,180,https://i.ytimg.com/vi/Awmq5BK0lgM/hqdefault.jpg,480,360,TVAI Hub,none,2022-06-20T13:57:58Z
1,youtube#searchResult,bWj29SuoFl4_7XLGoyHglUVkcqM,youtube#video,gG78VWREcSU,2022-03-31T15:26:27Z,UCVlPeQjsKct9bXoC1Qlp1qA,TVBEHub In Conversation With... GradSpire,"Listen in as we chat about skills for jobs and regional support for skills development with Gradspire Project Coordinator, Ella ...",https://i.ytimg.com/vi/gG78VWREcSU/default.jpg,120,90,https://i.ytimg.com/vi/gG78VWREcSU/mqdefault.jpg,320,180,https://i.ytimg.com/vi/gG78VWREcSU/hqdefault.jpg,480,360,TVAI Hub,none,2022-03-31T15:26:27Z
2,youtube#searchResult,0J7xA0RUzNNsQ2TXMMAEfq_2m9o,youtube#video,3U4-7Y-epFw,2022-03-21T16:28:56Z,UCVlPeQjsKct9bXoC1Qlp1qA,AI at the University of Reading,Index: 0:00:15 Introductions 0:02:22 Dr Varun Ojha - Anything Repeatable is Replaceable by Artificial Intelligence: Opportunities ...,https://i.ytimg.com/vi/3U4-7Y-epFw/default.jpg,120,90,https://i.ytimg.com/vi/3U4-7Y-epFw/mqdefault.jpg,320,180,https://i.ytimg.com/vi/3U4-7Y-epFw/hqdefault.jpg,480,360,TVAI Hub,none,2022-03-21T16:28:56Z
3,youtube#searchResult,05R-KgwDsQskfTcUSdPh7JeIaSA,youtube#video,fECQRR8aYPA,2022-03-08T16:47:27Z,UCVlPeQjsKct9bXoC1Qlp1qA,"Developing data driven solutions in Healthcare, what are the realities?",This recording includes details of how to engage with a hospital and successfully deliver a collaborative project. Speakers ...,https://i.ytimg.com/vi/fECQRR8aYPA/default.jpg,120,90,https://i.ytimg.com/vi/fECQRR8aYPA/mqdefault.jpg,320,180,https://i.ytimg.com/vi/fECQRR8aYPA/hqdefault.jpg,480,360,TVAI Hub,none,2022-03-08T16:47:27Z
4,youtube#searchResult,7kt_NH_DE1_4vDIdZx8yCvHzrAo,youtube#video,cPF-hCawHII,2021-12-02T18:34:55Z,UCVlPeQjsKct9bXoC1Qlp1qA,Getting data right for AI,"Be amongst the first to hear about new events, current funding opportunities and information on local business support services by ...",https://i.ytimg.com/vi/cPF-hCawHII/default.jpg,120,90,https://i.ytimg.com/vi/cPF-hCawHII/mqdefault.jpg,320,180,https://i.ytimg.com/vi/cPF-hCawHII/hqdefault.jpg,480,360,TVAI Hub,none,2021-12-02T18:34:55Z
0,youtube#searchResult,fZEsLvwqQQXs5Q00sc8N75aX71o,youtube#video,gbjDEYFhdr4,2023-12-18T15:00:35Z,UCUcpVoi5KkJmnE3bvEhHR0Q,The Planet Fitness Problem : Improved Markov Chains,0:00 Intro 3:47 Markov Chain Framework 13:32 Improving the Framework Icon References: ...,https://i.ytimg.com/vi/gbjDEYFhdr4/default.jpg,120,90,https://i.ytimg.com/vi/gbjDEYFhdr4/mqdefault.jpg,320,180,https://i.ytimg.com/vi/gbjDEYFhdr4/hqdefault.jpg,480,360,ritvikmath,none,2023-12-18T15:00:35Z
1,youtube#searchResult,c_c4oAOeDgBdaIH1YYMXbalpoFg,youtube#video,3LlMjjqJYYQ,2023-07-05T15:00:02Z,UCUcpVoi5KkJmnE3bvEhHR0Q,The 5 Most Important Matrices for Data Scientists,My Patreon : https://www.patreon.com/user?u=49277905 The 5 most important matrices that I use all the time as a data scientist.,https://i.ytimg.com/vi/3LlMjjqJYYQ/default.jpg,120,90,https://i.ytimg.com/vi/3LlMjjqJYYQ/mqdefault.jpg,320,180,https://i.ytimg.com/vi/3LlMjjqJYYQ/hqdefault.jpg,480,360,ritvikmath,none,2023-07-05T15:00:02Z
2,youtube#searchResult,AQll28qQyE2l9E53pj1SKDPUUJQ,youtube#video,1GqYpmLjTRQ,2023-06-26T15:00:01Z,UCUcpVoi5KkJmnE3bvEhHR0Q,Why do we use &quot;e&quot; in the Sigmoid?,"Why do we use the mathematical constant ""e"" in the sigmoid function? My Patreon : https://www.patreon.com/user?u=49277905 ...",https://i.ytimg.com/vi/1GqYpmLjTRQ/default.jpg,120,90,https://i.ytimg.com/vi/1GqYpmLjTRQ/mqdefault.jpg,320,180,https://i.ytimg.com/vi/1GqYpmLjTRQ/hqdefault.jpg,480,360,ritvikmath,none,2023-06-26T15:00:01Z
3,youtube#searchResult,Q-8qd6szWV7GSqe1A12xBOzMjpg,youtube#video,UHdbHkjhaeY,2023-06-19T14:30:18Z,UCUcpVoi5KkJmnE3bvEhHR0Q,I Made Two AIs Debate Student Loan Forgiveness,My Patreon https://www.patreon.com/user?u=49277905 Visuals created by ExcaliDraw https://excalidraw.com/ Text to Voice by ...,https://i.ytimg.com/vi/UHdbHkjhaeY/default.jpg,120,90,https://i.ytimg.com/vi/UHdbHkjhaeY/mqdefault.jpg,320,180,https://i.ytimg.com/vi/UHdbHkjhaeY/hqdefault.jpg,480,360,ritvikmath,none,2023-06-19T14:30:18Z
4,youtube#searchResult,9SitclfiFfN1H_Qz-GcI6rdf1iE,youtube#video,qTbGgG28Hbw,2023-06-14T14:15:05Z,UCUcpVoi5KkJmnE3bvEhHR0Q,I asked ai to make a Joe Biden oat milk commercial,Creating a Joe Biden oat milk commercial only using AI My Patreon : https://www.patreon.com/user?u=49277905 ----- Script by ...,https://i.ytimg.com/vi/qTbGgG28Hbw/default.jpg,120,90,https://i.ytimg.com/vi/qTbGgG28Hbw/mqdefault.jpg,320,180,https://i.ytimg.com/vi/qTbGgG28Hbw/hqdefault.jpg,480,360,ritvikmath,none,2023-06-14T14:15:05Z
0,youtube#searchResult,rRUHTYwh0DlcyxWzO9m-6D42qSw,youtube#video,Rzi5p_1Mg1E,2024-04-09T16:26:25Z,UCjRjkk9nmIqSYwZ1zdxFw_g,Maximiza el Potencial de los Modelos de IA Generativa con Afinamiento y Optimización,Este webinar explorará en profundidad las estrategias y técnicas clave para la afinación (fine-tuning) de Modelos Grandes del ...,https://i.ytimg.com/vi/Rzi5p_1Mg1E/default.jpg,120,90,https://i.ytimg.com/vi/Rzi5p_1Mg1E/mqdefault.jpg,320,180,https://i.ytimg.com/vi/Rzi5p_1Mg1E/hqdefault.jpg,480,360,Databricks America Latina,none,2024-04-09T16:26:25Z
1,youtube#searchResult,-IsnmOjK65bvZ93kFHjCWYhvPbo,youtube#video,uDrnt_sd_2A,2024-03-05T19:21:35Z,UCjRjkk9nmIqSYwZ1zdxFw_g,WEBINAR: Revolucionando el Lakehouse con GenAI: Data Intelligence Platform,"El impacto de la IA en las plataformas de datos no será incremental, sino fundamental: democratizar masivamente el acceso a los ...",https://i.ytimg.com/vi/uDrnt_sd_2A/default.jpg,120,90,https://i.ytimg.com/vi/uDrnt_sd_2A/mqdefault.jpg,320,180,https://i.ytimg.com/vi/uDrnt_sd_2A/hqdefault.jpg,480,360,Databricks America Latina,none,2024-03-05T19:21:35Z
2,youtube#searchResult,WIKUczI4RklWJY8ea4_hsinsF_8,youtube#video,j1Mk41NXNIQ,2023-07-19T17:26:58Z,UCjRjkk9nmIqSYwZ1zdxFw_g,Webinar en Español  Escala y democratiza la analítica avanzada con Databricks y DataIku,"En esta sesión te compartiremos como nuestros clientes pueden aprovechar las ventajas de Databricks y Dataiku juntos, al tener ...",https://i.ytimg.com/vi/j1Mk41NXNIQ/default.jpg,120,90,https://i.ytimg.com/vi/j1Mk41NXNIQ/mqdefault.jpg,320,180,https://i.ytimg.com/vi/j1Mk41NXNIQ/hqdefault.jpg,480,360,Databricks America Latina,none,2023-07-19T17:26:58Z
3,youtube#searchResult,HWD4S4LjVacT3ONYf6WcDxC2fhs,youtube#video,2Wzj9Iu9Ey4,2021-03-03T19:30:18Z,UCjRjkk9nmIqSYwZ1zdxFw_g,Databricks Data Platform: Hadoop Modernización,Porque migrar de Hadoop hacia Databricks? Te comentamos durante este webinar y Demo.,https://i.ytimg.com/vi/2Wzj9Iu9Ey4/default.jpg,120,90,https://i.ytimg.com/vi/2Wzj9Iu9Ey4/mqdefault.jpg,320,180,https://i.ytimg.com/vi/2Wzj9Iu9Ey4/hqdefault.jpg,480,360,Databricks America Latina,none,2021-03-03T19:30:18Z
4,youtube#searchResult,rlPOKbgBpTKyJMaxmbweuDMIROQ,youtube#video,ewdP1_coRyo,2021-02-09T19:42:42Z,UCjRjkk9nmIqSYwZ1zdxFw_g,Capsula 2 - Lakehouse,Aprende más sobre el nuevo paradigma: Lakehouse.,https://i.ytimg.com/vi/ewdP1_coRyo/default.jpg,120,90,https://i.ytimg.com/vi/ewdP1_coRyo/mqdefault.jpg,320,180,https://i.ytimg.com/vi/ewdP1_coRyo/hqdefault.jpg,480,360,Databricks America Latina,none,2021-02-09T19:42:42Z
0,youtube#searchResult,hvxEOopaVXaOT83HQwsXmrYG8qQ,youtube#video,vv82n_UG1ak,2024-06-04T14:55:43Z,UC3NDbeN0Jq_InNAhiJtvHcQ,Яка відмінність між роботою CTO в аутсорсі й у продукті? | Сергій Герасимов,"Зустрічайте третій випуск Fwdays CTO Talks з нашим ведучим Єгором Герасимчуком! Наш гість - Сергій Герасимов, Solution ...",https://i.ytimg.com/vi/vv82n_UG1ak/default.jpg,120,90,https://i.ytimg.com/vi/vv82n_UG1ak/mqdefault.jpg,320,180,https://i.ytimg.com/vi/vv82n_UG1ak/hqdefault.jpg,480,360,fwdays,none,2024-06-04T14:55:43Z
1,youtube#searchResult,YKMekHTz2vpNkaeq3Nb4llnefPk,youtube#video,wOufPZfX9qI,2024-06-03T15:55:42Z,UC3NDbeN0Jq_InNAhiJtvHcQ,AIRe - AI Reliability Engineering - Денис Васильєв [Fwdays DevOps],"Відео з DevOps fwdays'24 конференції, яка пройшла 17 лютого 2024 року https://fwdays.com/event/devops-fwdays-2024 Опис ...",https://i.ytimg.com/vi/wOufPZfX9qI/default.jpg,120,90,https://i.ytimg.com/vi/wOufPZfX9qI/mqdefault.jpg,320,180,https://i.ytimg.com/vi/wOufPZfX9qI/hqdefault.jpg,480,360,fwdays,none,2024-06-03T15:55:42Z
2,youtube#searchResult,_qUeB5DmaKZuvI256Rx21tcazV0,youtube#video,d5BvoiTLTxM,2024-05-21T15:00:16Z,UC3NDbeN0Jq_InNAhiJtvHcQ,Про інженерні процеси та роботу в Netflix. Як стати Frontend розробником у 2024? | Владислав Кампов,"Другий випуск подкасту Fwdays JavaScript Talks, де ми говоримо про JavaScript, Frontend та сумісні технології разом з ...",https://i.ytimg.com/vi/d5BvoiTLTxM/default.jpg,120,90,https://i.ytimg.com/vi/d5BvoiTLTxM/mqdefault.jpg,320,180,https://i.ytimg.com/vi/d5BvoiTLTxM/hqdefault.jpg,480,360,fwdays,none,2024-05-21T15:00:16Z
3,youtube#searchResult,Fb7gLfRNXh3EuGvMTGHd6KlzbC0,youtube#video,5r1iIHFFftY,2024-05-17T15:14:01Z,UC3NDbeN0Jq_InNAhiJtvHcQ,Найбільший факап,,https://i.ytimg.com/vi/5r1iIHFFftY/default.jpg,120,90,https://i.ytimg.com/vi/5r1iIHFFftY/mqdefault.jpg,320,180,https://i.ytimg.com/vi/5r1iIHFFftY/hqdefault.jpg,480,360,fwdays,none,2024-05-17T15:14:01Z
4,youtube#searchResult,Hp-bs1YEDNZDaWmU6fvez-qOJqo,youtube#video,vUxydTuMj50,2024-05-15T15:00:21Z,UC3NDbeN0Jq_InNAhiJtvHcQ,Чи має СТО продавати свій продукт?,,https://i.ytimg.com/vi/vUxydTuMj50/default.jpg,120,90,https://i.ytimg.com/vi/vUxydTuMj50/mqdefault.jpg,320,180,https://i.ytimg.com/vi/vUxydTuMj50/hqdefault.jpg,480,360,fwdays,none,2024-05-15T15:00:21Z
0,youtube#searchResult,uMhhrbq_rh60sYHu9igEftTAxrE,youtube#video,ccW4gPwiJz4,2024-05-01T11:16:30Z,UCRF82wX0EPwqvKMBwvB4fQg,"EdgeDB Office Hours: Launch Week Edition, Monday, April 29th, 2024 ft. EdgeDB + Vercel Hackathon",Join our Discord to get notified of our next office hours session! https://discord.gg/umUueND6ag.,https://i.ytimg.com/vi/ccW4gPwiJz4/default.jpg,120,90,https://i.ytimg.com/vi/ccW4gPwiJz4/mqdefault.jpg,320,180,https://i.ytimg.com/vi/ccW4gPwiJz4/hqdefault.jpg,480,360,EdgeDB,none,2024-05-01T11:16:30Z
1,youtube#searchResult,JI_K21IPa_oJ65hkk6ctdJNouZo,youtube#video,fzbJ2TYPJM8,2024-04-30T13:13:21Z,UCRF82wX0EPwqvKMBwvB4fQg,"EdgeDB Office Hours, Thursday, April 4th, 2024 ft. pre-launch discussion of EdgeDB v5",Join our Discord to get notified of our next office hours session! https://discord.gg/umUueND6ag.,https://i.ytimg.com/vi/fzbJ2TYPJM8/default.jpg,120,90,https://i.ytimg.com/vi/fzbJ2TYPJM8/mqdefault.jpg,320,180,https://i.ytimg.com/vi/fzbJ2TYPJM8/hqdefault.jpg,480,360,EdgeDB,none,2024-04-30T13:13:21Z
2,youtube#searchResult,zs-VEbY_ZNXFx46nVny5sZq1a4Y,youtube#video,oGFahpuRquc,2024-02-22T17:25:52Z,UCRF82wX0EPwqvKMBwvB4fQg,"EdgeDB Office Hours, Friday, February 16th, 2023 ft. a demo of a personal database powered by EdgeDB",Join our Discord to get notified of our next office hours session! https://discord.gg/umUueND6ag.,https://i.ytimg.com/vi/oGFahpuRquc/default.jpg,120,90,https://i.ytimg.com/vi/oGFahpuRquc/mqdefault.jpg,320,180,https://i.ytimg.com/vi/oGFahpuRquc/hqdefault.jpg,480,360,EdgeDB,none,2024-02-22T17:25:52Z
