,kind,etag,id.kind,id.videoId,snippet.publishedAt,snippet.channelId,snippet.title,snippet.description,snippet.thumbnails.default.url,snippet.thumbnails.default.width,snippet.thumbnails.default.height,snippet.thumbnails.medium.url,snippet.thumbnails.medium.width,snippet.thumbnails.medium.height,snippet.thumbnails.high.url,snippet.thumbnails.high.width,snippet.thumbnails.high.height,snippet.channelTitle,snippet.liveBroadcastContent,snippet.publishTime
4,youtube#searchResult,XJQGVOtfH9_TVdpdc2bsmi6T10c,youtube#video,6aDX14_3VL0,2026-01-13T13:01:23Z,UCUzGQrN-lyyc0BWTYoJM_Sg,What an API actually does,"Day 23/42: What Is an API? Yesterday, we chose the model. Now we connect to it. An API is how your app sends a prompt and ...",https://i.ytimg.com/vi/6aDX14_3VL0/default.jpg,120,90,https://i.ytimg.com/vi/6aDX14_3VL0/mqdefault.jpg,320,180,https://i.ytimg.com/vi/6aDX14_3VL0/hqdefault.jpg,480,360,What's AI by Louis-François Bouchard,none,2026-01-13T13:01:23Z
5,youtube#searchResult,uYJVxAF0ycr6epxrsWp4Q_gStoE,youtube#video,fcN_0c8-kEk,2026-01-11T13:03:02Z,UCUzGQrN-lyyc0BWTYoJM_Sg,The future and risk of agents,"Day 21/42: What Is Agentic AI? Yesterday, we compared workflows and agents. Today, we name the shift. Agentic AI means ...",https://i.ytimg.com/vi/fcN_0c8-kEk/default.jpg,120,90,https://i.ytimg.com/vi/fcN_0c8-kEk/mqdefault.jpg,320,180,https://i.ytimg.com/vi/fcN_0c8-kEk/hqdefault.jpg,480,360,What's AI by Louis-François Bouchard,none,2026-01-11T13:03:02Z
6,youtube#searchResult,UDituCoQ7KrUnXd_Zul8bQlEWIw,youtube#video,AIeGOHEClDY,2026-01-10T13:00:51Z,UCUzGQrN-lyyc0BWTYoJM_Sg,When NOT to use agents,"Day 20/42: Workflow vs Agent Yesterday, we built RAG. Now we talk about control. A workflow follows fixed steps. Predictable.",https://i.ytimg.com/vi/AIeGOHEClDY/default.jpg,120,90,https://i.ytimg.com/vi/AIeGOHEClDY/mqdefault.jpg,320,180,https://i.ytimg.com/vi/AIeGOHEClDY/hqdefault.jpg,480,360,What's AI by Louis-François Bouchard,none,2026-01-10T13:00:51Z
7,youtube#searchResult,PW4Y0h6KIpntyWq7J51QgomwQi0,youtube#video,iwqXLDM2hW4,2026-01-09T13:01:05Z,UCUzGQrN-lyyc0BWTYoJM_Sg,Why AI makes things up,"Day 19/42: What Is Grounding? Yesterday, we controlled randomness. Today, we control truth. Grounding means forcing a model ...",https://i.ytimg.com/vi/iwqXLDM2hW4/default.jpg,120,90,https://i.ytimg.com/vi/iwqXLDM2hW4/mqdefault.jpg,320,180,https://i.ytimg.com/vi/iwqXLDM2hW4/hqdefault.jpg,480,360,What's AI by Louis-François Bouchard,none,2026-01-09T13:01:05Z
8,youtube#searchResult,U_-9mj2w90zsFXqxp3CGUVnqvuk,youtube#video,3UBZHwr-By4,2026-01-08T13:00:57Z,UCUzGQrN-lyyc0BWTYoJM_Sg,This setting controls randomness,"Day 18/42: Temperature & Randomness Yesterday, we talked about latency. Now we talk about predictability. Temperature ...",https://i.ytimg.com/vi/3UBZHwr-By4/default.jpg,120,90,https://i.ytimg.com/vi/3UBZHwr-By4/mqdefault.jpg,320,180,https://i.ytimg.com/vi/3UBZHwr-By4/hqdefault.jpg,480,360,What's AI by Louis-François Bouchard,none,2026-01-08T13:00:57Z
9,youtube#searchResult,LqjvsIyOMT2qqpSKzpGE0pi3-5E,youtube#video,3eZz1pwP7EU,2026-01-07T13:01:18Z,UCUzGQrN-lyyc0BWTYoJM_Sg,The hidden cost of waiting,"Day 17/42: What Is Latency? Yesterday, we explained inference. Today, we talk about the wait. Latency is the delay between your ...",https://i.ytimg.com/vi/3eZz1pwP7EU/default.jpg,120,90,https://i.ytimg.com/vi/3eZz1pwP7EU/mqdefault.jpg,320,180,https://i.ytimg.com/vi/3eZz1pwP7EU/hqdefault.jpg,480,360,What's AI by Louis-François Bouchard,none,2026-01-07T13:01:18Z
10,youtube#searchResult,ZIwTvHFm65bR7UBuGPras58qn54,youtube#video,iOpLKJYOvXs,2026-01-06T22:04:14Z,UCUzGQrN-lyyc0BWTYoJM_Sg,From Workflows to Multi-Agent Systems: How to Choose,Get the FREE agents cheatsheet here: https://academy.towardsai.net/products/digital_downloads/agents-cheatsheet?ref=1f9b29 ...,https://i.ytimg.com/vi/iOpLKJYOvXs/default.jpg,120,90,https://i.ytimg.com/vi/iOpLKJYOvXs/mqdefault.jpg,320,180,https://i.ytimg.com/vi/iOpLKJYOvXs/hqdefault.jpg,480,360,What's AI by Louis-François Bouchard,none,2026-01-06T22:04:14Z
11,youtube#searchResult,1uzVNg-7RhYfqT8hHYK43q5Diak,youtube#video,jlcyyjprR2s,2026-01-06T13:01:10Z,UCUzGQrN-lyyc0BWTYoJM_Sg,Why AI types one word at a time,"Day 16/42: What Is Inference? Yesterday, we covered reasoning. Now we move to runtime. Inference is the moment a trained ...",https://i.ytimg.com/vi/jlcyyjprR2s/default.jpg,120,90,https://i.ytimg.com/vi/jlcyyjprR2s/mqdefault.jpg,320,180,https://i.ytimg.com/vi/jlcyyjprR2s/hqdefault.jpg,480,360,What's AI by Louis-François Bouchard,none,2026-01-06T13:01:10Z
12,youtube#searchResult,p2wRwN--5PDydWINPtkXQ4GabcY,youtube#video,pb7edpY_-pk,2026-01-04T13:02:40Z,UCUzGQrN-lyyc0BWTYoJM_Sg,The easiest way to improve prompts,"Day 14/42: Zero-Shot vs Few-Shot Learning Yesterday, we talked about context windows. Today, we use that space more ...",https://i.ytimg.com/vi/pb7edpY_-pk/default.jpg,120,90,https://i.ytimg.com/vi/pb7edpY_-pk/mqdefault.jpg,320,180,https://i.ytimg.com/vi/pb7edpY_-pk/hqdefault.jpg,480,360,What's AI by Louis-François Bouchard,none,2026-01-04T13:02:40Z
13,youtube#searchResult,yuMflNzgHh_H5Mj1O3n8LZqXa-E,youtube#video,T4VcqINbo9g,2026-01-03T13:00:38Z,UCUzGQrN-lyyc0BWTYoJM_Sg,This is how much AI can remember,"Day 13/42: What Is a Context Window? Yesterday, we broke down prompts. Now we talk about memory. The context window is ...",https://i.ytimg.com/vi/T4VcqINbo9g/default.jpg,120,90,https://i.ytimg.com/vi/T4VcqINbo9g/mqdefault.jpg,320,180,https://i.ytimg.com/vi/T4VcqINbo9g/hqdefault.jpg,480,360,What's AI by Louis-François Bouchard,none,2026-01-03T13:00:38Z
14,youtube#searchResult,xGKczhjKnnL1F4T9tKIrF6DLVFQ,youtube#video,PUy9dHuHM6s,2026-01-02T14:01:14Z,UCUzGQrN-lyyc0BWTYoJM_Sg,Your Prompts Aren’t the Problem—Your Context Is,Our courses and social media: https://links.louisbouchard.ai/ ▻ Our new book Building LLMs for Production: ...,https://i.ytimg.com/vi/PUy9dHuHM6s/default.jpg,120,90,https://i.ytimg.com/vi/PUy9dHuHM6s/mqdefault.jpg,320,180,https://i.ytimg.com/vi/PUy9dHuHM6s/hqdefault.jpg,480,360,What's AI by Louis-François Bouchard,none,2026-01-02T14:01:14Z
15,youtube#searchResult,oxfEoPl52xEqB_5mwaC4foSkjs4,youtube#video,S5wivuFwuLk,2026-01-02T13:01:03Z,UCUzGQrN-lyyc0BWTYoJM_Sg,Why prompts actually work,"Day 12/42: What Is a Prompt? (System vs User) Yesterday, we saw how models learn *how* to behave. Today, we talk about how ...",https://i.ytimg.com/vi/S5wivuFwuLk/default.jpg,120,90,https://i.ytimg.com/vi/S5wivuFwuLk/mqdefault.jpg,320,180,https://i.ytimg.com/vi/S5wivuFwuLk/hqdefault.jpg,480,360,What's AI by Louis-François Bouchard,none,2026-01-02T13:01:03Z
16,youtube#searchResult,GYvvSLkqJOKwzGxkxx0dVqcR-oo,youtube#video,N-UfmqdFQJM,2026-01-01T13:01:54Z,UCUzGQrN-lyyc0BWTYoJM_Sg,RLHF explained simply,"Day 11/42: What Is RLHF? Yesterday, we talked about alignment. But how do we actually teach a model what humans prefer?",https://i.ytimg.com/vi/N-UfmqdFQJM/default.jpg,120,90,https://i.ytimg.com/vi/N-UfmqdFQJM/mqdefault.jpg,320,180,https://i.ytimg.com/vi/N-UfmqdFQJM/hqdefault.jpg,480,360,What's AI by Louis-François Bouchard,none,2026-01-01T13:01:54Z
17,youtube#searchResult,YuRL9l7DYCzgS0wsrp1s-lbmZs4,youtube#video,wsOd97UO8V8,2025-12-31T13:01:27Z,UCUzGQrN-lyyc0BWTYoJM_Sg,Why ChatGPT refuses some answers,"Day 10/42: What Is Alignment? Yesterday, we talked about fine-tuning. But good answers aren't just accurate. They need to be ...",https://i.ytimg.com/vi/wsOd97UO8V8/default.jpg,120,90,https://i.ytimg.com/vi/wsOd97UO8V8/mqdefault.jpg,320,180,https://i.ytimg.com/vi/wsOd97UO8V8/hqdefault.jpg,480,360,What's AI by Louis-François Bouchard,none,2025-12-31T13:01:27Z
18,youtube#searchResult,eSDoVdakRT2T33Sif2WfrQVQTsY,youtube#video,vIRS45ACNtM,2025-12-30T13:01:53Z,UCUzGQrN-lyyc0BWTYoJM_Sg,How AI gets specialized (fine-tuning explained),"Day 9/42: What Is Fine-Tuning? Yesterday, we compared base vs instruct models. Today, we explain the key technique behind ...",https://i.ytimg.com/vi/vIRS45ACNtM/default.jpg,120,90,https://i.ytimg.com/vi/vIRS45ACNtM/mqdefault.jpg,320,180,https://i.ytimg.com/vi/vIRS45ACNtM/hqdefault.jpg,480,360,What's AI by Louis-François Bouchard,none,2025-12-30T13:01:53Z
19,youtube#searchResult,Kuy6aZmDNhBz8_9SOoZfdX6kCo4,youtube#video,TRVmuskzE5Y,2025-12-29T13:01:20Z,UCUzGQrN-lyyc0BWTYoJM_Sg,Base vs instruct models explained,"Day 8/42: Base Model vs Instruct Model Yesterday, we covered pre-training. That gives us a powerful model… that's still awkward ...",https://i.ytimg.com/vi/TRVmuskzE5Y/default.jpg,120,90,https://i.ytimg.com/vi/TRVmuskzE5Y/mqdefault.jpg,320,180,https://i.ytimg.com/vi/TRVmuskzE5Y/hqdefault.jpg,480,360,What's AI by Louis-François Bouchard,none,2025-12-29T13:01:20Z
20,youtube#searchResult,cHjUGR5qTD0b7o9q3_ZzgYs8ai8,youtube#video,IcVcvgD2eTw,2025-12-28T13:00:37Z,UCUzGQrN-lyyc0BWTYoJM_Sg,This is how GPT gets built,"Day 7/42: What Is Pre-Training? Yesterday, we met parameters. Today, we explain how they stop being random. Pre-training is ...",https://i.ytimg.com/vi/IcVcvgD2eTw/default.jpg,120,90,https://i.ytimg.com/vi/IcVcvgD2eTw/mqdefault.jpg,320,180,https://i.ytimg.com/vi/IcVcvgD2eTw/hqdefault.jpg,480,360,What's AI by Louis-François Bouchard,none,2025-12-28T13:00:37Z
21,youtube#searchResult,7NNjO5-UpQ3FE0ZmabBTYrj3Qas,youtube#video,axN09ingy28,2025-12-27T13:01:27Z,UCUzGQrN-lyyc0BWTYoJM_Sg,This is what LLMs really store,"Day 6/42: What Are Parameters? Yesterday, we explored latent space. Today, we look at what shapes it. Parameters are the ...",https://i.ytimg.com/vi/axN09ingy28/default.jpg,120,90,https://i.ytimg.com/vi/axN09ingy28/mqdefault.jpg,320,180,https://i.ytimg.com/vi/axN09ingy28/hqdefault.jpg,480,360,What's AI by Louis-François Bouchard,none,2025-12-27T13:01:27Z
22,youtube#searchResult,fZ4U4iktRXc4x93Rzcw_3DvaQaI,youtube#video,3XiOIbFjauo,2025-12-25T13:01:35Z,UCUzGQrN-lyyc0BWTYoJM_Sg,Day 4/42: How AI understands meaning,"Day 4/42: What Are Embeddings? Yesterday, we broke text into tokens. But tokens alone are meaningless numbers. So how does ...",https://i.ytimg.com/vi/3XiOIbFjauo/default.jpg,120,90,https://i.ytimg.com/vi/3XiOIbFjauo/mqdefault.jpg,320,180,https://i.ytimg.com/vi/3XiOIbFjauo/hqdefault.jpg,480,360,What's AI by Louis-François Bouchard,none,2025-12-25T13:01:35Z
23,youtube#searchResult,mO-7ph-C-igVvJ12aZMHYhiIcEk,youtube#video,IDnv-jcPnf4,2025-12-24T13:01:54Z,UCUzGQrN-lyyc0BWTYoJM_Sg,Everything in LLMs starts here,"Day 3/42: What is a Token? Yesterday, we said an LLM is just a powerful autocomplete system. Today, we define what it's actually ...",https://i.ytimg.com/vi/IDnv-jcPnf4/default.jpg,120,90,https://i.ytimg.com/vi/IDnv-jcPnf4/mqdefault.jpg,320,180,https://i.ytimg.com/vi/IDnv-jcPnf4/hqdefault.jpg,480,360,What's AI by Louis-François Bouchard,none,2025-12-24T13:01:54Z
24,youtube#searchResult,Q1NUBK2ISiq9bgxkaKfKkyilk6s,youtube#video,Pm4P6ryfezI,2025-12-23T16:55:02Z,UCUzGQrN-lyyc0BWTYoJM_Sg,Prediction Isn’t Understanding and That Difference Matters,Full article and references: https://www.louisbouchard.ai/why-ai-feels-intelligent ▻ Our new book Building LLMs for Production: ...,https://i.ytimg.com/vi/Pm4P6ryfezI/default.jpg,120,90,https://i.ytimg.com/vi/Pm4P6ryfezI/mqdefault.jpg,320,180,https://i.ytimg.com/vi/Pm4P6ryfezI/hqdefault.jpg,480,360,What's AI by Louis-François Bouchard,none,2025-12-23T16:55:02Z
0,youtube#searchResult,nAz3dpzD4J8t95ec7yX3i8P3W9A,youtube#video,9PFDJDdrEHk,2023-10-04T17:11:16Z,UC9cBIteC3u7Ee6bzeOcl_Og,Missing Malaysia Durian 🥲 Musang King in Kuala Lumpur - Chris&#39; Tasting,"Full video: https://youtu.be/6uFkJ4KPdT0 While living in Kuala Lumpur, Malaysia, we tried Musang King, the best quality durian in ...",https://i.ytimg.com/vi/9PFDJDdrEHk/default.jpg,120,90,https://i.ytimg.com/vi/9PFDJDdrEHk/mqdefault.jpg,320,180,https://i.ytimg.com/vi/9PFDJDdrEHk/hqdefault.jpg,480,360,deeplizard vlog,none,2023-10-04T17:11:16Z
1,youtube#searchResult,DM42F1HYi26xum9BRA4bxvRbrZc,youtube#video,y4PDIE77nzo,2023-09-30T19:32:09Z,UC9cBIteC3u7Ee6bzeOcl_Og,Missing Malaysia Durian 🥲 Musang King in Kuala Lumpur - Mandy&#39;s Tasting,"Full video: https://youtu.be/6uFkJ4KPdT0 While living in Kuala Lumpur, Malaysia, we tried Musang King, the best quality durian in ...",https://i.ytimg.com/vi/y4PDIE77nzo/default.jpg,120,90,https://i.ytimg.com/vi/y4PDIE77nzo/mqdefault.jpg,320,180,https://i.ytimg.com/vi/y4PDIE77nzo/hqdefault.jpg,480,360,deeplizard vlog,none,2023-09-30T19:32:09Z
2,youtube#searchResult,QLiDKafFn7tUgoXCDMTQpysonbQ,youtube#video,feUwtHWmM5I,2022-02-03T00:13:31Z,UC9cBIteC3u7Ee6bzeOcl_Og,Final Days of Vietnam Tết Holiday - Lunar New Year,"Tết, the Vietnamese celebration of the Lunar New Year, is the largest and most widely celebrated holiday in all of Vietnam.",https://i.ytimg.com/vi/feUwtHWmM5I/default.jpg,120,90,https://i.ytimg.com/vi/feUwtHWmM5I/mqdefault.jpg,320,180,https://i.ytimg.com/vi/feUwtHWmM5I/hqdefault.jpg,480,360,deeplizard vlog,none,2022-02-03T00:13:31Z
3,youtube#searchResult,TOjysMM8PxdXN6hEP6B-tsEjH8U,youtube#video,rBFn4sRmiC0,2022-01-31T22:33:38Z,UC9cBIteC3u7Ee6bzeOcl_Og,Vietnam Tết Holiday - Lunar New Year,"Tết, the Vietnamese celebration of the Lunar New Year, is the largest and most widely celebrated holiday in all of Vietnam.",https://i.ytimg.com/vi/rBFn4sRmiC0/default.jpg,120,90,https://i.ytimg.com/vi/rBFn4sRmiC0/mqdefault.jpg,320,180,https://i.ytimg.com/vi/rBFn4sRmiC0/hqdefault.jpg,480,360,deeplizard vlog,none,2022-01-31T22:33:38Z
4,youtube#searchResult,zudwsQ4Jk3MLc9jCHRJPk_uEjt4,youtube#video,W1QmrQoyMAc,2021-02-28T15:17:44Z,UC9cBIteC3u7Ee6bzeOcl_Og,Foreigners Spend Tết with Local Family - Vietnam Lunar New Year,"Tết, the Vietnamese word for the Lunar New Year, is the largest and most widely celebrated holiday in all of Vietnam.",https://i.ytimg.com/vi/W1QmrQoyMAc/default.jpg,120,90,https://i.ytimg.com/vi/W1QmrQoyMAc/mqdefault.jpg,320,180,https://i.ytimg.com/vi/W1QmrQoyMAc/hqdefault.jpg,480,360,deeplizard vlog,none,2021-02-28T15:17:44Z
0,youtube#searchResult,g9yTq5QSjL5dop3xS-ebvlsEfYg,youtube#video,oBxVrIEKkTw,2026-01-13T18:37:24Z,UCWXI5YeOsh03QvJ59PMaXFw,PyTorch Foundation Spotlight: Prabha Ganapathy (AWS),"In this PyTorch Foundation Spotlight, Prabha Ganapathy (AWS) shares an approach to open source centered on contributing ...",https://i.ytimg.com/vi/oBxVrIEKkTw/default.jpg,120,90,https://i.ytimg.com/vi/oBxVrIEKkTw/mqdefault.jpg,320,180,https://i.ytimg.com/vi/oBxVrIEKkTw/hqdefault.jpg,480,360,PyTorch,none,2026-01-13T18:37:24Z
1,youtube#searchResult,3_9Ng0ArQDZeadKypwwMMy_FaLs,youtube#video,P7Y8cn9varU,2025-12-18T18:49:40Z,UCWXI5YeOsh03QvJ59PMaXFw,PyTorch Foundation Spotlight: Simon Mo,"In this PyTorch Foundation Spotlight, Simon Mo discusses vLLM becoming a PyTorch Foundation project and why that milestone ...",https://i.ytimg.com/vi/P7Y8cn9varU/default.jpg,120,90,https://i.ytimg.com/vi/P7Y8cn9varU/mqdefault.jpg,320,180,https://i.ytimg.com/vi/P7Y8cn9varU/hqdefault.jpg,480,360,PyTorch,none,2025-12-18T18:49:40Z
2,youtube#searchResult,rhQbzO1YNjCXDcaAy9uRRHhEkfg,youtube#video,67719mlOSp0,2025-12-12T17:46:49Z,UCWXI5YeOsh03QvJ59PMaXFw,PyTorch Foundation Spotlight: Zhipeng Wang,"In this PyTorch Foundation Spotlight, Zhipeng Wang, TSC Committer (DeepSpeed), explains how DeepSpeed has supported ...",https://i.ytimg.com/vi/67719mlOSp0/default.jpg,120,90,https://i.ytimg.com/vi/67719mlOSp0/mqdefault.jpg,320,180,https://i.ytimg.com/vi/67719mlOSp0/hqdefault.jpg,480,360,PyTorch,none,2025-12-12T17:46:49Z
3,youtube#searchResult,wn76j11_EfYwNjYQlrmwoDFo9ro,youtube#video,_gIyr1BVUJk,2025-12-12T07:55:12Z,UCWXI5YeOsh03QvJ59PMaXFw,Inside Helion: Live Q&amp;A with the Developers,Helion — a new Python-embedded domain-specific language (DSL) for wiring high-performance ML kernels — is built to compile ...,https://i.ytimg.com/vi/_gIyr1BVUJk/default.jpg,120,90,https://i.ytimg.com/vi/_gIyr1BVUJk/mqdefault.jpg,320,180,https://i.ytimg.com/vi/_gIyr1BVUJk/hqdefault.jpg,480,360,PyTorch,none,2025-12-12T07:55:12Z
4,youtube#searchResult,GWoPq-8f8j5C_om0csL3l6yDVR8,youtube#video,pfdf8-6FEm4,2025-12-09T22:18:19Z,UCWXI5YeOsh03QvJ59PMaXFw,PyTorch Foundation Spotlight: Joe Spisak,"In this Spotlight filmed during PyTorch Conference 2025, Joe Spisak, Product Director at Meta Super Intelligence Labs and ...",https://i.ytimg.com/vi/pfdf8-6FEm4/default.jpg,120,90,https://i.ytimg.com/vi/pfdf8-6FEm4/mqdefault.jpg,320,180,https://i.ytimg.com/vi/pfdf8-6FEm4/hqdefault.jpg,480,360,PyTorch,none,2025-12-09T22:18:19Z
0,youtube#searchResult,JN4VldxSeKbS_4muNmbQ0LxCzss,youtube#video,TxBJyXKTbJ8,2025-01-18T01:00:25Z,UC0rqucBdTuFTjJiefW5t-IQ,Can AI increase the speed in which we solve problems?,"Ovetta Sampson, Director of UX for AI compute enablement at Google shares what she hopes the latest AI capabilities can do, ...",https://i.ytimg.com/vi/TxBJyXKTbJ8/default.jpg,120,90,https://i.ytimg.com/vi/TxBJyXKTbJ8/mqdefault.jpg,320,180,https://i.ytimg.com/vi/TxBJyXKTbJ8/hqdefault.jpg,480,360,TensorFlow,none,2025-01-18T01:00:25Z
1,youtube#searchResult,jZWZaTOfMnwm6xKoThDK2KFwJ9o,youtube#video,HEGojkpjx98,2025-01-14T22:00:09Z,UC0rqucBdTuFTjJiefW5t-IQ,Is AI a medium or tool?,Is AI a medium or tool? Artist Douglas Edrick Stanley and Dean of Research at Geneva University of Art and Design Anthony ...,https://i.ytimg.com/vi/HEGojkpjx98/default.jpg,120,90,https://i.ytimg.com/vi/HEGojkpjx98/mqdefault.jpg,320,180,https://i.ytimg.com/vi/HEGojkpjx98/hqdefault.jpg,480,360,TensorFlow,none,2025-01-14T22:00:09Z
2,youtube#searchResult,ZRn1VzE5QQbSRysckuNS4dQes2M,youtube#video,wyHf6yL15N4,2024-12-06T17:05:25Z,UC0rqucBdTuFTjJiefW5t-IQ,Personalizing healthcare with AI,Hear about Dr. Oliver Aalami's journey on incorporating AI in the healthcare industry and his passion for integrating technology in ...,https://i.ytimg.com/vi/wyHf6yL15N4/default.jpg,120,90,https://i.ytimg.com/vi/wyHf6yL15N4/mqdefault.jpg,320,180,https://i.ytimg.com/vi/wyHf6yL15N4/hqdefault.jpg,480,360,TensorFlow,none,2024-12-06T17:05:25Z
3,youtube#searchResult,qPd8phtCLCv5uQeytEzt_OzeegI,youtube#video,AuyaJz5O_LQ,2024-11-15T17:00:17Z,UC0rqucBdTuFTjJiefW5t-IQ,Building AI responsibly,"Find out what it means to be not only a person of AI, but responsibly. To learn more, head over to the related video “Responsible ...",https://i.ytimg.com/vi/AuyaJz5O_LQ/default.jpg,120,90,https://i.ytimg.com/vi/AuyaJz5O_LQ/mqdefault.jpg,320,180,https://i.ytimg.com/vi/AuyaJz5O_LQ/hqdefault.jpg,480,360,TensorFlow,none,2024-11-15T17:00:17Z
4,youtube#searchResult,CeCwRwh16ME7SxxIDO01a5RPFrs,youtube#video,8VTrp9m23kc,2024-11-08T14:00:07Z,UC0rqucBdTuFTjJiefW5t-IQ,What is Checks?,Learn the origin behind Checks and the inner workings of the Checks compliance framework. Want to hear more? Check out the ...,https://i.ytimg.com/vi/8VTrp9m23kc/default.jpg,120,90,https://i.ytimg.com/vi/8VTrp9m23kc/mqdefault.jpg,320,180,https://i.ytimg.com/vi/8VTrp9m23kc/hqdefault.jpg,480,360,TensorFlow,none,2024-11-08T14:00:07Z
0,youtube#searchResult,DUtchvwknW62Yx6mJm9_sxQ99Ek,youtube#video,7jrN_aZzalQ,2025-01-30T21:25:39Z,UCtOaFDjfZQ_Gqa_MogHDuow,Synthetic Data: Revolutionizing Dataset Building,"Data annotation is a heavily manual, time-consuming process. ⏰ That's why we offer semi-supervised learning, auto-annotation, ...",https://i.ytimg.com/vi/7jrN_aZzalQ/default.jpg,120,90,https://i.ytimg.com/vi/7jrN_aZzalQ/mqdefault.jpg,320,180,https://i.ytimg.com/vi/7jrN_aZzalQ/hqdefault.jpg,480,360,alwaysAI,none,2025-01-30T21:25:39Z
1,youtube#searchResult,AmttQNB-Z75thsMF5m8CD9Dw3DE,youtube#video,AlMxOgUCuAw,2025-01-23T19:23:41Z,UCtOaFDjfZQ_Gqa_MogHDuow,Harnessing Purpose-Driven Models for Vision AI,"At alwaysAI, we focus on smaller, more energy-efficient, and purpose-driven models. These models are leveraged to build ...",https://i.ytimg.com/vi/AlMxOgUCuAw/default.jpg,120,90,https://i.ytimg.com/vi/AlMxOgUCuAw/mqdefault.jpg,320,180,https://i.ytimg.com/vi/AlMxOgUCuAw/hqdefault.jpg,480,360,alwaysAI,none,2025-01-23T19:23:41Z
2,youtube#searchResult,WrtQjFMAT5RXuhTrCiP4yDIVx48,youtube#video,1qJWXV82Vbs,2025-01-13T23:25:01Z,UCtOaFDjfZQ_Gqa_MogHDuow,Why Is Vision AI So Powerful for Industrial Environments?,"Industrial environments are complex and constantly shifting. Large amounts of equipment, complicated sensory input, services, ...",https://i.ytimg.com/vi/1qJWXV82Vbs/default.jpg,120,90,https://i.ytimg.com/vi/1qJWXV82Vbs/mqdefault.jpg,320,180,https://i.ytimg.com/vi/1qJWXV82Vbs/hqdefault.jpg,480,360,alwaysAI,none,2025-01-13T23:25:01Z
3,youtube#searchResult,Qmrm9OgxxhgaFhBmVfIGEDvHoXE,youtube#video,mu1DtbFIjgI,2025-01-08T19:40:08Z,UCtOaFDjfZQ_Gqa_MogHDuow,Unlocking the Power of Predictive Analytics,"At alwaysAI, we're continually exploring tools and techniques to enhance our computer vision platform. One example? Leveraging ...",https://i.ytimg.com/vi/mu1DtbFIjgI/default.jpg,120,90,https://i.ytimg.com/vi/mu1DtbFIjgI/mqdefault.jpg,320,180,https://i.ytimg.com/vi/mu1DtbFIjgI/hqdefault.jpg,480,360,alwaysAI,none,2025-01-08T19:40:08Z
4,youtube#searchResult,3RTAYS6NzPU_smE3XzZ5Swz04pQ,youtube#video,TCvD4YRoAPs,2024-12-30T19:10:16Z,UCtOaFDjfZQ_Gqa_MogHDuow,alwaysAI Remote Management,A key component of successful computer vision edge deployment is the ability to remotely manage all of your devices.,https://i.ytimg.com/vi/TCvD4YRoAPs/default.jpg,120,90,https://i.ytimg.com/vi/TCvD4YRoAPs/mqdefault.jpg,320,180,https://i.ytimg.com/vi/TCvD4YRoAPs/hqdefault.jpg,480,360,alwaysAI,none,2024-12-30T19:10:16Z
0,youtube#searchResult,PIGhNsQy0b4pnMXTjz_ms0aMNTo,youtube#video,ioDMTwNccmY,2026-01-14T17:02:14Z,UC8LpQpJIT39DLDJ9VR0yixg,Head of AI at Atom: How a top digital UK bank is using AI #ai #datascience,We have been having some really good conversations off the back of this podcast episode already Shannon McKechnie is ...,https://i.ytimg.com/vi/ioDMTwNccmY/default.jpg,120,90,https://i.ytimg.com/vi/ioDMTwNccmY/mqdefault.jpg,320,180,https://i.ytimg.com/vi/ioDMTwNccmY/hqdefault.jpg,480,360,MBN Solutions,none,2026-01-14T17:02:14Z
1,youtube#searchResult,ssbZqeBzobPkWo0jpDA0OiEzbbA,youtube#video,AXwe6zQrPDU,2026-01-07T07:24:25Z,UC8LpQpJIT39DLDJ9VR0yixg,What Enterprise AI Really Looks Like in Practice Inside One of The UK’s Most Regulated Digital Ba...,What if you could sit down with the Head of AI inside one of the UK's most regulated digital banks and hear the truth about what ...,https://i.ytimg.com/vi/AXwe6zQrPDU/default.jpg,120,90,https://i.ytimg.com/vi/AXwe6zQrPDU/mqdefault.jpg,320,180,https://i.ytimg.com/vi/AXwe6zQrPDU/hqdefault.jpg,480,360,MBN Solutions,none,2026-01-07T07:24:25Z
2,youtube#searchResult,k03cHa0kzMMhYJ17mtUdjwrAU3U,youtube#video,gUaYfsc8m14,2026-01-07T07:00:44Z,UC8LpQpJIT39DLDJ9VR0yixg,What Enterprise AI Really Looks Like in Practice Inside One of The UK’s Most Regulated Digital Banks,What does real enterprise AI look like inside one of the UK's most regulated digital banks and what do leaders need to get right to ...,https://i.ytimg.com/vi/gUaYfsc8m14/default.jpg,120,90,https://i.ytimg.com/vi/gUaYfsc8m14/mqdefault.jpg,320,180,https://i.ytimg.com/vi/gUaYfsc8m14/hqdefault.jpg,480,360,MBN Solutions,none,2026-01-07T07:00:44Z
3,youtube#searchResult,aScQ-bgf53FcDAYMv8LpoiaYEYQ,youtube#video,R1hsi3CqeEw,2026-01-06T15:37:44Z,UC8LpQpJIT39DLDJ9VR0yixg,Behind AI Implementation with The Head of AI at Atom Bank  #artificialintelligence #ai,"For this episode of A Class Act, Shannon sat down with Dr. Russell Collingham, Head of AI & Data Science at one of the UK's ...",https://i.ytimg.com/vi/R1hsi3CqeEw/default.jpg,120,90,https://i.ytimg.com/vi/R1hsi3CqeEw/mqdefault.jpg,320,180,https://i.ytimg.com/vi/R1hsi3CqeEw/hqdefault.jpg,480,360,MBN Solutions,none,2026-01-06T15:37:44Z
4,youtube#searchResult,E21yJQ7EcNg9YooawcQWd_B_x4E,youtube#video,qohg5c_IvTg,2025-12-10T09:35:00Z,UC8LpQpJIT39DLDJ9VR0yixg,Scaling &amp; Growing Applied AI teams: The Biggest Advice from Global AI Solutions Lead | Snorkel AI,"Listen to the full conversation: https://youtu.be/nGjx9egTk1U?si=YJ6-7RsKvlnKb4dC For this week's episode of A Class Act, MBN ...",https://i.ytimg.com/vi/qohg5c_IvTg/default.jpg,120,90,https://i.ytimg.com/vi/qohg5c_IvTg/mqdefault.jpg,320,180,https://i.ytimg.com/vi/qohg5c_IvTg/hqdefault.jpg,480,360,MBN Solutions,none,2025-12-10T09:35:00Z
0,youtube#searchResult,1YjecOj1mfYWSapp2M45YABQQ10,youtube#video,CrhYmP0x5ZM,2021-11-10T07:33:41Z,UC7ZVvEo7-B7lA6LY2MVX72A,CS885 Module 6: Inverse RL,The slides associated with this video are accessible on the course website: ...,https://i.ytimg.com/vi/CrhYmP0x5ZM/default.jpg,120,90,https://i.ytimg.com/vi/CrhYmP0x5ZM/mqdefault.jpg,320,180,https://i.ytimg.com/vi/CrhYmP0x5ZM/hqdefault.jpg,480,360,Pascal Poupart,none,2021-11-10T07:33:41Z
1,youtube#searchResult,O5nDw6zOhG1bNiA1RNFxydnW5GE,youtube#video,r-Yk6-jagDU,2021-10-13T00:17:31Z,UC7ZVvEo7-B7lA6LY2MVX72A,CS885 Module 5: Distributional RL,The slides associated with this video are accessible on the course web: ...,https://i.ytimg.com/vi/r-Yk6-jagDU/default.jpg,120,90,https://i.ytimg.com/vi/r-Yk6-jagDU/mqdefault.jpg,320,180,https://i.ytimg.com/vi/r-Yk6-jagDU/hqdefault.jpg,480,360,Pascal Poupart,none,2021-10-13T00:17:31Z
2,youtube#searchResult,Rts6C0KHTHuzRhdGpXsvjLrkt-c,youtube#video,96V9tWNFaS4,2021-10-06T06:13:12Z,UC7ZVvEo7-B7lA6LY2MVX72A,CS885 Module 4: Partially Observable Reinforcement Learning,The slides associated with this video are accessible on the course web: ...,https://i.ytimg.com/vi/96V9tWNFaS4/default.jpg,120,90,https://i.ytimg.com/vi/96V9tWNFaS4/mqdefault.jpg,320,180,https://i.ytimg.com/vi/96V9tWNFaS4/hqdefault.jpg,480,360,Pascal Poupart,none,2021-10-06T06:13:12Z
3,youtube#searchResult,XZZuh1TACq6T38vOzHBjxvx8sJk,youtube#video,G-8eUMNvPfI,2020-07-06T00:57:55Z,UC7ZVvEo7-B7lA6LY2MVX72A,CS885 Module 3: Imitation Learning,The slides associated with this video are accessible on the course web: ...,https://i.ytimg.com/vi/G-8eUMNvPfI/default.jpg,120,90,https://i.ytimg.com/vi/G-8eUMNvPfI/mqdefault.jpg,320,180,https://i.ytimg.com/vi/G-8eUMNvPfI/hqdefault.jpg,480,360,Pascal Poupart,none,2020-07-06T00:57:55Z
