,kind,etag,id.kind,id.videoId,snippet.publishedAt,snippet.channelId,snippet.title,snippet.description,snippet.thumbnails.default.url,snippet.thumbnails.default.width,snippet.thumbnails.default.height,snippet.thumbnails.medium.url,snippet.thumbnails.medium.width,snippet.thumbnails.medium.height,snippet.thumbnails.high.url,snippet.thumbnails.high.width,snippet.thumbnails.high.height,snippet.channelTitle,snippet.liveBroadcastContent,snippet.publishTime
1,youtube#searchResult,wS1jWA-MotT8BPP6xkaYlY8kw7E,youtube#video,8LjK4knsTRQ,2021-05-10T09:09:31Z,UC6HfeAa0vWeSWS6IcNAjZ2A,Customizing MobileNetV2 through transfer learning using Keras and Python [Part 4],See https://python.cogsci.nl for code and written tutorials.) This is the fourth of a series of video tutorials about deep learning with Keras in Python. Here I show ...,https://i.ytimg.com/vi/8LjK4knsTRQ/default.jpg,120,90,https://i.ytimg.com/vi/8LjK4knsTRQ/mqdefault.jpg,320,180,https://i.ytimg.com/vi/8LjK4knsTRQ/hqdefault.jpg,480,360,Sebastiaan MathÃ´t,none,2021-05-10T09:09:31Z
2,youtube#searchResult,hFhQmeT2PnXIyqLYeqaJR15k5CQ,youtube#video,XBc3kbel7XY,2021-05-10T09:09:31Z,UC6HfeAa0vWeSWS6IcNAjZ2A,Building your first neural network with Keras and Python [Part 2],See https://python.cogsci.nl for code and written tutorials.) This is the second of a series of video tutorials about deep learning with Keras in Python. Here I show ...,https://i.ytimg.com/vi/XBc3kbel7XY/default.jpg,120,90,https://i.ytimg.com/vi/XBc3kbel7XY/mqdefault.jpg,320,180,https://i.ytimg.com/vi/XBc3kbel7XY/hqdefault.jpg,480,360,Sebastiaan MathÃ´t,none,2021-05-10T09:09:31Z
3,youtube#searchResult,EwWUtlGGaL0E7PYxivkOMV0ljlQ,youtube#video,rmNTqYGpr6Y,2021-05-10T09:09:31Z,UC6HfeAa0vWeSWS6IcNAjZ2A,Introduction to deep learning with Python and Keras [Part 1],See https://python.cogsci.nl for code and written tutorials.) This is the first of a series of video tutorials about deep learning with Keras in Python. Here I introduce ...,https://i.ytimg.com/vi/rmNTqYGpr6Y/default.jpg,120,90,https://i.ytimg.com/vi/rmNTqYGpr6Y/mqdefault.jpg,320,180,https://i.ytimg.com/vi/rmNTqYGpr6Y/hqdefault.jpg,480,360,Sebastiaan MathÃ´t,none,2021-05-10T09:09:31Z
4,youtube#searchResult,dRizHKedTYiMVnkBvj5CGUZW_00,youtube#video,1au5WA9xWsk,2021-01-03T12:43:51Z,UC6HfeAa0vWeSWS6IcNAjZ2A,The basics of object-oriented programming in Python [pt. 1],"In this video, the first of a three-part series about object-oriented programming in Python, I explain the basic terminology related to object-oriented programming ...",https://i.ytimg.com/vi/1au5WA9xWsk/default.jpg,120,90,https://i.ytimg.com/vi/1au5WA9xWsk/mqdefault.jpg,320,180,https://i.ytimg.com/vi/1au5WA9xWsk/hqdefault.jpg,480,360,Sebastiaan MathÃ´t,none,2021-01-03T12:43:51Z
0,youtube#searchResult,D0jYirg93IdrD-gqYhkGHnA8sI4,youtube#video,WY0KXynkpSA,2021-08-26T20:44:10Z,UCDVL0bPrZHwCeJrlyy-wxaQ,Dialogflow and Data Studio for Chatbot,"In this session, we'll showcase Google Dialog Flow and DataStudio for Chatbots to improve business insight. Attendees will learn how to build chatbots in ...",https://i.ytimg.com/vi/WY0KXynkpSA/default.jpg,120,90,https://i.ytimg.com/vi/WY0KXynkpSA/mqdefault.jpg,320,180,https://i.ytimg.com/vi/WY0KXynkpSA/hqdefault.jpg,480,360,Global AI Community,none,2021-08-26T20:44:10Z
1,youtube#searchResult,CHg4SBBrOfXnhUtK7njDQ9WBMhc,youtube#video,rn-F5wPjE34,2021-08-18T08:00:12Z,UCDVL0bPrZHwCeJrlyy-wxaQ,AI in Sports,"It is evident that Artificial Intelligence is already making a big difference in many industries and sports is no different. From footy to cricket to Formula 1, Artificial ...",https://i.ytimg.com/vi/rn-F5wPjE34/default.jpg,120,90,https://i.ytimg.com/vi/rn-F5wPjE34/mqdefault.jpg,320,180,https://i.ytimg.com/vi/rn-F5wPjE34/hqdefault.jpg,480,360,Global AI Community,none,2021-08-18T08:00:12Z
2,youtube#searchResult,-SDn70xc2FSPv04JqKfZXYJ_f6w,youtube#video,N8pFQqwxEqY,2021-07-29T20:56:17Z,UCDVL0bPrZHwCeJrlyy-wxaQ,End to end Machine Learning with Vertex AI,"In this session, we'll showcase Google Cloud's new unified AI platform: Vertex AI. Attendees will learn how to build and deploy ML models faster, and at scale, ...",https://i.ytimg.com/vi/N8pFQqwxEqY/default.jpg,120,90,https://i.ytimg.com/vi/N8pFQqwxEqY/mqdefault.jpg,320,180,https://i.ytimg.com/vi/N8pFQqwxEqY/hqdefault.jpg,480,360,Global AI Community,none,2021-07-29T20:56:17Z
3,youtube#searchResult,0jwBMbchtYbB3JZN2zA9PAt3Eo0,youtube#video,uQcWYKTGoY0,2021-07-28T08:00:13Z,UCDVL0bPrZHwCeJrlyy-wxaQ,AI in Code,"Artificial Intelligence is continuously changing the way we interact, shop and work. From intelligent reminders to the recommender systems to forecasting of ...",https://i.ytimg.com/vi/uQcWYKTGoY0/default.jpg,120,90,https://i.ytimg.com/vi/uQcWYKTGoY0/mqdefault.jpg,320,180,https://i.ytimg.com/vi/uQcWYKTGoY0/hqdefault.jpg,480,360,Global AI Community,none,2021-07-28T08:00:13Z
4,youtube#searchResult,EgasuqrFnNBXoV6_NLNeDeAsUiw,youtube#video,L9q4p7Y8TCs,2021-07-01T04:10:51Z,UCDVL0bPrZHwCeJrlyy-wxaQ,How to turn your passion in AI into your career,Before the summer break we would like to have a panel discussion and we would like to invite you to contribute to the discussion with your questions. The topic ...,https://i.ytimg.com/vi/L9q4p7Y8TCs/default.jpg,120,90,https://i.ytimg.com/vi/L9q4p7Y8TCs/mqdefault.jpg,320,180,https://i.ytimg.com/vi/L9q4p7Y8TCs/hqdefault.jpg,480,360,Global AI Community,none,2021-07-01T04:10:51Z
0,youtube#searchResult,tgS0Y9wiGWLxLQj-pCyzBAucQqk,youtube#video,3Anx7csWSkc,2021-05-11T19:58:20Z,UCxArXLI-gxlTmWGGgec5D7w,Dictionaries in Julia -Learn Julia 9/n-,What is a dictionary? In which context they are used? What are their benefits? Let's talk about Dictionaries in this video! You'll learn what are dictionaries and ...,https://i.ytimg.com/vi/3Anx7csWSkc/default.jpg,120,90,https://i.ytimg.com/vi/3Anx7csWSkc/mqdefault.jpg,320,180,https://i.ytimg.com/vi/3Anx7csWSkc/hqdefault.jpg,480,360,RÃ©mi Vezy,none,2021-05-11T19:58:20Z
1,youtube#searchResult,NuKXkIiEntbFnzjuavUvmlJM7mY,youtube#video,pYTw1LGbRm0,2021-04-19T22:22:10Z,UCxArXLI-gxlTmWGGgec5D7w,Tuples in Julia -Learn Julia 8/n-,What is a tuple? In which context they are used? What are their benefits? Let's talk about Tuples in this video! You'll learn what are tuples and how can we use ...,https://i.ytimg.com/vi/pYTw1LGbRm0/default.jpg,120,90,https://i.ytimg.com/vi/pYTw1LGbRm0/mqdefault.jpg,320,180,https://i.ytimg.com/vi/pYTw1LGbRm0/hqdefault.jpg,480,360,RÃ©mi Vezy,none,2021-04-19T22:22:10Z
2,youtube#searchResult,6wA8GFO3CkEH4R9VIB7QNh9Bems,youtube#video,VKjIRDBk6qo,2021-04-01T20:10:17Z,UCxArXLI-gxlTmWGGgec5D7w,Arrays in Julia -Learn Julia 7/n-,"What is an array? How to make a vector, a matrix or a tensor in Julia? Let's talk about it! You'll learn what are arrays and how can we use them: create, index, ...",https://i.ytimg.com/vi/VKjIRDBk6qo/default.jpg,120,90,https://i.ytimg.com/vi/VKjIRDBk6qo/mqdefault.jpg,320,180,https://i.ytimg.com/vi/VKjIRDBk6qo/hqdefault.jpg,480,360,RÃ©mi Vezy,none,2021-04-01T20:10:17Z
3,youtube#searchResult,eYuv2Jtdi6yRoEIk33jc20W2xoA,youtube#video,Jip2Ym5DsxQ,2021-02-23T20:39:24Z,UCxArXLI-gxlTmWGGgec5D7w,Julia variables and basic types -Learn Julia 6/n-,"What is a variable? What is a Float64? Let's talk about all that in this video! You'll learn what are variables, how can you use them, what are the basic types in ...",https://i.ytimg.com/vi/Jip2Ym5DsxQ/default.jpg,120,90,https://i.ytimg.com/vi/Jip2Ym5DsxQ/mqdefault.jpg,320,180,https://i.ytimg.com/vi/Jip2Ym5DsxQ/hqdefault.jpg,480,360,RÃ©mi Vezy,none,2021-02-23T20:39:24Z
4,youtube#searchResult,IIxKsdAu60F0OTNAiKAy3B44TWA,youtube#video,8NyjzlsOFuc,2021-01-27T20:42:42Z,UCxArXLI-gxlTmWGGgec5D7w,Getting help in Julia -Learn Julia 5/n-,Those red words on the REPL are not the end of the world! There are lots of ways to get past this little disappointment. Watch this video and you'll learn how you ...,https://i.ytimg.com/vi/8NyjzlsOFuc/default.jpg,120,90,https://i.ytimg.com/vi/8NyjzlsOFuc/mqdefault.jpg,320,180,https://i.ytimg.com/vi/8NyjzlsOFuc/hqdefault.jpg,480,360,RÃ©mi Vezy,none,2021-01-27T20:42:42Z
0,youtube#searchResult,RXHmzLI7Vgjb17_DXjeasT0Z2z8,youtube#video,MJfnamMFylo,2021-08-18T02:31:08Z,UCupQLyNchb9-2Z5lmUOIijw,"14L â€“ Lagrangian backpropagation, final project winners, and Q&amp;A session",Course website: http://bit.ly/DLSP21-home Playlist: http://bit.ly/DLSP21-YouTube Speaker: Yann LeCun Chapters 00:00:00 â€“ Welcome to class.,https://i.ytimg.com/vi/MJfnamMFylo/default.jpg,120,90,https://i.ytimg.com/vi/MJfnamMFylo/mqdefault.jpg,320,180,https://i.ytimg.com/vi/MJfnamMFylo/hqdefault.jpg,480,360,Alfredo Canziani,none,2021-08-18T02:31:08Z
1,youtube#searchResult,Vjemob750izm4uMISrOVdH5fmiw,youtube#video,n1w5b5rTFv0,2021-08-18T02:24:42Z,UCupQLyNchb9-2Z5lmUOIijw,13L â€“ Optimisation for Deep Learning,Course website: http://bit.ly/DLSP21-home Playlist: http://bit.ly/DLSP21-YouTube Speaker: Yann LeCun Chapters 00:00:00 â€“ Welcome to class.,https://i.ytimg.com/vi/n1w5b5rTFv0/default.jpg,120,90,https://i.ytimg.com/vi/n1w5b5rTFv0/mqdefault.jpg,320,180,https://i.ytimg.com/vi/n1w5b5rTFv0/hqdefault.jpg,480,360,Alfredo Canziani,none,2021-08-18T02:24:42Z
2,youtube#searchResult,4rnSiq9RA7LVsJDtLajgrKFxGW8,youtube#video,AOFUZZZ6KyU,2021-08-12T03:28:15Z,UCupQLyNchb9-2Z5lmUOIijw,"07L â€“ PCA, AE, K-means, Gaussian mixture model, sparse coding, and intuitive VAE",Course website: http://bit.ly/DLSP21-home Playlist: http://bit.ly/DLSP21-YouTube Speaker: Yann LeCun Chapters 00:00:00 â€“ Welcome to class.,https://i.ytimg.com/vi/AOFUZZZ6KyU/default.jpg,120,90,https://i.ytimg.com/vi/AOFUZZZ6KyU/mqdefault.jpg,320,180,https://i.ytimg.com/vi/AOFUZZZ6KyU/hqdefault.jpg,480,360,Alfredo Canziani,none,2021-08-12T03:28:15Z
3,youtube#searchResult,4cWJiJz2nDprVNC__ZjUunNDTOA,youtube#video,AQtPoDnauq4,2021-08-12T02:50:27Z,UCupQLyNchb9-2Z5lmUOIijw,"09L â€“ Differentiable associative memories, attention, and transformers",Course website: http://bit.ly/DLSP21-home Playlist: http://bit.ly/DLSP21-YouTube Speaker: Yann LeCun Chapters 00:00:00 â€“ Welcome to class.,https://i.ytimg.com/vi/AQtPoDnauq4/default.jpg,120,90,https://i.ytimg.com/vi/AQtPoDnauq4/mqdefault.jpg,320,180,https://i.ytimg.com/vi/AQtPoDnauq4/hqdefault.jpg,480,360,Alfredo Canziani,none,2021-08-12T02:50:27Z
4,youtube#searchResult,k2zBMDnGy1EjHMLjokce5htFvCs,youtube#video,bdebHVF__mo,2021-08-12T02:51:38Z,UCupQLyNchb9-2Z5lmUOIijw,08L â€“ Self-supervised learning and variational inference,Course website: http://bit.ly/DLSP21-home Playlist: http://bit.ly/DLSP21-YouTube Speaker: Yann LeCun Chapters 00:00:00 â€“ Welcome to class.,https://i.ytimg.com/vi/bdebHVF__mo/default.jpg,120,90,https://i.ytimg.com/vi/bdebHVF__mo/mqdefault.jpg,320,180,https://i.ytimg.com/vi/bdebHVF__mo/hqdefault.jpg,480,360,Alfredo Canziani,none,2021-08-12T02:51:38Z
0,youtube#searchResult,8in3XGKEHOQS7VGeQ54qHrNMLc4,youtube#video,vCqMCIdIHGo,2019-10-01T12:29:58Z,UCBEShbs7rtE_ZjTmb6Jt5WA,PROGRAM TO FIND FACTORIAL OF GIVEN NUMBER,DURecorder This is my video recorded with DU Recorder. It's easy to record your screen and livestream. Download link: Android: https://goo.gl/s9D6Mf iOS: ...,https://i.ytimg.com/vi/vCqMCIdIHGo/default.jpg,120,90,https://i.ytimg.com/vi/vCqMCIdIHGo/mqdefault.jpg,320,180,https://i.ytimg.com/vi/vCqMCIdIHGo/hqdefault.jpg,480,360,Real Python,none,2019-10-01T12:29:58Z
1,youtube#searchResult,7tL_bDIKJqKua7rVi5LiBH3faZk,youtube#video,TUlTY9GnKXE,2019-10-01T12:16:53Z,UCBEShbs7rtE_ZjTmb6Jt5WA,PYTHON PROGRAM TO PRINT REVERSE OF A NUMBER,,https://i.ytimg.com/vi/TUlTY9GnKXE/default.jpg,120,90,https://i.ytimg.com/vi/TUlTY9GnKXE/mqdefault.jpg,320,180,https://i.ytimg.com/vi/TUlTY9GnKXE/hqdefault.jpg,480,360,Real Python,none,2019-10-01T12:16:53Z
0,youtube#searchResult,LoArqqGKXvBgvNCj0wqH4jTCtGY,youtube#video,9Xm4Xv0HMxw,2021-08-22T17:00:03Z,UC9IuUwwE2xdjQUT_LMLONoA,An Introduction to DiffEq.jl and Solving Scalar Equations | Stephan Sahm  | Julia Munich User Group,Part of the Julia Munich User Group meetup from April 2021. Link to GitHub repo: https://github.com/schlichtanders/fall-in-love-with-julia 00:00 Welcome! 00:10 ...,https://i.ytimg.com/vi/9Xm4Xv0HMxw/default.jpg,120,90,https://i.ytimg.com/vi/9Xm4Xv0HMxw/mqdefault.jpg,320,180,https://i.ytimg.com/vi/9Xm4Xv0HMxw/hqdefault.jpg,480,360,The Julia Programming Language,none,2021-08-22T17:00:03Z
1,youtube#searchResult,jd0eqNfIss0WrQMhqKWp13O-yYc,youtube#video,SMJ0TY_RSo4,2021-08-21T22:00:31Z,UC9IuUwwE2xdjQUT_LMLONoA,What&#39;s new in ITensors.jl | Matthew Fishman | JuliaCon2021,This poster was presented at JuliaCon2021. Tensor networks encapsulate a large class of low rank decompositions of very high order -- potentially infinite order ...,https://i.ytimg.com/vi/SMJ0TY_RSo4/default.jpg,120,90,https://i.ytimg.com/vi/SMJ0TY_RSo4/mqdefault.jpg,320,180,https://i.ytimg.com/vi/SMJ0TY_RSo4/hqdefault.jpg,480,360,The Julia Programming Language,none,2021-08-21T22:00:31Z
2,youtube#searchResult,xc2nI9kqJqsEolDm21Hj_HdPZ5c,youtube#video,0DizdxCSNms,2021-08-21T19:11:12Z,UC9IuUwwE2xdjQUT_LMLONoA,Web Apps with Genie.jl | Adrian Salceanu | Julia Munich User Group March 2021,"Learn more about Genie.jl with the creator fo the popular web development framework in Julia! For more info on the Julia Programming Language, follow us on ...",https://i.ytimg.com/vi/0DizdxCSNms/default.jpg,120,90,https://i.ytimg.com/vi/0DizdxCSNms/mqdefault.jpg,320,180,https://i.ytimg.com/vi/0DizdxCSNms/hqdefault.jpg,480,360,The Julia Programming Language,none,2021-08-21T19:11:12Z
3,youtube#searchResult,rlVF0bjFCF7pnjltGoNeG6wl3FY,youtube#video,S71YIZ8e7MQ,2021-04-26T18:18:55Z,UC9IuUwwE2xdjQUT_LMLONoA,Libraries &amp; parameterized types | MIT Computational Thinking Spring 2021 | Lecture 18,"For more info on the Julia Programming Language, follow us on Twitter: https://twitter.com/JuliaLanguage.",https://i.ytimg.com/vi/S71YIZ8e7MQ/default.jpg,120,90,https://i.ytimg.com/vi/S71YIZ8e7MQ/mqdefault.jpg,320,180,https://i.ytimg.com/vi/S71YIZ8e7MQ/hqdefault.jpg,480,360,The Julia Programming Language,none,2021-04-26T18:18:55Z
4,youtube#searchResult,h_4Qy3zdul8Wmagh5-0jILWRAL8,youtube#video,3Y5gVyO8KcI,2021-04-21T18:05:54Z,UC9IuUwwE2xdjQUT_LMLONoA,Time stepping and differential equations | MIT Computational Thinking Spring 2021 | Lecture 17,"For more info on the Julia Programming Language, follow us on Twitter: https://twitter.com/JuliaLanguage.",https://i.ytimg.com/vi/3Y5gVyO8KcI/default.jpg,120,90,https://i.ytimg.com/vi/3Y5gVyO8KcI/mqdefault.jpg,320,180,https://i.ytimg.com/vi/3Y5gVyO8KcI/hqdefault.jpg,480,360,The Julia Programming Language,none,2021-04-21T18:05:54Z
0,youtube#searchResult,MKV0YL4RhTumqSgzj0fiED4Gikk,youtube#video,qxQa1-xwmX4,2021-01-25T20:36:47Z,UC12LqyqTQYbXatYS9AA7Nuw,DTEL5 5 1 Introduction,"In this video, we go over topics for this lecture: Boosting technique, gradient boosting and some well-known libraries such as XGBoost, LightGBM and CatBoost.",https://i.ytimg.com/vi/qxQa1-xwmX4/default.jpg,120,90,https://i.ytimg.com/vi/qxQa1-xwmX4/mqdefault.jpg,320,180,https://i.ytimg.com/vi/qxQa1-xwmX4/hqdefault.jpg,480,360,Machine Learning University,none,2021-01-25T20:36:47Z
1,youtube#searchResult,4KIyMt6C3hq1aZcuQ8Q62f8Zjxc,youtube#video,668Yj2sgQo4,2021-01-25T20:36:47Z,UC12LqyqTQYbXatYS9AA7Nuw,DTEL5 5 6 CatBoost,Here is our last gradient boosting method: CatBoost. Main contribution of this method is the ordering principle. We introduce ordered target encoding and ...,https://i.ytimg.com/vi/668Yj2sgQo4/default.jpg,120,90,https://i.ytimg.com/vi/668Yj2sgQo4/mqdefault.jpg,320,180,https://i.ytimg.com/vi/668Yj2sgQo4/hqdefault.jpg,480,360,Machine Learning University,none,2021-01-25T20:36:47Z
2,youtube#searchResult,cHJOKEJKiUQ9O4D0iQZVxQc6s2c,youtube#video,RGR1BL4WEe0,2021-01-25T20:36:47Z,UC12LqyqTQYbXatYS9AA7Nuw,DTEL5 5 4 XGBoost,"In this video, we introduce the XGBoost method. This method uses gradient boosting with some improvements. We talk about the approximate greedy method ...",https://i.ytimg.com/vi/RGR1BL4WEe0/default.jpg,120,90,https://i.ytimg.com/vi/RGR1BL4WEe0/mqdefault.jpg,320,180,https://i.ytimg.com/vi/RGR1BL4WEe0/hqdefault.jpg,480,360,Machine Learning University,none,2021-01-25T20:36:47Z
3,youtube#searchResult,jQxonwyNmJOM_kpNK7eW8KOZcfs,youtube#video,zGp6X6rLhQ0,2021-01-25T20:36:47Z,UC12LqyqTQYbXatYS9AA7Nuw,DTEL5 5 2 Boosting,"Let's start with the boosting technique. Boosting is an ensemble technique that adds weak models in a sequential manner. Overall, we get a powerful model out ...",https://i.ytimg.com/vi/zGp6X6rLhQ0/default.jpg,120,90,https://i.ytimg.com/vi/zGp6X6rLhQ0/mqdefault.jpg,320,180,https://i.ytimg.com/vi/zGp6X6rLhQ0/hqdefault.jpg,480,360,Machine Learning University,none,2021-01-25T20:36:47Z
4,youtube#searchResult,Ec5RrtPdvSdQENHiGVYVvZRF-qM,youtube#video,NsCdkzi2soE,2021-01-25T20:36:47Z,UC12LqyqTQYbXatYS9AA7Nuw,DTEL5 5 5 LightGBM,LightGBM is another important gradient boosting method. We talk about two main contributions of this method: Gradient-based One-Side Sampling and ...,https://i.ytimg.com/vi/NsCdkzi2soE/default.jpg,120,90,https://i.ytimg.com/vi/NsCdkzi2soE/mqdefault.jpg,320,180,https://i.ytimg.com/vi/NsCdkzi2soE/hqdefault.jpg,480,360,Machine Learning University,none,2021-01-25T20:36:47Z
0,youtube#searchResult,PlFu2zbK-CeJ_9yONJU5zuFt_U8,youtube#video,Byh-HityBIM,2021-08-27T20:52:26Z,UCX6b17PVsYBQ0ip5gyeme-Q,The Underground Railroad: Crash Course Black American History #15,Escape was one of the many ways that enslaved people resisted their captivity in the system of American slavery. The Underground Railroad was not literally a ...,https://i.ytimg.com/vi/Byh-HityBIM/default.jpg,120,90,https://i.ytimg.com/vi/Byh-HityBIM/mqdefault.jpg,320,180,https://i.ytimg.com/vi/Byh-HityBIM/hqdefault.jpg,480,360,CrashCourse,none,2021-08-27T20:52:26Z
1,youtube#searchResult,HVdlMiysKPJEC8siwe95w5_c8LQ,youtube#video,oi3bcICQd40,2021-08-26T16:00:03Z,UCX6b17PVsYBQ0ip5gyeme-Q,Retrosynthesis and Liquid-Liquid Extraction: Crash Course Organic Chemistry #34,"As we construct more complex organic molecules, it can start to feel like decrypting a complex code. Organic synthesis takes simple starting materials, and turns ...",https://i.ytimg.com/vi/oi3bcICQd40/default.jpg,120,90,https://i.ytimg.com/vi/oi3bcICQd40/mqdefault.jpg,320,180,https://i.ytimg.com/vi/oi3bcICQd40/hqdefault.jpg,480,360,CrashCourse,none,2021-08-26T16:00:03Z
2,youtube#searchResult,RdNudaX08DMEHkwUQmPn2GwQ2Ig,youtube#video,HDvS2rQZXMc,2021-08-23T19:00:04Z,UCX6b17PVsYBQ0ip5gyeme-Q,Why Does Jakarta Flood So Easily? Crash Course Geography #24,"Today we're going to talk about how and why floods happen both in spite of, and because of, us. Specifically, we'll take a closer look at the island of Java, and its ...",https://i.ytimg.com/vi/HDvS2rQZXMc/default.jpg,120,90,https://i.ytimg.com/vi/HDvS2rQZXMc/mqdefault.jpg,320,180,https://i.ytimg.com/vi/HDvS2rQZXMc/hqdefault.jpg,480,360,CrashCourse,none,2021-08-23T19:00:04Z
3,youtube#searchResult,EIjeSqOqwCW4Aquy9wC6JhTeqqg,youtube#video,83eJfEFFZ74,2021-08-13T23:26:56Z,UCX6b17PVsYBQ0ip5gyeme-Q,The Rise of Cotton: Crash Course Black American History #13,"Cotton is everywhere in our modern world, and it became a hugely important crop in the 19th century United States. Cotton was a huge economic boon to the US ...",https://i.ytimg.com/vi/83eJfEFFZ74/default.jpg,120,90,https://i.ytimg.com/vi/83eJfEFFZ74/mqdefault.jpg,320,180,https://i.ytimg.com/vi/83eJfEFFZ74/hqdefault.jpg,480,360,CrashCourse,none,2021-08-13T23:26:56Z
4,youtube#searchResult,jFjIpYaBLoKLqTj8Qmb5z-1ueuU,youtube#video,gu9RIGGXeNo,2021-05-29T15:23:56Z,UCX6b17PVsYBQ0ip5gyeme-Q,Slave Codes: Crash Course Black American History #4,Slave codes were a method of protecting the investment of white enslavers in the Colonies by restricting the lives of enslaved people in almost every imaginable ...,https://i.ytimg.com/vi/gu9RIGGXeNo/default.jpg,120,90,https://i.ytimg.com/vi/gu9RIGGXeNo/mqdefault.jpg,320,180,https://i.ytimg.com/vi/gu9RIGGXeNo/hqdefault.jpg,480,360,CrashCourse,none,2021-05-29T15:23:56Z
0,youtube#searchResult,UgCLFh5mwTOMUMb_nXzXPgeAGWQ,youtube#video,U5OD8MjYnOM,2021-08-29T17:41:21Z,UCSHZKyawb77ixDdsGog4iWA,"Wojciech Zaremba: OpenAI Codex, GPT-3, Robotics, and the Future of AI | Lex Fridman Podcast #215",Wojciech Zaremba is a co-founder of OpenAI. Please support this podcast by checking out our sponsors: - Paperspace: https://gradient.run/lex to get $15 credit ...,https://i.ytimg.com/vi/U5OD8MjYnOM/default.jpg,120,90,https://i.ytimg.com/vi/U5OD8MjYnOM/mqdefault.jpg,320,180,https://i.ytimg.com/vi/U5OD8MjYnOM/hqdefault.jpg,480,360,Lex Fridman,none,2021-08-29T17:41:21Z
1,youtube#searchResult,0Vk3S9oKau7K57Vl4BWx8E8r8yM,youtube#video,hwYzrSF9unk,2021-08-28T22:07:16Z,UCSHZKyawb77ixDdsGog4iWA,Andrew Huberman&#39;s first jiu jitsu class with Lex Fridman,Andrew Huberman took his first jiu jitsu class with me at 10th Planet Austin while visiting. It was great to see a world-class scientist like Andrew humbly take on a ...,https://i.ytimg.com/vi/hwYzrSF9unk/default.jpg,120,90,https://i.ytimg.com/vi/hwYzrSF9unk/mqdefault.jpg,320,180,https://i.ytimg.com/vi/hwYzrSF9unk/hqdefault.jpg,480,360,Lex Fridman,none,2021-08-28T22:07:16Z
2,youtube#searchResult,Mu5k8hj0kpflQ9N6UR7dU65REwY,youtube#video,TRdL6ZzWBS0,2021-08-27T21:12:28Z,UCSHZKyawb77ixDdsGog4iWA,Jed Buchwald: Isaac Newton and the Philosophy of Science | Lex Fridman Podcast #214,Jed Buchwald is a historian and philosopher of science at Caltech. Please support this podcast by checking out our sponsors: - GiveWell: ...,https://i.ytimg.com/vi/TRdL6ZzWBS0/default.jpg,120,90,https://i.ytimg.com/vi/TRdL6ZzWBS0/mqdefault.jpg,320,180,https://i.ytimg.com/vi/TRdL6ZzWBS0/hqdefault.jpg,480,360,Lex Fridman,none,2021-08-27T21:12:28Z
3,youtube#searchResult,dB4G2fuFGyeX-VZCRTPtWjD8IaY,youtube#video,J48bm21q8_A,2021-08-23T19:19:46Z,UCSHZKyawb77ixDdsGog4iWA,Barry Barish: Gravitational Waves and the Most Precise Device Ever Built | Lex Fridman Podcast #213,Barry Barish is a theoretical physicist at Caltech and the winner of the Nobel Prize in Physics. Please support this podcast by checking out our sponsors: ...,https://i.ytimg.com/vi/J48bm21q8_A/default.jpg,120,90,https://i.ytimg.com/vi/J48bm21q8_A/mqdefault.jpg,320,180,https://i.ytimg.com/vi/J48bm21q8_A/hqdefault.jpg,480,360,Lex Fridman,none,2021-08-23T19:19:46Z
4,youtube#searchResult,jCjuYex7JdIvMnuUOj53hJQ8Xe8,youtube#video,rIpUf-Vy2JA,2021-08-21T23:55:50Z,UCSHZKyawb77ixDdsGog4iWA,"Joscha Bach: Nature of Reality, Dreams, and Consciousness | Lex Fridman Podcast #212","Joscha Bach is a cognitive scientist, AI researcher, and philosopher. Please support this podcast by checking out our sponsors: - Coinbase: ...",https://i.ytimg.com/vi/rIpUf-Vy2JA/default.jpg,120,90,https://i.ytimg.com/vi/rIpUf-Vy2JA/mqdefault.jpg,320,180,https://i.ytimg.com/vi/rIpUf-Vy2JA/hqdefault.jpg,480,360,Lex Fridman,none,2021-08-21T23:55:50Z
0,youtube#searchResult,z0gf3mMBAcBYbRConQN_NJglQGU,youtube#video,VJYoVp5GDBY,2021-08-30T07:00:06Z,UCRbKmV_XYB7C12SPBokLVHQ,Data Science Pronto! - Bagging and Boosting,What is the difference between bagging and boosting? A short answer by Satoru Hayasaka.,https://i.ytimg.com/vi/VJYoVp5GDBY/default.jpg,120,90,https://i.ytimg.com/vi/VJYoVp5GDBY/mqdefault.jpg,320,180,https://i.ytimg.com/vi/VJYoVp5GDBY/hqdefault.jpg,480,360,KNIMETV,none,2021-08-30T07:00:06Z
1,youtube#searchResult,uonbxkzHhZNGScfkQDqAm2mFCDc,youtube#video,Av6IxcH7dKk,2021-08-27T10:07:24Z,UCRbKmV_XYB7C12SPBokLVHQ,The CSV Reader Node,"This video shows how to read CSV files and other text based files with the CSV Reader node. It explains how to specify the structure of the CSV file, such as the ...",https://i.ytimg.com/vi/Av6IxcH7dKk/default.jpg,120,90,https://i.ytimg.com/vi/Av6IxcH7dKk/mqdefault.jpg,320,180,https://i.ytimg.com/vi/Av6IxcH7dKk/hqdefault.jpg,480,360,KNIMETV,none,2021-08-27T10:07:24Z
2,youtube#searchResult,Vp9UrkIRmB56oQqX3n-Px3uVICU,youtube#video,vyJXSP1e_LI,2021-08-27T10:07:36Z,UCRbKmV_XYB7C12SPBokLVHQ,The Excel Reader Node,"This video shows how to read Excel files in KNIME. It shows how to read a specific sheet, or a range of the sheet, and how to handle empty rows, hidden ...",https://i.ytimg.com/vi/vyJXSP1e_LI/default.jpg,120,90,https://i.ytimg.com/vi/vyJXSP1e_LI/mqdefault.jpg,320,180,https://i.ytimg.com/vi/vyJXSP1e_LI/hqdefault.jpg,480,360,KNIMETV,none,2021-08-27T10:07:36Z
3,youtube#searchResult,5AfN1Yvt16RypZeSh_BcpbWQ8m8,youtube#video,5OgFBwuG_4A,2021-08-27T10:07:49Z,UCRbKmV_XYB7C12SPBokLVHQ,Path Data Type and Flow Variable,"This video introduces the â€œPathâ€, which is the dedicated data type and flow variable for file and folder locations. The video explains the different parts of a Path, ...",https://i.ytimg.com/vi/5OgFBwuG_4A/default.jpg,120,90,https://i.ytimg.com/vi/5OgFBwuG_4A/mqdefault.jpg,320,180,https://i.ytimg.com/vi/5OgFBwuG_4A/hqdefault.jpg,480,360,KNIMETV,none,2021-08-27T10:07:49Z
4,youtube#searchResult,eVflXorpkn7F6hEIlFMAny5XJD4,youtube#video,Dxl6077zUTg,2021-06-09T12:50:13Z,UCRbKmV_XYB7C12SPBokLVHQ,Vom EinzelkÃ¤mpfer zur cross-funktionalen User Group,Ingo Geisel - Internetstores GmbH.,https://i.ytimg.com/vi/Dxl6077zUTg/default.jpg,120,90,https://i.ytimg.com/vi/Dxl6077zUTg/mqdefault.jpg,320,180,https://i.ytimg.com/vi/Dxl6077zUTg/hqdefault.jpg,480,360,KNIMETV,none,2021-06-09T12:50:13Z
0,youtube#searchResult,7-51_Z3jlaKO-6sBg3t5EizDPhM,youtube#video,tjUL1a61EQQ,2021-07-29T15:30:13Z,UCmKaoNn0OvxVAe7f_8sXYNQ,AMA with Aditya Prasad | Lead Data Scientist at Dream11,"We are excited to bring this AMA with Aditya Prasad, Lead Data Scientist at Dream 11. About The Speaker Aditya Prasad Narisetty is the Lead Data Scientist ...",https://i.ytimg.com/vi/tjUL1a61EQQ/default.jpg,120,90,https://i.ytimg.com/vi/tjUL1a61EQQ/mqdefault.jpg,320,180,https://i.ytimg.com/vi/tjUL1a61EQQ/hqdefault.jpg,480,360,Jovian,none,2021-07-29T15:30:13Z
