,kind,etag,id.kind,id.videoId,snippet.publishedAt,snippet.channelId,snippet.title,snippet.description,snippet.thumbnails.default.url,snippet.thumbnails.default.width,snippet.thumbnails.default.height,snippet.thumbnails.medium.url,snippet.thumbnails.medium.width,snippet.thumbnails.medium.height,snippet.thumbnails.high.url,snippet.thumbnails.high.width,snippet.thumbnails.high.height,snippet.channelTitle,snippet.liveBroadcastContent,snippet.publishTime
1,youtube#searchResult,tFAj29ViZuzD8DFOhaPCiJ1yAvw,youtube#video,9K1I7Tmwk-s,2023-10-18T11:38:45Z,UCYuxbq0trkgoaoN72eJi8dA,Join us for the DATA festival #online in November 2023!,DATA.PEOPLE.EVERYWHERE. Be a part of #DATAfestivalonline - all info & free tickets here: https://data-festival.com/,https://i.ytimg.com/vi/9K1I7Tmwk-s/default.jpg,120,90,https://i.ytimg.com/vi/9K1I7Tmwk-s/mqdefault.jpg,320,180,https://i.ytimg.com/vi/9K1I7Tmwk-s/hqdefault.jpg,480,360,DATA festival,none,2023-10-18T11:38:45Z
2,youtube#searchResult,FiP_cZ2BHWKD367R37yRmhaKmJE,youtube#video,O5J1d9p2VG0,2023-06-16T13:04:39Z,UCYuxbq0trkgoaoN72eJi8dA,DATA festival #Munich 2023 - Aftermovie,Join us on November 14th - 15th 2023 for #DATAfestivalonline! Get your free ticket here: ...,https://i.ytimg.com/vi/O5J1d9p2VG0/default.jpg,120,90,https://i.ytimg.com/vi/O5J1d9p2VG0/mqdefault.jpg,320,180,https://i.ytimg.com/vi/O5J1d9p2VG0/hqdefault.jpg,480,360,DATA festival,none,2023-06-16T13:04:39Z
3,youtube#searchResult,1xdvkiaIr-wVAjFWVj9fvO_Xj78,youtube#video,GhqqKd9rYv8,2023-04-05T06:34:48Z,UCYuxbq0trkgoaoN72eJi8dA,Join us for the DATA festival #Munich in June 2023!,DATA.PEOPLE.EVERYWHERE. Get your ticket now! https://data-festival.com/data-festival-live-tickets/,https://i.ytimg.com/vi/GhqqKd9rYv8/default.jpg,120,90,https://i.ytimg.com/vi/GhqqKd9rYv8/mqdefault.jpg,320,180,https://i.ytimg.com/vi/GhqqKd9rYv8/hqdefault.jpg,480,360,DATA festival,none,2023-04-05T06:34:48Z
4,youtube#searchResult,weFRAbevWKZzm2xpG8JK95--ZiY,youtube#video,E7D7gtcxv3U,2022-10-07T08:58:59Z,UCYuxbq0trkgoaoN72eJi8dA,Creating a Data Culture through Data Democratization,One of the most important questions when it comes to data democratization is: But how can a positive data culture be created?,https://i.ytimg.com/vi/E7D7gtcxv3U/default.jpg,120,90,https://i.ytimg.com/vi/E7D7gtcxv3U/mqdefault.jpg,320,180,https://i.ytimg.com/vi/E7D7gtcxv3U/hqdefault.jpg,480,360,DATA festival,none,2022-10-07T08:58:59Z
0,youtube#searchResult,Uty9JkVxYCK4cchzKNcc4XuTjZ0,youtube#video,Shl1XsvnbHg,2024-03-18T15:30:09Z,UCKPyg5gsnt6h0aA8EBw3i6A,Follow THESE 5 Tips to Get a Data Job,Subscribe to RichardOnData here: https://www.youtube.com/channel/UCKPyg5gsnt6h0aA8EBw3i6A?sub_confirmation=1 In this ...,https://i.ytimg.com/vi/Shl1XsvnbHg/default.jpg,120,90,https://i.ytimg.com/vi/Shl1XsvnbHg/mqdefault.jpg,320,180,https://i.ytimg.com/vi/Shl1XsvnbHg/hqdefault.jpg,480,360,RichardOnData,none,2024-03-18T15:30:09Z
1,youtube#searchResult,91Ur3csRcFflF6A5bvPJ9iYD768,youtube#video,EW3FkQMTdKM,2024-03-10T17:00:09Z,UCKPyg5gsnt6h0aA8EBw3i6A,Learn (and Do) Data Science FAST with ChatGPT,Subscribe to RichardOnData here: https://www.youtube.com/channel/UCKPyg5gsnt6h0aA8EBw3i6A?sub_confirmation=1 In this ...,https://i.ytimg.com/vi/EW3FkQMTdKM/default.jpg,120,90,https://i.ytimg.com/vi/EW3FkQMTdKM/mqdefault.jpg,320,180,https://i.ytimg.com/vi/EW3FkQMTdKM/hqdefault.jpg,480,360,RichardOnData,none,2024-03-10T17:00:09Z
2,youtube#searchResult,3IeBATsX5kurTrkTtFbOsKvNpxY,youtube#video,vLYP5oTDssg,2024-02-21T19:00:22Z,UCKPyg5gsnt6h0aA8EBw3i6A,The Data Job Market in 2024,Subscribe to RichardOnData here: https://www.youtube.com/channel/UCKPyg5gsnt6h0aA8EBw3i6A?sub_confirmation=1 My ...,https://i.ytimg.com/vi/vLYP5oTDssg/default.jpg,120,90,https://i.ytimg.com/vi/vLYP5oTDssg/mqdefault.jpg,320,180,https://i.ytimg.com/vi/vLYP5oTDssg/hqdefault.jpg,480,360,RichardOnData,none,2024-02-21T19:00:22Z
3,youtube#searchResult,bLsbUkGEeHW-w6VJxvpV18a60zA,youtube#video,AexVDfAueGQ,2024-01-31T18:00:05Z,UCKPyg5gsnt6h0aA8EBw3i6A,R or Python: Which Should You Learn in 2024?,Subscribe to RichardOnData here: https://www.youtube.com/channel/UCKPyg5gsnt6h0aA8EBw3i6A?sub_confirmation=1 In this ...,https://i.ytimg.com/vi/AexVDfAueGQ/default.jpg,120,90,https://i.ytimg.com/vi/AexVDfAueGQ/mqdefault.jpg,320,180,https://i.ytimg.com/vi/AexVDfAueGQ/hqdefault.jpg,480,360,RichardOnData,none,2024-01-31T18:00:05Z
4,youtube#searchResult,aCjgirnm0DIoFuUDM6yVaZTec4Y,youtube#video,0KZ_6_HobIw,2024-01-24T17:00:01Z,UCKPyg5gsnt6h0aA8EBw3i6A,Four Data Science Jobs: My Experiences,Subscribe to RichardOnData here: https://www.youtube.com/channel/UCKPyg5gsnt6h0aA8EBw3i6A?sub_confirmation=1 In this ...,https://i.ytimg.com/vi/0KZ_6_HobIw/default.jpg,120,90,https://i.ytimg.com/vi/0KZ_6_HobIw/mqdefault.jpg,320,180,https://i.ytimg.com/vi/0KZ_6_HobIw/hqdefault.jpg,480,360,RichardOnData,none,2024-01-24T17:00:01Z
0,youtube#searchResult,HxFEFBlh3Bw2gAlmoFgDyKUWob0,youtube#video,MYKYksteNMM,2023-05-03T22:25:36Z,UCvwDejnW-Q49xEb667JqS-g,Mar 2023 - Supercharge your Python Dev Environment with VS Code &amp; XGBoost Wage Prediction Model,"Philly Python Users' Group + DataPhilly collaboration in-person event on Wharton's campus (Philadelphia, PA) on Mar 30, 2023.",https://i.ytimg.com/vi/MYKYksteNMM/default.jpg,120,90,https://i.ytimg.com/vi/MYKYksteNMM/mqdefault.jpg,320,180,https://i.ytimg.com/vi/MYKYksteNMM/hqdefault.jpg,480,360,DataPhilly,none,2023-05-03T22:25:36Z
1,youtube#searchResult,P_02NTj23r8soBrTOZgQeRKK3Fw,youtube#video,8y1p6uBHWVs,2022-10-17T00:51:38Z,UCvwDejnW-Q49xEb667JqS-g,Aug 2022  - Lighting Talks - Using Data Science in the Real World,This is a video of the second half of the event only. Lighting Talk #2 Abstract: The last two Canadian federal elections have ...,https://i.ytimg.com/vi/8y1p6uBHWVs/default.jpg,120,90,https://i.ytimg.com/vi/8y1p6uBHWVs/mqdefault.jpg,320,180,https://i.ytimg.com/vi/8y1p6uBHWVs/hqdefault.jpg,480,360,DataPhilly,none,2022-10-17T00:51:38Z
2,youtube#searchResult,fmCZYrKum1b0lRe-2fP0_8t6Vck,youtube#video,UixN0WmRaEg,2022-06-09T20:58:47Z,UCvwDejnW-Q49xEb667JqS-g,May 2022 - Linux Deep Dive for Data Science,"Speaker Session 1: In the world of data, there are a wide variety of tools for processing, managing, and analyzing data.",https://i.ytimg.com/vi/UixN0WmRaEg/default.jpg,120,90,https://i.ytimg.com/vi/UixN0WmRaEg/mqdefault.jpg,320,180,https://i.ytimg.com/vi/UixN0WmRaEg/hqdefault.jpg,480,360,DataPhilly,none,2022-06-09T20:58:47Z
3,youtube#searchResult,FwvYvLiaZzsYLPDiS9VIr3u-_SA,youtube#video,dSslgMZEhas,2022-04-25T22:03:00Z,UCvwDejnW-Q49xEb667JqS-g,April 2022 - Live LinkedIn Profile Reviews &amp; Job Search Strategies,"DataPhilly Speaker Event - Apr 21, 2022 Topic: Live LinkedIn Profile Reviews & Job Search Strategies Speaker: Lynne Williams Is ...",https://i.ytimg.com/vi/dSslgMZEhas/default.jpg,120,90,https://i.ytimg.com/vi/dSslgMZEhas/mqdefault.jpg,320,180,https://i.ytimg.com/vi/dSslgMZEhas/hqdefault.jpg,480,360,DataPhilly,none,2022-04-25T22:03:00Z
4,youtube#searchResult,-jSdzebOjoDTpHIw5kIYMUs1H24,youtube#video,D3vbH9klbTk,2022-01-03T02:59:02Z,UCvwDejnW-Q49xEb667JqS-g,Introducing Unstructured Data into your Models,"DataPhilly Speaker Event - Dec 16, 2021 Topic: Introducing Unstructured Data into your Models - Extracting predictive info/signals ...",https://i.ytimg.com/vi/D3vbH9klbTk/default.jpg,120,90,https://i.ytimg.com/vi/D3vbH9klbTk/mqdefault.jpg,320,180,https://i.ytimg.com/vi/D3vbH9klbTk/hqdefault.jpg,480,360,DataPhilly,none,2022-01-03T02:59:02Z
0,youtube#searchResult,g1QfmV9d0D6FK8wcxeLVeyesGIE,youtube#video,Vf_K6DSwpxU,2024-03-12T04:05:47Z,UCipPccqvcfychKNOaYUokyQ,FY2023 AIPシンポジウム 包括的パネルディスカッション,AIPシンポジウム成果報告会のURL: https://aip.riken.jp/sympo/sympo202403/,https://i.ytimg.com/vi/Vf_K6DSwpxU/default.jpg,120,90,https://i.ytimg.com/vi/Vf_K6DSwpxU/mqdefault.jpg,320,180,https://i.ytimg.com/vi/Vf_K6DSwpxU/hqdefault.jpg,480,360,RIKEN AIP,none,2024-03-12T04:05:47Z
1,youtube#searchResult,zEfUqG85Ih_2522aAz83B4ywfbI,youtube#video,UBkms5264fM,2024-03-08T07:28:34Z,UCipPccqvcfychKNOaYUokyQ,FY2023 AIPシンポジウム 目的指向基盤技術研究グループ紹介,下記(左)の時間(時・分・秒)をクリックするとそれぞれのパートに進みます。 00:00:06 目的指向基盤技術研究グループ紹介 ...,https://i.ytimg.com/vi/UBkms5264fM/default.jpg,120,90,https://i.ytimg.com/vi/UBkms5264fM/mqdefault.jpg,320,180,https://i.ytimg.com/vi/UBkms5264fM/hqdefault.jpg,480,360,RIKEN AIP,none,2024-03-08T07:28:34Z
2,youtube#searchResult,sNmGD-wJE9GNW5viEPixecm9veY,youtube#video,BZx7ikWfHIs,2024-03-08T07:26:49Z,UCipPccqvcfychKNOaYUokyQ,FY2023 AIPシンポジウム 汎用基盤技術研究グループ紹介,下記(左)の時間(時・分・秒)をクリックするとそれぞれのパートに進みます。 00:00:06 汎用基盤技術研究グループ紹介 00:08:25 ...,https://i.ytimg.com/vi/BZx7ikWfHIs/default.jpg,120,90,https://i.ytimg.com/vi/BZx7ikWfHIs/mqdefault.jpg,320,180,https://i.ytimg.com/vi/BZx7ikWfHIs/hqdefault.jpg,480,360,RIKEN AIP,none,2024-03-08T07:26:49Z
3,youtube#searchResult,i2ex0zbyc36eatfvYCHhvnZf99k,youtube#video,hVIwCsnDoBM,2024-01-29T07:31:16Z,UCipPccqvcfychKNOaYUokyQ,[Cognitive Behavioral Assistive Technology Team seminar] Talk by Dr. Seungjin Choi,Title: Bayesian Optimization over High-Dimensional Combinatorial Spaces Speaker: Dr. Seungjin Choi (Director of the Machine ...,https://i.ytimg.com/vi/hVIwCsnDoBM/default.jpg,120,90,https://i.ytimg.com/vi/hVIwCsnDoBM/mqdefault.jpg,320,180,https://i.ytimg.com/vi/hVIwCsnDoBM/hqdefault.jpg,480,360,RIKEN AIP,none,2024-01-29T07:31:16Z
4,youtube#searchResult,sgQhvlbeJY5ACgWj5dJyxakNHvY,youtube#video,1DQXS-Zc8Vo,2023-12-01T06:41:03Z,UCipPccqvcfychKNOaYUokyQ,INSAIT- RIKEN AIP Joint Workshop on Artificial Intelligence,"Date: November 10, 2023 Time: Bulgaria 9 : 00 – 12 : 00 / Japan 16 : 00 – 19 : 00 * You can start each talk by clicking the time ...",https://i.ytimg.com/vi/1DQXS-Zc8Vo/default.jpg,120,90,https://i.ytimg.com/vi/1DQXS-Zc8Vo/mqdefault.jpg,320,180,https://i.ytimg.com/vi/1DQXS-Zc8Vo/hqdefault.jpg,480,360,RIKEN AIP,none,2023-12-01T06:41:03Z
0,youtube#searchResult,sgOfaw4LoQdGtGQdgWkVmjsJAYg,youtube#video,VSSa2WwFVBs,2021-11-26T04:26:22Z,UC62ScVTFf3GpDC5gXDesfEQ,"#MKAILIVE - Licensing Artificial Intelligence - Practical, Critical or Political?","In this MKAILive discussion, join us when we ask our panel of contributors to explore the question: Is the licensing of artificial ...",https://i.ytimg.com/vi/VSSa2WwFVBs/default.jpg,120,90,https://i.ytimg.com/vi/VSSa2WwFVBs/mqdefault.jpg,320,180,https://i.ytimg.com/vi/VSSa2WwFVBs/hqdefault.jpg,480,360,Richard Foster-Fletcher,none,2021-11-26T04:26:22Z
1,youtube#searchResult,UEY4N7w2nuGmS9AeAu1rDXXuLeo,youtube#video,SpK_IbBd-HM,2021-10-22T03:05:28Z,UC62ScVTFf3GpDC5gXDesfEQ,#MKAILIVE - How will we use Artificial Intelligence in 20 years?,"In recognition of Kai-Fu Lee's latest book 'AI in 2041', this #MKAILive broadcast will discuss the question 'How will we use Artificial ...",https://i.ytimg.com/vi/SpK_IbBd-HM/default.jpg,120,90,https://i.ytimg.com/vi/SpK_IbBd-HM/mqdefault.jpg,320,180,https://i.ytimg.com/vi/SpK_IbBd-HM/hqdefault.jpg,480,360,Richard Foster-Fletcher,none,2021-10-22T03:05:28Z
2,youtube#searchResult,OgbZYUN9X_PyNw1UOLEhtkfXoz4,youtube#video,s9j1tKce4Xg,2021-09-24T03:14:00Z,UC62ScVTFf3GpDC5gXDesfEQ,#MKAILIVE - The Ethics and Imperative of Digital Nudging,In this #MKAILive panel discussion we will discuss the ethics and imperative of digital nudging in light of the 2021 IPCC climate ...,https://i.ytimg.com/vi/s9j1tKce4Xg/default.jpg,120,90,https://i.ytimg.com/vi/s9j1tKce4Xg/mqdefault.jpg,320,180,https://i.ytimg.com/vi/s9j1tKce4Xg/hqdefault.jpg,480,360,Richard Foster-Fletcher,none,2021-09-24T03:14:00Z
3,youtube#searchResult,Unj3rXDS0KWSwn3c1DuBrzckX9A,youtube#video,J9x5-8n8r_I,2021-08-20T03:18:19Z,UC62ScVTFf3GpDC5gXDesfEQ,#MKAILIVE - What will it take to solve the bias problem in Artificial Intelligence (AI)?,"AI bias, also known as algorithmic bias is a phenomenon that occurs when an algorithm produces results that are systemically ...",https://i.ytimg.com/vi/J9x5-8n8r_I/default.jpg,120,90,https://i.ytimg.com/vi/J9x5-8n8r_I/mqdefault.jpg,320,180,https://i.ytimg.com/vi/J9x5-8n8r_I/hqdefault.jpg,480,360,Richard Foster-Fletcher,none,2021-08-20T03:18:19Z
4,youtube#searchResult,E8Lmwm2F793iedRyuIV7hULiuKs,youtube#video,hipw3-BJvu8,2021-08-11T04:14:33Z,UC62ScVTFf3GpDC5gXDesfEQ,Ethical AI Certification and Maturity Model - In conversation with Matthew James Bailey,Our world requires a framework to build an ethical foundation that aligns the futures of humans and Artificial Intelligence.,https://i.ytimg.com/vi/hipw3-BJvu8/default.jpg,120,90,https://i.ytimg.com/vi/hipw3-BJvu8/mqdefault.jpg,320,180,https://i.ytimg.com/vi/hipw3-BJvu8/hqdefault.jpg,480,360,Richard Foster-Fletcher,none,2021-08-11T04:14:33Z
0,youtube#searchResult,K7ZdIx05oUaHygm7c152ppzNEy8,youtube#video,ssPSCs5GVlA,2022-09-13T15:20:32Z,UCY15whY8GyA3DgjZFPdHfAQ,AI Expo 2022 | Panel: Productivity and Performance Boosters for Data Scientists and Developers,"ValleyML AI Expo 2022 Panel Discussion, In-Person Event, Day 1 Topic: Productivity and Performance Boosters for Data ...",https://i.ytimg.com/vi/ssPSCs5GVlA/default.jpg,120,90,https://i.ytimg.com/vi/ssPSCs5GVlA/mqdefault.jpg,320,180,https://i.ytimg.com/vi/ssPSCs5GVlA/hqdefault.jpg,480,360,ValleyML,none,2022-09-13T15:20:32Z
1,youtube#searchResult,KhB-lUEXzOho7D_XpCtR0f322BA,youtube#video,xCMgLDx1O9M,2022-09-13T14:02:53Z,UCY15whY8GyA3DgjZFPdHfAQ,AI Expo 2022 | Chris Eliasmith - An Optimal Time Series Processor,"ValleyML AI Expo 2022 Sponsored Session, AI Hardware, Virtual Event Speaker: Chris Eliasmith, Co-CEO, Applied Brain ...",https://i.ytimg.com/vi/xCMgLDx1O9M/default.jpg,120,90,https://i.ytimg.com/vi/xCMgLDx1O9M/mqdefault.jpg,320,180,https://i.ytimg.com/vi/xCMgLDx1O9M/hqdefault.jpg,480,360,ValleyML,none,2022-09-13T14:02:53Z
2,youtube#searchResult,_xEaZHzjEX-U51ZT-nqna4WCz_Q,youtube#video,8kYM_Ac78ik,2022-09-13T14:02:58Z,UCY15whY8GyA3DgjZFPdHfAQ,AI Expo 2022 | Mark Oliver - Introduction to the Efinix TinyML Platform,"ValleyML AI Expo 2022 Sponsored Session, AI Hardware, Virtual Event Speaker: Mark Oliver, VP Marketing, Efinix, Inc. Title: ...",https://i.ytimg.com/vi/8kYM_Ac78ik/default.jpg,120,90,https://i.ytimg.com/vi/8kYM_Ac78ik/mqdefault.jpg,320,180,https://i.ytimg.com/vi/8kYM_Ac78ik/hqdefault.jpg,480,360,ValleyML,none,2022-09-13T14:02:58Z
3,youtube#searchResult,p-z8E2zLX8I3MGhwqubs7j69tYA,youtube#video,MvR-_fJ0NMQ,2022-09-13T14:03:03Z,UCY15whY8GyA3DgjZFPdHfAQ,AI Expo 2022 | Manasi Vartak - A Reference Architecture for Operational AI,"ValleyML AI Expo 2022 Sponsored Session, AI Operations, Virtual Event Speaker: Manasi Vartak, CEO, Verta Inc Title: A ...",https://i.ytimg.com/vi/MvR-_fJ0NMQ/default.jpg,120,90,https://i.ytimg.com/vi/MvR-_fJ0NMQ/mqdefault.jpg,320,180,https://i.ytimg.com/vi/MvR-_fJ0NMQ/hqdefault.jpg,480,360,ValleyML,none,2022-09-13T14:03:03Z
4,youtube#searchResult,NHgyq_5AhgNHP0JY7OyEV2ZUqTg,youtube#video,6Xmeo99eHVw,2022-09-13T14:03:09Z,UCY15whY8GyA3DgjZFPdHfAQ,AI Expo 2022 | Jan Jongboom - Building confidence in your ML models,"ValleyML AI Expo 2022 Virtual Keynote Speaker: Jan Jongboom, CTO, Edge Impulse Title: Building confidence in your ML ...",https://i.ytimg.com/vi/6Xmeo99eHVw/default.jpg,120,90,https://i.ytimg.com/vi/6Xmeo99eHVw/mqdefault.jpg,320,180,https://i.ytimg.com/vi/6Xmeo99eHVw/hqdefault.jpg,480,360,ValleyML,none,2022-09-13T14:03:09Z
0,youtube#searchResult,exh3u4WeqpwJmRp40cMBDh9Bxq8,youtube#video,5D2Vdt0QMN0,2021-08-12T21:37:24Z,UCMxUmQFr0_dyW8JTLDiOeNQ,"Proof, Provers, and the Lean Theorem Prover - Summer Special!","In this summer special we'll take a break from messy data, and - just for fun - take refuge in the reassuring consistency and ...",https://i.ytimg.com/vi/5D2Vdt0QMN0/default.jpg,120,90,https://i.ytimg.com/vi/5D2Vdt0QMN0/mqdefault.jpg,320,180,https://i.ytimg.com/vi/5D2Vdt0QMN0/hqdefault.jpg,480,360,Data Science Cornwall,none,2021-08-12T21:37:24Z
1,youtube#searchResult,LnGi36DTb2wT7VDh_ij7TK3M1fw,youtube#video,Qv4FVsXnf-M,2021-07-29T22:35:10Z,UCMxUmQFr0_dyW8JTLDiOeNQ,Data Challenge Cornwall - Cluster Analysis to Create Personas without Bias,Link to slides: tinyurl.com/SmartlineClusterDataChallenge Slides include links to data and sample code. --- The Smartline Project ...,https://i.ytimg.com/vi/Qv4FVsXnf-M/default.jpg,120,90,https://i.ytimg.com/vi/Qv4FVsXnf-M/mqdefault.jpg,320,180,https://i.ytimg.com/vi/Qv4FVsXnf-M/hqdefault.jpg,480,360,Data Science Cornwall,none,2021-07-29T22:35:10Z
2,youtube#searchResult,8kvQkZp1Z-ZhNqbVuO0cL5FhxDk,youtube#video,6U3h6DBTZes,2021-07-29T22:35:24Z,UCMxUmQFr0_dyW8JTLDiOeNQ,Data Challenge Cornwall - Predicting Housing Faults &amp; Resident Support Needs,Slides: https://drive.google.com/file/d/1lnjUb0tRI_wuHY1psFCArnDj8F116Osg/view?usp=sharing --- Coastline Housing is an ...,https://i.ytimg.com/vi/6U3h6DBTZes/default.jpg,120,90,https://i.ytimg.com/vi/6U3h6DBTZes/mqdefault.jpg,320,180,https://i.ytimg.com/vi/6U3h6DBTZes/hqdefault.jpg,480,360,Data Science Cornwall,none,2021-07-29T22:35:24Z
3,youtube#searchResult,C3zTtGPSHKLIImHuSg-GazdXIQk,youtube#video,1Sy0B-4ZRg8,2021-07-29T22:20:51Z,UCMxUmQFr0_dyW8JTLDiOeNQ,Data Challenge Cornwall - OCR of Historical Mining Records,Link to scanned images: https://cornishlithium.egnyte.com/fl/dTYUvzsHR3 Slides: ...,https://i.ytimg.com/vi/1Sy0B-4ZRg8/default.jpg,120,90,https://i.ytimg.com/vi/1Sy0B-4ZRg8/mqdefault.jpg,320,180,https://i.ytimg.com/vi/1Sy0B-4ZRg8/hqdefault.jpg,480,360,Data Science Cornwall,none,2021-07-29T22:20:51Z
4,youtube#searchResult,9LNSWwUHhsk3YEIMfCQm01BT7Uo,youtube#video,CuSX2jFMAFc,2021-07-22T23:49:04Z,UCMxUmQFr0_dyW8JTLDiOeNQ,Data Challenge Cornwall - Visualising GP Surgery Data,"The NHS collects and publishes a broad range of data, including on GP surgery information. Join the session to find hear about ...",https://i.ytimg.com/vi/CuSX2jFMAFc/default.jpg,120,90,https://i.ytimg.com/vi/CuSX2jFMAFc/mqdefault.jpg,320,180,https://i.ytimg.com/vi/CuSX2jFMAFc/hqdefault.jpg,480,360,Data Science Cornwall,none,2021-07-22T23:49:04Z
0,youtube#searchResult,TvmNzqssFFRGr9JLo2pPhu17CU4,youtube#video,PnTRj3ghRhI,2024-01-12T20:28:35Z,UCoTuN2KVQHpnAOO9nM9354Q,Part 7 End to End Machine Learning Series,"In this installment of the End to End ML Series, we discuss model selection using the PyCaret open source tool to evaluate ...",https://i.ytimg.com/vi/PnTRj3ghRhI/default.jpg,120,90,https://i.ytimg.com/vi/PnTRj3ghRhI/mqdefault.jpg,320,180,https://i.ytimg.com/vi/PnTRj3ghRhI/hqdefault.jpg,480,360,OMLDS,none,2024-01-12T20:28:35Z
1,youtube#searchResult,-rG6KhAnapO3ETFbghsrhqlE6Wo,youtube#video,vQLXgiqoG9o,2023-11-16T18:32:17Z,UCoTuN2KVQHpnAOO9nM9354Q,Part 6 End to End Machine Learning Series,In this phase we build our first model using SciKit Learn and evaluate the results of a Logistic Regression model using the ...,https://i.ytimg.com/vi/vQLXgiqoG9o/default.jpg,120,90,https://i.ytimg.com/vi/vQLXgiqoG9o/mqdefault.jpg,320,180,https://i.ytimg.com/vi/vQLXgiqoG9o/hqdefault.jpg,480,360,OMLDS,none,2023-11-16T18:32:17Z
2,youtube#searchResult,r6ygdiFN_yPJHisx7sCb2P_3zOs,youtube#video,m0gWOGrvn14,2023-10-24T20:42:47Z,UCoTuN2KVQHpnAOO9nM9354Q,Part5 End to End Machine Learning Series,,https://i.ytimg.com/vi/m0gWOGrvn14/default.jpg,120,90,https://i.ytimg.com/vi/m0gWOGrvn14/mqdefault.jpg,320,180,https://i.ytimg.com/vi/m0gWOGrvn14/hqdefault.jpg,480,360,OMLDS,none,2023-10-24T20:42:47Z
3,youtube#searchResult,EkGEzq9cFRsX_5H_ymHPji5Kd4Q,youtube#video,izd1aRnKW3Q,2023-10-24T20:30:42Z,UCoTuN2KVQHpnAOO9nM9354Q,Part4 End to End Machine Learning Series,,https://i.ytimg.com/vi/izd1aRnKW3Q/default.jpg,120,90,https://i.ytimg.com/vi/izd1aRnKW3Q/mqdefault.jpg,320,180,https://i.ytimg.com/vi/izd1aRnKW3Q/hqdefault.jpg,480,360,OMLDS,none,2023-10-24T20:30:42Z
4,youtube#searchResult,j3_sBwkozHPvov-C40_1ZbcTUIM,youtube#video,8V9G8SrHRpY,2023-07-23T17:54:52Z,UCoTuN2KVQHpnAOO9nM9354Q,Part 3: End to End Machine Learning Series,OMLDS (Orlando Machine Learning and Data Scientists) End to End Machine Learning Project 2023 This is the third video in a ...,https://i.ytimg.com/vi/8V9G8SrHRpY/default.jpg,120,90,https://i.ytimg.com/vi/8V9G8SrHRpY/mqdefault.jpg,320,180,https://i.ytimg.com/vi/8V9G8SrHRpY/hqdefault.jpg,480,360,OMLDS,none,2023-07-23T17:54:52Z
0,youtube#searchResult,EvkJPy8gH6lURFNhjvUcMZW53X0,youtube#video,PwoTb-SxoC0,2024-02-21T18:14:01Z,UC8hI87gt0dmTAIEupEcsckA,Deep Reinforcement Learning for Trading,Join the Hudson and Thames Reading Group: https://hudsonthames.org/reading-group/ This Friday for our weekly reading group ...,https://i.ytimg.com/vi/PwoTb-SxoC0/default.jpg,120,90,https://i.ytimg.com/vi/PwoTb-SxoC0/mqdefault.jpg,320,180,https://i.ytimg.com/vi/PwoTb-SxoC0/hqdefault.jpg,480,360,Hudson & Thames,none,2024-02-21T18:14:01Z
1,youtube#searchResult,hClKEnB0N4sPTqTf-VQ2GcASiHo,youtube#video,vyjgR5Ln57s,2024-02-21T18:14:16Z,UC8hI87gt0dmTAIEupEcsckA,Conditional Portfolio Optimization,Join the Hudson and Thames Reading Group: https://hudsonthames.org/reading-group/ In this session we are discussing a paper ...,https://i.ytimg.com/vi/vyjgR5Ln57s/default.jpg,120,90,https://i.ytimg.com/vi/vyjgR5Ln57s/mqdefault.jpg,320,180,https://i.ytimg.com/vi/vyjgR5Ln57s/hqdefault.jpg,480,360,Hudson & Thames,none,2024-02-21T18:14:16Z
2,youtube#searchResult,vNG2ONTXDaXsqgcxVFZsBEwdZXM,youtube#video,knPPeV58gHM,2024-02-21T18:12:28Z,UC8hI87gt0dmTAIEupEcsckA,Scientific Discovery in Quantitative Finance,"This lecture we review the first 4 chapters of Marcos Lopez de Prado's latest paper from ADIA Labs, which lays out the foundation ...",https://i.ytimg.com/vi/knPPeV58gHM/default.jpg,120,90,https://i.ytimg.com/vi/knPPeV58gHM/mqdefault.jpg,320,180,https://i.ytimg.com/vi/knPPeV58gHM/hqdefault.jpg,480,360,Hudson & Thames,none,2024-02-21T18:12:28Z
3,youtube#searchResult,bvYRzL5esqgkYuK7q_eYAofDHrI,youtube#video,6SfotqCQtag,2023-05-17T13:46:13Z,UC8hI87gt0dmTAIEupEcsckA,"Git, Branching, and Pull Requests","Welcome to our video on Git fundamentals presented by Michael Struwig, the CEO of Hudson & Thames. If you have some basic ...",https://i.ytimg.com/vi/6SfotqCQtag/default.jpg,120,90,https://i.ytimg.com/vi/6SfotqCQtag/mqdefault.jpg,320,180,https://i.ytimg.com/vi/6SfotqCQtag/hqdefault.jpg,480,360,Hudson & Thames,none,2023-05-17T13:46:13Z
4,youtube#searchResult,fLQyFqJ1XoNTYMUuvdxCbR2FUjc,youtube#video,Gnpeiu0KxUE,2023-03-03T11:41:59Z,UC8hI87gt0dmTAIEupEcsckA,PortfolioLab Demo Video,PortfolioLab: Portfolio optimisation and allocation library A modern guide to portfolio optimisation: ...,https://i.ytimg.com/vi/Gnpeiu0KxUE/default.jpg,120,90,https://i.ytimg.com/vi/Gnpeiu0KxUE/mqdefault.jpg,320,180,https://i.ytimg.com/vi/Gnpeiu0KxUE/hqdefault.jpg,480,360,Hudson & Thames,none,2023-03-03T11:41:59Z
0,youtube#searchResult,OrBDcnTWDtEyMjt8qswhAabqWaA,youtube#video,9ttxG6lsyog,2024-03-22T11:22:24Z,UC8kXgHG13XdgsigIPRmrIyA,How can Quants use AI? #ai #quants #quantitativetrading #trading #finance,"Unlock the Future of Finance with AI! Dive into the dynamic world where quants harness AI's power to revolutionize trading, ...",https://i.ytimg.com/vi/9ttxG6lsyog/default.jpg,120,90,https://i.ytimg.com/vi/9ttxG6lsyog/mqdefault.jpg,320,180,https://i.ytimg.com/vi/9ttxG6lsyog/hqdefault.jpg,480,360,QuantInsti Quantitative Learning,none,2024-03-22T11:22:24Z
1,youtube#searchResult,NZWMwNOHPqWmn-jS3xHvSrPEDnU,youtube#video,RswCmPFn6TY,2024-03-22T03:17:26Z,UC8kXgHG13XdgsigIPRmrIyA,ChatGPT and Algo Trading: Exploring Opportunities &amp; Challenges | AI-Powered Trading Workshop 2024,"Welcome to Session 2 of the AI-Powered Trading Workshop 2024 on ""ChatGPT and Algo Trading: Exploring Opportunities ...",https://i.ytimg.com/vi/RswCmPFn6TY/default.jpg,120,90,https://i.ytimg.com/vi/RswCmPFn6TY/mqdefault.jpg,320,180,https://i.ytimg.com/vi/RswCmPFn6TY/hqdefault.jpg,480,360,QuantInsti Quantitative Learning,none,2024-03-22T03:17:26Z
2,youtube#searchResult,QsMLcS3Z8oygj3Jvzr4nBAzNj14,youtube#video,nLtudB57tiQ,2024-03-22T01:51:11Z,UC8kXgHG13XdgsigIPRmrIyA,Trading in the Age of AI: How to Stay Ahead! | AI-Powered Trading Workshop 2024 [Panel Discussion],"Welcome to Session 1 of the AI-Powered Trading Workshop 2024: ""Trading in the Age of AI: How to Stay Ahead!"" In this ...",https://i.ytimg.com/vi/nLtudB57tiQ/default.jpg,120,90,https://i.ytimg.com/vi/nLtudB57tiQ/mqdefault.jpg,320,180,https://i.ytimg.com/vi/nLtudB57tiQ/hqdefault.jpg,480,360,QuantInsti Quantitative Learning,none,2024-03-22T01:51:11Z
3,youtube#searchResult,rqTcqGEuTKy55Id2BHvJDUr4YHs,youtube#video,pnD5cai_5ns,2024-03-21T10:16:16Z,UC8kXgHG13XdgsigIPRmrIyA,What is Portfolio Management and its Types?,Ever wondered about the art of managing a diverse set of assets in the financial world? Let's dive in! Portfolio management ...,https://i.ytimg.com/vi/pnD5cai_5ns/default.jpg,120,90,https://i.ytimg.com/vi/pnD5cai_5ns/mqdefault.jpg,320,180,https://i.ytimg.com/vi/pnD5cai_5ns/hqdefault.jpg,480,360,QuantInsti Quantitative Learning,none,2024-03-21T10:16:16Z
4,youtube#searchResult,FZOT9-QdgWbREu8LG10pNyZsrLc,youtube#video,HrBWWKDHWWo,2024-03-15T13:52:14Z,UC8kXgHG13XdgsigIPRmrIyA,AI-Powered Workshop 2024 - 21 March 2024!,Embark on a transformative journey into AI-powered trading at our exclusive workshop in 2024! Discover the future of trading with ...,https://i.ytimg.com/vi/HrBWWKDHWWo/default.jpg,120,90,https://i.ytimg.com/vi/HrBWWKDHWWo/mqdefault.jpg,320,180,https://i.ytimg.com/vi/HrBWWKDHWWo/hqdefault.jpg,480,360,QuantInsti Quantitative Learning,none,2024-03-15T13:52:14Z
