,kind,etag,id.kind,id.videoId,snippet.publishedAt,snippet.channelId,snippet.title,snippet.description,snippet.thumbnails.default.url,snippet.thumbnails.default.width,snippet.thumbnails.default.height,snippet.thumbnails.medium.url,snippet.thumbnails.medium.width,snippet.thumbnails.medium.height,snippet.thumbnails.high.url,snippet.thumbnails.high.width,snippet.thumbnails.high.height,snippet.channelTitle,snippet.liveBroadcastContent,snippet.publishTime
0,youtube#searchResult,JbqAhhNcc9HlI4uJT0lX3uXXgNI,youtube#video,0rPhFRy6qt4,2025-02-26T17:14:22Z,UCtWI06j1EADmEOGj2iJhSyA,Solve Communication Gaps with the Lost Art of Diagrams - Tadeh Hakopian (PyCascades 2025),This talk is about communicating with visuals to make complex ideas simple to understand. Over the years I have produced ...,https://i.ytimg.com/vi/0rPhFRy6qt4/default.jpg,120,90,https://i.ytimg.com/vi/0rPhFRy6qt4/mqdefault.jpg,320,180,https://i.ytimg.com/vi/0rPhFRy6qt4/hqdefault.jpg,480,360,PyCascades,none,2025-02-26T17:14:22Z
1,youtube#searchResult,_l0eQ1hhwIzPXvQxKfARtWJAtfk,youtube#video,x-xQj6EcQbI,2025-02-26T06:25:04Z,UCtWI06j1EADmEOGj2iJhSyA,PyLadies Panel: Experiences and Roles within the Tech Community and Open Source (PyCascades 2025),"Tammy Do, Drishti Jain, Parul Gupta, Lilinoe Harbottle, and Nasim.",https://i.ytimg.com/vi/x-xQj6EcQbI/default.jpg,120,90,https://i.ytimg.com/vi/x-xQj6EcQbI/mqdefault.jpg,320,180,https://i.ytimg.com/vi/x-xQj6EcQbI/hqdefault.jpg,480,360,PyCascades,none,2025-02-26T06:25:04Z
2,youtube#searchResult,TekAbMl2EQjkSDpb-OVFXVcqnhc,youtube#video,UygK5W3txTM,2025-02-26T06:21:29Z,UCtWI06j1EADmEOGj2iJhSyA,You Should Build a Robot (MicroPython &amp; Microprocessors) - Sage Elliott (PyCascades 2025),"Thinking about building a robot? You should! But don't know where to start? In this talk, we'll break down the barriers building ...",https://i.ytimg.com/vi/UygK5W3txTM/default.jpg,120,90,https://i.ytimg.com/vi/UygK5W3txTM/mqdefault.jpg,320,180,https://i.ytimg.com/vi/UygK5W3txTM/hqdefault.jpg,480,360,PyCascades,none,2025-02-26T06:21:29Z
3,youtube#searchResult,EeYHvF1RFzqwJ5KGDDKNIT5eTQk,youtube#video,JXZCw9wmc2M,2025-02-26T06:20:11Z,UCtWI06j1EADmEOGj2iJhSyA,Python for Earth: Climate Modeling and Sustainability in Action - Drishti Jain (PyCascades 2025),Discover how Python is shaping the future of our planet in this engaging talk. I'll explore how Python is used to model climate ...,https://i.ytimg.com/vi/JXZCw9wmc2M/default.jpg,120,90,https://i.ytimg.com/vi/JXZCw9wmc2M/mqdefault.jpg,320,180,https://i.ytimg.com/vi/JXZCw9wmc2M/hqdefault.jpg,480,360,PyCascades,none,2025-02-26T06:20:11Z
4,youtube#searchResult,XyiaE15V7Dd6GSv4UhzSUimtQUs,youtube#video,dvxzJDk6x9Q,2025-02-26T06:17:23Z,UCtWI06j1EADmEOGj2iJhSyA,Optimal Performance Over Basic as a Perfectionist with Deadlines - Velda Kiara (PyCascades 2025),In this talk we will be going through strategies of optimising Django applications with a focus on the following: - database ...,https://i.ytimg.com/vi/dvxzJDk6x9Q/default.jpg,120,90,https://i.ytimg.com/vi/dvxzJDk6x9Q/mqdefault.jpg,320,180,https://i.ytimg.com/vi/dvxzJDk6x9Q/hqdefault.jpg,480,360,PyCascades,none,2025-02-26T06:17:23Z
0,youtube#searchResult,T_gKY19aDOSuyaJSVyaSaRPlt80,youtube#video,rkw0jZkZA_U,2022-07-05T09:15:29Z,UCTCV2vonJgaQVb8AdMgdvCA,PyDataMCR - July Talks,Talk Details to be announced SPONSORS Thank you to NUMFocus for sponsoring Meetup and further support.,https://i.ytimg.com/vi/rkw0jZkZA_U/default_live.jpg,120,90,https://i.ytimg.com/vi/rkw0jZkZA_U/mqdefault_live.jpg,320,180,https://i.ytimg.com/vi/rkw0jZkZA_U/hqdefault_live.jpg,480,360,PyDataMCR,upcoming,2022-07-05T09:15:29Z
1,youtube#searchResult,YlRL8MOW54ZoFOzp-VivZwlrl4w,youtube#video,w_GQgSqLbxc,2022-06-30T06:48:38Z,UCTCV2vonJgaQVb8AdMgdvCA,PyDataMCR - is back!,"Topics, Classification and Reviews - Shaun Hide - @ShaunHide1 With increasing noise around fake reviews and review skews ...",https://i.ytimg.com/vi/w_GQgSqLbxc/default.jpg,120,90,https://i.ytimg.com/vi/w_GQgSqLbxc/mqdefault.jpg,320,180,https://i.ytimg.com/vi/w_GQgSqLbxc/hqdefault.jpg,480,360,PyDataMCR,none,2022-06-30T06:48:38Z
2,youtube#searchResult,LwBDuzzONyyAAHmljjdAZ5HoF2g,youtube#video,cik-dqUUiaU,2021-10-27T07:07:06Z,UCTCV2vonJgaQVb8AdMgdvCA,Data Horror Stories with Open Data Manchester &amp; Her+DataMcr 2021,"Do you have a tale of bad stats, strange correlations, malicious intent or plain stupidity? Join us and share your Data Horror ...",https://i.ytimg.com/vi/cik-dqUUiaU/default.jpg,120,90,https://i.ytimg.com/vi/cik-dqUUiaU/mqdefault.jpg,320,180,https://i.ytimg.com/vi/cik-dqUUiaU/hqdefault.jpg,480,360,PyDataMCR,none,2021-10-27T07:07:06Z
3,youtube#searchResult,JxyMchZ9BGsmC14DHzQezc-vxa4,youtube#video,G7Sm2vzZjZg,2021-08-18T06:21:37Z,UCTCV2vonJgaQVb8AdMgdvCA,Live-Coding - Rain Risk,"""The ship's navigation computer seems to be malfunctioning; rather than giving a route directly to safety, it produced extremely ...",https://i.ytimg.com/vi/G7Sm2vzZjZg/default.jpg,120,90,https://i.ytimg.com/vi/G7Sm2vzZjZg/mqdefault.jpg,320,180,https://i.ytimg.com/vi/G7Sm2vzZjZg/hqdefault.jpg,480,360,PyDataMCR,none,2021-08-18T06:21:37Z
4,youtube#searchResult,yabaQ7J6KJrUa1VugsOiQWulnBI,youtube#video,SvNGA5-wIPs,2021-04-28T06:13:46Z,UCTCV2vonJgaQVb8AdMgdvCA,Data FAQs with the UKDS,Data FAQs Some questions come up again and again in relation to data industries. Questions like: * Should I learn R or Python?,https://i.ytimg.com/vi/SvNGA5-wIPs/default.jpg,120,90,https://i.ytimg.com/vi/SvNGA5-wIPs/mqdefault.jpg,320,180,https://i.ytimg.com/vi/SvNGA5-wIPs/hqdefault.jpg,480,360,PyDataMCR,none,2021-04-28T06:13:46Z
0,youtube#searchResult,T_gKY19aDOSuyaJSVyaSaRPlt80,youtube#video,rkw0jZkZA_U,2022-07-05T09:15:29Z,UCTCV2vonJgaQVb8AdMgdvCA,PyDataMCR - July Talks,Talk Details to be announced SPONSORS Thank you to NUMFocus for sponsoring Meetup and further support.,https://i.ytimg.com/vi/rkw0jZkZA_U/default_live.jpg,120,90,https://i.ytimg.com/vi/rkw0jZkZA_U/mqdefault_live.jpg,320,180,https://i.ytimg.com/vi/rkw0jZkZA_U/hqdefault_live.jpg,480,360,PyDataMCR,upcoming,2022-07-05T09:15:29Z
1,youtube#searchResult,YlRL8MOW54ZoFOzp-VivZwlrl4w,youtube#video,w_GQgSqLbxc,2022-06-30T06:48:38Z,UCTCV2vonJgaQVb8AdMgdvCA,PyDataMCR - is back!,"Topics, Classification and Reviews - Shaun Hide - @ShaunHide1 With increasing noise around fake reviews and review skews ...",https://i.ytimg.com/vi/w_GQgSqLbxc/default.jpg,120,90,https://i.ytimg.com/vi/w_GQgSqLbxc/mqdefault.jpg,320,180,https://i.ytimg.com/vi/w_GQgSqLbxc/hqdefault.jpg,480,360,PyDataMCR,none,2022-06-30T06:48:38Z
2,youtube#searchResult,LwBDuzzONyyAAHmljjdAZ5HoF2g,youtube#video,cik-dqUUiaU,2021-10-27T07:07:06Z,UCTCV2vonJgaQVb8AdMgdvCA,Data Horror Stories with Open Data Manchester &amp; Her+DataMcr 2021,"Do you have a tale of bad stats, strange correlations, malicious intent or plain stupidity? Join us and share your Data Horror ...",https://i.ytimg.com/vi/cik-dqUUiaU/default.jpg,120,90,https://i.ytimg.com/vi/cik-dqUUiaU/mqdefault.jpg,320,180,https://i.ytimg.com/vi/cik-dqUUiaU/hqdefault.jpg,480,360,PyDataMCR,none,2021-10-27T07:07:06Z
3,youtube#searchResult,JxyMchZ9BGsmC14DHzQezc-vxa4,youtube#video,G7Sm2vzZjZg,2021-08-18T06:21:37Z,UCTCV2vonJgaQVb8AdMgdvCA,Live-Coding - Rain Risk,"""The ship's navigation computer seems to be malfunctioning; rather than giving a route directly to safety, it produced extremely ...",https://i.ytimg.com/vi/G7Sm2vzZjZg/default.jpg,120,90,https://i.ytimg.com/vi/G7Sm2vzZjZg/mqdefault.jpg,320,180,https://i.ytimg.com/vi/G7Sm2vzZjZg/hqdefault.jpg,480,360,PyDataMCR,none,2021-08-18T06:21:37Z
4,youtube#searchResult,yabaQ7J6KJrUa1VugsOiQWulnBI,youtube#video,SvNGA5-wIPs,2021-04-28T06:13:46Z,UCTCV2vonJgaQVb8AdMgdvCA,Data FAQs with the UKDS,Data FAQs Some questions come up again and again in relation to data industries. Questions like: * Should I learn R or Python?,https://i.ytimg.com/vi/SvNGA5-wIPs/default.jpg,120,90,https://i.ytimg.com/vi/SvNGA5-wIPs/mqdefault.jpg,320,180,https://i.ytimg.com/vi/SvNGA5-wIPs/hqdefault.jpg,480,360,PyDataMCR,none,2021-04-28T06:13:46Z
0,youtube#searchResult,p7QKhoN9zFI4B1l34SAt97OmHi4,youtube#video,Nm71G0-wnFU,2024-02-20T02:00:42Z,UC2d_azMgPLw_8JzgbpNb2oQ,PyData Montreal Meetup #24,There is a raw replay of PyData Montreal Meetup #24 with two talks 00:02:15 - 00:49:46 - How we used Python to see how many ...,https://i.ytimg.com/vi/Nm71G0-wnFU/default.jpg,120,90,https://i.ytimg.com/vi/Nm71G0-wnFU/mqdefault.jpg,320,180,https://i.ytimg.com/vi/Nm71G0-wnFU/hqdefault.jpg,480,360,PyData Montreal,none,2024-02-20T02:00:42Z
1,youtube#searchResult,tYYwvvKtvwFpFFG2TbuI0j4xn-c,youtube#video,-FFKxz4V9_o,2021-06-29T23:48:14Z,UC2d_azMgPLw_8JzgbpNb2oQ,PyData Montreal #20 with Itamar Turner-Trauring,"Our guest this time is Itamar Turner-Trauring who will present two talks: - ""Small Big Data: using NumPy and Pandas when your ...",https://i.ytimg.com/vi/-FFKxz4V9_o/default.jpg,120,90,https://i.ytimg.com/vi/-FFKxz4V9_o/mqdefault.jpg,320,180,https://i.ytimg.com/vi/-FFKxz4V9_o/hqdefault.jpg,480,360,PyData Montreal,none,2021-06-29T23:48:14Z
2,youtube#searchResult,4a8WWpNWmTWVkMY9rmYsxnknMYs,youtube#video,jNZw_azRlDU,2021-04-22T23:53:51Z,UC2d_azMgPLw_8JzgbpNb2oQ,PyData Montreal #19 with Frederick Reiss and Luciano Resende,"Our speakers this time are: - Frederick Reiss, with a talk ""Text Extensions for Pandas"", and - Luciano Resende with ""Introducing ...",https://i.ytimg.com/vi/jNZw_azRlDU/default.jpg,120,90,https://i.ytimg.com/vi/jNZw_azRlDU/mqdefault.jpg,320,180,https://i.ytimg.com/vi/jNZw_azRlDU/hqdefault.jpg,480,360,PyData Montreal,none,2021-04-22T23:53:51Z
3,youtube#searchResult,NGdrue3TKS7F_KjnfdzhUN1-OeA,youtube#video,NrdJOfYisKI,2021-03-20T00:01:15Z,UC2d_azMgPLw_8JzgbpNb2oQ,PyData Montreal #18: Data Engineering and Data Management,"Our speakers this time are: - Ben Rogojan, with a talk ""The Python ETL: Airflow Vs. Luigi"", and - Sergey Karayev, presenting on ...",https://i.ytimg.com/vi/NrdJOfYisKI/default.jpg,120,90,https://i.ytimg.com/vi/NrdJOfYisKI/mqdefault.jpg,320,180,https://i.ytimg.com/vi/NrdJOfYisKI/hqdefault.jpg,480,360,PyData Montreal,none,2021-03-20T00:01:15Z
4,youtube#searchResult,-87kesQLCvt17z3ef2oHWZnga_4,youtube#video,RG-yV5zgqjQ,2021-02-26T01:22:19Z,UC2d_azMgPLw_8JzgbpNb2oQ,PyData Montreal #17: Online meetup on NLP,"Our guests this time are: - Sylvain Gugger, a Research Engineer at Hugging Face and one of the core maintainers of the ...",https://i.ytimg.com/vi/RG-yV5zgqjQ/default.jpg,120,90,https://i.ytimg.com/vi/RG-yV5zgqjQ/mqdefault.jpg,320,180,https://i.ytimg.com/vi/RG-yV5zgqjQ/hqdefault.jpg,480,360,PyData Montreal,none,2021-02-26T01:22:19Z
0,youtube#searchResult,LsVA2m5vHbkXd-kH5ZOa-9liQlM,youtube#video,qoinGjj60Fo,2026-03-10T17:28:31Z,UCP7jMXSY2xbc3KCAE0MHQ-A,10 years of AlphaGo: The turning point for AI | Thore Graepel &amp; Pushmeet Kohli,"Seoul, March 2016. Two players sit hunched over a 19x19 grid covered in a sea of black and white stones. They are playing the ...",https://i.ytimg.com/vi/qoinGjj60Fo/default.jpg,120,90,https://i.ytimg.com/vi/qoinGjj60Fo/mqdefault.jpg,320,180,https://i.ytimg.com/vi/qoinGjj60Fo/hqdefault.jpg,480,360,Google DeepMind,none,2026-03-10T17:28:31Z
1,youtube#searchResult,pyeVLd_dEsGfsZnHGT98jBucPD8,youtube#video,l5Wpm4o6k1A,2026-02-24T14:00:09Z,UCP7jMXSY2xbc3KCAE0MHQ-A,Music AI Sandbox | AI x Creativity: Wyclef Jean,Legendary producer Wyclef Jean joins forces with Music AI Sandbox to explore the next era of creative expression. Discover how ...,https://i.ytimg.com/vi/l5Wpm4o6k1A/default.jpg,120,90,https://i.ytimg.com/vi/l5Wpm4o6k1A/mqdefault.jpg,320,180,https://i.ytimg.com/vi/l5Wpm4o6k1A/hqdefault.jpg,480,360,Google DeepMind,none,2026-02-24T14:00:09Z
2,youtube#searchResult,Xv_WL3brbkXwZXYHSdYSLOg__l0,youtube#video,IE0BmXsIzTI,2026-02-20T20:58:56Z,UCP7jMXSY2xbc3KCAE0MHQ-A,Gemini 3 Deep Think: Optimizing 2D semiconductor fabrication,"At Duke University, the Wang Lab utilized Gemini 3 Deep Think to solve a complex challenge in materials science: optimizing ...",https://i.ytimg.com/vi/IE0BmXsIzTI/default.jpg,120,90,https://i.ytimg.com/vi/IE0BmXsIzTI/mqdefault.jpg,320,180,https://i.ytimg.com/vi/IE0BmXsIzTI/hqdefault.jpg,480,360,Google DeepMind,none,2026-02-20T20:58:56Z
3,youtube#searchResult,7o81bwtMTDKkvGnZXq_GhxvJ8VI,youtube#video,bNrbxCvFrKA,2026-02-20T20:58:52Z,UCP7jMXSY2xbc3KCAE0MHQ-A,Gemini 3 Deep Think: Identifying logical errors in complex mathematics research,Gemini 3 Deep Think's improved reasoning makes it a robust tool for poking holes in even the most complex instances of ...,https://i.ytimg.com/vi/bNrbxCvFrKA/default.jpg,120,90,https://i.ytimg.com/vi/bNrbxCvFrKA/mqdefault.jpg,320,180,https://i.ytimg.com/vi/bNrbxCvFrKA/hqdefault.jpg,480,360,Google DeepMind,none,2026-02-20T20:58:52Z
4,youtube#searchResult,-vmUzde1jO1cWxlGfl240NsFdzE,youtube#video,eAOaRJj02HU,2026-02-20T20:58:49Z,UCP7jMXSY2xbc3KCAE0MHQ-A,Gemini 3 Deep Think: Accelerating mechanical engineering and rapid prototyping,"Engineering workflows require translating logic into executable, physical solutions. Anupam Pathak, an R&D lead in Google's ...",https://i.ytimg.com/vi/eAOaRJj02HU/default.jpg,120,90,https://i.ytimg.com/vi/eAOaRJj02HU/mqdefault.jpg,320,180,https://i.ytimg.com/vi/eAOaRJj02HU/hqdefault.jpg,480,360,Google DeepMind,none,2026-02-20T20:58:49Z
0,youtube#searchResult,Gse4EUaVzgiVdUSKkaejdsdI-Os,youtube#video,R5tSpTqXfxM,2026-03-05T04:22:03Z,UCj09XsAWj-RF9kY4UvBJh_A,AI DevTalks Live with Google Cloud - Ep 12 Agentic RAG with Vector Search 2.0 and ADK,Tech Talk: Agentic RAG with Vector Search 2.0 and ADK Speaker: Kaz Sato (Google) Abstract: Build a production-ready Agentic ...,https://i.ytimg.com/vi/R5tSpTqXfxM/default.jpg,120,90,https://i.ytimg.com/vi/R5tSpTqXfxM/mqdefault.jpg,320,180,https://i.ytimg.com/vi/R5tSpTqXfxM/hqdefault.jpg,480,360,AICamp,none,2026-03-05T04:22:03Z
1,youtube#searchResult,1NWL7jakntfCHgF9lIdKdZFR3Ho,youtube#video,-nqwrAEpZFk,2026-02-26T23:37:17Z,UCj09XsAWj-RF9kY4UvBJh_A,AI Deep Dive Series (Virtual) -  The Architecture Behind Self-Evolving AI Agents,Tech Talk: The Architecture Behind Self-Evolving AI Agents Speaker: Chris Latimer (Vectorize) Abstract: Every agent framework ...,https://i.ytimg.com/vi/-nqwrAEpZFk/default.jpg,120,90,https://i.ytimg.com/vi/-nqwrAEpZFk/mqdefault.jpg,320,180,https://i.ytimg.com/vi/-nqwrAEpZFk/hqdefault.jpg,480,360,AICamp,none,2026-02-26T23:37:17Z
2,youtube#searchResult,G7hmD2QKAxixTKm7_mNmJPYLNow,youtube#video,0n295LLJoMc,2026-02-25T05:03:39Z,UCj09XsAWj-RF9kY4UvBJh_A,AI Deep Dive Series (Virtual) - Build Reliable AI apps with Observability,"Tech Talk: Build Reliable AI apps with Observability, Validations and Evaluations Speaker: Hoc Phan (Okahu) Abstract: As ...",https://i.ytimg.com/vi/0n295LLJoMc/default.jpg,120,90,https://i.ytimg.com/vi/0n295LLJoMc/mqdefault.jpg,320,180,https://i.ytimg.com/vi/0n295LLJoMc/hqdefault.jpg,480,360,AICamp,none,2026-02-25T05:03:39Z
3,youtube#searchResult,l_axRL8cYNSdbrRuMqZvaG3fXGQ,youtube#video,XvH2dzE4Hjk,2026-02-21T19:32:29Z,UCj09XsAWj-RF9kY4UvBJh_A,AWS AI Builder Lab (San Francisco) - Clash of Agents,Build. Compete. Win. The AWS AI Builder Lab is where developers master production-grade multi-agent AI systems in one ...,https://i.ytimg.com/vi/XvH2dzE4Hjk/default.jpg,120,90,https://i.ytimg.com/vi/XvH2dzE4Hjk/mqdefault.jpg,320,180,https://i.ytimg.com/vi/XvH2dzE4Hjk/hqdefault.jpg,480,360,AICamp,none,2026-02-21T19:32:29Z
4,youtube#searchResult,InKX6UJhWkXXfPR0fo9lR1fllKA,youtube#video,8UqmRoJjUEE,2026-02-20T03:47:32Z,UCj09XsAWj-RF9kY4UvBJh_A,AWS AI Builder Lab SF - Future of AI Agents,Speaker: James Bland (AWS),https://i.ytimg.com/vi/8UqmRoJjUEE/default.jpg,120,90,https://i.ytimg.com/vi/8UqmRoJjUEE/mqdefault.jpg,320,180,https://i.ytimg.com/vi/8UqmRoJjUEE/hqdefault.jpg,480,360,AICamp,none,2026-02-20T03:47:32Z
0,youtube#searchResult,kiAVERzi5M7Y0VpVFSUEgDyrVCo,youtube#video,Pw4polTZx90,2025-11-21T18:12:41Z,UCuGC1JusVvbOGa__qMtH3QA,"smart content conference oct 19 2010 welcome, Seth Grimes, Laurel Earhart","Smart Content Conference, October 19, 2010 in New York.",https://i.ytimg.com/vi/Pw4polTZx90/default.jpg,120,90,https://i.ytimg.com/vi/Pw4polTZx90/mqdefault.jpg,320,180,https://i.ytimg.com/vi/Pw4polTZx90/hqdefault.jpg,480,360,Natural Language Processing presentations,none,2025-11-21T18:12:41Z
1,youtube#searchResult,vRb9Q_NnuLq28FuXG_2xV81WwKc,youtube#video,Hyp6ByQlCXI,2025-11-21T18:11:17Z,UCuGC1JusVvbOGa__qMtH3QA,"temis lightning talk, Guillaume Mazières","Smart Content Conference, October 19, 2010 in New York.",https://i.ytimg.com/vi/Hyp6ByQlCXI/default.jpg,120,90,https://i.ytimg.com/vi/Hyp6ByQlCXI/mqdefault.jpg,320,180,https://i.ytimg.com/vi/Hyp6ByQlCXI/hqdefault.jpg,480,360,Natural Language Processing presentations,none,2025-11-21T18:11:17Z
2,youtube#searchResult,BlFYXQm1V8NPW83T2U3M3-tqZoQ,youtube#video,7_Es1r6panQ,2025-11-21T18:11:32Z,UCuGC1JusVvbOGa__qMtH3QA,"delivering richer, smarter, targeted content, michael o lavitt","Smart Content Conference, October 19, 2010 in New York.",https://i.ytimg.com/vi/7_Es1r6panQ/default.jpg,120,90,https://i.ytimg.com/vi/7_Es1r6panQ/mqdefault.jpg,320,180,https://i.ytimg.com/vi/7_Es1r6panQ/hqdefault.jpg,480,360,Natural Language Processing presentations,none,2025-11-21T18:11:32Z
3,youtube#searchResult,uNY8rjkkkmvQnwDKG_tX_WeyFBE,youtube#video,TufdWzrHt9k,2025-11-21T18:11:45Z,UCuGC1JusVvbOGa__qMtH3QA,"analyst tools, competitive analysis, and market intelligence, fred wergeles","Smart Content Conference, October 19, 2010 in New York.",https://i.ytimg.com/vi/TufdWzrHt9k/default.jpg,120,90,https://i.ytimg.com/vi/TufdWzrHt9k/mqdefault.jpg,320,180,https://i.ytimg.com/vi/TufdWzrHt9k/hqdefault.jpg,480,360,Natural Language Processing presentations,none,2025-11-21T18:11:45Z
4,youtube#searchResult,LodzTD0F6t1XM6ZQlIH3gciRcTs,youtube#video,aomKq3iqEUI,2025-11-21T18:12:03Z,UCuGC1JusVvbOGa__qMtH3QA,"linguamatics lightning talk, smart content, david milward","Smart Content Conference, October 19, 2010 in New York.",https://i.ytimg.com/vi/aomKq3iqEUI/default.jpg,120,90,https://i.ytimg.com/vi/aomKq3iqEUI/mqdefault.jpg,320,180,https://i.ytimg.com/vi/aomKq3iqEUI/hqdefault.jpg,480,360,Natural Language Processing presentations,none,2025-11-21T18:12:03Z
0,youtube#searchResult,ZEFdHnPBUxZJHA4Oe4t-dBGpWzk,youtube#video,45Beo0ZkJJA,2026-03-10T21:05:00Z,UCBp3w4DCEC64FZr4k9ROxig,Getting started with Weights &amp; Biases for robotics,"W&B Models helps AI teams track experiments, manage model artifacts, and collaborate across the entire AI model development ...",https://i.ytimg.com/vi/45Beo0ZkJJA/default.jpg,120,90,https://i.ytimg.com/vi/45Beo0ZkJJA/mqdefault.jpg,320,180,https://i.ytimg.com/vi/45Beo0ZkJJA/hqdefault.jpg,480,360,Weights & Biases,none,2026-03-10T21:05:00Z
1,youtube#searchResult,OlUuX8YELaDxE_sUkryKhbi40b4,youtube#video,_pOOpXZ5BcM,2026-02-20T17:33:11Z,UCBp3w4DCEC64FZr4k9ROxig,Local or Global? The Big Question in AI Drug Discovery | Isomorphic Labs,There are two fundamental approaches to ML in drug discovery: local models and global models. Which should you use?,https://i.ytimg.com/vi/_pOOpXZ5BcM/default.jpg,120,90,https://i.ytimg.com/vi/_pOOpXZ5BcM/mqdefault.jpg,320,180,https://i.ytimg.com/vi/_pOOpXZ5BcM/hqdefault.jpg,480,360,Weights & Biases,none,2026-02-20T17:33:11Z
2,youtube#searchResult,ryfMk7HkrO8hi5zKc8qYIkBKq2Q,youtube#video,ffurzNK4QhE,2026-02-18T17:48:47Z,UCBp3w4DCEC64FZr4k9ROxig,Why We&#39;re Not Close to AI Drugs Yet | Isomorphic Labs,Drug design isn't one ML problem; it's a wide variety of challenges requiring specific system representations. Isomorphic Labs' ...,https://i.ytimg.com/vi/ffurzNK4QhE/default.jpg,120,90,https://i.ytimg.com/vi/ffurzNK4QhE/mqdefault.jpg,320,180,https://i.ytimg.com/vi/ffurzNK4QhE/hqdefault.jpg,480,360,Weights & Biases,none,2026-02-18T17:48:47Z
3,youtube#searchResult,xATTsE3Xyglvd2mFLIBkm9HE1N4,youtube#video,E9zJKNb5HZI,2026-02-13T15:00:32Z,UCBp3w4DCEC64FZr4k9ROxig,W&amp;B Alerts: Full Model Traceability,View the full model and any artifact lineage for your AI experiments. #shorts.,https://i.ytimg.com/vi/E9zJKNb5HZI/default.jpg,120,90,https://i.ytimg.com/vi/E9zJKNb5HZI/mqdefault.jpg,320,180,https://i.ytimg.com/vi/E9zJKNb5HZI/hqdefault.jpg,480,360,Weights & Biases,none,2026-02-13T15:00:32Z
4,youtube#searchResult,NZUbuJpk64ZNkUsEbtfPybxD1Dk,youtube#video,-bszzs9_X50,2026-02-12T23:00:01Z,UCBp3w4DCEC64FZr4k9ROxig,W&amp;B Models: Automate reports and workspaces,Automate report and workspace generation for your projects to reduce manual work for your AI researchers. #shorts.,https://i.ytimg.com/vi/-bszzs9_X50/default.jpg,120,90,https://i.ytimg.com/vi/-bszzs9_X50/mqdefault.jpg,320,180,https://i.ytimg.com/vi/-bszzs9_X50/hqdefault.jpg,480,360,Weights & Biases,none,2026-02-12T23:00:01Z
5,youtube#searchResult,LUe5_ZzqPj4uJ1kkxF8diwznVOA,youtube#video,Duy7IkOiWSk,2026-02-12T19:51:47Z,UCBp3w4DCEC64FZr4k9ROxig,Big Tech&#39;s $500 Billion Spending Problem | David Cahn Partner at Sequoia,"7 companies now control 33% of the S&P 500. Their cloud businesses are golden geese, but they're trapped in an arms race.",https://i.ytimg.com/vi/Duy7IkOiWSk/default.jpg,120,90,https://i.ytimg.com/vi/Duy7IkOiWSk/mqdefault.jpg,320,180,https://i.ytimg.com/vi/Duy7IkOiWSk/hqdefault.jpg,480,360,Weights & Biases,none,2026-02-12T19:51:47Z
6,youtube#searchResult,8aNgVOyYzd5b_cJeME4VFO3ep0I,youtube#video,OHMWl2feQjY,2026-02-11T16:14:13Z,UCBp3w4DCEC64FZr4k9ROxig,This Is Where AI Isn’t Trusted Yet,"Enterprises face a brutal choice: rely on humans to painstakingly verify critical systems, or trust AI where mistakes aren't allowed.",https://i.ytimg.com/vi/OHMWl2feQjY/default.jpg,120,90,https://i.ytimg.com/vi/OHMWl2feQjY/mqdefault.jpg,320,180,https://i.ytimg.com/vi/OHMWl2feQjY/hqdefault.jpg,480,360,Weights & Biases,none,2026-02-11T16:14:13Z
7,youtube#searchResult,Kn0YViAw0NC5KjlqVWtfEQQ6a0E,youtube#video,gU-cz72_C8Y,2026-02-10T21:00:44Z,UCBp3w4DCEC64FZr4k9ROxig,W&amp;B Models: Alerts,Send Slack notifications to your team for critical changes in training metrics with a few of clicks #shorts.,https://i.ytimg.com/vi/gU-cz72_C8Y/default.jpg,120,90,https://i.ytimg.com/vi/gU-cz72_C8Y/mqdefault.jpg,320,180,https://i.ytimg.com/vi/gU-cz72_C8Y/hqdefault.jpg,480,360,Weights & Biases,none,2026-02-10T21:00:44Z
8,youtube#searchResult,Hir59UFxkOozOHPfhmw79TmEaEs,youtube#video,YMFHYkMkZ6o,2026-02-09T18:18:53Z,UCBp3w4DCEC64FZr4k9ROxig,Can AI Pass the Hardest Math Test?,"The Putnam is essentially the Olympics of undergraduate math, and it regularly humbles even the best students. Carina Hong ...",https://i.ytimg.com/vi/YMFHYkMkZ6o/default.jpg,120,90,https://i.ytimg.com/vi/YMFHYkMkZ6o/mqdefault.jpg,320,180,https://i.ytimg.com/vi/YMFHYkMkZ6o/hqdefault.jpg,480,360,Weights & Biases,none,2026-02-09T18:18:53Z
9,youtube#searchResult,DFS7GLAqRfJP64ker6asE0Hf8fQ,youtube#video,QxfsjDBDw3M,2026-02-05T14:00:43Z,UCBp3w4DCEC64FZr4k9ROxig,"She Raised $64M to Build an AI Math Prodigy | Carina Hong, CEO of Axiom","Formal verification already consumes years of human effort. In this episode, Lukas Biewald talks with Carina Hong, Founder ...",https://i.ytimg.com/vi/QxfsjDBDw3M/default.jpg,120,90,https://i.ytimg.com/vi/QxfsjDBDw3M/mqdefault.jpg,320,180,https://i.ytimg.com/vi/QxfsjDBDw3M/hqdefault.jpg,480,360,Weights & Biases,none,2026-02-05T14:00:43Z
10,youtube#searchResult,xJi3b0krdsI-8FJ_5_rlGninNtE,youtube#video,8CH_n5KNTCc,2026-01-31T20:09:17Z,UCBp3w4DCEC64FZr4k9ROxig,GenZs are changing office culture,"Gen Z is replacing hour-long meetings with quick, async videos. Atlassian CEO Mike Cannon-Brookes explains how their ...",https://i.ytimg.com/vi/8CH_n5KNTCc/default.jpg,120,90,https://i.ytimg.com/vi/8CH_n5KNTCc/mqdefault.jpg,320,180,https://i.ytimg.com/vi/8CH_n5KNTCc/hqdefault.jpg,480,360,Weights & Biases,none,2026-01-31T20:09:17Z
11,youtube#searchResult,CzuKNGpTHIRVq9vRe_Xgdg9SVmM,youtube#video,0wg-v8MCe7k,2026-01-30T18:00:01Z,UCBp3w4DCEC64FZr4k9ROxig,JetBrains + Weights &amp; Biases: Establishing frameworks and best practices for enterprise AI agents,"Hear from Vadim Briliantov, the Technical Lead for Koog at JetBrains, as he shares how JetBrains continues to shape ...",https://i.ytimg.com/vi/0wg-v8MCe7k/default.jpg,120,90,https://i.ytimg.com/vi/0wg-v8MCe7k/mqdefault.jpg,320,180,https://i.ytimg.com/vi/0wg-v8MCe7k/hqdefault.jpg,480,360,Weights & Biases,none,2026-01-30T18:00:01Z
12,youtube#searchResult,vUAsYRqgQU6yvruyiqaLJgNfOe0,youtube#video,rwwuiokmUx4,2026-01-28T20:15:28Z,UCBp3w4DCEC64FZr4k9ROxig,Why you should hire junior developers,Common wisdom says AI will replace entry-level roles. Mike Cannon-Brookes thinks the opposite. In this episode of Gradient ...,https://i.ytimg.com/vi/rwwuiokmUx4/default.jpg,120,90,https://i.ytimg.com/vi/rwwuiokmUx4/mqdefault.jpg,320,180,https://i.ytimg.com/vi/rwwuiokmUx4/hqdefault.jpg,480,360,Weights & Biases,none,2026-01-28T20:15:28Z
13,youtube#searchResult,ojaXvtquOywOavnzxfOMz591_I8,youtube#video,XE-X7d3-hmw,2026-01-27T22:00:37Z,UCBp3w4DCEC64FZr4k9ROxig,Beyond AI implementation: Introducing JDLA&#39;s initiatives,JDLA is an industry association dedicated to the industrial and societal implementation of AI. As the application of AI to business ...,https://i.ytimg.com/vi/XE-X7d3-hmw/default.jpg,120,90,https://i.ytimg.com/vi/XE-X7d3-hmw/mqdefault.jpg,320,180,https://i.ytimg.com/vi/XE-X7d3-hmw/hqdefault.jpg,480,360,Weights & Biases,none,2026-01-27T22:00:37Z
14,youtube#searchResult,_Q5YSLoDQF543b_YZucmiDIxcFY,youtube#video,-TZRIHRRrsM,2026-01-25T20:01:00Z,UCBp3w4DCEC64FZr4k9ROxig,Why One Bigger Chip Beats Many for AI,"Every time data leaves a chip, it gets slower and more expensive. Andrew Feldman, CEO of Cerebras Systems, explains why ...",https://i.ytimg.com/vi/-TZRIHRRrsM/default.jpg,120,90,https://i.ytimg.com/vi/-TZRIHRRrsM/mqdefault.jpg,320,180,https://i.ytimg.com/vi/-TZRIHRRrsM/hqdefault.jpg,480,360,Weights & Biases,none,2026-01-25T20:01:00Z
