,kind,etag,id.kind,id.videoId,snippet.publishedAt,snippet.channelId,snippet.title,snippet.description,snippet.thumbnails.default.url,snippet.thumbnails.default.width,snippet.thumbnails.default.height,snippet.thumbnails.medium.url,snippet.thumbnails.medium.width,snippet.thumbnails.medium.height,snippet.thumbnails.high.url,snippet.thumbnails.high.width,snippet.thumbnails.high.height,snippet.channelTitle,snippet.liveBroadcastContent,snippet.publishTime
0,youtube#searchResult,_N5dza-wcKscizqi5u6eokXOdM0,youtube#video,UyeBa0OCh2I,2021-08-27T12:30:13Z,UCTmFBhuhMibVoSfYom1uXEg,Graph Introduction in hindi - Data Structures &amp; Algorithms Tutorials In Python #12,"In this video we will go over the introduction of graph data structure in python. There are two types of graphs, (1) Directed: There is a direction in the way two ...",https://i.ytimg.com/vi/UyeBa0OCh2I/default.jpg,120,90,https://i.ytimg.com/vi/UyeBa0OCh2I/mqdefault.jpg,320,180,https://i.ytimg.com/vi/UyeBa0OCh2I/hqdefault.jpg,480,360,codebasics Hindi,none,2021-08-27T12:30:13Z
1,youtube#searchResult,CGuwSTbz8vj8uHNN1laqeoEpJ_Y,youtube#video,FLHyJs9z48o,2021-08-25T12:30:18Z,UCTmFBhuhMibVoSfYom1uXEg,"Quantization in deep learning in Hindi | Deep Learning Tutorials (Tensorflow, Keras &amp; Python)","Quantization in deep learning: Are you planning to deploy a deep learning model on any edge device (microcontrollers, cell phone or wearable device)?",https://i.ytimg.com/vi/FLHyJs9z48o/default.jpg,120,90,https://i.ytimg.com/vi/FLHyJs9z48o/mqdefault.jpg,320,180,https://i.ytimg.com/vi/FLHyJs9z48o/hqdefault.jpg,480,360,codebasics Hindi,none,2021-08-25T12:30:18Z
2,youtube#searchResult,irx9Q2lOD0bGI54myFtvStYGFOQ,youtube#video,dGPcdU4ufgE,2021-08-21T13:00:15Z,UCTmFBhuhMibVoSfYom1uXEg,Binary Tree Part 2 | BST | Binary Search Tree | Data Structures &amp; Algorithms Tutorials In Hindi #11,"In this part 2 tutorial of binary tree, binary search tree (a.k.a BST), we will see how you can delete a node from a binary search tree. We will look at 3 different ...",https://i.ytimg.com/vi/dGPcdU4ufgE/default.jpg,120,90,https://i.ytimg.com/vi/dGPcdU4ufgE/mqdefault.jpg,320,180,https://i.ytimg.com/vi/dGPcdU4ufgE/hqdefault.jpg,480,360,codebasics Hindi,none,2021-08-21T13:00:15Z
3,youtube#searchResult,XKFOoUDPr9BU6bSoKMMZvhmI6rA,youtube#video,jCd0khQQzIk,2021-08-19T12:30:12Z,UCTmFBhuhMibVoSfYom1uXEg,Binary Tree Part 1 | BST | Binary Search Tree | Data Structures &amp; Algorithms Tutorials In Hindi #10,Binary tree is a special case of a general tree where you can have maximum 2 children for any given node. They are useful in implementing set/map class in ...,https://i.ytimg.com/vi/jCd0khQQzIk/default.jpg,120,90,https://i.ytimg.com/vi/jCd0khQQzIk/mqdefault.jpg,320,180,https://i.ytimg.com/vi/jCd0khQQzIk/hqdefault.jpg,480,360,codebasics Hindi,none,2021-08-19T12:30:12Z
4,youtube#searchResult,sa7oaAa61PfbwYzGRB1HQXPDl10,youtube#video,DLHW037-2NM,2021-08-15T12:30:03Z,UCTmFBhuhMibVoSfYom1uXEg,Do you need a college degree for data science or coding career? | In Hindi,What is the importance of a collge degree in data science or coding career? We will discuss this topic and also go through many examples where people built a ...,https://i.ytimg.com/vi/DLHW037-2NM/default.jpg,120,90,https://i.ytimg.com/vi/DLHW037-2NM/mqdefault.jpg,320,180,https://i.ytimg.com/vi/DLHW037-2NM/hqdefault.jpg,480,360,codebasics Hindi,none,2021-08-15T12:30:03Z
0,youtube#searchResult,RHwBCJfipajBuPG8GCGmYdkEvnc,youtube#video,4VJLZel2OjU,2021-08-25T16:30:45Z,UC23emuGbNM7twofQIrEgPBQ,ðŸ”´ [LIVE] LAST TIME WE SQUEEZED TO $70 ðŸ’ŽðŸ¤²  Shorts LOSE $1B ðŸ”¥ Where will AMC &amp; GameStop go to today?,Subscribe because we LIKE THE STONK. #AMCSqueeze #GME https://www.youtube.com/c/AndrewMoMoney?sub_confirmation=1 4 Free Stocks & Level 2 ...,https://i.ytimg.com/vi/4VJLZel2OjU/default.jpg,120,90,https://i.ytimg.com/vi/4VJLZel2OjU/mqdefault.jpg,320,180,https://i.ytimg.com/vi/4VJLZel2OjU/hqdefault.jpg,480,360,AndrewMoMoney,none,2021-08-25T16:30:45Z
1,youtube#searchResult,WJ0bgNItgCj-Y4onzFziel-igKw,youtube#video,WjOeXUyPhJs,2021-08-24T20:36:44Z,UC23emuGbNM7twofQIrEgPBQ,ðŸ”¥ AMC (+20%) SHORTS SCREWED UP ðŸ”¥ GME (+27%) POINT OF NO RETURN?,Let's get this bread #AMCsqueeze #GME #AMC https://www.youtube.com/c/AndrewMoMoney?sub_confirmation=1 Never miss the next dip: 20% off this ...,https://i.ytimg.com/vi/WjOeXUyPhJs/default.jpg,120,90,https://i.ytimg.com/vi/WjOeXUyPhJs/mqdefault.jpg,320,180,https://i.ytimg.com/vi/WjOeXUyPhJs/hqdefault.jpg,480,360,AndrewMoMoney,none,2021-08-24T20:36:44Z
2,youtube#searchResult,gW4kfG_77y7LFTsA9LRV8tOawdY,youtube#video,6TvFN9jv5xc,2021-08-23T20:40:05Z,UC23emuGbNM7twofQIrEgPBQ,ðŸ”¥ AMC &amp; GME - Double Gamma Squeeze ALREADY the beginning? ðŸ”¥,"Apply for the exclusive MOO link when it drops - Four Free Stocks, Free 2nd Level Data https://forms.gle/66UB92JUziyqNAz18 Let's get this bread ...",https://i.ytimg.com/vi/6TvFN9jv5xc/default.jpg,120,90,https://i.ytimg.com/vi/6TvFN9jv5xc/mqdefault.jpg,320,180,https://i.ytimg.com/vi/6TvFN9jv5xc/hqdefault.jpg,480,360,AndrewMoMoney,none,2021-08-23T20:40:05Z
3,youtube#searchResult,nwfj7Bgx4hkOiHMBHnBPdRlWH4c,youtube#video,q17Bjj4RbTw,2021-08-20T15:00:08Z,UC23emuGbNM7twofQIrEgPBQ,ðŸ”¥ AMC Shorts keep DIGGING their grave ðŸ”¥Why the Market is Changing...,Could we have predicted AMC's dip this morning? Why are AMC shorts rising and how much trouble are Shorts in? Let's get this bread #AMCsqueeze #GME ...,https://i.ytimg.com/vi/q17Bjj4RbTw/default.jpg,120,90,https://i.ytimg.com/vi/q17Bjj4RbTw/mqdefault.jpg,320,180,https://i.ytimg.com/vi/q17Bjj4RbTw/hqdefault.jpg,480,360,AndrewMoMoney,none,2021-08-20T15:00:08Z
4,youtube#searchResult,4OAoJW_z6-YsslRZeRkd4LprR70,youtube#video,NDAc8PopHgw,2021-07-27T17:16:16Z,UC23emuGbNM7twofQIrEgPBQ,ðŸ”´ [LIVE] Gamma Trap while Bitcoin Squeezes ðŸ’ŽðŸ¤²  Market Crash VS. AMC &amp; GAMESTOP MOASS,Subscribe because we LIKE THE STONK. #AMCSqueeze #GME https://www.youtube.com/c/AndrewMoMoney?sub_confirmation=1 One more week on this ...,https://i.ytimg.com/vi/NDAc8PopHgw/default.jpg,120,90,https://i.ytimg.com/vi/NDAc8PopHgw/mqdefault.jpg,320,180,https://i.ytimg.com/vi/NDAc8PopHgw/hqdefault.jpg,480,360,AndrewMoMoney,none,2021-07-27T17:16:16Z
0,youtube#searchResult,9i8sm7ygFysR77eUqL5OnkIXLy8,youtube#video,gTiqV3akBIE,2021-04-21T18:34:03Z,UCBHcMCGaiJhv-ESTcWGJPcw,Visualizing a Twin Earth in NVIDIA Omniverse,This is the Earth as we know it. Creating a â€œDigital Twinâ€ of the Earth using technologies like the #NVIDIAOmniverse ParaView Connector allows scientists to ...,https://i.ytimg.com/vi/gTiqV3akBIE/default.jpg,120,90,https://i.ytimg.com/vi/gTiqV3akBIE/mqdefault.jpg,320,180,https://i.ytimg.com/vi/gTiqV3akBIE/hqdefault.jpg,480,360,NVIDIA Developer,none,2021-04-21T18:34:03Z
1,youtube#searchResult,VZNHWlPtJSmQUlP3ITlJdgSkbBw,youtube#video,Q9mhNqDSqlE,2021-04-21T18:04:56Z,UCBHcMCGaiJhv-ESTcWGJPcw,Top 5 Reasons Why NVIDIA Triton is Simplifying Inference,"NVIDIA Triton Inference Server simplifies the deployment of #AI models at scale in production. Open-source inference serving software, it lets teams deploy ...",https://i.ytimg.com/vi/Q9mhNqDSqlE/default.jpg,120,90,https://i.ytimg.com/vi/Q9mhNqDSqlE/mqdefault.jpg,320,180,https://i.ytimg.com/vi/Q9mhNqDSqlE/hqdefault.jpg,480,360,NVIDIA Developer,none,2021-04-21T18:04:56Z
2,youtube#searchResult,dhbgfEkGNOLrP35OAuYkZC1pKrg,youtube#video,rj7pRJ9VAO4,2021-04-14T17:30:00Z,UCBHcMCGaiJhv-ESTcWGJPcw,"Accelerate Your End-to-End AI, Data Analytics and HPC Workflows with the NVIDIA NGC Catalog","The NGC catalog is a hub of GPU-optimized AI, high-performance computing (HPC), and data analytics software that simplifies and accelerates end-to-end ...",https://i.ytimg.com/vi/rj7pRJ9VAO4/default.jpg,120,90,https://i.ytimg.com/vi/rj7pRJ9VAO4/mqdefault.jpg,320,180,https://i.ytimg.com/vi/rj7pRJ9VAO4/hqdefault.jpg,480,360,NVIDIA Developer,none,2021-04-14T17:30:00Z
3,youtube#searchResult,lJzX8acOE-929IWIV7YWdQ0ftrE,youtube#video,vh-noM8p8Ss,2021-04-14T17:29:31Z,UCBHcMCGaiJhv-ESTcWGJPcw,"Reinvent Video Conferencing, Content Creation &amp; Streaming with AI Using NVIDIA Maxine",NVIDIA Maxine is a GPU-accelerated SDK with state-of-the-art AI features for developers to build virtual collaboration and content creation applications such as ...,https://i.ytimg.com/vi/vh-noM8p8Ss/default.jpg,120,90,https://i.ytimg.com/vi/vh-noM8p8Ss/mqdefault.jpg,320,180,https://i.ytimg.com/vi/vh-noM8p8Ss/hqdefault.jpg,480,360,NVIDIA Developer,none,2021-04-14T17:29:31Z
4,youtube#searchResult,SeIskj2xPw8yzDQwC0Ikovr6kpc,youtube#video,feH4b9_2Oug,2021-04-14T17:02:37Z,UCBHcMCGaiJhv-ESTcWGJPcw,Improve System Latency with NVIDIA Reflex,"System Latency is the measure of PC responsiveness - a critical metric for gamers that is difficult to optimize for. In this demo, we will show you how NVIDIA ...",https://i.ytimg.com/vi/feH4b9_2Oug/default.jpg,120,90,https://i.ytimg.com/vi/feH4b9_2Oug/mqdefault.jpg,320,180,https://i.ytimg.com/vi/feH4b9_2Oug/hqdefault.jpg,480,360,NVIDIA Developer,none,2021-04-14T17:02:37Z
0,youtube#searchResult,F0Ekd0UG_5HzvNFy5uBLs5J8L9M,youtube#video,Fto3OAwUoJ8,2021-07-26T18:38:34Z,UCDYdA4hjckRLRVBrCoKenCQ,[MLOps] The Clear SHOW - S02E13 - mlops_this: Copilot Shenanigans,Ariel should have known better than to mess with shitposts on mlops.community ;) Here is a ClearML pipeline integrated with the notorious mlops_this generated ...,https://i.ytimg.com/vi/Fto3OAwUoJ8/default.jpg,120,90,https://i.ytimg.com/vi/Fto3OAwUoJ8/mqdefault.jpg,320,180,https://i.ytimg.com/vi/Fto3OAwUoJ8/hqdefault.jpg,480,360,ClearML,none,2021-07-26T18:38:34Z
1,youtube#searchResult,cPdS4bR1v0b9XrFExdCGYJhUrOs,youtube#video,bD2_icAyKTA,2021-07-20T11:35:40Z,UCDYdA4hjckRLRVBrCoKenCQ,[MLOps] The Clear SHOW - S02E12 - Goodbye Fig .1 [Sculley15],"Sometimes, even in a field as young and bustling, one has to say goodbye to an old friend. Today we bid adieu to Fig. 1 of D. Sculley et al., AKA ""Hidden ...",https://i.ytimg.com/vi/bD2_icAyKTA/default.jpg,120,90,https://i.ytimg.com/vi/bD2_icAyKTA/mqdefault.jpg,320,180,https://i.ytimg.com/vi/bD2_icAyKTA/hqdefault.jpg,480,360,ClearML,none,2021-07-20T11:35:40Z
2,youtube#searchResult,iyOP6Mpg9qQy4ziccYLmwGA28nQ,youtube#video,WIZ88SmT58M,2021-07-13T20:54:28Z,UCDYdA4hjckRLRVBrCoKenCQ,[MLOps] The Clear SHOW - S02E11 - DIY Strikes Back! Building the Model Store!,"Ariel extends ClearML's ""experiment first"" approach towards a ""model first"" approach - by building a model store. See how easy it is to add metadata to the model ...",https://i.ytimg.com/vi/WIZ88SmT58M/default.jpg,120,90,https://i.ytimg.com/vi/WIZ88SmT58M/mqdefault.jpg,320,180,https://i.ytimg.com/vi/WIZ88SmT58M/hqdefault.jpg,480,360,ClearML,none,2021-07-13T20:54:28Z
3,youtube#searchResult,_DhHsDCw5kjlsPMjZxzpm-wqZNs,youtube#video,SLNXo7aIjIU,2021-07-12T15:00:22Z,UCDYdA4hjckRLRVBrCoKenCQ,[MLOPS] From #GTC21: Workshop - Demonstrating an End-to-End Pipeline for ML/DL Leveraging GPUs,Learn how to take models from research into deployment in an efficient and scalable manner. We'll demonstrate workflows and methodologies so that your data ...,https://i.ytimg.com/vi/SLNXo7aIjIU/default.jpg,120,90,https://i.ytimg.com/vi/SLNXo7aIjIU/mqdefault.jpg,320,180,https://i.ytimg.com/vi/SLNXo7aIjIU/hqdefault.jpg,480,360,ClearML,none,2021-07-12T15:00:22Z
4,youtube#searchResult,r3LsCgWO-1ny8iVOV9MRobp1gXo,youtube#video,ltZqNUEkfE8,2021-07-12T14:00:16Z,UCDYdA4hjckRLRVBrCoKenCQ,[MLOPS] From #GTC21: How to Supercharge Your Teamâ€™s Productivity with MLOps,"Learn how to structure a data scientist-first orchestration setup that allows your DS team to self-manage their allocated NVIDIA GPU clusters, without needing ...",https://i.ytimg.com/vi/ltZqNUEkfE8/default.jpg,120,90,https://i.ytimg.com/vi/ltZqNUEkfE8/mqdefault.jpg,320,180,https://i.ytimg.com/vi/ltZqNUEkfE8/hqdefault.jpg,480,360,ClearML,none,2021-07-12T14:00:16Z
0,youtube#searchResult,hnSx9CnGZDh2ZJwr5RZcQretiCs,youtube#video,gMchDJP0yEI,2021-08-24T19:27:07Z,UC4mrlyLbUN2q92W7P0u_Nzg,Brendan Collins: Visualizing Data? Get to Know Bokeh!,Join our Meetup group for more events and announcements: https://www.meetup.com/data-umbrella Meetup event description: ...,https://i.ytimg.com/vi/gMchDJP0yEI/default.jpg,120,90,https://i.ytimg.com/vi/gMchDJP0yEI/mqdefault.jpg,320,180,https://i.ytimg.com/vi/gMchDJP0yEI/hqdefault.jpg,480,360,Data Umbrella,none,2021-08-24T19:27:07Z
1,youtube#searchResult,9HOWJ3xm_OQ6Pst7S_XIT8VO1HQ,youtube#video,XKNdXN-Jfmo,2021-08-10T19:26:47Z,UC4mrlyLbUN2q92W7P0u_Nzg,Sean Law: Modern Time Series Analysis with STUMPY,Join our Meetup group for more events and announcements: https://www.meetup.com/data-umbrella Event info: ...,https://i.ytimg.com/vi/XKNdXN-Jfmo/default.jpg,120,90,https://i.ytimg.com/vi/XKNdXN-Jfmo/mqdefault.jpg,320,180,https://i.ytimg.com/vi/XKNdXN-Jfmo/hqdefault.jpg,480,360,Data Umbrella,none,2021-08-10T19:26:47Z
2,youtube#searchResult,0bogzeTDMT-xiAVKDWDq-3JI19M,youtube#video,hc8-AhYBu08,2021-07-28T13:13:38Z,UC4mrlyLbUN2q92W7P0u_Nzg,Sam Bail: Intro to Data Analysis with Pandas and Jupyter Notebook,Join our Data Umbrella meetup group here: https://www.meetup.com/data-umbrella ...,https://i.ytimg.com/vi/hc8-AhYBu08/default.jpg,120,90,https://i.ytimg.com/vi/hc8-AhYBu08/mqdefault.jpg,320,180,https://i.ytimg.com/vi/hc8-AhYBu08/hqdefault.jpg,480,360,Data Umbrella,none,2021-07-28T13:13:38Z
3,youtube#searchResult,7CtzghR38P5UsShMalrzI-cyvwU,youtube#video,ybMxQs6J2eM,2021-07-13T19:48:52Z,UC4mrlyLbUN2q92W7P0u_Nzg,Elizabeth DiLuzio: Excel for Data Analysts,Join our Data Umbrella meetup group here: https://www.meetup.com/data-umbrella Key Links: ...,https://i.ytimg.com/vi/ybMxQs6J2eM/default.jpg,120,90,https://i.ytimg.com/vi/ybMxQs6J2eM/mqdefault.jpg,320,180,https://i.ytimg.com/vi/ybMxQs6J2eM/hqdefault.jpg,480,360,Data Umbrella,none,2021-07-13T19:48:52Z
4,youtube#searchResult,-k45QjgZDhE5j-wYm_Jos2EGAMY,youtube#video,dyxS9KKCNzA,2021-06-03T12:47:57Z,UC4mrlyLbUN2q92W7P0u_Nzg,Thomas Fan: 3 Components of Reviewing a Pull Request (scikit-learn),Join our Data Umbrella meetup group here: https://www.meetup.com/data-umbrella Key links: ...,https://i.ytimg.com/vi/dyxS9KKCNzA/default.jpg,120,90,https://i.ytimg.com/vi/dyxS9KKCNzA/mqdefault.jpg,320,180,https://i.ytimg.com/vi/dyxS9KKCNzA/hqdefault.jpg,480,360,Data Umbrella,none,2021-06-03T12:47:57Z
0,youtube#searchResult,4cNzc5nhD9Hpc0ZX8RMTccGM5S4,youtube#video,DQ3EDkHdGa8,2021-08-09T08:56:09Z,UCTEgowmo98A-VI53vwmkmhg,DeepChain presented at ISMB/ECCP 2021,InstaDeep's NicolÃ¡s Lopez Carranza and Marcin J. Skwark recently presented the DeepChain protein design platform at the highly prestigious ISMB/ECCP 2021 ...,https://i.ytimg.com/vi/DQ3EDkHdGa8/default.jpg,120,90,https://i.ytimg.com/vi/DQ3EDkHdGa8/mqdefault.jpg,320,180,https://i.ytimg.com/vi/DQ3EDkHdGa8/hqdefault.jpg,480,360,InstaDeep,none,2021-08-09T08:56:09Z
1,youtube#searchResult,jJBXLz4zJXTBCLO79-7QjGPe9Is,youtube#video,X5TtHaal6As,2021-07-05T16:47:42Z,UCTEgowmo98A-VI53vwmkmhg,TensorFlow Meetup tunis - Arabic Natural Language Processing With TF,"In this TensorFlow Meetup we explored some of the Natural Language Processing, Automatic Speech Recognition and Text To Speech applications for Arabic ...",https://i.ytimg.com/vi/X5TtHaal6As/default.jpg,120,90,https://i.ytimg.com/vi/X5TtHaal6As/mqdefault.jpg,320,180,https://i.ytimg.com/vi/X5TtHaal6As/hqdefault.jpg,480,360,InstaDeep,none,2021-07-05T16:47:42Z
2,youtube#searchResult,eFJh_UOHLgcRvskG8RNThAygdTk,youtube#video,35X6Va0o7Nw,2021-06-21T19:38:42Z,UCTEgowmo98A-VI53vwmkmhg,TunBERT _ ConfÃ©rence de presse,,https://i.ytimg.com/vi/35X6Va0o7Nw/default_live.jpg,120,90,https://i.ytimg.com/vi/35X6Va0o7Nw/mqdefault_live.jpg,320,180,https://i.ytimg.com/vi/35X6Va0o7Nw/hqdefault_live.jpg,480,360,InstaDeep,upcoming,2021-06-21T19:38:42Z
3,youtube#searchResult,DfBK3KkohUqScu6s2UsTUgM9ef8,youtube#video,Uwvx1CIs0ys,2021-03-11T10:09:46Z,UCTEgowmo98A-VI53vwmkmhg,Facilitating powerful molecular dynamics simulations to accelerate protein research,"Molecular Dynamics Simulations provide a wealth of information to uncover links between protein structure, stability and function. Generally, running these ...",https://i.ytimg.com/vi/Uwvx1CIs0ys/default.jpg,120,90,https://i.ytimg.com/vi/Uwvx1CIs0ys/mqdefault.jpg,320,180,https://i.ytimg.com/vi/Uwvx1CIs0ys/hqdefault.jpg,480,360,InstaDeep,none,2021-03-11T10:09:46Z
4,youtube#searchResult,ApNxlafsNDJjhFJ15VsTymCMkCs,youtube#video,CkJtdUu29e4,2020-12-09T04:53:33Z,UCTEgowmo98A-VI53vwmkmhg,DeepChain Live Launch and Demo,Join us on this live launch and deep dive into the DeepChainâ„¢ platform! Our team will explain the main features of the new toolbox and will answer any ...,https://i.ytimg.com/vi/CkJtdUu29e4/default.jpg,120,90,https://i.ytimg.com/vi/CkJtdUu29e4/mqdefault.jpg,320,180,https://i.ytimg.com/vi/CkJtdUu29e4/hqdefault.jpg,480,360,InstaDeep,none,2020-12-09T04:53:33Z
0,youtube#searchResult,MJ7Tohj8Nym9ti2b1wvEhJCFUQ0,youtube#video,sNTlt2SMwkU,2021-06-08T21:44:42Z,UCJ4D3tL-iEWyJJDXJAsd9Mw,"LA Data Science Meetup, June 8, 2021 - Michal Kurka: H2O&#39;s GBM",Overview of H2O GBM implementation by Michal Kurka H2O started its mission to let data scientists train their models on datasets of any size in 2011 with just a ...,https://i.ytimg.com/vi/sNTlt2SMwkU/default.jpg,120,90,https://i.ytimg.com/vi/sNTlt2SMwkU/mqdefault.jpg,320,180,https://i.ytimg.com/vi/sNTlt2SMwkU/hqdefault.jpg,480,360,Real Data Science USA (formerly DataScience.LA),none,2021-06-08T21:44:42Z
1,youtube#searchResult,WZdAUi6PxZmqtz10jo4wQzCql7o,youtube#video,9lEdHju2qgw,2021-04-28T03:36:00Z,UCJ4D3tL-iEWyJJDXJAsd9Mw,"LA R Users - Emily Riederer - Column Names as Contracts - April 27, 2021","Column Names as Contracts*** In this talk, I will explain how controlled vocabularies can be used to form contracts between data producers and data consumers ...",https://i.ytimg.com/vi/9lEdHju2qgw/default.jpg,120,90,https://i.ytimg.com/vi/9lEdHju2qgw/mqdefault.jpg,320,180,https://i.ytimg.com/vi/9lEdHju2qgw/hqdefault.jpg,480,360,Real Data Science USA (formerly DataScience.LA),none,2021-04-28T03:36:00Z
2,youtube#searchResult,ttmMqUIhGzz3ILMkfmm4v39WIFw,youtube#video,aTtD2QlQ9n0,2021-03-31T08:44:37Z,UCJ4D3tL-iEWyJJDXJAsd9Mw,"LA Data Science Meetup, March 30, 2021 - Stanislav Kirillov: CatBoost","CatBoost: Distributed Training, Uncertainty Estimation and Other News by Stanislav Kirillov CatBoost is a popular open-source library for training gradient ...",https://i.ytimg.com/vi/aTtD2QlQ9n0/default.jpg,120,90,https://i.ytimg.com/vi/aTtD2QlQ9n0/mqdefault.jpg,320,180,https://i.ytimg.com/vi/aTtD2QlQ9n0/hqdefault.jpg,480,360,Real Data Science USA (formerly DataScience.LA),none,2021-03-31T08:44:37Z
3,youtube#searchResult,aLv1WSs8aB_i6wD9o7BlnSJhwoE,youtube#video,5kmUE-qHziA,2021-03-25T06:35:54Z,UCJ4D3tL-iEWyJJDXJAsd9Mw,R in Command Line - LA R Users - Mar 24 2021,"Talk 1** In this talk, attendees will get an introduction to writing command-line interfaces in R. The talk begins with a discussion of fundamental command-line ...",https://i.ytimg.com/vi/5kmUE-qHziA/default.jpg,120,90,https://i.ytimg.com/vi/5kmUE-qHziA/mqdefault.jpg,320,180,https://i.ytimg.com/vi/5kmUE-qHziA/hqdefault.jpg,480,360,Real Data Science USA (formerly DataScience.LA),none,2021-03-25T06:35:54Z
4,youtube#searchResult,7k5DkYQhyZjFqDuzoK_AwhHvre0,youtube#video,QUHcwwYB3-o,2021-02-24T06:07:11Z,UCJ4D3tL-iEWyJJDXJAsd9Mw,"Unified Data Applications with Shiny on Delta Lakes - LA R Users Meetup Feb 23, 2021",Talk** Shiny is arguably the most popular framework among data scientists for building advanced data apps. Once you build the Shiny application two questions ...,https://i.ytimg.com/vi/QUHcwwYB3-o/default.jpg,120,90,https://i.ytimg.com/vi/QUHcwwYB3-o/mqdefault.jpg,320,180,https://i.ytimg.com/vi/QUHcwwYB3-o/hqdefault.jpg,480,360,Real Data Science USA (formerly DataScience.LA),none,2021-02-24T06:07:11Z
0,youtube#searchResult,JrF3IrwNjV0goShr5uL-104MJvs,youtube#video,6dpyTMhw-9s,2021-02-16T14:58:38Z,UCH99twkwBNwN-IBQjoHwdCQ,"Chicago ML - February 15, 2021 - Automated Exploration of Bioinformatic Models",,https://i.ytimg.com/vi/6dpyTMhw-9s/default.jpg,120,90,https://i.ytimg.com/vi/6dpyTMhw-9s/mqdefault.jpg,320,180,https://i.ytimg.com/vi/6dpyTMhw-9s/hqdefault.jpg,480,360,Chicago ML,none,2021-02-16T14:58:38Z
1,youtube#searchResult,n5iZ6tN63AFtOfxqAgWwCN05idg,youtube#video,QqIsqpwAur8,2021-02-05T16:40:36Z,UCH99twkwBNwN-IBQjoHwdCQ,"Chicago ML - February 4, 2021 - Patterns for Jupyter Notebooks in Machine Learning","Jupyter Notebook is the tool of choice for many data scientists. Notebooks offer a unique combination of flexibility, visual feedback, and state management in ...",https://i.ytimg.com/vi/QqIsqpwAur8/default.jpg,120,90,https://i.ytimg.com/vi/QqIsqpwAur8/mqdefault.jpg,320,180,https://i.ytimg.com/vi/QqIsqpwAur8/hqdefault.jpg,480,360,Chicago ML,none,2021-02-05T16:40:36Z
2,youtube#searchResult,r9LoHE0EdbMJiYQk8QZJajvcyJU,youtube#video,T05Pd5Gq-5s,2021-01-29T14:40:39Z,UCH99twkwBNwN-IBQjoHwdCQ,"Chicago ML - January 28, 2021 - Probabilistic Generative Model for Multiple-choice Answer Copying",Derrick Higgins of Blue Cross / Blue Shield of Illinois and IIT presents Probabilistic Generative Model for Multiple-choice Answer Copying. Generative models ...,https://i.ytimg.com/vi/T05Pd5Gq-5s/default.jpg,120,90,https://i.ytimg.com/vi/T05Pd5Gq-5s/mqdefault.jpg,320,180,https://i.ytimg.com/vi/T05Pd5Gq-5s/hqdefault.jpg,480,360,Chicago ML,none,2021-01-29T14:40:39Z
3,youtube#searchResult,IB0dval9aHGA-TfOtEugxMnS9_8,youtube#video,hK4fiXz8zXM,2021-01-20T01:47:29Z,UCH99twkwBNwN-IBQjoHwdCQ,"Chicago ML - January 19, 2021 - Scaling Machine Learning with Python and Dask","James Lamb presents an introduction to Dask, a distributed computing framework in the PyData ecosystem. The first half of the talk describes the current state of ...",https://i.ytimg.com/vi/hK4fiXz8zXM/default.jpg,120,90,https://i.ytimg.com/vi/hK4fiXz8zXM/mqdefault.jpg,320,180,https://i.ytimg.com/vi/hK4fiXz8zXM/hqdefault.jpg,480,360,Chicago ML,none,2021-01-20T01:47:29Z
4,youtube#searchResult,E86oZUKZm8XhOrVJ7vlBeHEoiME,youtube#video,uZqlOsOiCTA,2020-12-04T15:15:07Z,UCH99twkwBNwN-IBQjoHwdCQ,"Chicago ML - Dec 3, 2020 - Model Deployment with DRUM","Rajiv and Tim will provide a short overview of typical model deployment patterns and then focus on a new open-source package, DRUM, for model deployment.",https://i.ytimg.com/vi/uZqlOsOiCTA/default.jpg,120,90,https://i.ytimg.com/vi/uZqlOsOiCTA/mqdefault.jpg,320,180,https://i.ytimg.com/vi/uZqlOsOiCTA/hqdefault.jpg,480,360,Chicago ML,none,2020-12-04T15:15:07Z
0,youtube#searchResult,SEaDyLslkWkCUQnp2iOs4UVh23E,youtube#video,j9cNiYwMlpM,2021-01-10T01:06:26Z,UCa3zFn8tzw6GaBKZUzifM9A,Lecture 6: Fairness and Transparency by Jenn Wortman Vaughan,Jenn Wortman Vaughan shows us when models can make unfair decisions and why it is important to critically evaluate them before we deploy them in practical ...,https://i.ytimg.com/vi/j9cNiYwMlpM/default.jpg,120,90,https://i.ytimg.com/vi/j9cNiYwMlpM/mqdefault.jpg,320,180,https://i.ytimg.com/vi/j9cNiYwMlpM/hqdefault.jpg,480,360,NYU AI School,none,2021-01-10T01:06:26Z
1,youtube#searchResult,AUvVOV2tum_8ZtIb07RrPMlMndI,youtube#video,QWQB2aF8XB8,2021-01-09T23:23:31Z,UCa3zFn8tzw6GaBKZUzifM9A,"Lecture 5, Track II: Bayesian Machine Learning by Andrew Gordon Wilson",Andrew G. Wilson teaches us what it means to adopt a Bayesian perspective whilst solving machine learning problems in everyday life. This is the parallel track ...,https://i.ytimg.com/vi/QWQB2aF8XB8/default.jpg,120,90,https://i.ytimg.com/vi/QWQB2aF8XB8/mqdefault.jpg,320,180,https://i.ytimg.com/vi/QWQB2aF8XB8/hqdefault.jpg,480,360,NYU AI School,none,2021-01-09T23:23:31Z
2,youtube#searchResult,0hFVOfQs8SKC7XPeiPMt4Xhplno,youtube#video,sKqz9T_F_EU,2021-01-09T23:07:47Z,UCa3zFn8tzw6GaBKZUzifM9A,"Lecture 5, Track I: Introduction to Deep Reinforcement Learning by Lerrel Pinto","Lerrel Pinto teaches us about deep reinforcement learning, the latest and greatest advances in game-playing agents, and more! This is the parallel track lecture ...",https://i.ytimg.com/vi/sKqz9T_F_EU/default.jpg,120,90,https://i.ytimg.com/vi/sKqz9T_F_EU/mqdefault.jpg,320,180,https://i.ytimg.com/vi/sKqz9T_F_EU/hqdefault.jpg,480,360,NYU AI School,none,2021-01-09T23:07:47Z
3,youtube#searchResult,I2-YSLQwiKiNU2o7GeTylVWvC_c,youtube#video,yfBngqnghYk,2021-01-09T22:21:08Z,UCa3zFn8tzw6GaBKZUzifM9A,Panel: ML Careers,"Join Sara Hooker, Pablo Samuel Castro, Chris Albon, and Marianne Monteiro as they tell you more about how to break into machine learning as a budding ...",https://i.ytimg.com/vi/yfBngqnghYk/default.jpg,120,90,https://i.ytimg.com/vi/yfBngqnghYk/mqdefault.jpg,320,180,https://i.ytimg.com/vi/yfBngqnghYk/hqdefault.jpg,480,360,NYU AI School,none,2021-01-09T22:21:08Z
4,youtube#searchResult,aQeX3LwgNYnOwMpYr6MqZzfNCOU,youtube#video,4b2oF-UIxPs,2021-01-09T04:53:46Z,UCa3zFn8tzw6GaBKZUzifM9A,Panel: Failing at AI,"Join Veronika Cheplygina, Akash Srivastava, Jaan Altosaar, and Siddharth Srivastava in a no-holds-barred panel discussing their failures, the challenges they ...",https://i.ytimg.com/vi/4b2oF-UIxPs/default.jpg,120,90,https://i.ytimg.com/vi/4b2oF-UIxPs/mqdefault.jpg,320,180,https://i.ytimg.com/vi/4b2oF-UIxPs/hqdefault.jpg,480,360,NYU AI School,none,2021-01-09T04:53:46Z
0,youtube#searchResult,MjqxnXxIWW68kkx7EgCCB56plXs,youtube#video,NOrG2YyDNBk,2021-06-18T11:13:22Z,UCYuxbq0trkgoaoN72eJi8dA,Join us for the DATA festival #online in September 2021!,"ONE LAST TIME: No travel, no costs! Be a part of #DATAfestivalonline - all info & free tickets here: https://hubs.li/H0KFJS90.",https://i.ytimg.com/vi/NOrG2YyDNBk/default.jpg,120,90,https://i.ytimg.com/vi/NOrG2YyDNBk/mqdefault.jpg,320,180,https://i.ytimg.com/vi/NOrG2YyDNBk/hqdefault.jpg,480,360,DATA festival,none,2021-06-18T11:13:22Z
