,kind,etag,id.kind,id.videoId,snippet.publishedAt,snippet.channelId,snippet.title,snippet.description,snippet.thumbnails.default.url,snippet.thumbnails.default.width,snippet.thumbnails.default.height,snippet.thumbnails.medium.url,snippet.thumbnails.medium.width,snippet.thumbnails.medium.height,snippet.thumbnails.high.url,snippet.thumbnails.high.width,snippet.thumbnails.high.height,snippet.channelTitle,snippet.liveBroadcastContent,snippet.publishTime
4,youtube#searchResult,BfxeRvVYnMatXABIwA-zkNkpS_o,youtube#video,j7pTZtDUeRc,2022-05-10T09:29:50Z,UCEhI2CfdT5--TYq47K4en4A,PyBCN Meetup 2022/04/21 Shorter feedback loop by running impacted tests only by Mathieu Kniewallner,"Python Barcelona https://pybcn.org At BackMarket, we have dozens of developers working on our Django monolith that holds ...",https://i.ytimg.com/vi/j7pTZtDUeRc/default.jpg,120,90,https://i.ytimg.com/vi/j7pTZtDUeRc/mqdefault.jpg,320,180,https://i.ytimg.com/vi/j7pTZtDUeRc/hqdefault.jpg,480,360,Python Barcelona,none,2022-05-10T09:29:50Z
0,youtube#searchResult,yxY34eXkoYTauaPgUHg1UYFPNn8,youtube#video,AzkUBhufgp8,2023-01-03T20:09:47Z,UC6HfeAa0vWeSWS6IcNAjZ2A,AI-animated visual short story: Never of the past or the future #aiart,An experiment in generating a visualization for a short story from suchwasnot.com (Never of the past or the future). The animation ...,https://i.ytimg.com/vi/AzkUBhufgp8/default.jpg,120,90,https://i.ytimg.com/vi/AzkUBhufgp8/mqdefault.jpg,320,180,https://i.ytimg.com/vi/AzkUBhufgp8/hqdefault.jpg,480,360,Sebastiaan Mathôt,none,2023-01-03T20:09:47Z
1,youtube#searchResult,rNqK97Y-osm_dnTzET3xY2UvT2w,youtube#video,mu7yct6hOSA,2022-03-21T19:44:04Z,UC6HfeAa0vWeSWS6IcNAjZ2A,Publishing a Python package on pip [PythonLiveLessons #6],"Episode 6 of #PythonLiveLessons, a weekly live stream about Python code and more, hosted by Sebastiaan Mathôt.",https://i.ytimg.com/vi/mu7yct6hOSA/default.jpg,120,90,https://i.ytimg.com/vi/mu7yct6hOSA/mqdefault.jpg,320,180,https://i.ytimg.com/vi/mu7yct6hOSA/hqdefault.jpg,480,360,Sebastiaan Mathôt,none,2022-03-21T19:44:04Z
2,youtube#searchResult,iNhicQ-F7ndvyGj8F5FsQaIXM9A,youtube#video,ej3S30nC8Io,2022-03-16T20:21:46Z,UC6HfeAa0vWeSWS6IcNAjZ2A,Documenting Python code (docstrings) [PythonLiveLessons #5],"The sixth episode of #PythonLiveLessons, a weekly live stream about Python code and more, hosted by Sebastiaan Mathôt.",https://i.ytimg.com/vi/ej3S30nC8Io/default.jpg,120,90,https://i.ytimg.com/vi/ej3S30nC8Io/mqdefault.jpg,320,180,https://i.ytimg.com/vi/ej3S30nC8Io/hqdefault.jpg,480,360,Sebastiaan Mathôt,none,2022-03-16T20:21:46Z
3,youtube#searchResult,kjTsSzMbExWq5QgrW8xYZU1s-DM,youtube#video,vX83-7G0Qm0,2022-03-16T05:33:29Z,UC6HfeAa0vWeSWS6IcNAjZ2A,PythonLiveLessons #6: Publishing a Python package on pip,"This is the seventh episode of #PythonLiveLessons, a weekly live stream about Python code and more, hosted by Sebastiaan ...",https://i.ytimg.com/vi/vX83-7G0Qm0/default.jpg,120,90,https://i.ytimg.com/vi/vX83-7G0Qm0/mqdefault.jpg,320,180,https://i.ytimg.com/vi/vX83-7G0Qm0/hqdefault.jpg,480,360,Sebastiaan Mathôt,none,2022-03-16T05:33:29Z
4,youtube#searchResult,Yp7j6IDyz67PhDYJpWSbKiutcFM,youtube#video,f4ZQ-_Sft0I,2022-03-09T05:35:13Z,UC6HfeAa0vWeSWS6IcNAjZ2A,PythonLiveLessons #5: Documenting your Python project,"This is the sixth episode of #PythonLiveLessons, a weekly live stream about Python code and more, hosted by Sebastiaan Mathôt.",https://i.ytimg.com/vi/f4ZQ-_Sft0I/default.jpg,120,90,https://i.ytimg.com/vi/f4ZQ-_Sft0I/mqdefault.jpg,320,180,https://i.ytimg.com/vi/f4ZQ-_Sft0I/hqdefault.jpg,480,360,Sebastiaan Mathôt,none,2022-03-09T05:35:13Z
0,youtube#searchResult,G4qT9MxzzzUxTQ5URmH70H_0y6g,youtube#video,aaUpuxnTaGQ,2026-01-30T16:24:18Z,UCDVL0bPrZHwCeJrlyy-wxaQ,AI Sustainability: The Cost of Big Language Models #shorts,"Large language models are advancing quickly, but powering them is expensive—requiring massive compute power and energy.",https://i.ytimg.com/vi/aaUpuxnTaGQ/default.jpg,120,90,https://i.ytimg.com/vi/aaUpuxnTaGQ/mqdefault.jpg,320,180,https://i.ytimg.com/vi/aaUpuxnTaGQ/hqdefault.jpg,480,360,Global AI Community,none,2026-01-30T16:24:18Z
1,youtube#searchResult,AvX1Zw3n8Jv2iiazYiPA4kZYmo8,youtube#video,eSy8BfIt0bw,2026-01-29T16:25:27Z,UCDVL0bPrZHwCeJrlyy-wxaQ,AI Agents: 3 Key Areas for Developers to Check #shorts,Developers are focusing on custom AI solutions or niche startup workflows. Three key areas to consider when evaluating if your AI ...,https://i.ytimg.com/vi/eSy8BfIt0bw/default.jpg,120,90,https://i.ytimg.com/vi/eSy8BfIt0bw/mqdefault.jpg,320,180,https://i.ytimg.com/vi/eSy8BfIt0bw/hqdefault.jpg,480,360,Global AI Community,none,2026-01-29T16:25:27Z
2,youtube#searchResult,udh1zj4PobhE8GBXjHd2c5MuZu8,youtube#video,OI4mEbD0gJM,2026-01-28T16:25:29Z,UCDVL0bPrZHwCeJrlyy-wxaQ,"LLM Agent Metrics: Groundedness, Fairness, Fluency Explained #shorts","LLM agents can be evaluated at every step: final response, trajectory, & statistical metrics. Groundedness, fairness, fluency—it ...",https://i.ytimg.com/vi/OI4mEbD0gJM/default.jpg,120,90,https://i.ytimg.com/vi/OI4mEbD0gJM/mqdefault.jpg,320,180,https://i.ytimg.com/vi/OI4mEbD0gJM/hqdefault.jpg,480,360,Global AI Community,none,2026-01-28T16:25:29Z
3,youtube#searchResult,F1HpWUBeTJteZSHDd6e_rZldryI,youtube#video,sKRnvpFfxII,2026-01-25T16:27:23Z,UCDVL0bPrZHwCeJrlyy-wxaQ,Microsoft Azure OpenAI: Meet Principal PM Manager #shorts,Meet a Microsoft leader accelerating developer productivity with the latest large language models. Learn how Azure OpenAI ...,https://i.ytimg.com/vi/sKRnvpFfxII/default.jpg,120,90,https://i.ytimg.com/vi/sKRnvpFfxII/mqdefault.jpg,320,180,https://i.ytimg.com/vi/sKRnvpFfxII/hqdefault.jpg,480,360,Global AI Community,none,2026-01-25T16:27:23Z
4,youtube#searchResult,zdoEh_d1nys8_tenWim-mV60MI0,youtube#video,fXbCXKZoDRA,2026-01-23T16:31:22Z,UCDVL0bPrZHwCeJrlyy-wxaQ,AI Model Comparison: GPT-4 vs LLaMA-3 for Your Data #shorts,Test different AI agent models like GPT-4 and LLaMA-3 by running simulations. See how model choice impacts responses and ...,https://i.ytimg.com/vi/fXbCXKZoDRA/default.jpg,120,90,https://i.ytimg.com/vi/fXbCXKZoDRA/mqdefault.jpg,320,180,https://i.ytimg.com/vi/fXbCXKZoDRA/hqdefault.jpg,480,360,Global AI Community,none,2026-01-23T16:31:22Z
0,youtube#searchResult,rPfPeaeseWAWGXARX7HJByravJk,youtube#video,NdPMaDzpqW8,2023-09-09T17:37:09Z,UCxArXLI-gxlTmWGGgec5D7w,Functions in Julia -Learn Julia 15/n-,"What are functions and what do they do ? In this video I present functions in Julia, what are they, how do they work, and how we ...",https://i.ytimg.com/vi/NdPMaDzpqW8/default.jpg,120,90,https://i.ytimg.com/vi/NdPMaDzpqW8/mqdefault.jpg,320,180,https://i.ytimg.com/vi/NdPMaDzpqW8/hqdefault.jpg,480,360,Rémi Vezy,none,2023-09-09T17:37:09Z
1,youtube#searchResult,J6dy3wsOINK5a2cLW2BqXU7aj3I,youtube#video,wTiVtP5tYPY,2023-08-21T14:58:42Z,UCxArXLI-gxlTmWGGgec5D7w,"For loops in Julia (eachindex, enumerate...) -Learn Julia 14/n-","How can we repeatedly execute code in Julia ? In this video I present for loops in Julia, what are they and how they work, and I ...",https://i.ytimg.com/vi/wTiVtP5tYPY/default.jpg,120,90,https://i.ytimg.com/vi/wTiVtP5tYPY/mqdefault.jpg,320,180,https://i.ytimg.com/vi/wTiVtP5tYPY/hqdefault.jpg,480,360,Rémi Vezy,none,2023-08-21T14:58:42Z
2,youtube#searchResult,A_RiDPy3ZyYRnyvRGf1jsSQtroU,youtube#video,qNK9C3ewoGE,2022-08-20T13:16:04Z,UCxArXLI-gxlTmWGGgec5D7w,Conditionals in Julia (if...else...) -Learn Julia 13/n-,"If you appreciate this video, you can buy me a coffee on Tipeee: https://fr.tipeee.com/remi-vezy What are conditional statements ?",https://i.ytimg.com/vi/qNK9C3ewoGE/default.jpg,120,90,https://i.ytimg.com/vi/qNK9C3ewoGE/mqdefault.jpg,320,180,https://i.ytimg.com/vi/qNK9C3ewoGE/hqdefault.jpg,480,360,Rémi Vezy,none,2022-08-20T13:16:04Z
3,youtube#searchResult,S8J3j6jSDiVMHXbqn7MeafdTh8U,youtube#video,zCvYmbP1esc,2022-05-22T19:07:40Z,UCxArXLI-gxlTmWGGgec5D7w,`begin` and `let` in Julia -Learn Julia 12/n-,You can buy me a coffee on Tipeee: https://fr.tipeee.com/remi-vezy What are `begin...end` statements ? What is the difference with ...,https://i.ytimg.com/vi/zCvYmbP1esc/default.jpg,120,90,https://i.ytimg.com/vi/zCvYmbP1esc/mqdefault.jpg,320,180,https://i.ytimg.com/vi/zCvYmbP1esc/hqdefault.jpg,480,360,Rémi Vezy,none,2022-05-22T19:07:40Z
4,youtube#searchResult,QJ2slbBUOJ_Qu_CTw0wgiJhEoxQ,youtube#video,yZwHgdAEx5Q,2022-04-24T19:46:02Z,UCxArXLI-gxlTmWGGgec5D7w,String operators in Julia -Learn Julia 11/n-,You can buy me a coffee on Tipeee: https://fr.tipeee.com/remi-vezy What is a string? What is the difference with characters?,https://i.ytimg.com/vi/yZwHgdAEx5Q/default.jpg,120,90,https://i.ytimg.com/vi/yZwHgdAEx5Q/mqdefault.jpg,320,180,https://i.ytimg.com/vi/yZwHgdAEx5Q/hqdefault.jpg,480,360,Rémi Vezy,none,2022-04-24T19:46:02Z
0,youtube#searchResult,YOVs6YIVg8aIuEumAEdqvsX_v1g,youtube#video,saskQ-EjCLQ,2025-04-09T18:05:39Z,UCupQLyNchb9-2Z5lmUOIijw,Lecture 20 – Learning the feature vector 𝒇(𝒙),"Lecture sample from my undergraduate course at NYU, «Introduction to Deep Learning», Spring 2025 Notebook: ...",https://i.ytimg.com/vi/saskQ-EjCLQ/default.jpg,120,90,https://i.ytimg.com/vi/saskQ-EjCLQ/mqdefault.jpg,320,180,https://i.ytimg.com/vi/saskQ-EjCLQ/hqdefault.jpg,480,360,Alfredo Canziani (冷在),none,2025-04-09T18:05:39Z
1,youtube#searchResult,NuO2Yveg3VeoVv1siwAFGq6Dkng,youtube#video,IKjd34ZsFVw,2025-01-23T21:18:39Z,UCupQLyNchb9-2Z5lmUOIijw,Cosine (extract from undergrad DLSP25),I think the new undergrad course is going well. At least we're having fun!,https://i.ytimg.com/vi/IKjd34ZsFVw/default.jpg,120,90,https://i.ytimg.com/vi/IKjd34ZsFVw/mqdefault.jpg,320,180,https://i.ytimg.com/vi/IKjd34ZsFVw/hqdefault.jpg,480,360,Alfredo Canziani (冷在),none,2025-01-23T21:18:39Z
2,youtube#searchResult,XwInghl9ONzyA-80o3xUHC0LJJg,youtube#video,g4sSU6B99Ek,2024-06-26T17:53:47Z,UCupQLyNchb9-2Z5lmUOIijw,"Chapter 2, video 4–6",Summary of the next 3 video lectures.,https://i.ytimg.com/vi/g4sSU6B99Ek/default.jpg,120,90,https://i.ytimg.com/vi/g4sSU6B99Ek/mqdefault.jpg,320,180,https://i.ytimg.com/vi/g4sSU6B99Ek/hqdefault.jpg,480,360,Alfredo Canziani (冷在),none,2024-06-26T17:53:47Z
3,youtube#searchResult,Vd7r_-Pa8gmhw3rsVK-ucehL7IM,youtube#video,WYnYCKXVfhg,2024-06-25T21:21:13Z,UCupQLyNchb9-2Z5lmUOIijw,06 – Optimisation and gradient ascent,Course website: https://atcold.github.io/NYU-AISP24/,https://i.ytimg.com/vi/WYnYCKXVfhg/default.jpg,120,90,https://i.ytimg.com/vi/WYnYCKXVfhg/mqdefault.jpg,320,180,https://i.ytimg.com/vi/WYnYCKXVfhg/hqdefault.jpg,480,360,Alfredo Canziani (冷在),none,2024-06-25T21:21:13Z
4,youtube#searchResult,5fkcx1FlOfXcBAXVyjTyNia2lXU,youtube#video,i31lQ18Gcbc,2024-06-18T15:01:24Z,UCupQLyNchb9-2Z5lmUOIijw,"05 – Multi-class perceptron, binary and multi-class logistic regression",Course website: https://atcold.github.io/NYU-AISP24/,https://i.ytimg.com/vi/i31lQ18Gcbc/default.jpg,120,90,https://i.ytimg.com/vi/i31lQ18Gcbc/mqdefault.jpg,320,180,https://i.ytimg.com/vi/i31lQ18Gcbc/hqdefault.jpg,480,360,Alfredo Canziani (冷在),none,2024-06-18T15:01:24Z
0,youtube#searchResult,n4BsStwDx1A7GDA7we99Fwavu4k,youtube#video,vCqMCIdIHGo,2019-10-01T12:29:58Z,UCBEShbs7rtE_ZjTmb6Jt5WA,PROGRAM TO FIND FACTORIAL OF GIVEN NUMBER,DURecorder This is my video recorded with DU Recorder. It's easy to record your screen and livestream. Download link: Android: ...,https://i.ytimg.com/vi/vCqMCIdIHGo/default.jpg,120,90,https://i.ytimg.com/vi/vCqMCIdIHGo/mqdefault.jpg,320,180,https://i.ytimg.com/vi/vCqMCIdIHGo/hqdefault.jpg,480,360,Real Python,none,2019-10-01T12:29:58Z
1,youtube#searchResult,QMdZN8zhI0EZ1xVys7c1WyHIwHg,youtube#video,TUlTY9GnKXE,2019-10-01T12:16:53Z,UCBEShbs7rtE_ZjTmb6Jt5WA,PYTHON PROGRAM TO PRINT REVERSE OF A NUMBER,,https://i.ytimg.com/vi/TUlTY9GnKXE/default.jpg,120,90,https://i.ytimg.com/vi/TUlTY9GnKXE/mqdefault.jpg,320,180,https://i.ytimg.com/vi/TUlTY9GnKXE/hqdefault.jpg,480,360,Real Python,none,2019-10-01T12:16:53Z
0,youtube#searchResult,IFBtjpDiSX04DTfpRrqgZcLRisI,youtube#video,zMaZuKwU49o,2026-01-30T21:15:04Z,UC9IuUwwE2xdjQUT_LMLONoA,FerriteCon 2025 Abdulazis Mohamed: Revisiting Adaptive Mesh Refinement that&#39;s not P4est,"In this session, Abdulaziz revisits and extends the AMR work presented at last year's conference, focusing on a refined algorithm ...",https://i.ytimg.com/vi/zMaZuKwU49o/default.jpg,120,90,https://i.ytimg.com/vi/zMaZuKwU49o/mqdefault.jpg,320,180,https://i.ytimg.com/vi/zMaZuKwU49o/hqdefault.jpg,480,360,The Julia Programming Language,none,2026-01-30T21:15:04Z
1,youtube#searchResult,Mcc__sCPQQqCnMsb5HLbgVkaIxY,youtube#video,jkCp3q5UOkw,2026-01-30T21:15:05Z,UC9IuUwwE2xdjQUT_LMLONoA,FerriteCon 2025 Dennis Ogiermann: Order Matters,"From FerriteCon 2025, the Ferrite.jl user & developer conference held on August 28, 2025 at the Technical University of Denmark ...",https://i.ytimg.com/vi/jkCp3q5UOkw/default.jpg,120,90,https://i.ytimg.com/vi/jkCp3q5UOkw/mqdefault.jpg,320,180,https://i.ytimg.com/vi/jkCp3q5UOkw/hqdefault.jpg,480,360,The Julia Programming Language,none,2026-01-30T21:15:05Z
2,youtube#searchResult,pVz6W2jmg1xOgTUkbjJZptjX3iM,youtube#video,0DCAK7y8uF4,2026-01-30T21:00:01Z,UC9IuUwwE2xdjQUT_LMLONoA,FerriteCon 2025 Quoc Tuan La: Viscoplastic Modeling the Evolving Mechanical Properties,"From FerriteCon 2025, the Ferrite.jl user & developer conference held on August 28, 2025 at the Technical University of Denmark ...",https://i.ytimg.com/vi/0DCAK7y8uF4/default.jpg,120,90,https://i.ytimg.com/vi/0DCAK7y8uF4/mqdefault.jpg,320,180,https://i.ytimg.com/vi/0DCAK7y8uF4/hqdefault.jpg,480,360,The Julia Programming Language,none,2026-01-30T21:00:01Z
3,youtube#searchResult,TMpmhPlvtmNKUSMU9eubLCzLjfc,youtube#video,HYf-E_mfNP4,2026-01-29T22:00:20Z,UC9IuUwwE2xdjQUT_LMLONoA,FerriteCon 2025 Cris Moen: ShellFEA.jl - A shell finite element library for Ferrite.jl,ShellFEA.jl provides a home for shell element implementations — specialized finite elements used to model thin-walled structures ...,https://i.ytimg.com/vi/HYf-E_mfNP4/default.jpg,120,90,https://i.ytimg.com/vi/HYf-E_mfNP4/mqdefault.jpg,320,180,https://i.ytimg.com/vi/HYf-E_mfNP4/hqdefault.jpg,480,360,The Julia Programming Language,none,2026-01-29T22:00:20Z
4,youtube#searchResult,DsjETOklk_-LngKGqul2HpHTe6A,youtube#video,4XA03XXTdzI,2026-01-29T21:45:00Z,UC9IuUwwE2xdjQUT_LMLONoA,FerriteCon 2025 Abdelrahman Fathy: A  Tale of Two Multigrids: A Case Study on A- and P-,"In this session, Abdelrahman contrasts two powerful multigrid approaches: Algebraic Multigrid (AMG) and Polynomial Multigrid ...",https://i.ytimg.com/vi/4XA03XXTdzI/default.jpg,120,90,https://i.ytimg.com/vi/4XA03XXTdzI/mqdefault.jpg,320,180,https://i.ytimg.com/vi/4XA03XXTdzI/hqdefault.jpg,480,360,The Julia Programming Language,none,2026-01-29T21:45:00Z
0,youtube#searchResult,4pGr6NuOXGG8agHPYsQFmlqMKOs,youtube#video,cUEdNmnKJVQ,2025-10-17T22:20:14Z,UC12LqyqTQYbXatYS9AA7Nuw,Responsible AI - Lesson 2: Foundations of Responsible AI,"This video will cover a review of the previous lesson on evaluating large language models (LLMs), followed by an introduction to ...",https://i.ytimg.com/vi/cUEdNmnKJVQ/default.jpg,120,90,https://i.ytimg.com/vi/cUEdNmnKJVQ/mqdefault.jpg,320,180,https://i.ytimg.com/vi/cUEdNmnKJVQ/hqdefault.jpg,480,360,Machine Learning University,none,2025-10-17T22:20:14Z
1,youtube#searchResult,49tTYRiIU6ZJbt77QbsFK4vKlb0,youtube#video,KGbplvULNwg,2025-10-17T22:20:14Z,UC12LqyqTQYbXatYS9AA7Nuw,Building Apps with Foundation Models - Lesson 4: Agents,"This lesson will begin by reviewing Lesson 4. Then, we will discuss tools and agents. We will cover some specifics of LangChain ...",https://i.ytimg.com/vi/KGbplvULNwg/default.jpg,120,90,https://i.ytimg.com/vi/KGbplvULNwg/mqdefault.jpg,320,180,https://i.ytimg.com/vi/KGbplvULNwg/hqdefault.jpg,480,360,Machine Learning University,none,2025-10-17T22:20:14Z
2,youtube#searchResult,4vqwc3EsrbX-GnKpKpW-aOwJZ4U,youtube#video,0dLiVlWQhYU,2025-10-17T22:20:14Z,UC12LqyqTQYbXatYS9AA7Nuw,Building Apps with Foundation Models - Lesson 1: LangChain Modules and Integration,"This video includes a review of Module 2 (Responsible Generative AI) and an introduction to LangChain, its various modules, and ...",https://i.ytimg.com/vi/0dLiVlWQhYU/default.jpg,120,90,https://i.ytimg.com/vi/0dLiVlWQhYU/mqdefault.jpg,320,180,https://i.ytimg.com/vi/0dLiVlWQhYU/hqdefault.jpg,480,360,Machine Learning University,none,2025-10-17T22:20:14Z
3,youtube#searchResult,cGkwyAj4dhxIZHKhbHV7uwpfHkY,youtube#video,8togqsH1xRU,2025-10-17T22:20:14Z,UC12LqyqTQYbXatYS9AA7Nuw,Responsible AI - Lesson 1: Evaluating Large Language Models,"This video will begin with a review of Generative AI Module 1 (Fundamentals of Generative AI), covering the key concepts and ...",https://i.ytimg.com/vi/8togqsH1xRU/default.jpg,120,90,https://i.ytimg.com/vi/8togqsH1xRU/mqdefault.jpg,320,180,https://i.ytimg.com/vi/8togqsH1xRU/hqdefault.jpg,480,360,Machine Learning University,none,2025-10-17T22:20:14Z
4,youtube#searchResult,heKPQnh3_6_WYIa0_o3IAmjco_o,youtube#video,5H77KxUbQnA,2025-10-17T22:20:14Z,UC12LqyqTQYbXatYS9AA7Nuw,Building Apps with Foundation Models - Lesson 3: Retrieval Augmented Generation (RAG),"This video begins with a review of Lesson 2 . Then we'll explore the concept of grounding a model. Next, we'll dive deeper into ...",https://i.ytimg.com/vi/5H77KxUbQnA/default.jpg,120,90,https://i.ytimg.com/vi/5H77KxUbQnA/mqdefault.jpg,320,180,https://i.ytimg.com/vi/5H77KxUbQnA/hqdefault.jpg,480,360,Machine Learning University,none,2025-10-17T22:20:14Z
0,youtube#searchResult,za_bFRDUV0o5XV3Tml9kNizpYsU,youtube#video,0ZpphjzNaGI,2026-01-29T17:00:02Z,UCX6b17PVsYBQ0ip5gyeme-Q,Animals &amp; Shapeshifters: Crash Course Latin American Literature #10,"Fish and insects and dogs—oh my! In this episode of Crash Course Latin American Literature, we'll explore how all things fuzzy, ...",https://i.ytimg.com/vi/0ZpphjzNaGI/default.jpg,120,90,https://i.ytimg.com/vi/0ZpphjzNaGI/mqdefault.jpg,320,180,https://i.ytimg.com/vi/0ZpphjzNaGI/hqdefault.jpg,480,360,CrashCourse,none,2026-01-29T17:00:02Z
1,youtube#searchResult,U9_hxLUHWH08yv6Gcjpy9IyhKdE,youtube#video,Lw4oMXTEAkw,2026-01-27T17:00:28Z,UCX6b17PVsYBQ0ip5gyeme-Q,Statistical Thinking in Science: Crash Course Scientific Thinking #2,"We're all gonna die someday. But can statistics help us know when? In this episode of Crash Course Scientific Thinking, we'll ...",https://i.ytimg.com/vi/Lw4oMXTEAkw/default.jpg,120,90,https://i.ytimg.com/vi/Lw4oMXTEAkw/mqdefault.jpg,320,180,https://i.ytimg.com/vi/Lw4oMXTEAkw/hqdefault.jpg,480,360,CrashCourse,none,2026-01-27T17:00:28Z
2,youtube#searchResult,2CJRXOp9y_Wds5Lh2y4JfPRveeg,youtube#video,-a739VjqdSI,2016-11-21T23:02:30Z,UCX6b17PVsYBQ0ip5gyeme-Q,Utilitarianism: Crash Course Philosophy #36,"Our next stop in our tour of the ethical lay of the land is utilitarianism. With a little help from Batman, Hank explains the principle of ...",https://i.ytimg.com/vi/-a739VjqdSI/default.jpg,120,90,https://i.ytimg.com/vi/-a739VjqdSI/mqdefault.jpg,320,180,https://i.ytimg.com/vi/-a739VjqdSI/hqdefault.jpg,480,360,CrashCourse,none,2016-11-21T23:02:30Z
3,youtube#searchResult,aqG00fXdXIfy99TictHQ98qEmsY,youtube#video,17WiQ_tNld4,2016-07-11T20:43:48Z,UCX6b17PVsYBQ0ip5gyeme-Q,Arguments Against Personal Identity: Crash Course Philosophy #20,How can Daenerys Targaryen help us understand personal identity? Find out as Hank continues our exploration of personal ...,https://i.ytimg.com/vi/17WiQ_tNld4/default.jpg,120,90,https://i.ytimg.com/vi/17WiQ_tNld4/mqdefault.jpg,320,180,https://i.ytimg.com/vi/17WiQ_tNld4/hqdefault.jpg,480,360,CrashCourse,none,2016-07-11T20:43:48Z
4,youtube#searchResult,10uVOOD9_ToY-DxryaAUYmbNs4Q,youtube#video,3ez10ADR_gM,2015-07-08T22:34:19Z,UCX6b17PVsYBQ0ip5gyeme-Q,Intro to Economics: Crash Course Econ #1,"In which Jacob Clifford and Adriene Hill launch a brand new Crash Course on Economics! So, what is economics? Good question ...",https://i.ytimg.com/vi/3ez10ADR_gM/default.jpg,120,90,https://i.ytimg.com/vi/3ez10ADR_gM/mqdefault.jpg,320,180,https://i.ytimg.com/vi/3ez10ADR_gM/hqdefault.jpg,480,360,CrashCourse,none,2015-07-08T22:34:19Z
0,youtube#searchResult,fJjaqXw_2NtEsp6Eo7KOLFDeO74,youtube#video,Z-FRe5AKmCU,2026-01-13T20:06:59Z,UCSHZKyawb77ixDdsGog4iWA,Paul Rosolie: Uncontacted Tribes in the Amazon Jungle | Lex Fridman Podcast #489,"Paul Rosolie is a naturalist, explorer, author of a new book titled Junglekeeper, and is someone who has dedicated his life to ...",https://i.ytimg.com/vi/Z-FRe5AKmCU/default.jpg,120,90,https://i.ytimg.com/vi/Z-FRe5AKmCU/mqdefault.jpg,320,180,https://i.ytimg.com/vi/Z-FRe5AKmCU/hqdefault.jpg,480,360,Lex Fridman,none,2026-01-13T20:06:59Z
1,youtube#searchResult,qf9xINy-lXBv7QBJUO7yAQuHtfI,youtube#video,14OPT6CcsH4,2025-12-31T21:26:17Z,UCSHZKyawb77ixDdsGog4iWA,"Infinity, Paradoxes, Gödel Incompleteness &amp; the Mathematical Multiverse | Lex Fridman Podcast #488","Joel David Hamkins is a mathematician and philosopher specializing in set theory, the foundations of mathematics, and the nature ...",https://i.ytimg.com/vi/14OPT6CcsH4/default.jpg,120,90,https://i.ytimg.com/vi/14OPT6CcsH4/mqdefault.jpg,320,180,https://i.ytimg.com/vi/14OPT6CcsH4/hqdefault.jpg,480,360,Lex Fridman,none,2025-12-31T21:26:17Z
2,youtube#searchResult,rlMHs3htO0g0igdVuPPEgYBXtZ4,youtube#video,_bBRVNkAfkQ,2025-12-12T20:01:08Z,UCSHZKyawb77ixDdsGog4iWA,"Deciphering Secrets of Ancient Civilizations, Noah&#39;s Ark, and Flood Myths | Lex Fridman Podcast #487","Irving Finkel is a scholar of ancient languages and a longtime curator at the British Museum, renowned for his expertise in ...",https://i.ytimg.com/vi/_bBRVNkAfkQ/default.jpg,120,90,https://i.ytimg.com/vi/_bBRVNkAfkQ/mqdefault.jpg,320,180,https://i.ytimg.com/vi/_bBRVNkAfkQ/hqdefault.jpg,480,360,Lex Fridman,none,2025-12-12T20:01:08Z
3,youtube#searchResult,SW0JM-P2Ur9Ezsdsp9AB-K2W5Qg,youtube#video,Qp0rCU49lMs,2025-11-30T19:30:21Z,UCSHZKyawb77ixDdsGog4iWA,Michael Levin: Hidden Reality of Alien Intelligence &amp; Biological Life | Lex Fridman Podcast #486,Michael Levin is a biologist at Tufts University working on novel ways to understand and control complex pattern formation in ...,https://i.ytimg.com/vi/Qp0rCU49lMs/default.jpg,120,90,https://i.ytimg.com/vi/Qp0rCU49lMs/mqdefault.jpg,320,180,https://i.ytimg.com/vi/Qp0rCU49lMs/hqdefault.jpg,480,360,Lex Fridman,none,2025-11-30T19:30:21Z
4,youtube#searchResult,N2n5WIkBHVgdIzvgCqJsrXba7vk,youtube#video,m_CFCyc2Shs,2025-11-17T18:27:43Z,UCSHZKyawb77ixDdsGog4iWA,"David Kirtley: Nuclear Fusion, Plasma Physics, and the Future of Energy | Lex Fridman Podcast #485","David Kirtley is a nuclear fusion engineer and CEO of Helion Energy, a company working on building the world's first commercial ...",https://i.ytimg.com/vi/m_CFCyc2Shs/default.jpg,120,90,https://i.ytimg.com/vi/m_CFCyc2Shs/mqdefault.jpg,320,180,https://i.ytimg.com/vi/m_CFCyc2Shs/hqdefault.jpg,480,360,Lex Fridman,none,2025-11-17T18:27:43Z
5,youtube#searchResult,Bn5zMRGJu0fZcn52kco73ezmIIs,youtube#video,7OLVwZeMCfY,2025-10-14T17:21:10Z,UCSHZKyawb77ixDdsGog4iWA,"Julia Shaw: Criminal Psychology of Murder, Serial Killers, Memory &amp; Sex | Lex Fridman Podcast #483","Julia Shaw is a criminal psychologist and author who in her books explores human nature, including psychopathy, violent crime, ...",https://i.ytimg.com/vi/7OLVwZeMCfY/default.jpg,120,90,https://i.ytimg.com/vi/7OLVwZeMCfY/mqdefault.jpg,320,180,https://i.ytimg.com/vi/7OLVwZeMCfY/hqdefault.jpg,480,360,Lex Fridman,none,2025-10-14T17:21:10Z
6,youtube#searchResult,I00g6hZwChPZs6ps-NQJZms6O6M,youtube#video,-Qm1_On71Oo,2025-09-04T19:56:59Z,UCSHZKyawb77ixDdsGog4iWA,"Dave Hone: T-Rex, Dinosaurs, Extinction, Evolution, and Jurassic Park | Lex Fridman Podcast #480","Dave Hone is a paleontologist, expert on dinosaurs, co-host of the Terrible Lizards podcast, and author of numerous scientific ...",https://i.ytimg.com/vi/-Qm1_On71Oo/default.jpg,120,90,https://i.ytimg.com/vi/-Qm1_On71Oo/mqdefault.jpg,320,180,https://i.ytimg.com/vi/-Qm1_On71Oo/hqdefault.jpg,480,360,Lex Fridman,none,2025-09-04T19:56:59Z
7,youtube#searchResult,ZGHSezzp2I6JoTFAu1OCv2y0GjE,youtube#video,HsLgZzgpz9Y,2025-08-29T23:52:25Z,UCSHZKyawb77ixDdsGog4iWA,"Dave Plummer: Programming, Autism, and Old-School Microsoft Stories | Lex Fridman Podcast #479","Dave Plummer is a programmer, former Microsoft software engineer (Windows 95, NT, XP), creator of Task Manager, author of two ...",https://i.ytimg.com/vi/HsLgZzgpz9Y/default.jpg,120,90,https://i.ytimg.com/vi/HsLgZzgpz9Y/mqdefault.jpg,320,180,https://i.ytimg.com/vi/HsLgZzgpz9Y/hqdefault.jpg,480,360,Lex Fridman,none,2025-08-29T23:52:25Z
8,youtube#searchResult,5KbMA9v7MDnDyWhgXkJiTj4KwW8,youtube#video,y3yAVZk3tyA,2025-08-13T20:35:35Z,UCSHZKyawb77ixDdsGog4iWA,"Keyu Jin: China&#39;s Economy, Tariffs, Trade, Trump, Communism &amp; Capitalism | Lex Fridman Podcast #477","Keyu Jin is an economist specializing in China's economy, international macroeconomics, global trade imbalances, and financial ...",https://i.ytimg.com/vi/y3yAVZk3tyA/default.jpg,120,90,https://i.ytimg.com/vi/y3yAVZk3tyA/mqdefault.jpg,320,180,https://i.ytimg.com/vi/y3yAVZk3tyA/hqdefault.jpg,480,360,Lex Fridman,none,2025-08-13T20:35:35Z
9,youtube#searchResult,pACIQVq3v6vxgbQ8EoUR_WcqAiA,youtube#video,mO3ay4F3S60,2025-08-08T23:23:46Z,UCSHZKyawb77ixDdsGog4iWA,Timeline for AGI: 2030 with 50% chance,,https://i.ytimg.com/vi/mO3ay4F3S60/default.jpg,120,90,https://i.ytimg.com/vi/mO3ay4F3S60/mqdefault.jpg,320,180,https://i.ytimg.com/vi/mO3ay4F3S60/hqdefault.jpg,480,360,Lex Fridman,none,2025-08-08T23:23:46Z
