,kind,etag,id.kind,id.videoId,snippet.publishedAt,snippet.channelId,snippet.title,snippet.description,snippet.thumbnails.default.url,snippet.thumbnails.default.width,snippet.thumbnails.default.height,snippet.thumbnails.medium.url,snippet.thumbnails.medium.width,snippet.thumbnails.medium.height,snippet.thumbnails.high.url,snippet.thumbnails.high.width,snippet.thumbnails.high.height,snippet.channelTitle,snippet.liveBroadcastContent,snippet.publishTime
1,youtube#searchResult,G1Ar90REW6P5hdo65FOP68HgJ3I,youtube#video,4CDd3n9iZag,2022-05-19T07:33:28Z,UCYuxbq0trkgoaoN72eJi8dA,Interview Dr. Holger Kömm,,https://i.ytimg.com/vi/4CDd3n9iZag/default.jpg,120,90,https://i.ytimg.com/vi/4CDd3n9iZag/mqdefault.jpg,320,180,https://i.ytimg.com/vi/4CDd3n9iZag/hqdefault.jpg,480,360,DATA festival,none,2022-05-19T07:33:28Z
2,youtube#searchResult,aPkDqA4-S5d6RREsWKcSGCfVSc0,youtube#video,3RJUhrBySkY,2022-05-19T07:33:33Z,UCYuxbq0trkgoaoN72eJi8dA,Founders Carsten &amp; Alex talk about the start of DATA festival and previous years in Data &amp; AI,The two founders of DATA festival - Alexander Thamm and Dr. Carsten Bange - take a look back into the past and talk about the ...,https://i.ytimg.com/vi/3RJUhrBySkY/default.jpg,120,90,https://i.ytimg.com/vi/3RJUhrBySkY/mqdefault.jpg,320,180,https://i.ytimg.com/vi/3RJUhrBySkY/hqdefault.jpg,480,360,DATA festival,none,2022-05-19T07:33:33Z
3,youtube#searchResult,_bhSSgavAk1Vcq-WH3FMBz5dIDY,youtube#video,oSNi5Wy1UU4,2022-05-19T07:33:22Z,UCYuxbq0trkgoaoN72eJi8dA,Interview Dr. Alexander Borek,"Dr. Alexander Borek is Data Executive at Zalando SE and a DATA festival committee member from day one. In the video-interview, ...",https://i.ytimg.com/vi/oSNi5Wy1UU4/default.jpg,120,90,https://i.ytimg.com/vi/oSNi5Wy1UU4/mqdefault.jpg,320,180,https://i.ytimg.com/vi/oSNi5Wy1UU4/hqdefault.jpg,480,360,DATA festival,none,2022-05-19T07:33:22Z
4,youtube#searchResult,xuYVDuTQoBazqwh7PFbyR2oWLv4,youtube#video,YVZQ4wlqywM,2022-05-19T07:33:17Z,UCYuxbq0trkgoaoN72eJi8dA,Interview Divya Bokaria,Divya Bokaria is Head of Data at Zattoo and since 2021 she is a committee member of the DATA festival. In the interview she tells ...,https://i.ytimg.com/vi/YVZQ4wlqywM/default.jpg,120,90,https://i.ytimg.com/vi/YVZQ4wlqywM/mqdefault.jpg,320,180,https://i.ytimg.com/vi/YVZQ4wlqywM/hqdefault.jpg,480,360,DATA festival,none,2022-05-19T07:33:17Z
0,youtube#searchResult,o4T1C-iIVyHJp3syAYyDbxWrXdo,youtube#video,FmjPtdP0Pv0,2022-03-28T22:00:12Z,UCKPyg5gsnt6h0aA8EBw3i6A,I Quit My Data Science Job.   Here’s Why,Subscribe to RichardOnData here: https://www.youtube.com/channel/UCKPyg5gsnt6h0aA8EBw3i6A?sub_confirmation=1 In this ...,https://i.ytimg.com/vi/FmjPtdP0Pv0/default.jpg,120,90,https://i.ytimg.com/vi/FmjPtdP0Pv0/mqdefault.jpg,320,180,https://i.ytimg.com/vi/FmjPtdP0Pv0/hqdefault.jpg,480,360,RichardOnData,none,2022-03-28T22:00:12Z
1,youtube#searchResult,X-ZRMtHe_HENBi2XzEeJZD8M_SM,youtube#video,V5srYcnDowA,2022-03-07T21:32:19Z,UCKPyg5gsnt6h0aA8EBw3i6A,10 Good Coding Practices for Data Science,Subscribe to RichardOnData here: https://www.youtube.com/channel/UCKPyg5gsnt6h0aA8EBw3i6A?sub_confirmation=1 In this ...,https://i.ytimg.com/vi/V5srYcnDowA/default.jpg,120,90,https://i.ytimg.com/vi/V5srYcnDowA/mqdefault.jpg,320,180,https://i.ytimg.com/vi/V5srYcnDowA/hqdefault.jpg,480,360,RichardOnData,none,2022-03-07T21:32:19Z
2,youtube#searchResult,GtWh-RB8mkb142KwB_OM5RV7rmM,youtube#video,imZ7bjBBHPg,2021-10-19T21:30:02Z,UCKPyg5gsnt6h0aA8EBw3i6A,Data Science Advice for College Students,"Subscribe to RichardOnData here: https://www.youtube.com/channel/UCKPyg5gsnt6h0aA8EBw3i6A?sub_confirmation=1 ""How ...",https://i.ytimg.com/vi/imZ7bjBBHPg/default.jpg,120,90,https://i.ytimg.com/vi/imZ7bjBBHPg/mqdefault.jpg,320,180,https://i.ytimg.com/vi/imZ7bjBBHPg/hqdefault.jpg,480,360,RichardOnData,none,2021-10-19T21:30:02Z
3,youtube#searchResult,l-apY0o4GvL3XS2fMki5QWoaygs,youtube#video,qnCRmzJHnIc,2021-10-05T15:30:05Z,UCKPyg5gsnt6h0aA8EBw3i6A,The TRUTH About Learning Data Science,Subscribe to RichardOnData here: https://www.youtube.com/channel/UCKPyg5gsnt6h0aA8EBw3i6A?sub_confirmation=1 In this ...,https://i.ytimg.com/vi/qnCRmzJHnIc/default.jpg,120,90,https://i.ytimg.com/vi/qnCRmzJHnIc/mqdefault.jpg,320,180,https://i.ytimg.com/vi/qnCRmzJHnIc/hqdefault.jpg,480,360,RichardOnData,none,2021-10-05T15:30:05Z
4,youtube#searchResult,XEW_at1K2wsOD55-Ea15m2PvhFw,youtube#video,rL-1bqrISWE,2021-08-31T12:38:05Z,UCKPyg5gsnt6h0aA8EBw3i6A,Is the Future of Data Work Remote?,Subscribe to RichardOnData here: https://www.youtube.com/channel/UCKPyg5gsnt6h0aA8EBw3i6A?sub_confirmation=1 In this ...,https://i.ytimg.com/vi/rL-1bqrISWE/default.jpg,120,90,https://i.ytimg.com/vi/rL-1bqrISWE/mqdefault.jpg,320,180,https://i.ytimg.com/vi/rL-1bqrISWE/hqdefault.jpg,480,360,RichardOnData,none,2021-08-31T12:38:05Z
0,youtube#searchResult,5MB6otO5nCUkoO-TzkOCsTsvw1w,youtube#video,dSslgMZEhas,2022-04-25T22:03:00Z,UCvwDejnW-Q49xEb667JqS-g,April 2022 - Live LinkedIn Profile Reviews &amp; Job Search Strategies,"DataPhilly Speaker Event - Apr 21, 2022 Topic: Live LinkedIn Profile Reviews & Job Search Strategies Speaker: Lynne Williams Is ...",https://i.ytimg.com/vi/dSslgMZEhas/default.jpg,120,90,https://i.ytimg.com/vi/dSslgMZEhas/mqdefault.jpg,320,180,https://i.ytimg.com/vi/dSslgMZEhas/hqdefault.jpg,480,360,DataPhilly,none,2022-04-25T22:03:00Z
1,youtube#searchResult,KqYtLD9eLI0iJOsBnrAa4QkdO_k,youtube#video,D3vbH9klbTk,2022-01-03T02:59:02Z,UCvwDejnW-Q49xEb667JqS-g,Introducing Unstructured Data into your Models,"DataPhilly Speaker Event - Dec 16, 2021 Topic: Introducing Unstructured Data into your Models - Extracting predictive info/signals ...",https://i.ytimg.com/vi/D3vbH9klbTk/default.jpg,120,90,https://i.ytimg.com/vi/D3vbH9klbTk/mqdefault.jpg,320,180,https://i.ytimg.com/vi/D3vbH9klbTk/hqdefault.jpg,480,360,DataPhilly,none,2022-01-03T02:59:02Z
2,youtube#searchResult,1pGfSxeoBpQHU8cil-1wdHK_PrU,youtube#video,oVqW390jZX8,2021-12-06T01:20:22Z,UCvwDejnW-Q49xEb667JqS-g,Crime Analysis - How is Data Science helping keep a community safe?,DataPhilly Speaker Event Topic: Crime Analysis - How is Data Science helping keep a community safe? Speaker: Capt.,https://i.ytimg.com/vi/oVqW390jZX8/default.jpg,120,90,https://i.ytimg.com/vi/oVqW390jZX8/mqdefault.jpg,320,180,https://i.ytimg.com/vi/oVqW390jZX8/hqdefault.jpg,480,360,DataPhilly,none,2021-12-06T01:20:22Z
3,youtube#searchResult,NbHcfOK7WXJBUroIjwSIKQMLRko,youtube#video,enDMje2i_F4,2021-10-25T04:00:03Z,UCvwDejnW-Q49xEb667JqS-g,DataPhilly Oct 2021 - Multi-Agent Reinforcement Learning: Dodging Tragedy of the Commons,Speaker Event Topic: Multi-Agent Reinforcement Learning: Dodging Tragedy of the Commons with Simple Mechanisms Speaker: ...,https://i.ytimg.com/vi/enDMje2i_F4/default.jpg,120,90,https://i.ytimg.com/vi/enDMje2i_F4/mqdefault.jpg,320,180,https://i.ytimg.com/vi/enDMje2i_F4/hqdefault.jpg,480,360,DataPhilly,none,2021-10-25T04:00:03Z
4,youtube#searchResult,G7ZBwSlDrLqfs18aMM_Y3AYuPko,youtube#video,PF5RxjsoSNU,2021-07-16T16:02:23Z,UCvwDejnW-Q49xEb667JqS-g,DataPhilly July 2021: Statistical Paradoxes &amp; Logical Fallacies: Don&#39;t Believe Lies your Data Tells,"Speaker Event I hate to admit it, but your data is lying to you — and more often than you think. Having clean data with high volume ...",https://i.ytimg.com/vi/PF5RxjsoSNU/default.jpg,120,90,https://i.ytimg.com/vi/PF5RxjsoSNU/mqdefault.jpg,320,180,https://i.ytimg.com/vi/PF5RxjsoSNU/hqdefault.jpg,480,360,DataPhilly,none,2021-07-16T16:02:23Z
0,youtube#searchResult,TSYm0vc7hFqd-x0AMqUXAABLxD8,youtube#video,4QkSfSSPUdU,2022-05-31T01:10:23Z,UCipPccqvcfychKNOaYUokyQ,森羅プロジェクト_2022(日本語版）,森羅2022 キックオフミーティング □イベントページ: https://aip.riken.jp/events/event_136692/ □時間: 約1時間53分 □目次: ...,https://i.ytimg.com/vi/4QkSfSSPUdU/default.jpg,120,90,https://i.ytimg.com/vi/4QkSfSSPUdU/mqdefault.jpg,320,180,https://i.ytimg.com/vi/4QkSfSSPUdU/hqdefault.jpg,480,360,AIP RIKEN,none,2022-05-31T01:10:23Z
1,youtube#searchResult,o_VRLCqQnNhSvutvCk1ZT3h-5D0,youtube#video,COuLOSAIIVE,2022-05-30T04:10:07Z,UCipPccqvcfychKNOaYUokyQ,TrustML Young Scientist Seminar #15 20220525,https://c5dc59ed978213830355fc8978.doorkeeper.jp/events/137238 YouTubeチャンネルの登録、Twitter のフォローをお願いし ...,https://i.ytimg.com/vi/COuLOSAIIVE/default.jpg,120,90,https://i.ytimg.com/vi/COuLOSAIIVE/mqdefault.jpg,320,180,https://i.ytimg.com/vi/COuLOSAIIVE/hqdefault.jpg,480,360,AIP RIKEN,none,2022-05-30T04:10:07Z
2,youtube#searchResult,7kE5twkf0RAwrXgq-br-H-LdEQo,youtube#video,MoPwK6vUlmA,2022-05-16T07:11:35Z,UCipPccqvcfychKNOaYUokyQ,EPFL CIS-RIKEN AIP Joint Seminar #14 20220511,https://c5dc59ed978213830355fc8978.doorkeeper.jp/events/136277 YouTubeチャンネルの登録、Twitter のフォローをお願いし ...,https://i.ytimg.com/vi/MoPwK6vUlmA/default.jpg,120,90,https://i.ytimg.com/vi/MoPwK6vUlmA/mqdefault.jpg,320,180,https://i.ytimg.com/vi/MoPwK6vUlmA/hqdefault.jpg,480,360,AIP RIKEN,none,2022-05-16T07:11:35Z
3,youtube#searchResult,Setn36HaWkNgSvBpo4K1jcW9vZA,youtube#video,gxJjwRwewPo,2022-05-16T05:01:25Z,UCipPccqvcfychKNOaYUokyQ,TrustML Young Scientist Seminar #14 20220510,https://c5dc59ed978213830355fc8978.doorkeeper.jp/events/136809 YouTubeチャンネルの登録、Twitter のフォローをお願いし ...,https://i.ytimg.com/vi/gxJjwRwewPo/default.jpg,120,90,https://i.ytimg.com/vi/gxJjwRwewPo/mqdefault.jpg,320,180,https://i.ytimg.com/vi/gxJjwRwewPo/hqdefault.jpg,480,360,AIP RIKEN,none,2022-05-16T05:01:25Z
4,youtube#searchResult,p_82FBEWRUGcZ7DqRNmZLFCkLEc,youtube#video,hTEyaIkjUcQ,2022-05-09T03:55:32Z,UCipPccqvcfychKNOaYUokyQ,TrustML Young Scientist Seminar #13 20220503,https://c5dc59ed978213830355fc8978.doorkeeper.jp/events/136719 YouTubeチャンネルの登録、Twitter のフォローをお願いし ...,https://i.ytimg.com/vi/hTEyaIkjUcQ/default.jpg,120,90,https://i.ytimg.com/vi/hTEyaIkjUcQ/mqdefault.jpg,320,180,https://i.ytimg.com/vi/hTEyaIkjUcQ/hqdefault.jpg,480,360,AIP RIKEN,none,2022-05-09T03:55:32Z
0,youtube#searchResult,jRdSy2iPN21j1HUJcRGI1XRJsdQ,youtube#video,VSSa2WwFVBs,2021-11-26T04:26:22Z,UC62ScVTFf3GpDC5gXDesfEQ,"#MKAILIVE - Licensing Artificial Intelligence - Practical, Critical or Political?","In this MKAILive discussion, join us when we ask our panel of contributors to explore the question: Is the licensing of artificial ...",https://i.ytimg.com/vi/VSSa2WwFVBs/default.jpg,120,90,https://i.ytimg.com/vi/VSSa2WwFVBs/mqdefault.jpg,320,180,https://i.ytimg.com/vi/VSSa2WwFVBs/hqdefault.jpg,480,360,Richard Foster-Fletcher,none,2021-11-26T04:26:22Z
1,youtube#searchResult,4ilZAFeTKAqSFDlniALBN0-GQmY,youtube#video,SpK_IbBd-HM,2021-10-22T03:05:28Z,UC62ScVTFf3GpDC5gXDesfEQ,#MKAILIVE - How will we use Artificial Intelligence in 20 years?,"In recognition of Kai-Fu Lee's latest book 'AI in 2041', this #MKAILive broadcast will discuss the question 'How will we use Artificial ...",https://i.ytimg.com/vi/SpK_IbBd-HM/default.jpg,120,90,https://i.ytimg.com/vi/SpK_IbBd-HM/mqdefault.jpg,320,180,https://i.ytimg.com/vi/SpK_IbBd-HM/hqdefault.jpg,480,360,Richard Foster-Fletcher,none,2021-10-22T03:05:28Z
2,youtube#searchResult,wVCqLvZCERatT0JR490ZRgLHtp4,youtube#video,s9j1tKce4Xg,2021-09-24T03:14:00Z,UC62ScVTFf3GpDC5gXDesfEQ,#MKAILIVE - The Ethics and Imperative of Digital Nudging,In this #MKAILive panel discussion we will discuss the ethics and imperative of digital nudging in light of the 2021 IPCC climate ...,https://i.ytimg.com/vi/s9j1tKce4Xg/default.jpg,120,90,https://i.ytimg.com/vi/s9j1tKce4Xg/mqdefault.jpg,320,180,https://i.ytimg.com/vi/s9j1tKce4Xg/hqdefault.jpg,480,360,Richard Foster-Fletcher,none,2021-09-24T03:14:00Z
3,youtube#searchResult,bx2P7F6kIwJO6iSBvjfMriPuZlw,youtube#video,J9x5-8n8r_I,2021-08-20T03:18:19Z,UC62ScVTFf3GpDC5gXDesfEQ,#MKAILIVE - What will it take to solve the bias problem in Artificial Intelligence (AI)?,"AI bias, also known as algorithmic bias is a phenomenon that occurs when an algorithm produces results that are systemically ...",https://i.ytimg.com/vi/J9x5-8n8r_I/default.jpg,120,90,https://i.ytimg.com/vi/J9x5-8n8r_I/mqdefault.jpg,320,180,https://i.ytimg.com/vi/J9x5-8n8r_I/hqdefault.jpg,480,360,Richard Foster-Fletcher,none,2021-08-20T03:18:19Z
4,youtube#searchResult,yThfKeCjqKOidfjuirB5qfbE4Og,youtube#video,hipw3-BJvu8,2021-08-11T04:14:33Z,UC62ScVTFf3GpDC5gXDesfEQ,Ethical AI Certification and Maturity Model - In conversation with Matthew James Bailey,Our world requires a framework to build an ethical foundation that aligns the futures of humans and Artificial Intelligence.,https://i.ytimg.com/vi/hipw3-BJvu8/default.jpg,120,90,https://i.ytimg.com/vi/hipw3-BJvu8/mqdefault.jpg,320,180,https://i.ytimg.com/vi/hipw3-BJvu8/hqdefault.jpg,480,360,Richard Foster-Fletcher,none,2021-08-11T04:14:33Z
0,youtube#searchResult,9gXdj7jFuIDXk41izGE4WXVaCIE,youtube#video,xg2SD4nCy3A,2021-10-21T22:05:06Z,UCY15whY8GyA3DgjZFPdHfAQ,ValleyML AI Expo 2021 - CxO Insights Panel Discussion on Edge AI,"ValleyML AI Expo 2021 Panel, CxO Insights Track Panel Discussion on Edge AI Moderator: Arun Rajasekaran, Consultant, Edge ...",https://i.ytimg.com/vi/xg2SD4nCy3A/default.jpg,120,90,https://i.ytimg.com/vi/xg2SD4nCy3A/mqdefault.jpg,320,180,https://i.ytimg.com/vi/xg2SD4nCy3A/hqdefault.jpg,480,360,ValleyML,none,2021-10-21T22:05:06Z
1,youtube#searchResult,ZY-vF0KR1bQnlG4o0CtfEsYA_yM,youtube#video,-Ygd_1IvpzU,2021-10-21T22:05:11Z,UCY15whY8GyA3DgjZFPdHfAQ,"ValleyML AI Expo 2021 - CxO Insights Presentation by Prasad Saripalli, MINDBODY, Inc.","ValleyML AI Expo 2021 Presentation, CxO Insights Track Title: Wellness is Healthcare Done Right: How AIML and Robotics ...",https://i.ytimg.com/vi/-Ygd_1IvpzU/default.jpg,120,90,https://i.ytimg.com/vi/-Ygd_1IvpzU/mqdefault.jpg,320,180,https://i.ytimg.com/vi/-Ygd_1IvpzU/hqdefault.jpg,480,360,ValleyML,none,2021-10-21T22:05:11Z
2,youtube#searchResult,mwc4XjEVioLtEM99a54NHY2eES8,youtube#video,tlJe_iiMwLg,2021-10-21T22:05:15Z,UCY15whY8GyA3DgjZFPdHfAQ,"ValleyML AI Expo 2021 - AI Hardware Presentation by Iakovos Stamoulis, Think Silicon S.A.","ValleyML AI Expo 2021 Presentation, AI Hardware Track Title: NEOX™, Graphics, Compute & AI extensions based on the RISC-V ...",https://i.ytimg.com/vi/tlJe_iiMwLg/default.jpg,120,90,https://i.ytimg.com/vi/tlJe_iiMwLg/mqdefault.jpg,320,180,https://i.ytimg.com/vi/tlJe_iiMwLg/hqdefault.jpg,480,360,ValleyML,none,2021-10-21T22:05:15Z
3,youtube#searchResult,o77BzDa3mN8VvODWZf-mBa0Dneo,youtube#video,UcbMSefCL-U,2021-10-21T22:05:02Z,UCY15whY8GyA3DgjZFPdHfAQ,"ValleyML AI Expo 2021 - AI Optimization Keynote by Jan Jongboom, Edge Impulse","ValleyML AI Expo 2021 Keynote, AI Optimization Track Title: The future is now: ML on ubiquitous devices Speaker: Jan Jongboom ...",https://i.ytimg.com/vi/UcbMSefCL-U/default.jpg,120,90,https://i.ytimg.com/vi/UcbMSefCL-U/mqdefault.jpg,320,180,https://i.ytimg.com/vi/UcbMSefCL-U/hqdefault.jpg,480,360,ValleyML,none,2021-10-21T22:05:02Z
4,youtube#searchResult,5IS6_qVsbSqzm13NvXWuXYQnDzc,youtube#video,6o34YTyiTHE,2021-10-21T22:04:58Z,UCY15whY8GyA3DgjZFPdHfAQ,"ValleyML AI Expo 2021 - CxO Insights Keynote by Sree Ganesan, Habana Labs","ValleyML AI Expo 2021 Keynote, CxO Insights Track Title: Delivering Deep Learning Training Efficiency with Habana Gaudi® ...",https://i.ytimg.com/vi/6o34YTyiTHE/default.jpg,120,90,https://i.ytimg.com/vi/6o34YTyiTHE/mqdefault.jpg,320,180,https://i.ytimg.com/vi/6o34YTyiTHE/hqdefault.jpg,480,360,ValleyML,none,2021-10-21T22:04:58Z
0,youtube#searchResult,U-GdD_GrT52pOm6zq_lI1fewA_w,youtube#video,5D2Vdt0QMN0,2021-08-12T21:37:24Z,UCMxUmQFr0_dyW8JTLDiOeNQ,"Proof, Provers, and the Lean Theorem Prover - Summer Special!","In this summer special we'll take a break from messy data, and - just for fun - take refuge in the reassuring consistency and ...",https://i.ytimg.com/vi/5D2Vdt0QMN0/default.jpg,120,90,https://i.ytimg.com/vi/5D2Vdt0QMN0/mqdefault.jpg,320,180,https://i.ytimg.com/vi/5D2Vdt0QMN0/hqdefault.jpg,480,360,Data Science Cornwall,none,2021-08-12T21:37:24Z
1,youtube#searchResult,Cr7XVYfjC9ldrTv7KzFduYinITw,youtube#video,Qv4FVsXnf-M,2021-07-29T22:35:10Z,UCMxUmQFr0_dyW8JTLDiOeNQ,Data Challenge Cornwall - Cluster Analysis to Create Personas without Bias,Link to slides: tinyurl.com/SmartlineClusterDataChallenge Slides include links to data and sample code. --- The Smartline Project ...,https://i.ytimg.com/vi/Qv4FVsXnf-M/default.jpg,120,90,https://i.ytimg.com/vi/Qv4FVsXnf-M/mqdefault.jpg,320,180,https://i.ytimg.com/vi/Qv4FVsXnf-M/hqdefault.jpg,480,360,Data Science Cornwall,none,2021-07-29T22:35:10Z
2,youtube#searchResult,Ii5BBkSDVLOt9g2AqfNM97HCujI,youtube#video,6U3h6DBTZes,2021-07-29T22:35:24Z,UCMxUmQFr0_dyW8JTLDiOeNQ,Data Challenge Cornwall - Predicting Housing Faults &amp; Resident Support Needs,Slides: https://drive.google.com/file/d/1lnjUb0tRI_wuHY1psFCArnDj8F116Osg/view?usp=sharing --- Coastline Housing is an ...,https://i.ytimg.com/vi/6U3h6DBTZes/default.jpg,120,90,https://i.ytimg.com/vi/6U3h6DBTZes/mqdefault.jpg,320,180,https://i.ytimg.com/vi/6U3h6DBTZes/hqdefault.jpg,480,360,Data Science Cornwall,none,2021-07-29T22:35:24Z
3,youtube#searchResult,IsLoAi_B9h1l9qDCsKfl4C0nXPU,youtube#video,1Sy0B-4ZRg8,2021-07-29T22:20:51Z,UCMxUmQFr0_dyW8JTLDiOeNQ,Data Challenge Cornwall - OCR of Historical Mining Records,Link to scanned images: https://cornishlithium.egnyte.com/fl/dTYUvzsHR3 Slides: ...,https://i.ytimg.com/vi/1Sy0B-4ZRg8/default.jpg,120,90,https://i.ytimg.com/vi/1Sy0B-4ZRg8/mqdefault.jpg,320,180,https://i.ytimg.com/vi/1Sy0B-4ZRg8/hqdefault.jpg,480,360,Data Science Cornwall,none,2021-07-29T22:20:51Z
4,youtube#searchResult,a7rP_GdFc_LOI0_g5ytXVaVt50w,youtube#video,CuSX2jFMAFc,2021-07-22T23:49:04Z,UCMxUmQFr0_dyW8JTLDiOeNQ,Data Challenge Cornwall - Visualising GP Surgery Data,"The NHS collects and publishes a broad range of data, including on GP surgery information. Join the session to find hear about ...",https://i.ytimg.com/vi/CuSX2jFMAFc/default.jpg,120,90,https://i.ytimg.com/vi/CuSX2jFMAFc/mqdefault.jpg,320,180,https://i.ytimg.com/vi/CuSX2jFMAFc/hqdefault.jpg,480,360,Data Science Cornwall,none,2021-07-22T23:49:04Z
0,youtube#searchResult,k5wY5NZU6I9-OYzzWhXxO0uNcCo,youtube#video,2Qb795RA0z4,2022-05-30T18:55:56Z,UCoTuN2KVQHpnAOO9nM9354Q,OMLDS - Lunch and Learn (5/25/2022) - Missing Data,Orlando Machine Learning and Data Science Meetup May 2022 Lunch and Learn Orlando Machine Learning and Data Science ...,https://i.ytimg.com/vi/2Qb795RA0z4/default.jpg,120,90,https://i.ytimg.com/vi/2Qb795RA0z4/mqdefault.jpg,320,180,https://i.ytimg.com/vi/2Qb795RA0z4/hqdefault.jpg,480,360,OMLDS,none,2022-05-30T18:55:56Z
1,youtube#searchResult,YwA6dnylr3fEEmA6kFwwo7dhGsE,youtube#video,AoWNOdkXlpE,2021-11-09T19:45:14Z,UCoTuN2KVQHpnAOO9nM9354Q,Introduction to Distributed Compute with Dask,"Orlando Machine Learning and Data Science Meetup November 2021 Event About the Talk: As data volume continues to grow, ...",https://i.ytimg.com/vi/AoWNOdkXlpE/default.jpg,120,90,https://i.ytimg.com/vi/AoWNOdkXlpE/mqdefault.jpg,320,180,https://i.ytimg.com/vi/AoWNOdkXlpE/hqdefault.jpg,480,360,OMLDS,none,2021-11-09T19:45:14Z
2,youtube#searchResult,WhFAKzMggCWRX6cu2BQXzesEym0,youtube#video,6qO1-NEbjxs,2021-08-28T17:09:26Z,UCoTuN2KVQHpnAOO9nM9354Q,Sarcasm Detection in Social Media,Orlando Machine Learning and Data Science Meetup July 2021 Event About the Talk: Ramya Akula is a PhD candidate and a ...,https://i.ytimg.com/vi/6qO1-NEbjxs/default.jpg,120,90,https://i.ytimg.com/vi/6qO1-NEbjxs/mqdefault.jpg,320,180,https://i.ytimg.com/vi/6qO1-NEbjxs/hqdefault.jpg,480,360,OMLDS,none,2021-08-28T17:09:26Z
3,youtube#searchResult,PCRrctQG6iqebtb6x8VoTvKPdZo,youtube#video,8B4_mkU_XW0,2021-07-04T07:11:04Z,UCoTuN2KVQHpnAOO9nM9354Q,Multi-language Data Wrangling and Acquisition Conversational Agents,Orlando Machine Learning and Data Science Meetup June 2021 Event About the Talk: Anton Antonov is an applied ...,https://i.ytimg.com/vi/8B4_mkU_XW0/default.jpg,120,90,https://i.ytimg.com/vi/8B4_mkU_XW0/mqdefault.jpg,320,180,https://i.ytimg.com/vi/8B4_mkU_XW0/hqdefault.jpg,480,360,OMLDS,none,2021-07-04T07:11:04Z
4,youtube#searchResult,WopnJIWIBKeirK1-hm38MfB8BfU,youtube#video,tnKkm0cBM-k,2021-04-19T18:42:10Z,UCoTuN2KVQHpnAOO9nM9354Q,Building a Tableau Dashboard from Scratch,Orlando Machine Learning and Data Science Meetup April 2021 Event About the talk: Maggy will be giving us a step-by-step ...,https://i.ytimg.com/vi/tnKkm0cBM-k/default.jpg,120,90,https://i.ytimg.com/vi/tnKkm0cBM-k/mqdefault.jpg,320,180,https://i.ytimg.com/vi/tnKkm0cBM-k/hqdefault.jpg,480,360,OMLDS,none,2021-04-19T18:42:10Z
0,youtube#searchResult,2Vrwo_X6wyjEspwFoJJi-K1kflI,youtube#video,9MSPeAYBYIY,2022-05-30T10:56:18Z,UC8hI87gt0dmTAIEupEcsckA,Hierarchical Risk Parity (HRP),"Learn more at: https://hudsonthames.org/portfoliolab/ In 2016, Dr. Marcos Lopez de Prado introduced the Hierarchical Risk Parity ...",https://i.ytimg.com/vi/9MSPeAYBYIY/default.jpg,120,90,https://i.ytimg.com/vi/9MSPeAYBYIY/mqdefault.jpg,320,180,https://i.ytimg.com/vi/9MSPeAYBYIY/hqdefault.jpg,480,360,Hudson & Thames,none,2022-05-30T10:56:18Z
1,youtube#searchResult,uNMTacOyG_7FlznHjFelSAOwRtk,youtube#video,pH4wctij1Hk,2022-05-26T11:53:07Z,UC8hI87gt0dmTAIEupEcsckA,Nested Clustered Optimization (NCO),Learn more at: https://hudsonthames.org/portfoliolab/ The purpose of the Nested Clustered Optimization(NCO) algorithm is to ...,https://i.ytimg.com/vi/pH4wctij1Hk/default.jpg,120,90,https://i.ytimg.com/vi/pH4wctij1Hk/mqdefault.jpg,320,180,https://i.ytimg.com/vi/pH4wctij1Hk/hqdefault.jpg,480,360,Hudson & Thames,none,2022-05-26T11:53:07Z
2,youtube#searchResult,WxoeWTkmjBnDmIFhLZEXbkZKrbg,youtube#video,yhR1zLQIu9g,2022-05-25T10:24:06Z,UC8hI87gt0dmTAIEupEcsckA,Theory-Implied Correlation Matrix (TIC),Learn more at: https://hudsonthames.org/portfoliolab/ A problem of empirical correlation matrices is that they are purely ...,https://i.ytimg.com/vi/yhR1zLQIu9g/default.jpg,120,90,https://i.ytimg.com/vi/yhR1zLQIu9g/mqdefault.jpg,320,180,https://i.ytimg.com/vi/yhR1zLQIu9g/hqdefault.jpg,480,360,Hudson & Thames,none,2022-05-25T10:24:06Z
3,youtube#searchResult,D2sTlDq-SB07qFS8p93aqurjYwQ,youtube#video,k8oiBBfuvz8,2022-05-24T11:23:57Z,UC8hI87gt0dmTAIEupEcsckA,"Wrapping up MVO and learning about Denoising, Detoning, and Shrinkage methods.",Learn more at: https://hudsonthames.org/portfoliolab/ Part 2 wraps up Mean-Variance portfolio optimization (MVO). Exploring the ...,https://i.ytimg.com/vi/k8oiBBfuvz8/default.jpg,120,90,https://i.ytimg.com/vi/k8oiBBfuvz8/mqdefault.jpg,320,180,https://i.ytimg.com/vi/k8oiBBfuvz8/hqdefault.jpg,480,360,Hudson & Thames,none,2022-05-24T11:23:57Z
4,youtube#searchResult,hLUAyHSVnSXVuRzJrvaJ6tcc-Rg,youtube#video,rjKnpkmBZXs,2022-05-23T10:40:01Z,UC8hI87gt0dmTAIEupEcsckA,Portfolio Optimization: Mean-Variance Optimization and the Critical Line Algorithm.,Learn more at: https://hudsonthames.org/portfoliolab/ Kicking this week off with a lecture series on using machine learning in ...,https://i.ytimg.com/vi/rjKnpkmBZXs/default.jpg,120,90,https://i.ytimg.com/vi/rjKnpkmBZXs/mqdefault.jpg,320,180,https://i.ytimg.com/vi/rjKnpkmBZXs/hqdefault.jpg,480,360,Hudson & Thames,none,2022-05-23T10:40:01Z
0,youtube#searchResult,YyIqVuE5D1xmTjGgubLjh4aoI9s,youtube#video,vVZNse7xiSs,2022-05-20T14:52:52Z,UC8kXgHG13XdgsigIPRmrIyA,Ask Me Anything: Sentiment Analysis and Alternative Data in Trading,00:00 Introduction 08:19 Questions on Sentiment Analysis 21:24 Questions on Alternative Data 35:27 Questions on Career ...,https://i.ytimg.com/vi/vVZNse7xiSs/default.jpg,120,90,https://i.ytimg.com/vi/vVZNse7xiSs/mqdefault.jpg,320,180,https://i.ytimg.com/vi/vVZNse7xiSs/hqdefault.jpg,480,360,QuantInsti Quantitative Learning,none,2022-05-20T14:52:52Z
1,youtube#searchResult,rBWcS3rpNuA9k0CKZmKefy2fBMs,youtube#video,-w6V3QlH14E,2022-05-10T14:44:09Z,UC8kXgHG13XdgsigIPRmrIyA,Volatility Trading: Trading The Fear Index VIX,00:00 Introduction 02:30 Agenda 03:45 What is volatility 12:17 How do you measure volatility? 18:30 Why is VIX called the fear ...,https://i.ytimg.com/vi/-w6V3QlH14E/default.jpg,120,90,https://i.ytimg.com/vi/-w6V3QlH14E/mqdefault.jpg,320,180,https://i.ytimg.com/vi/-w6V3QlH14E/hqdefault.jpg,480,360,QuantInsti Quantitative Learning,none,2022-05-10T14:44:09Z
2,youtube#searchResult,L_QS1qzelNVTp2gatxyiJHnwK1k,youtube#video,M-rsJMqYMmM,2022-04-26T14:46:18Z,UC8kXgHG13XdgsigIPRmrIyA,Big Data And The Future Of Retail Investing,00:00 - Introduction 04:00 - Disclaimer 05:44 - Agenda 11:04 - Data 14:31 - Big Data 20:01 - The dawn of data analytics 23:29 ...,https://i.ytimg.com/vi/M-rsJMqYMmM/default.jpg,120,90,https://i.ytimg.com/vi/M-rsJMqYMmM/mqdefault.jpg,320,180,https://i.ytimg.com/vi/M-rsJMqYMmM/hqdefault.jpg,480,360,QuantInsti Quantitative Learning,none,2022-04-26T14:46:18Z
3,youtube#searchResult,DTQnjQHppmHx7vC7fg2FVNV5QfI,youtube#video,hmX22QSY2qk,2022-04-12T14:45:33Z,UC8kXgHG13XdgsigIPRmrIyA,Pairs Trading in Brazil and Short Straddles in the US Markets [Algo Trading Projects],This session has project presentations by two of our esteemed EPAT alumni. 00:00 Introduction - Project 1 04:45 Presentation ...,https://i.ytimg.com/vi/hmX22QSY2qk/default.jpg,120,90,https://i.ytimg.com/vi/hmX22QSY2qk/mqdefault.jpg,320,180,https://i.ytimg.com/vi/hmX22QSY2qk/hqdefault.jpg,480,360,QuantInsti Quantitative Learning,none,2022-04-12T14:45:33Z
4,youtube#searchResult,m2W2zlBoKxV2X6ajy-xd85PATMo,youtube#video,26rvLjc52pw,2022-03-29T14:46:37Z,UC8kXgHG13XdgsigIPRmrIyA,Certificate In Sentiment Analysis And Alternative Data For Finance - CSAF™ [FREE INFO SESSION],00:00 Introduction 02:30 CSAF overview by Prof Mitra 10:40 Detailed course overview by Prof Christina 15:45 Amit Arora sharing ...,https://i.ytimg.com/vi/26rvLjc52pw/default.jpg,120,90,https://i.ytimg.com/vi/26rvLjc52pw/mqdefault.jpg,320,180,https://i.ytimg.com/vi/26rvLjc52pw/hqdefault.jpg,480,360,QuantInsti Quantitative Learning,none,2022-03-29T14:46:37Z
