,kind,etag,id.kind,id.videoId,snippet.publishedAt,snippet.channelId,snippet.title,snippet.description,snippet.thumbnails.default.url,snippet.thumbnails.default.width,snippet.thumbnails.default.height,snippet.thumbnails.medium.url,snippet.thumbnails.medium.width,snippet.thumbnails.medium.height,snippet.thumbnails.high.url,snippet.thumbnails.high.width,snippet.thumbnails.high.height,snippet.channelTitle,snippet.liveBroadcastContent,snippet.publishTime
1,youtube#searchResult,DuQ92lfICm4aJ7d2NQA9Y_UtVV8,youtube#video,iXnBKS4X8zw,2026-02-24T06:28:20Z,UCDVL0bPrZHwCeJrlyy-wxaQ,GPT-4&#39;s Knowledge Limit: What It Misses! #shorts,"GPT-4's knowledge base ends in October 2023. It's trained on public internet data. Knowledge workers, developers, and humans ...",https://i.ytimg.com/vi/iXnBKS4X8zw/default.jpg,120,90,https://i.ytimg.com/vi/iXnBKS4X8zw/mqdefault.jpg,320,180,https://i.ytimg.com/vi/iXnBKS4X8zw/hqdefault.jpg,480,360,Global AI Community,none,2026-02-24T06:28:20Z
2,youtube#searchResult,bmR4dRbtxwVgtCtAFzK36uwEcNI,youtube#video,LsYxAzsPNuY,2026-02-22T16:34:32Z,UCDVL0bPrZHwCeJrlyy-wxaQ,"AI Answers: Ditch Ads, Get Instant Solutions Now! #shorts",Tired of endless ads and SEO spam on Google? Get straight answers instantly. Use AI to cut through the noise and get the info ...,https://i.ytimg.com/vi/LsYxAzsPNuY/default.jpg,120,90,https://i.ytimg.com/vi/LsYxAzsPNuY/mqdefault.jpg,320,180,https://i.ytimg.com/vi/LsYxAzsPNuY/hqdefault.jpg,480,360,Global AI Community,none,2026-02-22T16:34:32Z
3,youtube#searchResult,CG5wfTSsUAUDbe2n1Y9moY_HQRQ,youtube#video,9MKYwXVGu5w,2026-02-20T22:12:25Z,UCDVL0bPrZHwCeJrlyy-wxaQ,AI on Mac: Phi-4 Runs Smoothly! #shorts,"Even on 6-8 year old machines, Pieces runs smoothly—with a small impact. Unless users activate an on-device model, ...",https://i.ytimg.com/vi/9MKYwXVGu5w/default.jpg,120,90,https://i.ytimg.com/vi/9MKYwXVGu5w/mqdefault.jpg,320,180,https://i.ytimg.com/vi/9MKYwXVGu5w/hqdefault.jpg,480,360,Global AI Community,none,2026-02-20T22:12:25Z
4,youtube#searchResult,aGU6SvepXR3OiRiIDdENiO6w65w,youtube#video,2-TT4PjPXuk,2026-02-18T18:11:58Z,UCDVL0bPrZHwCeJrlyy-wxaQ,February 2026 - Chapter Leads meeting,,https://i.ytimg.com/vi/2-TT4PjPXuk/default.jpg,120,90,https://i.ytimg.com/vi/2-TT4PjPXuk/mqdefault.jpg,320,180,https://i.ytimg.com/vi/2-TT4PjPXuk/hqdefault.jpg,480,360,Global AI Community,none,2026-02-18T18:11:58Z
0,youtube#searchResult,rPfPeaeseWAWGXARX7HJByravJk,youtube#video,NdPMaDzpqW8,2023-09-09T17:37:09Z,UCxArXLI-gxlTmWGGgec5D7w,Functions in Julia -Learn Julia 15/n-,"What are functions and what do they do ? In this video I present functions in Julia, what are they, how do they work, and how we ...",https://i.ytimg.com/vi/NdPMaDzpqW8/default.jpg,120,90,https://i.ytimg.com/vi/NdPMaDzpqW8/mqdefault.jpg,320,180,https://i.ytimg.com/vi/NdPMaDzpqW8/hqdefault.jpg,480,360,Rémi Vezy,none,2023-09-09T17:37:09Z
1,youtube#searchResult,J6dy3wsOINK5a2cLW2BqXU7aj3I,youtube#video,wTiVtP5tYPY,2023-08-21T14:58:42Z,UCxArXLI-gxlTmWGGgec5D7w,"For loops in Julia (eachindex, enumerate...) -Learn Julia 14/n-","How can we repeatedly execute code in Julia ? In this video I present for loops in Julia, what are they and how they work, and I ...",https://i.ytimg.com/vi/wTiVtP5tYPY/default.jpg,120,90,https://i.ytimg.com/vi/wTiVtP5tYPY/mqdefault.jpg,320,180,https://i.ytimg.com/vi/wTiVtP5tYPY/hqdefault.jpg,480,360,Rémi Vezy,none,2023-08-21T14:58:42Z
2,youtube#searchResult,A_RiDPy3ZyYRnyvRGf1jsSQtroU,youtube#video,qNK9C3ewoGE,2022-08-20T13:16:04Z,UCxArXLI-gxlTmWGGgec5D7w,Conditionals in Julia (if...else...) -Learn Julia 13/n-,"If you appreciate this video, you can buy me a coffee on Tipeee: https://fr.tipeee.com/remi-vezy What are conditional statements ?",https://i.ytimg.com/vi/qNK9C3ewoGE/default.jpg,120,90,https://i.ytimg.com/vi/qNK9C3ewoGE/mqdefault.jpg,320,180,https://i.ytimg.com/vi/qNK9C3ewoGE/hqdefault.jpg,480,360,Rémi Vezy,none,2022-08-20T13:16:04Z
3,youtube#searchResult,S8J3j6jSDiVMHXbqn7MeafdTh8U,youtube#video,zCvYmbP1esc,2022-05-22T19:07:40Z,UCxArXLI-gxlTmWGGgec5D7w,`begin` and `let` in Julia -Learn Julia 12/n-,You can buy me a coffee on Tipeee: https://fr.tipeee.com/remi-vezy What are `begin...end` statements ? What is the difference with ...,https://i.ytimg.com/vi/zCvYmbP1esc/default.jpg,120,90,https://i.ytimg.com/vi/zCvYmbP1esc/mqdefault.jpg,320,180,https://i.ytimg.com/vi/zCvYmbP1esc/hqdefault.jpg,480,360,Rémi Vezy,none,2022-05-22T19:07:40Z
4,youtube#searchResult,QJ2slbBUOJ_Qu_CTw0wgiJhEoxQ,youtube#video,yZwHgdAEx5Q,2022-04-24T19:46:02Z,UCxArXLI-gxlTmWGGgec5D7w,String operators in Julia -Learn Julia 11/n-,You can buy me a coffee on Tipeee: https://fr.tipeee.com/remi-vezy What is a string? What is the difference with characters?,https://i.ytimg.com/vi/yZwHgdAEx5Q/default.jpg,120,90,https://i.ytimg.com/vi/yZwHgdAEx5Q/mqdefault.jpg,320,180,https://i.ytimg.com/vi/yZwHgdAEx5Q/hqdefault.jpg,480,360,Rémi Vezy,none,2022-04-24T19:46:02Z
0,youtube#searchResult,fKFUqNRA2-v42XBggiUueuacd5I,youtube#video,AJdgzGB80rg,2026-03-09T17:48:32Z,UCupQLyNchb9-2Z5lmUOIijw,"Lesson 04: Bias, perceptron properties, and multi-class classification 🧠",,https://i.ytimg.com/vi/AJdgzGB80rg/default.jpg,120,90,https://i.ytimg.com/vi/AJdgzGB80rg/mqdefault.jpg,320,180,https://i.ytimg.com/vi/AJdgzGB80rg/hqdefault.jpg,480,360,Alfredo Canziani (冷在),none,2026-03-09T17:48:32Z
1,youtube#searchResult,ORE1_C7KhJdYZwfGWy3WcmdD-TU,youtube#video,DtP2HYp9cNM,2026-03-06T23:13:22Z,UCupQLyNchb9-2Z5lmUOIijw,"Lesson 04 – Bias, perceptron’s properties, and multi-class classification",Course website: https://atcold.github.io/NYU-DLFL25U/,https://i.ytimg.com/vi/DtP2HYp9cNM/default.jpg,120,90,https://i.ytimg.com/vi/DtP2HYp9cNM/mqdefault.jpg,320,180,https://i.ytimg.com/vi/DtP2HYp9cNM/hqdefault.jpg,480,360,Alfredo Canziani (冷在),none,2026-03-06T23:13:22Z
2,youtube#searchResult,X_BneVSa0Sp-i-N1aP5I5ZyMC44,youtube#video,EisubTHUFoE,2026-02-28T03:33:06Z,UCupQLyNchb9-2Z5lmUOIijw,"Lesson 03: Wiener’s cybernetics, Hebbian plasticity, and Rosenblatt’s perceptron ⚡️",,https://i.ytimg.com/vi/EisubTHUFoE/default.jpg,120,90,https://i.ytimg.com/vi/EisubTHUFoE/mqdefault.jpg,320,180,https://i.ytimg.com/vi/EisubTHUFoE/hqdefault.jpg,480,360,Alfredo Canziani (冷在),none,2026-02-28T03:33:06Z
3,youtube#searchResult,7B3xcLOLItK_TkzHZTJcjc-4En8,youtube#video,8WDOAXaxwlU,2026-02-28T01:00:17Z,UCupQLyNchb9-2Z5lmUOIijw,"Lesson 03 – Wiener’s cybernetics, Hebbian plasticity, and Rosenblatt’s perceptron",Course website: https://atcold.github.io/NYU-DLFL25U/ Additional cards 0:21:00 ...,https://i.ytimg.com/vi/8WDOAXaxwlU/default.jpg,120,90,https://i.ytimg.com/vi/8WDOAXaxwlU/mqdefault.jpg,320,180,https://i.ytimg.com/vi/8WDOAXaxwlU/hqdefault.jpg,480,360,Alfredo Canziani (冷在),none,2026-02-28T01:00:17Z
4,youtube#searchResult,hAWAn8p4APYGL-ejKY5Xxtagrt0,youtube#video,NETzF_00s3Q,2026-02-21T01:03:02Z,UCupQLyNchb9-2Z5lmUOIijw,Lesson 02: Programming a neural network 💻🧠,,https://i.ytimg.com/vi/NETzF_00s3Q/default.jpg,120,90,https://i.ytimg.com/vi/NETzF_00s3Q/mqdefault.jpg,320,180,https://i.ytimg.com/vi/NETzF_00s3Q/hqdefault.jpg,480,360,Alfredo Canziani (冷在),none,2026-02-21T01:03:02Z
0,youtube#searchResult,n4BsStwDx1A7GDA7we99Fwavu4k,youtube#video,vCqMCIdIHGo,2019-10-01T12:29:58Z,UCBEShbs7rtE_ZjTmb6Jt5WA,PROGRAM TO FIND FACTORIAL OF GIVEN NUMBER,DURecorder This is my video recorded with DU Recorder. It's easy to record your screen and livestream. Download link: Android: ...,https://i.ytimg.com/vi/vCqMCIdIHGo/default.jpg,120,90,https://i.ytimg.com/vi/vCqMCIdIHGo/mqdefault.jpg,320,180,https://i.ytimg.com/vi/vCqMCIdIHGo/hqdefault.jpg,480,360,Real Python,none,2019-10-01T12:29:58Z
1,youtube#searchResult,QMdZN8zhI0EZ1xVys7c1WyHIwHg,youtube#video,TUlTY9GnKXE,2019-10-01T12:16:53Z,UCBEShbs7rtE_ZjTmb6Jt5WA,PYTHON PROGRAM TO PRINT REVERSE OF A NUMBER,,https://i.ytimg.com/vi/TUlTY9GnKXE/default.jpg,120,90,https://i.ytimg.com/vi/TUlTY9GnKXE/mqdefault.jpg,320,180,https://i.ytimg.com/vi/TUlTY9GnKXE/hqdefault.jpg,480,360,Real Python,none,2019-10-01T12:16:53Z
0,youtube#searchResult,a-SgwhD5kZgTs3ANtXZhy_K9eU0,youtube#video,cUEdNmnKJVQ,2025-10-17T22:20:14Z,UC12LqyqTQYbXatYS9AA7Nuw,Responsible AI - Lesson 2: Foundations of Responsible AI,"This video will cover a review of the previous lesson on evaluating large language models (LLMs), followed by an introduction to ...",https://i.ytimg.com/vi/cUEdNmnKJVQ/default.jpg,120,90,https://i.ytimg.com/vi/cUEdNmnKJVQ/mqdefault.jpg,320,180,https://i.ytimg.com/vi/cUEdNmnKJVQ/hqdefault.jpg,480,360,Machine Learning University,none,2025-10-17T22:20:14Z
1,youtube#searchResult,aMuhwTwHG_CLS_O_PkLBW_HtJo8,youtube#video,KGbplvULNwg,2025-10-17T22:20:14Z,UC12LqyqTQYbXatYS9AA7Nuw,Building Apps with Foundation Models - Lesson 4: Agents,"This lesson will begin by reviewing Lesson 4. Then, we will discuss tools and agents. We will cover some specifics of LangChain ...",https://i.ytimg.com/vi/KGbplvULNwg/default.jpg,120,90,https://i.ytimg.com/vi/KGbplvULNwg/mqdefault.jpg,320,180,https://i.ytimg.com/vi/KGbplvULNwg/hqdefault.jpg,480,360,Machine Learning University,none,2025-10-17T22:20:14Z
2,youtube#searchResult,hwvjuaslef0uWcpFB3YDhdYATRQ,youtube#video,0dLiVlWQhYU,2025-10-17T22:20:14Z,UC12LqyqTQYbXatYS9AA7Nuw,Building Apps with Foundation Models - Lesson 1: LangChain Modules and Integration,"This video includes a review of Module 2 (Responsible Generative AI) and an introduction to LangChain, its various modules, and ...",https://i.ytimg.com/vi/0dLiVlWQhYU/default.jpg,120,90,https://i.ytimg.com/vi/0dLiVlWQhYU/mqdefault.jpg,320,180,https://i.ytimg.com/vi/0dLiVlWQhYU/hqdefault.jpg,480,360,Machine Learning University,none,2025-10-17T22:20:14Z
3,youtube#searchResult,cGkwyAj4dhxIZHKhbHV7uwpfHkY,youtube#video,8togqsH1xRU,2025-10-17T22:20:14Z,UC12LqyqTQYbXatYS9AA7Nuw,Responsible AI - Lesson 1: Evaluating Large Language Models,"This video will begin with a review of Generative AI Module 1 (Fundamentals of Generative AI), covering the key concepts and ...",https://i.ytimg.com/vi/8togqsH1xRU/default.jpg,120,90,https://i.ytimg.com/vi/8togqsH1xRU/mqdefault.jpg,320,180,https://i.ytimg.com/vi/8togqsH1xRU/hqdefault.jpg,480,360,Machine Learning University,none,2025-10-17T22:20:14Z
4,youtube#searchResult,grUO1YD-wxCIpZMC5pdgAqhFYyg,youtube#video,5H77KxUbQnA,2025-10-17T22:20:14Z,UC12LqyqTQYbXatYS9AA7Nuw,Building Apps with Foundation Models - Lesson 3: Retrieval Augmented Generation (RAG),"This video begins with a review of Lesson 2 . Then we'll explore the concept of grounding a model. Next, we'll dive deeper into ...",https://i.ytimg.com/vi/5H77KxUbQnA/default.jpg,120,90,https://i.ytimg.com/vi/5H77KxUbQnA/mqdefault.jpg,320,180,https://i.ytimg.com/vi/5H77KxUbQnA/hqdefault.jpg,480,360,Machine Learning University,none,2025-10-17T22:20:14Z
0,youtube#searchResult,x_n6HqD1m52_dw4aKuXePa88ZVk,youtube#video,Fm0MpfKIs5w,2026-03-10T16:00:23Z,UCX6b17PVsYBQ0ip5gyeme-Q,Evaluating Sources &amp; Fact Checking: Crash Course Scientific Thinking #6,"Are you consuming a credit card's worth of misinformation every week? In this episode of Crash Course Scientific Thinking, we'll ...",https://i.ytimg.com/vi/Fm0MpfKIs5w/default.jpg,120,90,https://i.ytimg.com/vi/Fm0MpfKIs5w/mqdefault.jpg,320,180,https://i.ytimg.com/vi/Fm0MpfKIs5w/hqdefault.jpg,480,360,CrashCourse,none,2026-03-10T16:00:23Z
1,youtube#searchResult,vjtP_5S3gG_1oGQvki53kOO9noc,youtube#video,9wSAeV0xX0M,2026-03-03T17:00:15Z,UCX6b17PVsYBQ0ip5gyeme-Q,How Scientists Build Consensus: Crash Course Scientific Thinking #5,"Why is there consensus around atoms existing, but not around if chocolate is good for you? In this episode of Crash Course ...",https://i.ytimg.com/vi/9wSAeV0xX0M/default.jpg,120,90,https://i.ytimg.com/vi/9wSAeV0xX0M/mqdefault.jpg,320,180,https://i.ytimg.com/vi/9wSAeV0xX0M/hqdefault.jpg,480,360,CrashCourse,none,2026-03-03T17:00:15Z
2,youtube#searchResult,v_NSYxUBbnOX9h-jmjBa--RD3BY,youtube#video,-a739VjqdSI,2016-11-21T23:02:30Z,UCX6b17PVsYBQ0ip5gyeme-Q,Utilitarianism: Crash Course Philosophy #36,"Our next stop in our tour of the ethical lay of the land is utilitarianism. With a little help from Batman, Hank explains the principle of ...",https://i.ytimg.com/vi/-a739VjqdSI/default.jpg,120,90,https://i.ytimg.com/vi/-a739VjqdSI/mqdefault.jpg,320,180,https://i.ytimg.com/vi/-a739VjqdSI/hqdefault.jpg,480,360,CrashCourse,none,2016-11-21T23:02:30Z
3,youtube#searchResult,aqG00fXdXIfy99TictHQ98qEmsY,youtube#video,17WiQ_tNld4,2016-07-11T20:43:48Z,UCX6b17PVsYBQ0ip5gyeme-Q,Arguments Against Personal Identity: Crash Course Philosophy #20,How can Daenerys Targaryen help us understand personal identity? Find out as Hank continues our exploration of personal ...,https://i.ytimg.com/vi/17WiQ_tNld4/default.jpg,120,90,https://i.ytimg.com/vi/17WiQ_tNld4/mqdefault.jpg,320,180,https://i.ytimg.com/vi/17WiQ_tNld4/hqdefault.jpg,480,360,CrashCourse,none,2016-07-11T20:43:48Z
4,youtube#searchResult,DFMVcNmv1W0T18UpLNKuyVp3HsA,youtube#video,3ez10ADR_gM,2015-07-08T22:34:19Z,UCX6b17PVsYBQ0ip5gyeme-Q,Intro to Economics: Crash Course Econ #1,"In which Jacob Clifford and Adriene Hill launch a brand new Crash Course on Economics! So, what is economics? Good question ...",https://i.ytimg.com/vi/3ez10ADR_gM/default.jpg,120,90,https://i.ytimg.com/vi/3ez10ADR_gM/mqdefault.jpg,320,180,https://i.ytimg.com/vi/3ez10ADR_gM/hqdefault.jpg,480,360,CrashCourse,none,2015-07-08T22:34:19Z
0,youtube#searchResult,NkpfoaUhy12yLqJ-cVqTeTlGx2U,youtube#video,1SJiTwbSI58,2026-03-01T03:37:44Z,UCSHZKyawb77ixDdsGog4iWA,"Rick Beato: Greatest Guitarists of All Time, History &amp; Future of Music | Lex Fridman Podcast #492","Rick Beato is a music educator, interviewer, producer, songwriter, and a true multi-instrument musician, playing guitar, bass, cello ...",https://i.ytimg.com/vi/1SJiTwbSI58/default.jpg,120,90,https://i.ytimg.com/vi/1SJiTwbSI58/mqdefault.jpg,320,180,https://i.ytimg.com/vi/1SJiTwbSI58/hqdefault.jpg,480,360,Lex Fridman,none,2026-03-01T03:37:44Z
1,youtube#searchResult,tbDf0YhOcYSJ54VyFC1xPQ7p8P8,youtube#video,YFjfBk8HI5o,2026-02-12T03:07:03Z,UCSHZKyawb77ixDdsGog4iWA,OpenClaw: The Viral AI Agent that Broke the Internet - Peter Steinberger | Lex Fridman Podcast #491,"Peter Steinberger is the creator of OpenClaw, an open-source AI agent framework that's the fastest-growing project in GitHub ...",https://i.ytimg.com/vi/YFjfBk8HI5o/default.jpg,120,90,https://i.ytimg.com/vi/YFjfBk8HI5o/mqdefault.jpg,320,180,https://i.ytimg.com/vi/YFjfBk8HI5o/hqdefault.jpg,480,360,Lex Fridman,none,2026-02-12T03:07:03Z
2,youtube#searchResult,z8QDc8fk0kbjEm31h-LapuEWjk0,youtube#video,EV7WhVT270Q,2026-01-31T22:33:33Z,UCSHZKyawb77ixDdsGog4iWA,"State of AI in 2026: LLMs, Coding, Scaling Laws, China, Agents, GPUs, AGI | Lex Fridman Podcast #490","Nathan Lambert and Sebastian Raschka are machine learning researchers, engineers, and educators. Nathan is the post-training ...",https://i.ytimg.com/vi/EV7WhVT270Q/default.jpg,120,90,https://i.ytimg.com/vi/EV7WhVT270Q/mqdefault.jpg,320,180,https://i.ytimg.com/vi/EV7WhVT270Q/hqdefault.jpg,480,360,Lex Fridman,none,2026-01-31T22:33:33Z
3,youtube#searchResult,451yruNy0ty_pByK6ccuuQdTBrw,youtube#video,Z-FRe5AKmCU,2026-01-13T20:06:59Z,UCSHZKyawb77ixDdsGog4iWA,Paul Rosolie: Uncontacted Tribes in the Amazon Jungle | Lex Fridman Podcast #489,"Paul Rosolie is a naturalist, explorer, author of a new book titled Junglekeeper, and is someone who has dedicated his life to ...",https://i.ytimg.com/vi/Z-FRe5AKmCU/default.jpg,120,90,https://i.ytimg.com/vi/Z-FRe5AKmCU/mqdefault.jpg,320,180,https://i.ytimg.com/vi/Z-FRe5AKmCU/hqdefault.jpg,480,360,Lex Fridman,none,2026-01-13T20:06:59Z
4,youtube#searchResult,bF6Ltu6IG4unyywZm0uK1x8-l8s,youtube#video,14OPT6CcsH4,2025-12-31T21:26:17Z,UCSHZKyawb77ixDdsGog4iWA,"Infinity, Paradoxes, Gödel Incompleteness &amp; the Mathematical Multiverse | Lex Fridman Podcast #488","Joel David Hamkins is a mathematician and philosopher specializing in set theory, the foundations of mathematics, and the nature ...",https://i.ytimg.com/vi/14OPT6CcsH4/default.jpg,120,90,https://i.ytimg.com/vi/14OPT6CcsH4/mqdefault.jpg,320,180,https://i.ytimg.com/vi/14OPT6CcsH4/hqdefault.jpg,480,360,Lex Fridman,none,2025-12-31T21:26:17Z
0,youtube#searchResult,6xOI92Qr8Rdbz1M7urRYUnta6fs,youtube#video,ehc9p-Hjguc,2026-03-10T14:09:41Z,UCRbKmV_XYB7C12SPBokLVHQ,How to split cells &amp; clean messy columns #datacleaning,Learn how to: -Split a Customer ID into separate components -Separate City and Country into individual columns -Convert ...,https://i.ytimg.com/vi/ehc9p-Hjguc/default.jpg,120,90,https://i.ytimg.com/vi/ehc9p-Hjguc/mqdefault.jpg,320,180,https://i.ytimg.com/vi/ehc9p-Hjguc/hqdefault.jpg,480,360,KNIME,none,2026-03-10T14:09:41Z
1,youtube#searchResult,k8uXEJwKvSIuU6v3n0iRGGoFpcM,youtube#video,es1zYILfHP4,2026-03-10T10:00:36Z,UCRbKmV_XYB7C12SPBokLVHQ,Why Perfect Data Models Are a Red Flag,"In data science, useful beats perfect #datascience #datanalytics #datamodels #knime.",https://i.ytimg.com/vi/es1zYILfHP4/default.jpg,120,90,https://i.ytimg.com/vi/es1zYILfHP4/mqdefault.jpg,320,180,https://i.ytimg.com/vi/es1zYILfHP4/hqdefault.jpg,480,360,KNIME,none,2026-03-10T10:00:36Z
2,youtube#searchResult,YXg2E87I7Hdc7CrzMxfQ-1d8hxA,youtube#video,k6w0uMRjcdI,2026-03-09T16:01:06Z,UCRbKmV_XYB7C12SPBokLVHQ,How to operate AI &amp; Analytics in your business with KNIME Business Hub,"Businesses today must scale Analytics and Artificial Intelligence (AI) to stay competitive. However, as data workflows, machine ...",https://i.ytimg.com/vi/k6w0uMRjcdI/default.jpg,120,90,https://i.ytimg.com/vi/k6w0uMRjcdI/mqdefault.jpg,320,180,https://i.ytimg.com/vi/k6w0uMRjcdI/hqdefault.jpg,480,360,KNIME,none,2026-03-09T16:01:06Z
3,youtube#searchResult,ExlGsdZ2RzZtvD9JUoWi8c_MAAc,youtube#video,LL0FQ_LZLwk,2026-03-08T21:01:01Z,UCRbKmV_XYB7C12SPBokLVHQ,Analyze A/B Test Results in Minutes with KNIME,"Learn how to quickly evaluate website A/B test results in KNIME using ANOVA, p-values, and clear visualizations to uncover ...",https://i.ytimg.com/vi/LL0FQ_LZLwk/default.jpg,120,90,https://i.ytimg.com/vi/LL0FQ_LZLwk/mqdefault.jpg,320,180,https://i.ytimg.com/vi/LL0FQ_LZLwk/hqdefault.jpg,480,360,KNIME,none,2026-03-08T21:01:01Z
4,youtube#searchResult,rf3G8MCVE1ItpGGYffVIazm-_w8,youtube#video,NdpFHJaUQbE,2026-03-03T21:16:53Z,UCRbKmV_XYB7C12SPBokLVHQ,How to Add Tools to Agents in KNIME,"See how simple it is to connect workflows as tools to an agent in KNIME — just drag, drop, and instantly enable powerful ...",https://i.ytimg.com/vi/NdpFHJaUQbE/default.jpg,120,90,https://i.ytimg.com/vi/NdpFHJaUQbE/mqdefault.jpg,320,180,https://i.ytimg.com/vi/NdpFHJaUQbE/hqdefault.jpg,480,360,KNIME,none,2026-03-03T21:16:53Z
0,youtube#searchResult,FNGtai-L8cpXoPEeYYiHMMEPbvs,youtube#video,K3m8v0kGGsE,2026-03-09T14:34:31Z,UCmKaoNn0OvxVAe7f_8sXYNQ,Microsoft Excel for Beginners - Data Analysis and Visualization Full Tutorial (No Ads),"Master Microsoft Excel from absolute zero! This is your full beginner tutorial to master spreadsheets. Forget the overwhelm, we'll ...",https://i.ytimg.com/vi/K3m8v0kGGsE/default.jpg,120,90,https://i.ytimg.com/vi/K3m8v0kGGsE/mqdefault.jpg,320,180,https://i.ytimg.com/vi/K3m8v0kGGsE/hqdefault.jpg,480,360,Jovian,none,2026-03-09T14:34:31Z
1,youtube#searchResult,zLHmm779F2tvP9vCcMsxy08uJcc,youtube#video,HZXgrXQnfjk,2023-11-01T14:30:10Z,UCmKaoNn0OvxVAe7f_8sXYNQ,Jovian&#39;s Batch of November 2023 Graduation Day!,"Join us for Jovian's Data Science Bootcamp Graduation Day Over the past eight months, participants of the program have spent ...",https://i.ytimg.com/vi/HZXgrXQnfjk/default.jpg,120,90,https://i.ytimg.com/vi/HZXgrXQnfjk/mqdefault.jpg,320,180,https://i.ytimg.com/vi/HZXgrXQnfjk/hqdefault.jpg,480,360,Jovian,none,2023-11-01T14:30:10Z
2,youtube#searchResult,_tQHrrD__t3AzXVRYmLVN6vnG8k,youtube#video,3RFdcWf9kN4,2023-09-11T14:30:10Z,UCmKaoNn0OvxVAe7f_8sXYNQ,Jovian&#39;s Batch of September 2023 Graduation Day!,"Join us for Jovian's Data Science Bootcamp Graduation Day Over the past eight months, participants of the program have spent ...",https://i.ytimg.com/vi/3RFdcWf9kN4/default.jpg,120,90,https://i.ytimg.com/vi/3RFdcWf9kN4/mqdefault.jpg,320,180,https://i.ytimg.com/vi/3RFdcWf9kN4/hqdefault.jpg,480,360,Jovian,none,2023-09-11T14:30:10Z
3,youtube#searchResult,OzwM9kscLxPgTKO4Jcnoh8ou3qI,youtube#video,kFUKx4Rh5CI,2023-06-30T14:30:08Z,UCmKaoNn0OvxVAe7f_8sXYNQ,"Difference between Pass by Value, Pass by Reference | #python #pythonprogramming #pythonlanguage",Did you know the way you pass arguments to a function can make a huge difference in your code? Let's explore. Pass by value ...,https://i.ytimg.com/vi/kFUKx4Rh5CI/default.jpg,120,90,https://i.ytimg.com/vi/kFUKx4Rh5CI/mqdefault.jpg,320,180,https://i.ytimg.com/vi/kFUKx4Rh5CI/hqdefault.jpg,480,360,Jovian,none,2023-06-30T14:30:08Z
4,youtube#searchResult,Yhpa09Y2-dsLHyWy4rHBcDmdxNY,youtube#video,oRhD7j_HtaU,2023-06-29T15:30:08Z,UCmKaoNn0OvxVAe7f_8sXYNQ,"From #chemicalengineering to #datascience | Watch Aakash interview Rishabh, Data Scientist, Uber","The speaker, who majored in chemical engineering, became interested in data science because they wanted to use their ...",https://i.ytimg.com/vi/oRhD7j_HtaU/default.jpg,120,90,https://i.ytimg.com/vi/oRhD7j_HtaU/mqdefault.jpg,320,180,https://i.ytimg.com/vi/oRhD7j_HtaU/hqdefault.jpg,480,360,Jovian,none,2023-06-29T15:30:08Z
0,youtube#searchResult,0kYMOgu5G6zTk9WprwQQYUmynKA,youtube#video,4crSSwsB3-k,2026-03-07T16:00:11Z,UCe_QLqna7cFtTCfZ0a8pycg,Enabling Unstructured Sparse Acceleration on Structured Sparse Accelerators,"If you would like to support the channel, please join the membership: https://www.youtube.com/c/AIPursuit/join Subscribe to the ...",https://i.ytimg.com/vi/4crSSwsB3-k/default.jpg,120,90,https://i.ytimg.com/vi/4crSSwsB3-k/mqdefault.jpg,320,180,https://i.ytimg.com/vi/4crSSwsB3-k/hqdefault.jpg,480,360,DSAI by Dr. Osbert Tay,none,2026-03-07T16:00:11Z
1,youtube#searchResult,aBPs8Sdiebu083DYiyIoPmL_E4U,youtube#video,3ZQcKppG3vo,2026-02-28T16:00:08Z,UCe_QLqna7cFtTCfZ0a8pycg,Training Ultra Long Context Language Model,"If you would like to support the channel, please join the membership: https://www.youtube.com/c/AIPursuit/join Subscribe to the ...",https://i.ytimg.com/vi/3ZQcKppG3vo/default.jpg,120,90,https://i.ytimg.com/vi/3ZQcKppG3vo/mqdefault.jpg,320,180,https://i.ytimg.com/vi/3ZQcKppG3vo/hqdefault.jpg,480,360,DSAI by Dr. Osbert Tay,none,2026-02-28T16:00:08Z
2,youtube#searchResult,WVVuzQ4QUhP-KYdtEc4lXZTEr-0,youtube#video,Z1fMzVzgaWI,2026-02-24T09:00:49Z,UCe_QLqna7cFtTCfZ0a8pycg,Effectively Serving Text2Image Diffusion Models,"If you would like to support the channel, please join the membership: https://www.youtube.com/c/AIPursuit/join Subscribe to the ...",https://i.ytimg.com/vi/Z1fMzVzgaWI/default.jpg,120,90,https://i.ytimg.com/vi/Z1fMzVzgaWI/mqdefault.jpg,320,180,https://i.ytimg.com/vi/Z1fMzVzgaWI/hqdefault.jpg,480,360,DSAI by Dr. Osbert Tay,none,2026-02-24T09:00:49Z
3,youtube#searchResult,-eGZWwDXIHtD0fHdgRUZXy76UzQ,youtube#video,LT-F0xSNSjo,2025-11-09T16:00:34Z,UCe_QLqna7cFtTCfZ0a8pycg,Yi Ma: Pursuing the Nature of Intelligence @ ICLR,"If you would like to support the channel, please join the membership: https://www.youtube.com/c/AIPursuit/join Subscribe to the ...",https://i.ytimg.com/vi/LT-F0xSNSjo/default.jpg,120,90,https://i.ytimg.com/vi/LT-F0xSNSjo/mqdefault.jpg,320,180,https://i.ytimg.com/vi/LT-F0xSNSjo/hqdefault.jpg,480,360,DSAI by Dr. Osbert Tay,none,2025-11-09T16:00:34Z
4,youtube#searchResult,UNkML783Gi9oWIYliiC9rCb3bI0,youtube#video,UxDMA8kSLGo,2025-11-06T16:00:58Z,UCe_QLqna7cFtTCfZ0a8pycg,From Seeing to Doing by Fei-Fei Li at NeurIPS,"If you would like to support the channel, please join the membership: https://www.youtube.com/c/AIPursuit/join Subscribe to the ...",https://i.ytimg.com/vi/UxDMA8kSLGo/default.jpg,120,90,https://i.ytimg.com/vi/UxDMA8kSLGo/mqdefault.jpg,320,180,https://i.ytimg.com/vi/UxDMA8kSLGo/hqdefault.jpg,480,360,DSAI by Dr. Osbert Tay,none,2025-11-06T16:00:58Z
0,youtube#searchResult,veZkkR7V2ayONKwlEz-8VTmpbMQ,youtube#video,Kdw3vWlBGnQ,2023-08-23T10:24:41Z,UCZq33lhQWAsd-8NDqOdjN_g,Seldon Team Spotlight: Kaitlin Hourihane,Welcome back to the Seldon Team Spotlight! Get a glimpse behind the scenes and meet the incredible minds powering Seldon.,https://i.ytimg.com/vi/Kdw3vWlBGnQ/default.jpg,120,90,https://i.ytimg.com/vi/Kdw3vWlBGnQ/mqdefault.jpg,320,180,https://i.ytimg.com/vi/Kdw3vWlBGnQ/hqdefault.jpg,480,360,Seldon,none,2023-08-23T10:24:41Z
1,youtube#searchResult,eRkZQ126LxtuousZHy0t194QNYU,youtube#video,ar5lSG_idh4,2023-07-25T12:49:41Z,UCZq33lhQWAsd-8NDqOdjN_g,Intro to Seldon Core (v2),"In this video, Ed introduces Seldon Core, an open-source framework for deploying machine learning systems. Seldon Core ...",https://i.ytimg.com/vi/ar5lSG_idh4/default.jpg,120,90,https://i.ytimg.com/vi/ar5lSG_idh4/mqdefault.jpg,320,180,https://i.ytimg.com/vi/ar5lSG_idh4/hqdefault.jpg,480,360,Seldon,none,2023-07-25T12:49:41Z
2,youtube#searchResult,Qh7LM_nSc_i2OM1KIkH37IuVV98,youtube#video,TqwJRxVTU28,2023-07-17T08:45:12Z,UCZq33lhQWAsd-8NDqOdjN_g,Seldon Team Spotlight: Alex Rakowski,Welcome to the Seldon Team Spotlight! We're excited to bring you closer to the amazing people behind the scenes at Seldon.,https://i.ytimg.com/vi/TqwJRxVTU28/default.jpg,120,90,https://i.ytimg.com/vi/TqwJRxVTU28/mqdefault.jpg,320,180,https://i.ytimg.com/vi/TqwJRxVTU28/hqdefault.jpg,480,360,Seldon,none,2023-07-17T08:45:12Z
3,youtube#searchResult,oq06YFz4sAHtnUtJjt_N3ihZi4k,youtube#video,JXuEHSOLnmo,2023-04-07T10:03:52Z,UCZq33lhQWAsd-8NDqOdjN_g,Seldon&#39;s Team Growth and International Expansion post Series B,Join our VP of Customer Success Nick Abbott as he talks you through what our Series be funding means for our both our ...,https://i.ytimg.com/vi/JXuEHSOLnmo/default.jpg,120,90,https://i.ytimg.com/vi/JXuEHSOLnmo/mqdefault.jpg,320,180,https://i.ytimg.com/vi/JXuEHSOLnmo/hqdefault.jpg,480,360,Seldon,none,2023-04-07T10:03:52Z
