,kind,etag,id.kind,id.videoId,snippet.publishedAt,snippet.channelId,snippet.title,snippet.description,snippet.thumbnails.default.url,snippet.thumbnails.default.width,snippet.thumbnails.default.height,snippet.thumbnails.medium.url,snippet.thumbnails.medium.width,snippet.thumbnails.medium.height,snippet.thumbnails.high.url,snippet.thumbnails.high.width,snippet.thumbnails.high.height,snippet.channelTitle,snippet.liveBroadcastContent,snippet.publishTime
1,youtube#searchResult,rQt_NyAyGiEw047gJJ25BmoNJaI,youtube#video,FYYbtaC2qzA,2026-05-28T13:00:06Z,UCTEgowmo98A-VI53vwmkmhg,Let&#39;s Talk Research - The Soul of MLIPAudit,"Catch up now on our latest episode with Silvia Acosta Gutierrez, Staff Research Scientist, and Leon Wehrhan, Applied Research ...",https://i.ytimg.com/vi/FYYbtaC2qzA/default.jpg,120,90,https://i.ytimg.com/vi/FYYbtaC2qzA/mqdefault.jpg,320,180,https://i.ytimg.com/vi/FYYbtaC2qzA/hqdefault.jpg,480,360,InstaDeep,none,2026-05-28T13:00:06Z
2,youtube#searchResult,7fM4OcA76k5zOwsNLV9TsD0Ug9k,youtube#video,FGXwxoP1OUQ,2026-05-13T13:30:28Z,UCTEgowmo98A-VI53vwmkmhg,Let&#39;s Talk Research Episode 9: MLIPAudit - Trustworthy Molecular Simulation,"We sit down with Silvia Acosta Gutierrez, Staff Research Scientist, and Leon Wehrhan, Applied Research Scientist at InstaDeep, ...",https://i.ytimg.com/vi/FGXwxoP1OUQ/default.jpg,120,90,https://i.ytimg.com/vi/FGXwxoP1OUQ/mqdefault.jpg,320,180,https://i.ytimg.com/vi/FGXwxoP1OUQ/hqdefault.jpg,480,360,InstaDeep,none,2026-05-13T13:30:28Z
3,youtube#searchResult,msGxp8OcuRyCGiWk_OYU4b44sX0,youtube#video,lzvZ6igEgc8,2026-04-16T13:03:41Z,UCTEgowmo98A-VI53vwmkmhg,Let&#39;s Talk Research Episode 8: AI and Biology in Practice,"We sit down with Marie Lopez, Genomics Lead at InstaDeep, to discuss the practical applications of our Nucleotide Transformer ...",https://i.ytimg.com/vi/lzvZ6igEgc8/default.jpg,120,90,https://i.ytimg.com/vi/lzvZ6igEgc8/mqdefault.jpg,320,180,https://i.ytimg.com/vi/lzvZ6igEgc8/hqdefault.jpg,480,360,InstaDeep,none,2026-04-16T13:03:41Z
4,youtube#searchResult,Jmr7_bz2n3-ijYBZwjRio15sIvg,youtube#video,L0u6XvTomlM,2026-03-30T14:39:48Z,UCTEgowmo98A-VI53vwmkmhg,Genome modelling at scale: Let&#39;s Talk Research episode 7,"Don't miss Episode 7 of Let's Talk Research! Catch up now on our latest episode with Head of Genomics AI Research, Bernardo ...",https://i.ytimg.com/vi/L0u6XvTomlM/default.jpg,120,90,https://i.ytimg.com/vi/L0u6XvTomlM/mqdefault.jpg,320,180,https://i.ytimg.com/vi/L0u6XvTomlM/hqdefault.jpg,480,360,InstaDeep,none,2026-03-30T14:39:48Z
0,youtube#searchResult,tn4Htee9uHDoL8xKLNGEdoPfBes,youtube#video,uo6a2wH94LU,2025-11-14T20:08:21Z,UCJ4D3tL-iEWyJJDXJAsd9Mw,R+AI Conference: Szilard Pafka: Gradient Boosting Machines (GBMs) in the Age of LLMs and ChatGPT,"Gradient Boosting Machines (GBMs) in the Age of LLMs and ChatGPT Szilard Pafka, PhD Chief Scientist, Epoch Gradient ...",https://i.ytimg.com/vi/uo6a2wH94LU/default.jpg,120,90,https://i.ytimg.com/vi/uo6a2wH94LU/mqdefault.jpg,320,180,https://i.ytimg.com/vi/uo6a2wH94LU/hqdefault.jpg,480,360,Real Data Science USA (formerly DataScience.LA),none,2025-11-14T20:08:21Z
1,youtube#searchResult,j4l4SvIAyMTXDmgZPDF1RFCJmlU,youtube#video,igflZ8_9hdk,2022-05-26T20:16:29Z,UCJ4D3tL-iEWyJJDXJAsd9Mw,"Real Data Science USA Meetup, May 26, 2022 - Szilard Pafka: Best Algo for Tabular/Business Data?","Best Algorithm for Tabular/Business Data? Sorry, It's Not Deep Learning… Szilard Pafka, PhD Chief Scientist, Epoch With all the ...",https://i.ytimg.com/vi/igflZ8_9hdk/default.jpg,120,90,https://i.ytimg.com/vi/igflZ8_9hdk/mqdefault.jpg,320,180,https://i.ytimg.com/vi/igflZ8_9hdk/hqdefault.jpg,480,360,Real Data Science USA (formerly DataScience.LA),none,2022-05-26T20:16:29Z
2,youtube#searchResult,Ja_w6-52E9N66iCD_YwPgQp2CGE,youtube#video,8ze-zf_-viE,2021-11-12T15:52:55Z,UCJ4D3tL-iEWyJJDXJAsd9Mw,"Real Data Science USA - R Meetup, Nov 11, 2021 - Gergely Daroczi: A Decade of Using R in Production","A Decade of Using R in Production with Gergely Daroczi, Senior Director of Data Operations at System1 R is often not taken ...",https://i.ytimg.com/vi/8ze-zf_-viE/default.jpg,120,90,https://i.ytimg.com/vi/8ze-zf_-viE/mqdefault.jpg,320,180,https://i.ytimg.com/vi/8ze-zf_-viE/hqdefault.jpg,480,360,Real Data Science USA (formerly DataScience.LA),none,2021-11-12T15:52:55Z
3,youtube#searchResult,jN5ok5J2bC7xNJKu9Z5u3UKPfBU,youtube#video,sNTlt2SMwkU,2021-06-08T21:44:42Z,UCJ4D3tL-iEWyJJDXJAsd9Mw,"LA Data Science Meetup, June 8, 2021 - Michal Kurka: H2O&#39;s GBM",Overview of H2O GBM implementation by Michal Kurka H2O started its mission to let data scientists train their models on datasets ...,https://i.ytimg.com/vi/sNTlt2SMwkU/default.jpg,120,90,https://i.ytimg.com/vi/sNTlt2SMwkU/mqdefault.jpg,320,180,https://i.ytimg.com/vi/sNTlt2SMwkU/hqdefault.jpg,480,360,Real Data Science USA (formerly DataScience.LA),none,2021-06-08T21:44:42Z
4,youtube#searchResult,Vn4HWGHfL8s055ou6ccCKuEpWO4,youtube#video,2OfTEakSFXQ,2021-05-19T06:10:58Z,UCJ4D3tL-iEWyJJDXJAsd9Mw,"LA R Users - Max Kuhn - Creating model en mass with workflowsets - May 18, 2021",Creating model en mass with workflowsets*** The tidymodels packages allow users to create and optimize models and their ...,https://i.ytimg.com/vi/2OfTEakSFXQ/default.jpg,120,90,https://i.ytimg.com/vi/2OfTEakSFXQ/mqdefault.jpg,320,180,https://i.ytimg.com/vi/2OfTEakSFXQ/hqdefault.jpg,480,360,Real Data Science USA (formerly DataScience.LA),none,2021-05-19T06:10:58Z
0,youtube#searchResult,VvWY44zGzlSQDfIoVg7h1OavGpg,youtube#video,LI2G4ztuIPs,2023-05-04T13:30:25Z,UCH99twkwBNwN-IBQjoHwdCQ,ChicagoML Building with Large Language Models,"The last six months have seen an explosion of interest in large language models spurred by the releases of ChatGPT, GPT-4, and ...",https://i.ytimg.com/vi/LI2G4ztuIPs/default.jpg,120,90,https://i.ytimg.com/vi/LI2G4ztuIPs/mqdefault.jpg,320,180,https://i.ytimg.com/vi/LI2G4ztuIPs/hqdefault.jpg,480,360,Chicago ML,none,2023-05-04T13:30:25Z
1,youtube#searchResult,xz8bJulmVzUxZFn626uwMTnalN4,youtube#video,R9sIRi-jwP8,2023-05-04T13:24:40Z,UCH99twkwBNwN-IBQjoHwdCQ,Chicago ML Lightning Talks,Chicaghost: Predicting Train Time Delays by Will Raphaelson - Leveraging LLM Hallucination with Marvin by Nate Nowack - Free ...,https://i.ytimg.com/vi/R9sIRi-jwP8/default.jpg,120,90,https://i.ytimg.com/vi/R9sIRi-jwP8/mqdefault.jpg,320,180,https://i.ytimg.com/vi/R9sIRi-jwP8/hqdefault.jpg,480,360,Chicago ML,none,2023-05-04T13:24:40Z
2,youtube#searchResult,-4Kmfc4uSxjA444_4jNVHbnq0S0,youtube#video,7uOWoO5vVNs,2022-11-02T04:57:01Z,UCH99twkwBNwN-IBQjoHwdCQ,"Chicago ML - November 1, 2022 - The Transformation of ML with Transformers",,https://i.ytimg.com/vi/7uOWoO5vVNs/default.jpg,120,90,https://i.ytimg.com/vi/7uOWoO5vVNs/mqdefault.jpg,320,180,https://i.ytimg.com/vi/7uOWoO5vVNs/hqdefault.jpg,480,360,Chicago ML,none,2022-11-02T04:57:01Z
3,youtube#searchResult,EkykBVji7SPNMUVUR6E-OH95iJQ,youtube#video,90oNojNV75o,2022-11-02T04:51:16Z,UCH99twkwBNwN-IBQjoHwdCQ,"Chicago ML - November 1, 2022 - The Path to End to End Spoken Language Redaction",,https://i.ytimg.com/vi/90oNojNV75o/default.jpg,120,90,https://i.ytimg.com/vi/90oNojNV75o/mqdefault.jpg,320,180,https://i.ytimg.com/vi/90oNojNV75o/hqdefault.jpg,480,360,Chicago ML,none,2022-11-02T04:51:16Z
4,youtube#searchResult,PjxTjVCUCmF-BqGVeGLO8o8tY5g,youtube#video,6dpyTMhw-9s,2021-02-16T14:58:38Z,UCH99twkwBNwN-IBQjoHwdCQ,"Chicago ML - February 15, 2021 - Automated Exploration of Bioinformatic Models",,https://i.ytimg.com/vi/6dpyTMhw-9s/default.jpg,120,90,https://i.ytimg.com/vi/6dpyTMhw-9s/mqdefault.jpg,320,180,https://i.ytimg.com/vi/6dpyTMhw-9s/hqdefault.jpg,480,360,Chicago ML,none,2021-02-16T14:58:38Z
0,youtube#searchResult,CwX1hGHs93HGmrh5kSqM97Z14UA,youtube#video,l1sCtg4WYxo,2023-02-20T05:00:20Z,UCa3zFn8tzw6GaBKZUzifM9A,Lecture 5: Ethics and Transparency by Emily Denton (Day 5),"Emily Denton gives an overview of algorithmic harms, thoughtful dataset development, and discusses efforts in the AI community ...",https://i.ytimg.com/vi/l1sCtg4WYxo/default.jpg,120,90,https://i.ytimg.com/vi/l1sCtg4WYxo/mqdefault.jpg,320,180,https://i.ytimg.com/vi/l1sCtg4WYxo/hqdefault.jpg,480,360,NYU AI School,none,2023-02-20T05:00:20Z
1,youtube#searchResult,tH3ZrB5mqhFY-f0LaEn2bLSN3IQ,youtube#video,N5RAqvDTlao,2023-02-20T05:00:06Z,UCa3zFn8tzw6GaBKZUzifM9A,Panel: Bumpy Road to AI Research,A no-holds-barred panel discussion on challenges and realities of artificial intelligence research. Panelists: Sam Bowman ...,https://i.ytimg.com/vi/N5RAqvDTlao/default.jpg,120,90,https://i.ytimg.com/vi/N5RAqvDTlao/mqdefault.jpg,320,180,https://i.ytimg.com/vi/N5RAqvDTlao/hqdefault.jpg,480,360,NYU AI School,none,2023-02-20T05:00:06Z
2,youtube#searchResult,XY7Xr6Ck3sWb500jXJL2gy3w5Fk,youtube#video,Tlcfgl_kAkI,2023-02-20T05:00:19Z,UCa3zFn8tzw6GaBKZUzifM9A,Lecture 4: Deep Learning Part 2: Natural Language Processing by Sabrina Mielke (Day 4),Sabrina Mielke teaches us about deep neural networks as used in natural language applications. Lecture includes text ...,https://i.ytimg.com/vi/Tlcfgl_kAkI/default.jpg,120,90,https://i.ytimg.com/vi/Tlcfgl_kAkI/mqdefault.jpg,320,180,https://i.ytimg.com/vi/Tlcfgl_kAkI/hqdefault.jpg,480,360,NYU AI School,none,2023-02-20T05:00:19Z
3,youtube#searchResult,n2UUUF7EMpyfA-uMpRckaddnP5g,youtube#video,cptbXhIsdRQ,2023-02-20T05:00:17Z,UCa3zFn8tzw6GaBKZUzifM9A,Panel: Building a Career in AI,"Discussion on how to get into machine learning as a budding undergraduate, including non-STEM majors. Panelists: Tai-Danae ...",https://i.ytimg.com/vi/cptbXhIsdRQ/default.jpg,120,90,https://i.ytimg.com/vi/cptbXhIsdRQ/mqdefault.jpg,320,180,https://i.ytimg.com/vi/cptbXhIsdRQ/hqdefault.jpg,480,360,NYU AI School,none,2023-02-20T05:00:17Z
4,youtube#searchResult,5xZk96kVOpszOe1I1-G0W5OSVUo,youtube#video,44LhKrwY7FQ,2023-02-20T05:00:01Z,UCa3zFn8tzw6GaBKZUzifM9A,Lecture 3: Deep Learning Part 1: Computer Vision by Elena Sizikova (Day 3),Elena Sizikova teaches us the basics of deep neural networks as used in computer vision applications. Lecture includes an ...,https://i.ytimg.com/vi/44LhKrwY7FQ/default.jpg,120,90,https://i.ytimg.com/vi/44LhKrwY7FQ/mqdefault.jpg,320,180,https://i.ytimg.com/vi/44LhKrwY7FQ/hqdefault.jpg,480,360,NYU AI School,none,2023-02-20T05:00:01Z
0,youtube#searchResult,_57EarDjvTmwhTR7IVecvQJKIFo,youtube#video,7oM5NAl9SPM,2026-06-22T15:42:49Z,UCYuxbq0trkgoaoN72eJi8dA,DATA festival 2026: It was a blast!,"Munich, this was a blast! Relive two days of hands-on Data & AI insights at DATA festival Munich 2026. With 280+ participants, ...",https://i.ytimg.com/vi/7oM5NAl9SPM/default.jpg,120,90,https://i.ytimg.com/vi/7oM5NAl9SPM/mqdefault.jpg,320,180,https://i.ytimg.com/vi/7oM5NAl9SPM/hqdefault.jpg,480,360,DATA festival,none,2026-06-22T15:42:49Z
1,youtube#searchResult,tRVYnTH69OOp9mZIQDp3alpvUwE,youtube#video,p91XxrRxrXU,2026-01-27T08:08:29Z,UCYuxbq0trkgoaoN72eJi8dA,Get ready for the DATA Festival in Munich 2026!,"DATA festival Munich isn't for everyone – it's for those ready to build. As a cornerstone of the Data & AI community, this event ...",https://i.ytimg.com/vi/p91XxrRxrXU/default.jpg,120,90,https://i.ytimg.com/vi/p91XxrRxrXU/mqdefault.jpg,320,180,https://i.ytimg.com/vi/p91XxrRxrXU/hqdefault.jpg,480,360,DATA festival,none,2026-01-27T08:08:29Z
2,youtube#searchResult,7jlUyoro1-_-R8vXnLAT2nIDvJE,youtube#video,qEeqlLmZZ9U,2025-07-31T15:31:47Z,UCYuxbq0trkgoaoN72eJi8dA,Join us for the DATA festival online in October 2025!,wAIt no more! Sign up for free and save your spot now: https://barc.com/events/data-festival... DATA festival online is where theory ...,https://i.ytimg.com/vi/qEeqlLmZZ9U/default.jpg,120,90,https://i.ytimg.com/vi/qEeqlLmZZ9U/mqdefault.jpg,320,180,https://i.ytimg.com/vi/qEeqlLmZZ9U/hqdefault.jpg,480,360,DATA festival,none,2025-07-31T15:31:47Z
3,youtube#searchResult,p0PEYUJ641ji4bLj1N5yUPI2vBw,youtube#video,5Od4SeaiuHU,2025-07-24T13:28:36Z,UCYuxbq0trkgoaoN72eJi8dA,Centralized vs. Decentralized Data? Hybrid Wins. #datagovernance #shorts #datafestival #ai,Speaker: Thorsten Kranz | Head of AI Solutions at DHL Interested in what is happening at the forefront of AI? Join our DATA ...,https://i.ytimg.com/vi/5Od4SeaiuHU/default.jpg,120,90,https://i.ytimg.com/vi/5Od4SeaiuHU/mqdefault.jpg,320,180,https://i.ytimg.com/vi/5Od4SeaiuHU/hqdefault.jpg,480,360,DATA festival,none,2025-07-24T13:28:36Z
4,youtube#searchResult,Xn5NPUA1x__CypCc4AplSEp5LOM,youtube#video,hiunJBn2iNc,2025-07-24T13:24:13Z,UCYuxbq0trkgoaoN72eJi8dA,How AI Is Changing Data Job Roles! 💼🤖 #shorts #AI #DataFestival,Speaker: Barbara Engerer | Head of Data & AI - Senior Vice President Global Digital Services @ BSH Home Appliances Group ...,https://i.ytimg.com/vi/hiunJBn2iNc/default.jpg,120,90,https://i.ytimg.com/vi/hiunJBn2iNc/mqdefault.jpg,320,180,https://i.ytimg.com/vi/hiunJBn2iNc/hqdefault.jpg,480,360,DATA festival,none,2025-07-24T13:24:13Z
0,youtube#searchResult,Qs6bj8_uzCkxOWrumf138E3iy4Y,youtube#video,KdUrfY1yM0w,2024-06-05T21:00:19Z,UCKPyg5gsnt6h0aA8EBw3i6A,"Classification Metrics Explained | Sensitivity, Precision, AUROC, &amp; More",Subscribe to RichardOnData here: https://www.youtube.com/channel/UCKPyg5gsnt6h0aA8EBw3i6A?sub_confirmation=1 In this ...,https://i.ytimg.com/vi/KdUrfY1yM0w/default.jpg,120,90,https://i.ytimg.com/vi/KdUrfY1yM0w/mqdefault.jpg,320,180,https://i.ytimg.com/vi/KdUrfY1yM0w/hqdefault.jpg,480,360,RichardOnData,none,2024-06-05T21:00:19Z
1,youtube#searchResult,yzCxpEjvD4mVnSxQnDLaNkzEfJ0,youtube#video,Vfnv1_bBqNg,2024-05-29T18:00:17Z,UCKPyg5gsnt6h0aA8EBw3i6A,SHAP Values: An Overview,Subscribe to RichardOnData here: https://www.youtube.com/channel/UCKPyg5gsnt6h0aA8EBw3i6A?sub_confirmation=1 In this ...,https://i.ytimg.com/vi/Vfnv1_bBqNg/default.jpg,120,90,https://i.ytimg.com/vi/Vfnv1_bBqNg/mqdefault.jpg,320,180,https://i.ytimg.com/vi/Vfnv1_bBqNg/hqdefault.jpg,480,360,RichardOnData,none,2024-05-29T18:00:17Z
2,youtube#searchResult,1nuKv9fSRNGh_JMavYMrXEnuTiY,youtube#video,nsHHcBoRTrI,2024-05-15T16:00:42Z,UCKPyg5gsnt6h0aA8EBw3i6A,Is ChatGPT-4 Worth It?,Subscribe to RichardOnData here: https://www.youtube.com/channel/UCKPyg5gsnt6h0aA8EBw3i6A?sub_confirmation=1 NOTE: ...,https://i.ytimg.com/vi/nsHHcBoRTrI/default.jpg,120,90,https://i.ytimg.com/vi/nsHHcBoRTrI/mqdefault.jpg,320,180,https://i.ytimg.com/vi/nsHHcBoRTrI/hqdefault.jpg,480,360,RichardOnData,none,2024-05-15T16:00:42Z
3,youtube#searchResult,BYQnqpy6IqM1THzVQjzDIHOtG84,youtube#video,Shl1XsvnbHg,2024-03-18T15:30:09Z,UCKPyg5gsnt6h0aA8EBw3i6A,Follow THESE 5 Tips to Get a Data Job,Subscribe to RichardOnData here: https://www.youtube.com/channel/UCKPyg5gsnt6h0aA8EBw3i6A?sub_confirmation=1 In this ...,https://i.ytimg.com/vi/Shl1XsvnbHg/default.jpg,120,90,https://i.ytimg.com/vi/Shl1XsvnbHg/mqdefault.jpg,320,180,https://i.ytimg.com/vi/Shl1XsvnbHg/hqdefault.jpg,480,360,RichardOnData,none,2024-03-18T15:30:09Z
4,youtube#searchResult,n8d2Sa8Y41bReWEbuimCZRcqTHQ,youtube#video,EW3FkQMTdKM,2024-03-10T17:00:09Z,UCKPyg5gsnt6h0aA8EBw3i6A,Learn (and Do) Data Science FAST with ChatGPT,Subscribe to RichardOnData here: https://www.youtube.com/channel/UCKPyg5gsnt6h0aA8EBw3i6A?sub_confirmation=1 In this ...,https://i.ytimg.com/vi/EW3FkQMTdKM/default.jpg,120,90,https://i.ytimg.com/vi/EW3FkQMTdKM/mqdefault.jpg,320,180,https://i.ytimg.com/vi/EW3FkQMTdKM/hqdefault.jpg,480,360,RichardOnData,none,2024-03-10T17:00:09Z
0,youtube#searchResult,MXsmmCMB-o1mBbRxaiUESte_yRM,youtube#video,MYKYksteNMM,2023-05-03T22:25:36Z,UCvwDejnW-Q49xEb667JqS-g,Mar 2023 - Supercharge your Python Dev Environment with VS Code &amp; XGBoost Wage Prediction Model,"Philly Python Users' Group + DataPhilly collaboration in-person event on Wharton's campus (Philadelphia, PA) on Mar 30, 2023.",https://i.ytimg.com/vi/MYKYksteNMM/default.jpg,120,90,https://i.ytimg.com/vi/MYKYksteNMM/mqdefault.jpg,320,180,https://i.ytimg.com/vi/MYKYksteNMM/hqdefault.jpg,480,360,DataPhilly,none,2023-05-03T22:25:36Z
1,youtube#searchResult,2dFKRr_A-P5rj4BNkHMFKROWp4w,youtube#video,8y1p6uBHWVs,2022-10-17T00:51:38Z,UCvwDejnW-Q49xEb667JqS-g,Aug 2022  - Lighting Talks - Using Data Science in the Real World,This is a video of the second half of the event only. Lighting Talk #2 Abstract: The last two Canadian federal elections have ...,https://i.ytimg.com/vi/8y1p6uBHWVs/default.jpg,120,90,https://i.ytimg.com/vi/8y1p6uBHWVs/mqdefault.jpg,320,180,https://i.ytimg.com/vi/8y1p6uBHWVs/hqdefault.jpg,480,360,DataPhilly,none,2022-10-17T00:51:38Z
2,youtube#searchResult,36gcg4K2CPsuBj7jH2BGKvDC2WI,youtube#video,UixN0WmRaEg,2022-06-09T20:58:47Z,UCvwDejnW-Q49xEb667JqS-g,May 2022 - Linux Deep Dive for Data Science,"Speaker Session 1: In the world of data, there are a wide variety of tools for processing, managing, and analyzing data.",https://i.ytimg.com/vi/UixN0WmRaEg/default.jpg,120,90,https://i.ytimg.com/vi/UixN0WmRaEg/mqdefault.jpg,320,180,https://i.ytimg.com/vi/UixN0WmRaEg/hqdefault.jpg,480,360,DataPhilly,none,2022-06-09T20:58:47Z
3,youtube#searchResult,en3LrkNwjKAMDNPuq1GEBso1UPA,youtube#video,dSslgMZEhas,2022-04-25T22:03:00Z,UCvwDejnW-Q49xEb667JqS-g,April 2022 - Live LinkedIn Profile Reviews &amp; Job Search Strategies,"DataPhilly Speaker Event - Apr 21, 2022 Topic: Live LinkedIn Profile Reviews & Job Search Strategies Speaker: Lynne Williams Is ...",https://i.ytimg.com/vi/dSslgMZEhas/default.jpg,120,90,https://i.ytimg.com/vi/dSslgMZEhas/mqdefault.jpg,320,180,https://i.ytimg.com/vi/dSslgMZEhas/hqdefault.jpg,480,360,DataPhilly,none,2022-04-25T22:03:00Z
4,youtube#searchResult,EwXIPEPInFhJQAc-m3JnQusICrI,youtube#video,D3vbH9klbTk,2022-01-03T02:59:02Z,UCvwDejnW-Q49xEb667JqS-g,Introducing Unstructured Data into your Models,"DataPhilly Speaker Event - Dec 16, 2021 Topic: Introducing Unstructured Data into your Models - Extracting predictive info/signals ...",https://i.ytimg.com/vi/D3vbH9klbTk/default.jpg,120,90,https://i.ytimg.com/vi/D3vbH9klbTk/mqdefault.jpg,320,180,https://i.ytimg.com/vi/D3vbH9klbTk/hqdefault.jpg,480,360,DataPhilly,none,2022-01-03T02:59:02Z
0,youtube#searchResult,N42h_9hF3hxLRzyvuPLpx5Klvv8,youtube#video,vqrYUAQNvEc,2026-06-22T03:52:01Z,UCipPccqvcfychKNOaYUokyQ,[AIP AI4S Seminar Series #2]  Talk by Masaaki Imaizumi (University of Tokyo and RIKEN AIP)-20260318,Event URL: https://c5dc59ed978213830355fc8978.doorkeeper.jp/events/195771 Please subscribe to our YouTube channel!,https://i.ytimg.com/vi/vqrYUAQNvEc/default.jpg,120,90,https://i.ytimg.com/vi/vqrYUAQNvEc/mqdefault.jpg,320,180,https://i.ytimg.com/vi/vqrYUAQNvEc/hqdefault.jpg,480,360,RIKEN AIP,none,2026-06-22T03:52:01Z
1,youtube#searchResult,NkXQaYPOi5gV6dRAMsvrrugA1jQ,youtube#video,u_HZgudJMU0,2026-06-17T23:02:12Z,UCipPccqvcfychKNOaYUokyQ,"The 2nd RIKEN AIP - IIT Hyderabad Joint Workshop Day2 Part 1-1 (Mar. 25, 2025)","The 2nd RIKEN AIP - IIT Hyderabad Joint Workshop Day2 Part 1-1 (Mar. 25, 2025) 00:00:06 Srijith P K (IITH) Title: Towards ...",https://i.ytimg.com/vi/u_HZgudJMU0/default.jpg,120,90,https://i.ytimg.com/vi/u_HZgudJMU0/mqdefault.jpg,320,180,https://i.ytimg.com/vi/u_HZgudJMU0/hqdefault.jpg,480,360,RIKEN AIP,none,2026-06-17T23:02:12Z
2,youtube#searchResult,SYk9XN_AnUfNIZtUQOg8WqkRK8A,youtube#video,wgxCA_r9xcs,2026-06-10T06:35:09Z,UCipPccqvcfychKNOaYUokyQ,"Statistical Safeguarding Workshop 2026 Part 2 (Apr. 9, 2026)","Statistical Safeguarding Workshop 2026 Part 2 (Apr. 9, 2026) ＊You can start each talk by clicking the time (h:m:s) before the ...",https://i.ytimg.com/vi/wgxCA_r9xcs/default.jpg,120,90,https://i.ytimg.com/vi/wgxCA_r9xcs/mqdefault.jpg,320,180,https://i.ytimg.com/vi/wgxCA_r9xcs/hqdefault.jpg,480,360,RIKEN AIP,none,2026-06-10T06:35:09Z
3,youtube#searchResult,q7hdFdF2J5yeTAShjvAE7viQMec,youtube#video,dwjTSl7wuG0,2026-06-10T06:33:30Z,UCipPccqvcfychKNOaYUokyQ,"Statistical Safeguarding Workshop 2026 Part 1 (Apr. 9, 2026)","Statistical Safeguarding Workshop 2026 Part 1 (Apr. 9, 2026) ＊You can start each talk by clicking the time (h:m:s) before the ...",https://i.ytimg.com/vi/dwjTSl7wuG0/default.jpg,120,90,https://i.ytimg.com/vi/dwjTSl7wuG0/mqdefault.jpg,320,180,https://i.ytimg.com/vi/dwjTSl7wuG0/hqdefault.jpg,480,360,RIKEN AIP,none,2026-06-10T06:33:30Z
4,youtube#searchResult,2Hw7qCvsBnvcdVl2CNTwTQiPYxw,youtube#video,KO3HgALHLEc,2026-06-03T23:57:23Z,UCipPccqvcfychKNOaYUokyQ,"The 2nd RIKEN AIP - IIT Hyderabad Joint Workshop Day2 Part 2 (Mar. 25, 2026)",You can start each talk by clicking the time (h:m:s) before the speaker's name. Spotlight Talks: 00:00:06 Arkaprava Majumdar ...,https://i.ytimg.com/vi/KO3HgALHLEc/default.jpg,120,90,https://i.ytimg.com/vi/KO3HgALHLEc/mqdefault.jpg,320,180,https://i.ytimg.com/vi/KO3HgALHLEc/hqdefault.jpg,480,360,RIKEN AIP,none,2026-06-03T23:57:23Z
0,youtube#searchResult,n5gwqW6lCXKbk3QvkXLswibUgFM,youtube#video,ssPSCs5GVlA,2022-09-13T15:20:32Z,UCY15whY8GyA3DgjZFPdHfAQ,AI Expo 2022 | Panel: Productivity and Performance Boosters for Data Scientists and Developers,"ValleyML AI Expo 2022 Panel Discussion, In-Person Event, Day 1 Topic: Productivity and Performance Boosters for Data ...",https://i.ytimg.com/vi/ssPSCs5GVlA/default.jpg,120,90,https://i.ytimg.com/vi/ssPSCs5GVlA/mqdefault.jpg,320,180,https://i.ytimg.com/vi/ssPSCs5GVlA/hqdefault.jpg,480,360,ValleyML,none,2022-09-13T15:20:32Z
1,youtube#searchResult,6h8lnm0yXNlSfkRqtdltoryz9vs,youtube#video,xCMgLDx1O9M,2022-09-13T14:02:53Z,UCY15whY8GyA3DgjZFPdHfAQ,AI Expo 2022 | Chris Eliasmith - An Optimal Time Series Processor,"ValleyML AI Expo 2022 Sponsored Session, AI Hardware, Virtual Event Speaker: Chris Eliasmith, Co-CEO, Applied Brain ...",https://i.ytimg.com/vi/xCMgLDx1O9M/default.jpg,120,90,https://i.ytimg.com/vi/xCMgLDx1O9M/mqdefault.jpg,320,180,https://i.ytimg.com/vi/xCMgLDx1O9M/hqdefault.jpg,480,360,ValleyML,none,2022-09-13T14:02:53Z
2,youtube#searchResult,Gyx3Vm7t21vTtTX1jH1xIJGRwPg,youtube#video,8kYM_Ac78ik,2022-09-13T14:02:58Z,UCY15whY8GyA3DgjZFPdHfAQ,AI Expo 2022 | Mark Oliver - Introduction to the Efinix TinyML Platform,"ValleyML AI Expo 2022 Sponsored Session, AI Hardware, Virtual Event Speaker: Mark Oliver, VP Marketing, Efinix, Inc. Title: ...",https://i.ytimg.com/vi/8kYM_Ac78ik/default.jpg,120,90,https://i.ytimg.com/vi/8kYM_Ac78ik/mqdefault.jpg,320,180,https://i.ytimg.com/vi/8kYM_Ac78ik/hqdefault.jpg,480,360,ValleyML,none,2022-09-13T14:02:58Z
3,youtube#searchResult,Ibqi2tdEf9eMK6RQmXVdSDD079I,youtube#video,MvR-_fJ0NMQ,2022-09-13T14:03:03Z,UCY15whY8GyA3DgjZFPdHfAQ,AI Expo 2022 | Manasi Vartak - A Reference Architecture for Operational AI,"ValleyML AI Expo 2022 Sponsored Session, AI Operations, Virtual Event Speaker: Manasi Vartak, CEO, Verta Inc Title: A ...",https://i.ytimg.com/vi/MvR-_fJ0NMQ/default.jpg,120,90,https://i.ytimg.com/vi/MvR-_fJ0NMQ/mqdefault.jpg,320,180,https://i.ytimg.com/vi/MvR-_fJ0NMQ/hqdefault.jpg,480,360,ValleyML,none,2022-09-13T14:03:03Z
4,youtube#searchResult,5JenBakojW0CzhzQ0WL8Y7ftafU,youtube#video,6Xmeo99eHVw,2022-09-13T14:03:09Z,UCY15whY8GyA3DgjZFPdHfAQ,AI Expo 2022 | Jan Jongboom - Building confidence in your ML models,"ValleyML AI Expo 2022 Virtual Keynote Speaker: Jan Jongboom, CTO, Edge Impulse Title: Building confidence in your ML ...",https://i.ytimg.com/vi/6Xmeo99eHVw/default.jpg,120,90,https://i.ytimg.com/vi/6Xmeo99eHVw/mqdefault.jpg,320,180,https://i.ytimg.com/vi/6Xmeo99eHVw/hqdefault.jpg,480,360,ValleyML,none,2022-09-13T14:03:09Z
0,youtube#searchResult,3OwBz7Y4AjEUYh2wWPNFpo-MfFg,youtube#video,5D2Vdt0QMN0,2021-08-12T21:37:24Z,UCMxUmQFr0_dyW8JTLDiOeNQ,"Proof, Provers, and the Lean Theorem Prover - Summer Special!","In this summer special we'll take a break from messy data, and - just for fun - take refuge in the reassuring consistency and ...",https://i.ytimg.com/vi/5D2Vdt0QMN0/default.jpg,120,90,https://i.ytimg.com/vi/5D2Vdt0QMN0/mqdefault.jpg,320,180,https://i.ytimg.com/vi/5D2Vdt0QMN0/hqdefault.jpg,480,360,Data Science Cornwall,none,2021-08-12T21:37:24Z
1,youtube#searchResult,fKNtKzjwJn_R0IQ9wpTc95NVGVA,youtube#video,Qv4FVsXnf-M,2021-07-29T22:35:10Z,UCMxUmQFr0_dyW8JTLDiOeNQ,Data Challenge Cornwall - Cluster Analysis to Create Personas without Bias,Link to slides: tinyurl.com/SmartlineClusterDataChallenge Slides include links to data and sample code. --- The Smartline Project ...,https://i.ytimg.com/vi/Qv4FVsXnf-M/default.jpg,120,90,https://i.ytimg.com/vi/Qv4FVsXnf-M/mqdefault.jpg,320,180,https://i.ytimg.com/vi/Qv4FVsXnf-M/hqdefault.jpg,480,360,Data Science Cornwall,none,2021-07-29T22:35:10Z
2,youtube#searchResult,8NZ7elGGYvVTe81z5p6kMseAmlk,youtube#video,6U3h6DBTZes,2021-07-29T22:35:24Z,UCMxUmQFr0_dyW8JTLDiOeNQ,Data Challenge Cornwall - Predicting Housing Faults &amp; Resident Support Needs,Slides: https://drive.google.com/file/d/1lnjUb0tRI_wuHY1psFCArnDj8F116Osg/view?usp=sharing --- Coastline Housing is an ...,https://i.ytimg.com/vi/6U3h6DBTZes/default.jpg,120,90,https://i.ytimg.com/vi/6U3h6DBTZes/mqdefault.jpg,320,180,https://i.ytimg.com/vi/6U3h6DBTZes/hqdefault.jpg,480,360,Data Science Cornwall,none,2021-07-29T22:35:24Z
3,youtube#searchResult,F_Prdz2IDFknXDYOdozKUPuaQAQ,youtube#video,1Sy0B-4ZRg8,2021-07-29T22:20:51Z,UCMxUmQFr0_dyW8JTLDiOeNQ,Data Challenge Cornwall - OCR of Historical Mining Records,Link to scanned images: https://cornishlithium.egnyte.com/fl/dTYUvzsHR3 Slides: ...,https://i.ytimg.com/vi/1Sy0B-4ZRg8/default.jpg,120,90,https://i.ytimg.com/vi/1Sy0B-4ZRg8/mqdefault.jpg,320,180,https://i.ytimg.com/vi/1Sy0B-4ZRg8/hqdefault.jpg,480,360,Data Science Cornwall,none,2021-07-29T22:20:51Z
4,youtube#searchResult,zGOgtvGAuPhG45pfKZ3Hc8H93eg,youtube#video,CuSX2jFMAFc,2021-07-22T23:49:04Z,UCMxUmQFr0_dyW8JTLDiOeNQ,Data Challenge Cornwall - Visualising GP Surgery Data,"The NHS collects and publishes a broad range of data, including on GP surgery information. Join the session to find hear about ...",https://i.ytimg.com/vi/CuSX2jFMAFc/default.jpg,120,90,https://i.ytimg.com/vi/CuSX2jFMAFc/mqdefault.jpg,320,180,https://i.ytimg.com/vi/CuSX2jFMAFc/hqdefault.jpg,480,360,Data Science Cornwall,none,2021-07-22T23:49:04Z
