,kind,etag,id.kind,id.videoId,snippet.publishedAt,snippet.channelId,snippet.title,snippet.description,snippet.thumbnails.default.url,snippet.thumbnails.default.width,snippet.thumbnails.default.height,snippet.thumbnails.medium.url,snippet.thumbnails.medium.width,snippet.thumbnails.medium.height,snippet.thumbnails.high.url,snippet.thumbnails.high.width,snippet.thumbnails.high.height,snippet.channelTitle,snippet.liveBroadcastContent,snippet.publishTime
0,youtube#searchResult,X2goRAwPmxR4CUwqgMrp0x0rQYM,youtube#video,7y1rq9apST4,2021-07-29T08:43:46Z,UC7kFLyCRK3gQmiSBaFRzgnA,Utilizing Knowledge Graph for Healthy Ingredient Substitution | AI &amp; Food &amp; Nutrition | Sola Shirai,"Sola Shirai â€“ Doctoral Student, Rensselaer Polytechnic Institute The Applied Machine Learning Days channel features talks and performances from the Applied ...",https://i.ytimg.com/vi/7y1rq9apST4/default.jpg,120,90,https://i.ytimg.com/vi/7y1rq9apST4/mqdefault.jpg,320,180,https://i.ytimg.com/vi/7y1rq9apST4/hqdefault.jpg,480,360,Applied Machine Learning Days,none,2021-07-29T08:43:46Z
1,youtube#searchResult,cSxXkZzMKUnc5r6LTFNx0dkMCh0,youtube#video,QBBdzMSTuV8,2021-07-29T08:43:51Z,UC7kFLyCRK3gQmiSBaFRzgnA,Food Recognition Benchmark for Instance Segmentation tasks | AI &amp; Food &amp; Nutrition | Sharada Mohanty,"Sharada Mohanty â€“ CEO & Founder, AIcrowd The Applied Machine Learning Days channel features talks and performances from the Applied Machine Learning ...",https://i.ytimg.com/vi/QBBdzMSTuV8/default.jpg,120,90,https://i.ytimg.com/vi/QBBdzMSTuV8/mqdefault.jpg,320,180,https://i.ytimg.com/vi/QBBdzMSTuV8/hqdefault.jpg,480,360,Applied Machine Learning Days,none,2021-07-29T08:43:51Z
2,youtube#searchResult,ulZfztrZH-4IDAlz8uw9VwddBx4,youtube#video,oipMbg68qcg,2021-07-29T08:43:57Z,UC7kFLyCRK3gQmiSBaFRzgnA,Pitch session | AI &amp; Food and Nutrition,"Natural Language Processing for Automatic Labelling of Open Consumer Comments â€“ Nourchene Ben Romdhane, NestlÃ© Digital Twin Me, My diet and I â€“ Lydia ...",https://i.ytimg.com/vi/oipMbg68qcg/default.jpg,120,90,https://i.ytimg.com/vi/oipMbg68qcg/mqdefault.jpg,320,180,https://i.ytimg.com/vi/oipMbg68qcg/hqdefault.jpg,480,360,Applied Machine Learning Days,none,2021-07-29T08:43:57Z
3,youtube#searchResult,lAVne9sd7cPqe1BWBJb4gJctOHc,youtube#video,p3TYXKu0QFI,2021-07-29T08:43:08Z,UC7kFLyCRK3gQmiSBaFRzgnA,Machine Learning in Industry: Opportunities and Challenges | AI &amp; Food and Nutrition | Enrico Zio,"Enrico Zio â€“ Full Professor, Politecnico di Milano The Applied Machine Learning Days channel features talks and performances from the Applied Machine ...",https://i.ytimg.com/vi/p3TYXKu0QFI/default.jpg,120,90,https://i.ytimg.com/vi/p3TYXKu0QFI/mqdefault.jpg,320,180,https://i.ytimg.com/vi/p3TYXKu0QFI/hqdefault.jpg,480,360,Applied Machine Learning Days,none,2021-07-29T08:43:08Z
4,youtube#searchResult,JMtEbMX2ZXtRiDizCGyyGGuiYC4,youtube#video,rnVDzoCki04,2021-07-29T08:43:26Z,UC7kFLyCRK3gQmiSBaFRzgnA,Can AI &amp; social psycho nudge towards healthier diet? | AI &amp; Food and Nutrition | Patrizia Catellani,"Patrizia Catellani â€“ Full Professor, Department of Psychology, Catholic University of the Sacred Heart Milan The Applied Machine Learning Days channel ...",https://i.ytimg.com/vi/rnVDzoCki04/default.jpg,120,90,https://i.ytimg.com/vi/rnVDzoCki04/mqdefault.jpg,320,180,https://i.ytimg.com/vi/rnVDzoCki04/hqdefault.jpg,480,360,Applied Machine Learning Days,none,2021-07-29T08:43:26Z
0,youtube#searchResult,uYwt2PhcJ2FzlX19JQBWcRhnvpc,youtube#video,fIflyRSqjVM,2021-08-26T03:10:27Z,UCspapbPlDQn1Tc7Pym2KMTw,NLP with Friends,,https://i.ytimg.com/vi/fIflyRSqjVM/default.jpg,120,90,https://i.ytimg.com/vi/fIflyRSqjVM/mqdefault.jpg,320,180,https://i.ytimg.com/vi/fIflyRSqjVM/hqdefault.jpg,480,360,NLP with Friends,none,2021-08-26T03:10:27Z
1,youtube#searchResult,FgRVzirFhjNtxjtM8YOeJCpwNPQ,youtube#video,-kPkBFlmACw,2021-08-12T03:10:19Z,UCspapbPlDQn1Tc7Pym2KMTw,NLP with Friends,,https://i.ytimg.com/vi/-kPkBFlmACw/default.jpg,120,90,https://i.ytimg.com/vi/-kPkBFlmACw/mqdefault.jpg,320,180,https://i.ytimg.com/vi/-kPkBFlmACw/hqdefault.jpg,480,360,NLP with Friends,none,2021-08-12T03:10:19Z
2,youtube#searchResult,jsEGBehv5fa7JGQbnDKWG3khNJs,youtube#video,iiXOGSGuN6c,2021-06-22T01:09:28Z,UCspapbPlDQn1Tc7Pym2KMTw,"NLP with Friends, featured friend: Sherry Wu",Principles and Tools for Evaluating and Improving NLP Models.,https://i.ytimg.com/vi/iiXOGSGuN6c/default.jpg,120,90,https://i.ytimg.com/vi/iiXOGSGuN6c/mqdefault.jpg,320,180,https://i.ytimg.com/vi/iiXOGSGuN6c/hqdefault.jpg,480,360,NLP with Friends,none,2021-06-22T01:09:28Z
3,youtube#searchResult,NDajXxvWbyX4HsDVIu5Iu4V6oFw,youtube#video,pRq4tsi5GVU,2021-06-16T17:55:37Z,UCspapbPlDQn1Tc7Pym2KMTw,"NLP with Friends, Featured Friend: Zeerak Waseem",It ain't all good: Machinic Abuse Detection and Marginalisation in Machine Learning.,https://i.ytimg.com/vi/pRq4tsi5GVU/default.jpg,120,90,https://i.ytimg.com/vi/pRq4tsi5GVU/mqdefault.jpg,320,180,https://i.ytimg.com/vi/pRq4tsi5GVU/hqdefault.jpg,480,360,NLP with Friends,none,2021-06-16T17:55:37Z
4,youtube#searchResult,zOy1SMxoLVkvxavgkK6mbs6nPNk,youtube#video,lsJyvxO_27A,2021-06-16T16:52:10Z,UCspapbPlDQn1Tc7Pym2KMTw,"NLP with Friends, Featured Friend: Ofir Press",Shortformer: Better Language Modeling using Shorter Inputs.,https://i.ytimg.com/vi/lsJyvxO_27A/default.jpg,120,90,https://i.ytimg.com/vi/lsJyvxO_27A/mqdefault.jpg,320,180,https://i.ytimg.com/vi/lsJyvxO_27A/hqdefault.jpg,480,360,NLP with Friends,none,2021-06-16T16:52:10Z
0,youtube#searchResult,fNLNk-N0bFChidaK0ekKvKvImUY,youtube#video,PFHrB6jy_vk,2020-10-20T08:11:11Z,UC2FX7UmiCtIOpWVT7156Gag,REINFORCE AI online conference 2021- teaser,,https://i.ytimg.com/vi/PFHrB6jy_vk/default.jpg,120,90,https://i.ytimg.com/vi/PFHrB6jy_vk/mqdefault.jpg,320,180,https://i.ytimg.com/vi/PFHrB6jy_vk/hqdefault.jpg,480,360,Reinforceconf,none,2020-10-20T08:11:11Z
1,youtube#searchResult,oo2qHVrm-7yKA4GHBvh3MkhB564,youtube#video,qe3GSKsrjko,2020-01-22T12:47:17Z,UC2FX7UmiCtIOpWVT7156Gag,Reinforce 2020 trailer video,"Reinforce AI conference 2020 Budapest, 2020.04.06-08 Tickets, program: ...",https://i.ytimg.com/vi/qe3GSKsrjko/default.jpg,120,90,https://i.ytimg.com/vi/qe3GSKsrjko/mqdefault.jpg,320,180,https://i.ytimg.com/vi/qe3GSKsrjko/hqdefault.jpg,480,360,Reinforceconf,none,2020-01-22T12:47:17Z
2,youtube#searchResult,I78uHqzT7I-EufF8TUBUdQSDcWc,youtube#video,-8s06FJkNwY,2019-04-11T17:44:33Z,UC2FX7UmiCtIOpWVT7156Gag,Reinforce 2019 Summary,Summary video about the Reinforce AI conference 2019.,https://i.ytimg.com/vi/-8s06FJkNwY/default.jpg,120,90,https://i.ytimg.com/vi/-8s06FJkNwY/mqdefault.jpg,320,180,https://i.ytimg.com/vi/-8s06FJkNwY/hqdefault.jpg,480,360,Reinforceconf,none,2019-04-11T17:44:33Z
3,youtube#searchResult,nHLr0Nexm6W0ZChin3dz7bemUYE,youtube#video,Q6-TyrJcYMk,2019-03-25T15:00:08Z,UC2FX7UmiCtIOpWVT7156Gag,Andrea Pasqua - Forecasting at Uber: Machine Learning approaches,"In this talk, we will give an overview of several machine learning approaches to forecasting time series that we have employed at Uber with success. We will also ...",https://i.ytimg.com/vi/Q6-TyrJcYMk/default.jpg,120,90,https://i.ytimg.com/vi/Q6-TyrJcYMk/mqdefault.jpg,320,180,https://i.ytimg.com/vi/Q6-TyrJcYMk/hqdefault.jpg,480,360,Reinforceconf,none,2019-03-25T15:00:08Z
4,youtube#searchResult,BHvn9asbGq_1tQGlU-gp42OvTak,youtube#video,HxUqZSB-LFU,2019-03-25T14:26:06Z,UC2FX7UmiCtIOpWVT7156Gag,Kush Varshney - AI Fairness 360,"Machine learning models are increasingly used to inform high-stakes decisions about people. Although machine learning, by its very nature, is always a form of ...",https://i.ytimg.com/vi/HxUqZSB-LFU/default.jpg,120,90,https://i.ytimg.com/vi/HxUqZSB-LFU/mqdefault.jpg,320,180,https://i.ytimg.com/vi/HxUqZSB-LFU/hqdefault.jpg,480,360,Reinforceconf,none,2019-03-25T14:26:06Z
0,youtube#searchResult,nBMRbbLeZ9U5FLZ_Pm47rvbT9ZU,youtube#video,GQY76ItGtuM,2021-02-13T21:24:18Z,UCVlPeQjsKct9bXoC1Qlp1qA,How to make data science more racially inclusive,"Taking place on Wednesday 10th February 2021, this virtual event highlights the issues and impact of racial biases in AI/ML algorithms and discusses what we ...",https://i.ytimg.com/vi/GQY76ItGtuM/default.jpg,120,90,https://i.ytimg.com/vi/GQY76ItGtuM/mqdefault.jpg,320,180,https://i.ytimg.com/vi/GQY76ItGtuM/hqdefault.jpg,480,360,TVAI Hub,none,2021-02-13T21:24:18Z
1,youtube#searchResult,wLru3Fq4pR3PVwb52r-k7OVITQ0,youtube#video,uWCDoe0V8sc,2021-01-29T12:22:55Z,UCVlPeQjsKct9bXoC1Qlp1qA,Unravelling challenges for AI in healthcare,"A co-branded virtual event between the TVAI Hub and Bayer LifeHub UK, with a keynote speech from Dr Matthew Lungren MD MPH Co-Director, Stanford ...",https://i.ytimg.com/vi/uWCDoe0V8sc/default.jpg,120,90,https://i.ytimg.com/vi/uWCDoe0V8sc/mqdefault.jpg,320,180,https://i.ytimg.com/vi/uWCDoe0V8sc/hqdefault.jpg,480,360,TVAI Hub,none,2021-01-29T12:22:55Z
2,youtube#searchResult,LDZeP0PibUKbiPw7irZegNee2dY,youtube#video,cnqGAq4sDtE,2020-10-09T13:03:31Z,UCVlPeQjsKct9bXoC1Qlp1qA,Data Science: Where do I start?,"With guests speakers Andrew Sivanesan - Data Science Specialist at NATS and president of globeAll, and Ella Cockerell - Business Development Lead, IoT, ...",https://i.ytimg.com/vi/cnqGAq4sDtE/default.jpg,120,90,https://i.ytimg.com/vi/cnqGAq4sDtE/mqdefault.jpg,320,180,https://i.ytimg.com/vi/cnqGAq4sDtE/hqdefault.jpg,480,360,TVAI Hub,none,2020-10-09T13:03:31Z
3,youtube#searchResult,iB1KxS4U7I403jdU4g-12iPpvoU,youtube#video,okpafXYtTR4,2020-07-21T09:21:53Z,UCVlPeQjsKct9bXoC1Qlp1qA,AI in Intellectual Property,The TVAI Hub hosted an online event about AI in Intellectual Property on Wednesday 15th July 2020. Artificial intelligence law and the use of technology within ...,https://i.ytimg.com/vi/okpafXYtTR4/default.jpg,120,90,https://i.ytimg.com/vi/okpafXYtTR4/mqdefault.jpg,320,180,https://i.ytimg.com/vi/okpafXYtTR4/hqdefault.jpg,480,360,TVAI Hub,none,2020-07-21T09:21:53Z
4,youtube#searchResult,MBftFniTDOwCi-RteSuTe0wpIEI,youtube#video,JOXJ0Gn-PcE,2020-06-17T11:45:33Z,UCVlPeQjsKct9bXoC1Qlp1qA,AI in the Knowledge Transfer Network,"The TVAI Hub hosted an online event about AI in the Knowledge Transfer Network on Wednesday 17th June 2020. Dr. Caroline Chibelushi, Knowledge Transfer ...",https://i.ytimg.com/vi/JOXJ0Gn-PcE/default.jpg,120,90,https://i.ytimg.com/vi/JOXJ0Gn-PcE/mqdefault.jpg,320,180,https://i.ytimg.com/vi/JOXJ0Gn-PcE/hqdefault.jpg,480,360,TVAI Hub,none,2020-06-17T11:45:33Z
0,youtube#searchResult,efqCg_fzBT-rZmd8FcRUUTlc8q4,youtube#video,XPFcjCfn9Fc,2021-08-16T15:00:15Z,UCUcpVoi5KkJmnE3bvEhHR0Q,Linear Regression + Decision Trees = Linear Trees,Best of both worlds. My Patreon : https://www.patreon.com/user?u=49277905.,https://i.ytimg.com/vi/XPFcjCfn9Fc/default.jpg,120,90,https://i.ytimg.com/vi/XPFcjCfn9Fc/mqdefault.jpg,320,180,https://i.ytimg.com/vi/XPFcjCfn9Fc/hqdefault.jpg,480,360,ritvikmath,none,2021-08-16T15:00:15Z
1,youtube#searchResult,vBMjnr0tZLEj02XsE_0TOCAqQUA,youtube#video,NBg7YirBTN8,2021-08-02T14:30:04Z,UCUcpVoi5KkJmnE3bvEhHR0Q,Shapley Values : Data Science Concepts,Interpret ANY machine learning model using this awesome method! Partial Dependence Plots : https://www.youtube.com/watch?v=uQQa3wQgG_s My Patreon ...,https://i.ytimg.com/vi/NBg7YirBTN8/default.jpg,120,90,https://i.ytimg.com/vi/NBg7YirBTN8/mqdefault.jpg,320,180,https://i.ytimg.com/vi/NBg7YirBTN8/hqdefault.jpg,480,360,ritvikmath,none,2021-08-02T14:30:04Z
2,youtube#searchResult,JYDo4QGTLCblHpv12ZUlqfewJ18,youtube#video,bjX947ilf7E,2021-07-28T14:30:09Z,UCUcpVoi5KkJmnE3bvEhHR0Q,Capture - Recapture : Data Science Concepts,How do you estimate the size of a population ... the data science way? Link to Code ...,https://i.ytimg.com/vi/bjX947ilf7E/default.jpg,120,90,https://i.ytimg.com/vi/bjX947ilf7E/mqdefault.jpg,320,180,https://i.ytimg.com/vi/bjX947ilf7E/hqdefault.jpg,480,360,ritvikmath,none,2021-07-28T14:30:09Z
3,youtube#searchResult,8I7GmjegXIUu9Yd2FOO2tpWKgaU,youtube#video,Zgwfw3bzSmQ,2021-07-07T14:30:08Z,UCUcpVoi5KkJmnE3bvEhHR0Q,Thompson Sampling : Data Science Concepts,The coolest Multi-Armed Bandit solution! Multi-Armed Bandit Intro : https://www.youtube.com/watch?v=e3L4VocZnnQ Table of Conjugate Priors: ...,https://i.ytimg.com/vi/Zgwfw3bzSmQ/default.jpg,120,90,https://i.ytimg.com/vi/Zgwfw3bzSmQ/mqdefault.jpg,320,180,https://i.ytimg.com/vi/Zgwfw3bzSmQ/hqdefault.jpg,480,360,ritvikmath,none,2021-07-07T14:30:08Z
4,youtube#searchResult,RSAJ9xXrgW5C7vRlrbR8ZvdksP4,youtube#video,d2E-pU4H2gc,2021-06-30T16:00:34Z,UCUcpVoi5KkJmnE3bvEhHR0Q,Coding Word2Vec : Natural Language Processing,Code word2vec with me!! Word2Vec Intro Video : https://www.youtube.com/watch?v=f7o8aDNxf7k Link to Code: ...,https://i.ytimg.com/vi/d2E-pU4H2gc/default.jpg,120,90,https://i.ytimg.com/vi/d2E-pU4H2gc/mqdefault.jpg,320,180,https://i.ytimg.com/vi/d2E-pU4H2gc/hqdefault.jpg,480,360,ritvikmath,none,2021-06-30T16:00:34Z
0,youtube#searchResult,_0OtS041pnPDMPmja2pgHn76TQk,youtube#video,2Wzj9Iu9Ey4,2021-03-03T19:30:18Z,UCjRjkk9nmIqSYwZ1zdxFw_g,Databricks Data Platform: Hadoop ModernizaciÃ³n,Porque migrar de Hadoop hacia Databricks? Te comentamos durante este webinar y Demo.,https://i.ytimg.com/vi/2Wzj9Iu9Ey4/default.jpg,120,90,https://i.ytimg.com/vi/2Wzj9Iu9Ey4/mqdefault.jpg,320,180,https://i.ytimg.com/vi/2Wzj9Iu9Ey4/hqdefault.jpg,480,360,Databricks America Latina,none,2021-03-03T19:30:18Z
1,youtube#searchResult,nWELDY7KddfykuB76r9YGJiKNbA,youtube#video,ewdP1_coRyo,2021-02-09T19:42:42Z,UCjRjkk9nmIqSYwZ1zdxFw_g,Capsula 2 - Lakehouse,Aprende mÃ¡s sobre el nuevo paradigma: Lakehouse.,https://i.ytimg.com/vi/ewdP1_coRyo/default.jpg,120,90,https://i.ytimg.com/vi/ewdP1_coRyo/mqdefault.jpg,320,180,https://i.ytimg.com/vi/ewdP1_coRyo/hqdefault.jpg,480,360,Databricks America Latina,none,2021-02-09T19:42:42Z
2,youtube#searchResult,nnjQpXsUNU3bGMtaHDfDqGcQjqw,youtube#video,t7f18haq_1Y,2020-12-17T17:27:59Z,UCjRjkk9nmIqSYwZ1zdxFw_g,Capsula 1 - Databricks Unified Data Analytics Platform,Aprende mÃ¡s sobre nuestro concepto UDAP.,https://i.ytimg.com/vi/t7f18haq_1Y/default.jpg,120,90,https://i.ytimg.com/vi/t7f18haq_1Y/mqdefault.jpg,320,180,https://i.ytimg.com/vi/t7f18haq_1Y/hqdefault.jpg,480,360,Databricks America Latina,none,2020-12-17T17:27:59Z
3,youtube#searchResult,d-eqB1sfXqsenE8ZN97lowtpZ4k,youtube#video,KFtnR53YlO8,2020-12-01T21:39:20Z,UCjRjkk9nmIqSYwZ1zdxFw_g,Databricks Webinar: Construye una plataforma para minimizar el riesgo,"Agenda: IntroducciÃ³n Plataforma Databricks Ecosistema Databricks: Delta Lake, Spark, ML Flow Demostracion.",https://i.ytimg.com/vi/KFtnR53YlO8/default.jpg,120,90,https://i.ytimg.com/vi/KFtnR53YlO8/mqdefault.jpg,320,180,https://i.ytimg.com/vi/KFtnR53YlO8/hqdefault.jpg,480,360,Databricks America Latina,none,2020-12-01T21:39:20Z
0,youtube#searchResult,XgU6CeK_k-IUPDo7BhEEEmHeyPs,youtube#video,EiSbiQWt5tM,2021-04-22T18:20:14Z,UC3NDbeN0Jq_InNAhiJtvHcQ,ÐÐ´Ð°Ð¿Ñ‚Ð°Ñ†Ð¸Ñ GRASP Ð´Ð»Ñ JavaScript Ð¸ Node.js | Ð’ÐµÐ±Ð¸Ð½Ð°Ñ€ 3 [ru] / Ð¢Ð¸Ð¼ÑƒÑ€ Ð¨ÐµÐ¼ÑÐµÐ´Ð¸Ð½Ð¾Ð²,"Ð’Ð¸Ð´ÐµÐ¾ ""ÐÐ´Ð°Ð¿Ñ‚Ð°Ñ†Ð¸Ñ GRASP Ð´Ð»Ñ JavaScript Ð¸ Node.js"" â€” Ñ‚Ñ€ÐµÑ‚ÑŒÑ Ñ‡Ð°ÑÑ‚ÑŒ Ð¸Ð· Ñ†Ð¸ÐºÐ»Ð° Ð»ÐµÐºÑ†Ð¸Ð¹ Ð¢Ð¸Ð¼ÑƒÑ€Ð° Ð¨ÐµÐ¼ÑÐµÐ´Ð¸Ð½Ð¾Ð²Ð° ""Node.js Stack for Enterprise"", ÐºÐ¾Ñ‚Ð¾Ñ€Ñ‹Ð¹ ÑÐ¾ÑÑ‚Ð¾Ð¸Ñ‚ ...",https://i.ytimg.com/vi/EiSbiQWt5tM/default.jpg,120,90,https://i.ytimg.com/vi/EiSbiQWt5tM/mqdefault.jpg,320,180,https://i.ytimg.com/vi/EiSbiQWt5tM/hqdefault.jpg,480,360,fwdays,none,2021-04-22T18:20:14Z
1,youtube#searchResult,9gys-30R4ANSV5Z8ogt59-LXNh4,youtube#video,GRg4BmV1uYI,2021-04-15T18:38:52Z,UC3NDbeN0Jq_InNAhiJtvHcQ,Ð¡Ñ‚Ñ€Ð°Ñ‚ÐµÐ³Ð¸Ñ Node.js Ð´Ð»Ñ ÐºÐ¾Ñ€Ð¿Ð¾Ñ€Ð°Ñ‚Ð¸Ð²Ð½Ð¾Ð³Ð¾ ÑÐµÐºÑ‚Ð¾Ñ€Ð° | Ð’ÐµÐ±Ð¸Ð½Ð°Ñ€ 2 [ru] / Ð¢Ð¸Ð¼ÑƒÑ€ Ð¨ÐµÐ¼ÑÐµÐ´Ð¸Ð½Ð¾Ð²,"Ð’Ð¸Ð´ÐµÐ¾ ""Ð¡Ñ‚Ñ€Ð°Ñ‚ÐµÐ³Ð¸Ñ Node.js Ð´Ð»Ñ ÐºÐ¾Ñ€Ð¿Ð¾Ñ€Ð°Ñ‚Ð¸Ð²Ð½Ð¾Ð³Ð¾ ÑÐµÐºÑ‚Ð¾Ñ€Ð°"" â€” Ð²Ñ‚Ð¾Ñ€Ð°Ñ Ñ‡Ð°ÑÑ‚ÑŒ Ð¸Ð· Ñ†Ð¸ÐºÐ»Ð° Ð»ÐµÐºÑ†Ð¸Ð¹ Ð¢Ð¸Ð¼ÑƒÑ€Ð° Ð¨ÐµÐ¼ÑÐµÐ´Ð¸Ð½Ð¾Ð²Ð° ""Node.js Stack for Enterprise"", ÐºÐ¾Ñ‚Ð¾Ñ€Ñ‹Ð¹ ...",https://i.ytimg.com/vi/GRg4BmV1uYI/default.jpg,120,90,https://i.ytimg.com/vi/GRg4BmV1uYI/mqdefault.jpg,320,180,https://i.ytimg.com/vi/GRg4BmV1uYI/hqdefault.jpg,480,360,fwdays,none,2021-04-15T18:38:52Z
2,youtube#searchResult,JYbelul4SkdVkTPLJdsuCVo9dQQ,youtube#video,L7Yge5Ph0z4,2021-04-08T18:44:18Z,UC3NDbeN0Jq_InNAhiJtvHcQ,Node.js Ð¾Ñ‚ middleware Ðº ÑÐµÑ€Ð²Ð¸ÑÐ°Ð¼ | Ð’ÐµÐ±Ð¸Ð½Ð°Ñ€ 1 [ru] / Ð¢Ð¸Ð¼ÑƒÑ€ Ð¨ÐµÐ¼ÑÐµÐ´Ð¸Ð½Ð¾Ð²,"Ð’Ð¸Ð´ÐµÐ¾ ""Node.js Ð¾Ñ‚ middleware Ðº ÑÐµÑ€Ð²Ð¸ÑÐ°Ð¼"" â€” Ð¿ÐµÑ€Ð²Ð°Ñ Ñ‡Ð°ÑÑ‚ÑŒ Ð¸Ð· Ñ†Ð¸ÐºÐ»Ð° Ð»ÐµÐºÑ†Ð¸Ð¹ Ð¢Ð¸Ð¼ÑƒÑ€Ð° Ð¨ÐµÐ¼ÑÐµÐ´Ð¸Ð½Ð¾Ð²Ð° ""Node.js Stack for Enterprise"", ÐºÐ¾Ñ‚Ð¾Ñ€Ñ‹Ð¹ ÑÐ¾ÑÑ‚Ð¾Ð¸Ñ‚ Ð¸Ð· 3-Ñ… ...",https://i.ytimg.com/vi/L7Yge5Ph0z4/default.jpg,120,90,https://i.ytimg.com/vi/L7Yge5Ph0z4/mqdefault.jpg,320,180,https://i.ytimg.com/vi/L7Yge5Ph0z4/hqdefault.jpg,480,360,fwdays,none,2021-04-08T18:44:18Z
3,youtube#searchResult,ZC5We4EkMjWKWNW9xxZzmfRsjH4,youtube#video,LGsDerVgzyU,2021-03-31T15:00:14Z,UC3NDbeN0Jq_InNAhiJtvHcQ,Vuetify in practice [ru] / ÐÐ»ÐµÐºÑÐ°Ð½Ð´Ñ€ Ð¡Ñ‚ÐµÐ¿Ð°Ð½Ð¾Ð²,"Ð’Ð¸Ð´ÐµÐ¾ Ñ Ð¾Ð½Ð»Ð°Ð¹Ð½-ÐºÐ¾Ð½Ñ„ÐµÑ€ÐµÐ½Ñ†Ð¸Ð¸ Vue.js fwdays'20, ÐºÐ¾Ñ‚Ð¾Ñ€Ð°Ñ Ð¿Ñ€Ð¾ÑˆÐ»Ð° 26 Ð½Ð¾ÑÐ±Ñ€Ñ 2020 Ð³Ð¾Ð´Ð°. ÐšÐ»ÑŽÑ‡ÐµÐ²Ñ‹Ðµ Ð²Ð¾Ð¿Ñ€Ð¾ÑÑ‹, ÐºÐ¾Ñ‚Ð¾Ñ€Ñ‹Ðµ Ñ€Ð°ÑÑÐ¼Ð°Ñ‚Ñ€Ð¸Ð²Ð°ÑŽÑ‚ÑÑ Ð½Ð° Ð²Ð¾Ñ€ÐºÑˆÐ¾Ð¿Ðµ: ...",https://i.ytimg.com/vi/LGsDerVgzyU/default.jpg,120,90,https://i.ytimg.com/vi/LGsDerVgzyU/mqdefault.jpg,320,180,https://i.ytimg.com/vi/LGsDerVgzyU/hqdefault.jpg,480,360,fwdays,none,2021-03-31T15:00:14Z
4,youtube#searchResult,Zj0H52Wb2RyvKz-CJVw0xiUMPV0,youtube#video,OWJBbm8Zo3w,2021-03-29T15:00:16Z,UC3NDbeN0Jq_InNAhiJtvHcQ,Secure Vue app [ukr] / Ð†Ð²Ð°Ð½ ÐšÐ¸Ð²Ð°Ñ†ÑŒÐºÐ¸Ð¹,"Ð’Ñ–Ð´ÐµÐ¾ Ð· Ð¾Ð½Ð»Ð°Ð¹Ð½-ÐºÐ¾Ð½Ñ„ÐµÑ€ÐµÐ½Ñ†Ñ–Ñ— Vue.js fwdays'20, ÑÐºÐ° Ð¿Ñ€Ð¾Ð¹ÑˆÐ»Ð° 24 Ð»Ð¸ÑÑ‚Ð¾Ð¿Ð°Ð´Ð° 2020 Ñ€Ð¾ÐºÑƒ. ÐžÐ¿Ð¸Ñ Ð´Ð¾Ð¿Ð¾Ð²Ñ–Ð´Ñ–: Ð†Ð²Ð°Ð½ Ñ€Ð¾Ð·Ð¿Ð¾Ð²Ñ–Ð´Ð°Ñ” Ð¿Ñ€Ð¾ Ñ‚Ðµ, ÑÐº Ð¿Ð¾ÐºÑ€Ð°Ñ‰Ð¸Ñ‚Ð¸ Ð±ÐµÐ·Ð¿ÐµÐºÑƒ Ñ‚Ð° ...",https://i.ytimg.com/vi/OWJBbm8Zo3w/default.jpg,120,90,https://i.ytimg.com/vi/OWJBbm8Zo3w/mqdefault.jpg,320,180,https://i.ytimg.com/vi/OWJBbm8Zo3w/hqdefault.jpg,480,360,fwdays,none,2021-03-29T15:00:16Z
0,youtube#searchResult,0jQUX7EGOSk7kzFlHBnGZTk51eQ,youtube#video,dnjm-sx7b8k,2021-03-19T02:14:08Z,UCRF82wX0EPwqvKMBwvB4fQg,import asyncio: Learn Python&#39;s AsyncIO #6 - An Example Web Application with Starlette and EdgeDB,This series of videos introduces AsyncIO to Python programmers who haven't used it yet. This time around we make a Web app from scratch to see how async ...,https://i.ytimg.com/vi/dnjm-sx7b8k/default.jpg,120,90,https://i.ytimg.com/vi/dnjm-sx7b8k/mqdefault.jpg,320,180,https://i.ytimg.com/vi/dnjm-sx7b8k/hqdefault.jpg,480,360,EdgeDB,none,2021-03-19T02:14:08Z
1,youtube#searchResult,H8FsEP-aT03vLPgitPML-7Iw1Ws,youtube#video,SyiTd4rLb2s,2020-08-03T07:00:12Z,UCRF82wX0EPwqvKMBwvB4fQg,import asyncio: Learn Python&#39;s AsyncIO #5 - Batteries Included,"This series of videos introduces AsyncIO to Python programmers who haven't used it yet. Like the Song of Ice and Fire, we're at five released instalments. Yes ...",https://i.ytimg.com/vi/SyiTd4rLb2s/default.jpg,120,90,https://i.ytimg.com/vi/SyiTd4rLb2s/mqdefault.jpg,320,180,https://i.ytimg.com/vi/SyiTd4rLb2s/hqdefault.jpg,480,360,EdgeDB,none,2020-08-03T07:00:12Z
2,youtube#searchResult,j9VD7C04iGeb4dYMbcdNjkKyCsI,youtube#video,1LTHbmed3D4,2020-06-16T04:44:04Z,UCRF82wX0EPwqvKMBwvB4fQg,import asyncio: Learn Python&#39;s AsyncIO #4 - Coroutines Under The Hood,"This series of videos introduces AsyncIO to Python programmers who haven't used it yet. After weeks of silence, Episode IV is like a new hope. Ekhem. I mean ...",https://i.ytimg.com/vi/1LTHbmed3D4/default.jpg,120,90,https://i.ytimg.com/vi/1LTHbmed3D4/mqdefault.jpg,320,180,https://i.ytimg.com/vi/1LTHbmed3D4/hqdefault.jpg,480,360,EdgeDB,none,2020-06-16T04:44:04Z
3,youtube#searchResult,KThxUlk59u5v8DMLAS0CZDtSaS4,youtube#video,-CzqsgaXUM8,2020-05-06T05:42:15Z,UCRF82wX0EPwqvKMBwvB4fQg,import asyncio: Learn Python&#39;s AsyncIO #3 - Using Coroutines,This series of videos introduces AsyncIO to Python programmers who haven't used it yet. The third episode is the long-awaited introduction to async/await.,https://i.ytimg.com/vi/-CzqsgaXUM8/default.jpg,120,90,https://i.ytimg.com/vi/-CzqsgaXUM8/mqdefault.jpg,320,180,https://i.ytimg.com/vi/-CzqsgaXUM8/hqdefault.jpg,480,360,EdgeDB,none,2020-05-06T05:42:15Z
4,youtube#searchResult,9lvyKIRP4et30cbYv8StH1QHszE,youtube#video,E7Yn5biBZ58,2020-04-21T00:21:27Z,UCRF82wX0EPwqvKMBwvB4fQg,import asyncio: Learn Python&#39;s AsyncIO #2 - The Event Loop,This series of videos introduces AsyncIO to Python programmers who haven't used it yet. The second episode is a deep dive exploration of the event loop.,https://i.ytimg.com/vi/E7Yn5biBZ58/default.jpg,120,90,https://i.ytimg.com/vi/E7Yn5biBZ58/mqdefault.jpg,320,180,https://i.ytimg.com/vi/E7Yn5biBZ58/hqdefault.jpg,480,360,EdgeDB,none,2020-04-21T00:21:27Z
0,youtube#searchResult,OezbjbQKqKYW6habuwwrbAhztnI,youtube#video,TBuIODzOqrs,2021-08-27T13:04:10Z,UCeq6ZIlvC9SVsfhfKnSvM9w,ÐÐ½Ñ‚Ð¾Ð½ ÐšÐ¸ÑÐµÐ»ÐµÐ² | Ð”Ð¸Ð½Ð°Ð¼Ð¸Ñ‡ÐµÑÐºÐ¾Ðµ Ñ†ÐµÐ½Ð¾Ð¾Ð±Ñ€Ð°Ð·Ð¾Ð²Ð°Ð½Ð¸Ðµ Ð² Ñ‚Ð¾Ð¿Ð»Ð¸Ð²Ð½Ð¾Ð¼ Ñ€Ð¸Ñ‚ÐµÐ¹Ð»Ðµ,"ML in Marketing track https://ods.ai/tracks/ml-in-marketing-df2021 Ð¢ÐµÐ»ÐµÐ³Ñ€Ð°Ð¼-ÐºÐ°Ð½Ð°Ð» https://t.me/mlinmarketing Ð¡Ð¿Ð¸ÐºÐµÑ€: ÐÐ½Ñ‚Ð¾Ð½ ÐšÐ¸ÑÐµÐ»ÐµÐ², Marketing Analytics ...",https://i.ytimg.com/vi/TBuIODzOqrs/default.jpg,120,90,https://i.ytimg.com/vi/TBuIODzOqrs/mqdefault.jpg,320,180,https://i.ytimg.com/vi/TBuIODzOqrs/hqdefault.jpg,480,360,ODS AI Ru,none,2021-08-27T13:04:10Z
1,youtube#searchResult,idy9AIIYopQldI3TLrdgMay5iwE,youtube#video,p4m_E38ojyc,2021-08-13T11:08:26Z,UCeq6ZIlvC9SVsfhfKnSvM9w,LightAutoML  | ODS Summer of Code 2021,ODS Summer of Code 2021 https://ods.ai/tracks/summer-of-code-2021 LightAutoML Hackathon https://ods.ai/competitions/LAMA-hack-soc2021 ÐŸÑ€Ð¸Ð²ÐµÑ‚ÑÑ‚Ð²ÑƒÐµÐ¼ ...,https://i.ytimg.com/vi/p4m_E38ojyc/default.jpg,120,90,https://i.ytimg.com/vi/p4m_E38ojyc/mqdefault.jpg,320,180,https://i.ytimg.com/vi/p4m_E38ojyc/hqdefault.jpg,480,360,ODS AI Ru,none,2021-08-13T11:08:26Z
2,youtube#searchResult,k3XP8pYJrofR2a_EMQK08oBdb20,youtube#video,81Bvg0t4eZY,2021-08-07T04:33:49Z,UCeq6ZIlvC9SVsfhfKnSvM9w,Ð­ÐºÐ²Ð°Ñ‚Ð¾Ñ€-ÑÑ‚Ñ€Ð¸Ð¼ ODS Summer of Code,Ð›ÐµÑ‚Ð½ÑÑ ÑˆÐºÐ¾Ð»Ð° ODS Summer of Code #1 https://ods.ai/tracks/summer-of-code-2021 Ð—Ð°Ñ€ÐµÐ³Ð¸ÑÑ‚Ñ€Ð¸Ñ€Ð¾Ð²Ð°Ñ‚ÑŒÑÑ Ð¸ Ð¿Ð¾Ð»ÑƒÑ‡Ð¸Ñ‚ÑŒ Ð´Ð¾ÑÑ‚ÑƒÐ¿ Ðº Ð¿Ñ€Ð¾ÐµÐºÑ‚Ð°Ð¼: ...,https://i.ytimg.com/vi/81Bvg0t4eZY/default.jpg,120,90,https://i.ytimg.com/vi/81Bvg0t4eZY/mqdefault.jpg,320,180,https://i.ytimg.com/vi/81Bvg0t4eZY/hqdefault.jpg,480,360,ODS AI Ru,none,2021-08-07T04:33:49Z
3,youtube#searchResult,1BPv6Bzuj-WDI4PdGAStjkFFk0M,youtube#video,nqjJFxI1PtY,2021-07-29T16:00:32Z,UCeq6ZIlvC9SVsfhfKnSvM9w,Ð¢Ð°Ñ‚ÑŒÑÐ½Ð° Ð—Ð¾Ð±Ð½Ð¸Ð½Ð° | ÐÐµÐ¹Ñ€Ð¾Ð½Ð½Ñ‹Ðµ ÑÐµÑ‚Ð¸ Ð² Ð°Ð½Ð°Ð»Ð¸Ð·Ðµ Ð¸ Ð³ÐµÐ½ÐµÑ€Ð°Ñ†Ð¸Ð¸ Ð·Ð²ÑƒÐºÐ°,Data Fest Online 2021 ML Art track https://ods.ai/tracks/ml-art-df2021 ÐŸÐ¾ÑÐ¼Ð¾Ñ‚Ñ€ÐµÑ‚ÑŒ ÑÑ„Ð¸Ñ€ Ð¸ ÑÐ¿Ð¸ÑÐ¾Ðº Ñ‚Ñ€ÐµÐºÐ¾Ð² Ð¸ Ð¾Ñ€Ð³Ð°Ð½Ð¸Ð·Ð°Ñ‚Ð¾Ñ€Ð¾Ð²: https://datafest.ru/2021/ ...,https://i.ytimg.com/vi/nqjJFxI1PtY/default.jpg,120,90,https://i.ytimg.com/vi/nqjJFxI1PtY/mqdefault.jpg,320,180,https://i.ytimg.com/vi/nqjJFxI1PtY/hqdefault.jpg,480,360,ODS AI Ru,none,2021-07-29T16:00:32Z
4,youtube#searchResult,QFhcMfb6bppVLK9Kv_y-D7-2_0Y,youtube#video,NPfYDDbprtw,2021-06-24T15:00:21Z,UCeq6ZIlvC9SVsfhfKnSvM9w,Ð“Ð»ÐµÐ± ÐœÐ¾Ñ€Ð³Ð°Ñ‡Ñ‘Ð² | Text2Bash: ÐºÐ°Ðº Ð¼Ñ‹ ÑƒÑ‡Ð°ÑÑ‚Ð²Ð¾Ð²Ð°Ð»Ð¸ Ð² ÑÐ¾Ñ€ÐµÐ²Ð½Ð¾Ð²Ð°Ð½Ð¸Ð¸ NeurIPS,"Data Fest Online 2021 Code Mining track https://ods.ai/tracks/code-mining-df2021 Ð¡Ð¿Ð¸ÐºÐµÑ€: Ð“Ð»ÐµÐ± ÐœÐ¾Ñ€Ð³Ð°Ñ‡ÐµÐ², Data Scientist @JetBrains Ð’ Ñ€Ð°Ð¼ÐºÐ°Ñ… ÐºÐ¾Ð½Ñ„ÐµÑ€ÐµÐ½Ñ†Ð¸Ð¸ ...",https://i.ytimg.com/vi/NPfYDDbprtw/default.jpg,120,90,https://i.ytimg.com/vi/NPfYDDbprtw/mqdefault.jpg,320,180,https://i.ytimg.com/vi/NPfYDDbprtw/hqdefault.jpg,480,360,ODS AI Ru,none,2021-06-24T15:00:21Z
