,kind,etag,id.kind,id.videoId,snippet.publishedAt,snippet.channelId,snippet.title,snippet.description,snippet.thumbnails.default.url,snippet.thumbnails.default.width,snippet.thumbnails.default.height,snippet.thumbnails.medium.url,snippet.thumbnails.medium.width,snippet.thumbnails.medium.height,snippet.thumbnails.high.url,snippet.thumbnails.high.width,snippet.thumbnails.high.height,snippet.channelTitle,snippet.liveBroadcastContent,snippet.publishTime
0,youtube#searchResult,cA-YnCVG447aL1WkcZNpQL6H7pM,youtube#video,aLEkXKI_R_s,2023-03-21T22:14:49Z,UCOjD18EJYcsBog4IozkF_7w,Thomas Wiecki: The State of the Art for Probabilistic Programming | PyData Global 2022,"Probabilistic Programming as a field is moving at breakneck speed, with innovations being driven on all levels: language, ...",https://i.ytimg.com/vi/aLEkXKI_R_s/default.jpg,120,90,https://i.ytimg.com/vi/aLEkXKI_R_s/mqdefault.jpg,320,180,https://i.ytimg.com/vi/aLEkXKI_R_s/hqdefault.jpg,480,360,PyData,none,2023-03-21T22:14:49Z
1,youtube#searchResult,DX5bqJfevwjiW3KIZXICLhtDd_8,youtube#video,fsdbneHgi58,2023-03-20T17:37:56Z,UCOjD18EJYcsBog4IozkF_7w,Allen Downey: Bayesian Decision Analysis [Tutorial] | PyData Global 2022,"This tutorial is a hands-on introduction to Bayesian Decision Analysis (BDA), which is a framework for using probability to guide ...",https://i.ytimg.com/vi/fsdbneHgi58/default.jpg,120,90,https://i.ytimg.com/vi/fsdbneHgi58/mqdefault.jpg,320,180,https://i.ytimg.com/vi/fsdbneHgi58/hqdefault.jpg,480,360,PyData,none,2023-03-20T17:37:56Z
2,youtube#searchResult,wsKQ28IEKNlHzgNm1l1-oPKY8Wo,youtube#video,7XpZjt8cvgs,2023-01-11T08:08:21Z,UCOjD18EJYcsBog4IozkF_7w,Dimitry Venger - Extreme Value Analysis | PyData Tel Aviv 2022,How do you use data from 15 years of observations to predict the magnitude of a “once in 50 years” storm? How can we build a ...,https://i.ytimg.com/vi/7XpZjt8cvgs/default.jpg,120,90,https://i.ytimg.com/vi/7XpZjt8cvgs/mqdefault.jpg,320,180,https://i.ytimg.com/vi/7XpZjt8cvgs/hqdefault.jpg,480,360,PyData,none,2023-01-11T08:08:21Z
3,youtube#searchResult,Lw7fbrMvJBLr0Q_bEOjIS5qHc6A,youtube#video,wiGkV37Kbxk,2023-01-11T08:06:11Z,UCOjD18EJYcsBog4IozkF_7w,Raymond Hettinger: Numerical Marvels Inside Python - Keynote | PyData Tel Aviv 2022,"Bio: Raymond has been a prolific contributor to the CPython project for over a decade, having implemented and maintained many ...",https://i.ytimg.com/vi/wiGkV37Kbxk/default.jpg,120,90,https://i.ytimg.com/vi/wiGkV37Kbxk/mqdefault.jpg,320,180,https://i.ytimg.com/vi/wiGkV37Kbxk/hqdefault.jpg,480,360,PyData,none,2023-01-11T08:06:11Z
4,youtube#searchResult,2QNDthQj6Wn6jjMhZiIygYSeSDI,youtube#video,2i2nyodhGkk,2023-01-06T18:26:05Z,UCOjD18EJYcsBog4IozkF_7w,Pedro Holanda - DuckDB: Bringing analytical SQL directly to your Python shell,"PyData Eindhoven 2022 In this talk, we will present DuckDB. DuckDB is a novel data management system that executes ...",https://i.ytimg.com/vi/2i2nyodhGkk/default.jpg,120,90,https://i.ytimg.com/vi/2i2nyodhGkk/mqdefault.jpg,320,180,https://i.ytimg.com/vi/2i2nyodhGkk/hqdefault.jpg,480,360,PyData,none,2023-01-06T18:26:05Z
0,youtube#searchResult,kgJUEF59rOIG9L-2HZIBl0OHI0s,youtube#video,i-EHx0WSsBM,2023-04-12T05:04:35Z,UCtWI06j1EADmEOGj2iJhSyA,Lightning Talks (PyCascades 2023),"Speaker: Jim De la Hunt Lightning Talk: Global domain names and email addresses, or, email me at जिम@डाटामेल.",https://i.ytimg.com/vi/i-EHx0WSsBM/default.jpg,120,90,https://i.ytimg.com/vi/i-EHx0WSsBM/mqdefault.jpg,320,180,https://i.ytimg.com/vi/i-EHx0WSsBM/hqdefault.jpg,480,360,PyCascades,none,2023-04-12T05:04:35Z
1,youtube#searchResult,FR_cQ9soz3QWtdQp76YgUp77he8,youtube#video,f7dS4b7xOn4,2023-04-12T04:51:16Z,UCtWI06j1EADmEOGj2iJhSyA,Vulnerability Scanning For Free (as in Puppies) - Terri Oda (PyCascades 2023),"Secure software supply chains with 0 vulnerabilities sounds like a great idea, but once you start looking through entire ...",https://i.ytimg.com/vi/f7dS4b7xOn4/default.jpg,120,90,https://i.ytimg.com/vi/f7dS4b7xOn4/mqdefault.jpg,320,180,https://i.ytimg.com/vi/f7dS4b7xOn4/hqdefault.jpg,480,360,PyCascades,none,2023-04-12T04:51:16Z
2,youtube#searchResult,khXoetrInW4_8jMAaoRq1mGbf20,youtube#video,Rfz5Bm-AG1M,2023-04-12T04:53:07Z,UCtWI06j1EADmEOGj2iJhSyA,Untangle Python Spaghettis - Deep Dive Into Environments [...] - Cheuk Ting Ho (PyCascades 2023),"After learning doing in Python, we started multiple Python or Data Science projects. Dependency management becomes a skill ...",https://i.ytimg.com/vi/Rfz5Bm-AG1M/default.jpg,120,90,https://i.ytimg.com/vi/Rfz5Bm-AG1M/mqdefault.jpg,320,180,https://i.ytimg.com/vi/Rfz5Bm-AG1M/hqdefault.jpg,480,360,PyCascades,none,2023-04-12T04:53:07Z
3,youtube#searchResult,n5numbVYoKlQ16PnmrP6wv7RJTE,youtube#video,Ee4dCiHmOsU,2023-04-12T04:46:56Z,UCtWI06j1EADmEOGj2iJhSyA,Fear the Mutants. Love the Mutants - Max Kahan (PyCascades 2023),"Code coverage is a great metric - how much of your code is actually tested by your unit tests. However, this doesn't tell you how ...",https://i.ytimg.com/vi/Ee4dCiHmOsU/default.jpg,120,90,https://i.ytimg.com/vi/Ee4dCiHmOsU/mqdefault.jpg,320,180,https://i.ytimg.com/vi/Ee4dCiHmOsU/hqdefault.jpg,480,360,PyCascades,none,2023-04-12T04:46:56Z
4,youtube#searchResult,nyap2tlu-oCqN-ONYGl3g-5wklI,youtube#video,kevcz8NRcQU,2023-04-12T04:47:41Z,UCtWI06j1EADmEOGj2iJhSyA,&quot;Sharing is Caring - Sharing pytest Fixtures&quot; by Brian Okken (PyCascades 2023),"pytest rocks, obviously. When people start using pytest as a team, they often come up with cool fixtures that would be great to ...",https://i.ytimg.com/vi/kevcz8NRcQU/default.jpg,120,90,https://i.ytimg.com/vi/kevcz8NRcQU/mqdefault.jpg,320,180,https://i.ytimg.com/vi/kevcz8NRcQU/hqdefault.jpg,480,360,PyCascades,none,2023-04-12T04:47:41Z
0,youtube#searchResult,LEeUlNlNEPCVtjbW2nz7lW6ncVQ,youtube#video,rkw0jZkZA_U,2022-07-05T09:15:29Z,UCTCV2vonJgaQVb8AdMgdvCA,PyDataMCR - July Talks,Talk Details to be announced SPONSORS Thank you to NUMFocus for sponsoring Meetup and further support.,https://i.ytimg.com/vi/rkw0jZkZA_U/default_live.jpg,120,90,https://i.ytimg.com/vi/rkw0jZkZA_U/mqdefault_live.jpg,320,180,https://i.ytimg.com/vi/rkw0jZkZA_U/hqdefault_live.jpg,480,360,PyDataMCR,upcoming,2022-07-05T09:15:29Z
1,youtube#searchResult,V1d_RCtPEFxzFdd5xcOiGDFu46w,youtube#video,w_GQgSqLbxc,2022-06-30T06:48:38Z,UCTCV2vonJgaQVb8AdMgdvCA,PyDataMCR - is back!,"Topics, Classification and Reviews - Shaun Hide - @ShaunHide1 With increasing noise around fake reviews and review skews ...",https://i.ytimg.com/vi/w_GQgSqLbxc/default.jpg,120,90,https://i.ytimg.com/vi/w_GQgSqLbxc/mqdefault.jpg,320,180,https://i.ytimg.com/vi/w_GQgSqLbxc/hqdefault.jpg,480,360,PyDataMCR,none,2022-06-30T06:48:38Z
2,youtube#searchResult,amC_9Hg-rK1eWpGARm_YY5MjmYA,youtube#video,cik-dqUUiaU,2021-10-27T07:07:06Z,UCTCV2vonJgaQVb8AdMgdvCA,Data Horror Stories with Open Data Manchester &amp; Her+DataMcr 2021,"Do you have a tale of bad stats, strange correlations, malicious intent or plain stupidity? Join us and share your Data Horror ...",https://i.ytimg.com/vi/cik-dqUUiaU/default.jpg,120,90,https://i.ytimg.com/vi/cik-dqUUiaU/mqdefault.jpg,320,180,https://i.ytimg.com/vi/cik-dqUUiaU/hqdefault.jpg,480,360,PyDataMCR,none,2021-10-27T07:07:06Z
3,youtube#searchResult,HNVLAVv_rkYhnjCEBuqTfn8DLaY,youtube#video,G7Sm2vzZjZg,2021-08-18T06:21:37Z,UCTCV2vonJgaQVb8AdMgdvCA,Live-Coding - Rain Risk,"""The ship's navigation computer seems to be malfunctioning; rather than giving a route directly to safety, it produced extremely ...",https://i.ytimg.com/vi/G7Sm2vzZjZg/default.jpg,120,90,https://i.ytimg.com/vi/G7Sm2vzZjZg/mqdefault.jpg,320,180,https://i.ytimg.com/vi/G7Sm2vzZjZg/hqdefault.jpg,480,360,PyDataMCR,none,2021-08-18T06:21:37Z
4,youtube#searchResult,1zM2OVs3ZLvXGi_VUP4N2hP-ciM,youtube#video,SvNGA5-wIPs,2021-04-28T06:13:46Z,UCTCV2vonJgaQVb8AdMgdvCA,Data FAQs with the UKDS,Data FAQs Some questions come up again and again in relation to data industries. Questions like: * Should I learn R or Python?,https://i.ytimg.com/vi/SvNGA5-wIPs/default.jpg,120,90,https://i.ytimg.com/vi/SvNGA5-wIPs/mqdefault.jpg,320,180,https://i.ytimg.com/vi/SvNGA5-wIPs/hqdefault.jpg,480,360,PyDataMCR,none,2021-04-28T06:13:46Z
0,youtube#searchResult,LEeUlNlNEPCVtjbW2nz7lW6ncVQ,youtube#video,rkw0jZkZA_U,2022-07-05T09:15:29Z,UCTCV2vonJgaQVb8AdMgdvCA,PyDataMCR - July Talks,Talk Details to be announced SPONSORS Thank you to NUMFocus for sponsoring Meetup and further support.,https://i.ytimg.com/vi/rkw0jZkZA_U/default_live.jpg,120,90,https://i.ytimg.com/vi/rkw0jZkZA_U/mqdefault_live.jpg,320,180,https://i.ytimg.com/vi/rkw0jZkZA_U/hqdefault_live.jpg,480,360,PyDataMCR,upcoming,2022-07-05T09:15:29Z
1,youtube#searchResult,V1d_RCtPEFxzFdd5xcOiGDFu46w,youtube#video,w_GQgSqLbxc,2022-06-30T06:48:38Z,UCTCV2vonJgaQVb8AdMgdvCA,PyDataMCR - is back!,"Topics, Classification and Reviews - Shaun Hide - @ShaunHide1 With increasing noise around fake reviews and review skews ...",https://i.ytimg.com/vi/w_GQgSqLbxc/default.jpg,120,90,https://i.ytimg.com/vi/w_GQgSqLbxc/mqdefault.jpg,320,180,https://i.ytimg.com/vi/w_GQgSqLbxc/hqdefault.jpg,480,360,PyDataMCR,none,2022-06-30T06:48:38Z
2,youtube#searchResult,amC_9Hg-rK1eWpGARm_YY5MjmYA,youtube#video,cik-dqUUiaU,2021-10-27T07:07:06Z,UCTCV2vonJgaQVb8AdMgdvCA,Data Horror Stories with Open Data Manchester &amp; Her+DataMcr 2021,"Do you have a tale of bad stats, strange correlations, malicious intent or plain stupidity? Join us and share your Data Horror ...",https://i.ytimg.com/vi/cik-dqUUiaU/default.jpg,120,90,https://i.ytimg.com/vi/cik-dqUUiaU/mqdefault.jpg,320,180,https://i.ytimg.com/vi/cik-dqUUiaU/hqdefault.jpg,480,360,PyDataMCR,none,2021-10-27T07:07:06Z
3,youtube#searchResult,HNVLAVv_rkYhnjCEBuqTfn8DLaY,youtube#video,G7Sm2vzZjZg,2021-08-18T06:21:37Z,UCTCV2vonJgaQVb8AdMgdvCA,Live-Coding - Rain Risk,"""The ship's navigation computer seems to be malfunctioning; rather than giving a route directly to safety, it produced extremely ...",https://i.ytimg.com/vi/G7Sm2vzZjZg/default.jpg,120,90,https://i.ytimg.com/vi/G7Sm2vzZjZg/mqdefault.jpg,320,180,https://i.ytimg.com/vi/G7Sm2vzZjZg/hqdefault.jpg,480,360,PyDataMCR,none,2021-08-18T06:21:37Z
4,youtube#searchResult,1zM2OVs3ZLvXGi_VUP4N2hP-ciM,youtube#video,SvNGA5-wIPs,2021-04-28T06:13:46Z,UCTCV2vonJgaQVb8AdMgdvCA,Data FAQs with the UKDS,Data FAQs Some questions come up again and again in relation to data industries. Questions like: * Should I learn R or Python?,https://i.ytimg.com/vi/SvNGA5-wIPs/default.jpg,120,90,https://i.ytimg.com/vi/SvNGA5-wIPs/mqdefault.jpg,320,180,https://i.ytimg.com/vi/SvNGA5-wIPs/hqdefault.jpg,480,360,PyDataMCR,none,2021-04-28T06:13:46Z
0,youtube#searchResult,TDKmq-ZnSTQEf2XyUro6sKzkcD8,youtube#video,Nm71G0-wnFU,2024-02-20T02:00:42Z,UC2d_azMgPLw_8JzgbpNb2oQ,PyData Montreal Meetup #24,There is a raw replay of PyData Montreal Meetup #24 with two talks 00:02:15 - 00:49:46 - How we used Python to see how many ...,https://i.ytimg.com/vi/Nm71G0-wnFU/default.jpg,120,90,https://i.ytimg.com/vi/Nm71G0-wnFU/mqdefault.jpg,320,180,https://i.ytimg.com/vi/Nm71G0-wnFU/hqdefault.jpg,480,360,PyData Montreal,none,2024-02-20T02:00:42Z
1,youtube#searchResult,4TEPTDyjH8vN7iv1c-MszBDgcXo,youtube#video,-FFKxz4V9_o,2021-06-29T23:48:14Z,UC2d_azMgPLw_8JzgbpNb2oQ,PyData Montreal #20 with Itamar Turner-Trauring,"Our guest this time is Itamar Turner-Trauring who will present two talks: - ""Small Big Data: using NumPy and Pandas when your ...",https://i.ytimg.com/vi/-FFKxz4V9_o/default.jpg,120,90,https://i.ytimg.com/vi/-FFKxz4V9_o/mqdefault.jpg,320,180,https://i.ytimg.com/vi/-FFKxz4V9_o/hqdefault.jpg,480,360,PyData Montreal,none,2021-06-29T23:48:14Z
2,youtube#searchResult,jD5eSAJfkT99MgQIxRSALxHnkmQ,youtube#video,jNZw_azRlDU,2021-04-22T23:53:51Z,UC2d_azMgPLw_8JzgbpNb2oQ,PyData Montreal #19 with Frederick Reiss and Luciano Resende,"Our speakers this time are: - Frederick Reiss, with a talk ""Text Extensions for Pandas"", and - Luciano Resende with ""Introducing ...",https://i.ytimg.com/vi/jNZw_azRlDU/default.jpg,120,90,https://i.ytimg.com/vi/jNZw_azRlDU/mqdefault.jpg,320,180,https://i.ytimg.com/vi/jNZw_azRlDU/hqdefault.jpg,480,360,PyData Montreal,none,2021-04-22T23:53:51Z
3,youtube#searchResult,CWS40FqH_jJyw7g2GYaVCKwzKdk,youtube#video,NrdJOfYisKI,2021-03-20T00:01:15Z,UC2d_azMgPLw_8JzgbpNb2oQ,PyData Montreal #18: Data Engineering and Data Management,"Our speakers this time are: - Ben Rogojan, with a talk ""The Python ETL: Airflow Vs. Luigi"", and - Sergey Karayev, presenting on ...",https://i.ytimg.com/vi/NrdJOfYisKI/default.jpg,120,90,https://i.ytimg.com/vi/NrdJOfYisKI/mqdefault.jpg,320,180,https://i.ytimg.com/vi/NrdJOfYisKI/hqdefault.jpg,480,360,PyData Montreal,none,2021-03-20T00:01:15Z
4,youtube#searchResult,ogf_jkexZCsazI8mHrvc2l5gVxY,youtube#video,RG-yV5zgqjQ,2021-02-26T01:22:19Z,UC2d_azMgPLw_8JzgbpNb2oQ,PyData Montreal #17: Online meetup on NLP,"Our guests this time are: - Sylvain Gugger, a Research Engineer at Hugging Face and one of the core maintainers of the ...",https://i.ytimg.com/vi/RG-yV5zgqjQ/default.jpg,120,90,https://i.ytimg.com/vi/RG-yV5zgqjQ/mqdefault.jpg,320,180,https://i.ytimg.com/vi/RG-yV5zgqjQ/hqdefault.jpg,480,360,PyData Montreal,none,2021-02-26T01:22:19Z
0,youtube#searchResult,ZF6Aj2JSnssiTwCpw--9jYvgMzc,youtube#video,9nOhWmxOBI8,2024-02-06T15:05:58Z,UCP7jMXSY2xbc3KCAE0MHQ-A,Using AI to help blind and partially-sighted people perceive the world,"Audio Description Version: https://youtu.be/qNmE0loz0Mc Meet Lookout, an app by Google to help blind and low-vision ...",https://i.ytimg.com/vi/9nOhWmxOBI8/default.jpg,120,90,https://i.ytimg.com/vi/9nOhWmxOBI8/mqdefault.jpg,320,180,https://i.ytimg.com/vi/9nOhWmxOBI8/hqdefault.jpg,480,360,Google DeepMind,none,2024-02-06T15:05:58Z
1,youtube#searchResult,EXld9YINtG9g1YrCm4hfIKBO0lg,youtube#video,qNmE0loz0Mc,2024-02-06T15:04:43Z,UCP7jMXSY2xbc3KCAE0MHQ-A,[AUDIO DESCRIBED] Using AI to help blind and partially-sighted people perceive the world,"Watch the original version here: https://youtu.be/9nOhWmxOBI8 Meet Lookout, an app by Google to help blind and low-vision ...",https://i.ytimg.com/vi/qNmE0loz0Mc/default.jpg,120,90,https://i.ytimg.com/vi/qNmE0loz0Mc/mqdefault.jpg,320,180,https://i.ytimg.com/vi/qNmE0loz0Mc/hqdefault.jpg,480,360,Google DeepMind,none,2024-02-06T15:04:43Z
2,youtube#searchResult,Lwz8vy3RiD993zXU_NwPpRrFKas,youtube#video,-KFO0pES-zQ,2023-12-21T17:06:58Z,UCP7jMXSY2xbc3KCAE0MHQ-A,Why AI Creates Better Weather Forecasts,Weather forecasts have historically relied on physics-based simulations powered by the world's largest supercomputers.,https://i.ytimg.com/vi/-KFO0pES-zQ/default.jpg,120,90,https://i.ytimg.com/vi/-KFO0pES-zQ/mqdefault.jpg,320,180,https://i.ytimg.com/vi/-KFO0pES-zQ/hqdefault.jpg,480,360,Google DeepMind,none,2023-12-21T17:06:58Z
3,youtube#searchResult,Luhn8Tjridr3rvN8GirqIN_Y_Vc,youtube#video,zIyaO0YMfbE,2023-11-21T11:10:58Z,UCP7jMXSY2xbc3KCAE0MHQ-A,Building the tools to make AI breakthroughs possible | Inside Google DeepMind - Anna’s story,"We live in an exciting time when AI research and technology are delivering extraordinary advances. In the coming years, AI — and ...",https://i.ytimg.com/vi/zIyaO0YMfbE/default.jpg,120,90,https://i.ytimg.com/vi/zIyaO0YMfbE/mqdefault.jpg,320,180,https://i.ytimg.com/vi/zIyaO0YMfbE/hqdefault.jpg,480,360,Google DeepMind,none,2023-11-21T11:10:58Z
4,youtube#searchResult,8dQ7l84m2hMjM7SNBaQRNQ7uH_U,youtube#video,nPmpzQgiLWY,2023-11-21T11:11:06Z,UCP7jMXSY2xbc3KCAE0MHQ-A,Making the connections to advance AI | Inside Google DeepMind - Annette’s story,"We live in an exciting time when AI research and technology are delivering extraordinary advances. In the coming years, AI — and ...",https://i.ytimg.com/vi/nPmpzQgiLWY/default.jpg,120,90,https://i.ytimg.com/vi/nPmpzQgiLWY/mqdefault.jpg,320,180,https://i.ytimg.com/vi/nPmpzQgiLWY/hqdefault.jpg,480,360,Google DeepMind,none,2023-11-21T11:11:06Z
0,youtube#searchResult,qIQpC0K76dhsw69nV58pkC0Nh9E,youtube#video,1xlABlYnxSQ,2024-03-07T18:45:22Z,UCj09XsAWj-RF9kY4UvBJh_A,AI meetup (3/6/2024) - San Francisco,Tech Talk: Open-source LLM optimized for building purpose-trained models Speaker: Lucy Park (Upstage) Tech Talk: Building an ...,https://i.ytimg.com/vi/1xlABlYnxSQ/default.jpg,120,90,https://i.ytimg.com/vi/1xlABlYnxSQ/mqdefault.jpg,320,180,https://i.ytimg.com/vi/1xlABlYnxSQ/hqdefault.jpg,480,360,AICamp,none,2024-03-07T18:45:22Z
1,youtube#searchResult,k2Zgsa9MyUlp-TIubyhvJD_RN0c,youtube#video,8JvwVomQtqE,2024-02-21T23:25:47Z,UCj09XsAWj-RF9kY4UvBJh_A,AI meetup (2/20/2024) - San Francisco,Tech Talk: The challenges of making vector search billion-scale Speaker: Kacper Łukawski (Qdrant) Tech Talk: Improving the ...,https://i.ytimg.com/vi/8JvwVomQtqE/default.jpg,120,90,https://i.ytimg.com/vi/8JvwVomQtqE/mqdefault.jpg,320,180,https://i.ytimg.com/vi/8JvwVomQtqE/hqdefault.jpg,480,360,AICamp,none,2024-02-21T23:25:47Z
2,youtube#searchResult,bfHLdEwhjQlJJZcuY5EURqS6M3M,youtube#video,Md6262yIW3I,2023-12-20T03:31:12Z,UCj09XsAWj-RF9kY4UvBJh_A,AI EOY Meetup 2023 - Dallas,Tech Talk 1: AI-Powered Data Exploration: Beyond SQL Expertise Speaker: Abdullah Al Hamoud @PMG Tech Talk 2: The Future ...,https://i.ytimg.com/vi/Md6262yIW3I/default.jpg,120,90,https://i.ytimg.com/vi/Md6262yIW3I/mqdefault.jpg,320,180,https://i.ytimg.com/vi/Md6262yIW3I/hqdefault.jpg,480,360,AICamp,none,2023-12-20T03:31:12Z
3,youtube#searchResult,16y-iT9Av70OVE80Dw24gx4_Sds,youtube#video,4-idBODa_qU,2023-10-18T05:18:25Z,UCj09XsAWj-RF9kY4UvBJh_A,AI Workshop (Virtual): Building Generative AI workflows,Speaker/Instructor: Andrew Hoh @LastMile AI Outline: Embrace the power of Generative AI and learn how to build Gen AI ...,https://i.ytimg.com/vi/4-idBODa_qU/default.jpg,120,90,https://i.ytimg.com/vi/4-idBODa_qU/mqdefault.jpg,320,180,https://i.ytimg.com/vi/4-idBODa_qU/hqdefault.jpg,480,360,AICamp,none,2023-10-18T05:18:25Z
4,youtube#searchResult,eMlSSiS6f3NQgK6rQWOEyf2oXzk,youtube#video,NbEVPUlIKOA,2023-09-25T20:01:07Z,UCj09XsAWj-RF9kY4UvBJh_A,AI-driven Language Processing with Vector Search,Tech Talk: AI-driven language processing with Vector Search and Apache Cassandra Speaker: Erick Ramirez @Datastax ...,https://i.ytimg.com/vi/NbEVPUlIKOA/default.jpg,120,90,https://i.ytimg.com/vi/NbEVPUlIKOA/mqdefault.jpg,320,180,https://i.ytimg.com/vi/NbEVPUlIKOA/hqdefault.jpg,480,360,AICamp,none,2023-09-25T20:01:07Z
0,youtube#searchResult,rVKYyCSQzBrh-8tWP0c3Qff4PYg,youtube#video,_KNKXnRwy78,2023-10-27T20:17:39Z,UCuGC1JusVvbOGa__qMtH3QA,"Translating Electronic Documents: A Low-Resource Story, with John Ortega","Translating Electronic Documents: A Low-Resource Story, presented by John Ortega to an online meetup audience, October 25, ...",https://i.ytimg.com/vi/_KNKXnRwy78/default.jpg,120,90,https://i.ytimg.com/vi/_KNKXnRwy78/mqdefault.jpg,320,180,https://i.ytimg.com/vi/_KNKXnRwy78/hqdefault.jpg,480,360,Natural Language Processing presentations,none,2023-10-27T20:17:39Z
1,youtube#searchResult,5-78z79w6tLNG33ADNqgpA2o510,youtube#video,veFYp_WPcxU,2023-04-20T00:20:13Z,UCuGC1JusVvbOGa__qMtH3QA,NLP Technology for Enterprise Legal ApplicationsUntitled,"Emad Elwany from Lexion.ai presents NLP Technology for Enterprise Legal Applications in an online meetup program, April 19, ...",https://i.ytimg.com/vi/veFYp_WPcxU/default.jpg,120,90,https://i.ytimg.com/vi/veFYp_WPcxU/mqdefault.jpg,320,180,https://i.ytimg.com/vi/veFYp_WPcxU/hqdefault.jpg,480,360,Natural Language Processing presentations,none,2023-04-20T00:20:13Z
2,youtube#searchResult,NFuoajaWq_QuAl8oH78Rtz-XfSA,youtube#video,ocNgZ6eDG3A,2023-03-28T21:43:44Z,UCuGC1JusVvbOGa__qMtH3QA,Training New Multilingual Foundation Models for Search &amp; Classification,"Nils Reimers, who is director of machine learning at cohere.ai, presents online on March 28, 2023 on Training New Multilingual ...",https://i.ytimg.com/vi/ocNgZ6eDG3A/default.jpg,120,90,https://i.ytimg.com/vi/ocNgZ6eDG3A/mqdefault.jpg,320,180,https://i.ytimg.com/vi/ocNgZ6eDG3A/hqdefault.jpg,480,360,Natural Language Processing presentations,none,2023-03-28T21:43:44Z
3,youtube#searchResult,hiObqv5hXYgf1-G0gGtD4shsnX0,youtube#video,hscJK-4kA_A,2023-03-15T20:35:05Z,UCuGC1JusVvbOGa__qMtH3QA,Automated Speech Recognition with Spark NLP,David Cecchini from John Snow Labs presents Automated Speech Recognition with Spark NLP to an online natural language ...,https://i.ytimg.com/vi/hscJK-4kA_A/default.jpg,120,90,https://i.ytimg.com/vi/hscJK-4kA_A/mqdefault.jpg,320,180,https://i.ytimg.com/vi/hscJK-4kA_A/hqdefault.jpg,480,360,Natural Language Processing presentations,none,2023-03-15T20:35:05Z
4,youtube#searchResult,ls5KzeYypzwXgY149J7FpBhV_dg,youtube#video,9JNXgF7K2x0,2023-02-23T20:31:31Z,UCuGC1JusVvbOGa__qMtH3QA,"Why and How to Build a Distributed Search Engine, with Stan Srednyak",Stan Srednyak presents Why and How to Build a Distributed Search Engine to an online natural language processing (NLP) ...,https://i.ytimg.com/vi/9JNXgF7K2x0/default.jpg,120,90,https://i.ytimg.com/vi/9JNXgF7K2x0/mqdefault.jpg,320,180,https://i.ytimg.com/vi/9JNXgF7K2x0/hqdefault.jpg,480,360,Natural Language Processing presentations,none,2023-02-23T20:31:31Z
0,youtube#searchResult,TmM_fyd74Cjecs9GCB-eorHKvpw,youtube#video,yxv3l17WmR4,2024-03-18T16:00:48Z,UCBp3w4DCEC64FZr4k9ROxig,How Salesforce Leverages AI for System Health Monitoring,"Dive into the transformative world of business AI with Clara Shih, CEO of Salesforce AI and Founder of Hearsay Systems, in this ...",https://i.ytimg.com/vi/yxv3l17WmR4/default.jpg,120,90,https://i.ytimg.com/vi/yxv3l17WmR4/mqdefault.jpg,320,180,https://i.ytimg.com/vi/yxv3l17WmR4/hqdefault.jpg,480,360,Weights & Biases,none,2024-03-18T16:00:48Z
1,youtube#searchResult,FZrFNBAvoWgef6YRv1Q8jyxClHk,youtube#video,1cLCFgKX8zg,2024-03-15T16:00:01Z,UCBp3w4DCEC64FZr4k9ROxig,Is LLM Fine-tuning Here to Stay?,"In the latest episode of Gradient Dissent, join us as we explore the nuances of AI fine-tuning with Clara Shih, CEO of Salesforce AI ...",https://i.ytimg.com/vi/1cLCFgKX8zg/default.jpg,120,90,https://i.ytimg.com/vi/1cLCFgKX8zg/mqdefault.jpg,320,180,https://i.ytimg.com/vi/1cLCFgKX8zg/hqdefault.jpg,480,360,Weights & Biases,none,2024-03-15T16:00:01Z
2,youtube#searchResult,FJD2cWGmopUogyorlfTKkt4PqPk,youtube#video,_2iaqgEXdOQ,2024-03-04T17:00:32Z,UCBp3w4DCEC64FZr4k9ROxig,Augmenting Not Replacing: The Future of AI in Healthcare,"Join us for a compelling conversation with John Halamka, President of the Mayo Clinic, and dive deep into the intricate dynamics ...",https://i.ytimg.com/vi/_2iaqgEXdOQ/default.jpg,120,90,https://i.ytimg.com/vi/_2iaqgEXdOQ/mqdefault.jpg,320,180,https://i.ytimg.com/vi/_2iaqgEXdOQ/hqdefault.jpg,480,360,Weights & Biases,none,2024-03-04T17:00:32Z
3,youtube#searchResult,myShKlfrmaRV4kutZnMDjOhRO1c,youtube#video,fjs0JYSdgF4,2024-02-29T22:00:17Z,UCBp3w4DCEC64FZr4k9ROxig,Building Reliable AI in Healthcare,"Join us on a thought-provoking episode with John Halamka, President of the Mayo Clinic. We delve into the pressing issues ...",https://i.ytimg.com/vi/fjs0JYSdgF4/default.jpg,120,90,https://i.ytimg.com/vi/fjs0JYSdgF4/mqdefault.jpg,320,180,https://i.ytimg.com/vi/fjs0JYSdgF4/hqdefault.jpg,480,360,Weights & Biases,none,2024-02-29T22:00:17Z
4,youtube#searchResult,T8yqeTCnSiQkgCs6ZrPGXPNB9A4,youtube#video,c9yN8Rtx3pM,2024-02-20T17:00:33Z,UCBp3w4DCEC64FZr4k9ROxig,Simulated Steps to Real-World Leaps,"Welcome to the forefront of technological evolution! In this captivating short, we delve into the realm of reinforcement learning, ...",https://i.ytimg.com/vi/c9yN8Rtx3pM/default.jpg,120,90,https://i.ytimg.com/vi/c9yN8Rtx3pM/mqdefault.jpg,320,180,https://i.ytimg.com/vi/c9yN8Rtx3pM/hqdefault.jpg,480,360,Weights & Biases,none,2024-02-20T17:00:33Z
0,youtube#searchResult,5rIzH0XXPi4TLoA813md8HrGn7Q,youtube#video,9c9KdJ-5JG4,2024-02-08T09:58:37Z,UCpwC9QC0lWaEJ85MoMRFvrA,Yuxiong Wang | Bridging Generative &amp; Discriminative Learning in the Open World,Sponsored by Evolution AI: https://www.evolution.ai Abstract: Generative AI has emerged as the new wave following ...,https://i.ytimg.com/vi/9c9KdJ-5JG4/default.jpg,120,90,https://i.ytimg.com/vi/9c9KdJ-5JG4/mqdefault.jpg,320,180,https://i.ytimg.com/vi/9c9KdJ-5JG4/hqdefault.jpg,480,360,London Machine Learning Meetup,none,2024-02-08T09:58:37Z
1,youtube#searchResult,LvJW1wIkyIdPj_FUmA03padLK48,youtube#video,THYrjDuJ7GI,2024-01-11T15:42:13Z,UCpwC9QC0lWaEJ85MoMRFvrA,Brenden M. Lake | Addressing Two Classic Debates in Cognitive Science with Deep Learning,Sponsored by Evolution AI: https://www.evolution.ai Abstract: How can advances in machine learning best advance our ...,https://i.ytimg.com/vi/THYrjDuJ7GI/default.jpg,120,90,https://i.ytimg.com/vi/THYrjDuJ7GI/mqdefault.jpg,320,180,https://i.ytimg.com/vi/THYrjDuJ7GI/hqdefault.jpg,480,360,London Machine Learning Meetup,none,2024-01-11T15:42:13Z
2,youtube#searchResult,D8FCvl4KsDSjRWmB4A8kDMglXTc,youtube#video,eXPhvQgAT_I,2023-12-08T10:12:18Z,UCpwC9QC0lWaEJ85MoMRFvrA,Yuandong Tian | Efficient Inference of LLMs with Long Context Support,Sponsored by Evolution AI: https://www.evolution.ai Abstract: While Large Language Models (LLMs) demonstrate impressive ...,https://i.ytimg.com/vi/eXPhvQgAT_I/default.jpg,120,90,https://i.ytimg.com/vi/eXPhvQgAT_I/mqdefault.jpg,320,180,https://i.ytimg.com/vi/eXPhvQgAT_I/hqdefault.jpg,480,360,London Machine Learning Meetup,none,2023-12-08T10:12:18Z
3,youtube#searchResult,l1ZDupXw6T8DWVUFJi6gT7cBH70,youtube#video,_mhMi-7ONWQ,2023-11-27T11:02:58Z,UCpwC9QC0lWaEJ85MoMRFvrA,Baptiste Rozière | Code Llama: Open Foundation Models for Code,"Sponsored by Evolution AI: https://www.evolution.ai Abstract: We release Code Llama, a family of large language models for code ...",https://i.ytimg.com/vi/_mhMi-7ONWQ/default.jpg,120,90,https://i.ytimg.com/vi/_mhMi-7ONWQ/mqdefault.jpg,320,180,https://i.ytimg.com/vi/_mhMi-7ONWQ/hqdefault.jpg,480,360,London Machine Learning Meetup,none,2023-11-27T11:02:58Z
