,kind,etag,id.kind,id.videoId,snippet.publishedAt,snippet.channelId,snippet.title,snippet.description,snippet.thumbnails.default.url,snippet.thumbnails.default.width,snippet.thumbnails.default.height,snippet.thumbnails.medium.url,snippet.thumbnails.medium.width,snippet.thumbnails.medium.height,snippet.thumbnails.high.url,snippet.thumbnails.high.width,snippet.thumbnails.high.height,snippet.channelTitle,snippet.liveBroadcastContent,snippet.publishTime
3,youtube#searchResult,V_akDL6kSkJkYNfQIG0MFT4xm5k,youtube#video,9K1I7Tmwk-s,2023-10-18T11:38:45Z,UCYuxbq0trkgoaoN72eJi8dA,Join us for the DATA festival #online in November 2023!,DATA.PEOPLE.EVERYWHERE. Be a part of #DATAfestivalonline - all info & free tickets here: https://data-festival.com/,https://i.ytimg.com/vi/9K1I7Tmwk-s/default.jpg,120,90,https://i.ytimg.com/vi/9K1I7Tmwk-s/mqdefault.jpg,320,180,https://i.ytimg.com/vi/9K1I7Tmwk-s/hqdefault.jpg,480,360,DATA festival,none,2023-10-18T11:38:45Z
4,youtube#searchResult,PRom2c3I5UhSaXZuScgHL9yovgo,youtube#video,O5J1d9p2VG0,2023-06-16T13:04:39Z,UCYuxbq0trkgoaoN72eJi8dA,DATA festival #Munich 2023 - Aftermovie,Join us on November 14th - 15th 2023 for #DATAfestivalonline! Get your free ticket here: ...,https://i.ytimg.com/vi/O5J1d9p2VG0/default.jpg,120,90,https://i.ytimg.com/vi/O5J1d9p2VG0/mqdefault.jpg,320,180,https://i.ytimg.com/vi/O5J1d9p2VG0/hqdefault.jpg,480,360,DATA festival,none,2023-06-16T13:04:39Z
0,youtube#searchResult,msdVJuopvxLh4ipr23j0i5Pc8mI,youtube#video,Vfnv1_bBqNg,2024-05-29T18:00:17Z,UCKPyg5gsnt6h0aA8EBw3i6A,SHAP Values: An Overview,Subscribe to RichardOnData here: https://www.youtube.com/channel/UCKPyg5gsnt6h0aA8EBw3i6A?sub_confirmation=1 In this ...,https://i.ytimg.com/vi/Vfnv1_bBqNg/default.jpg,120,90,https://i.ytimg.com/vi/Vfnv1_bBqNg/mqdefault.jpg,320,180,https://i.ytimg.com/vi/Vfnv1_bBqNg/hqdefault.jpg,480,360,RichardOnData,none,2024-05-29T18:00:17Z
1,youtube#searchResult,BJI86jMHAVNFvO6QVORLaJV1VgU,youtube#video,nsHHcBoRTrI,2024-05-15T16:00:42Z,UCKPyg5gsnt6h0aA8EBw3i6A,Is ChatGPT-4 Worth It?,Subscribe to RichardOnData here: https://www.youtube.com/channel/UCKPyg5gsnt6h0aA8EBw3i6A?sub_confirmation=1 NOTE: ...,https://i.ytimg.com/vi/nsHHcBoRTrI/default.jpg,120,90,https://i.ytimg.com/vi/nsHHcBoRTrI/mqdefault.jpg,320,180,https://i.ytimg.com/vi/nsHHcBoRTrI/hqdefault.jpg,480,360,RichardOnData,none,2024-05-15T16:00:42Z
2,youtube#searchResult,jWA1unJkzw25aCU5VFlXrpQoWk4,youtube#video,Shl1XsvnbHg,2024-03-18T15:30:09Z,UCKPyg5gsnt6h0aA8EBw3i6A,Follow THESE 5 Tips to Get a Data Job,Subscribe to RichardOnData here: https://www.youtube.com/channel/UCKPyg5gsnt6h0aA8EBw3i6A?sub_confirmation=1 In this ...,https://i.ytimg.com/vi/Shl1XsvnbHg/default.jpg,120,90,https://i.ytimg.com/vi/Shl1XsvnbHg/mqdefault.jpg,320,180,https://i.ytimg.com/vi/Shl1XsvnbHg/hqdefault.jpg,480,360,RichardOnData,none,2024-03-18T15:30:09Z
3,youtube#searchResult,kJiBlWcY0Tx-Zl5ktUb5ajV1b2Y,youtube#video,EW3FkQMTdKM,2024-03-10T17:00:09Z,UCKPyg5gsnt6h0aA8EBw3i6A,Learn (and Do) Data Science FAST with ChatGPT,Subscribe to RichardOnData here: https://www.youtube.com/channel/UCKPyg5gsnt6h0aA8EBw3i6A?sub_confirmation=1 In this ...,https://i.ytimg.com/vi/EW3FkQMTdKM/default.jpg,120,90,https://i.ytimg.com/vi/EW3FkQMTdKM/mqdefault.jpg,320,180,https://i.ytimg.com/vi/EW3FkQMTdKM/hqdefault.jpg,480,360,RichardOnData,none,2024-03-10T17:00:09Z
4,youtube#searchResult,r0emC2R-PzqvHZ9egrHL48Or3ME,youtube#video,vLYP5oTDssg,2024-02-21T19:00:22Z,UCKPyg5gsnt6h0aA8EBw3i6A,The Data Job Market in 2024,Subscribe to RichardOnData here: https://www.youtube.com/channel/UCKPyg5gsnt6h0aA8EBw3i6A?sub_confirmation=1 My ...,https://i.ytimg.com/vi/vLYP5oTDssg/default.jpg,120,90,https://i.ytimg.com/vi/vLYP5oTDssg/mqdefault.jpg,320,180,https://i.ytimg.com/vi/vLYP5oTDssg/hqdefault.jpg,480,360,RichardOnData,none,2024-02-21T19:00:22Z
0,youtube#searchResult,LBXzFNQ6KM7yNxza9tzBs1QNIdA,youtube#video,MYKYksteNMM,2023-05-03T22:25:36Z,UCvwDejnW-Q49xEb667JqS-g,Mar 2023 - Supercharge your Python Dev Environment with VS Code &amp; XGBoost Wage Prediction Model,"Philly Python Users' Group + DataPhilly collaboration in-person event on Wharton's campus (Philadelphia, PA) on Mar 30, 2023.",https://i.ytimg.com/vi/MYKYksteNMM/default.jpg,120,90,https://i.ytimg.com/vi/MYKYksteNMM/mqdefault.jpg,320,180,https://i.ytimg.com/vi/MYKYksteNMM/hqdefault.jpg,480,360,DataPhilly,none,2023-05-03T22:25:36Z
1,youtube#searchResult,0JGT1ibrwGYAyDl6bNBt7BWzPrI,youtube#video,8y1p6uBHWVs,2022-10-17T00:51:38Z,UCvwDejnW-Q49xEb667JqS-g,Aug 2022  - Lighting Talks - Using Data Science in the Real World,This is a video of the second half of the event only. Lighting Talk #2 Abstract: The last two Canadian federal elections have ...,https://i.ytimg.com/vi/8y1p6uBHWVs/default.jpg,120,90,https://i.ytimg.com/vi/8y1p6uBHWVs/mqdefault.jpg,320,180,https://i.ytimg.com/vi/8y1p6uBHWVs/hqdefault.jpg,480,360,DataPhilly,none,2022-10-17T00:51:38Z
2,youtube#searchResult,uPh2TwV0rh7q7GCkZj_0bd1BOVc,youtube#video,UixN0WmRaEg,2022-06-09T20:58:47Z,UCvwDejnW-Q49xEb667JqS-g,May 2022 - Linux Deep Dive for Data Science,"Speaker Session 1: In the world of data, there are a wide variety of tools for processing, managing, and analyzing data.",https://i.ytimg.com/vi/UixN0WmRaEg/default.jpg,120,90,https://i.ytimg.com/vi/UixN0WmRaEg/mqdefault.jpg,320,180,https://i.ytimg.com/vi/UixN0WmRaEg/hqdefault.jpg,480,360,DataPhilly,none,2022-06-09T20:58:47Z
3,youtube#searchResult,UqzVdWLrXqf1UF8dGBbJMhtnkcI,youtube#video,dSslgMZEhas,2022-04-25T22:03:00Z,UCvwDejnW-Q49xEb667JqS-g,April 2022 - Live LinkedIn Profile Reviews &amp; Job Search Strategies,"DataPhilly Speaker Event - Apr 21, 2022 Topic: Live LinkedIn Profile Reviews & Job Search Strategies Speaker: Lynne Williams Is ...",https://i.ytimg.com/vi/dSslgMZEhas/default.jpg,120,90,https://i.ytimg.com/vi/dSslgMZEhas/mqdefault.jpg,320,180,https://i.ytimg.com/vi/dSslgMZEhas/hqdefault.jpg,480,360,DataPhilly,none,2022-04-25T22:03:00Z
4,youtube#searchResult,sQLpEddRAOeFN-nwBO8hRSdZ39U,youtube#video,D3vbH9klbTk,2022-01-03T02:59:02Z,UCvwDejnW-Q49xEb667JqS-g,Introducing Unstructured Data into your Models,"DataPhilly Speaker Event - Dec 16, 2021 Topic: Introducing Unstructured Data into your Models - Extracting predictive info/signals ...",https://i.ytimg.com/vi/D3vbH9klbTk/default.jpg,120,90,https://i.ytimg.com/vi/D3vbH9klbTk/mqdefault.jpg,320,180,https://i.ytimg.com/vi/D3vbH9klbTk/hqdefault.jpg,480,360,DataPhilly,none,2022-01-03T02:59:02Z
0,youtube#searchResult,JIDG-XWI1Ir18Wo_oit9iJOs9vo,youtube#video,xobS_i0RbEA,2024-05-31T05:36:16Z,UCipPccqvcfychKNOaYUokyQ,MLSS 2024_Arthur Gretton (Causal effect estimation),"Date: Monday, March 4, 2024 (All day) to Friday, March 15, 2024 (All day) Location: OIST Conference Center, The Okinawa ...",https://i.ytimg.com/vi/xobS_i0RbEA/default.jpg,120,90,https://i.ytimg.com/vi/xobS_i0RbEA/mqdefault.jpg,320,180,https://i.ytimg.com/vi/xobS_i0RbEA/hqdefault.jpg,480,360,RIKEN AIP,none,2024-05-31T05:36:16Z
1,youtube#searchResult,8BVvAg3iHSQpDfTjBt1eAi82zXo,youtube#video,PEu9nfyFrEk,2024-05-31T05:32:07Z,UCipPccqvcfychKNOaYUokyQ,MLSS 2024_Masashi Sugiyama (Weakly Supervised Learning),"Date: Monday, March 4, 2024 (All day) to Friday, March 15, 2024 (All day) Location: OIST Conference Center, The Okinawa ...",https://i.ytimg.com/vi/PEu9nfyFrEk/default.jpg,120,90,https://i.ytimg.com/vi/PEu9nfyFrEk/mqdefault.jpg,320,180,https://i.ytimg.com/vi/PEu9nfyFrEk/hqdefault.jpg,480,360,RIKEN AIP,none,2024-05-31T05:32:07Z
2,youtube#searchResult,BlwCaNUrwoweFfHFO94KXD8KxkY,youtube#video,yI2CflRQ2PY,2024-05-31T05:31:35Z,UCipPccqvcfychKNOaYUokyQ,MLSS 2024_Ryoma Sato (GNN),"Date: Monday, March 4, 2024 (All day) to Friday, March 15, 2024 (All day) Location: OIST Conference Center, The Okinawa ...",https://i.ytimg.com/vi/yI2CflRQ2PY/default.jpg,120,90,https://i.ytimg.com/vi/yI2CflRQ2PY/mqdefault.jpg,320,180,https://i.ytimg.com/vi/yI2CflRQ2PY/hqdefault.jpg,480,360,RIKEN AIP,none,2024-05-31T05:31:35Z
3,youtube#searchResult,tVCOcKmrm8lQNt55p7Bm441hhTo,youtube#video,NMc1J1YHvcM,2024-05-31T05:23:24Z,UCipPccqvcfychKNOaYUokyQ,MLSS 2024_Pierre Alquier (PAC-Bayes),"Date: Monday, March 4, 2024 (All day) to Friday, March 15, 2024 (All day) Location: OIST Conference Center, The Okinawa ...",https://i.ytimg.com/vi/NMc1J1YHvcM/default.jpg,120,90,https://i.ytimg.com/vi/NMc1J1YHvcM/mqdefault.jpg,320,180,https://i.ytimg.com/vi/NMc1J1YHvcM/hqdefault.jpg,480,360,RIKEN AIP,none,2024-05-31T05:23:24Z
4,youtube#searchResult,0MwtEFiXdBEPUCqqqR_tc-Yajtw,youtube#video,yPHon-7fTgM,2024-05-31T05:22:05Z,UCipPccqvcfychKNOaYUokyQ,MLSS 2024_Shai Ben David (Statistical Learning Theory),"Date: Monday, March 4, 2024 (All day) to Friday, March 15, 2024 (All day) Location: OIST Conference Center, The Okinawa ...",https://i.ytimg.com/vi/yPHon-7fTgM/default.jpg,120,90,https://i.ytimg.com/vi/yPHon-7fTgM/mqdefault.jpg,320,180,https://i.ytimg.com/vi/yPHon-7fTgM/hqdefault.jpg,480,360,RIKEN AIP,none,2024-05-31T05:22:05Z
0,youtube#searchResult,tMldCWG-ooyrq7jIictSCYFNKb0,youtube#video,VSSa2WwFVBs,2021-11-26T04:26:22Z,UC62ScVTFf3GpDC5gXDesfEQ,"#MKAILIVE - Licensing Artificial Intelligence - Practical, Critical or Political?","In this MKAILive discussion, join us when we ask our panel of contributors to explore the question: Is the licensing of artificial ...",https://i.ytimg.com/vi/VSSa2WwFVBs/default.jpg,120,90,https://i.ytimg.com/vi/VSSa2WwFVBs/mqdefault.jpg,320,180,https://i.ytimg.com/vi/VSSa2WwFVBs/hqdefault.jpg,480,360,Richard Foster-Fletcher,none,2021-11-26T04:26:22Z
1,youtube#searchResult,rZjo05A2XboNoclunUxg3oyWWpc,youtube#video,SpK_IbBd-HM,2021-10-22T03:05:28Z,UC62ScVTFf3GpDC5gXDesfEQ,#MKAILIVE - How will we use Artificial Intelligence in 20 years?,"In recognition of Kai-Fu Lee's latest book 'AI in 2041', this #MKAILive broadcast will discuss the question 'How will we use Artificial ...",https://i.ytimg.com/vi/SpK_IbBd-HM/default.jpg,120,90,https://i.ytimg.com/vi/SpK_IbBd-HM/mqdefault.jpg,320,180,https://i.ytimg.com/vi/SpK_IbBd-HM/hqdefault.jpg,480,360,Richard Foster-Fletcher,none,2021-10-22T03:05:28Z
2,youtube#searchResult,u6gtuUmiA5qVjyhUvF1vtgaZM0E,youtube#video,s9j1tKce4Xg,2021-09-24T03:14:00Z,UC62ScVTFf3GpDC5gXDesfEQ,#MKAILIVE - The Ethics and Imperative of Digital Nudging,In this #MKAILive panel discussion we will discuss the ethics and imperative of digital nudging in light of the 2021 IPCC climate ...,https://i.ytimg.com/vi/s9j1tKce4Xg/default.jpg,120,90,https://i.ytimg.com/vi/s9j1tKce4Xg/mqdefault.jpg,320,180,https://i.ytimg.com/vi/s9j1tKce4Xg/hqdefault.jpg,480,360,Richard Foster-Fletcher,none,2021-09-24T03:14:00Z
3,youtube#searchResult,PRPGDI5iWs3xTGyJRtZQzqu-ZXo,youtube#video,J9x5-8n8r_I,2021-08-20T03:18:19Z,UC62ScVTFf3GpDC5gXDesfEQ,#MKAILIVE - What will it take to solve the bias problem in Artificial Intelligence (AI)?,"AI bias, also known as algorithmic bias is a phenomenon that occurs when an algorithm produces results that are systemically ...",https://i.ytimg.com/vi/J9x5-8n8r_I/default.jpg,120,90,https://i.ytimg.com/vi/J9x5-8n8r_I/mqdefault.jpg,320,180,https://i.ytimg.com/vi/J9x5-8n8r_I/hqdefault.jpg,480,360,Richard Foster-Fletcher,none,2021-08-20T03:18:19Z
4,youtube#searchResult,IKh-qCJxO1RWfl1-flINU7q9Pgs,youtube#video,hipw3-BJvu8,2021-08-11T04:14:33Z,UC62ScVTFf3GpDC5gXDesfEQ,Ethical AI Certification and Maturity Model - In conversation with Matthew James Bailey,Our world requires a framework to build an ethical foundation that aligns the futures of humans and Artificial Intelligence.,https://i.ytimg.com/vi/hipw3-BJvu8/default.jpg,120,90,https://i.ytimg.com/vi/hipw3-BJvu8/mqdefault.jpg,320,180,https://i.ytimg.com/vi/hipw3-BJvu8/hqdefault.jpg,480,360,Richard Foster-Fletcher,none,2021-08-11T04:14:33Z
0,youtube#searchResult,Lv5Vi_wM2fVBtiZ634u79GjZTxg,youtube#video,ssPSCs5GVlA,2022-09-13T15:20:32Z,UCY15whY8GyA3DgjZFPdHfAQ,AI Expo 2022 | Panel: Productivity and Performance Boosters for Data Scientists and Developers,"ValleyML AI Expo 2022 Panel Discussion, In-Person Event, Day 1 Topic: Productivity and Performance Boosters for Data ...",https://i.ytimg.com/vi/ssPSCs5GVlA/default.jpg,120,90,https://i.ytimg.com/vi/ssPSCs5GVlA/mqdefault.jpg,320,180,https://i.ytimg.com/vi/ssPSCs5GVlA/hqdefault.jpg,480,360,ValleyML,none,2022-09-13T15:20:32Z
1,youtube#searchResult,J9_o1bpcGqySgVU3Rd0lLS6RCRs,youtube#video,xCMgLDx1O9M,2022-09-13T14:02:53Z,UCY15whY8GyA3DgjZFPdHfAQ,AI Expo 2022 | Chris Eliasmith - An Optimal Time Series Processor,"ValleyML AI Expo 2022 Sponsored Session, AI Hardware, Virtual Event Speaker: Chris Eliasmith, Co-CEO, Applied Brain ...",https://i.ytimg.com/vi/xCMgLDx1O9M/default.jpg,120,90,https://i.ytimg.com/vi/xCMgLDx1O9M/mqdefault.jpg,320,180,https://i.ytimg.com/vi/xCMgLDx1O9M/hqdefault.jpg,480,360,ValleyML,none,2022-09-13T14:02:53Z
2,youtube#searchResult,NxP_jt-ef2uK4IDYmK-Ddq5HSJQ,youtube#video,8kYM_Ac78ik,2022-09-13T14:02:58Z,UCY15whY8GyA3DgjZFPdHfAQ,AI Expo 2022 | Mark Oliver - Introduction to the Efinix TinyML Platform,"ValleyML AI Expo 2022 Sponsored Session, AI Hardware, Virtual Event Speaker: Mark Oliver, VP Marketing, Efinix, Inc. Title: ...",https://i.ytimg.com/vi/8kYM_Ac78ik/default.jpg,120,90,https://i.ytimg.com/vi/8kYM_Ac78ik/mqdefault.jpg,320,180,https://i.ytimg.com/vi/8kYM_Ac78ik/hqdefault.jpg,480,360,ValleyML,none,2022-09-13T14:02:58Z
3,youtube#searchResult,i18GdZrc0fWEhT1sZylN388lkig,youtube#video,MvR-_fJ0NMQ,2022-09-13T14:03:03Z,UCY15whY8GyA3DgjZFPdHfAQ,AI Expo 2022 | Manasi Vartak - A Reference Architecture for Operational AI,"ValleyML AI Expo 2022 Sponsored Session, AI Operations, Virtual Event Speaker: Manasi Vartak, CEO, Verta Inc Title: A ...",https://i.ytimg.com/vi/MvR-_fJ0NMQ/default.jpg,120,90,https://i.ytimg.com/vi/MvR-_fJ0NMQ/mqdefault.jpg,320,180,https://i.ytimg.com/vi/MvR-_fJ0NMQ/hqdefault.jpg,480,360,ValleyML,none,2022-09-13T14:03:03Z
4,youtube#searchResult,Lst1EipLFQAll3kTuib-IrbcStg,youtube#video,6Xmeo99eHVw,2022-09-13T14:03:09Z,UCY15whY8GyA3DgjZFPdHfAQ,AI Expo 2022 | Jan Jongboom - Building confidence in your ML models,"ValleyML AI Expo 2022 Virtual Keynote Speaker: Jan Jongboom, CTO, Edge Impulse Title: Building confidence in your ML ...",https://i.ytimg.com/vi/6Xmeo99eHVw/default.jpg,120,90,https://i.ytimg.com/vi/6Xmeo99eHVw/mqdefault.jpg,320,180,https://i.ytimg.com/vi/6Xmeo99eHVw/hqdefault.jpg,480,360,ValleyML,none,2022-09-13T14:03:09Z
0,youtube#searchResult,Ulf3cYthR2E1TBnHLIiHqq5B0OU,youtube#video,5D2Vdt0QMN0,2021-08-12T21:37:24Z,UCMxUmQFr0_dyW8JTLDiOeNQ,"Proof, Provers, and the Lean Theorem Prover - Summer Special!","In this summer special we'll take a break from messy data, and - just for fun - take refuge in the reassuring consistency and ...",https://i.ytimg.com/vi/5D2Vdt0QMN0/default.jpg,120,90,https://i.ytimg.com/vi/5D2Vdt0QMN0/mqdefault.jpg,320,180,https://i.ytimg.com/vi/5D2Vdt0QMN0/hqdefault.jpg,480,360,Data Science Cornwall,none,2021-08-12T21:37:24Z
1,youtube#searchResult,hGgG12Wpblq1RYxrij0lwvHl39Q,youtube#video,Qv4FVsXnf-M,2021-07-29T22:35:10Z,UCMxUmQFr0_dyW8JTLDiOeNQ,Data Challenge Cornwall - Cluster Analysis to Create Personas without Bias,Link to slides: tinyurl.com/SmartlineClusterDataChallenge Slides include links to data and sample code. --- The Smartline Project ...,https://i.ytimg.com/vi/Qv4FVsXnf-M/default.jpg,120,90,https://i.ytimg.com/vi/Qv4FVsXnf-M/mqdefault.jpg,320,180,https://i.ytimg.com/vi/Qv4FVsXnf-M/hqdefault.jpg,480,360,Data Science Cornwall,none,2021-07-29T22:35:10Z
2,youtube#searchResult,Y_fbPryYPdsn70sIVhFgS0t-5sc,youtube#video,6U3h6DBTZes,2021-07-29T22:35:24Z,UCMxUmQFr0_dyW8JTLDiOeNQ,Data Challenge Cornwall - Predicting Housing Faults &amp; Resident Support Needs,Slides: https://drive.google.com/file/d/1lnjUb0tRI_wuHY1psFCArnDj8F116Osg/view?usp=sharing --- Coastline Housing is an ...,https://i.ytimg.com/vi/6U3h6DBTZes/default.jpg,120,90,https://i.ytimg.com/vi/6U3h6DBTZes/mqdefault.jpg,320,180,https://i.ytimg.com/vi/6U3h6DBTZes/hqdefault.jpg,480,360,Data Science Cornwall,none,2021-07-29T22:35:24Z
3,youtube#searchResult,KLRescYr7-J6-N6utJcPSsOP95U,youtube#video,1Sy0B-4ZRg8,2021-07-29T22:20:51Z,UCMxUmQFr0_dyW8JTLDiOeNQ,Data Challenge Cornwall - OCR of Historical Mining Records,Link to scanned images: https://cornishlithium.egnyte.com/fl/dTYUvzsHR3 Slides: ...,https://i.ytimg.com/vi/1Sy0B-4ZRg8/default.jpg,120,90,https://i.ytimg.com/vi/1Sy0B-4ZRg8/mqdefault.jpg,320,180,https://i.ytimg.com/vi/1Sy0B-4ZRg8/hqdefault.jpg,480,360,Data Science Cornwall,none,2021-07-29T22:20:51Z
4,youtube#searchResult,D3vzXXCQ-tKI8Lfs6XswH4zAlzE,youtube#video,CuSX2jFMAFc,2021-07-22T23:49:04Z,UCMxUmQFr0_dyW8JTLDiOeNQ,Data Challenge Cornwall - Visualising GP Surgery Data,"The NHS collects and publishes a broad range of data, including on GP surgery information. Join the session to find hear about ...",https://i.ytimg.com/vi/CuSX2jFMAFc/default.jpg,120,90,https://i.ytimg.com/vi/CuSX2jFMAFc/mqdefault.jpg,320,180,https://i.ytimg.com/vi/CuSX2jFMAFc/hqdefault.jpg,480,360,Data Science Cornwall,none,2021-07-22T23:49:04Z
0,youtube#searchResult,Vu9tnA2RnmrT2bKKPon7kBkw0LM,youtube#video,LRfFBhxpoO8,2024-04-20T18:00:23Z,UCoTuN2KVQHpnAOO9nM9354Q,OMLDS: Lakehouse Solutions to Data Problems,"In today's data-driven world, organizations grapple with vast volumes of data coming from diverse sources. Managing, processing ...",https://i.ytimg.com/vi/LRfFBhxpoO8/default.jpg,120,90,https://i.ytimg.com/vi/LRfFBhxpoO8/mqdefault.jpg,320,180,https://i.ytimg.com/vi/LRfFBhxpoO8/hqdefault.jpg,480,360,OMLDS,none,2024-04-20T18:00:23Z
1,youtube#searchResult,k6c0JYCZjSsRr9Q5Qjprb7sz1hk,youtube#video,PnTRj3ghRhI,2024-01-12T20:28:35Z,UCoTuN2KVQHpnAOO9nM9354Q,Part 7 End to End Machine Learning Series,"In this installment of the End to End ML Series, we discuss model selection using the PyCaret open source tool to evaluate ...",https://i.ytimg.com/vi/PnTRj3ghRhI/default.jpg,120,90,https://i.ytimg.com/vi/PnTRj3ghRhI/mqdefault.jpg,320,180,https://i.ytimg.com/vi/PnTRj3ghRhI/hqdefault.jpg,480,360,OMLDS,none,2024-01-12T20:28:35Z
2,youtube#searchResult,YVf3W9IyoAk6yyn3oaFf0QpT4I0,youtube#video,vQLXgiqoG9o,2023-11-16T18:32:17Z,UCoTuN2KVQHpnAOO9nM9354Q,Part 6 End to End Machine Learning Series,In this phase we build our first model using SciKit Learn and evaluate the results of a Logistic Regression model using the ...,https://i.ytimg.com/vi/vQLXgiqoG9o/default.jpg,120,90,https://i.ytimg.com/vi/vQLXgiqoG9o/mqdefault.jpg,320,180,https://i.ytimg.com/vi/vQLXgiqoG9o/hqdefault.jpg,480,360,OMLDS,none,2023-11-16T18:32:17Z
3,youtube#searchResult,3vhPuxFDn6bOsR2r5DK88K8R5kY,youtube#video,m0gWOGrvn14,2023-10-24T20:42:47Z,UCoTuN2KVQHpnAOO9nM9354Q,Part5 End to End Machine Learning Series,,https://i.ytimg.com/vi/m0gWOGrvn14/default.jpg,120,90,https://i.ytimg.com/vi/m0gWOGrvn14/mqdefault.jpg,320,180,https://i.ytimg.com/vi/m0gWOGrvn14/hqdefault.jpg,480,360,OMLDS,none,2023-10-24T20:42:47Z
4,youtube#searchResult,6Ypco-bvnSFsVDAjZcRcRQII5IU,youtube#video,izd1aRnKW3Q,2023-10-24T20:30:42Z,UCoTuN2KVQHpnAOO9nM9354Q,Part4 End to End Machine Learning Series,,https://i.ytimg.com/vi/izd1aRnKW3Q/default.jpg,120,90,https://i.ytimg.com/vi/izd1aRnKW3Q/mqdefault.jpg,320,180,https://i.ytimg.com/vi/izd1aRnKW3Q/hqdefault.jpg,480,360,OMLDS,none,2023-10-24T20:30:42Z
0,youtube#searchResult,2YHYAsYYc_GyGtDa6LSHhYrqk0o,youtube#video,PwoTb-SxoC0,2024-02-21T18:14:01Z,UC8hI87gt0dmTAIEupEcsckA,Deep Reinforcement Learning for Trading,Join the Hudson and Thames Reading Group: https://hudsonthames.org/reading-group/ This Friday for our weekly reading group ...,https://i.ytimg.com/vi/PwoTb-SxoC0/default.jpg,120,90,https://i.ytimg.com/vi/PwoTb-SxoC0/mqdefault.jpg,320,180,https://i.ytimg.com/vi/PwoTb-SxoC0/hqdefault.jpg,480,360,Hudson & Thames,none,2024-02-21T18:14:01Z
1,youtube#searchResult,ueDHISTqlw8umJOZy91dq8nqjI4,youtube#video,vyjgR5Ln57s,2024-02-21T18:14:16Z,UC8hI87gt0dmTAIEupEcsckA,Conditional Portfolio Optimization,Join the Hudson and Thames Reading Group: https://hudsonthames.org/reading-group/ In this session we are discussing a paper ...,https://i.ytimg.com/vi/vyjgR5Ln57s/default.jpg,120,90,https://i.ytimg.com/vi/vyjgR5Ln57s/mqdefault.jpg,320,180,https://i.ytimg.com/vi/vyjgR5Ln57s/hqdefault.jpg,480,360,Hudson & Thames,none,2024-02-21T18:14:16Z
2,youtube#searchResult,dMaeN49CLUWChhZHgRSiHS8CqW4,youtube#video,knPPeV58gHM,2024-02-21T18:12:28Z,UC8hI87gt0dmTAIEupEcsckA,Scientific Discovery in Quantitative Finance,"This lecture we review the first 4 chapters of Marcos Lopez de Prado's latest paper from ADIA Labs, which lays out the foundation ...",https://i.ytimg.com/vi/knPPeV58gHM/default.jpg,120,90,https://i.ytimg.com/vi/knPPeV58gHM/mqdefault.jpg,320,180,https://i.ytimg.com/vi/knPPeV58gHM/hqdefault.jpg,480,360,Hudson & Thames,none,2024-02-21T18:12:28Z
3,youtube#searchResult,S33gpa7v8vbBdWxkaCS3Drhyb6I,youtube#video,6SfotqCQtag,2023-05-17T13:46:13Z,UC8hI87gt0dmTAIEupEcsckA,"Git, Branching, and Pull Requests","Welcome to our video on Git fundamentals presented by Michael Struwig, the CEO of Hudson & Thames. If you have some basic ...",https://i.ytimg.com/vi/6SfotqCQtag/default.jpg,120,90,https://i.ytimg.com/vi/6SfotqCQtag/mqdefault.jpg,320,180,https://i.ytimg.com/vi/6SfotqCQtag/hqdefault.jpg,480,360,Hudson & Thames,none,2023-05-17T13:46:13Z
4,youtube#searchResult,qVlzYEdDS0zHnIto7OgeqAyDFcs,youtube#video,Gnpeiu0KxUE,2023-03-03T11:41:59Z,UC8hI87gt0dmTAIEupEcsckA,PortfolioLab Demo Video,PortfolioLab: Portfolio optimisation and allocation library A modern guide to portfolio optimisation: ...,https://i.ytimg.com/vi/Gnpeiu0KxUE/default.jpg,120,90,https://i.ytimg.com/vi/Gnpeiu0KxUE/mqdefault.jpg,320,180,https://i.ytimg.com/vi/Gnpeiu0KxUE/hqdefault.jpg,480,360,Hudson & Thames,none,2023-03-03T11:41:59Z
0,youtube#searchResult,-NYAPds-l--cbGssFtiKqhc5mP0,youtube#video,Zsk8xlnY3Dw,2024-06-04T12:45:02Z,UC8kXgHG13XdgsigIPRmrIyA,High Frequency Trading HFT #trading #highfrequencytrading,"High-frequency trading is a subset of algorithmic trading. Here, opportunities are sought and taken advantage of on very small ...",https://i.ytimg.com/vi/Zsk8xlnY3Dw/default.jpg,120,90,https://i.ytimg.com/vi/Zsk8xlnY3Dw/mqdefault.jpg,320,180,https://i.ytimg.com/vi/Zsk8xlnY3Dw/hqdefault.jpg,480,360,QuantInsti Quantitative Learning,none,2024-06-04T12:45:02Z
1,youtube#searchResult,9xotZiaKJboXg_u0iFLvuW32g0Q,youtube#video,OGE_4ypRaIA,2024-05-30T13:04:00Z,UC8kXgHG13XdgsigIPRmrIyA,QuantInsti Pop Quiz! What is the primary purpose of a stop-loss order in trading? #trading #stoploss,What is the primary purpose of a stop-loss order in trading? - To lock in profits - To limit potential losses Leave your answers in the ...,https://i.ytimg.com/vi/OGE_4ypRaIA/default.jpg,120,90,https://i.ytimg.com/vi/OGE_4ypRaIA/mqdefault.jpg,320,180,https://i.ytimg.com/vi/OGE_4ypRaIA/hqdefault.jpg,480,360,QuantInsti Quantitative Learning,none,2024-05-30T13:04:00Z
2,youtube#searchResult,MOx773t3wfeLopTM5ROt0F2rEq4,youtube#video,bjaRWs9noYc,2024-05-28T14:49:41Z,UC8kXgHG13XdgsigIPRmrIyA,Stop Loss #stoploss #trading #risk #riskmanagement #algorithmictrading #algotrading #exit,"Stop-loss orders are crucial for risk management, helping traders protect their capital by setting predefined exit points to limit ...",https://i.ytimg.com/vi/bjaRWs9noYc/default.jpg,120,90,https://i.ytimg.com/vi/bjaRWs9noYc/mqdefault.jpg,320,180,https://i.ytimg.com/vi/bjaRWs9noYc/hqdefault.jpg,480,360,QuantInsti Quantitative Learning,none,2024-05-28T14:49:41Z
3,youtube#searchResult,PptpxHgRtxmH8dEd4MMgQwsD5Dg,youtube#video,OLrQrovpems,2024-05-24T14:58:47Z,UC8kXgHG13XdgsigIPRmrIyA,Risk Management in Trading #trading #algotrading #algorithmictrading #risk #riskmanagement,"Risk Management in Trading Risk is inherent in trading, as factors like inflation, natural disasters, political instability, and conflicts ...",https://i.ytimg.com/vi/OLrQrovpems/default.jpg,120,90,https://i.ytimg.com/vi/OLrQrovpems/mqdefault.jpg,320,180,https://i.ytimg.com/vi/OLrQrovpems/hqdefault.jpg,480,360,QuantInsti Quantitative Learning,none,2024-05-24T14:58:47Z
4,youtube#searchResult,SW4RJBGlX4kAt63odwdlOXCcqDc,youtube#video,x--oy2ScL2I,2024-05-21T13:22:01Z,UC8kXgHG13XdgsigIPRmrIyA,What is Sharpe Ratio? #sharpe #sharperatio #trading #tradingstrategies,What is Sharpe Ratio? Sharpe Ratio is a measure used to calculate the risk-adjusted return of an investment or a trading strategy.,https://i.ytimg.com/vi/x--oy2ScL2I/default.jpg,120,90,https://i.ytimg.com/vi/x--oy2ScL2I/mqdefault.jpg,320,180,https://i.ytimg.com/vi/x--oy2ScL2I/hqdefault.jpg,480,360,QuantInsti Quantitative Learning,none,2024-05-21T13:22:01Z
0,youtube#searchResult,b121YbA5erZW7yfiNI2hvyZd4Cg,youtube#video,3s1YWgG4iP8,2024-03-15T09:21:11Z,UCywHr2wSEj3Fl0u81OIzEoQ,Correlation - Basic intro  #correlationmatrix #datascience #statisticalanalysis,Learn about correlations.,https://i.ytimg.com/vi/3s1YWgG4iP8/default.jpg,120,90,https://i.ytimg.com/vi/3s1YWgG4iP8/mqdefault.jpg,320,180,https://i.ytimg.com/vi/3s1YWgG4iP8/hqdefault.jpg,480,360,HKML,none,2024-03-15T09:21:11Z
1,youtube#searchResult,_M05zaB5ERDUHnK5oFd0yo_ySGA,youtube#video,cFfj-mlwPrU,2024-03-15T03:45:22Z,UCywHr2wSEj3Fl0u81OIzEoQ,Uniform at Heart: Generating Correlation Matrices with the Onion Method,"Dive into the core of statistical simulations with our concise and informative YouTube short, where we explain generating random ...",https://i.ytimg.com/vi/cFfj-mlwPrU/default.jpg,120,90,https://i.ytimg.com/vi/cFfj-mlwPrU/mqdefault.jpg,320,180,https://i.ytimg.com/vi/cFfj-mlwPrU/hqdefault.jpg,480,360,HKML,none,2024-03-15T03:45:22Z
