,kind,etag,id.kind,id.videoId,snippet.publishedAt,snippet.channelId,snippet.title,snippet.description,snippet.thumbnails.default.url,snippet.thumbnails.default.width,snippet.thumbnails.default.height,snippet.thumbnails.medium.url,snippet.thumbnails.medium.width,snippet.thumbnails.medium.height,snippet.thumbnails.high.url,snippet.thumbnails.high.width,snippet.thumbnails.high.height,snippet.channelTitle,snippet.liveBroadcastContent,snippet.publishTime
3,youtube#searchResult,e0Y5kH5h6-8vPiUfTu8zRgCY4Nk,youtube#video,SlN3m4gXvmo,2026-06-08T12:02:39Z,UCJ0V6493mLvqdiVwOKWBODQ,Why AI Voice Conversations Still Feel Awkward,Ever notice how some AI voice assistants feel unnatural? It's often not what they're saying—it's when they're saying it. Rebecca ...,https://i.ytimg.com/vi/SlN3m4gXvmo/default.jpg,120,90,https://i.ytimg.com/vi/SlN3m4gXvmo/mqdefault.jpg,320,180,https://i.ytimg.com/vi/SlN3m4gXvmo/hqdefault.jpg,480,360,Rasa,none,2026-06-08T12:02:39Z
4,youtube#searchResult,Vj_36-AXt_1B8OsSkleKCFFrE1Y,youtube#video,ycqL3g4pY3s,2026-06-04T14:00:32Z,UCJ0V6493mLvqdiVwOKWBODQ,Conversation Design Isn&#39;t Dead—It&#39;s More Important Than Ever | Rebecca Evanhoe,"Most teams think the secret to better AI is better prompts. Rebecca Evanhoe says that's the wrong question. At Slang AI, handling ...",https://i.ytimg.com/vi/ycqL3g4pY3s/default.jpg,120,90,https://i.ytimg.com/vi/ycqL3g4pY3s/mqdefault.jpg,320,180,https://i.ytimg.com/vi/ycqL3g4pY3s/hqdefault.jpg,480,360,Rasa,none,2026-06-04T14:00:32Z
0,youtube#searchResult,hol3Omb0MgGS7Xs89NoqUIE8ybo,youtube#video,L3nlGfSyHV0,2026-06-08T15:01:35Z,UCtYLUTtgS3k1Fg4y5tAhLbw,"False Discovery Rates, FDR, clearly explained",One of the best ways to prevent p-hacking is to adjust p-values for multiple testing. This StatQuest explains how the ...,https://i.ytimg.com/vi/L3nlGfSyHV0/default.jpg,120,90,https://i.ytimg.com/vi/L3nlGfSyHV0/mqdefault.jpg,320,180,https://i.ytimg.com/vi/L3nlGfSyHV0/hqdefault.jpg,480,360,StatQuest with Josh Starmer,none,2026-06-08T15:01:35Z
1,youtube#searchResult,0aihopE_yOY5QgxAmqq8nOHJCS0,youtube#video,mIlw5j3WyVk,2026-06-08T15:02:05Z,UCtYLUTtgS3k1Fg4y5tAhLbw,StatQuest: Random Forests Part 2: Missing data and clustering,NOTE: This StatQuest is the updated version of the original Random Forests Part 3 and includes two minor corrections. Last time ...,https://i.ytimg.com/vi/mIlw5j3WyVk/default.jpg,120,90,https://i.ytimg.com/vi/mIlw5j3WyVk/mqdefault.jpg,320,180,https://i.ytimg.com/vi/mIlw5j3WyVk/hqdefault.jpg,480,360,StatQuest with Josh Starmer,none,2026-06-08T15:02:05Z
2,youtube#searchResult,hQ19wCdSiS9cnR2Z73_chwPveOY,youtube#video,aFDOzpTeg0s,2026-05-18T04:00:01Z,UCtYLUTtgS3k1Fg4y5tAhLbw,The Essence of Linear Regression,"This StatQuest takes you through basic linear regression, step-by-step, explaining both the method and the motivation behind the ...",https://i.ytimg.com/vi/aFDOzpTeg0s/default.jpg,120,90,https://i.ytimg.com/vi/aFDOzpTeg0s/mqdefault.jpg,320,180,https://i.ytimg.com/vi/aFDOzpTeg0s/hqdefault.jpg,480,360,StatQuest with Josh Starmer,none,2026-05-18T04:00:01Z
3,youtube#searchResult,zSGQWiylSJRZ6cu2ietN41n005c,youtube#video,q-BiW5srMFQ,2026-01-12T05:01:06Z,UCtYLUTtgS3k1Fg4y5tAhLbw,How AI works in Super Simple Terms!!!,"In this StatQuest we explain how AI, like ChatGPT, works. However, instead of using lots of complicated math, we're going to use a ...",https://i.ytimg.com/vi/q-BiW5srMFQ/default.jpg,120,90,https://i.ytimg.com/vi/q-BiW5srMFQ/mqdefault.jpg,320,180,https://i.ytimg.com/vi/q-BiW5srMFQ/hqdefault.jpg,480,360,StatQuest with Josh Starmer,none,2026-01-12T05:01:06Z
4,youtube#searchResult,agFDI2CSSM8pwfNYool_SuqjZ1k,youtube#video,WRYk7oZiogg,2025-09-04T04:00:42Z,UCtYLUTtgS3k1Fg4y5tAhLbw,StatQuest: Career Advice from Tech Industry Leaders,"This year, for my Pop's birthday, we're going to hear from current tech industry leaders that all started out working for my pop in the ...",https://i.ytimg.com/vi/WRYk7oZiogg/default.jpg,120,90,https://i.ytimg.com/vi/WRYk7oZiogg/mqdefault.jpg,320,180,https://i.ytimg.com/vi/WRYk7oZiogg/hqdefault.jpg,480,360,StatQuest with Josh Starmer,none,2025-09-04T04:00:42Z
0,youtube#searchResult,GqjC1JmYrqHGRETk46_EvdNOUeE,youtube#video,ndoj_-79Bck,2026-06-11T13:54:46Z,UCyRXlm2atZrHv9GtKM3kzbQ,Naomi presents: FALCUN: A Simple and Efficient Deep Active Learning Strategy,"FALCUN: A Simple and Efficient Deep Active Learning Strategy by Sandra Gilhuber, Anna Beer, Yunpu Ma, and Thomas Seidl ...",https://i.ytimg.com/vi/ndoj_-79Bck/default.jpg,120,90,https://i.ytimg.com/vi/ndoj_-79Bck/mqdefault.jpg,320,180,https://i.ytimg.com/vi/ndoj_-79Bck/hqdefault.jpg,480,360,nPlan,none,2026-06-11T13:54:46Z
1,youtube#searchResult,yPDJ4HCxl9U18lbrkLxh95D5b4Y,youtube#video,Hv2FACAjHX0,2026-05-28T14:39:14Z,UCyRXlm2atZrHv9GtKM3kzbQ,Arshad presents: YOLO26: A Comprehensive Architecture Overview and Key Improvements,"YOLO26: A Comprehensive Architecture Overview and Key Improvements by Priyanto Hidayatullah, Refdinal Tubagus Abstract: ...",https://i.ytimg.com/vi/Hv2FACAjHX0/default.jpg,120,90,https://i.ytimg.com/vi/Hv2FACAjHX0/mqdefault.jpg,320,180,https://i.ytimg.com/vi/Hv2FACAjHX0/hqdefault.jpg,480,360,nPlan,none,2026-05-28T14:39:14Z
2,youtube#searchResult,K-ibSV55dqZDyhCA_R2GPGxEZMU,youtube#video,AOomoq_1I84,2026-05-14T13:29:41Z,UCyRXlm2atZrHv9GtKM3kzbQ,Lahari presents: Complexity-aware fine-tuning,"Complexity-aware fine-tuning by Andrey Goncharov, Daniil Vyazhev, Petr Sychev, Edvard Khalafyan, Alexey Zaytsev Abstract: ...",https://i.ytimg.com/vi/AOomoq_1I84/default.jpg,120,90,https://i.ytimg.com/vi/AOomoq_1I84/mqdefault.jpg,320,180,https://i.ytimg.com/vi/AOomoq_1I84/hqdefault.jpg,480,360,nPlan,none,2026-05-14T13:29:41Z
3,youtube#searchResult,qNZzUFTsyzES-DX9OWrlaPyjiKA,youtube#video,S3rMcTB7hgw,2026-04-30T14:54:52Z,UCyRXlm2atZrHv9GtKM3kzbQ,Inneke presents: LeWorldModel: Stable End-to-End Joint-EmbeddingPredictive Architecture from Pixels,"LeWorldModel: Stable End-to-End Joint-Embedding Predictive Architecture from Pixels by Lucas Maes, Quentin Le Lidec, Damien ...",https://i.ytimg.com/vi/S3rMcTB7hgw/default.jpg,120,90,https://i.ytimg.com/vi/S3rMcTB7hgw/mqdefault.jpg,320,180,https://i.ytimg.com/vi/S3rMcTB7hgw/hqdefault.jpg,480,360,nPlan,none,2026-04-30T14:54:52Z
4,youtube#searchResult,o36Hh23AGvw2PRDi76GlDgcGBUw,youtube#video,2bhAeChDxvI,2026-04-16T13:42:56Z,UCyRXlm2atZrHv9GtKM3kzbQ,Damian presents: TriAttention: Efficient Long Reasoning with Trigonometric KV Compression,"TriAttention: Efficient Long Reasoning with Trigonometric KV Compression by Weian Mao, Xi Lin, Wei Huang, Yuxin Xie, Tianfu Fu ...",https://i.ytimg.com/vi/2bhAeChDxvI/default.jpg,120,90,https://i.ytimg.com/vi/2bhAeChDxvI/mqdefault.jpg,320,180,https://i.ytimg.com/vi/2bhAeChDxvI/hqdefault.jpg,480,360,nPlan,none,2026-04-16T13:42:56Z
0,youtube#searchResult,QUKLYPTgzbMpqytIxDJQgPAlXuY,youtube#video,_pfzxxMpo34,2024-12-02T05:31:00Z,UCWtY0NYpa3hXbJprpt1qLbQ,Deep Learning by Goodfellow Study Group - 8-31-2024,Join the TWIML Community to participate in this and our many other study groups. https://twimlai.com/community.,https://i.ytimg.com/vi/_pfzxxMpo34/default.jpg,120,90,https://i.ytimg.com/vi/_pfzxxMpo34/mqdefault.jpg,320,180,https://i.ytimg.com/vi/_pfzxxMpo34/hqdefault.jpg,480,360,TWIML Community,none,2024-12-02T05:31:00Z
1,youtube#searchResult,sBypibZrtC9Sr7VFnfhA_ykUY_Y,youtube#video,gL89G5t1VJg,2024-12-01T14:27:14Z,UCWtY0NYpa3hXbJprpt1qLbQ,Deep Learning by Goodfellow Study Group - 8-24-2024,Join the TWIML Community to participate in this and our many other study groups. https://twimlai.com/community.,https://i.ytimg.com/vi/gL89G5t1VJg/default.jpg,120,90,https://i.ytimg.com/vi/gL89G5t1VJg/mqdefault.jpg,320,180,https://i.ytimg.com/vi/gL89G5t1VJg/hqdefault.jpg,480,360,TWIML Community,none,2024-12-01T14:27:14Z
2,youtube#searchResult,6t-f3AgCDSKvla1iun7J5bdmgZk,youtube#video,1Fyt8wJHfqY,2024-10-07T04:25:38Z,UCWtY0NYpa3hXbJprpt1qLbQ,Deep Learning by Goodfellow Study Group - 8-10-2024,Join the TWIML Community to participate in this and our many other study groups. https://twimlai.com/community.,https://i.ytimg.com/vi/1Fyt8wJHfqY/default.jpg,120,90,https://i.ytimg.com/vi/1Fyt8wJHfqY/mqdefault.jpg,320,180,https://i.ytimg.com/vi/1Fyt8wJHfqY/hqdefault.jpg,480,360,TWIML Community,none,2024-10-07T04:25:38Z
3,youtube#searchResult,G9P7E7qsb7unmbezdAk3utWzbc0,youtube#video,0aWUgUvDlUM,2024-08-26T07:54:01Z,UCWtY0NYpa3hXbJprpt1qLbQ,Deep Learning by Goodfellow Study Group - 8-3-2024,Join the TWIML Community to participate in this and our many other study groups. https://twimlai.com/community.,https://i.ytimg.com/vi/0aWUgUvDlUM/default.jpg,120,90,https://i.ytimg.com/vi/0aWUgUvDlUM/mqdefault.jpg,320,180,https://i.ytimg.com/vi/0aWUgUvDlUM/hqdefault.jpg,480,360,TWIML Community,none,2024-08-26T07:54:01Z
4,youtube#searchResult,shXyBjrMmQvY8n18ZaXfDoDu7aE,youtube#video,CDrRoUud79w,2024-08-26T06:36:05Z,UCWtY0NYpa3hXbJprpt1qLbQ,Deep Learning by Goodfellow Study Group - 7-27-2024,Join the TWIML Community to participate in this and our many other study groups. https://twimlai.com/community.,https://i.ytimg.com/vi/CDrRoUud79w/default.jpg,120,90,https://i.ytimg.com/vi/CDrRoUud79w/mqdefault.jpg,320,180,https://i.ytimg.com/vi/CDrRoUud79w/hqdefault.jpg,480,360,TWIML Community,none,2024-08-26T06:36:05Z
0,youtube#searchResult,LYjicA59t-5YFUbrgsJ0HMhSkTY,youtube#video,U6-Y3kw4Sr8,2019-01-31T17:10:48Z,UChssXLcvkJk4xNEbU7r0OxA,What&#39;s next in Deep Learning,In this podcast we will be looking at what do I see as the future of Deep Learning.,https://i.ytimg.com/vi/U6-Y3kw4Sr8/default.jpg,120,90,https://i.ytimg.com/vi/U6-Y3kw4Sr8/mqdefault.jpg,320,180,https://i.ytimg.com/vi/U6-Y3kw4Sr8/hqdefault.jpg,480,360,Crazymuse Coding,none,2019-01-31T17:10:48Z
1,youtube#searchResult,LP84hB6UX56CWLUhmVeMoWO5orE,youtube#video,bLJ-JakFFXY,2019-01-30T07:18:28Z,UChssXLcvkJk4xNEbU7r0OxA,What is it so difficult to make a chatbot ?,"Have you ever wondered, what is that one thing you could learn to make a smarter chatbot? Well, this video introduces you to the ...",https://i.ytimg.com/vi/bLJ-JakFFXY/default.jpg,120,90,https://i.ytimg.com/vi/bLJ-JakFFXY/mqdefault.jpg,320,180,https://i.ytimg.com/vi/bLJ-JakFFXY/hqdefault.jpg,480,360,Crazymuse Coding,none,2019-01-30T07:18:28Z
0,youtube#searchResult,MnRqjHipbgsBKmA3L0NhPi_ZmW4,youtube#video,ZOHu_FUEssQ,2013-07-14T02:42:12Z,UCGWwUL0LhOPpfu62HfFD8Yg,Buffy in the backyard,,https://i.ytimg.com/vi/ZOHu_FUEssQ/default.jpg,120,90,https://i.ytimg.com/vi/ZOHu_FUEssQ/mqdefault.jpg,320,180,https://i.ytimg.com/vi/ZOHu_FUEssQ/hqdefault.jpg,480,360,Andreas Mueller,none,2013-07-14T02:42:12Z
0,youtube#searchResult,Ba-ir5OP2Q_z48Mq6aCgb_akv3g,youtube#video,J5NviNVdOsc,2018-07-12T11:55:31Z,UCjpaCHc1XIivGlFVLS2xXZg,VentureBeat: Amazon Virtual Reality VR Mall Kiosks - The Future of Retail,"See Amazon's amazing VR mall kiosks, set up in 10 different malls for 2018's Prime Day. Is this the future of retail shopping, where ...",https://i.ytimg.com/vi/J5NviNVdOsc/default.jpg,120,90,https://i.ytimg.com/vi/J5NviNVdOsc/mqdefault.jpg,320,180,https://i.ytimg.com/vi/J5NviNVdOsc/hqdefault.jpg,480,360,VentureBeat,none,2018-07-12T11:55:31Z
0,youtube#searchResult,OD32blLIM9-HQe5K71MLJh3oez4,youtube#video,QVrJmhXxiVw,2026-06-21T04:30:02Z,UCNU_lfiiWBdtULKOw6X0Dig,3.0 Agentic AI Specialization And AgentsOps Induction Session,Enrollment Link: https://www.krishnaik.in/liveclass2/AgenticAi?id=11.,https://i.ytimg.com/vi/QVrJmhXxiVw/default.jpg,120,90,https://i.ytimg.com/vi/QVrJmhXxiVw/mqdefault.jpg,320,180,https://i.ytimg.com/vi/QVrJmhXxiVw/hqdefault.jpg,480,360,Krish Naik,none,2026-06-21T04:30:02Z
1,youtube#searchResult,xXbkqXior_FReIZiMLmRhyGgbVo,youtube#video,rQE3w8Qjx98,2026-06-18T06:39:54Z,UCNU_lfiiWBdtULKOw6X0Dig,"The Complete AI Security Course In 8 Hours-AI Guardrails, LLM Evals &amp; Memory And AgentOps","AI Security, Agentic Memory & AgentOps Masterclass A huge thanks to our amazing mentors — Divesh, Yash, Chirantan, and ...",https://i.ytimg.com/vi/rQE3w8Qjx98/default.jpg,120,90,https://i.ytimg.com/vi/rQE3w8Qjx98/mqdefault.jpg,320,180,https://i.ytimg.com/vi/rQE3w8Qjx98/hqdefault.jpg,480,360,Krish Naik,none,2026-06-18T06:39:54Z
0,youtube#searchResult,RGfET_cPRfhI5CFzmU-qs6XpqwQ,youtube#video,JB9T2MKqgno,2026-06-20T17:30:06Z,UCoW_WzQNJVAjxo4osNAxd_g,"GLM-5.2 First Test | Frontier-Level Open Weight Model? | Agentic Coding, Web Design, Logic Puzzles",GLM 5.2 by Z.ai is a ~750B open weight LLM that is optimized for agentic/long--running tasks that is a serious contender for the ...,https://i.ytimg.com/vi/JB9T2MKqgno/default.jpg,120,90,https://i.ytimg.com/vi/JB9T2MKqgno/mqdefault.jpg,320,180,https://i.ytimg.com/vi/JB9T2MKqgno/hqdefault.jpg,480,360,Venelin Valkov,none,2026-06-20T17:30:06Z
1,youtube#searchResult,peFz5QzkRJaCJQ8e_6gWIEAbYrc,youtube#video,g9tr2BFIg54,2026-06-16T19:00:06Z,UCoW_WzQNJVAjxo4osNAxd_g,DiffusionGemma Local Test | 4x Faster but How Accurate? | Text Generation &amp; Coding with llama.cpp,"DiffusionGemma is a 26B MoE diffusion model that promises 4x faster inference compared to the ""conventional"" autoregressive ...",https://i.ytimg.com/vi/g9tr2BFIg54/default.jpg,120,90,https://i.ytimg.com/vi/g9tr2BFIg54/mqdefault.jpg,320,180,https://i.ytimg.com/vi/g9tr2BFIg54/hqdefault.jpg,480,360,Venelin Valkov,none,2026-06-16T19:00:06Z
2,youtube#searchResult,p1kVNl0scjiA6av8kJ7KU2bJ2uI,youtube#video,2yAzw6CJzeY,2026-06-14T20:00:06Z,UCoW_WzQNJVAjxo4osNAxd_g,"Gemma 4 12B MTP Local Test | Coding, OCR, Visual RAG with llama.cpp",Gemma 4 12B is the latest open model by Google DeepMind that aims to bring performance similar to the 26B model requiring ...,https://i.ytimg.com/vi/2yAzw6CJzeY/default.jpg,120,90,https://i.ytimg.com/vi/2yAzw6CJzeY/mqdefault.jpg,320,180,https://i.ytimg.com/vi/2yAzw6CJzeY/hqdefault.jpg,480,360,Venelin Valkov,none,2026-06-14T20:00:06Z
3,youtube#searchResult,LqPsWJF2xjc4unao-hq0B2JUMgk,youtube#video,o7dlRLFcnxU,2026-05-20T08:20:35Z,UCoW_WzQNJVAjxo4osNAxd_g,"Gemini 3.5 Flash Test | Coding, OCR, Image Understanding, Pricing, Speed | 🔴 Live",Google just launched Gemini 3.5 Flash (no Pro yet) - let's test it! Blog post: ...,https://i.ytimg.com/vi/o7dlRLFcnxU/default.jpg,120,90,https://i.ytimg.com/vi/o7dlRLFcnxU/mqdefault.jpg,320,180,https://i.ytimg.com/vi/o7dlRLFcnxU/hqdefault.jpg,480,360,Venelin Valkov,none,2026-05-20T08:20:35Z
4,youtube#searchResult,xdZ5rRVyZQCqbHD2Qs6Y6jTbgkQ,youtube#video,NSb1yGHykH8,2026-05-19T16:30:05Z,UCoW_WzQNJVAjxo4osNAxd_g,"Qwen 3.7 Max &amp; Plus First Test | Coding, Game Dev, OCR, Image Understanding Testing",The Qwen team have released preview versions of Qwen 3.7 Max & Plus (hoping this one goes open source) - let's look at their ...,https://i.ytimg.com/vi/NSb1yGHykH8/default.jpg,120,90,https://i.ytimg.com/vi/NSb1yGHykH8/mqdefault.jpg,320,180,https://i.ytimg.com/vi/NSb1yGHykH8/hqdefault.jpg,480,360,Venelin Valkov,none,2026-05-19T16:30:05Z
0,youtube#searchResult,wjbFLZbOOYU7R8BCIEQ4KY9i3t0,youtube#video,TI8Mx9N40_c,2026-06-16T10:00:37Z,UCxxisInVr7upxv1yUhSgdBA,AI and Economics: Twins Separated at Birth? with Kevin Leyton-Brown (Live from Upper Bound 2026),"What happens when you give an economics final to ChatGPT? On a special episode of Approximately Correct, filmed live at ...",https://i.ytimg.com/vi/TI8Mx9N40_c/default.jpg,120,90,https://i.ytimg.com/vi/TI8Mx9N40_c/mqdefault.jpg,320,180,https://i.ytimg.com/vi/TI8Mx9N40_c/hqdefault.jpg,480,360,Amii,none,2026-06-16T10:00:37Z
1,youtube#searchResult,tOLgvh4UvY380z6dazF1-g_m5kI,youtube#video,uoEUtltHrCM,2026-05-29T21:36:12Z,UCxxisInVr7upxv1yUhSgdBA,Distributions as Actions: A Unified Framework for Diverse Action Spaces,"In this seminar from the Alberta Machine Intelligence Institute and the Department of Computing Science, Jiamin He, PhD student ...",https://i.ytimg.com/vi/uoEUtltHrCM/default.jpg,120,90,https://i.ytimg.com/vi/uoEUtltHrCM/mqdefault.jpg,320,180,https://i.ytimg.com/vi/uoEUtltHrCM/hqdefault.jpg,480,360,Amii,none,2026-05-29T21:36:12Z
2,youtube#searchResult,QereYUrsqSWvuNi3e3inNCzL1Wc,youtube#video,_3y2dzz9K5w,2026-05-29T20:52:03Z,UCxxisInVr7upxv1yUhSgdBA,Topological Data Analysis for Medical Imaging,"In this seminar from the Alberta Machine Intelligence Institute and the Department of Computing Science, Dashti Ali, PhD student ...",https://i.ytimg.com/vi/_3y2dzz9K5w/default.jpg,120,90,https://i.ytimg.com/vi/_3y2dzz9K5w/mqdefault.jpg,320,180,https://i.ytimg.com/vi/_3y2dzz9K5w/hqdefault.jpg,480,360,Amii,none,2026-05-29T20:52:03Z
3,youtube#searchResult,PQ34GEv_yxdtC22kavIa2pFK38I,youtube#video,B1xJiiXVScU,2026-05-25T18:15:50Z,UCxxisInVr7upxv1yUhSgdBA,Amii Partners with Alberta Government to Bring AI Literacy to K-12 Classrooms,"As announced at Upper Bound 2026, Amii is partnering with the Alberta government on a three-year partnership to expand and ...",https://i.ytimg.com/vi/B1xJiiXVScU/default.jpg,120,90,https://i.ytimg.com/vi/B1xJiiXVScU/mqdefault.jpg,320,180,https://i.ytimg.com/vi/B1xJiiXVScU/hqdefault.jpg,480,360,Amii,none,2026-05-25T18:15:50Z
4,youtube#searchResult,y1nTuC1_7gZJgue7SqAQ9vR-v0o,youtube#video,-kpWMpZxE7k,2026-05-25T18:14:17Z,UCxxisInVr7upxv1yUhSgdBA,Live from Upper Bound: Amii and Government of Alberta launch Health Innovation Lab,"Announced on Wednesday at Upper Bound: Amii is launching the Health Innovation Lab, a $10M initiative in partnership with the ...",https://i.ytimg.com/vi/-kpWMpZxE7k/default.jpg,120,90,https://i.ytimg.com/vi/-kpWMpZxE7k/mqdefault.jpg,320,180,https://i.ytimg.com/vi/-kpWMpZxE7k/hqdefault.jpg,480,360,Amii,none,2026-05-25T18:14:17Z
0,youtube#searchResult,3QHnlJz45TK-bhRDk9wFPXHyZ7w,youtube#video,CACQ7nCBda4,2023-05-03T02:52:03Z,UCHGAwygtFWAonSYfjeUv0iA,WiDS Mumbai Regional Event 2023 - With Geetha Manjunath@geethamhp and Usha Rengaraju@usharengaraju,WiDS Mumbai Fireside chat with Mrs Geetha Manjunath and Mrs Usha Rengaraju.,https://i.ytimg.com/vi/CACQ7nCBda4/default.jpg,120,90,https://i.ytimg.com/vi/CACQ7nCBda4/mqdefault.jpg,320,180,https://i.ytimg.com/vi/CACQ7nCBda4/hqdefault.jpg,480,360,Data Science Talks,none,2023-05-03T02:52:03Z
1,youtube#searchResult,9ZhfRISN2XSsyQSetePl9g1UeaA,youtube#video,XcprcNreEzE,2023-01-11T20:16:23Z,UCHGAwygtFWAonSYfjeUv0iA,Data Science in Healthcare,,https://i.ytimg.com/vi/XcprcNreEzE/default.jpg,120,90,https://i.ytimg.com/vi/XcprcNreEzE/mqdefault.jpg,320,180,https://i.ytimg.com/vi/XcprcNreEzE/hqdefault.jpg,480,360,Data Science Talks,none,2023-01-11T20:16:23Z
2,youtube#searchResult,1ypu9_yy4EFvZ2fgJ7ntT3zB2sM,youtube#video,WrgH4CKfY7M,2022-06-25T17:20:34Z,UCHGAwygtFWAonSYfjeUv0iA,Data science as a career choice for women in all stages | WiDS Regional &#39;22,"Speaker: Saradha Kameswaran, Google. She has spent 15+ years across many teams since the inception of Google India.",https://i.ytimg.com/vi/WrgH4CKfY7M/default.jpg,120,90,https://i.ytimg.com/vi/WrgH4CKfY7M/mqdefault.jpg,320,180,https://i.ytimg.com/vi/WrgH4CKfY7M/hqdefault.jpg,480,360,Data Science Talks,none,2022-06-25T17:20:34Z
3,youtube#searchResult,dlenPZKlh_kk2xROQkUEmpaCQZs,youtube#video,sKO3dY-R9q0,2022-06-18T17:40:54Z,UCHGAwygtFWAonSYfjeUv0iA,Identifying fake reviews on a Business using ML and Data | WiDS 2022,,https://i.ytimg.com/vi/sKO3dY-R9q0/default.jpg,120,90,https://i.ytimg.com/vi/sKO3dY-R9q0/mqdefault.jpg,320,180,https://i.ytimg.com/vi/sKO3dY-R9q0/hqdefault.jpg,480,360,Data Science Talks,none,2022-06-18T17:40:54Z
4,youtube#searchResult,-D-mJB8CrzTYzqFU9gmkcszyI8I,youtube#video,VEoSYvmC-PE,2022-04-16T17:46:00Z,UCHGAwygtFWAonSYfjeUv0iA,ML applications in Customer Interactions,"Sravanthi Dhanekula, Engineering Lead at Google. This talk is organized in association with VIT Bhopal University. Special ...",https://i.ytimg.com/vi/VEoSYvmC-PE/default.jpg,120,90,https://i.ytimg.com/vi/VEoSYvmC-PE/mqdefault.jpg,320,180,https://i.ytimg.com/vi/VEoSYvmC-PE/hqdefault.jpg,480,360,Data Science Talks,none,2022-04-16T17:46:00Z
0,youtube#searchResult,O7HpfLDgynOzLZIjmiDVo4X-rBw,youtube#video,3MYAkMMlDU0,2020-05-04T08:00:02Z,UCJ70w0WzWjWerpk3utRcAKA,Object-oriented programming in Python - Part 6 - Polymorphism,"Welcome to a new series of videos on the Python programming language. This time I want to tackle OOP, Object-oriented ...",https://i.ytimg.com/vi/3MYAkMMlDU0/default.jpg,120,90,https://i.ytimg.com/vi/3MYAkMMlDU0/mqdefault.jpg,320,180,https://i.ytimg.com/vi/3MYAkMMlDU0/hqdefault.jpg,480,360,The Digital Cat,none,2020-05-04T08:00:02Z
1,youtube#searchResult,vanRai6SFQvaj0SvG990l1ST7g8,youtube#video,FLwxJrwYHbo,2020-04-13T08:46:56Z,UCJ70w0WzWjWerpk3utRcAKA,Object-oriented programming in Python - Part 5 - Delegation: inheritance and composition,"Welcome to a new series of videos on the Python programming language. This time I want to tackle OOP, Object-oriented ...",https://i.ytimg.com/vi/FLwxJrwYHbo/default.jpg,120,90,https://i.ytimg.com/vi/FLwxJrwYHbo/mqdefault.jpg,320,180,https://i.ytimg.com/vi/FLwxJrwYHbo/hqdefault.jpg,480,360,The Digital Cat,none,2020-04-13T08:46:56Z
2,youtube#searchResult,84u3kcMvxvps5NWuhrytl2jHdMg,youtube#video,6ZPXR0Gj0GU,2019-12-09T19:00:00Z,UCJ70w0WzWjWerpk3utRcAKA,Object-oriented programming in Python - Part 4 - Classes and instances,"Welcome to a new series of videos on the Python programming language. This time I want to tackle OOP, Object-oriented ...",https://i.ytimg.com/vi/6ZPXR0Gj0GU/default.jpg,120,90,https://i.ytimg.com/vi/6ZPXR0Gj0GU/mqdefault.jpg,320,180,https://i.ytimg.com/vi/6ZPXR0Gj0GU/hqdefault.jpg,480,360,The Digital Cat,none,2019-12-09T19:00:00Z
3,youtube#searchResult,GiDYSUQoeg5amJiq6XiXPAbUZTM,youtube#video,_b18YfmEvTg,2019-12-02T19:00:06Z,UCJ70w0WzWjWerpk3utRcAKA,Object-oriented programming in Python - Part 3 - How to create a class,"Welcome to a new series of videos on the Python programming language. This time I want to tackle OOP, Object-oriented ...",https://i.ytimg.com/vi/_b18YfmEvTg/default.jpg,120,90,https://i.ytimg.com/vi/_b18YfmEvTg/mqdefault.jpg,320,180,https://i.ytimg.com/vi/_b18YfmEvTg/hqdefault.jpg,480,360,The Digital Cat,none,2019-12-02T19:00:06Z
4,youtube#searchResult,-cJAca-W-kSGaG7Iy5Ufq2emMBo,youtube#video,-O7OHmrQMfc,2019-11-25T19:00:01Z,UCJ70w0WzWjWerpk3utRcAKA,Object-oriented programming in Python - Part 2 - Types and classes in Python,"Welcome to a new series of videos on the Python programming language. This time I want to tackle OOP, Object-oriented ...",https://i.ytimg.com/vi/-O7OHmrQMfc/default.jpg,120,90,https://i.ytimg.com/vi/-O7OHmrQMfc/mqdefault.jpg,320,180,https://i.ytimg.com/vi/-O7OHmrQMfc/hqdefault.jpg,480,360,The Digital Cat,none,2019-11-25T19:00:01Z
0,youtube#searchResult,WOqrHsAYkxCWoY8ur8epV-Dkwkk,youtube#video,g5QWmWn3KGY,2021-04-26T02:43:57Z,UCGYPQz_qySbPESTK8k2ky5g,Announcing the 8 Week SQL Challenge - Start Your Data Science Journey,I'm super excited to announce the official launch of the #8WeekSQLChallenge - join me for a 1 hour SQL focused Q&A session to ...,https://i.ytimg.com/vi/g5QWmWn3KGY/default.jpg,120,90,https://i.ytimg.com/vi/g5QWmWn3KGY/mqdefault.jpg,320,180,https://i.ytimg.com/vi/g5QWmWn3KGY/hqdefault.jpg,480,360,Danny Ma,none,2021-04-26T02:43:57Z
1,youtube#searchResult,wNFJIOSizcVM6Qato-YiDkothtM,youtube#video,OO4W4SnIHhM,2021-03-30T13:48:54Z,UCGYPQz_qySbPESTK8k2ky5g,Machine Learning From Beginning To Advanced,A quick breakdown of different machine learning skills required for data science from beginner to advanced. This video is a ...,https://i.ytimg.com/vi/OO4W4SnIHhM/default.jpg,120,90,https://i.ytimg.com/vi/OO4W4SnIHhM/mqdefault.jpg,320,180,https://i.ytimg.com/vi/OO4W4SnIHhM/hqdefault.jpg,480,360,Danny Ma,none,2021-03-30T13:48:54Z
2,youtube#searchResult,wT12Fx3KV9t_JLqfVki0WC7fcKw,youtube#video,GnkIX10cLao,2021-03-23T13:11:30Z,UCGYPQz_qySbPESTK8k2ky5g,The 3 Types of Data Scientists,"A is for Analyst, B is for Builder and C is for Consultant - a Unicorn Data Scientist is someone who can do all 3 at an extreme level ...",https://i.ytimg.com/vi/GnkIX10cLao/default.jpg,120,90,https://i.ytimg.com/vi/GnkIX10cLao/mqdefault.jpg,320,180,https://i.ytimg.com/vi/GnkIX10cLao/hqdefault.jpg,480,360,Danny Ma,none,2021-03-23T13:11:30Z
3,youtube#searchResult,pWJzwm-cS7ni1mPKfjaemNaPOnI,youtube#video,ksciAXvvck0,2021-03-18T09:45:11Z,UCGYPQz_qySbPESTK8k2ky5g,How to Break Into Data Science in 2021,Are you interested in breaking into Data Science but don't know where to start? Don't worry that flying brain in the thumbnail has ...,https://i.ytimg.com/vi/ksciAXvvck0/default.jpg,120,90,https://i.ytimg.com/vi/ksciAXvvck0/mqdefault.jpg,320,180,https://i.ytimg.com/vi/ksciAXvvck0/hqdefault.jpg,480,360,Danny Ma,none,2021-03-18T09:45:11Z
4,youtube#searchResult,atb1Dr_Wd7b-jfUvlfLCI7gIb8M,youtube#video,sdrY7pA-f2I,2021-03-12T16:07:02Z,UCGYPQz_qySbPESTK8k2ky5g,Ask Danny - Live Data Science Q&amp;A,"Join me at 2PM AEDT Friday 12th March for Q&A about data science, machine learning, career advice or anything else you'd like ...",https://i.ytimg.com/vi/sdrY7pA-f2I/default.jpg,120,90,https://i.ytimg.com/vi/sdrY7pA-f2I/mqdefault.jpg,320,180,https://i.ytimg.com/vi/sdrY7pA-f2I/hqdefault.jpg,480,360,Danny Ma,none,2021-03-12T16:07:02Z
0,youtube#searchResult,hEzNLCeEDk96xqXgn1f3JFgLMWM,youtube#video,UlNt1rInC3I,2020-07-03T12:17:07Z,UCmWRF1AxelqS9hlbgI-SRWw,alb datastream1003 1080p 24fps,,https://i.ytimg.com/vi/UlNt1rInC3I/default.jpg,120,90,https://i.ytimg.com/vi/UlNt1rInC3I/mqdefault.jpg,320,180,https://i.ytimg.com/vi/UlNt1rInC3I/hqdefault.jpg,480,360,Brandon Rohrer,none,2020-07-03T12:17:07Z
0,youtube#searchResult,WQTP7nhEUTQqyJ3SznuhiiSThUU,youtube#video,SUZwYV5JYBM,2026-06-10T22:58:36Z,UCX7Y2qWriXpqocG97SFW2OQ,Growing on Purpose: The Work That Makes You. Jeremy Howard on human flourishing in the time of AI.,A talk from AI Engineer Melbourne https://webdirections.org/ai-engineer/ .,https://i.ytimg.com/vi/SUZwYV5JYBM/default.jpg,120,90,https://i.ytimg.com/vi/SUZwYV5JYBM/mqdefault.jpg,320,180,https://i.ytimg.com/vi/SUZwYV5JYBM/hqdefault.jpg,480,360,Jeremy Howard,none,2026-06-10T22:58:36Z
