,kind,etag,id.kind,id.videoId,snippet.publishedAt,snippet.channelId,snippet.title,snippet.description,snippet.thumbnails.default.url,snippet.thumbnails.default.width,snippet.thumbnails.default.height,snippet.thumbnails.medium.url,snippet.thumbnails.medium.width,snippet.thumbnails.medium.height,snippet.thumbnails.high.url,snippet.thumbnails.high.width,snippet.thumbnails.high.height,snippet.channelTitle,snippet.liveBroadcastContent,snippet.publishTime
1,youtube#searchResult,mtIYMjVVWKRfwpjlC5jwMF9rTCI,youtube#video,P4IfFLAX9hY,2019-05-07T06:50:29Z,UCxs2IIVXaEHHA4BtTiWZ2mQ,Python Software Foundation Community Report and Community Service Awards - PyCon 2019,,https://i.ytimg.com/vi/P4IfFLAX9hY/default.jpg,120,90,https://i.ytimg.com/vi/P4IfFLAX9hY/mqdefault.jpg,320,180,https://i.ytimg.com/vi/P4IfFLAX9hY/hqdefault.jpg,480,360,PyCon 2019,none,2019-05-07T06:50:29Z
2,youtube#searchResult,usl-jzAnCODGvxT33QYhGI5yUaA,youtube#video,ofuEhdzCqug,2019-05-07T06:50:29Z,UCxs2IIVXaEHHA4BtTiWZ2mQ,Briceida Mariscal - Por qué comencé mi carrera con Python y por qué tu también deberías hacerlo,Speaker: Briceida Mariscal.,https://i.ytimg.com/vi/ofuEhdzCqug/default.jpg,120,90,https://i.ytimg.com/vi/ofuEhdzCqug/mqdefault.jpg,320,180,https://i.ytimg.com/vi/ofuEhdzCqug/hqdefault.jpg,480,360,PyCon 2019,none,2019-05-07T06:50:29Z
3,youtube#searchResult,rj7vh5KNunPvxagnf9ClSiZ6nig,youtube#video,bnxxoTx9Sko,2019-05-06T03:20:46Z,UCxs2IIVXaEHHA4BtTiWZ2mQ,Sunday Lightning Talks - PyCon 2019,,https://i.ytimg.com/vi/bnxxoTx9Sko/default.jpg,120,90,https://i.ytimg.com/vi/bnxxoTx9Sko/mqdefault.jpg,320,180,https://i.ytimg.com/vi/bnxxoTx9Sko/hqdefault.jpg,480,360,PyCon 2019,none,2019-05-06T03:20:46Z
4,youtube#searchResult,nBumJwYTITdusEtVcGW5zn_xYs0,youtube#video,8dDp-UHBJ_A,2019-05-06T03:05:12Z,UCxs2IIVXaEHHA4BtTiWZ2mQ,Python Steering Council - Keynote - PyCon 2019,"""Speaker: Python Steering Council Keynote Slides can be found at: https://speakerdeck.com/pycon2019 and ...",https://i.ytimg.com/vi/8dDp-UHBJ_A/default.jpg,120,90,https://i.ytimg.com/vi/8dDp-UHBJ_A/mqdefault.jpg,320,180,https://i.ytimg.com/vi/8dDp-UHBJ_A/hqdefault.jpg,480,360,PyCon 2019,none,2019-05-06T03:05:12Z
0,youtube#searchResult,X_gkBCBHtUueKwWvEpsYGuoxUOQ,youtube#video,HqBiSY_ExDo,2021-07-31T18:50:36Z,UCYqdrfvhGxNW3vXebypqXoQ,PyOhio 2021 Opening Remarks [PyOhio 2021],Plenary Session by Dave Forgac at PyOhio 2021. Description: Welcome to PyOhio! * [Code of ...,https://i.ytimg.com/vi/HqBiSY_ExDo/default.jpg,120,90,https://i.ytimg.com/vi/HqBiSY_ExDo/mqdefault.jpg,320,180,https://i.ytimg.com/vi/HqBiSY_ExDo/hqdefault.jpg,480,360,PyOhio,none,2021-07-31T18:50:36Z
1,youtube#searchResult,fizlFNfzHRKFQEGn6f2nwo7eWK4,youtube#video,EKU9UG5vU_k,2021-07-31T18:50:36Z,UCYqdrfvhGxNW3vXebypqXoQ,How to Make Friends and Influence Users with Huggingface [PyOhio 2021],Thunder Talk by Joshua Jay Herman at PyOhio 2021. Description: This will be a tutorial based talk with a demo at the end on how ...,https://i.ytimg.com/vi/EKU9UG5vU_k/default.jpg,120,90,https://i.ytimg.com/vi/EKU9UG5vU_k/mqdefault.jpg,320,180,https://i.ytimg.com/vi/EKU9UG5vU_k/hqdefault.jpg,480,360,PyOhio,none,2021-07-31T18:50:36Z
2,youtube#searchResult,TzbbQP2bFYC1pZcnqh0_a5KSZaw,youtube#video,ZS2eZJxXdt8,2021-07-31T18:50:36Z,UCYqdrfvhGxNW3vXebypqXoQ,Avoiding the Oops with MLOps [PyOhio 2021],"Thunder Talk by Shawna Bankovich at PyOhio 2021. Description: Machine Learning (ML) projects are gaining ground in industry, ...",https://i.ytimg.com/vi/ZS2eZJxXdt8/default.jpg,120,90,https://i.ytimg.com/vi/ZS2eZJxXdt8/mqdefault.jpg,320,180,https://i.ytimg.com/vi/ZS2eZJxXdt8/hqdefault.jpg,480,360,PyOhio,none,2021-07-31T18:50:36Z
3,youtube#searchResult,xoPtwZBioqLQE3-lCRzK4uLrzy0,youtube#video,rUPIpH-mrO8,2021-07-31T18:50:36Z,UCYqdrfvhGxNW3vXebypqXoQ,Redlining Your CPU for Fun and Profit: Threading and Multiprocessing in Python [PyOhio 2021],"Thunder Talk by Alex Zharichenko at PyOhio 2021. Description: Is your Python script taking too long, and your CPU utilization too ...",https://i.ytimg.com/vi/rUPIpH-mrO8/default.jpg,120,90,https://i.ytimg.com/vi/rUPIpH-mrO8/mqdefault.jpg,320,180,https://i.ytimg.com/vi/rUPIpH-mrO8/hqdefault.jpg,480,360,PyOhio,none,2021-07-31T18:50:36Z
4,youtube#searchResult,YM5oShyguVKduuqwz3SkBUkzNwI,youtube#video,AOi0vss2pXA,2021-07-31T18:50:36Z,UCYqdrfvhGxNW3vXebypqXoQ,Combating PTSD with Machine Learning [PyOhio 2021],Featured Talk by Deborah Diller Harris at PyOhio 2021. Description: The United States is facing an urgent crisis in the treatment of ...,https://i.ytimg.com/vi/AOi0vss2pXA/default.jpg,120,90,https://i.ytimg.com/vi/AOi0vss2pXA/mqdefault.jpg,320,180,https://i.ytimg.com/vi/AOi0vss2pXA/hqdefault.jpg,480,360,PyOhio,none,2021-07-31T18:50:36Z
0,youtube#searchResult,_6G7BCWwLwKBJuctO3mvrTC2GVs,youtube#video,s2ugvkipu2Y,2021-09-15T00:45:18Z,UCS9sdEyduD9K83K3GkvQlOA,&quot;Conference Close&quot; - Richard Jones (PyConline AU 2021),"(Richard Jones) Conference close, logistics, and Sunday event information https://pretalx.com/pycon-au-2021/talk/AYP8FC/ ...",https://i.ytimg.com/vi/s2ugvkipu2Y/default.jpg,120,90,https://i.ytimg.com/vi/s2ugvkipu2Y/mqdefault.jpg,320,180,https://i.ytimg.com/vi/s2ugvkipu2Y/hqdefault.jpg,480,360,PyCon AU,none,2021-09-15T00:45:18Z
1,youtube#searchResult,dmyPUqSRn5venMC99qHydmy2cyE,youtube#video,ZF4BARKBRjc,2021-09-15T00:12:08Z,UCS9sdEyduD9K83K3GkvQlOA,&quot;Python Versions and Dependencies Made Easy&quot; - Sebastian Witowski (PyConline AU 2021),"(Sebastian Witowski) Presentation on using pyenv, virtual environments, and pipx to build an easy-to-manage Python ...",https://i.ytimg.com/vi/ZF4BARKBRjc/default.jpg,120,90,https://i.ytimg.com/vi/ZF4BARKBRjc/mqdefault.jpg,320,180,https://i.ytimg.com/vi/ZF4BARKBRjc/hqdefault.jpg,480,360,PyCon AU,none,2021-09-15T00:12:08Z
2,youtube#searchResult,XmvkeUdmesD677PZFQhNVVVpdyo,youtube#video,9_tS2N__8N0,2021-09-15T00:12:13Z,UCS9sdEyduD9K83K3GkvQlOA,"No, Maybe and Close Enough! Probabilistic Data Structures with Python and Redis",(Simon Prickett) Being right all the time isn't necessarily the best idea. This talk examines how to count distinct items from a ...,https://i.ytimg.com/vi/9_tS2N__8N0/default.jpg,120,90,https://i.ytimg.com/vi/9_tS2N__8N0/mqdefault.jpg,320,180,https://i.ytimg.com/vi/9_tS2N__8N0/hqdefault.jpg,480,360,PyCon AU,none,2021-09-15T00:12:13Z
3,youtube#searchResult,fbpZkHB-ml21n78DVVnmkPJcIRU,youtube#video,GeyiWsy5oWQ,2021-09-15T00:12:05Z,UCS9sdEyduD9K83K3GkvQlOA,&quot;What was your Python up to at 3am?&quot; - Garth Kidd (PyConline AU 2021),"(Garth Kidd) If a customer was hopping mad overnight, but your monitoring dashboard shows its usual green line at 99.5% superb ...",https://i.ytimg.com/vi/GeyiWsy5oWQ/default.jpg,120,90,https://i.ytimg.com/vi/GeyiWsy5oWQ/mqdefault.jpg,320,180,https://i.ytimg.com/vi/GeyiWsy5oWQ/hqdefault.jpg,480,360,PyCon AU,none,2021-09-15T00:12:05Z
4,youtube#searchResult,ag5ok1egkyH8x_L_SQO8mEjUjf8,youtube#video,KQZym_PmwxY,2021-09-15T00:12:01Z,UCS9sdEyduD9K83K3GkvQlOA,"&quot;Snakes all the way down, building Worlds with Python code&quot; - Sam Bishop (PyConline AU 2021)",(Sam Bishop) This talk will introduce and demonstrate a selection of procedural content generation tools built with Python.,https://i.ytimg.com/vi/KQZym_PmwxY/default.jpg,120,90,https://i.ytimg.com/vi/KQZym_PmwxY/mqdefault.jpg,320,180,https://i.ytimg.com/vi/KQZym_PmwxY/hqdefault.jpg,480,360,PyCon AU,none,2021-09-15T00:12:01Z
0,youtube#searchResult,dTuuWXQ8OSwhoCBsFGgH2Pd10TI,youtube#video,z4wSSuKuA04,2019-10-08T15:26:39Z,UCHh7vOesookNhYvupCCcJxA,Women in Tech Panel - PyLondinium 2019,The PyLondinium 2019 Women in Tech Panel has an in-depth discussion about promoting diversity and inclusion in the work ...,https://i.ytimg.com/vi/z4wSSuKuA04/default.jpg,120,90,https://i.ytimg.com/vi/z4wSSuKuA04/mqdefault.jpg,320,180,https://i.ytimg.com/vi/z4wSSuKuA04/hqdefault.jpg,480,360,PyLondinium,none,2019-10-08T15:26:39Z
1,youtube#searchResult,f5PiBsN6S5gl9mMmdLSsIpO6rfc,youtube#video,xNuz3WEk6AE,2019-10-08T13:55:09Z,UCHh7vOesookNhYvupCCcJxA,Keynote: The M Word - Anna Ossowski - PyLondinium19,"In a world where you can be anything, be kind. ** Copyright belongs to the speaker **",https://i.ytimg.com/vi/xNuz3WEk6AE/default.jpg,120,90,https://i.ytimg.com/vi/xNuz3WEk6AE/mqdefault.jpg,320,180,https://i.ytimg.com/vi/xNuz3WEk6AE/hqdefault.jpg,480,360,PyLondinium,none,2019-10-08T13:55:09Z
2,youtube#searchResult,TSZAVa5o-IyS1QXFwdFAVn5pVmo,youtube#video,OSnRl8yF9a4,2019-09-18T17:05:11Z,UCHh7vOesookNhYvupCCcJxA,How to best package your library? - Bernát Gábor - PyLondinium19,"One of the most fundamental principles of programming is ""don't repeat yourself."" Join me in finding out how you can achieve ...",https://i.ytimg.com/vi/OSnRl8yF9a4/default.jpg,120,90,https://i.ytimg.com/vi/OSnRl8yF9a4/mqdefault.jpg,320,180,https://i.ytimg.com/vi/OSnRl8yF9a4/hqdefault.jpg,480,360,PyLondinium,none,2019-09-18T17:05:11Z
3,youtube#searchResult,BHWuajEAR_z23VzOu-s3L8dVn_U,youtube#video,avLK67SHeAs,2019-09-18T17:00:14Z,UCHh7vOesookNhYvupCCcJxA,The soul of the beast: Everything about Python’s grammar - Pablo Galindo Salgado - PyLondinium19,We will try to answer a straightforward question: What makes Python so easy to learn and read? Other languages also have a ...,https://i.ytimg.com/vi/avLK67SHeAs/default.jpg,120,90,https://i.ytimg.com/vi/avLK67SHeAs/mqdefault.jpg,320,180,https://i.ytimg.com/vi/avLK67SHeAs/hqdefault.jpg,480,360,PyLondinium,none,2019-09-18T17:00:14Z
4,youtube#searchResult,X2oT2KmWdHRBMWt_3QBDc1SNxJQ,youtube#video,WOlLYckxeLc,2019-09-18T16:42:10Z,UCHh7vOesookNhYvupCCcJxA,The Adventures of pip and pacman: A Tale of Package Managers - László Kiss Kollár - PyLondinium19,Overview Installing Python packages can be frustrating for new (and even not so new) users of Python. If we simply follow the ...,https://i.ytimg.com/vi/WOlLYckxeLc/default.jpg,120,90,https://i.ytimg.com/vi/WOlLYckxeLc/mqdefault.jpg,320,180,https://i.ytimg.com/vi/WOlLYckxeLc/hqdefault.jpg,480,360,PyLondinium,none,2019-09-18T16:42:10Z
0,youtube#searchResult,8XjtSJUC8YdzadTmwKy5MzKeQzI,youtube#video,TFdnGcnP_5M,2019-12-05T22:51:57Z,UChA9XP_feY1-1oSy2L7acog,PyCon UK Society 2018 AGM,,https://i.ytimg.com/vi/TFdnGcnP_5M/default.jpg,120,90,https://i.ytimg.com/vi/TFdnGcnP_5M/mqdefault.jpg,320,180,https://i.ytimg.com/vi/TFdnGcnP_5M/hqdefault.jpg,480,360,PyCon UK,none,2019-12-05T22:51:57Z
1,youtube#searchResult,12Rg_Fcp6MqSCRNLRpBQ991a0N4,youtube#video,f4ZWRzFpkO0,2019-12-05T22:36:39Z,UChA9XP_feY1-1oSy2L7acog,PyCon UK Society 2017 AGM,,https://i.ytimg.com/vi/f4ZWRzFpkO0/default.jpg,120,90,https://i.ytimg.com/vi/f4ZWRzFpkO0/mqdefault.jpg,320,180,https://i.ytimg.com/vi/f4ZWRzFpkO0/hqdefault.jpg,480,360,PyCon UK,none,2019-12-05T22:36:39Z
2,youtube#searchResult,W8X8SHhJV060V0VuhOUUbb1QcNA,youtube#video,OIqz7NMyW4E,2019-10-07T15:38:59Z,UChA9XP_feY1-1oSy2L7acog,Technical Debt Remediation in a Massive Python Codebase,Irit Katriel The Quartz engineering team at Bank of America hosts one of the world's largest python codebases. Changes in core ...,https://i.ytimg.com/vi/OIqz7NMyW4E/default.jpg,120,90,https://i.ytimg.com/vi/OIqz7NMyW4E/mqdefault.jpg,320,180,https://i.ytimg.com/vi/OIqz7NMyW4E/hqdefault.jpg,480,360,PyCon UK,none,2019-10-07T15:38:59Z
3,youtube#searchResult,TZKTE88V0PlRIv8mFMRGdciM3fY,youtube#video,J3S3Ng9xNN4,2019-09-19T21:14:53Z,UChA9XP_feY1-1oSy2L7acog,UK Python Association AGM 2019,"The 2019 AGM of the UK Python Association, hosted by Owen Campbell.",https://i.ytimg.com/vi/J3S3Ng9xNN4/default.jpg,120,90,https://i.ytimg.com/vi/J3S3Ng9xNN4/mqdefault.jpg,320,180,https://i.ytimg.com/vi/J3S3Ng9xNN4/hqdefault.jpg,480,360,PyCon UK,none,2019-09-19T21:14:53Z
4,youtube#searchResult,c6QmQ0kAO4Lc9f_VAh_UYBlgohw,youtube#video,t35wB-R6mr4,2019-09-17T15:52:01Z,UChA9XP_feY1-1oSy2L7acog,Hangar  git for your data,Richard Izzo Software development is entering an era where the behavior of programs critically depends on the data they were ...,https://i.ytimg.com/vi/t35wB-R6mr4/default.jpg,120,90,https://i.ytimg.com/vi/t35wB-R6mr4/mqdefault.jpg,320,180,https://i.ytimg.com/vi/t35wB-R6mr4/hqdefault.jpg,480,360,PyCon UK,none,2019-09-17T15:52:01Z
0,youtube#searchResult,7ESfRmzfRP8c84LBfCyuhdVWnu4,youtube#video,rGhCgONDVzc,2022-02-08T20:00:15Z,UC51aOZF5nnderbuar5D5ifw,Creating GUIs with PySimpleGUI - Michael Driscoll,"SF Python Meetup January 19, 2022 Learn how to create cross-platform GUIs using Python and PySimpleGUI. The PySimpleGUI ...",https://i.ytimg.com/vi/rGhCgONDVzc/default.jpg,120,90,https://i.ytimg.com/vi/rGhCgONDVzc/mqdefault.jpg,320,180,https://i.ytimg.com/vi/rGhCgONDVzc/hqdefault.jpg,480,360,SF Python,none,2022-02-08T20:00:15Z
1,youtube#searchResult,mB5r8Fu8LysoZule7BaobESTpB8,youtube#video,53UKm9AJ4v4,2022-02-08T20:00:17Z,UC51aOZF5nnderbuar5D5ifw,Building Pytest Plug Ins - Phebe Polk,"SF Python Meetup January 19, 2022 Learn how to build a plugin and what makes a pytest plug in a pytest plug in. Check out SF ...",https://i.ytimg.com/vi/53UKm9AJ4v4/default.jpg,120,90,https://i.ytimg.com/vi/53UKm9AJ4v4/mqdefault.jpg,320,180,https://i.ytimg.com/vi/53UKm9AJ4v4/hqdefault.jpg,480,360,SF Python,none,2022-02-08T20:00:17Z
2,youtube#searchResult,GRJRpJXj1qhnoMJmVKPNm5viTm0,youtube#video,KgYZtlbFYXE,2022-01-05T22:20:39Z,UC51aOZF5nnderbuar5D5ifw,Ray Tune: Distributed Hyperparameter Optimization Made Simple - Xiaowei Jiang,This talk was presented at PyBay2021 Food Truck Edition - 6th annual Bay Area Regional Python conference. See pybay.com for ...,https://i.ytimg.com/vi/KgYZtlbFYXE/default.jpg,120,90,https://i.ytimg.com/vi/KgYZtlbFYXE/mqdefault.jpg,320,180,https://i.ytimg.com/vi/KgYZtlbFYXE/hqdefault.jpg,480,360,SF Python,none,2022-01-05T22:20:39Z
3,youtube#searchResult,I1EEl7cnH94veoBYqmpm3uqMUeQ,youtube#video,B1eOov0PGUQ,2022-01-05T22:10:25Z,UC51aOZF5nnderbuar5D5ifw,Python Typing - Michael Sullivan,This talk was presented at PyBay2021 Food Truck Edition - 6th annual Bay Area Regional Python conference. See pybay.com for ...,https://i.ytimg.com/vi/B1eOov0PGUQ/default.jpg,120,90,https://i.ytimg.com/vi/B1eOov0PGUQ/mqdefault.jpg,320,180,https://i.ytimg.com/vi/B1eOov0PGUQ/hqdefault.jpg,480,360,SF Python,none,2022-01-05T22:10:25Z
4,youtube#searchResult,zyzX52oYflu-9Lp5Zi-svDyFJes,youtube#video,WZWfeVp_Muo,2022-01-05T22:00:31Z,UC51aOZF5nnderbuar5D5ifw,Checkov: A Python based Static Code Analysis Tool for Infrastructure-As-Code - Austin Bennett,This talk was presented at PyBay2021 Food Truck Edition - 6th annual Bay Area Regional Python conference. See pybay.com for ...,https://i.ytimg.com/vi/WZWfeVp_Muo/default.jpg,120,90,https://i.ytimg.com/vi/WZWfeVp_Muo/mqdefault.jpg,320,180,https://i.ytimg.com/vi/WZWfeVp_Muo/hqdefault.jpg,480,360,SF Python,none,2022-01-05T22:00:31Z
0,youtube#searchResult,oSblq2UPoXWdMy5f8owaPuerAlA,youtube#video,a8smnNogLQU,2022-05-16T18:24:58Z,UCEhI2CfdT5--TYq47K4en4A,PyBCN Meetup 2022/03/04 Aprendizaje a través de grafos: Graph Neural Networks by @camilo_chacon_s,Python Barcelona https://pybcn.org ➡️ What: Aprendizaje a través de grafos: Graph Neural Networks Who: Camilo Chacón ...,https://i.ytimg.com/vi/a8smnNogLQU/default.jpg,120,90,https://i.ytimg.com/vi/a8smnNogLQU/mqdefault.jpg,320,180,https://i.ytimg.com/vi/a8smnNogLQU/hqdefault.jpg,480,360,Python Barcelona,none,2022-05-16T18:24:58Z
1,youtube#searchResult,d9VgfiVdct1g5zUybnCjqmnslE4,youtube#video,j7pTZtDUeRc,2022-05-10T09:29:50Z,UCEhI2CfdT5--TYq47K4en4A,PyBCN Meetup 2022/04/21 Shorter feedback loop by running impacted tests only by Mathieu Kniewallner,"Python Barcelona https://pybcn.org At BackMarket, we have dozens of developers working on our Django monolith that holds ...",https://i.ytimg.com/vi/j7pTZtDUeRc/default.jpg,120,90,https://i.ytimg.com/vi/j7pTZtDUeRc/mqdefault.jpg,320,180,https://i.ytimg.com/vi/j7pTZtDUeRc/hqdefault.jpg,480,360,Python Barcelona,none,2022-05-10T09:29:50Z
2,youtube#searchResult,Haa5QzcrJGdpLq1oJdvuUgJzH58,youtube#video,pOg3IbFEnlw,2022-04-27T20:34:43Z,UCEhI2CfdT5--TYq47K4en4A,PyBCN Meetup 2022/03/24 Telegram bots - From idea to production by Ferran Jovell,"Python Barcelona https://pybcn.org Ferran Jovell (@MrSwats) did his bachelor's in physics, then a master in applied mathematics, ...",https://i.ytimg.com/vi/pOg3IbFEnlw/default.jpg,120,90,https://i.ytimg.com/vi/pOg3IbFEnlw/mqdefault.jpg,320,180,https://i.ytimg.com/vi/pOg3IbFEnlw/hqdefault.jpg,480,360,Python Barcelona,none,2022-04-27T20:34:43Z
3,youtube#searchResult,cf8xkOHa_v8dgxKUQXWC0v-rIzs,youtube#video,Ga5Wiq0swS8,2021-10-28T06:09:47Z,UCEhI2CfdT5--TYq47K4en4A,PyBCN Meetup 2021/10/27 Wardley mapping the Python Barcelona Association,Meetup: https://www.meetup.com/python-barcelona/events/281570632/ - Miro: ...,https://i.ytimg.com/vi/Ga5Wiq0swS8/default.jpg,120,90,https://i.ytimg.com/vi/Ga5Wiq0swS8/mqdefault.jpg,320,180,https://i.ytimg.com/vi/Ga5Wiq0swS8/hqdefault.jpg,480,360,Python Barcelona,none,2021-10-28T06:09:47Z
4,youtube#searchResult,KaFGhcbwEX7Nw1I0eXfRItQpWG4,youtube#video,4kY7IfWJ_Mg,2021-05-20T17:00:15Z,UCEhI2CfdT5--TYq47K4en4A,PyBCN Meetup 2021/05/20 A principled approach to authorization with SQLAlchemy by Sam Scott,"Python Barcelona https://pybcn.org Sam Scott (https://twitter.com/samososos), CTO at oso, an NYC-based startup building an ...",https://i.ytimg.com/vi/4kY7IfWJ_Mg/default.jpg,120,90,https://i.ytimg.com/vi/4kY7IfWJ_Mg/mqdefault.jpg,320,180,https://i.ytimg.com/vi/4kY7IfWJ_Mg/hqdefault.jpg,480,360,Python Barcelona,none,2021-05-20T17:00:15Z
0,youtube#searchResult,BuuQ5Zhwlb6Bn8k897aaU53PxJw,youtube#video,mu7yct6hOSA,2022-03-21T19:44:04Z,UC6HfeAa0vWeSWS6IcNAjZ2A,Publishing a Python package on pip [PythonLiveLessons #6],"Episode 6 of #PythonLiveLessons, a weekly live stream about Python code and more, hosted by Sebastiaan Mathôt.",https://i.ytimg.com/vi/mu7yct6hOSA/default.jpg,120,90,https://i.ytimg.com/vi/mu7yct6hOSA/mqdefault.jpg,320,180,https://i.ytimg.com/vi/mu7yct6hOSA/hqdefault.jpg,480,360,Sebastiaan Mathôt,none,2022-03-21T19:44:04Z
1,youtube#searchResult,B21Ut7t_QtdpnVrP1GEvOss3kDE,youtube#video,ej3S30nC8Io,2022-03-16T20:21:46Z,UC6HfeAa0vWeSWS6IcNAjZ2A,Documenting Python code (docstrings) [PythonLiveLessons #5],"The sixth episode of #PythonLiveLessons, a weekly live stream about Python code and more, hosted by Sebastiaan Mathôt.",https://i.ytimg.com/vi/ej3S30nC8Io/default.jpg,120,90,https://i.ytimg.com/vi/ej3S30nC8Io/mqdefault.jpg,320,180,https://i.ytimg.com/vi/ej3S30nC8Io/hqdefault.jpg,480,360,Sebastiaan Mathôt,none,2022-03-16T20:21:46Z
2,youtube#searchResult,4soOmBa5Pqcn5DfITBNZRI6w2NI,youtube#video,vX83-7G0Qm0,2022-03-16T05:33:29Z,UC6HfeAa0vWeSWS6IcNAjZ2A,PythonLiveLessons #6: Publishing a Python package on pip,"This is the seventh episode of #PythonLiveLessons, a weekly live stream about Python code and more, hosted by Sebastiaan ...",https://i.ytimg.com/vi/vX83-7G0Qm0/default.jpg,120,90,https://i.ytimg.com/vi/vX83-7G0Qm0/mqdefault.jpg,320,180,https://i.ytimg.com/vi/vX83-7G0Qm0/hqdefault.jpg,480,360,Sebastiaan Mathôt,none,2022-03-16T05:33:29Z
3,youtube#searchResult,RF0NOa5t3BfPdfMWgJWzgb2SMgw,youtube#video,f4ZQ-_Sft0I,2022-03-09T05:35:13Z,UC6HfeAa0vWeSWS6IcNAjZ2A,PythonLiveLessons #5: Documenting your Python project,"This is the sixth episode of #PythonLiveLessons, a weekly live stream about Python code and more, hosted by Sebastiaan Mathôt.",https://i.ytimg.com/vi/f4ZQ-_Sft0I/default.jpg,120,90,https://i.ytimg.com/vi/f4ZQ-_Sft0I/mqdefault.jpg,320,180,https://i.ytimg.com/vi/f4ZQ-_Sft0I/hqdefault.jpg,480,360,Sebastiaan Mathôt,none,2022-03-09T05:35:13Z
4,youtube#searchResult,ps_tJy4HF6rbOZj495-y_Aixw8A,youtube#video,VcgBAwdz7aA,2022-03-07T20:03:37Z,UC6HfeAa0vWeSWS6IcNAjZ2A,Creating a command-line app in Python [PythonLiveLessons #4],"The fifth episode of #PythonLiveLessons, a weekly live stream about Python code and more, hosted by Sebastiaan Mathôt. In this ...",https://i.ytimg.com/vi/VcgBAwdz7aA/default.jpg,120,90,https://i.ytimg.com/vi/VcgBAwdz7aA/mqdefault.jpg,320,180,https://i.ytimg.com/vi/VcgBAwdz7aA/hqdefault.jpg,480,360,Sebastiaan Mathôt,none,2022-03-07T20:03:37Z
0,youtube#searchResult,nbmb-szbrMiq1460QScMkf135KA,youtube#video,-8Kn_2MBMOA,2022-05-19T04:14:33Z,UCDVL0bPrZHwCeJrlyy-wxaQ,DIY AI with Cognitive Services,About the session Is AI really rocket science? What if we told you all you need is a function call to make your application intelligent ...,https://i.ytimg.com/vi/-8Kn_2MBMOA/default.jpg,120,90,https://i.ytimg.com/vi/-8Kn_2MBMOA/mqdefault.jpg,320,180,https://i.ytimg.com/vi/-8Kn_2MBMOA/hqdefault.jpg,480,360,Global AI Community,none,2022-05-19T04:14:33Z
1,youtube#searchResult,msYpsI9RIa8KvpT83CEbvurt2wY,youtube#video,k0uPwMO-4c4,2022-05-05T04:08:57Z,UCDVL0bPrZHwCeJrlyy-wxaQ,Home Automation with Azure Percept,"About the session In this demo heavy talk, we run through using the Azure Percept Audio Module to control common appliances ...",https://i.ytimg.com/vi/k0uPwMO-4c4/default.jpg,120,90,https://i.ytimg.com/vi/k0uPwMO-4c4/mqdefault.jpg,320,180,https://i.ytimg.com/vi/k0uPwMO-4c4/hqdefault.jpg,480,360,Global AI Community,none,2022-05-05T04:08:57Z
2,youtube#searchResult,r4GgMJMb4x0ZCpAAQGc44pvQ--E,youtube#video,_-xLOC65gPs,2022-04-27T08:00:12Z,UCDVL0bPrZHwCeJrlyy-wxaQ,AI in Neonatal Care,"The neonatal period is the first 28 days of life, which is the stage of developing physiological adaptations for extra-uterine life.",https://i.ytimg.com/vi/_-xLOC65gPs/default.jpg,120,90,https://i.ytimg.com/vi/_-xLOC65gPs/mqdefault.jpg,320,180,https://i.ytimg.com/vi/_-xLOC65gPs/hqdefault.jpg,480,360,Global AI Community,none,2022-04-27T08:00:12Z
3,youtube#searchResult,z4L9CFBkxfv8gfxQ2UVj9GCoj_I,youtube#video,bbMqn2XvLxc,2022-04-21T04:02:15Z,UCDVL0bPrZHwCeJrlyy-wxaQ,Building your lakehouse in Azure,About the session: By attending this session you will gain a better understand why data lakehouse is becoming popular. You will ...,https://i.ytimg.com/vi/bbMqn2XvLxc/default.jpg,120,90,https://i.ytimg.com/vi/bbMqn2XvLxc/mqdefault.jpg,320,180,https://i.ytimg.com/vi/bbMqn2XvLxc/hqdefault.jpg,480,360,Global AI Community,none,2022-04-21T04:02:15Z
4,youtube#searchResult,verwEQA6dKW8qodyKxU69xynbPE,youtube#video,X8SLihyeeJE,2022-04-07T04:07:23Z,UCDVL0bPrZHwCeJrlyy-wxaQ,Machine Learning in Power BI,About the session Machine learning is a branch of artificial intelligence (AI) and computer science which focuses on the use of ...,https://i.ytimg.com/vi/X8SLihyeeJE/default.jpg,120,90,https://i.ytimg.com/vi/X8SLihyeeJE/mqdefault.jpg,320,180,https://i.ytimg.com/vi/X8SLihyeeJE/hqdefault.jpg,480,360,Global AI Community,none,2022-04-07T04:07:23Z
0,youtube#searchResult,6OLJwRDdmbtsNSpcZ16nfAA9MFQ,youtube#video,zCvYmbP1esc,2022-05-22T19:07:40Z,UCxArXLI-gxlTmWGGgec5D7w,`begin` and `let` in Julia -Learn Julia 12/n-,You can buy me a coffee on Tipeee: https://fr.tipeee.com/remi-vezy What are `begin...end` statements ? What is the difference with ...,https://i.ytimg.com/vi/zCvYmbP1esc/default.jpg,120,90,https://i.ytimg.com/vi/zCvYmbP1esc/mqdefault.jpg,320,180,https://i.ytimg.com/vi/zCvYmbP1esc/hqdefault.jpg,480,360,Rémi Vezy,none,2022-05-22T19:07:40Z
1,youtube#searchResult,KQcN-a2cuWtP3sQeXNlltED7z_Q,youtube#video,yZwHgdAEx5Q,2022-04-24T19:46:02Z,UCxArXLI-gxlTmWGGgec5D7w,String operators in Julia -Learn Julia 11/n-,You can buy me a coffee on Tipeee: https://fr.tipeee.com/remi-vezy What is a string? What is the difference with characters?,https://i.ytimg.com/vi/yZwHgdAEx5Q/default.jpg,120,90,https://i.ytimg.com/vi/yZwHgdAEx5Q/mqdefault.jpg,320,180,https://i.ytimg.com/vi/yZwHgdAEx5Q/hqdefault.jpg,480,360,Rémi Vezy,none,2022-04-24T19:46:02Z
2,youtube#searchResult,1_JL3hGrsqCdj1YbYEYxSoTRzvU,youtube#video,k2aGzLvN4uA,2022-02-13T17:24:52Z,UCxArXLI-gxlTmWGGgec5D7w,Basic operators in Julia -Learn Julia 10/n-,You can buy me a coffee on Tipeee: https://fr.tipeee.com/remi-vezy Want to know what is the synthax of the basic operators in Julia ...,https://i.ytimg.com/vi/k2aGzLvN4uA/default.jpg,120,90,https://i.ytimg.com/vi/k2aGzLvN4uA/mqdefault.jpg,320,180,https://i.ytimg.com/vi/k2aGzLvN4uA/hqdefault.jpg,480,360,Rémi Vezy,none,2022-02-13T17:24:52Z
3,youtube#searchResult,tKCCqY0W8q-l6URf1OUVK5xPREE,youtube#video,3Anx7csWSkc,2021-05-11T19:58:20Z,UCxArXLI-gxlTmWGGgec5D7w,Dictionaries in Julia -Learn Julia 9/n-,You can buy me a coffee on Tipeee: https://fr.tipeee.com/remi-vezy What is a dictionary? In which context they are used? What are ...,https://i.ytimg.com/vi/3Anx7csWSkc/default.jpg,120,90,https://i.ytimg.com/vi/3Anx7csWSkc/mqdefault.jpg,320,180,https://i.ytimg.com/vi/3Anx7csWSkc/hqdefault.jpg,480,360,Rémi Vezy,none,2021-05-11T19:58:20Z
4,youtube#searchResult,yrQy1aW3_PJY26pMsY7KYaHQEZE,youtube#video,pYTw1LGbRm0,2021-04-19T22:22:10Z,UCxArXLI-gxlTmWGGgec5D7w,Tuples in Julia -Learn Julia 8/n-,You can buy me a coffee on Tipeee: https://fr.tipeee.com/remi-vezy What is a tuple? In which context they are used? What are their ...,https://i.ytimg.com/vi/pYTw1LGbRm0/default.jpg,120,90,https://i.ytimg.com/vi/pYTw1LGbRm0/mqdefault.jpg,320,180,https://i.ytimg.com/vi/pYTw1LGbRm0/hqdefault.jpg,480,360,Rémi Vezy,none,2021-04-19T22:22:10Z
0,youtube#searchResult,nz2ZHzSk9NblsG4Wq-ITPj14zkg,youtube#video,5VjEBHWuYs8,2022-05-27T20:04:57Z,UCupQLyNchb9-2Z5lmUOIijw,09P – Contrastive joint embedding methods (JEMs) for self-supervised learning (SSL),Course website: http://bit.ly/DLSP21-home Playlist: http://bit.ly/DLSP22-YouTube Speaker: Jiachen Zhu (朱家晨) Chapters ...,https://i.ytimg.com/vi/5VjEBHWuYs8/default.jpg,120,90,https://i.ytimg.com/vi/5VjEBHWuYs8/mqdefault.jpg,320,180,https://i.ytimg.com/vi/5VjEBHWuYs8/hqdefault.jpg,480,360,Alfredo Canziani,none,2022-05-27T20:04:57Z
