,kind,etag,id.kind,id.videoId,snippet.publishedAt,snippet.channelId,snippet.title,snippet.description,snippet.thumbnails.default.url,snippet.thumbnails.default.width,snippet.thumbnails.default.height,snippet.thumbnails.medium.url,snippet.thumbnails.medium.width,snippet.thumbnails.medium.height,snippet.thumbnails.high.url,snippet.thumbnails.high.width,snippet.thumbnails.high.height,snippet.channelTitle,snippet.liveBroadcastContent,snippet.publishTime
0,youtube#searchResult,GECnadXw2MkSRTTSkJJvJF3THac,youtube#video,1rQp5r6vbT8,2025-11-17T15:37:42Z,UCOjD18EJYcsBog4IozkF_7w,Everett Kleven - Why Models Break Your Pipelines | PyData Seattle 2025,"Most AI pipelines still treat models like Python UDFs, just another function bolted onto Spark, Pandas, or Ray. But models aren't ...",https://i.ytimg.com/vi/1rQp5r6vbT8/default.jpg,120,90,https://i.ytimg.com/vi/1rQp5r6vbT8/mqdefault.jpg,320,180,https://i.ytimg.com/vi/1rQp5r6vbT8/hqdefault.jpg,480,360,PyData,none,2025-11-17T15:37:42Z
1,youtube#searchResult,PurHxC-d_nFjQqBeKxB0KmpLxvU,youtube#video,Lypf_qNaeQs,2025-11-17T15:37:37Z,UCOjD18EJYcsBog4IozkF_7w,JustinCastilla - There and back again... by ferry or I-5? | PyData Seattle 2025,"Living on Washington State's peninsula offers endless beauty, nature, and commuting challenges. In this talk, I'll share how I built ...",https://i.ytimg.com/vi/Lypf_qNaeQs/default.jpg,120,90,https://i.ytimg.com/vi/Lypf_qNaeQs/mqdefault.jpg,320,180,https://i.ytimg.com/vi/Lypf_qNaeQs/hqdefault.jpg,480,360,PyData,none,2025-11-17T15:37:37Z
2,youtube#searchResult,lXrwNG4EE-WWWBdE4B4GduANSVM,youtube#video,smUeNnB6Xbs,2025-11-17T15:37:45Z,UCOjD18EJYcsBog4IozkF_7w,Sebastian Duerr - Evaluation is all you need | PyData Seattle 2025,"LLM apps fail without reliable, reproducible evaluation. This talk maps the open‑source evaluation landscape, compares leading ...",https://i.ytimg.com/vi/smUeNnB6Xbs/default.jpg,120,90,https://i.ytimg.com/vi/smUeNnB6Xbs/mqdefault.jpg,320,180,https://i.ytimg.com/vi/smUeNnB6Xbs/hqdefault.jpg,480,360,PyData,none,2025-11-17T15:37:45Z
3,youtube#searchResult,I8PWNuFZW94okme9cl1hXpXuBQo,youtube#video,uWxR845ciCI,2025-11-17T15:37:40Z,UCOjD18EJYcsBog4IozkF_7w,Denny Lee - Building Agents with Agent Bricks and MCP | PyData Seattle 2025,Want to create AI agents that can do more than just generate text? Join us to explore how combining Databricks' Agent Bricks with ...,https://i.ytimg.com/vi/uWxR845ciCI/default.jpg,120,90,https://i.ytimg.com/vi/uWxR845ciCI/mqdefault.jpg,320,180,https://i.ytimg.com/vi/uWxR845ciCI/hqdefault.jpg,480,360,PyData,none,2025-11-17T15:37:40Z
4,youtube#searchResult,hJpgS1P-FTupPECubgM4oTm5qOM,youtube#video,Hfspu0UO2Sc,2025-11-17T15:37:47Z,UCOjD18EJYcsBog4IozkF_7w,Rajesh - Securing Retrieval-Augmented Generation | PyData Seattle 2025,Modern LLM applications rely heavily on embeddings and vector databases for retrieval-augmented generation (RAG).,https://i.ytimg.com/vi/Hfspu0UO2Sc/default.jpg,120,90,https://i.ytimg.com/vi/Hfspu0UO2Sc/mqdefault.jpg,320,180,https://i.ytimg.com/vi/Hfspu0UO2Sc/hqdefault.jpg,480,360,PyData,none,2025-11-17T15:37:47Z
5,youtube#searchResult,yKDRvZk2wpr6gVPjjQXQQTbrKrk,youtube#video,sM9PO_dfDhI,2025-11-17T15:37:01Z,UCOjD18EJYcsBog4IozkF_7w,Noor Aftab - The Missing 78% | PyData Seattle 2025,"Women make up only 22% of data and AI roles and contribute just 3% of Python commits, leaving a “missing 78%” of untapped ...",https://i.ytimg.com/vi/sM9PO_dfDhI/default.jpg,120,90,https://i.ytimg.com/vi/sM9PO_dfDhI/mqdefault.jpg,320,180,https://i.ytimg.com/vi/sM9PO_dfDhI/hqdefault.jpg,480,360,PyData,none,2025-11-17T15:37:01Z
6,youtube#searchResult,VeDAZneQoAVzwkFm3RZL2OqF5Uc,youtube#video,u3aFp78BTno,2025-11-17T15:36:10Z,UCOjD18EJYcsBog4IozkF_7w,Allison Wang &amp; Shujing Yang - Polars on Spark | PyData Seattle 2025,PySpark's Arrow-based Python UDFs open the door to dramatically faster data processing by avoiding expensive serialization ...,https://i.ytimg.com/vi/u3aFp78BTno/default.jpg,120,90,https://i.ytimg.com/vi/u3aFp78BTno/mqdefault.jpg,320,180,https://i.ytimg.com/vi/u3aFp78BTno/hqdefault.jpg,480,360,PyData,none,2025-11-17T15:36:10Z
7,youtube#searchResult,AFiwpn9VMDleq0m2gDumNmY-S_U,youtube#video,KCRKbY8ewH0,2025-11-17T15:35:59Z,UCOjD18EJYcsBog4IozkF_7w,Keynote: Zaheera Valani - Driving Data Democratization with the Databricks | PyData Seattle 2025,Driving Data Democratization with the Databricks Data Intelligence Platform www.pydata.org PyData is an educational program of ...,https://i.ytimg.com/vi/KCRKbY8ewH0/default.jpg,120,90,https://i.ytimg.com/vi/KCRKbY8ewH0/mqdefault.jpg,320,180,https://i.ytimg.com/vi/KCRKbY8ewH0/hqdefault.jpg,480,360,PyData,none,2025-11-17T15:35:59Z
8,youtube#searchResult,dxmL_4M-dIBNBxkjPJZN7lLNDrs,youtube#video,uapsxFc1D5o,2025-11-17T15:36:19Z,UCOjD18EJYcsBog4IozkF_7w,Weston Pace - Data Loading for Data Engineers | PyData Seattle 2025,Data scientists need data to train their models. The process of feeding the training algorithm with data is loosely described as ...,https://i.ytimg.com/vi/uapsxFc1D5o/default.jpg,120,90,https://i.ytimg.com/vi/uapsxFc1D5o/mqdefault.jpg,320,180,https://i.ytimg.com/vi/uapsxFc1D5o/hqdefault.jpg,480,360,PyData,none,2025-11-17T15:36:19Z
9,youtube#searchResult,JpVXexCjap4pgzHdgcRgOokSrCQ,youtube#video,u4L4mUmuO9o,2025-11-17T15:36:38Z,UCOjD18EJYcsBog4IozkF_7w,Panel: Building Data-Driven Startups with User-Centric Design | PyData Seattle 2025,"Yinhan Liu, Pedro Luraschi, Joshua Ahmed & Yujian Tang Creating successful data products requires more than just powerful ...",https://i.ytimg.com/vi/u4L4mUmuO9o/default.jpg,120,90,https://i.ytimg.com/vi/u4L4mUmuO9o/mqdefault.jpg,320,180,https://i.ytimg.com/vi/u4L4mUmuO9o/hqdefault.jpg,480,360,PyData,none,2025-11-17T15:36:38Z
10,youtube#searchResult,vnoZOZA8pe3nhsFH_mNrxlvpVyI,youtube#video,Hc-EH-NfbRg,2025-11-17T15:37:08Z,UCOjD18EJYcsBog4IozkF_7w,Ojas Ankurbhai Ramwala - Explainable AI for Biomedical Image Processing | PyData Seattle 2025,Advancements in deep learning for biomedical image processing have led to the development of promising algorithms across ...,https://i.ytimg.com/vi/Hc-EH-NfbRg/default.jpg,120,90,https://i.ytimg.com/vi/Hc-EH-NfbRg/mqdefault.jpg,320,180,https://i.ytimg.com/vi/Hc-EH-NfbRg/hqdefault.jpg,480,360,PyData,none,2025-11-17T15:37:08Z
11,youtube#searchResult,ThRhoKWlrGEeetxnxiJAE_sQwow,youtube#video,sMKOp3-EmD0,2025-11-17T15:36:29Z,UCOjD18EJYcsBog4IozkF_7w,Pedro Albuquerque - Generalized Additive Models: Explainability Strikes Back | PyData Seattle 2025,Generalized Additive Models (GAMs) strike a rare balance: they combine the flexibility of complex models with the clarity of simple ...,https://i.ytimg.com/vi/sMKOp3-EmD0/default.jpg,120,90,https://i.ytimg.com/vi/sMKOp3-EmD0/mqdefault.jpg,320,180,https://i.ytimg.com/vi/sMKOp3-EmD0/hqdefault.jpg,480,360,PyData,none,2025-11-17T15:36:29Z
12,youtube#searchResult,FitTsA6YQEvFymF3LHSMd0N0j0k,youtube#video,qeIP6XYFJHA,2025-11-17T15:35:50Z,UCOjD18EJYcsBog4IozkF_7w,John Carney- Building valuable Deterministic products in a Probabilistic world | PyData Seattle 2025,For the first time in computing history the paradigm of designing applications is following a probabilistic approach rather than a ...,https://i.ytimg.com/vi/qeIP6XYFJHA/default.jpg,120,90,https://i.ytimg.com/vi/qeIP6XYFJHA/mqdefault.jpg,320,180,https://i.ytimg.com/vi/qeIP6XYFJHA/hqdefault.jpg,480,360,PyData,none,2025-11-17T15:35:50Z
13,youtube#searchResult,EJ7SJlvzH7O6jDc61CtMxozag1w,youtube#video,gTYSbbDBYNQ,2025-11-17T15:35:47Z,UCOjD18EJYcsBog4IozkF_7w,Dr. Jim Dowling - Real-TIme Context Engineering for Agents | PyData Seattle 2025,Agents need timely and relevant context data to work effectively in an interactive environment. If an agent takes more than a few ...,https://i.ytimg.com/vi/gTYSbbDBYNQ/default.jpg,120,90,https://i.ytimg.com/vi/gTYSbbDBYNQ/mqdefault.jpg,320,180,https://i.ytimg.com/vi/gTYSbbDBYNQ/hqdefault.jpg,480,360,PyData,none,2025-11-17T15:35:47Z
14,youtube#searchResult,jUSahQ1aCBJCsTGWTs46V6FM7tM,youtube#video,ytRvvJgNdco,2025-11-17T15:36:16Z,UCOjD18EJYcsBog4IozkF_7w,Devin Petersohn - We don&#39;t dataframe shame: A love letter to dataframes | PyData Seattle 2025,"This lighthearted educational talk explores the wild west of dataframes. We discuss where dataframes got their origin (it wasn't R), ...",https://i.ytimg.com/vi/ytRvvJgNdco/default.jpg,120,90,https://i.ytimg.com/vi/ytRvvJgNdco/mqdefault.jpg,320,180,https://i.ytimg.com/vi/ytRvvJgNdco/hqdefault.jpg,480,360,PyData,none,2025-11-17T15:36:16Z
15,youtube#searchResult,DM6WAp6MhT92Gro4r-WkMPIx5LY,youtube#video,wSiF1Bm8f3s,2025-11-17T15:36:43Z,UCOjD18EJYcsBog4IozkF_7w,Carl Kadie - How to Optimize your Python Program for Slowness | PyData Seattle 2025,Many talks show how to make Python code faster. This one flips the script: what if we try to make our Python as slow as possible?,https://i.ytimg.com/vi/wSiF1Bm8f3s/default.jpg,120,90,https://i.ytimg.com/vi/wSiF1Bm8f3s/mqdefault.jpg,320,180,https://i.ytimg.com/vi/wSiF1Bm8f3s/hqdefault.jpg,480,360,PyData,none,2025-11-17T15:36:43Z
16,youtube#searchResult,4WS-3v-SOwsZT8a6WLvy1gGP9SQ,youtube#video,2w5WZsY_DOw,2025-11-17T15:36:13Z,UCOjD18EJYcsBog4IozkF_7w,Khuyen Tran &amp; Yibei Hu - Multi-Series Forecasting at Scale with StatsForecast | PyData Seattle 2025,"Learn how to build fast and reliable retail demand forecasts using StatsForecast, an open-source Python library for scalable ...",https://i.ytimg.com/vi/2w5WZsY_DOw/default.jpg,120,90,https://i.ytimg.com/vi/2w5WZsY_DOw/mqdefault.jpg,320,180,https://i.ytimg.com/vi/2w5WZsY_DOw/hqdefault.jpg,480,360,PyData,none,2025-11-17T15:36:13Z
17,youtube#searchResult,NeK-Hc_lS4Gdj06XTaBsg3-aWJs,youtube#video,p3eQgOexQho,2025-11-17T15:37:17Z,UCOjD18EJYcsBog4IozkF_7w,Andy Terrel - Building Inference Workflows with Tile Languages | PyData Seattle 2025,The world of generative AI is expanding. New models are hitting the market daily. The field has bifurcated between model training ...,https://i.ytimg.com/vi/p3eQgOexQho/default.jpg,120,90,https://i.ytimg.com/vi/p3eQgOexQho/mqdefault.jpg,320,180,https://i.ytimg.com/vi/p3eQgOexQho/hqdefault.jpg,480,360,PyData,none,2025-11-17T15:37:17Z
18,youtube#searchResult,90OJfVd1N09tnxWOaurtwQUbpr4,youtube#video,7F2zHERZlGo,2025-11-17T15:37:19Z,UCOjD18EJYcsBog4IozkF_7w,C.A.M. Gerlach - Democratizing (Py)Data | PyData Seattle 2025,"PhD students, postdocs and independent researchers often struggle when trying to scale their code and data beyond their local ...",https://i.ytimg.com/vi/7F2zHERZlGo/default.jpg,120,90,https://i.ytimg.com/vi/7F2zHERZlGo/mqdefault.jpg,320,180,https://i.ytimg.com/vi/7F2zHERZlGo/hqdefault.jpg,480,360,PyData,none,2025-11-17T15:37:19Z
19,youtube#searchResult,zjAxCs90sLHU9QtXBszyl09F2c8,youtube#video,CJznMMM6Svk,2025-11-17T15:35:44Z,UCOjD18EJYcsBog4IozkF_7w,"Keynote: Josh Starmer - Communicating Concepts, Clearly Explained!!! | ﻿﻿PyData Seattle 2025",In this talk I'll discuss 3 goals I have when I try to communicate complicated topics. I'll then illustrate how I used these goals to ...,https://i.ytimg.com/vi/CJznMMM6Svk/default.jpg,120,90,https://i.ytimg.com/vi/CJznMMM6Svk/mqdefault.jpg,320,180,https://i.ytimg.com/vi/CJznMMM6Svk/hqdefault.jpg,480,360,PyData,none,2025-11-17T15:35:44Z
20,youtube#searchResult,5Pk06a5rfKAM6xRKMLcWsW-5k-c,youtube#video,OBK_rgcY56I,2025-11-17T15:36:32Z,UCOjD18EJYcsBog4IozkF_7w,Bill Engels - Actually using GPs in practice with PyMC | PyData Seattle 2025,"This talk will be about the Gaussian process (GP) functionality in the open source Python package PyMC, and how to use GPs ...",https://i.ytimg.com/vi/OBK_rgcY56I/default.jpg,120,90,https://i.ytimg.com/vi/OBK_rgcY56I/mqdefault.jpg,320,180,https://i.ytimg.com/vi/OBK_rgcY56I/hqdefault.jpg,480,360,PyData,none,2025-11-17T15:36:32Z
21,youtube#searchResult,qJ4s-SKHaIIal1d9dT3DBmelWZs,youtube#video,9PFcG9MZ3s8,2025-11-17T15:37:05Z,UCOjD18EJYcsBog4IozkF_7w,Trent Nelson - Unlocking Parallel PyTorch Inference (and More!) | PyData Seattle 2025,"From the speaker who got kicked off the stage after 54 minutes of his 45-minute PyParallel talk at PyData NYC 2013, comes a new ...",https://i.ytimg.com/vi/9PFcG9MZ3s8/default.jpg,120,90,https://i.ytimg.com/vi/9PFcG9MZ3s8/mqdefault.jpg,320,180,https://i.ytimg.com/vi/9PFcG9MZ3s8/hqdefault.jpg,480,360,PyData,none,2025-11-17T15:37:05Z
22,youtube#searchResult,BATazxj3CuzXRtMidsyuU669LLg,youtube#video,pt_v-x0pT2Y,2025-11-17T15:36:51Z,UCOjD18EJYcsBog4IozkF_7w,Jack Ye - Supercharging Multimodal Feature Engineering | PyData Seattle 2025,"Efficient feature engineering is key to unlocking modern multimodal AI workloads. In this talk, we'll dive deep into how Lance - an ...",https://i.ytimg.com/vi/pt_v-x0pT2Y/default.jpg,120,90,https://i.ytimg.com/vi/pt_v-x0pT2Y/mqdefault.jpg,320,180,https://i.ytimg.com/vi/pt_v-x0pT2Y/hqdefault.jpg,480,360,PyData,none,2025-11-17T15:36:51Z
23,youtube#searchResult,7EuDriwronEoHyQhawEWndJ4uR4,youtube#video,NpoaDkacsTI,2025-11-17T15:36:45Z,UCOjD18EJYcsBog4IozkF_7w,David Aronchick - Taming the Data Tsunami | PyData Seattle 2025,"Machine learning teams today are drowning in massive volumes of raw, redundant data that inflate training costs, slow down ...",https://i.ytimg.com/vi/NpoaDkacsTI/default.jpg,120,90,https://i.ytimg.com/vi/NpoaDkacsTI/mqdefault.jpg,320,180,https://i.ytimg.com/vi/NpoaDkacsTI/hqdefault.jpg,480,360,PyData,none,2025-11-17T15:36:45Z
24,youtube#searchResult,VMdffqH040SDZ7_PEruzEd0VHIY,youtube#video,op5WDRVhxVc,2025-11-17T15:36:41Z,UCOjD18EJYcsBog4IozkF_7w,Keynote: Chang She - Never Send a Human to do an Agent&#39;s Search | PyData Seattle 2025,"www.pydata.org PyData is an educational program of NumFOCUS, a 501(c)3 non-profit organization in the United States. PyData ...",https://i.ytimg.com/vi/op5WDRVhxVc/default.jpg,120,90,https://i.ytimg.com/vi/op5WDRVhxVc/mqdefault.jpg,320,180,https://i.ytimg.com/vi/op5WDRVhxVc/hqdefault.jpg,480,360,PyData,none,2025-11-17T15:36:41Z
0,youtube#searchResult,JbqAhhNcc9HlI4uJT0lX3uXXgNI,youtube#video,0rPhFRy6qt4,2025-02-26T17:14:22Z,UCtWI06j1EADmEOGj2iJhSyA,Solve Communication Gaps with the Lost Art of Diagrams - Tadeh Hakopian (PyCascades 2025),This talk is about communicating with visuals to make complex ideas simple to understand. Over the years I have produced ...,https://i.ytimg.com/vi/0rPhFRy6qt4/default.jpg,120,90,https://i.ytimg.com/vi/0rPhFRy6qt4/mqdefault.jpg,320,180,https://i.ytimg.com/vi/0rPhFRy6qt4/hqdefault.jpg,480,360,PyCascades,none,2025-02-26T17:14:22Z
1,youtube#searchResult,_l0eQ1hhwIzPXvQxKfARtWJAtfk,youtube#video,x-xQj6EcQbI,2025-02-26T06:25:04Z,UCtWI06j1EADmEOGj2iJhSyA,PyLadies Panel: Experiences and Roles within the Tech Community and Open Source (PyCascades 2025),"Tammy Do, Drishti Jain, Parul Gupta, Lilinoe Harbottle, and Nasim.",https://i.ytimg.com/vi/x-xQj6EcQbI/default.jpg,120,90,https://i.ytimg.com/vi/x-xQj6EcQbI/mqdefault.jpg,320,180,https://i.ytimg.com/vi/x-xQj6EcQbI/hqdefault.jpg,480,360,PyCascades,none,2025-02-26T06:25:04Z
2,youtube#searchResult,TekAbMl2EQjkSDpb-OVFXVcqnhc,youtube#video,UygK5W3txTM,2025-02-26T06:21:29Z,UCtWI06j1EADmEOGj2iJhSyA,You Should Build a Robot (MicroPython &amp; Microprocessors) - Sage Elliott (PyCascades 2025),"Thinking about building a robot? You should! But don't know where to start? In this talk, we'll break down the barriers building ...",https://i.ytimg.com/vi/UygK5W3txTM/default.jpg,120,90,https://i.ytimg.com/vi/UygK5W3txTM/mqdefault.jpg,320,180,https://i.ytimg.com/vi/UygK5W3txTM/hqdefault.jpg,480,360,PyCascades,none,2025-02-26T06:21:29Z
3,youtube#searchResult,EeYHvF1RFzqwJ5KGDDKNIT5eTQk,youtube#video,JXZCw9wmc2M,2025-02-26T06:20:11Z,UCtWI06j1EADmEOGj2iJhSyA,Python for Earth: Climate Modeling and Sustainability in Action - Drishti Jain (PyCascades 2025),Discover how Python is shaping the future of our planet in this engaging talk. I'll explore how Python is used to model climate ...,https://i.ytimg.com/vi/JXZCw9wmc2M/default.jpg,120,90,https://i.ytimg.com/vi/JXZCw9wmc2M/mqdefault.jpg,320,180,https://i.ytimg.com/vi/JXZCw9wmc2M/hqdefault.jpg,480,360,PyCascades,none,2025-02-26T06:20:11Z
4,youtube#searchResult,XyiaE15V7Dd6GSv4UhzSUimtQUs,youtube#video,dvxzJDk6x9Q,2025-02-26T06:17:23Z,UCtWI06j1EADmEOGj2iJhSyA,Optimal Performance Over Basic as a Perfectionist with Deadlines - Velda Kiara (PyCascades 2025),In this talk we will be going through strategies of optimising Django applications with a focus on the following: - database ...,https://i.ytimg.com/vi/dvxzJDk6x9Q/default.jpg,120,90,https://i.ytimg.com/vi/dvxzJDk6x9Q/mqdefault.jpg,320,180,https://i.ytimg.com/vi/dvxzJDk6x9Q/hqdefault.jpg,480,360,PyCascades,none,2025-02-26T06:17:23Z
0,youtube#searchResult,T_gKY19aDOSuyaJSVyaSaRPlt80,youtube#video,rkw0jZkZA_U,2022-07-05T09:15:29Z,UCTCV2vonJgaQVb8AdMgdvCA,PyDataMCR - July Talks,Talk Details to be announced SPONSORS Thank you to NUMFocus for sponsoring Meetup and further support.,https://i.ytimg.com/vi/rkw0jZkZA_U/default_live.jpg,120,90,https://i.ytimg.com/vi/rkw0jZkZA_U/mqdefault_live.jpg,320,180,https://i.ytimg.com/vi/rkw0jZkZA_U/hqdefault_live.jpg,480,360,PyDataMCR,upcoming,2022-07-05T09:15:29Z
1,youtube#searchResult,wkzjxMlvAmjjpbq6u9BJ2PBfTHk,youtube#video,w_GQgSqLbxc,2022-06-30T06:48:38Z,UCTCV2vonJgaQVb8AdMgdvCA,PyDataMCR - is back!,"Topics, Classification and Reviews - Shaun Hide - @ShaunHide1 With increasing noise around fake reviews and review skews ...",https://i.ytimg.com/vi/w_GQgSqLbxc/default.jpg,120,90,https://i.ytimg.com/vi/w_GQgSqLbxc/mqdefault.jpg,320,180,https://i.ytimg.com/vi/w_GQgSqLbxc/hqdefault.jpg,480,360,PyDataMCR,none,2022-06-30T06:48:38Z
2,youtube#searchResult,LwBDuzzONyyAAHmljjdAZ5HoF2g,youtube#video,cik-dqUUiaU,2021-10-27T07:07:06Z,UCTCV2vonJgaQVb8AdMgdvCA,Data Horror Stories with Open Data Manchester &amp; Her+DataMcr 2021,"Do you have a tale of bad stats, strange correlations, malicious intent or plain stupidity? Join us and share your Data Horror ...",https://i.ytimg.com/vi/cik-dqUUiaU/default.jpg,120,90,https://i.ytimg.com/vi/cik-dqUUiaU/mqdefault.jpg,320,180,https://i.ytimg.com/vi/cik-dqUUiaU/hqdefault.jpg,480,360,PyDataMCR,none,2021-10-27T07:07:06Z
3,youtube#searchResult,JxyMchZ9BGsmC14DHzQezc-vxa4,youtube#video,G7Sm2vzZjZg,2021-08-18T06:21:37Z,UCTCV2vonJgaQVb8AdMgdvCA,Live-Coding - Rain Risk,"""The ship's navigation computer seems to be malfunctioning; rather than giving a route directly to safety, it produced extremely ...",https://i.ytimg.com/vi/G7Sm2vzZjZg/default.jpg,120,90,https://i.ytimg.com/vi/G7Sm2vzZjZg/mqdefault.jpg,320,180,https://i.ytimg.com/vi/G7Sm2vzZjZg/hqdefault.jpg,480,360,PyDataMCR,none,2021-08-18T06:21:37Z
4,youtube#searchResult,yabaQ7J6KJrUa1VugsOiQWulnBI,youtube#video,SvNGA5-wIPs,2021-04-28T06:13:46Z,UCTCV2vonJgaQVb8AdMgdvCA,Data FAQs with the UKDS,Data FAQs Some questions come up again and again in relation to data industries. Questions like: * Should I learn R or Python?,https://i.ytimg.com/vi/SvNGA5-wIPs/default.jpg,120,90,https://i.ytimg.com/vi/SvNGA5-wIPs/mqdefault.jpg,320,180,https://i.ytimg.com/vi/SvNGA5-wIPs/hqdefault.jpg,480,360,PyDataMCR,none,2021-04-28T06:13:46Z
0,youtube#searchResult,T_gKY19aDOSuyaJSVyaSaRPlt80,youtube#video,rkw0jZkZA_U,2022-07-05T09:15:29Z,UCTCV2vonJgaQVb8AdMgdvCA,PyDataMCR - July Talks,Talk Details to be announced SPONSORS Thank you to NUMFocus for sponsoring Meetup and further support.,https://i.ytimg.com/vi/rkw0jZkZA_U/default_live.jpg,120,90,https://i.ytimg.com/vi/rkw0jZkZA_U/mqdefault_live.jpg,320,180,https://i.ytimg.com/vi/rkw0jZkZA_U/hqdefault_live.jpg,480,360,PyDataMCR,upcoming,2022-07-05T09:15:29Z
1,youtube#searchResult,wkzjxMlvAmjjpbq6u9BJ2PBfTHk,youtube#video,w_GQgSqLbxc,2022-06-30T06:48:38Z,UCTCV2vonJgaQVb8AdMgdvCA,PyDataMCR - is back!,"Topics, Classification and Reviews - Shaun Hide - @ShaunHide1 With increasing noise around fake reviews and review skews ...",https://i.ytimg.com/vi/w_GQgSqLbxc/default.jpg,120,90,https://i.ytimg.com/vi/w_GQgSqLbxc/mqdefault.jpg,320,180,https://i.ytimg.com/vi/w_GQgSqLbxc/hqdefault.jpg,480,360,PyDataMCR,none,2022-06-30T06:48:38Z
2,youtube#searchResult,LwBDuzzONyyAAHmljjdAZ5HoF2g,youtube#video,cik-dqUUiaU,2021-10-27T07:07:06Z,UCTCV2vonJgaQVb8AdMgdvCA,Data Horror Stories with Open Data Manchester &amp; Her+DataMcr 2021,"Do you have a tale of bad stats, strange correlations, malicious intent or plain stupidity? Join us and share your Data Horror ...",https://i.ytimg.com/vi/cik-dqUUiaU/default.jpg,120,90,https://i.ytimg.com/vi/cik-dqUUiaU/mqdefault.jpg,320,180,https://i.ytimg.com/vi/cik-dqUUiaU/hqdefault.jpg,480,360,PyDataMCR,none,2021-10-27T07:07:06Z
3,youtube#searchResult,JxyMchZ9BGsmC14DHzQezc-vxa4,youtube#video,G7Sm2vzZjZg,2021-08-18T06:21:37Z,UCTCV2vonJgaQVb8AdMgdvCA,Live-Coding - Rain Risk,"""The ship's navigation computer seems to be malfunctioning; rather than giving a route directly to safety, it produced extremely ...",https://i.ytimg.com/vi/G7Sm2vzZjZg/default.jpg,120,90,https://i.ytimg.com/vi/G7Sm2vzZjZg/mqdefault.jpg,320,180,https://i.ytimg.com/vi/G7Sm2vzZjZg/hqdefault.jpg,480,360,PyDataMCR,none,2021-08-18T06:21:37Z
4,youtube#searchResult,yabaQ7J6KJrUa1VugsOiQWulnBI,youtube#video,SvNGA5-wIPs,2021-04-28T06:13:46Z,UCTCV2vonJgaQVb8AdMgdvCA,Data FAQs with the UKDS,Data FAQs Some questions come up again and again in relation to data industries. Questions like: * Should I learn R or Python?,https://i.ytimg.com/vi/SvNGA5-wIPs/default.jpg,120,90,https://i.ytimg.com/vi/SvNGA5-wIPs/mqdefault.jpg,320,180,https://i.ytimg.com/vi/SvNGA5-wIPs/hqdefault.jpg,480,360,PyDataMCR,none,2021-04-28T06:13:46Z
0,youtube#searchResult,p7QKhoN9zFI4B1l34SAt97OmHi4,youtube#video,Nm71G0-wnFU,2024-02-20T02:00:42Z,UC2d_azMgPLw_8JzgbpNb2oQ,PyData Montreal Meetup #24,There is a raw replay of PyData Montreal Meetup #24 with two talks 00:02:15 - 00:49:46 - How we used Python to see how many ...,https://i.ytimg.com/vi/Nm71G0-wnFU/default.jpg,120,90,https://i.ytimg.com/vi/Nm71G0-wnFU/mqdefault.jpg,320,180,https://i.ytimg.com/vi/Nm71G0-wnFU/hqdefault.jpg,480,360,PyData Montreal,none,2024-02-20T02:00:42Z
1,youtube#searchResult,tYYwvvKtvwFpFFG2TbuI0j4xn-c,youtube#video,-FFKxz4V9_o,2021-06-29T23:48:14Z,UC2d_azMgPLw_8JzgbpNb2oQ,PyData Montreal #20 with Itamar Turner-Trauring,"Our guest this time is Itamar Turner-Trauring who will present two talks: - ""Small Big Data: using NumPy and Pandas when your ...",https://i.ytimg.com/vi/-FFKxz4V9_o/default.jpg,120,90,https://i.ytimg.com/vi/-FFKxz4V9_o/mqdefault.jpg,320,180,https://i.ytimg.com/vi/-FFKxz4V9_o/hqdefault.jpg,480,360,PyData Montreal,none,2021-06-29T23:48:14Z
2,youtube#searchResult,4a8WWpNWmTWVkMY9rmYsxnknMYs,youtube#video,jNZw_azRlDU,2021-04-22T23:53:51Z,UC2d_azMgPLw_8JzgbpNb2oQ,PyData Montreal #19 with Frederick Reiss and Luciano Resende,"Our speakers this time are: - Frederick Reiss, with a talk ""Text Extensions for Pandas"", and - Luciano Resende with ""Introducing ...",https://i.ytimg.com/vi/jNZw_azRlDU/default.jpg,120,90,https://i.ytimg.com/vi/jNZw_azRlDU/mqdefault.jpg,320,180,https://i.ytimg.com/vi/jNZw_azRlDU/hqdefault.jpg,480,360,PyData Montreal,none,2021-04-22T23:53:51Z
3,youtube#searchResult,NGdrue3TKS7F_KjnfdzhUN1-OeA,youtube#video,NrdJOfYisKI,2021-03-20T00:01:15Z,UC2d_azMgPLw_8JzgbpNb2oQ,PyData Montreal #18: Data Engineering and Data Management,"Our speakers this time are: - Ben Rogojan, with a talk ""The Python ETL: Airflow Vs. Luigi"", and - Sergey Karayev, presenting on ...",https://i.ytimg.com/vi/NrdJOfYisKI/default.jpg,120,90,https://i.ytimg.com/vi/NrdJOfYisKI/mqdefault.jpg,320,180,https://i.ytimg.com/vi/NrdJOfYisKI/hqdefault.jpg,480,360,PyData Montreal,none,2021-03-20T00:01:15Z
4,youtube#searchResult,-87kesQLCvt17z3ef2oHWZnga_4,youtube#video,RG-yV5zgqjQ,2021-02-26T01:22:19Z,UC2d_azMgPLw_8JzgbpNb2oQ,PyData Montreal #17: Online meetup on NLP,"Our guests this time are: - Sylvain Gugger, a Research Engineer at Hugging Face and one of the core maintainers of the ...",https://i.ytimg.com/vi/RG-yV5zgqjQ/default.jpg,120,90,https://i.ytimg.com/vi/RG-yV5zgqjQ/mqdefault.jpg,320,180,https://i.ytimg.com/vi/RG-yV5zgqjQ/hqdefault.jpg,480,360,PyData Montreal,none,2021-02-26T01:22:19Z
0,youtube#searchResult,z3hTo-9f883-M-RccFL1V8Rrz9s,youtube#video,YQwqoEm_xis,2025-11-17T14:56:31Z,UCP7jMXSY2xbc3KCAE0MHQ-A,WeatherNext 2: Our most advanced weather forecasting model,"We're powering a new era of global weather forecasting with WeatherNext 2, our most advanced and efficient AI model. It delivers ...",https://i.ytimg.com/vi/YQwqoEm_xis/default.jpg,120,90,https://i.ytimg.com/vi/YQwqoEm_xis/mqdefault.jpg,320,180,https://i.ytimg.com/vi/YQwqoEm_xis/hqdefault.jpg,480,360,Google DeepMind,none,2025-11-17T14:56:31Z
1,youtube#searchResult,RKbIGQZ4aSbscCfIZ2r30Q2Yd8M,youtube#video,Zphax4f6Rls,2025-11-13T14:51:38Z,UCP7jMXSY2xbc3KCAE0MHQ-A,"Introducing SIMA 2, the next milestone in our research creating general and helpful AI agents.","We're introducing SIMA 2, the next major milestone in general and helpful embodied AI agents. With Gemini integrated at its ...",https://i.ytimg.com/vi/Zphax4f6Rls/default.jpg,120,90,https://i.ytimg.com/vi/Zphax4f6Rls/mqdefault.jpg,320,180,https://i.ytimg.com/vi/Zphax4f6Rls/hqdefault.jpg,480,360,Google DeepMind,none,2025-11-13T14:51:38Z
2,youtube#searchResult,M82CW8ArQmXMv5j6mTXKaDIDpkk,youtube#video,2t2pMtJGv6k,2025-11-06T18:57:24Z,UCP7jMXSY2xbc3KCAE0MHQ-A,Waymo: The future of autonomous driving with Vincent Vanhoucke,How do you train an AI to drive safer than a human? Professor Hannah Fry sits down with Waymo Distinguished Engineer Vincent ...,https://i.ytimg.com/vi/2t2pMtJGv6k/default.jpg,120,90,https://i.ytimg.com/vi/2t2pMtJGv6k/mqdefault.jpg,320,180,https://i.ytimg.com/vi/2t2pMtJGv6k/hqdefault.jpg,480,360,Google DeepMind,none,2025-11-06T18:57:24Z
