,kind,etag,id.kind,id.videoId,snippet.publishedAt,snippet.channelId,snippet.title,snippet.description,snippet.thumbnails.default.url,snippet.thumbnails.default.width,snippet.thumbnails.default.height,snippet.thumbnails.medium.url,snippet.thumbnails.medium.width,snippet.thumbnails.medium.height,snippet.thumbnails.high.url,snippet.thumbnails.high.width,snippet.thumbnails.high.height,snippet.channelTitle,snippet.liveBroadcastContent,snippet.publishTime
5,youtube#searchResult,I_EvX6O52wn_KfMMAJSEBHd9qws,youtube#video,rS18UM4YpsQ,2019-04-30T22:47:40Z,UCfVG8K_0XyMh7r2162aDKJw,How I Overcame my Fear of Heights - Glenn Block - Lightning Talk - ML4ALL 2019,http://ml4all.org/schedule.html video by https://backpedal.tv.,https://i.ytimg.com/vi/rS18UM4YpsQ/default.jpg,120,90,https://i.ytimg.com/vi/rS18UM4YpsQ/mqdefault.jpg,320,180,https://i.ytimg.com/vi/rS18UM4YpsQ/hqdefault.jpg,480,360,ML4ALL,none,2019-04-30T22:47:40Z
6,youtube#searchResult,hF2mDs-oShMYiVSZ-5cmZu5jeZc,youtube#video,K8RqZ6b5L4c,2019-04-30T22:36:44Z,UCfVG8K_0XyMh7r2162aDKJw,ML Signal Reconstruction - Ben Hendrickson - Lightning Talk - ML4ALL 2019,http://ml4all.org/schedule.html video by https://backpedal.tv.,https://i.ytimg.com/vi/K8RqZ6b5L4c/default.jpg,120,90,https://i.ytimg.com/vi/K8RqZ6b5L4c/mqdefault.jpg,320,180,https://i.ytimg.com/vi/K8RqZ6b5L4c/hqdefault.jpg,480,360,ML4ALL,none,2019-04-30T22:36:44Z
7,youtube#searchResult,oFsPwxEFkfJc3OCbUDdD-FJ5eX0,youtube#video,Bkj3tfIvp-w,2019-04-30T22:29:53Z,UCfVG8K_0XyMh7r2162aDKJw,Should this Exist? - Nicole Merrill - Lightning Talk - ML4ALL 2019,http://ml4all.org/schedule.html video by https://backpedal.tv.,https://i.ytimg.com/vi/Bkj3tfIvp-w/default.jpg,120,90,https://i.ytimg.com/vi/Bkj3tfIvp-w/mqdefault.jpg,320,180,https://i.ytimg.com/vi/Bkj3tfIvp-w/hqdefault.jpg,480,360,ML4ALL,none,2019-04-30T22:29:53Z
8,youtube#searchResult,5FMssEfeA_GPnDhrD1ordL91nek,youtube#video,3rFKWfy2QlQ,2019-04-30T22:21:20Z,UCfVG8K_0XyMh7r2162aDKJw,Bacon or Not Bacon? - Maxime Rouiller - Lightning Talk - ML4ALL 2019,http://ml4all.org/schedule.html video by https://backpedal.tv.,https://i.ytimg.com/vi/3rFKWfy2QlQ/default.jpg,120,90,https://i.ytimg.com/vi/3rFKWfy2QlQ/mqdefault.jpg,320,180,https://i.ytimg.com/vi/3rFKWfy2QlQ/hqdefault.jpg,480,360,ML4ALL,none,2019-04-30T22:21:20Z
9,youtube#searchResult,ACahBpAtOVkySvVaR-fYPgmb-Bk,youtube#video,skDACjAd4Xc,2019-04-30T22:19:50Z,UCfVG8K_0XyMh7r2162aDKJw,Lessons Learned from Learning Robots - Frank Krueger - Lightning Talk - ML4ALL 2019,http://ml4all.org/schedule.html video by https://backpedal.tv.,https://i.ytimg.com/vi/skDACjAd4Xc/default.jpg,120,90,https://i.ytimg.com/vi/skDACjAd4Xc/mqdefault.jpg,320,180,https://i.ytimg.com/vi/skDACjAd4Xc/hqdefault.jpg,480,360,ML4ALL,none,2019-04-30T22:19:50Z
10,youtube#searchResult,kVdfALBoEnPsrqr_x26OTQ5AbFc,youtube#video,mgVyarU5WLA,2019-04-30T22:11:02Z,UCfVG8K_0XyMh7r2162aDKJw,Infrastructure for ML and Kubernetes - Mihal - Lightning Talk - ML4ALL 2019,http://ml4all.org/schedule.html video by https://backpedal.tv.,https://i.ytimg.com/vi/mgVyarU5WLA/default.jpg,120,90,https://i.ytimg.com/vi/mgVyarU5WLA/mqdefault.jpg,320,180,https://i.ytimg.com/vi/mgVyarU5WLA/hqdefault.jpg,480,360,ML4ALL,none,2019-04-30T22:11:02Z
11,youtube#searchResult,StFs9dNHx4yKvZ2rX7zBDDrcXvw,youtube#video,HyCJxMNcVbw,2019-04-30T22:03:53Z,UCfVG8K_0XyMh7r2162aDKJw,Automating your Developer Workflow - Hamel - Lightning Talk - ML4ALL 2019,http://ml4all.org/schedule.html video by https://backpedal.tv.,https://i.ytimg.com/vi/HyCJxMNcVbw/default.jpg,120,90,https://i.ytimg.com/vi/HyCJxMNcVbw/mqdefault.jpg,320,180,https://i.ytimg.com/vi/HyCJxMNcVbw/hqdefault.jpg,480,360,ML4ALL,none,2019-04-30T22:03:53Z
12,youtube#searchResult,MDphjPoQhBL5OGppb5hjw7MtUjA,youtube#video,awGJkRe9m50,2019-04-30T21:48:32Z,UCfVG8K_0XyMh7r2162aDKJw,A Machine Learning Primer - Seth Juarez - Lightning Talk - ML4ALL 2019,http://ml4all.org/schedule.html video by https://backpedal.tv.,https://i.ytimg.com/vi/awGJkRe9m50/default.jpg,120,90,https://i.ytimg.com/vi/awGJkRe9m50/mqdefault.jpg,320,180,https://i.ytimg.com/vi/awGJkRe9m50/hqdefault.jpg,480,360,ML4ALL,none,2019-04-30T21:48:32Z
13,youtube#searchResult,nNdHH-ZZg38ztBJ2fS9R8A8f_7M,youtube#video,Wngt33IIcpY,2019-04-30T21:35:37Z,UCfVG8K_0XyMh7r2162aDKJw,ML and Analytics Trends - William O&#39;Shea - Lightning Talk - ML4ALL 2019,http://ml4all.org/schedule.html video by https://backpedal.tv.,https://i.ytimg.com/vi/Wngt33IIcpY/default.jpg,120,90,https://i.ytimg.com/vi/Wngt33IIcpY/mqdefault.jpg,320,180,https://i.ytimg.com/vi/Wngt33IIcpY/hqdefault.jpg,480,360,ML4ALL,none,2019-04-30T21:35:37Z
14,youtube#searchResult,PvllBAFD4imBZJfyk6PyqHrRQu8,youtube#video,dSy883K4S48,2019-04-30T20:14:25Z,UCfVG8K_0XyMh7r2162aDKJw,Model Biases &amp; Data Cleaning - Matt Beatty - ML4ALL 2019,Model Biases & Data Cleaning Matt Beatty http://ml4all.org/schedule.html video by https://backpedal.tv.,https://i.ytimg.com/vi/dSy883K4S48/default.jpg,120,90,https://i.ytimg.com/vi/dSy883K4S48/mqdefault.jpg,320,180,https://i.ytimg.com/vi/dSy883K4S48/hqdefault.jpg,480,360,ML4ALL,none,2019-04-30T20:14:25Z
15,youtube#searchResult,msVFZZMNE3NhgbIqcdYUiBmVvX4,youtube#video,_xH7mlDGb0c,2019-04-30T20:10:48Z,UCfVG8K_0XyMh7r2162aDKJw,"MLOps for non-DevOps folks, a.k.a. “I have a model, now what?! - Hannes Hapke - ML4ALL 2019","MLOps for non-DevOps folks, a.k.a. “I have a model, now what?! Hannes Hapke The prospect of developing and training machine ...",https://i.ytimg.com/vi/_xH7mlDGb0c/default.jpg,120,90,https://i.ytimg.com/vi/_xH7mlDGb0c/mqdefault.jpg,320,180,https://i.ytimg.com/vi/_xH7mlDGb0c/hqdefault.jpg,480,360,ML4ALL,none,2019-04-30T20:10:48Z
16,youtube#searchResult,if8L-SPAchQ2ZQbsxO5sCyD0QA8,youtube#video,WbRagtmQulQ,2019-04-30T19:53:08Z,UCfVG8K_0XyMh7r2162aDKJw,Getting Started with Keras and OpenCV for Computer Vision - Andrew Ferlitsch - ML4ALL 2019,"Getting Started with Keras and OpenCV for Computer Vision Andrew Ferlitsch In this 4hr workshop, led by Andrew Ferlitsch, you ...",https://i.ytimg.com/vi/WbRagtmQulQ/default.jpg,120,90,https://i.ytimg.com/vi/WbRagtmQulQ/mqdefault.jpg,320,180,https://i.ytimg.com/vi/WbRagtmQulQ/hqdefault.jpg,480,360,ML4ALL,none,2019-04-30T19:53:08Z
17,youtube#searchResult,c68EFjQQFFWXRq4eXt9dSDXazE0,youtube#video,cL2YT8WmCzU,2019-04-30T19:44:02Z,UCfVG8K_0XyMh7r2162aDKJw,Deep Learning for Computer Vision with Applications for Wildlife Conservation - ML4ALL 2019,Deep Learning for Computer Vision with Applications for Wildlife Conservation Seth Juarez & Siyu Yang Deep Learning is one of ...,https://i.ytimg.com/vi/cL2YT8WmCzU/default.jpg,120,90,https://i.ytimg.com/vi/cL2YT8WmCzU/mqdefault.jpg,320,180,https://i.ytimg.com/vi/cL2YT8WmCzU/hqdefault.jpg,480,360,ML4ALL,none,2019-04-30T19:44:02Z
18,youtube#searchResult,kqesNXHY80iXdylnpNhW1iNOwzY,youtube#video,lAlmnCeQBLc,2019-04-30T19:18:05Z,UCfVG8K_0XyMh7r2162aDKJw,"What is Quantum Machine Learning, and Is It A Thing? - Dr. Sarah Kaiser - ML4ALL 2019","What is Quantum Machine Learning, and Is It A Thing? Dr. Sarah Kaiser In the rush to add the word _quantum_ to everything from ...",https://i.ytimg.com/vi/lAlmnCeQBLc/default.jpg,120,90,https://i.ytimg.com/vi/lAlmnCeQBLc/mqdefault.jpg,320,180,https://i.ytimg.com/vi/lAlmnCeQBLc/hqdefault.jpg,480,360,ML4ALL,none,2019-04-30T19:18:05Z
19,youtube#searchResult,Zu7DL4ucmT5hfcTjcRlyep7ui1Q,youtube#video,F6gpHfx3BCs,2019-04-30T02:47:15Z,UCfVG8K_0XyMh7r2162aDKJw,Machine Learning Model Evaluation Metrics - Maria Khalusova - ML4ALL 2019,Machine Learning Model Evaluation Metrics Maria Khalusova Choosing the right evaluation metric for your machine learning ...,https://i.ytimg.com/vi/F6gpHfx3BCs/default.jpg,120,90,https://i.ytimg.com/vi/F6gpHfx3BCs/mqdefault.jpg,320,180,https://i.ytimg.com/vi/F6gpHfx3BCs/hqdefault.jpg,480,360,ML4ALL,none,2019-04-30T02:47:15Z
20,youtube#searchResult,9ZnYUesM0ersU7k_DUj3tz6QG58,youtube#video,mcvwioTVIn0,2019-04-30T01:06:46Z,UCfVG8K_0XyMh7r2162aDKJw,Gaming Rigs and ML Pipelines - Aeva van der Veen - ML4ALL 2019,Gaming Rigs and ML Pipelines: How to Get Started with the Tools You Already Have Aeva van der Veen If you think that only big ...,https://i.ytimg.com/vi/mcvwioTVIn0/default.jpg,120,90,https://i.ytimg.com/vi/mcvwioTVIn0/mqdefault.jpg,320,180,https://i.ytimg.com/vi/mcvwioTVIn0/hqdefault.jpg,480,360,ML4ALL,none,2019-04-30T01:06:46Z
21,youtube#searchResult,Rb7W-WTo-cDrt547DPmwHjNwugo,youtube#video,yhD2ksHPzWY,2019-04-30T00:44:56Z,UCfVG8K_0XyMh7r2162aDKJw,Improving ML Predictions with Connected Feature Extraction - Amy Hodler - ML4ALL 2019,Improving ML Predictions with Connected Feature Extraction Amy Hodler One of the most practical ways to improve our machine ...,https://i.ytimg.com/vi/yhD2ksHPzWY/default.jpg,120,90,https://i.ytimg.com/vi/yhD2ksHPzWY/mqdefault.jpg,320,180,https://i.ytimg.com/vi/yhD2ksHPzWY/hqdefault.jpg,480,360,ML4ALL,none,2019-04-30T00:44:56Z
22,youtube#searchResult,cxf3yyp3iWHFh-ncceefEe_r4RI,youtube#video,ajIwl7jS5ro,2019-04-29T23:15:04Z,UCfVG8K_0XyMh7r2162aDKJw,Practical Privacy in Machine Learning Systems - Dr. Catherine Nelson - ML4ALL 2019,Practical Privacy in Machine Learning Systems Dr. Catherine Nelson Data privacy is a huge topic right now for any business using ...,https://i.ytimg.com/vi/ajIwl7jS5ro/default.jpg,120,90,https://i.ytimg.com/vi/ajIwl7jS5ro/mqdefault.jpg,320,180,https://i.ytimg.com/vi/ajIwl7jS5ro/hqdefault.jpg,480,360,ML4ALL,none,2019-04-29T23:15:04Z
23,youtube#searchResult,lwF2ahgnj3wPNu3QqAzqAiNNvnw,youtube#video,K0vmU_Jf3f4,2019-04-29T22:48:55Z,UCfVG8K_0XyMh7r2162aDKJw,Building a Machine Learning Classifier to Listen to Killer Whales - Erika Pelaez - ML4ALL 2019,Building a Machine Learning Classifier to Listen to Killer Whales Erika Pelaez Did you know that Machine Learning can help ...,https://i.ytimg.com/vi/K0vmU_Jf3f4/default.jpg,120,90,https://i.ytimg.com/vi/K0vmU_Jf3f4/mqdefault.jpg,320,180,https://i.ytimg.com/vi/K0vmU_Jf3f4/hqdefault.jpg,480,360,ML4ALL,none,2019-04-29T22:48:55Z
24,youtube#searchResult,p0GSdfvwG4AYa96eqsBddg57qr4,youtube#video,aDkBhgxGGE8,2019-04-29T22:43:30Z,UCfVG8K_0XyMh7r2162aDKJw,Ethics and Machine Learning - Christopher - Lightning Talk - ML4ALL 2019,http://ml4all.org/schedule.html video by https://backpedal.tv.,https://i.ytimg.com/vi/aDkBhgxGGE8/default.jpg,120,90,https://i.ytimg.com/vi/aDkBhgxGGE8/mqdefault.jpg,320,180,https://i.ytimg.com/vi/aDkBhgxGGE8/hqdefault.jpg,480,360,ML4ALL,none,2019-04-29T22:43:30Z
0,youtube#searchResult,VQtkgrijoSJ-whrgDujZOVc4Rto,youtube#video,fWHzYMo4KJA,2025-10-16T17:09:52Z,UCR1-GEpyOPzT2AO4D_eifdw,Using NVIDIA Sync on the NVIDIA DGX Spark on a Mac,"For more information, or to buy a NVIDIA DGX Spark: https://nvda.ws/4nFFtPT In this video I show how to use NVIDIA Sync to work ...",https://i.ytimg.com/vi/fWHzYMo4KJA/default.jpg,120,90,https://i.ytimg.com/vi/fWHzYMo4KJA/mqdefault.jpg,320,180,https://i.ytimg.com/vi/fWHzYMo4KJA/hqdefault.jpg,480,360,Jeff Heaton,none,2025-10-16T17:09:52Z
1,youtube#searchResult,mj6o_8HYQRMwv088zSP55mEqyx8,youtube#video,RyFLhzmAO30,2025-10-14T17:14:18Z,UCR1-GEpyOPzT2AO4D_eifdw,"Just got an NVIDIA DGX Spark, here is my first look",https://www.nvidia.com/en-us/products/workstations/dgx-spark/,https://i.ytimg.com/vi/RyFLhzmAO30/default.jpg,120,90,https://i.ytimg.com/vi/RyFLhzmAO30/mqdefault.jpg,320,180,https://i.ytimg.com/vi/RyFLhzmAO30/hqdefault.jpg,480,360,Jeff Heaton,none,2025-10-14T17:14:18Z
2,youtube#searchResult,PCWLrcuYN8x_hRqUrH_C5R35SWY,youtube#video,QbqY5qfi3Lw,2025-10-14T17:13:32Z,UCR1-GEpyOPzT2AO4D_eifdw,First look and unboxing at the NVIDIA DGX Spark,"For more information, or to buy a NVIDIA DGX Spark: https://nvda.ws/4nFFtPT The video introduces the NVIDIA DGX Spark, which ...",https://i.ytimg.com/vi/QbqY5qfi3Lw/default.jpg,120,90,https://i.ytimg.com/vi/QbqY5qfi3Lw/mqdefault.jpg,320,180,https://i.ytimg.com/vi/QbqY5qfi3Lw/hqdefault.jpg,480,360,Jeff Heaton,none,2025-10-14T17:13:32Z
3,youtube#searchResult,jLrpaCjMaxX6gu_PblSMdpRDpTw,youtube#video,G-l3T1Z9CHc,2025-09-05T16:29:10Z,UCR1-GEpyOPzT2AO4D_eifdw,Conversation Buffer Window Memory (4.2),"This video explores Conversation Buffer Memory in LangChain, expanding on the basics of building LLM-powered chat systems.",https://i.ytimg.com/vi/G-l3T1Z9CHc/default.jpg,120,90,https://i.ytimg.com/vi/G-l3T1Z9CHc/mqdefault.jpg,320,180,https://i.ytimg.com/vi/G-l3T1Z9CHc/hqdefault.jpg,480,360,Jeff Heaton,none,2025-09-05T16:29:10Z
4,youtube#searchResult,VmhjRTaPEGw3tJcqBQgFQ8S0mQU,youtube#video,7QEFjNE6wxs,2025-09-01T11:35:18Z,UCR1-GEpyOPzT2AO4D_eifdw,"LangChain Chat with Persistence, Rollback and Regeneration (4.4)","This video introduces the ChatConversation class, an upgraded framework for managing conversations with LangChain and ...",https://i.ytimg.com/vi/7QEFjNE6wxs/default.jpg,120,90,https://i.ytimg.com/vi/7QEFjNE6wxs/mqdefault.jpg,320,180,https://i.ytimg.com/vi/7QEFjNE6wxs/hqdefault.jpg,480,360,Jeff Heaton,none,2025-09-01T11:35:18Z
0,youtube#searchResult,uu15psdMOgoU0RV41RFLr7o_S84,youtube#video,77dlPxJ7IwY,2021-02-25T17:37:13Z,UCa8JYaJrsUbMO8kWJt2B7LQ,WeCNLP 2020   Invited Talk 5   Tom Yeh,,https://i.ytimg.com/vi/77dlPxJ7IwY/default.jpg,120,90,https://i.ytimg.com/vi/77dlPxJ7IwY/mqdefault.jpg,320,180,https://i.ytimg.com/vi/77dlPxJ7IwY/hqdefault.jpg,480,360,WeCNLP,none,2021-02-25T17:37:13Z
1,youtube#searchResult,6ZZgvQhrUytQFdid4TG-7NT2jgE,youtube#video,hDNOhji7D4M,2021-02-25T17:37:18Z,UCa8JYaJrsUbMO8kWJt2B7LQ,WeCNLP 2020   Invited Talk 4   Irina Rish,,https://i.ytimg.com/vi/hDNOhji7D4M/default.jpg,120,90,https://i.ytimg.com/vi/hDNOhji7D4M/mqdefault.jpg,320,180,https://i.ytimg.com/vi/hDNOhji7D4M/hqdefault.jpg,480,360,WeCNLP,none,2021-02-25T17:37:18Z
2,youtube#searchResult,xzAY4P5mDZfzEbq5l4cvO08iRqM,youtube#video,KDaTwn72I-4,2021-02-25T17:37:27Z,UCa8JYaJrsUbMO8kWJt2B7LQ,Generating natural questions from images for multimodal assistants,WeCNLP 2020 - Poster#7.,https://i.ytimg.com/vi/KDaTwn72I-4/default.jpg,120,90,https://i.ytimg.com/vi/KDaTwn72I-4/mqdefault.jpg,320,180,https://i.ytimg.com/vi/KDaTwn72I-4/hqdefault.jpg,480,360,WeCNLP,none,2021-02-25T17:37:27Z
3,youtube#searchResult,SDgzUqDLJVM9R0qeZA5vRVMbvPE,youtube#video,5W3xnmyTmgM,2021-02-25T17:37:46Z,UCa8JYaJrsUbMO8kWJt2B7LQ,Large-scale Resource-efficient Models for Task-oriented Dialog with Augmentation and Distillation,WeCNLP 2020 - Poster#4.,https://i.ytimg.com/vi/5W3xnmyTmgM/default.jpg,120,90,https://i.ytimg.com/vi/5W3xnmyTmgM/mqdefault.jpg,320,180,https://i.ytimg.com/vi/5W3xnmyTmgM/hqdefault.jpg,480,360,WeCNLP,none,2021-02-25T17:37:46Z
4,youtube#searchResult,ho9zk7uj4Qg4RGKO1ofyzz3qBes,youtube#video,aMPWI7mysmU,2021-02-25T17:37:22Z,UCa8JYaJrsUbMO8kWJt2B7LQ,WeCNLP 2020   Invited Talk 1   Mei Yuh Hwang,,https://i.ytimg.com/vi/aMPWI7mysmU/default.jpg,120,90,https://i.ytimg.com/vi/aMPWI7mysmU/mqdefault.jpg,320,180,https://i.ytimg.com/vi/aMPWI7mysmU/hqdefault.jpg,480,360,WeCNLP,none,2021-02-25T17:37:22Z
0,youtube#searchResult,df8WjUBq04x9m26mQmXr7rrwb9Y,youtube#video,eRPSRSGiAA8,2025-08-30T15:21:01Z,UCfzlCWGWYyIQ0aLC5w48gBQ,Testing VLMs and LLMs for robotics w/ the Jetson Thor devkit,Exploring the Jetson Thor devkit w/ some local LLMs and VLMs. More info on the Jetson Thor Devkit: https://nvda.ws/45xIU4B ...,https://i.ytimg.com/vi/eRPSRSGiAA8/default.jpg,120,90,https://i.ytimg.com/vi/eRPSRSGiAA8/mqdefault.jpg,320,180,https://i.ytimg.com/vi/eRPSRSGiAA8/hqdefault.jpg,480,360,sentdex,none,2025-08-30T15:21:01Z
1,youtube#searchResult,yFSMVEHvL8aC6T3pxYnpQXsRikY,youtube#video,sJYlJlIEBpg,2025-04-30T15:56:40Z,UCfzlCWGWYyIQ0aLC5w48gBQ,"Unitree G1 LiDAR, SLAM, navigation and control. Dev w/ G1 Humanoid P.2","Doing SLAM with the LiDAR, occupancy graph, better navigation, and a bunch of improvements. Unitree G1 playlist: ...",https://i.ytimg.com/vi/sJYlJlIEBpg/default.jpg,120,90,https://i.ytimg.com/vi/sJYlJlIEBpg/mqdefault.jpg,320,180,https://i.ytimg.com/vi/sJYlJlIEBpg/hqdefault.jpg,480,360,sentdex,none,2025-04-30T15:56:40Z
2,youtube#searchResult,6ynKm2QSz5mc5yF5-CF7C5hp99g,youtube#video,WKF__cJTxvg,2025-02-16T01:08:55Z,UCfzlCWGWYyIQ0aLC5w48gBQ,Programming with LLM Agents in 2025,"Some tips and tricks for using modern LLM agents for building stuff. I am using openhands here, but you're free to take some of my ...",https://i.ytimg.com/vi/WKF__cJTxvg/default.jpg,120,90,https://i.ytimg.com/vi/WKF__cJTxvg/mqdefault.jpg,320,180,https://i.ytimg.com/vi/WKF__cJTxvg/hqdefault.jpg,480,360,sentdex,none,2025-02-16T01:08:55Z
3,youtube#searchResult,kQ1sCuLv6rzfX3T6Qnmvf7oE3Ic,youtube#video,ChfEO8l-fas,2024-02-14T18:23:24Z,UCfzlCWGWYyIQ0aLC5w48gBQ,Visualizing Neural Network Internals,Visualizing some of the internals of a neural network during training and inference. Starting and full code: ...,https://i.ytimg.com/vi/ChfEO8l-fas/default.jpg,120,90,https://i.ytimg.com/vi/ChfEO8l-fas/mqdefault.jpg,320,180,https://i.ytimg.com/vi/ChfEO8l-fas/hqdefault.jpg,480,360,sentdex,none,2024-02-14T18:23:24Z
4,youtube#searchResult,XQPS7GsA502IPs_RSO4OZcKYVow,youtube#video,0lOSvOoF2to,2023-06-15T00:14:31Z,UCfzlCWGWYyIQ0aLC5w48gBQ,OpenAI GPT-4 Function Calling: Unlimited Potential,Function calling is a new capability for OpenAI's GPT-4 and GPT-3.5 via the API. Function-calling allows you to extract structured ...,https://i.ytimg.com/vi/0lOSvOoF2to/default.jpg,120,90,https://i.ytimg.com/vi/0lOSvOoF2to/mqdefault.jpg,320,180,https://i.ytimg.com/vi/0lOSvOoF2to/hqdefault.jpg,480,360,sentdex,none,2023-06-15T00:14:31Z
0,youtube#searchResult,PPcxBCZ_3beFfoidb3AKRbiQOtQ,youtube#video,FCDKn-vpn_o,2026-02-09T15:00:24Z,UC5_6ZD6s8klmMu9TXEB_1IA,CLIP - Explained!,"In this video, we take a look at CLIP (contrastive language image pretraining). What is it? Why do we have it? How does it look?",https://i.ytimg.com/vi/FCDKn-vpn_o/default.jpg,120,90,https://i.ytimg.com/vi/FCDKn-vpn_o/mqdefault.jpg,320,180,https://i.ytimg.com/vi/FCDKn-vpn_o/hqdefault.jpg,480,360,CodeEmporium,none,2026-02-09T15:00:24Z
1,youtube#searchResult,dOpcl_16hMe7S12uoT3-uHyqh6g,youtube#video,KEu6HVK_rzE,2026-01-27T15:00:37Z,UC5_6ZD6s8klmMu9TXEB_1IA,Swin transformer - Explained!,"In this video, we take a look at Swin Transformers. What is it? Why do we have it? How does it look? ABOUT ME ⭕ Subscribe: ...",https://i.ytimg.com/vi/KEu6HVK_rzE/default.jpg,120,90,https://i.ytimg.com/vi/KEu6HVK_rzE/mqdefault.jpg,320,180,https://i.ytimg.com/vi/KEu6HVK_rzE/hqdefault.jpg,480,360,CodeEmporium,none,2026-01-27T15:00:37Z
2,youtube#searchResult,0rxel3ul1QYJpaohIXktVKizZuc,youtube#video,r3lDNWYDGF4,2026-01-12T15:01:41Z,UC5_6ZD6s8klmMu9TXEB_1IA,DETR - Explained!,"In this video, we take a look at Detection Transformers (DETR). What is it? Why do we have it? How do we train it? How does it ...",https://i.ytimg.com/vi/r3lDNWYDGF4/default.jpg,120,90,https://i.ytimg.com/vi/r3lDNWYDGF4/mqdefault.jpg,320,180,https://i.ytimg.com/vi/r3lDNWYDGF4/hqdefault.jpg,480,360,CodeEmporium,none,2026-01-12T15:01:41Z
3,youtube#searchResult,2Ip7TvJ1Rs52WbVB82QEBlAvxHQ,youtube#video,Hnsrm1ezI3g,2025-12-15T15:00:35Z,UC5_6ZD6s8klmMu9TXEB_1IA,Vision Transformers - Explained!,"In this video, we take a look at Vision Transformers (ViT). What is it? Why do we have it? How do we pretrain and fine tune it?",https://i.ytimg.com/vi/Hnsrm1ezI3g/default.jpg,120,90,https://i.ytimg.com/vi/Hnsrm1ezI3g/mqdefault.jpg,320,180,https://i.ytimg.com/vi/Hnsrm1ezI3g/hqdefault.jpg,480,360,CodeEmporium,none,2025-12-15T15:00:35Z
4,youtube#searchResult,08grX5Pzhw-FM9fwrcncwixqouQ,youtube#video,i4GKvPGoGxY,2025-12-08T15:01:31Z,UC5_6ZD6s8klmMu9TXEB_1IA,Feature Pyramid Networks - Explained!,"In this video, we take a look at Feature Pyramid Networks (FPN). What is it? How does it work? Why they are so useful in computer ...",https://i.ytimg.com/vi/i4GKvPGoGxY/default.jpg,120,90,https://i.ytimg.com/vi/i4GKvPGoGxY/mqdefault.jpg,320,180,https://i.ytimg.com/vi/i4GKvPGoGxY/hqdefault.jpg,480,360,CodeEmporium,none,2025-12-08T15:01:31Z
0,youtube#searchResult,2cqtjXqeR8bX8W4TlKEDbX4PuCc,youtube#video,nctdwJliOpQ,2023-01-31T09:09:20Z,UCEugr9SHEXmvG8bg6e3y_bw,Implicit Regularization in Quantum Tensor Networks,"Nadav Cohen, Tel Aviv University.",https://i.ytimg.com/vi/nctdwJliOpQ/default.jpg,120,90,https://i.ytimg.com/vi/nctdwJliOpQ/mqdefault.jpg,320,180,https://i.ytimg.com/vi/nctdwJliOpQ/hqdefault.jpg,480,360,Physics Meets ML,none,2023-01-31T09:09:20Z
1,youtube#searchResult,YTs017TiXV8-Ayndv9vgNxPIbh0,youtube#video,fhjNMnQkmK4,2023-01-08T16:20:26Z,UCEugr9SHEXmvG8bg6e3y_bw,Differentiable Programming in HEP,"Lukas Heinrich, TU Munich.",https://i.ytimg.com/vi/fhjNMnQkmK4/default.jpg,120,90,https://i.ytimg.com/vi/fhjNMnQkmK4/mqdefault.jpg,320,180,https://i.ytimg.com/vi/fhjNMnQkmK4/hqdefault.jpg,480,360,Physics Meets ML,none,2023-01-08T16:20:26Z
2,youtube#searchResult,zxnK1IKwh7ufKIDA0ICD7Qcy3Ek,youtube#video,JMNYR7Yf3wo,2022-11-19T17:09:53Z,UCEugr9SHEXmvG8bg6e3y_bw,Anomaly detection in the search for new physics,"Gregor Kasieczka, Hamburg University.",https://i.ytimg.com/vi/JMNYR7Yf3wo/default.jpg,120,90,https://i.ytimg.com/vi/JMNYR7Yf3wo/mqdefault.jpg,320,180,https://i.ytimg.com/vi/JMNYR7Yf3wo/hqdefault.jpg,480,360,Physics Meets ML,none,2022-11-19T17:09:53Z
3,youtube#searchResult,nCic2xD2si5wOKpoK7TcEVb9hD8,youtube#video,81o-Uiop5CA,2022-10-07T14:43:36Z,UCEugr9SHEXmvG8bg6e3y_bw,Maths with transformers,"François Charton, Meta AI.",https://i.ytimg.com/vi/81o-Uiop5CA/default.jpg,120,90,https://i.ytimg.com/vi/81o-Uiop5CA/mqdefault.jpg,320,180,https://i.ytimg.com/vi/81o-Uiop5CA/hqdefault.jpg,480,360,Physics Meets ML,none,2022-10-07T14:43:36Z
4,youtube#searchResult,fPWZQ0suUEPsYKY-xaX5aw1-ICQ,youtube#video,GMXxbmXapsw,2022-07-30T21:51:10Z,UCEugr9SHEXmvG8bg6e3y_bw,Explainable deep learning models for cosmological structure formation,"Luisa Lucie-Smith, Max Planck Institute for Astrophysics.",https://i.ytimg.com/vi/GMXxbmXapsw/default.jpg,120,90,https://i.ytimg.com/vi/GMXxbmXapsw/mqdefault.jpg,320,180,https://i.ytimg.com/vi/GMXxbmXapsw/hqdefault.jpg,480,360,Physics Meets ML,none,2022-07-30T21:51:10Z
0,youtube#searchResult,tz7ayqQn_MG_Ss5dujExiDIX8Ck,youtube#video,oMsm57Egpno,2025-07-23T16:42:37Z,UCQb7JgBXngKzI7YNB-KEZAA,snowmeth - AI novel-writing assistant,"a demonstration of snowmeth, my AI application for generating models https://github.com/joelgrus/snowmeth.",https://i.ytimg.com/vi/oMsm57Egpno/default.jpg,120,90,https://i.ytimg.com/vi/oMsm57Egpno/mqdefault.jpg,320,180,https://i.ytimg.com/vi/oMsm57Egpno/hqdefault.jpg,480,360,Joel Grus,none,2025-07-23T16:42:37Z
1,youtube#searchResult,oHBwEvjtPr2HBnrfF4ZPU-CWC7U,youtube#video,GfmJi8GHrYw,2025-05-30T13:07:53Z,UCQb7JgBXngKzI7YNB-KEZAA,Vibe Coding,,https://i.ytimg.com/vi/GfmJi8GHrYw/default.jpg,120,90,https://i.ytimg.com/vi/GfmJi8GHrYw/mqdefault.jpg,320,180,https://i.ytimg.com/vi/GfmJi8GHrYw/hqdefault.jpg,480,360,Joel Grus,none,2025-05-30T13:07:53Z
2,youtube#searchResult,CpLCk0FhjjlLSr60bfN6pqEnt2E,youtube#video,3oiEJiUM5Jw,2025-05-30T00:29:36Z,UCQb7JgBXngKzI7YNB-KEZAA,Vibe Coding,,https://i.ytimg.com/vi/3oiEJiUM5Jw/default.jpg,120,90,https://i.ytimg.com/vi/3oiEJiUM5Jw/mqdefault.jpg,320,180,https://i.ytimg.com/vi/3oiEJiUM5Jw/hqdefault.jpg,480,360,Joel Grus,none,2025-05-30T00:29:36Z
3,youtube#searchResult,YYM5cJr-t_BrDsPN1vmyrLTfM2Q,youtube#video,GJTx93rYsX4,2025-03-02T21:23:39Z,UCQb7JgBXngKzI7YNB-KEZAA,word ladder game using claude code (part 2),word ladder game using claude code probably watch at 2x this is me fixing bugs and trying to make improvements the 1B local ...,https://i.ytimg.com/vi/GJTx93rYsX4/default.jpg,120,90,https://i.ytimg.com/vi/GJTx93rYsX4/mqdefault.jpg,320,180,https://i.ytimg.com/vi/GJTx93rYsX4/hqdefault.jpg,480,360,Joel Grus,none,2025-03-02T21:23:39Z
4,youtube#searchResult,tYYtzjob37izX4P_PEQd6g_vkAs,youtube#video,7nLjHldVhF4,2025-03-02T19:45:37Z,UCQb7JgBXngKzI7YNB-KEZAA,word ladder game using claude code (part 1),word ladder game using claude code (probably better to watch at 2x speed) (this cost 51 cents worth of anthropic credits),https://i.ytimg.com/vi/7nLjHldVhF4/default.jpg,120,90,https://i.ytimg.com/vi/7nLjHldVhF4/mqdefault.jpg,320,180,https://i.ytimg.com/vi/7nLjHldVhF4/hqdefault.jpg,480,360,Joel Grus,none,2025-03-02T19:45:37Z
0,youtube#searchResult,LAiy33atcu3jXeAozOyXSL11_8Y,youtube#video,dYSw-SV_fsI,2022-10-12T13:29:33Z,UCuHZ1UYfHRqk3-5N5oc97Kw,Edouard Harris - New Research: Advanced AI may tend to seek power *by default*,"What does power seeking really mean? And does all this imply for the safety of future, general-purpose reasoning systems?",https://i.ytimg.com/vi/dYSw-SV_fsI/default.jpg,120,90,https://i.ytimg.com/vi/dYSw-SV_fsI/mqdefault.jpg,320,180,https://i.ytimg.com/vi/dYSw-SV_fsI/hqdefault.jpg,480,360,Towards Data Science,none,2022-10-12T13:29:33Z
1,youtube#searchResult,0aJ5IlGW84pigQAr1ahp77iWtKU,youtube#video,zQ84HXl_kDc,2022-10-05T15:25:49Z,UCuHZ1UYfHRqk3-5N5oc97Kw,Amber Teng - Building apps with a new generation of language models,"Joining Jeremie Harris this episode is Amber Teng, a data scientist and TDS author (and former editor!) who recently published a ...",https://i.ytimg.com/vi/zQ84HXl_kDc/default.jpg,120,90,https://i.ytimg.com/vi/zQ84HXl_kDc/mqdefault.jpg,320,180,https://i.ytimg.com/vi/zQ84HXl_kDc/hqdefault.jpg,480,360,Towards Data Science,none,2022-10-05T15:25:49Z
2,youtube#searchResult,0K24NY_kGYLagIb6r5OFLe1f6n0,youtube#video,J76h5loFn1I,2022-09-28T15:06:38Z,UCuHZ1UYfHRqk3-5N5oc97Kw,David Hirko - AI observability and data as a cybersecurity weakness,"David Hirko, co-founder of data observability company Zectonal, joined Jeremie Harris in discussing data observability, data as a ...",https://i.ytimg.com/vi/J76h5loFn1I/default.jpg,120,90,https://i.ytimg.com/vi/J76h5loFn1I/mqdefault.jpg,320,180,https://i.ytimg.com/vi/J76h5loFn1I/hqdefault.jpg,480,360,Towards Data Science,none,2022-09-28T15:06:38Z
